left,top,width,height,conf,text,page
1333.14,560.43,179.0,90.29,55.86,ACTRIZ DICE ©UIE y y ?32£$HERE a,1
1129.0,1523.2,626.4,303.6,58.8,N CANSE Dje [LAS JUEQ©AS,1
1490.88,2303.0,133.62,42.0,87.62,"CUENTA UE ALGUNOS CHICOS N PARA SALIR, PERO",1
1176.79,2486.14,80.71,60.71,46.64,E e ¡IXÁ13| ||Í 4>|1í| la la ;? ( —X] —X] SIN a E,1
2098.67,510.78,123.67,36.33,71.56,> r PRIMER MINISTRO ESP MANANA LA APROBACIÓN DELCONGRESO,1
366.5,794.75,132.12,41.62,75.38,<DECANO DEL COLEGIO MEDICO DE LIMA SOSTIENE QUE,10
545.6,868.0,138.2,42.4,80.0,MEDICAMENTO SALDRÁ EN UN MES,10
1199.33,158.33,88.17,23.67,89.0,DOMINGO 2 DE AGOSTO DEL 2020,10
1392.25,311.5,216.75,57.5,78.25,Advierte por de hospitalizaciones',10
1457.4,458.0,66.67,24.73,86.37,"G» Ante el incremento de contagios por Covid—19 en el país, el médico Elmer Huer— ta advirtió que, tras las alarmantes cifras, se avizor que vendrá una ”ola de hospitalizaciones”.",10
2088.08,485.69,81.46,24.77,90.46,"carte y salgan más personas infectadas. Esto podría provocar una ola de hospitalizaciones”,",10
502.0,920.86,116.0,39.14,90.71,Y HABRÁ DURA COMPETENCIA EN EL MUNDO,10
405.78,1840.43,109.22,25.25,76.82,"linfectólogo y decano del Colegio Médi— codeLima, Juan Astuvilca,calificóco— mouna noticia esperanza dora para el mundo el avance de dos vacunas contra el Covid—19en Rusia, además de anun.— ci arse que en un mes comenzari a su produc— ción industrial. La vice primera ministra rusa, Tatiana Góliko— va, informó que los dos medicamentos, creados por investigadores y miembros del Ministerio de Defensa dedico país, son muy prometedo— res' y en se tie m bre iniciar ia su producción.",10
747.2,2062.2,100.2,38.8,90.3,que la declaren bien público universal para que sea gratuita,10
328.25,2158.75,63.12,29.5,45.75,e 0 233 53) 0 3 S [J*[Ma'“lUll1(olr,10
572.57,2459.64,55.57,26.57,37.57,(t S oo BO 2 eo d es 2 Kesia ((Poctanvs]] pre se ¡pieote,10
1106.73,2425.91,24.55,28.18,37.18,id e l of d asael l a n a emi,10
1472.12,618.35,66.71,22.71,89.41,”La situación es notoriamente peor respecto a la sema— na pasada. Es una mala noticia que estemos,10
1687.41,1175.09,98.76,27.87,76.73,"”Esuna gran noticia que en los paísespotencias esténenetapasavanzadas en la creación de la medicina”,indicó. Además, dijo: ”Temo que, por laseleccio— nes del próximo año, se pierda el objetivo (detraercuanto antesala vacuna). El Gobierno yel Comando Vacuna ya de— ben estar trabajando para cumplir la meta, porque habrá altademanda, así sea con la producida en Rusia o la de Oxford”, acotó. Consideró queen fármaco llegaría al país en marzo y el Gobierno deberá priori— zara las familias vulnerables. ”La vacu— na deberá llegar y ser declara da un bien público universal para que sea gratuita”, manifestó. CIFRAS El Ministerio Salud (Minsa)informó la ma.— drogada de ayer que cifra oficial de fallecidos porel Covid—19el viernes fue de 19 mil217a ni— vel nacional. Además, el Minsaindicóquehay 414mil735contagiados. A la fecha, detienen 13 mil 577 pacientes hospitalizados,deloscuales mil 414 reencuentran con ventilación mecánica. (Jimmy Hernández) *]",10
1715.55,1891.29,83.35,25.02,86.65,O_El Ministerio de Transportes informó que solos viajes interprovincial terrestres y aéreos quedarán suspendidos a par— tir de mañana lunes en las regiones que retornaron a la cuarentena focalizada. O_Hoy se desarrollará la cruzada o” solidaria Oxigenotón en Huanca— yo para adquirir plantas de oxígeno medicinal para los pacientes con Covid—19.,10
1385.5,2299.75,128.0,50.25,66.5,a trámite para bono,10
1514.5,2509.5,78.0,25.5,91.75,procedimiento de pago del,10
1631.5,2465.79,57.5,23.93,86.43,"Desde ayer, el Ministe— rio de Trabajo inició el Para acceder a este benefi—",10
1830.5,2508.0,82.5,24.75,91.0,"cio, los interesados deberán",10
1651.05,2572.77,80.36,24.41,91.0,"nuevo bono de 760 soles contar con una resolución para los trabajadores con probatoria de suspensión suspensión perfecta. perfecta de labores, expre—",10
2137.38,616.08,67.92,24.5,87.04,"En tanto, el integrante del grupo Prospecti— va del Ministerio de Salud, César Cárcamo, estimó que cada día fallecen unas 900 personas por Covid—19. [JHV]) [+]",10
2253.0,858.4,200.6,42.8,80.0,INVOCA mascarilla cuando visiten afamillares',10
2217.11,1359.44,65.56,25.67,71.44,"EE e oe Salud [Minsa), César Munayco, informó que",10
2231.71,1489.0,73.29,24.71,71.57,oe el go de contagio de CESAR coronavirus si se pro— MÓNACO p e,10
2264.49,1812.17,68.3,24.12,90.08,"familiares o de amigos que no usen mascarillas ni respeten el distancimiento social”. Preciso que se registran bro— tes de contagio en familias que se visitaron entre ellas y bajaron la guardia. ”Ahora el uso de la mascarilla es universal. Hay que usarla en todo momento”, acotó. Mónaco insistió en que, además, se respete el distan— cimiento social, usar protector facial en el transporte públi— co, evitar las aglomeraciones y lavarse las manos con agua y jabón.",10
2301.27,2393.16,62.98,23.59,91.02,"sa o no, emitida por la Autoridad Admi— ni strati va de Trabajo. Además, deberán prestar servicios en una empresa con no más de 100 cola— boradores, percibir un sueldo mensual hasta de 2 mil 400 soles no haber sido bene— vicario de otro bono, ni los integrantes de su familia.",10
183.5,1654.67,176.5,58.67,78.5,Aconsejan hablar cada día sobre (,11
265.0,1938.4,71.32,25.2,88.64,"Tras el aumento de problemas de salud mental por la pandemia, el psicólogo y psicotera— puta Manuel Saravia, del Instituto Gestalt de Lima, ANTES QUE",11
156.25,2235.75,261.75,57.75,86.25,Peruanos prefieren comprar televisores,11
295.14,2490.91,73.36,23.91,88.36,"Pese a estar en ple— na pandemia, los peruanos prefieren com— par televisores antes que refrigeradoras, según un reciente estudio de Grade.",11
645.83,1980.67,75.42,23.67,90.33,aconsejó hablar diariamen— te sobre nuestros miedos y emociones en el hogar,11
631.33,2463.83,54.25,27.17,74.17,E i dador principal de la e ne en los hogares con,11
1343.67,160.33,92.67,23.67,89.83,DOMINGO 2 DE AGOSTO DEL 2020,11
1191.85,1047.11,115.15,28.86,77.61,"Sres la engreída del Zoológico Hachita donde posa como modelo, sonríe y aplaude ese aquel a nueva realidad impues— ta por la pandemia ahorapo— canceló su presen— — dránverlos taciónespecial”Aventura — másdecerca, simpáticoslo— — conocersusca— bitos de mar Nayra'y Ti— — racterísticasfísicas, tán' siguen deleitando — cómosealimentanyhas— el Zoológico Hachita. tatomarsefotossicoinci— Incluso, el públicoaho— deacon interacción de ra puede disfrutar de una _ cuidador DannyRaba— experienciamáscercana _ nal”,.comentóPilar Marti— conestoscuriososejem— nez, defade Prensadelre— plares. cinto. a Estoslobitos de mar se da einquieta. Nacióha— encuentran un mira— cenueveañosen el zooló— — dorespecial, frecuenta gico y besos vo— lados, sonríe,posacomo modelo, saluda, sacala lengua yaplaude. ”Cumplimos conlasnor— mas sanitaria s es— establecidas porelGo— tierno yhemossuspen— dido las presentaciones que tenían en suaudito— rio cerrado todos los fines desemana. Sinembargo, durante unos 20 — ayuda especializada si minutos. hubiera situaciones que no Según Saravia, se pueden manejar. se pueden hacer — ”Cada vez se observan más preguntas bási— casos de personas que no",11
1128.35,1878.58,60.65,23.1,84.94,cas [¿cómo te sientes? y ¿cómo a emitir que las personas lleven a cabo una catar— e ee problemas. El objetivo es conocer cómo están nues— tros seres queridos y buscar,11
1077.28,2344.28,59.81,23.72,89.31,"visores, mientras que en los de jefatura femenina predominan otro tipo de aparatos, como lavadoras de ropa, planchas y coci— nas. Según otro estudio, basado en los acti— vos del sector pobre aumentó la tenencia de cocinas a qas, licuado— ras y televisores a color. Este último de 45.8 % en el 2004 al 78 % en [<]",11
1467.44,1854.74,72.28,25.26,86.85,"pueden dormir, tienen pro— lemas de apetito, falta de energía, cansancio, pro— lemas de concentración y hasta ideas suicidas. Es necesario promover una campaña de salud mental que involucre a todos los niveles del gobierno”, indi— a n )|",11
1564.25,2098.0,100.75,22.0,78.25,&TERMINARON EN EL PISO,11
1580.57,2169.43,180.57,59.14,90.29,Pistoleros asaltan agente bancario y los capturan,11
1492.11,2595.11,48.11,23.11,92.78,"A balazos, la Policía frustró el asalto a un",11
2078.79,817.71,69.54,23.57,86.82,+En las interacciones eventuales podrá observarse por las mañanas a la lobita 'Nayra' y por las tardes a Titán'. +Las entradas pueden comprarse de manera online o en,11
2023.24,907.06,62.88,24.59,86.12,la misma boletería del zoológico. _+No se permite el ingreso de menores de 14 años ni mayo—,11
2017.8,949.2,62.4,24.4,88.5,"res de 65, por disposición del Gobierno debido al virus.",11
2037.64,1216.05,141.56,35.15,73.87,"roba los gellañosyfugerescala—_al oportun equipo especie aP|BUSOS de deFauna, con el apoyo Serfor, haceochoaños, visitantes a| lado , — cuando lo encontraron de su pareja TItáN' — maltratado junto a unos perrosenlascercanías con un ambiente amplio — delCastillodeChancay. y abierto para observar— Recuperación fuedi— los asígarantizar eldis— — ficil, perolograronreha— tan ci amiento social. visitarlo yen pocotiem— RESCATADO poseconvirtióen laestre— Elimponentemacho Ti— — lladelaexhibición.(Sonia Nayra'tie— — Obregón)",11
1861.5,1872.67,50.17,24.0,37.0,Intercitonnter 5 a eo Bs na,11
2312.33,1824.89,54.78,24.89,60.56,el 201 No la (GoxitiH9 smell a OF ie,11
2262.11,2205.57,51.7,24.7,87.11,"de la banda 'Los Malditos de Luya!, cayeron en pleno atra— co a 'Lia Farmal”, en San José de Lomas. Se les halló la pistola con la que Toby' disparó al techo para obligar al dueño del",11
1879.67,2290.44,61.44,25.78,90.78,agente de banco y cap— tiró a tres delincuentes,11
2078.58,2454.96,60.42,24.88,84.52,"que iban a robar cin— negocio a entregar el dinero. co mil soles, en Los ladrones estaban en Carabay!llo. ta Piero Cama El propietario y los Perdono (21), vecinos pidieron Hans que los dete— Lima Acusa nidos no sean (18), Toby', y el liberados. (E. menorJ.M.S. (17), Cirilo)",11
188.6,356.4,153.4,54.0,89.0,Sean Penn secas con chabola,12
233.69,651.17,60.86,26.21,76.1,"G» La estrella de Hollywood, Sean Penn (59), se casó con la actriz Leila George [28), quien a ue la nia secreta, según Medavoy, quien los ME E st",12
659.46,298.77,68.08,24.85,88.23,"Además, el actor Josh Bro— lin publicó un mensaje: ”Feliz boda tortolitos. Nues—",12
1152.2,158.2,90.4,23.8,72.6,DOMINGO 2 DE AGOST”” DF',12
1547.65,742.59,74.6,28.39,75.87,"tros saludos a un hermoso U[“ A i ese | Ú] | a e o” del actor Vin— ell <'D Candice Myhre, una doctora que cent D'Onofrio, trabaja en Hawai [Estados Unidos), solo un año compartió fotografías en las que se mayor que en es la ve en bikini, mientras atiende a un paciente en la sala de emergencias. esposo. e e ppi tib rez s La razón de esto es que busca sentar a Ios s un precedente en contra de un estuvo casa— estudio, que ella tacha de sexista, el do antes con pl es spuo» cual califica de profesionales' a los Madonna y la At a i a cirujanos vasculares que comparten actriz Robin e ] ( © — en sus redes sociales contenido con 'vestimenta o inapropiada”. ..... e P oe i ese '¡Á“Xle4l|'qll.od os eo “wxa/¡¡ux |3 i y E J l t ee EN CONCIERTO POR FACEBOOK nacidos músicos perua— la Te nosrealizarán un concierto virtual solid ario desde sus Solas personas que deseen hogares conelfinderecau— ayudar pueden hacer— dar fondos para el cant ante Erick— lo donando a la cuenta BCP de",12
949.0,1904.0,81.0,25.2,90.0,EL COBARDE ATAQUE FUE GRABADO,12
1476.7,1240.4,149.2,28.0,65.5,"son García Amasifuén(28), quien fue bale ado por delincuentes el domingo19dejulio,en San Mar— tíndePorres.",12
1480.17,1409.83,113.92,29.67,72.08,"porun hampón quebajóde una mototaxi, paraarrebatarlesuce— lugar y un parlante, cuando sedi—",12
2001.67,1206.67,61.67,21.17,77.33,". Max García, hermano de Erick—",12
2025.0,1402.4,83.0,30.8,76.8,'vidaen el Hospital Daniel Alci—,12
1840.79,1680.3,148.73,32.32,69.27,"rigíaacantarenuna serenata. podidoextraerlelabala. ”QueremosayudaraErickson GRAVESDANOS quees unjoven padre de familia y ”Hasufrido daños en el pul— hasidovicti— man y columna, pedimosjus— madelainse— tibia y que second enea los guridadciu— delincuentes. puedeque— dadana.Los darparalítico”,remarcó. artistaspe— El concierto virtual seráestevier— rumanos de— nes agosto vía Facebook des— be mos estar delas2delatarde. Además de unidos”,indi— Andrade,estarán AnaKo— cóelcantan— hiler, Willy Noriega, Briyit'La dejulio An— muchos más. drade. (JimmyHernández)",12
1640.36,1947.55,100.91,37.91,84.0,Joven artista fue atacado por delincuentes y lucha por su vida,12
228.0,2392.75,57.12,23.25,42.75,os ta ox no peppin caladita ewell [Al,12
1108.89,2403.21,58.16,25.05,41.21,"]]I(uln[o…'» |L1u|nf.. |o¡v&slm(u: t ta Eií, os lintie a es zt toss lever IRIS Sis a el (ioxc:mu<xu—— námdiao y s ee l",12
720.78,2504.44,54.11,22.22,53.22,"ra|[tl[""lfl[0h a es Iko| os sls [cxutoln(o)nnlm»1, |ur m)",12
1537.0,2044.0,98.75,25.0,90.75,DEJAN GRAVE A PASAJERO,12
1466.83,2119.83,139.17,47.17,84.17,Asesinan a barrita en su cotopaxi,12
1689.75,2243.5,58.0,27.5,81.0,G» Sicarios en moto,12
1672.8,2322.4,55.8,26.9,85.4,"los a un joven de 27 Muflh£%m años, que trabajaba",12
1544.14,2414.86,74.86,24.57,83.57,"dejaron gravemente herido a su pasajero, VO",12
1580.29,2475.71,70.29,25.43,90.86,"Daniel Ballarta, que según sus amigos sería",12
1564.36,2525.36,65.86,24.21,88.5,"fundador de la barra 'Los Alianzistas MB”, murió dentro del vehículo NG—13185, en la",12
1548.4,2576.0,100.8,25.2,88.0,avenida Mateo Pumacahua. Jorge Gonzales,12
1530.0,2609.43,56.43,23.14,85.57,recibió un balazo en el rostro. Yucra),12
2111.81,2343.48,78.05,27.29,88.7,"BENAVIDES Congreso interesará a ministro de Educación €? Por 94 votos a favor, 15 en contra y 15 abstenciones, el Pleno del Con— greso, en sesión virtual, acordó interpolar al ministro de Educación, Martín Benavides. en — Es por el papel que tuvo en el pro— ceso de licenciamiento de dos universidades, cuando Benavides era miembro de la Superinten— decia Nacional de Educación",12
2029.0,2590.5,101.75,29.75,74.0,Superior Universitaria (Sunedu). [<],12
210.25,1751.25,98.5,44.62,46.12,ff1_L€:j i£I' eto OV f1& J…J_C £C'1AI1UJ OF,14
2297.8,1349.88,191.92,53.68,52.24,"NEMEIR1IE©HBR©N gUWE$P¡]WA©IQ SEVOWMÓA /ÁÍGHT/A*RNYUNAX (“A' ung H, udo ev¡t ILILIE|NA|DEIBN¡BRGIAX Interage e ga e el SARESQUERNOS ©UNNII©1&ÍÍDIOb%?£[,?,fl /NWMMRILAX ee $©LEM%P'E'R©' IN… Q'AXI[|))EJ© [[|))E Irallateas",14
2332.0,1692.33,141.67,41.0,52.0,SERUN PIANO estara,14
2366.89,1883.11,116.47,52.16,47.63,PARA RS IFIUECHAS lg;;f¿g¿ |DET©UPIID© ( X eal oe …>-' ( SHABEQUE ea E a (©1…J]E SOLTERO (quee£té tr,14
2457.62,2422.88,90.5,35.0,49.5,(6 t Laffalta[d. — FOTOS:ALENGINO) e¡preo (QUINTANN s,14
2320.2,154.2,39.2,42.4,44.2,a xe el e e,15
93.13,1134.13,110.22,31.65,54.57,"b hay¿un*antes. ¿unldespues Jes lunam|sqgra[que l|nstala(eltlempo Vives pasado y [sola,y£su¡presente) ie E G ) e ""Laruta(delfamor.,1no | _uezsu:eonazófmyse:a d a el ¿|ones<tan(comun,(ella¡ ¡=su5ent¡m¡ento",15
43.71,1701.43,176.86,39.29,53.57,"permisos? [defáL'g]una'síde[e'lla'sms*i]pja's,'&lh¡ lantelalli!, r%nv.olv;enalnmtnam interés e i…puede_",15
125.75,2034.5,196.75,44.5,67.75,%l:1delhabenematudozem c0nralgu¡en eparmdo'desdeífebrero del,15
31.8,2418.4,183.2,29.6,60.6,¡respetoáel machismajúna' ermldel[lamaríla'atenc¡0n ' pafloque<sb_eecnba'em,15
473.82,1032.55,165.55,34.09,54.64,$Se.quennsu[tan(cuand(mel Is (esteomibiquieren. l!i|ine1un1hquuanbdeyarí'aquñ E ser Jard¡nera 1Am01las*plantas a o desarrdllasteeníla],15
486.16,1555.84,232.35,42.19,50.06,"Preparanqueques(denammafarroz tapado»ísuflede'alcach0fai. c¿Fqnqu&um1m¡;íenpuede]p:erdonañ p E De¡epenteporíla]manera[c0moífueron¡ (cnadas*lles*dueronlquesean&sumlsa5' G¡i'mo:sh¡hstalaelelúb& |mai_tí i ] ©uaáv¡eron[ensu1hogartal[padr (c0n]malas*palabrms'&ñlae5 isaquello; |perm|t|a I[Deph¡(losimnosílo.ven(como l (¿_Unaex:usa;para1nbsepara ) (cuandolelwaró'n%acóílcg ©uelloshuos*noywan'con]padres e a (guapayifamosa (zapatosíson'decemento ez4me;par$un]pol¡c¡a""Tuleres. e e 2 ea ¿Manejasautodelaro?",15
507.41,2313.24,182.24,42.41,48.0,"Losegundoxvoya1la'de(Ch E 0 (&qumav.ez¡al a r&mde.caaa'abn&gadao? E e o estoy,preocupada lp_onq 'malogrf5ím¡tsecad¿>mI d¡£shtecma1uneano;j¿bayaso Me'h'a'pa'sád01noíuenecesano ¿Porqué? l p0[|c¡a'lo¡par0,ydle¡puso.papeIeta",15
1022.5,1018.25,117.0,35.0,70.75,prote fa (¿_Un81loícurae ítlempqs*,15
977.44,1176.0,246.0,38.22,53.44,llr(desde miihagarhasta'Lurínacomprar S plantasw;apr0vecharpar©]pasear p0nla]playa e —*nanzaque¿tea'e'fdlam lA[t0manso|aítus*dec¡s¡ones Mndr&(&lmarofaegunqu&nose),15
993.27,1540.33,225.2,35.87,43.93,sci ee i ¿¿'Est5'ssañúar” llad(ma]m¡s'huosmpadree Setevemássonriente> e sl m|entounoíle¡p0nem&s ”punchetalavida. Unicuartedendillón.. Wueiv.olun[pc¡:oa&á's'&ou'éípas&g [Ia'eabeza'de_unMarqn]p'a'fa'£emhhbl” a edecuandose'acaba1laífaltalde,15
965.25,1793.0,255.0,38.75,51.5,Gl 'cac¡0nen1la]relac¡0n Hoytienesuniprogramadondeeres [unaesp:e:ne_dá(,15
1114.5,1899.75,139.38,32.25,48.75,lElamorlenecesitamasi dos ea (dacuandoent uentras*unatañnldad © ll at otra persona:,15
1304.95,2080.71,144.57,39.24,51.9,"¡Atoratedejam e M f elneá' es Ct1_3_m¡m ( ta' ustedes¡y,queítusilect0res r—:—| deste zsepanqueestamos*en1&atlna,(dellunes*a GJLAL=Ú£D,) es _ que l conozco parecesiempreacompañarcadafrase, p…,t¡r…| M Jc¡ír_-",15
1075.1,2347.5,198.2,36.6,55.5,"o mtenorisedesp¡de) (calmada¿agrade da4Estawezhablo*del £sentum¡entoquen eenel.corazon,yxal (que;otrawezha(dec |doentregañe…su¡ tuvo'el (todostosmalesz.",15
373.77,1539.59,66.52,23.77,88.08,"DEL SAQUE somos carnecita... HAY UN TECNICO sesenta y que se pone pantalones pitillos y rasgados, que escuela a los más chicos de su equi— po. Los encierra en el vestuario y habla fuerte para que escuchen: 'Hay muje— res para la joda y otras para llevarías al cine de la mano”. Clarito, directo y simple. Sabe diferenciar sentimien— to y placer. Corazón y presupuesto. Si les decía que el amor nace de un fle— chao y el flechao lo lanzó Cupido, los confundida con su ”floro”. Ojalá que los chamacos que se enamoran de Tombi— tas' y 'Chicas realidad' agarren esa flor. Rexuxa... HAY UN RUN RUN BRAVO que al que estuvo en Méxi— co, la ”rayería' lo ha investigado como 30 veces. Le han metido inteligen— cía financiera y no le han encontrado ni mela en sus cuentas. Quieren que ”pague ganso' por su viejo que tuvo roche por corrupción y está con arresto domiciliario. El lateral es emprendedor y su señora también gana sus bue— nos cobres en la tele. Ambos van por la línea correcta y son una familia decen— te. Molesten a esos que hacen pases de contenedores, roban, extorsionar y lavan su plata. Así es... ME PASAN LA VOZ que un delantero blanco y gran— dado tiene una pelea de gatos en la cabeza. Tanto así que lo dejaron mar— echarse libre de un balneario para no comerse un budín y ahorrarse escán— dalos. Su última payasada fue que dio positivo y salió a la calle como sí nada. No le interesó infectar a la gente. Ima— gino que varios han tenido que ir a pasar su prueba rápida y molecular. El pelucón, que lo ha recibido en el norte, ha dicho que lo va a marcar al centi— metro. Le doy un dato: tiene un video donde se le aprecia en el lobby de un telo con una bebita con sorpresa. Ya tiene un aviso en las páginas amarillas. Ayayayay... UN ABRAZO y un saludo especial para mi hermano Lucho Tri— sano, que es un guerrero luchando por su salud. Se contagió de coronavirus, estuvo en cuidados intensivos y, como los grandes, viene ganando la bata— lla escuchando tango y música clásica. Hay colegas y colegas. La 'Fiera' es cali— dos como amigo y periodista. Póngale fe, maestro. Agarrado de la mano de Dios, pronto lo veremos en la pantalla con su peculiar estilo. Se movía menos que un barco en la cancha, pero su zur— da era mágica. Según Ruckelly”, lo más bravo es ”robarle' un balón y sacarle un sencillo para una ”chancha'... Me voy, soy fuga.",16
894.25,791.0,107.25,45.25,64.75,a AMISTOSO QUE ALIANZA,16
1683.83,774.67,94.75,41.5,85.25,HABRA DESDE AHORA EN LA LIGA 1 EN ALO 1—1 CON MUNICIPAL,16
910.01,1330.96,76.97,26.36,81.14,"equipos llegando sepa— rados, tomas detem— peritura en laentra— da, jugadores usan— do mascarillas y suplentes dis— ancianos en la banca. No es la Bundesligani la SerieA. Es nuestra querida que hi— zo su primer en sayo miras al reinicio del torneo el viernes 7 de agosto.Alianza Li— ma y Municipaligualaron1—1 en una mis to so jug ado en Matu— te, sin público, siguiendo todo el protocolo establecido para quedaba 'luzverde' en el fút— bol y después de cinco meses devolvió a televisar partido.",16
908.2,2541.6,73.0,27.6,82.6,"tura. Ayer, Christian Ramos [1",16
1014.86,2230.86,92.0,25.14,84.43,ANOTÓ EN VALLEJO QUE VENCIO A CRISTAL,16
1057.42,2469.51,57.04,25.16,87.38,"G» El verdadero 'poeta' no 'mete letra”. El técni— co Roberto Mosquea volvió a recibir 'clase' de la César Vallejo, que venció 2—0 a Sporting Cristal en amistoso que se jugó en La Florida. En marzo, en su reestreno en la banca celeste, el DT tampoco pudo ganarle a los tr uji llanos (1—1) por la fecha 5 del Aper— F que lució el cabello pintado de rosado, y José Manzana [50') dieron el triunfo al cuadro de 'Chemo' del Solar.",16
1308.19,1334.16,82.87,26.78,74.06,"Elestadiovacío permitióes— cuchillos gritos deltécnico blanqui azul Mario Salas, quien quedó muy molesto con el jue— gode suequipo. ”Alexi son dos veces quete ganan la dair(Salazar] no la vuelvas ati— rar nunca más...¡Corran, re— gresen...!”, fueron algunosre— claros del DT. EljovenGonzalo Sánchez(56') adelantó aAlianza, peroMu— ni' igualó a los 91' con zurdazo de Masakatsu Sawa.La'Hie— na' Gómez vio la roja. Protoco— lo aprobado.Ahora iremos en serio. [+]",16
1810.5,1667.56,62.44,30.33,90.22,EL ÚLTIMO PARTIDO sin pub|¡co de Alianza en su estadio fue ante Cristal en setiembre del 2018. Se,16
1751.67,1752.94,76.44,28.94,87.5,GONZALO SANCHEZ lleva 14 partidos oficiales en Alianza y aún no ha convertido. GANARON 3—2 A SPORT BOYS,16
1605.21,2302.47,56.59,24.97,85.92,"Si hubiera sido un due— lo oficial, la *U! habría recuperado el punto que le descontarán por deudas. Lejos del frío de Lima, Universita— rio entró en calor en la sede de playa del colegio San Agustín y le ganó 3—2 a Sport Boys en su último partido de preparación previo a la L|ga 1. Los cremas anotaron gracias a Felino Quina (2”), Alejandro Hoh— berg (37') y Luis Chavez (71'). La *Misilera' descontó con Sebas— tán Penco (57) y Adrián Zela (81). Los reabrirán el torneo el viernes 7 de agos— to ante Cantora en el Estadio © — Nacional.",16
676.2,332.0,143.6,31.0,38.8,GELIRELAX Pd bo ea GEBICHIE,17
232.75,1270.0,66.5,23.5,91.0,EN TIRA Y AFLOJE,17
652.06,1121.05,76.98,26.2,79.86,".!B_uenosAlm.— / tin' cerrado. La venta dell ¡peruano Luis'Abram al Betistde: Españalhabría entrado en un) punto oscuro”.según argentino 'Sábado Vez. ”Hay molestia en el club por el manejo del i representante que; llo está ofreciendo a varios clu— Ibestíde Italia y México). Vez tiene toalla intención de ven— derlo”,.se dijo en el programa. Al DTiMauricioiPellegrini le Habrían comunicado que ya no cuente con el central, ¡porquello",17
1988.67,740.83,118.0,35.17,49.33,Salud 19 restodelplante!. tsuma ndose is tantos ten la o of,17
2079.6,544.4,139.6,44.8,59.2,(oútlee;gi_;z$hn'ito;yllacantha Ratlo&uerrero» 13 S,17
1861.5,1106.1,157.2,37.3,53.4,"súp:er©]la'_sjem'iñh'ál£se:em'fr_em'ta'ná)(cía's“i!squu:— tarte M ,¡RA'QL;'9ng'|JLERTRTERol€ieneiíóggailbsxeml&1m:añíido&ammm | tenma e _ nj,l|% Prueba",17
2107.0,1335.25,276.25,34.25,43.5,JJettersontFartánestágcontentoeniRusiayereo portallá” l E,17
325.4,816.8,108.73,37.2,79.47,y ARSENAL SE QUEDO CON TITULO AL VENCER 2—1ACHELSEAY _ _ . AUBAMEYANG SOLTO TROFEO,18
316.73,1167.85,74.21,24.65,76.02,"( la levantó. Pierre Emerick Aubameyang hizo lo que piso con la Copa FA, lue— go que Arsenal se adueñó deltí— tulo consu'doblete' al volte arle 2—1alChelsea. Ellos festejos, atacante gabo— nos dejó caerle históricotrofeo ante las sonrisas de sus compa— veros recordó lo hecho porlva— novia del Zenitesta temporada",18
1199.33,158.33,88.17,23.67,89.83,DOMINGO 2 DE AGOSTO DEL 2020,18
772.22,1141.26,76.32,25.3,80.64,"[Copade Rusia)y Sergio Ramos en 2011(Copadel Rey).La alegría del delantero, según la prensa, es que renovarla ponlos ”Gunners” con un sueldo de 280 milagros a lasemana. Aubameyanganotó a los 28', de penal, y alos 67 con una espec— tacularjugadadonde”rompió al central Rudiger pelo— ta al portero Caballero. Los adelantado alos",18
1207.62,1158.29,81.83,25.81,79.46,"5' con Christian Pulisic, el primer norteamericano en anotaron una finale Copa FA. Chelseaju— gócondiezhombres desde los 73' porun polémica expulsión del volante Mateo Kovacic. Arsenal llegóalátítulos enes— torneo —el cuarto en lastimas siete ediciones.— y es el más ga— nador potencia de Manchester United (12). Además, nunca per— dió una final ante Chelsea. [+]",18
