left,top,width,height,conf,text,page
1237.64,2315.24,74.9,24.26,90.47,"Presionó para que se nombrara como presidente de ese organismo a un magistrado allegado a su jefa Keiko M Cuando el hecho fue denunciado, la poderosa bancada fuji mori sta lo blindó. La investigación pasó al olvido y hasta hoy no es vista por este nuevo Congreso. Antes de llegar a ser congresista, Becerro era un desconocido en la política. Era químico farmacéutico y había sido decano del colegio de profesionales de esa especialidad en Trujillo. Pero su nombre sonaba con fuerza en el mundo violento del tráfico de terrenos. Tenía el cargo de jefe de seguridad de una empresa azucarera. Dirigía una gravilla de matones que, a punta de pistolas y cachiporras, despojada de sus terrenos, sin misericordia alguna, a humildes campesinos.",9
1988.14,433.5,148.64,43.93,89.93,"en peluquerías Es obligatorio el uso de mascarilla antes, durante y después del servicio",9
2078.8,863.2,65.6,26.8,69.0,Utiliza a Desinfección de calzado.,9
2023.0,1414.5,63.75,25.0,87.5,Respeta la distancia social.,9
2457.0,1280.0,33.4,62.0,56.6,Peluquera Mortal Infografías Dado Trome.,9
2026.29,2191.56,75.98,24.41,90.27,"¿Qué hacía el decano de un colegio profesional metido de jefe de una banda de delincuentes? Esa fue una pregunta que siempre se la quise hacer, pero nunca me concedió una entrevista. En una oportunidad, el poblado Freyre Prieto, quien fue echado y agredido de su propiedad, lo denunció. Becerro fue sentenciado a cinco años de prisión por usurpación agravada. Pero con el transcurso del tiempo logró ser absuelto por una sala superior. Era amigazo del presidente del CNM, Guido Aguila, vinculado a los 'Cuellos Blancos del Puerto'. Tal era su amistad que su conveniente fue contratada por ese organismo, que nombraba jueces y fiscales. El nombramiento de su pareja fue cuestionado porque no cumplía los requisitos de transparencia e idoneidad: su hijo —el hijastro de Becerro— había sido procesado y sentenciado por una millonaria estafa que perjudicaba a jubilados fallecidos. Nadie sabe cómo el muchacho salió en libertad al poco tiempo de ser detenido. Merecido final de un mal político que confundió el poder con la bravuconería y el aprovechamiento personal. Nos vemos el otro martes.",9
2051.0,2626.46,59.92,35.69,88.92,Los artículos firmados y/o de opinión son de exclusiva responsabilidad de sus autores.,9
