left,top,width,height,conf,text,page
694.86,137.57,86.29,38.0,50.86,a e — (facebookcomiitromepe fU“X 7 a,1
318.38,612.0,279.38,100.25,56.88,IRIECOM[ILIE)&IAN/Á)&IL I[HNWIIEIRWA P| QUIE IILAIIIE |Fn o.¡..- (C7TUIRE,1
975.2,1525.2,158.2,56.6,55.4,IE$PE!RN ER<LAILG IM o POSIBLE,1
1967.0,1939.0,51.83,34.5,65.33,TÚ T BE SI SON PAREJA,1
218.17,365.0,123.0,51.67,78.33,Valle o Muerte es un infierno,10
1190.17,158.5,86.5,23.5,91.17,MARTES 18 DE AGOSTO DEL 2020,10
680.35,460.82,59.35,24.89,88.79,"Gl G» La temperatura en el temido Valle de la Muerte, en Califormia, Esta— dos Unidos, alcanzó el último domingo los 54.4 grados Celsius, la más alta registrada en el planeta en los últimos 107 años. Los meteorólogos señala— ron que el récord anterior fue en el mismo lugar, el 10 de julio de 1913, cuando se",10
1512.0,524.0,33.5,31.0,40.25,en la 3 ss,10
1790.75,585.75,149.75,53.75,90.25,Entrenador de 53 mismo,10
2262.86,421.35,61.78,23.67,90.16,"los Países Bajos, asegu— ra que nunca se sometió a una cirugía estética, y gra— dias a su estilo de vida, las personas creen que tiene 30 años menos. Dijo que su secreto es evi— tar el azúcar, alimentos procesados, fritos, gaseo— sas, alcohol y drogas. Además, hace ejercicios",10
2263.25,636.0,62.25,26.5,90.5,"todos los días, ingiere",10
1513.75,870.66,67.87,26.75,84.08,"registró 56.6 grados. Ch|bo comida natural, frutas, Una ola de calor azota Cali— eles señores verduras, bebe mucha fornida y causó una rara ete €9 a agua y cuida su piel tormenta de verano que st dao, un con cremas. Y siempre lanzó un rayo, el que provo— entrenador per— tiene mentalidad posi— có varios incendios. sonar de 53 años, en tiva. antes dejaban T cimientos priorizar el trabajo M m fijo. Esto, por la incertidumbre …o co""…'dadf de qué pasará. Es la generación 1 que mejor se adapta al teletra— ante el erre o bajo, pero también se afecta empresas priorizar ]] por el desempleo y cierre de",10
384.5,1639.33,46.0,22.67,91.83,mios en la visión del tra—,10
1160.0,1260.67,88.17,27.33,82.67,SON 8 MILLONES EN EL PAÍS,10
755.88,1640.25,42.0,23.25,91.62,jo de 75% a 47% su interés por,10
833.5,1843.83,72.82,28.41,79.23,"bajo y las finanzas se están _ cambiar de empleo y aumentó su — ha estado el vincularse con Ps dando en los 'millennial”, inclinación por el ahorro, según sus espacios laborales por pre— |a bme3, or la crisis del coronavi— encuesta de Deleite 2020. ferir nuevas experiencias A rus. Esta 'Generación Y (nacidos — ”La realidad de los 'millennial' y aprender, pero por adaptan £ entre los años 1981y 1994) redu— — ha cambiado con la pande— ahora más que empren— a| tele trabajo 8 millones son millennial en Perú. | | y casi la mitad SEPA más Internet, redes sociales, Netflix, streaming, comercio electrónico. tá” … QUE: :* Alzan su voz por temas sociales, medioambientales, lucha contra violencia y racismo. ll lo ©DIUUU[:[G)M& E eo CESAR VILLANUEVA oÍf' “ : S = s [Cíoj FE A||anan Vglenc!as po U£0] a |(01'£01 i ) pago e comas",10
764.6,2236.4,34.6,25.8,40.8,pow querés a t ra,10
769.6,2511.2,27.6,23.2,32.4,ma i t a ii,10
1038.89,2423.11,38.33,26.89,39.56,a o a ese e a os est si blt e els,10
1662.43,2276.57,74.48,27.1,88.38,"€9 La Fiscalía allanó ayer diversas viviendas de personas que estarían invo— juradas en un presunto caso de corrupción, que implicaría",10
1629.0,2374.0,90.0,25.5,89.0,al exprimir César Villanueva.,10
1572.33,2495.07,73.43,24.53,89.97,"Sería por la recepción de pre— juntas coimas para la construcción de hospitales, cuando Villanueva era gobernador de San Martín (2007—2010). En una diligen— cia se detuvo al funcionario Juan",10
2230.92,1544.29,65.09,24.38,85.61,"empresas”, dijo Jorge Martínez, ll a cional, a Trome. Señaló que el promedio está en la 3' (alrededor de 30 años), en su mejor épo— ca productiva, con profesión o estudiando, multiconectados, con mucho acceso a informa— ción, casi la mitad casados o con pareja, pero con ingresos regulares a bajos. ESTILO DE VIDA ”Se preguntan cómo sos— tener su estándar devida: alimento, internet para su celu— lar, estudio (las matriculas han disminuido al no poder costear clases virtuales o por padres sin trabajo o que enferma— y están con más estrés y ansiedad porque solian salir, ir a reuniones o al gimnasio”. (Isabel E 5) y",10
2059.57,2104.86,115.0,50.0,88.86,Cúter lo embiste y le roban celular,10
2120.85,2414.42,63.07,25.03,87.18,"<9 Un motociclista venezo— lado quedó grave tras ser embestido por una Cúter de transporte público, en Chorti— llos. Por si fuera poco, el celular de la víctima voló varios metros y habría sido hurtado por algún transeúnte. El accidente fue cuando el extranjero, que no podía decir su nombre, iba por la avenida Hablas y fue colisio— nado por la unidad, de placa VIW—950, EM e",10
534.0,1674.44,179.89,44.44,60.89,PAOLO e eu ESTARÁ POR LO MENOS Sels E,11
1391.29,1132.27,76.58,26.44,79.79,"orto Alegre.— Silenció a la FIFA y al TAS, ahora Paolo Guerrero tiene otra batalla que librar. Un duro choque contra el marca dor derecho del Fluminense, IgorJuliao, le ocasionó una rotura en el ligament o anterior cruzado de su pierna derecha. Diagnóstico: operación inmediata y adiós a temporada 2020. En el duelo ante el Flu', el peruano fue duramente golpeado y dejala cancha en camilla a los 66' Le pusieron hielo en la rodilla y ayer pasó pruebas médicas que arrojaron el doloroso resultado. Tromeconversó con una fuente en la Videna, quien reveló que Guerrero no puede viajara Perú por ahora para operarse debido a la escasez devueltos internacionales. Eljugadory el Internacional de Porto Alegre estánviendo opciones enel mismo Brasil (Sao Paulo), Argentina Europa (Barcelona) para la intervención quirúrgica. El cuadro”Colorado' lanzó a la búsqueda del reemplazante del Depredador que se perderá el arranque de las Eliminatorias, en octubre, y el reinicio la Copa Libertadores en setiembre.",11
946.81,2291.33,70.38,23.62,91.71,"Asunción.— Tras la postergación de la fecha FIFA en setiembre, la Conmebol tendría una reunión esta semana con los presidentes de",11
900.91,2372.85,70.38,24.74,86.44,"las 10 Generaciones y decidir si las Eliminatorias arrancan o no en octu— bre, Según medios internacionales, Perú (dada la lesión de Guerrero) y Argentina (con torneo aún sin comenzar] propondría que se posterquen,",11
931.64,2475.82,75.82,23.64,91.82,"concentraciones y amistosos, y esto sería un indicativo. El diario brasileño",11
830.75,2444.17,74.33,28.17,88.5,TU mientras Brasil sería el lado opuesto. Colombia y Chile cancelaron sus,11
914.29,2547.11,64.37,25.0,87.34,"”Lance' señaló que de suspenderse la competencia, el formato de todos contra todos' cambiaría a dos grupos de 5 equipos. Los clasificados al Mundial serían los 2 primeros de cada serie y los dos terceros jugarían por [<]",11
2149.18,520.27,89.27,33.0,86.18,"Fuerza Guerrero, la torcida colorada' está contigo” INTER DE PORTO ALEGRE",11
2154.55,655.55,77.18,31.0,85.64,"Volverás más fuerte que nunca, hermano. Una prueba más que nos",11
2112.25,715.5,42.75,24.0,88.25,pone la vida” y,11
2174.36,833.27,85.73,32.18,89.82,Fuerza Guerrero. Autor de tres goles en la Libertadores 2020” CONMEBOL,11
2148.33,991.44,103.22,30.11,87.0,"¡Mucha fuerza y pronta recuperación, goleador!” y SELECCIÓN PERUANA",11
2162.83,1186.0,74.17,32.83,86.92,PAOLO GUERRERO sumaba 10 oles y 2 asistencias en este 2020 con,11
2140.3,1487.53,79.43,29.53,75.23,"Viena ¿ dio negativo en la prueba de Covid—19, desde mañana empezará a i 15 LESIONES DE PAOLO ©Abril 2017: ©Octubre 2009: Dolencia muscular s e e cruzado ©Mayo 2011: (194 días de para) Rotura del ligamento EE EE $SE LE REEMPLAZARÁ LIGAMENTO ROTO POR UNO NUEVO",11
2160.84,2435.37,65.38,24.45,89.86,"En la Videna, el doctor Julio Segura, médico de la Blanquirroja, recibió la resonancia magnética que se le practicó a Paolo Guerrero en Brasil y dio su diágnostico. ”Lamentablemente se ha roto el ligamento y tiene que hacerse una cirugía, se reemplaza el roto por uno nuevo. Se hace con injertos, tejidos y tendones de sus rodillas, se colocan dentro y se fijan. La recuperación mínima es de seis meses”, detalló el galeno.",11
1414.57,2018.57,282.14,49.86,59.0,Mess¡ Ihabna“'comun¡cado¿a“ésusxcompanerosfdelllBarcelena IBotaronta Quique' Estén ronald Cokeman,12
1555.06,2156.63,148.69,39.17,55.06,"m (arcelona.-$5ljpensabfa trformn©lagcadena ESPN.. — v A IEImedlotanad'”1ques¡b¡en1lacláusula ll¿ajprim'er©íf…í1era'délarit&ar¡la'sfélecjc—'ímniejs, Ala / | ) MGS>SIMGCIdeQM ,.querec¡b1618arcelona e oe ie ne EL'XVOLANTE 'operad0 hotel — (tenemos que l bu si car <(a[manosfdel[Bayem |m|||ones&deeuros (e|oargentmozse¡naLpor EE salud de|actual¡tecnlco““©u¡que ax…Do¡r(my Ítendon1rotu lano: ¡nombre.al",12
1263.31,2264.0,198.5,39.12,54.88,"|Mun|cherauna luna'eant1dadmucho]mener¡par©que,la .ser(elentrenader(del¡pnmer (de¡su¡r0d¡ a et rs l|nstltuc10nque,lo'desee¡pueda'eancelar quipo r2'3r]|p 4»S€f'€'| $—A—MM'ELIET©Q'IEMI /vxene¡otr© peer(Lhenell 3y(as¡dejar(dmem*al(cIub[quello'albergo> l",12
2024.25,2305.75,154.5,42.25,69.25,tres meses(de (DEL! canGrau(d|rectmr(general(dell,12
1530.57,2480.43,114.78,37.16,56.96,"ooo ell |do¡crec¡endo,y ¡paralficharía $SEGUN EL'XVOLANTE escuela!l e o Ko>eman /Arthur ¡que — rs a — ]ugad0f' E comunicóasuditeulomástercanoque la E (dejluvén (agreswoaque]no¡se — e ue e p20' ¡v'go|por nnad¡e wienedelvestuario. lMess¡…estamuy, /Ayense'real¡zomna Junta llosífranceses*Laurent¡8lanc(o)Th|erry fas E ea falcoh0lem¡a (€NHUE&HE… (enfadadqwles'd¡¡o — el italiane:MassimilianoWilegriy la LIPO RITERO: — i manejando su",12
1380.33,2593.0,330.5,46.67,54.0,"(enelcamannrque,qu¡ere¡rse,(de¡anel IBart0meu,y'loídmgentes'm'assy.despues. (exleyendáblaugrana*)('awHernandezf] 1Ter$tegensera Ferrahi. ||.MRR$|EZE",12
21.75,2441.0,99.5,29.5,78.0,"lichels, trepadores asan con",13
49.0,2582.4,61.8,32.0,90.8,ASESOR DE A DEL CLUB,13
462.65,1536.19,74.46,24.22,88.96,"DEL SAQUE somos carnecita... LAMENTABLE LA LESIÓN DE PAQOLO. Justo cuando estaba en racha goleador en Brasil. Una rotura de ligamentos cruzado anterior, a sus 36 años, le costará para recuperarse. En enero de 2014, el colombiano Madame Falco sufrió la misma dolencia, tenía 28 años, tardó seis meses en volver, pero igual quedó fuera del Mundial de Brasil, pues no llegó a estar bien futbolísticamente para esa fecha. Ojalá que el Depredador' tenga más suerte y haga el mejor tratamiento postoperatorio, la lo necesita al cien por ciento, porque la firme que en la actualidad no veo a ningún '9' como su reemplazante en la selección. Así es... EL MÁS CABEZÓN CON LA NOTICIA ES EL TIGRE”. Mira a los que vienen detrás de Guerrero y se debe estar jalando la peluca. Las piernitas de Ruidito son un brazo del belga Lukaku, mojado llega a 60 kilos y con la bicolor tiene una deuda sin saldar. La dribla y es rápido, pero no tiene mucho gol y desde que se fue a jugar con camellos su juego dejó de tener curva ascendente. La viene de alternar en dos partidos, tras una para de un año por lesión y sin continuidad no está para chocar y desequilibrar. Detrás de ellos vienen *Z ancudito”, Succar, Culos y todos en una licuadora no llegan ni al 50 por ciento de lo que rinde Guerrero en la selección. Ayayayay... SI LAS ELIMINATORIAS arrancan en octubre, Areca tendría que alinear un equipo sin referente de ataque, tal como lo hizo cuando Paolo estuvo castigado, y rezar a todos los santos. Muchos dirán que aquella vez que jugamos sin *9' nos fue bien: los dos partidos con Nueva Zelanda, triunfos ante Croacia, Islandia y Escocia, y empate ante Suecia. Pero los demás jugadores estaban en alza, con continuidad, ritmo, había un equipo ensamblado. Ahora varios están sin jugar, haciendo pretemporada, algunos ni equipos tienen. Lo mejor que nos podría pasar es que la competencia se postergue hasta el próximo año, para que nos agarre completos. Si no, ni el TAS nos salva. Curuju... Me voy, soy fuga",13
1341.5,160.5,91.33,23.5,91.17,MARTES 18 DE AGOSTO DEL 2020,13
1005.78,833.82,87.7,26.05,72.5,"ússeldorf.— Alguien emet econ el le tocan los cuernos. Lactato Martínezfue una'bestia' en la cancha ybri— llegara que Interne Milán golee 5—0al ShakhtarDonetsk(Ucra— nial ycl asi fique a la final de la Europa League. Survival será Sevilla viernes 21. Pasóunadécada parque In— tervolvieraameterseaunade— función de un torneo europeo —elúltimo fuera Champions quelogróen 2010— y ayerLau— taro, de 22 años, abriólacuen— tade cabeza a los 19'y aumentó comun derechazo a los 74' El ar— genuino celebró por partidado— ble la próximallegada desuhi— jo. También hijoung asistencia real gol de Romeu Luau Fa 78'), que aumentó alos italiano Danilo corta goleada (64). Con suactuación, Lactato al— lanzó los 21golesenlatempo— ] a e st na, ZenLi— gadeEuropa.Además, rom— pióunaracha dedie años sin queunargenuino anoten se— finales den certamen eu—",13
1033.2,1369.6,69.6,30.8,81.0,ropeo. Último fue Diego Malito,13
1833.42,505.79,86.21,37.46,90.67,"Argentino Lactato Martínez brilló con doblete y llevó al Inter de Milán a la final de Europa League, tras el 5—0 al Shakha Donetsk",13
1886.03,1299.47,66.14,32.76,80.69,"La final es un partido ROMEJ%JKAKU llegó a 10 — fue en 1998 I¡Ílar'udos seguidos anotando en EL EXTREMO David Silva, llevarnos la Copa” a que arregló con Real Sociedad, LACTATO MARTÍNEZ, INTER DE MILÁN ju Á hará su tendrá una estatua en el estadio DELANTERO DE INTER _ no final de Copa UEFA/Liga de __ de Manchester City.",13
1859.43,1404.29,48.43,27.14,91.14,"Europa, la última vez que la ganó",13
1739.57,1478.0,99.0,22.0,83.57,BUSCA HACER HISTORIA CON PSG EN CHAMPION,13
1973.43,1737.38,67.17,25.27,88.6,"Lisboa.— Hace 5 años, Keymar metió al Barcelona a una final de Champions anotando tres goles al Bayem. Hoy buscará repetir el pla— to y devorarse a otro cuadro alemán, cuando PSG choque con Leipzig (2 p.m./Fox Sports/Espn 2. El brasileño desea hacer historia y llevar al cuadro francés a disputar por primera vez la 'Orejona”. Será un duelo de entrenadores alemanes entre el alumno, Julian Nagelsmann (33), ¡ antiguo maestro, Thomas Muchel del PSG [46] En los galos reaparecerá Ángel Di María y Kalian Mbappé, pero perderán por lesión muscular al portero Kaylor Navas.",13
1067.66,2499.34,69.68,25.63,87.59,":“'> La selección de Bolivia inició ayer su concentración, en Santa Cruz con miras a los duelos con Brasil [9IIOÍ y Argentina (13/10). Los 32 convocados pasaron pruebas moleculares junto al DT Casar Harías y desde mañana empezarán con los entrenamientos.",13
1615.19,2509.05,71.68,24.92,88.92,":“'> AC Milan presentó su nueva camiseta alterna, con estilo fashion, teniendo a Latan Ibrahimovic como principal modelo. El sueco podría tener como acompañante en ataque a Diego Costa, quien habría decidido dejar al Atlético de Madrid.",13
2192.24,2511.51,68.14,23.41,87.95,"Mientras espera su libertad en Asunción, Ronaldinho recibió de regalo unas botas personalizadas hechas por una artista paraguaya. ”Todos tenemos un idolo de la infancia que con su magia nos hizo amar el fútbol”, dijo la creadora.",13
300.68,1051.54,86.92,26.89,78.19,"[ Porfavorquédeseencasa! Nadade'banderazos' o aglo— Bmeración. Sereiniciala Legal después de 10 días y el parti— demás atractivo lo protagoniza— rán SportBoysy SportingCristal en el estadio Nacional a lal:15de latarde. Los encuentros de hoy son parte de la suspend ida fecha 7 delAper— tura, nosepodrá asistir los alre— demores de donde juegue y los protagonistas deberánvelar porel cumplimiento del protocolodese— seguridad para no arriesgaría po— siblecancelación del torneo.Es— reencuentro será también la pri— mera'prueba de fuego' palaver si campaña de concientización al hincha surtióefecto. En la cancha habrá duelo de go— leadores, entre el rosa do Sebas— tán Penco y el celeste Emanuel Herrera. El primero acumular tantos, mientras el piense ape— nas marcódos. Los chalecos presentarán un on— ce con algunas bajas porlos con— agios de tres jugadores quedan a sertitulares. En equipo de Ro— bert Mosquera, la principalno— vedad será la vuelta aparco de Pa— tricioAlvarez, además del debut del volante venezolano Jhon Mar— chán.",14
296.4,1756.8,114.1,30.4,80.7,RESCATANDO AL SOLDADO SEXO E / PARA QUE SEA TITULAR,14
500.19,2108.54,51.54,23.68,86.84,"€$ Psicología aplicada. A sus 43 años, y cerca al retiro, Leao Botón tenía dudas si iba o no a ser titular con el entrenador Mario Salas. El asunto se habría aclarado con una charla entre el",14
468.31,2229.52,54.88,24.12,89.23,"veterano arquero y el 'Comandante” ”Usted no debe presionar— se con la idea de retirarse, solo piense en dejar el fútbo! cuando no tenga ganas de entrenar y ese no es su caso, porque lo veo trabajar y parece un juvenil”, le habría dicho el DT. Ahora, Leao",14
311.17,2309.33,56.0,24.67,90.33,pensaría en jugar otro año más.,14
1190.0,158.5,86.67,23.5,91.17,MARTES 18 DE AGOSTO DEL 2020,14
1048.6,1694.8,54.6,28.6,73.2,a G» rar. Máquinas del,14
1041.54,2035.49,65.84,24.0,89.33,"gimnasio oxidadas, ves— varios sucios, grass demasiado crecido y canchas en pésimo esta— do. Un completo caos encontró el técnico Comienzo en su visita a Campo Mar. El argenti— no quedó muy molesto y le pidió a la adminis— traidora mejorar cuanto antes las instalaciones para volver a trabajar allí. De otro lado, el delante— ro Jonathan Dos Santos se encuentra totalmente recuperado de su opera— ción a la rodilla.",14
1369.8,2174.0,112.0,24.4,86.4,ENCONTRÓ SEDE EN PESIMO ESTADO,14
1357.75,2264.0,151.0,48.0,85.5,CAMPO MAR DE LAGRIMAS,14
2221.0,264.67,93.67,39.17,80.17,"LIGA 1 SE REINICIA, POSTBOYS Y",14
2236.0,410.93,78.53,30.4,73.6,CRISTALANIMAN El ”CLASICO” DE LA FECHA Y LOS . a N a ALENTAR SOLO DESDE,14
2278.53,726.5,58.8,34.0,86.13,"DESDE que ascendió en 2017, Sport Boys no le ha podido ganar a Cnsta] El derrotas g u EN LOS partidos se podrán hacer 5 cambios repartidos en tres tandas.",14
2235.58,951.58,58.0,29.67,76.42,"No tenemos ninguna baja, va a depender del trabajo E e a",14
2265.73,1154.67,78.4,27.73,86.4,"Cristal es un equipo dinámi— co, hay que estar atentos” SEBASTIÁN PENCO DELANTERO SPORT BOYS",14
2197.2,1556.8,97.6,24.8,89.0,NACIONAL San Martín vs. Municipal,14
2074.62,2207.36,62.74,24.94,89.56,"G» Horas vitales. Según el diario de Argentina, el extre— mo peruano Muriel Peli le dará hoy una respuesta final a Racing Club. La 'Academia” pretende el pase del futbolista de 18 años que juega en Cantolao. Gisella Mandriotti, presiden— ta del club espera convencer a Peli y su empresario,",14
1891.2,2310.4,70.8,25.2,90.0,que pretende llevarlo a Europa.,14
382.27,2559.27,67.36,27.09,89.55,cambió al casarse con Natalie y ahora cree en la fidelidad,15
706.6,189.2,121.4,62.6,37.4,o o et iii e,15
1457.75,169.5,93.75,47.75,44.75,STICK A ROTOS QU,15
1639.8,1008.2,60.6,23.8,54.9,"0 melo de A, le en ds lñ(wr=í(:.(u¿ IF x¿pbeh'”",15
672.5,847.5,87.25,68.5,41.0,v_'_y'- a OF rp,15
1531.0,1255.76,75.18,25.41,54.65,"(7'H'Íll'lgr—i—í*'lfv7ll. S 1u>1u|nmu'1(omu¡o' w|11ualu¡oma(c: en N |u)h];o]“,, 2 m;;.. no dejo ee Isto mal * de 4",15
1635.92,1468.46,50.46,24.0,45.31,"iii a 2 r ie 11(a a |0[UI'|1I1U¡J|',¡ …II a i la sesti”",15
776.56,1420.89,35.11,26.0,58.67,l os eso es llo [ : 'Jm'm ue,15
877.25,1604.0,76.0,37.0,35.5,eo a s o,15
970.4,1714.4,47.4,22.8,50.0,|h»lr(n;o' o E 6 I+H=,15
1129.2,1810.8,39.6,21.2,62.0,"ers cossts, no e uik>",15
1052.0,1907.0,81.67,42.5,49.83,x*ow/uw&wgu 31 IDI II BF :,15
983.5,2042.9,55.4,21.7,85.7,Saco Ashkenazi afirmó que desde que se casó con l,15
1022.1,2258.86,69.44,26.53,86.54,"WIIR¿L Natalie Fértil es un hombre fiel. [/ y / /) ”Desde que me casé, creo en la fídelidad, antes no...era una 'bala al aire' hasta que La actriz Stephany Orbe conocí a Natalie”, dijo Saco en 'América reveló que dio positivo para coronavirus, pero contó Asimismo, señaló que podría perdonar una infidelidad, pero no continuaría con la relación. ”Podría perdonar a la persona y algún día olvidar, pero no seguiría porque se lo reprocharía siem— pre o dudaría de esa persona”, añadió. Por último, reafirmó que entre Ethel Pozo e Ignacio Balada",15
1715.75,2436.02,62.92,26.03,85.59,"la cuarentena en su casa. ”Estoy aislada por dos sema— nas. Soy asintomática. No _ — he sentido ningún efecto del — virus, pero por prevención y haCe — para cuidar a mi entorno es cuarentena — que estoy en cuarentena. No en Casa tengo ningún tratamiento y no médico, el que estoy llevando sintomas — es la medicina más natu—",15
1766.8,2243.6,70.6,24.0,89.8,que es asintomática y cumple,15
2206.38,341.88,59.5,44.5,51.0,"(DJ k. “| (c'[' [J'j n£""'o'r;¡_¡ i'[;(o') emelle",15
2226.78,1132.14,55.67,24.48,84.67,"Kevin Blow aconsejó a Michelle Sofer cuidar su salud tras bajar 28 kilos de peso por la operacirn de manga gástrica. ”Ella se hizo eso porque al parecer las dietas y los fármacos no le dieron resultados. ee ce extremo que un ser u 5 corte el estó— mago para bajar de peso, pero si le hace feliz, es — salud está su vida. Para mi pero gusto, no pasa d ba¡ar nada. Le acon— %gnto de dejaría que Ge ir operac¡on que su salud está primero y se cuide de no caer EEE sostuvo. Además, contó que está trabajan— do en su debut cinematográ— fico y extraña mucho a sus pequeñas hijas que viven en Perú. ”Hace un año que no las veo, a 5 d el ea Las extra— ño”, acotó. (D. Bautista)",15
2390.5,985.0,67.25,28.0,90.75,que recuerde que su,15
2196.59,2328.61,61.85,24.34,84.97,"ral, que es comer sano, hacer deporte en casa y canalizar mi energía con otras activida— des en el hogar”, dijo Orúe. Entonces, ¿en dos semanas regresas a la conducción de ”Aprendo en casa'? Sí. Ilusa (Eskenazi) nos E e i d hacía la prueba seguía tra— bajando como si nada, pero gracias a Dios, por E (. Gamarra)",15
478.43,699.29,76.43,42.43,58.29,"1 pp » Cx.»¿“>,£fi ffo© e en l hosp l tal",16
277.78,992.56,177.0,53.56,46.22,| clfñ£i& ngresóelhespi— t©Lmíromñf©&ñá…p*&&w©c&g¿ ©)%3 E |oí©f3í!l&.l>|:í€© a yl,16
244.5,1428.0,221.88,49.62,59.25,"Z% bw** (©> EI|popular""ffongo'(estakcon— s tentoporque¡sulhua(0nthlaIRodr|gue1 ¡C|nt""lIe¡s¡guellos|pasos'entel|mun(dotdella",16
474.69,1839.31,87.69,35.38,55.69,primertema”Wudive. (a(comenzar'$y&hora¡su a sigue los' pone: |Estoy' i ea Commo — cantante —,16
908.5,1624.21,244.57,37.25,52.46,"¡agaly Medinatsugirióa PattyWongíque,invierta ¡sult¡empoxen1rec¡blntera|pm|ps¡cologlca¡y,(no(en (demandaria, magen¡ylla'defsu¡ lositestimanios, (delicosinero: 3yfsu(espoerderuco r tPatty¡Wong(ha'dtdm(weflmlhas,ylm¡pnqgmma¡ponde¡aln i u;w1mdenarderdnfa& IEIIaI(antes(deempezar(una a na|para hacer ewer ta la (opmlon]publlcal (que(cas¡(esllaIMadre*lTeresa(de(€alcuta (deb¡0(de¡pensarlb¡enten(cualestsonu Iostaspectos(que¿estanIblen(o]mal ltros|nollalhemos'demandadozsmo El(dicetunatcosayella (otra, puesfhatomentadotentestos.",16
1126.0,2079.33,75.17,66.0,64.67,) ? p Á 172 /'[/',16
1054.43,2357.29,49.86,41.43,49.29,a [>“'?: ySi Lle a ta a,16
1710.57,1342.37,220.22,39.4,58.75,"días; tres wer si one si diferente si sobre jest a ¡persona.ltatprimera (quelle r0po,,la(otra …que£su(c0ntratoítermlno<en(febreroyy,<des |pues<culpo¡a¡sulhennana[d|c¡endo(que; Fue(ellallalque(desp¡d¡o'a(estevsenor (ereoique: neces¡ta(otro(argumento ¿Muchaicontradicción? [Mira,cuandowunajpersonatdice la werdadidebeconsenartuntsolodis= imanejandofhastare! momento:Ella a porquéxiemandarme,, |porqueísoloísoy¡.una|penod¡sttarque pone(elttest¡momo'dellas |personas:que(quleren1hablar5y (db.,(emllas(denunc¡as(quelhexv¡sto portmaltrato¡ps¡co— CA lágicowyxdejpronto: |DESC El A (estas¡íe(con;nertenu 6 ie ea DE C IN TA (c0 'ah|3yalno.qu¡ero |meterme1mas*|por— EL e e i MÍA ©* (qu¡zas]neces¡te Desconf¡o]mucho'dellasjpersonas(qu&van [loriqueandojporaquiyporaillá,fel melodra: |malbarat04n04me(gustai(Creoxque'antesxde; finiciar.una [querellalneces¡ta'traba;ar'0tras (cosas., /lmetlBarboza,já¡o:queflardonaaon…que Ihk¡steffue]paa!hmp¡w¡tulrmag r¡y,íte un(pol:t|co(conupto quejen. ÍmfcasoibuscasimUng¡y,(dloslrobamos—s $S|empre4he'dlcholqueeruo¡a mistenemigos: (ei",16
1685.45,2355.09,109.73,30.05,64.14,laiorden:del día Ihay tener mucho que'siga ”sostuvo. ¿Has;pasado ea e ¡No Ar |me¡mandanll¡nks¡para fotos obscenas l|mquelhago desbloquear porque meíconcentro en traba— de|personal,16
2227.34,1544.98,84.45,26.44,64.52,"o.g;…uou, 5] a ll (o E em bala di taj para contar— lestlos'últimos' chismes' de que vés de un vídeo que hizo con:su e en E 0 ¡Qué emoción...FICRE— [ .cargan baterías; pues este miér— secuencia de ei e ea toda: ”la portátil”. Asuuy.... €AN IMARCOZIE— (e el ayer 50' años. y millas gra— ¡Felicidades!... CALAMARES se.despidió de por— .que en dos'semanas daráiluz a > 5 a e e e IDENTICA están conejos nervios'de.punta ya que. en cualquier momento ro... PAULA MANZANA .contó que estáisuperan— do su crisis matrimonial .con.su esposo . ADAM CARTTJREHT... Quien también estáifeliz.es. PIMENTEL,, pues *El REVENTO— DE LACKOLA' volvió'alliderar el rating: del. sábado'al hacer Azapa— tear... Los actores' GABRIEL SOTO e han denunciado, en México, altura discri— nación y no.podrá hablar elljuicio. Asuuuu...Somos. fuga j porque mi amorci— to se alucinalPapá Noel y quiere.regalarme,su juguetito...",16
