left,top,width,height,conf,text,page
977.82,153.45,62.09,32.36,49.82,a s 2 e a “'ooebook.com/úmmepe ||[ A bo 2 >,1
1553.75,409.0,85.0,34.5,63.75,VÍA AÉREA S 1.00,1
413.89,1187.56,206.22,84.78,51.11,3£6““PUW?? …|LW 1J“|I 3U__|_[_Q U“W/ All 3©W?Foo “)…W%¡a] yse,1
1017.8,1707.2,525.6,318.8,52.6,ENVÍE — ja VA ERÁ&©Á$©,1
831.69,2446.38,158.08,95.08,44.92,"€le.:]&£E F% &“E%…%F x% u.g.…./3 D l F% '…wm""fooof'o""ooo“l'. SEA ]_ÚXQ) om a",1
247.8,385.2,79.6,58.0,55.2,EL D + rap' como,10
212.63,706.8,54.3,24.27,87.37,"La exitosa serie de de los 90, *El príncipe del rap', protagoni— nada por el actor Will Smith, volve— rá a la televisión, pero ya no como una comedia, sino",10
215.03,1250.89,46.31,22.86,70.67,"Oyen las o” próximas : semanas se — lanzará una ' campaña : de turismo [ e ( la marca 0 1 , que se espe— — E e d * ingresos del : * rubro.",10
186.13,1669.47,45.83,23.77,70.97,": 0 Segun o Gr , Gobierno, en '; lo que va del . año el turis— d l 1 ¡mil 348 : millones ;de dóla— ”res por la :¡pandemia.",10
686.38,647.15,65.97,24.6,89.68,"como un desgarrador drama, donde se conta— rá cómo el protagonista sufre por causa de una pandilla de Filadelfia (Estados Unidos). Smith será el produc— tor ejecutivo, pero la idea original es de Morgan Cooper, un fanático de la serie.",10
1176.0,158.5,84.5,24.5,89.17,JUEVES 13 DE AGOSTO DEL 2020,10
1871.6,336.8,113.2,61.8,70.0,ee e trabajo y gana,10
1790.73,514.32,64.84,31.14,76.76,"ello GO — 117 y mill 6] [Oj k a © David Adams (61) había — Grande fue su sorpresa sido despedido de su cuando al cotejar los núme— isln¡¡'of&¡$(€lnh]plr($í3&; trabajo como maquinista ros que había escogido,",10
2114.1,620.0,53.7,26.4,60.3,comprobó que ganó 1 millón E ] ie el a,10
1940.3,745.23,62.66,25.66,73.27,"|nnmm:Ikitaw5iingg]tc:I.V4kaili;,(elnl ”Ha sido un año muy ell Wnitito, mill familiar por el ta d e y a fire 1¡7¿»h|ux.lx…lIl»mv¿nmil|nnu. a (l lia, pero la suerte nos — así que deci— acompaño”, señaló dió comprar un Adams al medio 'Bir— boleto de lotería. minghammail” [<]",10
1714.3,917.2,147.7,43.1,84.3,"SOLO PODRÁN HACERLO PAREJAS, CONOCIDOS O FAMILIARES QUE ESTEN SANOS",10
1731.93,1509.84,200.33,34.69,69.21,"cashorasdetrayecto.Ca— SE REINVENTAR ñete,Huacho,Huaral, Lu— m] nahuaná, Pachacámacr, BarrancaoHuarazes— másdeseadas”,detalló. Y z A ALTERNATIVAS Precisóquevariosdeestos o nuevos viajeros'son per— sonasdeentre30 y50años, ensumayoría parejas, G g quienesestándecidién— dose por movi liza rse con propio vehículo. Además, señalóquelas empresasturísticasem— busca de destinos explicóqueestossi— pezaríanaofrecerlos ideales para escapar — tiosseconvertiránen ”Viajesburbujas;enlos delestrésylospro— los p referidos por ser quesoloestépermiti— le mas ocasion a dos _ espaciososalaireli— do viajar con parejas, porlapandemia,lospe— breyfueradeaglome— conocidos o familiares ruanosempezaránaoptar — raciones,quenoarries— con los que se tenga la por viajes cortos a playas o — guenlasaludconalgún seguridaddequees— montañas,dondesesien— — contagio. tánsanos. Además,se tanasalvodelcoronavirus. — ”La 'nuevanormalidad” respetarántodaslas AsíloafirmóLuisSicheri, hamarcadounatenden— medidasdebiosegu— expertoenturismo,quien. — ciahacialosviajesdepo— ridad.(].Arce)",10
281.56,2449.56,35.67,26.33,41.56,"es IetURIL, es unto ciertos l el o i",10
1700.0,1927.2,107.0,39.2,90.0,viajes cortos a playas o montañas para alejarse del coronavirus,10
1088.0,2201.38,42.62,30.12,59.62,"os e ell i |o)"" 1( 's|to1 |o)riinnuro1m¿",10
1168.71,2500.14,59.0,34.57,50.29,yel y y e s o =,10
1536.75,2088.0,127.0,53.0,65.25,”El angelito” Gian Carlo,10
1451.25,2151.0,73.25,45.0,88.75,se fue al cielo,10
1573.14,2313.9,71.41,24.38,85.66,"El congresista Gian Carlo Vacchelli, ”El Angelito”, falleció ayer después de sufrir un paro cardiorrespiratorio. Fue su esposa Evelyn Osario quien dio a conocer la triste noticia en redes",10
2096.5,2044.0,106.0,22.0,76.5,&CON PREVIA CITA VIRTUAL,10
2117.29,2113.14,143.29,54.86,89.29,Ya puedes tramitar tu licencia de conducir,10
2075.78,2309.0,76.56,23.56,85.61,Los postulantes a una licencia de conducir podrán ser evaluados en los establecimientos auto— rizados previa cita virtual,10
1655.6,2426.4,62.1,23.8,90.7,sociales: ”Partiste junto a tu mamá. Me dejaste el cora—,10
1680.55,2531.1,58.65,24.45,90.95,"zen destrozado, no sé cómo podré salir de esto... Tu corazen no resistió por— que estaba lleno de amor”. o",10
2142.4,2507.67,67.93,23.71,90.53,"para su examen de cono— cimiento y habilidades en la conducción en el Centro de Evaluación Touring y Automó— vil Club del Perú, informó el Ministerio de Transportes. La atención será con previa cita, a través del 615—9315 o de la platafor— ma web: touring.pe/inscripcion.",10
409.88,491.5,113.12,42.12,89.88,DE INMOVILIZACIÓN S CUANDO REINICIE LA LIGA 1,11
662.43,433.71,114.14,40.57,81.14,Y CRISTAL JUGARÍAN EN DÍA IAL OBLIGATORIA,11
431.74,1304.48,66.73,33.35,84.55,"LA COMISIÓN MEDICA de la de la FPS evalúa realizar nueva pruebas moleculares a todos los jugadores de los clubes antes que reinicie el tomeo. ASCENDIDO que Alianza Lima recibiría los %untos h E E_;art¡do suspendido con Binacional, tras los contagiados q_ue registró el cuadro EL VOLANTE Willian Mimarla hará un viaje catatónico de 4 días para integrarse al Cusco, EC: viajará de Irán a Tel Aviv [Israel), luego hacia — AmsterdamíHolandafy de allí a Guayaquil donde irá por tierra a Tumbes y tomará un avión a Lima.",11
270.57,1661.29,149.29,32.0,43.71,reultimandetalles'para: e e i — tautoridadestestudian'a posibilidad,11
372.45,2388.39,115.42,30.26,56.77,"INUEVOIPOSITIVO EN l l no [ a v! V y ; SUBELATEMPERATURA go iMatute: Unnuevercaso (dudas; el para que deshagan exámentes: moleculares realizarla Trascendióqueunwolante'titularisería: Mientras, AlbertolRodríguez falta médica Mario Salastsillotalinea (entell",11
754.62,1683.88,129.75,29.88,46.0,tdíasipara'asievitaragiomeración o oe ds e s ¡prevecarontasuspensión del,11
1232.85,1678.73,79.3,26.61,80.55,"Anoche se reunieron el de la'Federación, Agustín Lozano, miembros de la'Policía Nacional, así como del Ministerio de Salud y el IPD.'Uno dellosrequerimientos: para que se dé”luz verde'— es' que hay a una campaña'agresiva",11
1221.85,2426.88,78.24,25.02,76.51,"ADMINISTRADORA LEVANTO HUELGA EN LA U' a y m VOT© DE CONFIANZA administradora de la ”V' Sonia Alva, se presentó;porpri— . y mera vez ante eliplante! y prometió saldar los'dos sueldos atrasados'antes de fin de mes:iDespués de escuchar sombrilla forma de trabajo que tendrá su empresa, y el equipo volvió a entren an luego de dos'días de huelga. Median— te carta notarial, la empresa ”Solución y Desarrollo' solicitó:una reunión conla nueva 'administradora para entregarlos docu— menos y sedes'del club. Desde el funestos cremas volveríanta:",11
1680.4,1615.8,169.0,32.2,50.0,o e en sus teas as y in bias is tanta los alrededor est de lost estadios tion de,11
1661.8,1758.0,159.2,28.6,36.0,Es'casi imposible que teste fin de semana sere inicie la Ligal.Guando,11
2123.11,1666.78,138.67,30.78,45.44,tassel t seap me bent os protocol ast de tseguiidadseterminaríadejugarila fechar mejore es e ese o,11
1887.1,2417.62,193.76,41.33,44.52,"* — Al ©$ Roberto: Mesqueranodieseamásproblemastdisciplina— isetapoyarátenllostmásrecorridosiparatmantener' elordententeliplante!. habríatreunidoxconttoracio Galeaterra: Jorge Gazulo, RenzolRevoredoy ©mariMerlotpara (quelhablenteonllos. másfjóvenesy cuidan; másiprejudicados.”Tene— montón plante! SLub—23tcontalgunos",11
925.38,158.75,101.62,26.25,87.5,12 (DEPORTES) JUEVES 13 DE AGOSTO DEL 2020,12
1005.56,1170.21,79.15,25.97,76.27,"isboa.— Keymar puso la torta, Mba— trajo música fiesta se amó en 3 minutos. Enel ataque cumplía 50 años defun— dación, Provino detrás y acabó con el sueño del Atalanta derrotándolo 2—1, enundramático partido, para entrar a semifinales de la Champions luego de 25 años. Sien 2017 'Ney' quitó una remontada contra PSG (con Barcelona), ayerlide— reuna del clubfrancés. El brasileño participó en el gol deem pate de Marquin— hos a los 90'y meti un pa— se genial para Frappé queterminóconeltanto del camerinos EricMaxim Choupo—Motingalos 93' El cuadroitalianoempe— zódandoel golpearon Ma— rio Pashalic (27), peroseca— Keymarhizo dos hua— chas, recibiópatadas, me— ti un codazo, pero estuvo sin socio s ataque entró",12
618.0,1730.0,134.0,46.5,73.0,"BRASILEÑO HIZO HUACHAS, — Mbappéalos 59'vtodose",12
329.5,1778.0,136.25,37.5,65.5,COMO EN PLAYSTATION RECIBIO,12
1419.8,2193.15,74.77,31.07,80.45,"pATADAS. premio firióqueelpremio sea para o COMPANERO, PARTICIPÓ EN LOS GOLES — Choupo—Motingdemos: T¿QZO$Sd a . a . traído grandeza dentro corto una racha de / elml— 15 , Reloj __ — eliminación. Meneo — suerte, peri EL NO UL%L%S&OVSOTLFTQE(S) ¡¿z¡HKIÓ1A(.)Í€|Y'ANTA y furdel campo. PSGes— _ naciones seguidas en Champions (4 — Navas, fue cambiado porun lesión enla final” vives todo pera alvencedordelAtiéti— — en cuartos y 3 en octav051 muscular n hoy será evaluado. Neymar, delantero algo total m CLASIFICO A SEMIFINALES DELA ! l ATALANTA hizo 200 pases e a CHAMPIONS %Jalo la marca de Lionel Mess en enos que PSG y cometió 29 fal Thomas T el mayor registro en esta edición). ”CHOLO i e i a ta ee a a na ra VENGANZA ganar, es lo único que hay”, el DT Diego Simone ©RGAN ||ZA©S PUNTUALES ANTE LEIPZIG metió toda la confianza a su Atlético de Madrid RAD©S y PEGA|L©N ES GN© ES para vencer hoy (2:00 al Leipzig, por los cuartos de final de la Champions. Los © Lisboa.— Lo siguen calentando y no se inmuta. Lionel Mess, quien entre— ""MP©WANFE *Colchoneros' perdieron en esta ciudad la edi— nó ayer sin vendaje, continúa siendo el 'punto' de los ataques de Bayed MNA ción 2014 de manera increíble ante Real Madrid y Munich, rival por los cuartos de la Champions. La 'Pulga' ya les marcó dos |L© UN"" C© quieren venganza. dobleces en el 2009 y 2015, y en ambas ediciones campeona el Barcelona. En A su favor tienen que siempre avanzaron en esa última 'destrozó la cintura' del zaguero Jerome Boateng, quien mañana ©UE HIAY' eliminatorias de este tome ante equipos alema— es fijo en la zaga bávara. ”Al día de hoy, Lewandowski es mejor que Mess, ha",12
727.21,2556.55,58.42,24.67,86.94,"nes [3 cruces), aunque por primera vez chocarán con su rival de tumo. El cuadro 'germano' no con— tará con su goleador Timo Temer (fichó por el Chelsea) y debuta en esta instancia.",12
1948.85,2556.7,61.62,24.28,83.96,"dado un recital este año”, dijo el brasileño Elber, atacante del equipo 'ger— mano” Por su parte, Kar—Heinz Rummenigge, presidente de honor, le mandó un 'recado' al portero alemán del 'Barza'. ”Neuer es un portero de talla mun— dial y Ter Steven va camino a serto”, declaró.",12
176.75,2025.0,57.25,41.5,67.75,e |áhel. DT Atalanta,13
1344.0,160.67,89.0,24.33,91.17,JUEVES 13 DE AGOSTO DEL 2020,13
788.57,1495.32,67.36,23.95,88.72,"DEL SAQUE somos car— necita... SE VIENE UN PROBLEMÓN en la aveni— da Canadá y ni el 'Tigre' lo va a poder solucionar, Lo — parte es que se presenta a 56 ' días del debut en las Elimina— torias. Pero primero les voy a contar cómo nace la historia. El capítulo I se titula: Abertura de carne”. Un extremo que creció al frente del Mall Aventura de La Colonial se rega— la mal. Su señora hackeó su Instagram y descubrió sus engaños y conversaciones hot recontra subidas de tono. Cuentan que la doña es recontra celosa y por eso hizo el seguimiento. Le dio confianza hasta que se descui— dó. Reventó el chancho y en una le pidió el divorcio. Tiene todo el material donde varios caen contando sus intimida— des. Y eso pasa porque la no se escribe en un celular. El tema es sencillo: La esposa pide un billetes para firmar los papeles de la separación. Paga o paga, así como despilfarra con las trampas. La cosa es que por bocones y malhablado habrá varios 'damnificados”. Incluso, ya le chorrear la información a la mujer del quien se ha quedado sorprendida y asqueada de que su maridi— to haga ”cardio' en los baños. Ayayayayay... EL CAPÍTULO II lo llamaremos de plástico” Hay varios de Euro— pa que le mandaron pasajes a una que su nombre rima con Anamilé”. Hizo ”turismo” por Turquía, Rusia y Espa— ña. También visitó los Estados Unidos y otros países más. Esa flaca es la misma que salía con el Rey de los casi— nos' y tiene más que las páginas de Teléfonica. La modelo venía con maletas llenas de ropa de mar— ca y con su cartera Louis Sutton repleta de euros. Pero no se la llevó de alivio porque la descubridor la timbre para insultarla y tirarla de lo que ustedes ya saben. Los chats eran revelaciones de los detalles de cada seleccio— nado con la anfitriona. Y con y videos para los zapatos rotos'” Eso no corre. No es de hombres, aunque ya es costumbre de esa batería. Rexuxa... EL CAPÍTU— LO III es el Aquí hay una conversación de grupo que puede partir al de todos”. Yo no creo que dicha pase desapercibida en la concentración. Mini— mo hay un destrabe, sacada al fresco y puede llegar a puñete. Una cosa es un comentario en joda' y otro decir— le ”cornudo” a tu compañero, vía redes, con la gente que clasificó al Mundial. Allí ya no es broma. Es ”coba' y bur— la, Se le fue la lancha al ”turco' que pasó por Portugal. Se dirigió de esa manera con un zambito, quien ya avisó que viene a reventarlo si todo sale a la luz. Se pintó de canche— ro y al final cayó como sonso. Es una situación complicada en lo deportivo. Cómo sanas esa herida. Ya la tienen des— amenazada el entrenador, el presidente de la Federación, el gerente de selecciones y jugadores. Hagan algo pronto. Así es... QUEDA DEMOSTRADO que ya no hay favori— tos en el fútbol. La boquilla, declaraciones humillantes, el dinero, cartas pases y apellidos no ganan los partidos. PSG le volteó el partido al Atalanta en los últimos 3 minu— tos y clasificó a la semifinal de la Champions. El cuadro italiano, cuya plantilla completa gana al año lo que percibe Neymar, estuvo a un abrir y cerrar de ojos de hacer histo— ría. Iba 1—0 y en los descuentos le voltearon 2—1. La firme que el brasileño es un fuera de serie, un monstruo. Junto a Mbappé, que entró en el segundo tiempo, hicieron la fies— ta. Pero creo que el técnico italiano ayudó a la reacción. Cometió un error al sacar a Duran Zapata. El colombia— no, así cansado y torpe, los tenía enfermos y distraídos a Hago Silva y la defensa. Chocaba como un camión y aguantaba. Apenas lo sacó se le vinieron los indios. Pare— cía que atacaban 15 y defendían 10. Ese cambio inclinó la cancha. Curuju... Me voy, soy fuga.",13
319.38,276.12,89.38,30.88,80.62,RACING DE ARGENTINA OFRECIÓ MEDIO MILLON DE LARES,14
360.5,344.0,104.38,35.5,83.75,PORVOLANTE Y TRATAN DE CONVENCERLO PARA QUE ACEPTE,14
351.42,1320.84,86.52,26.78,75.44,"elaAcademia Cantora ala'Acade— mia' argentina. Volante Muriel Ce— Te ese 1 ea girarse racing Club en las próxi— mas horas definiría sutraspaso. El cuadro de Avellaneda ha ofrecido 500 mil dólares por el 60 porciento de su pase y un contrato por cuatroaños. Fueelpropio presidente deRacingquiencon— firmóteneren la mira al peruano. ”Nosinte— resa Muriel Celi. Es muy buenjugador”, co— mentóVíctor Blanco en'Radio Cooperativa'. Se supo que Cantora estaría de acuerdo, pe— roaúnfaltaque el jugador acept el a oferta y hoy reuniría con suempresario, quientra— tarde convencerlo nomás pronto para que emigre a un grande de Argentina, donde empezaronaentrenar. Celi, de 18 años, fue una de las figura sen las selecciones Sub—17 y Sub—20, y lleva 964 mi— nutos en el fútbol profesional desdequede— butóenmayodel 2019.",14
1176.0,158.5,84.5,24.5,88.67,JUEVES 13 DE AGOSTO DEL 2020,14
1139.13,1734.09,60.35,33.3,86.61,E|l(. GOL que anotó Andy Polo (Portland Timbers) al New York City (de Alexander Callens) está nominado al mejor de la in a,14
848.29,1800.14,77.79,31.79,86.79,"S CELTA DE VIGO, donde juega Renato Tapia, anunció dos casos positivos de coronavirus.",14
369.94,2150.85,64.68,24.84,84.52,"€» San Remo.— Mientras decide si se queda o no en Juventus, Cristiano Ronald se relaja junto a su novia Georgina Rodríguez en altamar. ”Feliz de compartir estos hermosos momentos contigo””, pos— te 'CR7, que según el diario alemán 'Der Spiegel' cobra 16.2 millones al año de su sponsor deportivo el doble de lo que percibe Mess con ”Adidas”. Cristiano habría pedido retener como sea a Paulo Bala — &prICAS VACACIONES para que no deje el club. DE CRISTIANO",14
1638.4,1887.2,127.2,24.8,81.2,DESPILFARRÓ 250 MILLONES DE DÓLARES,14
1371.72,2094.0,58.71,24.59,89.87,"Evander Goldfield fue un campeón mun— dial que ganó 250 millones de dólares en el box. Hoy, con 57 años, se gana la vida con peleas de exhibición. Once hijos con 6 mujeres, tres divorcios y malas compañías e inversiones lo llevaron a la ruina. Tenía una mansión con 109 habitaciones y pagaba 15 mil dólares de luz al mes. Ahora vive en un departamento de dos cuartos. ”Cuando no tienes a otros cuidando de ti, todos te termi—",14
1559.08,2285.58,56.75,26.0,81.33,"robando. Solía ser tonto, pero ya no lo | EN L& LONA",14
1230.0,2307.75,93.75,25.75,86.75,"soy”, confesó el norteamericano.",14
2263.75,596.0,67.5,40.0,89.75,DIEGO Y MIL MÁS,14
2286.71,776.37,56.63,27.61,87.0,"G$ Diego Paradoja donó mil camisetas de Gimnasia y Esgrima que se repartieron en los barrios de La Plata. El obje— tipo es llegar a las 10 mil y, ante la alegría de los hinchas, el ”Pelusa' regalaría mil casaqui— ass",14
2358.0,1310.4,23.6,46.4,37.6,ga m p l |,14
2283.11,1492.17,69.03,24.61,89.0,"”Kun' Agúero, delantero del Manchester City, apu— ra su recuperación para jugar en una posible semifinal de Champions. Tras la rotura de menisco de la rodilla izquier— da, ya está en la fase final del postoperatorio.",14
2263.24,2170.44,60.78,26.93,86.68,"Riker Casillas (39), €$ tras colgar los guan— tes, buscará recuperar los años que le quitó el fút— bol. ”No he estado con Sara (su esposa] todo el tiempo que debería”, dijo. La pare— ja dejará Porto y vivirá en Madrid.",14
306.45,2398.97,59.24,25.76,81.45,"(© Francisca Aronson contó que es muy bue— na amiga de la actriz Mina El Hammani, la recordada 'Nadia' de la serie 'Elite' de Netflix, con quien graba 'El",15
340.56,2554.22,69.56,32.22,87.44,comparte roles con Mina El Hamlani de la serie,15
768.32,1347.7,80.25,24.12,82.8,"anet Barboza pidió a Fiorello Alzamo— ra que sea clara con la denuncia en con— tra de Ricardo Zúñiga, el *Zorro Zupe', porque ”los ni— ños son sagrados y no se de — be tener piedad contra las personas que atentan con.— tra ellos” ”No quiero adelanta r juicios ni especular sobre lo que pa— só, y creo que Fiorello (Alza— mora) debería ser más direc— ta porque es un tema delica— do cuando se menciona a ni— ños, no se debe tener piedad nipona en denunciar”, seña— la la Rulitos”. ”Losniños son intocables, sa— grados, los tenemos que pro— tegertotalmente. Aquí, al pa— códigos de amistad no existen ni nunca existieron y posponemos imaginarlo peor”. añadió Barboza. Además, contóqueco— noceSuecia y shabeque lasley pro—",15
1015.39,2278.44,68.16,23.95,89.03,"internado' de Amazon Prime. ”Tenemos una bonita amis— tad y lo más importante es que somos muy bue— nas compañeras de trabajo. Mina es una bellísima per— sona y tiene muchos deseos de conocer Perú”, dijo la actriz desde San Sebastián E ¿Cómoteva en las gra— baciones? Muy bien, este es mi primer proyecto internacional. Espero que esto sea el inicio de muchas oportuni—",15
1245.5,945.0,45.5,35.0,48.5,ne e A id,15
1248.0,1091.6,61.0,33.8,48.0,(r(¡;7“n EN DC SU s,15
1199.35,1549.55,84.18,25.25,82.25,"temen mucho a los niños y las sanciones son muy duras. ”Sien denuncian por ”tocamientos indebidos”, al día siguiente estáen la cár— cel. El gobierno protege a los menores, el Estado paga alas familias porel na— cimiento de cada niño, parque tenga buena alimentación y educa.— ción”, expresó. Por su parte, Paula Manzanaltambién brindó su apo— yo a Fiorello Alza— mora y espera que las autori— dades 'hagan justicia” ”Cada perso—",15
1539.56,2232.5,86.78,24.94,89.72,"Monique Pardo afirmó que se encuentra bastante mejor, después de haber sufrido una arritmia cardíaca. ”Estoy recuperándome, cada",15
1731.77,1407.05,71.9,24.73,84.05,"na cae por su pro— pio peso, es una si— situación delicada y prefiero ahorrar— memiscomen— tarios, sino me saldrá lo peor. Ella es mi ami— ga tiene todo miapo— yo”, dijo. DENUNCIA Como se sabe, Fagaly Medina presentó un informe donde Alzamos reveló, a través de una conversación de Whats— App, que había una denun— cia contra el Zorro' y que por respeto a sus meno — res hijos no podía dar detalles porque era un tema muy deli— cado. Además, Fio— rella, en su cuen— posteó una foto— gracia en la que se leía la pedofilia no es una orien— nación sexual”, pero luego la borró. (E.C./ D.B.) +",15
1531.43,2344.57,46.86,24.0,91.57,día me siento mejor y le agra—,15
1502.0,2376.4,58.2,22.8,92.0,deco a Gisela Valcárcel y,15
1516.6,2410.8,65.8,22.4,86.4,Ethel porque me están aten—,15
1499.74,2508.26,61.65,23.17,88.91,"siendo en una clínica con la ayuda que me dieron en 'América hoy””, dijo. Además, contó que espe— ra retomar pronto su faceta",15
2270.09,1021.62,68.78,24.06,87.12,"© Jamila Dahabieh ase— duró que el Zorro Zupe' se encuentra tranquilo' y no se está esconsiendo de las autoridades en Suecia. ”Hablé con él ['Zorro'), pero no con Fiorella, por eso no sé si mi opinirn pueda porque debería haber escu— echado a la otra es a | e que las cosas no son como se están diciendo, que él está tran— quilo. Espero que realmente puedan solucionar sus pro— blemas, pues me da pena, ambos son mis amigos, que esté pasando todo esto, realmente es un tema delicado”, señaló. ¿Escierto que seestáescon— siendo de las autoridades? Asegura que no. ¿Y dónde se es— táquedando? No sé exacta— ul ir sigue en Europa. (D. Bautista)",15
2355.2,1774.4,88.0,30.8,77.4,que habló con A esconde,15
2210.39,2197.44,64.56,24.17,88.8,"como cantante porque aún no puede trabajar en sus shows. ”Vivir sola es muy complicado a mi edad, pero no me rindo. Voy a seguir grabando mis canciones porque ahora no puedo hacer shows y mi nieto está por nacer”, precisó. También, lamentó que la del oriente” se haya contagiado de coronavirus. (E.C [+]",15
2212.89,2518.67,83.11,36.44,85.78,que se está recuperando de arritmia cardíaca que sufrió,15
276.3,772.98,60.24,25.43,86.17,"€» Sabia Bengola reve— la en 'Mi mamá cocina mejor que la tuya', que (e go, que conquistó a ( a ti) con bombones que le preparó. ”Tengo 20 años con Lelé, es la relación más larga que he tenido. Hemos pasado por todos los problemas y alegrías de una pareja, ambos creemos que el amor con humor siempre será mejor”, dijo Sabia.",16
403.56,1103.89,68.33,32.0,84.44,que tiene veinte años con Su pareja Relé Mirate,16
533.83,1333.67,81.17,31.83,62.17,At al programa de Karina Rivera,16
380.8,1989.62,57.11,25.36,87.69,"(O Jessy Kate afirmó que la próxima semana espera regresar al programa ”La ruta del amor de Latina, pues se viene recuperando de un esguince al tobillo. ”La semana pasada salía de mi casa para ir al canal y me tropecé en la vereda, no podía caminar y se hinchó mi pie, tengo un esguin— ce. El otro lunes volveré porque aún creo en el amor y el público pidió mi regreso”, dijo. (E.C)",16
1176.0,158.67,84.5,24.33,85.5,JUEVES 13 DE AGOSTO DEL 2020,16
971.2,718.8,108.6,76.6,57.6,"— f a U<o5['¿í L_€íoíó_]'""]",16
927.56,1544.41,103.48,25.42,76.05,"lindaCastañedale desealomejorajJack— son Mora y TilsaLo— zano, luego que apa.— lentamente se distancia ran por las conversaciones que el pelea— dorsostuvoconella. ”Quiero aclararme no mos— presos mensajes, sefiltraron. Jackstones amigo y nos co— comunicamos por temas detra— bajo. No vi nada de malo, él co— noche novio ambos se caen bien y res— petan”, comentó. ¿Creesquejack— sondeó contarle aTilsaque ustedes conversaban? Todarelación seba— saben la confianza y comunicación. No es mi tema cómo ellos lleven su relación. Escaso estén peleados, ¿te gus— haría que se reconcilien? Lesdeseolomejor. Situparejate ocultainforma— ción, ¿quéharías? Estoy en esa posición para opinar, me encuentro feliz por— quema relación rebasa confianza. Elprogramade Fagaly Medina",16
952.5,2425.5,224.5,58.5,43.0,encontra cella manda gástrica,16
1296.6,1034.4,186.0,35.2,86.0,"presentados denuncias deagresiónquetuvotu pareja, ChristianMar—",16
1408.6,1408.31,77.13,24.13,79.84,"dal... Eso ya lo habíamos conversado y, como di— ces, solo son denuncias, no pasó a más. Si en realidad fue— culpable se abre un proceso y pasa a una investigación. Confío en él, es un chico sú— pertrabajador. ¿Nunca permitirías que falte el respeto? Jamás, nolo he permi— tido ni lo voy a per— mitir.El no es pa— ra nada agresivo, esdetallista, ca— riñoso, respetuoso y veocómo lleva con mamá desu hija,con sushijos, amigos quetiene. Eles",16
