left,top,width,height,conf,text,page
2233.22,879.32,64.99,24.1,86.17,"ogo HOLA, MI o BARRUNTO. Llego embalada para contar— les los últimos chismes de En redes sociales se espe— cula que BRENDA CARPATHO estaría embarazada y que haría papá, por segunda vez, a Julinho, pues ambos fueron vistos en una clínica de fer— tilidad. ¿Prendió la vacuna?... S BE pidió que no especulan sobre el fin de su romance con BETO DA SiL— VA, y aclaró que ahora está viviendo una eta— pa tranquila enfocada solo en su trabajo. l lr",16
2231.57,1959.63,64.47,24.62,85.88,"a correr con SAID PALAO, el alcalde GEORGE FOR— SETH comparte videos donde jue— ga con su perrito y dice que 'no tiene suerte en el amor”. Pobechi— to... JANET BARBOZA demostró que sabe coci— nar al preparar unos frijoles para los hijos de su pareja MIGUEL BAYONA, quienes pasan unos días con ellos. Bue— na... El popular JOTA' reveló que la cuaren— tena le jugó en contra para seguir 'echando maicito' a ARI— ZAGA... GIULIANA BARRIOS todavía no a el a A pero contó que ayer se hizo la prue— ba del coronavirus y por prevención se quedará en casita hasta que le den los resul— tados. Bien ahí... Somos fuga porque mi amorcito se cree malabarista de cir— co y dice que esta a ea baja... Suuuaaaveee",16
1155.75,427.75,170.75,90.5,55.25,"(A El color? |""]Yí£…",17
1137.67,1017.42,58.1,23.75,83.91,"después que el cantan— te Todo Centella puso E e e ee e| esposa Johan Rodrí— guez, porque le habría sido infiel con el 'Zape— roko', Marvin Salas, Marisol Ramírez, 'La faraona!”, le brindó su res— paldo, pues ella ha vivido en carne propia lo que es un engaño. ”Todo es mi amigo y me solidari— zo con él, porque es una buena persona y le doy todo mi respaldo”, preciso la intérprete de 'La escobita” ¿Hablaste con él?",17
1344.08,1305.0,41.42,25.33,91.33,"Sí. Le dije que el dolor pasa, lo viví, lo pasé, así",17
1343.75,1464.92,57.94,24.62,87.03,"que le aconsejé: 'Pa' lante, tienes que voltear la página porque la vida continúa. Por cierto, acabas de grabar una canción con Todo. ¿Es su primer tema a dúo? Sí. El tema se llama 'Con la sangre en mis venas”, él me lo propuso y le dije sí porque me encanta la música chi— cha. Además, Todo es mi amigo y lo estimo mucho. (LGamarra)",17
1067.51,1743.29,61.8,32.22,85.07,"<> Ever Vela pidió que no que metros para medir la / empañan la felicidad de — fiesta por los — temperatura, vaporizó Í/K su hija, que cumplió 15 años, — 15 años de su — todo el ambiente y hubo",17
848.4,1937.98,51.26,23.51,84.7,"el e E hizo una - ' fiesta en Ica, sin respetar los protocolos seguridad. e almuerzo, que sí tuvo todos los detallitos porque eran sus 15 años. La reunión familiar fue en mi casa de Lima y no en Ica. El papá",17
1383.17,1941.72,51.5,24.67,85.13,"mucha higiene. La reu— e e d ell la familia de Melissa [Klug), jamás expondría a mi fami— lia y a la de ella”, dijo. En redes te crítica por esto... Nada empañar la felicidad de mi hija y mi alegría, porque es mi única hija",17
1146.14,1835.71,54.86,32.0,77.86,hija solo fue un almuerzo E) d,17
1297.2,2103.6,49.88,25.48,84.72,"de mi hija mujer, porque mi otra niña está en colocó el cielo y verla una señorita es termó— una bendición. (C. Chévez) — G",17
1866.6,424.4,39.6,49.6,52.6,(':-¡D*l |[ IL(Q ñ íl(o),17
1940.55,654.49,70.09,25.94,85.13,"€) Arturo Caballe— ro, el popular Arturo', desmintió que haya pasado el fin de semana con Macare— y na Vélez, como se especuló, luego que mostraron una E foto con similar leyenda. coincidencia ”Por favor no inventen cosas, que publicara estoy soltero, tranquilo y tra— foto ee",17
1956.44,874.28,72.04,28.8,81.24,"bajando”, dijo Caballero. la misma ¿Solo fueunacoinci— — leyenda dencia? g¡ue empleó Sí. No veo a mis hijos &sl hace seis meses por la Vez",17
1950.95,1050.48,86.29,28.95,84.24,"cuarentena. ¿Ledeseas lo mejor alejandra Bai— gorra y Said, tras el amply quesa— lió? Siempre los mejores deseos para ella. (L.Gamarra)",17
2230.11,1606.05,57.7,24.15,84.05,"$% Armó fiesta © Susy Díaz aclaró que en casa no organizó una fies— con orquesta ta con orquesta en su cuando ella — casa y que uno de sus estaba en _ inguilinos, aprovechan— do que se encuentra en Harvey junto a su go' Walter Obregón, armó la reunión. ”Me sorprendió lo que = a inquilino el que aprove— echó mi ausencia y realizó una fiesta con orques— ta. Me llegaron quejas pensando que era yo, y ahora tengo que desin— afectar toda mi casa. l EE ción porque así se dan los con— tagios, eso es irresponsa— V.,""r|'_ — ! V |1! y a",17
260.56,512.89,52.61,31.06,69.83,o | x Dale su espacio No puedes pasar © todo el tiempo jun— E 1 os l,18
266.67,649.0,79.0,22.67,90.33,necesita su momento a solas. Respétalo.,18
324.36,1496.73,107.18,39.27,83.64,tabla de recomendaciones te ayudará a guiarlo mejor en la vida,18
293.24,1855.98,70.18,24.24,88.86,"apá y mamá siempre bus— harán la felicidad de sus hijos. Podrían hacer cualquier cosa para evitar que suíran, incluso sobreproteger— los y resolverlos sus problemas. Sin embar— go, ese tampoco es el camino. Aquí los 10 mandamientos que recomiendan exper— tos en psicología infantil para que los chicos sean",18
443.89,2384.5,62.75,26.34,82.32,"i 42 tzs. de caldo de INGREDIENTES 42 tzs. de tomate sin piel — cdas. de albahaca ni pepas, picado picada +1/2 tz. de apio picado *1 tz. de caballito italia— ++1 pimiento rojo picado no picado hoja laurel y aceite de oliva PREPARACIÓN",18
683.38,2555.75,62.88,25.5,89.0,"En una olla, cocina el tomate, apio, pimiento,",18
346.86,2562.57,64.29,24.57,91.43,dientes ajo picados tzs. de arroz cocido,18
934.5,270.0,68.5,35.5,58.25,u Peravcora ” |,18
1176.83,158.5,84.33,23.5,90.33,MARTES 4 DE AGOSTO DEL 2020,18
1064.41,592.09,60.82,28.14,87.14,a © El reparto depende— rá de la edad de cada miembro. Todos deben colaborar sin la necesidad de recibir un premio.,18
1430.7,1083.4,67.05,23.65,88.9,"atento o atenta a los silencios de tu pequeño. A veces, esa actitud puede alentarte de algún problema o cambio.",18
1937.4,370.0,46.8,29.8,89.4,© No dejes pasar la,18
1970.33,434.33,48.83,24.67,89.83,bar cada logro de tu niño.,18
1968.25,471.0,74.0,22.5,91.25,Sigue animándola en ese,18
1825.78,1407.21,66.01,24.06,88.4,".Lo amarás sobre todas las cosas, Conoce a tu hijo y acép— tal con sus errores y virtudes. . Demostrarás tu cariño, Pue— de ser a través de abrazos, besos o palabras de elogio. . Educará con respeto. Para hacerlo utiliza el sentido común y el sentido del humor. . Pondrás límites. Esto hará que aprendan a respetar las normas de convivencia de la casa y de la sociedad. . Pasarás tiempo con él, Esta es la mejor forma de fortalecer los vínculos afectivos. .Lo escucharás, Habla con él y asegúrate de que puede contar contigo si tiene algún problema. . Estimulará sus capacida— des y su autoestima. Ayúdale a descubrir sus capacidades para que pueda sacarles el máximo potencial. . No lo etiquetarás. Si lo haces, solo le crearás com— plejos, debilitará la confianza en sí mismo y limitará sus aspiraciones. . No lograrás a tu hijo en yano. Resalta sus logros, pero también hazle ver sus errores para que pueda corregirlos y ser mejor persona. '| 0 No lo sobreprotegerás. Deja que viva sus propias experiencias, está bien que lo guíes, pero no le resuelvas sus problemas.",18
1426.0,2208.0,96.78,39.11,62.0,It Bola As _ Arroz al homo con verduras,18
1097.87,2414.48,55.52,24.0,86.52,"laurel y sal a fuego len— to por 15 minutos. Añade el ajo, arroz, caldo calien— te, albahaca y zapallito. Mezcla bien y vierte en una ee i sl con aceite. Lleva al hor— no medio hasta que segue. Acompaña con pescado o pollo al vapor.",18
2220.6,948.8,50.4,24.6,71.4,Gs Pediatra — CM 18361,18
2257.12,1825.46,69.29,25.25,85.53,"© Con la pandero (F E ie a E es el retraso que puedan estar teniendo nues— tros niños al no acudir al colegio. Es evidente que cuando los chicos regre— sen a la escuela estarán menos preparados que si hubiesen seguido acu— siendo a clases, pero mejor presentémonos ¿cómo podemos pro— verles de experiencias educativas en las cir— sustancias en que nos encontramos? Encuentre en el quehacer el la ee a a des para enseñar cortesía, a esperar, a compartir, a apreciar el tiempo, a dís— a Z cuando salgan, teniendo charlas sobre la vege— tación, los animales, la salud. Lleve cuentas sim— ples, haga mediciones, deles responsabilidades que puedan cumplir, inte— rselos en la lectura y jueguen mucho. No se sienta culpable si resulta muy difícil, sim— clemente aproveche las oportunidades que se presenten. Los niños sabrán recuperar el tiempo posteriormente, socializando y esfor— zándose.",18
1348.0,160.5,88.67,23.5,91.17,MARTES 4 DE AGOSTO DEL 2020,19
958.0,260.0,247.25,38.0,72.5,¿CUIDA TUS INGRESOS MENSUALES,19
1066.0,508.43,363.57,153.86,73.14,Que las compres online no afecten tu,19
1109.55,1162.91,124.18,38.73,89.45,de adquirir algo pregúntate si realmente es necesario en estos momentos,19
1472.46,1263.19,62.27,24.96,80.54,"© Las transacciones por internet ayudan, pero la idea es que gastes lo ee e a una laptop para tu trabajo remoto es una adquisición ea",19
1832.26,830.62,121.88,27.83,74.28,"compras porin— terne tse han ”disparado” alternativa pormu— caos motivos: seguri— dad, rapidez, comodi— dad, disponibilidad, en— tregua domicilio...Sin embargo, muchas perso— nash an empezado a ad— quirirartículos por es— tavía, sinconsiderarmu— caosusituacióneconó— mica. ”Sedejan llevar porlas ofertas y sienten bien— estatal hacerlacompra. Sinembargo, al final so— loestánperjudicando sus finanzas personales y familiares”, señalóJor— geLuisOjeda, docente de la Facultad de Negocios Pídela Universidad Pe— ruana ciencias Aplica— das (UPO). PIENSA, LUEGO COMPRA Para quelcomprason— linen perjudiquen tus fi— nanzas, toma en cuenta losiguiente:",19
2312.5,159.25,49.0,23.75,57.0,H HAAA V 19,19
2235.96,972.31,137.41,27.02,77.8,"Reflexiona hacién— detesta pregun— ta:¿Realmentenecesi— tocomprarlo? Sincero conturespuesta,noteen— gañes. Tu bolsilloserá el afectado. Olvídate la frase: *prontoregresare— Na— da seráigual, poreso mi— deus gastos porqueaún es una incertidumbre nuestraeconomía. En vezdecomprar, ahorra;asíseapo— quito. Es necesario tener un fondo prevención parausarloencasodeen— enfermedad o desempleo. Olvidatedelatar— jetadecrédito.Sino puedes con la tentación, desactivalaopción com— praseninternet” para que notaste demás.",19
203.5,153.25,55.75,40.25,73.25,2 — (AL DÍA),2
508.0,376.0,175.0,62.5,76.75,CRÍMENES SIN RESOLVER (1),2
499.66,1310.22,68.19,23.96,88.67,"is amigos periodistas, el fotógrafo Gary y el redac— tor *Barney”, llegaron al restaurante y se llevaron un cau—cau con amorcito blanco y su roc o tito molido. ”María, las crónicas sobre ”Crímenes sin resolver” están dando la hora gracias a las invalorables historias del legendario periodista de policiales ”El Sonámbulo”. Lo encontramos en su cubiculo con su gabán gris y su cigarrillo en la boca. *Coleguitas, tal vez uno de los más famosos casos sin re— solver fue el brutal asesinato del multimillonario pesque— ro Luis Ranchero Rossi, la madrugada del 1 de enero de 1972. Fue un caso tan mediático y misterioso que nueve años después su el cineasta tacaño Francisco Lombardi, presentó una película ”Muerte de un mag— nate”, basado en la novela de Guillermo Thorndike: ”El caso Ranchero”. El periodista *Iechucero” se detuvo para encender otro cigarrillo: que había ingresado a estudiar Perio— mismo ese año de 1972, cuando mataron a Ranchero Rossi, el ”rey de la pesca”, dueño de conservaras y fundador de diarios. Era tal vez el hombre más poderoso del país, pues sus empresas de harina de pescado le redituable millones de dólares en la época del ”boom' en el mundo. Esa trágica noche, Ranchero, de novio con la guapa Susa— na Cabieses, recibió el nuevo año y cenó en la casa de su pareja. Quedó con ella en pasar todo el primero juntos y se retiró solo a su residencia de Chaclacayo. Pero eso era un ”tango”, en su casa lo esperaba su bellisima y sensual amante Eugenia Sessarego, quien trabajaba como su secretaria ejecutiva. Pero al ingresar se dio con una te— crible sorpresa. Según el testimonio de Eugenia mientras esperaba a su amante tomando un trago, irrumpió en la sala el hijo del jardinero, Juan Villa Carranza (20) qu¡en la mandato intimidándola con un cuchillo. Luego esperó que llegara el empresagio y, amenazándolo con una pis— tola, también lo amordazó. Después lo asesinó a golpes y cuchilladas, mientras que a ella la violó. La justicia conde— nó tanto a Juan Villa, como autor material, a veinte años de prisión, y a Eugenia, que pasó de víctima y testigo, a cómplice, pero cinco años después salió del penal ”San— ta Mónica? gracias a un indulto del presidente Francisco Morales Bermúdez. Pero siempre quedó la duda de que Villa, que era pequeñito, no pudo matar solo a Ranchero. Cuarenta y cinco años después del crimen, la periodista Sonia Goldenberg sostuvo que el magnate fue asesinado por una mafia de nazis debido a una presunta delación del empresagio a un criminal de guerra, Klaus Barbie, quien se escondía como las ratas en la casa de un vecino del em— presagio en Chaclacayo. Me quedé corto, muchachos, ma— gana continuamos con este misterioso caso y más de los nazis”. Pucha, el señor Sonámbulo siempre cuenta buenas historias. Me voy, cuídense.",2
1176.83,158.5,84.33,23.5,91.83,MARTES 4 DE AGOSTO DEL 2020,2
1513.06,934.17,74.31,29.75,86.56,"pt Pandemia causa angustias Ve oportunidad de trabajo €) Estoy muy preocupada porque los (D En casa, mi esposa y yo realizamos tele— expertos en salud advierten que aumen— trabajo a diario, así que hemos tenido",2
1188.0,1078.4,67.11,24.34,88.91,"harán los contagios de coronavirus, pero los hospitales ya están colapsados el camas disponibles para más enfermos. Ten— go conmigo a mi madre, que es mayor, y vive con un miedo permanente que me preocupa.",2
1346.6,1224.4,83.0,25.2,81.0,Celda Domínguez Vecina de Pachacamac,2
1175.35,1406.82,65.18,24.41,90.32,"En esta pandemia también están aumen— tando los casos de estrés, ansiedad, pánico y hasta ideas suicidas. Muchos requieren ayuda profesional, por lo que el Gobierno debe centrar su atención también en este aspecto.",2
1459.0,2070.6,51.6,23.4,57.5,Director — Contenido elaborado_ — Fax: 311—6353. a e Carlos,2
1400.77,2147.23,46.85,29.0,48.62,"A [ es mo Espinosa — no 171 La Victoria, Lima t e",2
1778.55,1064.33,66.18,23.79,90.18,"que comprar sillas giratorias con ruedas, un escritorio más y otros artículos de oficina. Creo que la fabricación y venta de estos pro— ductos es una buena oportunidad de trabajo para muchas personas.",2
1785.48,1396.34,59.24,26.48,80.83,"En las grandes crisis siempre existen opor— tunidades, Solo hay que analizar la nueva ta e d e ea muchos peruanos padecen, pero hay que seguir luchando con optimismo.",2
2259.65,389.45,64.48,31.26,78.03,"TWITTER Ojalá aprenda estalección, l e por un par de tragos es una estupidez monumental, a lo mejor te dan chamba en ese club donde reciclan borrachos. o a d e",2
2270.75,658.83,64.83,31.83,90.33,El Diego y Cueva cantando una de Todo Centella en el camerino,2
2168.0,792.0,139.75,23.5,90.25,©pasededesprecio PASE DEL DESPRECIO,2
2275.26,1042.22,53.56,29.11,85.37,¿Está de acuerdo que el club Sporting Cristal haya separado a Ray Sandoval? ¿Cree que los militares deben seguir en las calles para enfrentar a la e,2
2217.2,1247.8,103.2,37.6,73.0,……I 98% INO2% EL DÓLAR,2
2260.45,1683.41,83.45,24.55,71.14,OEBEERGENCIAS E l o Emergencias 105 115 Águilas Negras 3623277 Escuadrónverde _ 4276904 Luz del Sur Semanal 0 ee l 2247777 PUTT,2
2272.0,1946.75,74.25,24.5,45.5,s e 1APROMOC[ON 11ÁMENOSAL,2
2114.79,2064.43,39.21,23.71,82.43,Ingreso en la Planta Dando de Empresa ... Hecho el Legal en la Biblioteca,2
1934.43,2098.29,53.86,20.29,75.43,Editora El Comercio SA. Jr. Paracas t,2
2288.71,2116.86,68.14,35.29,81.0,Los artículos firmados y/o de opinión ie,2
2034.33,2174.0,47.44,24.67,77.44,"Prohibida su reproducción total o parcial. — sus autores,",2
1176.83,158.5,84.5,23.5,91.67,MARTES 4 DE AGOSTO DEL 2020,20
963.29,624.57,71.14,45.14,59.71,S 1 5 IQ'S MÁS ( TODOS,20
1180.5,628.0,72.5,40.0,47.5,"et NK""“' '»|l !.N S el",20
485.4,1275.25,55.92,23.45,90.62,"empezó a hablar con más de tres años y sus padres pensaron que algo le ocurría a su pequeño Albert. Aunque no tenía un pelo de tonto, para desesperación de sus profesores, era un niño vago y no un buen",20
1055.03,1268.55,61.34,24.29,90.74,"Albert se pasaba todo el día mirando la brú— jula, admirado de que hubiera una fuerza tan grande que hiciera que la flecha siempre apuntara hacia el mismo lugar: el norte. Desde ese día empezó a mostrar interés",20
1723.5,717.67,59.0,19.5,88.0,Encierra en un circulo los artículos que se utilizan en un laboratorio.,20
2241.0,612.15,63.31,28.31,78.15,Lee bien la información que sale en esta página y ( ea preguntas:,20
2200.6,839.4,72.3,25.3,72.6,"|. Albert Einstein fue un E .B, Científico. C. Comerciante.",20
2214.84,1149.47,61.79,24.79,76.26,5 — Modestia que se usa a modo de_ _ _ por acabarse E 1 B. Arrogancia C. Desprecio',20
1213.21,1482.87,60.77,24.58,85.05,"E a por la ciencia, aunque en clase se seguía la Cuando un — ¡Albert! ¿No has hecho las tareas?, le decía — aburriendo. —— )volcán b su maestro viendo su cuadro en blanco. — ¡Todos los niños han pasado de curso, Contra todo pronóstico, ese niño que para . /activo puede: — ¡No me gusta contestaba él menos túl, le dijeron sus padres disgustados. _ todos siempre había sido un mal estudiante, A. Echar humo o — ¡Tu actitud no nos gusta nada!, le manifesta— _ llegó a ser profesor, escribió artículos e hizo e Por lo único que demostraba interés ron sus profesores. descubrimientos importantes para la ciencia. B. Ser escalado. era por el violín que tocaba su Un día llegó un maestro nuevo y desde enton— — Se hizo muy famoso dando a conocer la teo— €. Arrojar agua.",20
560.25,1606.0,72.25,24.0,87.0,madre. Cuando tenía cin—,20
1058.22,1608.89,56.0,22.44,91.11,ces a Albert le empezaron a gustar mucho las,20
1567.5,1606.0,45.67,24.0,90.67,ría de la relatividad. El mal,20
1171.55,1865.92,61.58,27.91,80.6,"co años enfermó y varios matemáticas y la física. E en y — Las efímeras: días no fue a la escuela. Una mañana su padre lo llevó a su taller y era un genio. Í/ a a — ¡Mira qué te traigo, le habló de la electricidad y, desde ese mis— 1m, Albert!, le dijo su padre. — mo instante, Albert quedó maravillado de que — Autora: Marisa alados cuando t — ¿Qué es papá?, con— algo que no se podía ver fuera tan importan— Alonso alcanzan la: a ( m_ test Albert. Abrió te en la vida. oe T¡C'C©£©M el paquete y era una Creció haciéndose preguntas sobre el espa— B. Orilla del mar. brújula. cio, la luz y el sol. Adultez. .CÓMOSE ES CRIBE? ¿Por qué explota un — V U* H::'V C») M (A ll Ru > — volcán? Un volcán puede . W )'K[)j ;Qx[25li 2 estar activo o no; cuando sí N lo está puede lanzar humo MODESTIA APARTE oe el u Efímera (¡-o "")£%X&% Las erupciones volcánicas Son insectos que pasan la mayor parte de su",20
1466.16,2368.62,62.95,23.81,85.95,"ocurren cuando el magma, algo así como roca líquida hirviendo a nivel subterráneo, encuentra un punto débil o una salida, ' (cráter] por la cual atravesar la corteza de la Tierra y salir despedida a la superficie.",20
1934.34,2379.24,65.94,23.56,89.8,"vida como larvas acuáticas, pero al alcanzar la adultez se convierten en insectos alados y viven mi poco tiempo [incluso horas), el necesario para su reproduc— ción. Se aparean en pleno vuelo y, al terminar, el macho muere. La hembra pone huevos inmediata— mente en el agua y también ul",20
451.26,2399.09,66.32,24.15,87.72,"La expresión está consignado en el Diccionario Fra— geológico Documentado del Español Actual [2005), de Manuel Seco, con esta definición: 'Dejando de lado la modestia. Se usa antecogiendo a una afirma— ción elogios o positiva para quien habla'” Es decir, se usa a modo de disculpa por acabarse a uno mis— mo. Se da a entender algo sin resultar arrogante. Ejemplo: Ahora el resultado, modestia aparte, es ]",20
496.0,1833.6,19.8,57.4,37.8,A o : ie 0,22
1225.2,158.6,72.0,23.4,91.0,4 DE AGOSTO DEL 2020,22
981.14,1427.3,38.35,27.96,57.32,MUSICIPIODECUBA — ELEVADOS — RASPA — SEDIRIGAA — MUSCULAR —— ENGORDEN 3 35 E & o *] 85¡% El DESCIFRAR e A fa s m F o PASAJERO gn FE < o pe uO — apocope —— cine 2 F El LID l a e:% al EF F ”. l FA 3 S FE El 2 3 F FE — ” » g a y ll 23 FINAL VERBAL © ez g + j e ea a < o 5) E,22
1546.75,1080.0,21.25,43.75,67.0,PIEDRA — HUBO DESEO,22
1879.84,1660.08,33.96,24.52,52.84,u l 3 o tel E 2 d a 32 caLzaDO MADERA ” o eg oler DECIDA gd EL F € 3 DE E ],22
1348.33,160.5,88.33,23.5,91.0,MARTES 4 DE AGOSTO DEL 2020,23
1114.44,515.25,75.83,24.35,88.86,".. ¿3 FABIANO (59).— Querida docto— $ ra Carmen, soy un hombre que ha ganado mucha experiencia con los años, pero que no ha tenido suer— te en el amor. Mi más grande temor es no tener una pareja que me quiera y me cuide. Tal vez le parezca infantil lo que pienso, creo que la soledad es una mala compañera. Quisiera conocer a una mujer, entre 34 y 58 años, que sea emprendedora, trabajadora, honesta y tenga el deseo de formar un proyecto conmigo, una familia. Las interesa— das pueden llamarme o escribirme al: 990—524—252.",23
1715.0,569.58,227.25,43.25,50.17,"(s '£ngtardepamelamor.ngtí% — desanimesymud¡o¡uenoste 3 >. es.Pmntohallarasaesamu¡et,rse losenecesitaeldeseodeenama;g yveoquetúlotienes£st9ysel;3dama quemuvpmntoconoce¡as; quedaráfeliddadan¡da. 1",23
602.3,839.0,132.5,33.8,81.6,"CARTAS: Jr. Jorge Salazar Arroz 171, tercer piso, Lima13. doctoracarmendi©trome.com",23
653.88,1038.05,61.78,29.65,78.08,"$¿QUE SIGNIFICA TU NOMBRE? P SOFÍA ff'£l japonés H305hi Utloú”*Sabiduría”. De origen griego. Es una A.<_da es el coleccionista 53 mujer apasionada en las cosas que artículos del famo— hace y, por eso, es común que dirija cual— — 25 anime 'Dragon Ball, quier proyecto en su trabajo. En el amor es — go Libro de Récords (A ds",23
730.77,1138.69,45.54,25.46,60.62,e d ee e ese . Tiene más de 10 mil figuras id,23
1602.8,901.2,98.0,32.8,81.2,&UN DÍA COMO HOY 1972,23
1576.0,1057.08,66.15,26.77,82.85,"'Nace la cantante española Eva Amaral, conocida por interpretar el tema Te necesito”",23
1516.67,1140.67,27.83,23.33,71.33,. — Junto a la banda,23
1271.8,1247.6,223.2,54.4,88.6,LA BIODIVERSIDAD O DIVERSIDAD BIOLÓGICA,23
1043.85,1925.13,25.56,28.65,77.12,| » Lo L O N E S E S |5s = kal F S V D F T V E V Z O N Ro O T N E L = N 0 C A L S Z G Y Z U F A Z Y D A S G F S X B R O R C Y N E C A N C Z E S A S A E y kal | V E L F E S A M A D A S S D uU 0 S N = = y a A F T E S O E A A D S N 0 D = S M X A V T M V Z V N F C V Al A— M — A o 3 T V F | | . E D A A R E S T 0 M C D _y V Y — Z | V V Z E T P E A Ro A L E Ro L D N o T A A 0 E D E S D A T L V L 0 D E — y | 3 y U kal Ro Ro L | A N T S E F E S D C E Roo D — A E Ro D S L S E D E R A Y E S C A | | 3 3 | S C E A A O C R B L O R uU A D C D L o y y y | A | C S A E D E N Ro L E C A E 3 V y | A S AT E F U V S G E E P C | . | y F A D Z W F F Q F A Z T F S S C N E F A A Z S Ro D V Z A V N Z E F A Z S | C Z A Z Z V A_W F A Z | A A A M P o | A V — Z A V V V F L a a a GENETICAS la ei l3 UNA EVOLUCIÓN CADA —*CON EL ENTORNO ©*DE MILLONES *Y ENTRE ELLAS. LA FORMAN. SUS MUTUAS,23
2253.35,380.6,56.8,22.1,80.15,"e o ?MARIES: Las cossaean a lle— 1* gar, no te desesperes. Cui— dado con lo que dices, escucha consejos.",23
2291.16,533.11,48.63,29.37,57.58,e d n a %deddo para siempre l es a ir ayuda. Cuentas con un gran bl E e,23
2280.93,665.6,47.6,24.4,71.27,no GEMINIS: Planifica bien tu . i ese que todo salga bien. Tu familia te,23
2264.67,809.83,57.67,24.92,83.08,"a : para dar, solo es cuestión de esfuerzo. Una persona del",23
2237.0,855.6,109.4,28.8,88.0,sexo opuesto te está buscando.,23
2276.91,940.36,68.82,22.55,73.09,LEO: Necesitas expresar lo que sientes. Alguien espe— E a EE,23
2283.56,1088.75,69.69,24.31,89.38,Si pones muchas ganas alcanzarás lo que tie— nes en mente. No hagas caso a gentemalintencionada.,23
2236.72,1230.56,62.89,24.33,77.78,1 LIBRA: Pueden presentarse / Conflictos enel hogar. Nece— citas aclarar algunas dudas res— pecho a tu pareja.,23
2256.8,1367.55,43.8,20.75,86.45,"* , A veces te — < por cosas que no están en tus manos, relájate. Llega una buena notica.",23
2275.75,1512.45,49.85,21.75,88.0,Te sientes :. *> atado por algo y eso no es bueno. Necesitas darte un tiempo para ti. Respira hondo.,23
2250.33,1637.0,118.22,26.78,65.67,"EAPRICORNIO: Evita hacer comentarios inapropiados, E¡ndrías e ea armonía.",23
2226.28,1788.67,57.28,25.22,74.89,"a n o P “'xtran?uilidad y mucho tra— bajo, se llega lejos. Encuentras un motivo para ser feliz.",23
2250.82,1908.29,73.59,28.35,82.76,"£* Tú vales porlo que ""J eres, no te dejes sorpren— der por gente oporiunista. Sien— tesganasdehacercosasmuevas.",23
1395.83,204.67,68.17,27.33,81.0,©S 4 DE AGOSTO DEL 2020,24
