left,top,width,height,conf,text,page
1554.86,653.14,53.61,31.89,80.93,". EL ESPA— del Arsenal, — también ganó pie como capitán Fel equ¡go 2014 y 2015). PORTO ALZO la *Copa Portu— al' al vencer —1 a Benéfica EL",18
1569.67,1039.67,67.17,36.33,64.17,and la 'Copa Mr %íe0rrotando o,18
2035.05,611.91,65.31,26.62,86.44,"IMMOBILE GANO 'BOTA es PARA LA CRISTIANO (<$ Napoli.— Cristiano Ronald quedó sometido a Ciro Immobile, quien se llevó la de Oro'. El italiano marcó en la caída 3—1 de Lazio contra Napoli y alcanzó 36 goles en la temporada, cinco más que ”CR7” [que no jugó en la derrota 3—1 de Juventud ante la y le sacó dos más al polaco Robert Lewandowski [Bayern). Immobile Cual la marca histórica de Gonzalo Figurín en la Serie A",18
2021.45,779.4,45.1,24.1,88.5,"016) y le volvió a dar a Italia el trofeo de artillero, tras 10 años en 'poder' de España. [<]",18
1891.93,1027.0,57.2,24.57,89.02,"((a Bérgamo.— Una historia a lo Toño' Centella. El eslo— veno Josip ilicic (32), figura del Atalanta, estaría cerca de dejar el fútbol debido a una profunda depresión. Según medios italia— nos, el atacante viajó a su país para ver a su familia y habría descubierto a su esposa con otro hombre. El artillero, quien le",18
1997.32,1216.95,71.84,24.37,77.21,"h m ESPOSA HABRÍA hizo cuatro goles al Valencia en — INVITA octavos de Champions, esto — GOLEADOR DE",18
1953.62,1271.75,65.12,24.62,78.62,ausente ayer en la derrota 2—0 — ATALANTA,18
1940.85,1330.2,56.15,30.4,83.45,ante Inter y tampoco jugaría los cuartos de la Liga de Campeo— MU EIR E nes ante PSG. [<] A|R,18
222.2,198.8,62.4,43.2,70.6,2 — (AL DÍA) ie,2
517.56,1305.86,59.37,23.98,89.2,"1 Chato Matta llegó al restaurante por una casita rellena un estofado de pollo parte pierna con papita amarilla y roc o tito molido. ”María, me llegó un mensaje por ”wasap' del gran Pancholón. 'Chatito, baja urgente a mi casa, toda la vida he sido callejero y esta pandemia me tiene como loco'. Re— cortó que el año pasado estuvo a un paso de la muerte, en cuidados intensivos y entubado. 'Abrí los ojos y esa luz blan— ca me hizo ver mi vida como una película. La enfermedad me agarró con los bolsillos vacíos. El colon, la la próstata, el corazón y los triglicéridos me tumbaron. Mas de 30 años de interminables amanecido a puro ron, pagándole la juerga, tra— go y la comida a tanto oportunista que se sentaba a mi lado y ahora estaba más solo y mismo que el 'Chavo del 8'. Ya perdí la cuenta de las mujeres que pasaron por mi vida. Te voy a dar las copias de mis memorias para que se las des a un escritor, puede ser Renato Mineros o Jaime Bay!ly. Hasta un produc> tor gringo me ha llamado para una serie de Neelix sobre mi vida, que sería más vista que 'La casa de papel' o Si en mis tiempos hubiera existido ”Esto es guerra' o 'Guerreros de México', yo estaría en lugar de Porella o Guty. Viene un chico sano, universitario y me pegunta qué pienso de lo que está viviendo el chiclero Todo Centella. 'Hijo —le dije— hay mucha gente que está confundida, pero yo tengo las cosas claritas... Una cosa son los detalles que tengas con tu pareja, regalitos y viajes que nacen del corazón, y otra que ten— gas que comprar caricias, besos y frases fingidas. Un ”te amo', ”te quiero' no valen mil, 100 mil dólares ni un millón. No creo en las relaciones de muchos años de diferencia. Cuando avanza la edad y te toman la presión todas las noches, ahí te arre— sientes de las malas decisiones. Tú enfermo y ella enterita. Es mejor esperar la vejez y contratar a una enfermera que tener al enemigo, al diablo a tu lado. Soy de la vieja escuela, de esa especie en extinción que ahora los modernos llaman 'cavemí— colas'. El amor crece solo, nace solo, es face to face. ¿Ustedes creen que un amor verdadero puede surgir de dos compu— adoras o dos que se juntan por necesidad o soledad? Para mí los Tinder y esas páginas solo sirven para ”Timpieza de cutis” y los sosos que se quieren engañar. Ahora estoy solo, pero con el amor de mis hijos y mis viejitos. Ese que no es interesa— do. ¿De qué valen todas las juergas que viví? ¿Dónde están todos esos hinchas y camarones que me pasaban la mano? Notaba la plata que ganaba en la radio, miles de dólares. Cha— to, la vida te enseña, la mujer que vale, así como está contigo en los cruceros por Miami y hoteles 5 estrellas, cuando estás postrado en una cama, si te ama, tiene que limpiarte el popó, alcanzarte el papagayo y dormir en un sillón a tu costado. No estar haciendo números a ver si te mueres. Agradezco todo lo que me ha pasado porque me ha quitado la venda de los ojos. Lo bueno es que ya estoy mejor. Volveré a ser el ”tigre' de toda la vida'”. Pucha, ese señor Pancholón es un caso. Cochino y sinvergúenza. Me voy, cuídense.",2
1199.33,158.67,88.17,23.33,91.17,DOMINGO 2 DE AGOSTO DEL 2020,2
1183.25,1047.33,96.67,29.0,81.33,HABLA TOMIE Extraña salir en familia En mi familia teníamos como costumbre,2
1203.0,1210.7,60.02,24.05,87.37,"€D salir por lo menos una vez al mes todos juntos. Ibamos al cine, a restaurantes, cen— tros comerciales y otros lugares. La verdad es que extraño todo eso. La pandemia nos ha golpeado en varias formas, solo espero que esto acabe pronto.",2
1384.6,1389.6,47.4,28.0,71.6,E el Vecino de Magdalena,2
1237.63,1554.24,65.58,23.76,87.55,"Comprendemos al lector, pero las circuns— rancias actuales nos obligan a tener una ”nueva normalidad”, donde el uso de mascari— llas, desinfección y distanciamiento social son obligatorios. Cuando llegue la vacuna, tal vez regresemos a lo de antes,",2
1802.15,1150.88,65.76,26.83,90.05,"Recuerda visita a Macho Pinche (9 Días atrás, leí en su columna que El Búho había visitado Macho Pinche en el Cusco y había quedado fascinado. Yo también estuve en la Ciudad Inca y con— cuerdo con sus palabras. Sencillamente es",2
1742.2,1281.0,66.0,27.2,89.3,hermoso y hace que hinchados el pecho de puro orgullo.,2
2022.33,1386.33,38.0,26.33,50.33,Marlene Mora Z. o Rs nl,2
1788.62,1550.0,58.36,24.82,88.0,"$3 En julio del 2007, Macho Pinche fue elegi— da como una de ”Las Nuevas 7 Maravillas del Mundo Moderno'. Hasta antes de la recibía a millones de turistas que quedaban fas— citados por su majestuosidad. Otro motivo más para sentirse orgulloso de ser peruano.",2
1398.36,1854.48,88.84,33.36,89.56,”Creamos desigualdad entre nosotros mismos sí termina— mos recomendando que solo pueden cobrar (por gastos de instalación) los congresistas de provincias y no los de,2
1398.14,1972.86,112.57,31.29,76.0,MIGUEL VIVAN REYES (CONGRESISTA DE FUERZA POPULAR),2
2259.76,565.64,86.24,28.83,83.81,"en Lima Prefieren que la gente se mueraacá antes de tomar medidas concretas. Y con estas cifras piensan abrir gimnasios, bares y cines. ©amigoperuz6 WALTER MENENDEZ ConBengoechea no jugaría Gonzalo Sánchez, preferiría utilizar un falso 9 antes que un juvenil. ALEJANDRO DEL RIO",2
2275.77,999.23,50.15,25.69,91.23,¿Cree que el Congreso le dará la confianza al Gabinete de Pedro Cateriano?,2
2277.33,1138.0,61.67,32.0,81.44,"¿Aprueba la gestión del ministro de Defensa, Walter Martos?",2
2262.8,1740.6,85.23,24.0,72.7,©EMERGENCIAS la 113 Emergencias 105 Defensa Civil ] Salud Águilas Negras e Escuadrón verde 4276904 Luz del Sur 6175000 3178000 Indecopi A ©ALO TOME e ie LA PROMOCIÓN LLAMENOS AL,2
1842.01,2113.35,51.96,26.89,68.26,"Director — Contenido elaborado — Impreso en la Planta Dando de Empresa .. Hecho el Depósito Legal en la Biblioteca E E ea a ta a $0(a El Comercio SA.JF. Paracas Nacional del Perú No2001—1992 Eo]&n$€aséa o m—""o… i a E a ei Espinosa — No T1 [3 Victoria, Lima — _ 10005 5 derechos reservados. son de exclusiva responsabilidad de Olnay — Teléfono: 31—6500. Publicidad: 708—9999, — Prohibida reproducción total parcial. — susauteres,",2
947.1,582.31,82.1,26.21,85.96,"1 wifi A i Conejos Idewificción No se deben bañar, El perro debe que los ayuda a mantener la ellos mismos dedi— tener una identi— energía. Una dieta equili— can mucho tiempo a su ficción externa: un propia higiene. En caso collar y una placa que que se de que esté muy sucio, incluya su nombre, man— hazle una limpieza en dirección y número tengan de teléfono. sanos. P — PA EXPERTO ACONSEJA DARSELO SANCOCHADO Y NUNCA LIGADO",20
215.42,1337.33,116.83,39.17,85.0,"Ses una gran fuente de proteína, pero no reemplaza al alimento balanceado",20
301.26,1870.89,75.22,25.0,89.26,"Existen perritos que © son alérgicos al pollo y sus derivados, por eso tienes que verificar qué componentes contiene su alimento balanceado para que no corra riesgos.",20
213.94,2448.83,136.11,29.5,78.94,"Envíalafotodetu mascota para que forme parte de nuestra TROMEATROME.COM DIRECCIÓN: JR. JORGE SALAZAR ARROZ No 171 URBANIZACIÓN SANTA CATALINA, LA VICTORIA TELEFONO 311—6500",20
1199.33,158.33,88.0,23.67,90.83,DOMINGO 2 DE AGOSTO DEL 2020,20
688.25,937.0,290.0,166.5,58.25,G &o)é» » POLLO?,20
633.0,2252.53,64.94,23.71,90.41,pasear y cuando hago mis travesuras mi familia huma— na no me dice nada porque me resiento.,20
733.12,1605.65,69.37,24.26,89.88,"cuando estamos comiendo un peda— zo de pollo y nuestro el siempre escucha— mos decir a alguien: 'Dale un poquito, no seas mala'... y de seguro lo has hecho, ¿pero realmente estamos hacien— do bien en darle ese poquito? ”No es malo darle pollo a tu perrito porque es una gran fuente de proteína, pero hay que tener mucho cuida— do en que se mala costumbre y quiera comer únicamente eso, porque jamás reempla— hará al alimento balanceado que necesita para crecer y desarrollarse bien”, advierte el médico de Acet Veteri— naria, Anhelo Centeno. Ante esto, el especialista",20
872.18,2153.76,67.53,27.06,89.59,"Juguetón Hola amigos, soy Luna. Soy Mayo, un lindo Me gusta jugar, salir a cachorrito juguetón y",20
1066.0,2249.84,59.58,24.26,90.0,"muy comelón. Soy el engrei— do de mi casa, mi familia me ama mucho y siempre me compran juguetes.",20
1826.57,1283.4,69.82,23.46,88.89,"brinda las siguientes recomen— naciones si quieres darle ese alimento a tu mascota: , Preferible san coch ado y sin ningún tipo de aderezo. Quítale la granita y los huesos. , Nunca el higado. Ofré— cele pechuga y patitas sancochadas, estas aportará colágeno a su organismo, pero no el higado porque podría desencadenar problemas 1 , Dale pollito como pre— mio. El mejor momento es después de un buen compor— tamiento. Así entenderá que es un premio y no su alimen— to diario. , Deshilachado, Si quieres incluirlo en su dieta diaria, deshilachado y mézclalo con su alimento balanceado para que coma todo junto.",20
1817.24,1874.71,89.41,25.06,89.06,"RESORTE Para evitar complicaciones, consulta con un veterinario antes de darle un nuevo alimento a tu mascota.",20
1684.16,2209.61,62.61,26.89,82.16,"Renegada Viejita a ga ee a Yo soy Solita y tengo 10 © a a y pequeñita y un poco años. Me gusta mucho renegona, pero mis papis pasear y soy muy tranquila. me tienen mucha paciencia. _ Tengo varios amigos en el Ellos perdonan tortitas mis _ parque y mi papito siempre travesuras me cuida mucho.",20
2208.5,1068.0,116.75,41.25,87.0,ELAMOR A LOS ANIMALES,20
2271.02,1798.21,63.75,23.89,88.52,"GD Esta semana que— damos estupefactos con las imágenes de un voraz incendio que dejó al menos a 60 familias dam— unificada en el Cercado de Lima. Felizmente, no hubo víctimas mortales que lamentar. Más de doscien— tas personas quedaron sin hogar y están a la espera de ser reubicadas. Sin embargo, en medio de las llamas aparecie— ron algunas postales de esperanza. Y es que las cámaras de televisión captaron imágenes de un niño cargando en sus brazos a dos cachorritos para salvarlos del fuego. El niño corría precedi— do por su madre y decidió arriesgar su vida para sal— EE E Esto nos demuestra la pureza del corazón de los niños, que no dudan en ayudar a los seres más vulnerables, a pesar del peligro. En estos tiem— pos en que vemos con impotencia cómo hay personas que luchan con la enfermedad y el dolor ajeno, este niño nos da una lección de valentía y solidaridad. ¡Aprendamos lr",20
1585.12,160.12,105.25,25.62,90.88,DOMINGO 2 DE AGOSTO DEL 2020 (ESPECIAL) 21,21
1051.27,413.27,59.91,25.09,74.18,[ zapatos. Rocía la i e solución de agua y lejía.,21
1684.9,436.8,57.3,28.0,67.4,Recuerda que la distancia mínima es ( a et 0,21
761.75,1269.5,306.75,105.5,80.75,Toma precauciones si vas,21
565.0,1407.0,147.75,91.0,85.0,a a tu familia,21
530.55,1564.0,142.73,47.82,83.64,Es primordial que respetes las medidas de bioseguridad para evitar contagios,21
639.03,2177.97,64.0,29.56,76.35,Cubre todo el No descubras mentón. la nariz. a e g puede limpiar con toallita No dejes espacios Note la pongas en Usa protector facial y :Ij£bóandeñm descubiertos. la barbilla. e ra l usarlo,21
288.25,2509.0,61.5,32.0,39.0,a considerado un ajo,21
1921.27,1228.51,57.81,24.62,81.11,transmite de persona a ppersona. contacto físico. Lo mejores que no o dd familiares. Salúdalos por teléfono E l a Ho es seguro saludar tocándose los puños o codos. Todos los miembros de la familia deben usar,21
2151.2,1647.8,81.2,31.4,86.2,mascarilla. Los visitantes y anfitriones.,21
1889.17,2199.92,52.31,28.94,83.69,= £ E $ FE El E — k Trata de instalar un perchero para dejar las El agua y jabón desactivan el virus. Es la manera carteras y casacas. más segura y sencilla de eliminarko. Lávate bien las manos _ Con agua y jabón por lo menos durante 20 segundos. Relájate bien — Utiliza Frota las El dedo — Entrecruzan — Los nudillos,21
1893.6,2549.0,60.7,34.7,75.2,las manos jabón palmas Ia los dedos — decada mano,21
270.5,2139.83,133.17,62.67,67.67,0]M|?W[CF N NESTY SE e IMANERASANA,22
269.45,2358.27,133.0,69.73,52.64,LA o]$W©… JAU € 0) |Í]rx /L/W& Qur l TERCERAS %(0]NMX5,22
441.5,355.42,108.5,52.58,52.42,"MM s | /X|_ííll%'$ | (©AIIIE%£%IW , — E g5fggm“£ rt m¡*a&©abwñ¡¡",23
223.09,905.73,113.09,72.27,48.45,/Nuávu | g& JJUIQF…HA 3 l… |Mi'£Wí£ñ… oi_JTIQ;4VAX '1MYNLJD… O i,23
260.0,331.17,72.17,57.33,52.5,* ( fa p a mujeres,24
352.6,915.62,60.34,25.64,86.71,"Porce— lla, en un vivo que hizo con la cadena Unimos de Estados Unidos, que le gusta reveló que prefiere a las |mujeres con ce|¡ráctery que ie ee al o 'marquen' al M ! ”Todo <3ntra por los ojos y me gustan las mujeres guapas, de buen cuerpo, no tengo preferencia por las rubias o las morenas, pero debo confe— sar que me gustan cuando me controlan, llaman y preguntan qué estoy haciendo”, dijo el 'guerrero' que recalco está soltero.",24
284.52,1869.5,68.29,25.03,81.16,"e ea © lito Barraza cuenta que ahora se baña en alcohol e ”Los contagios aumentan cada día y hay que tener mucho cuidado, ahora me baño en alcohol como medida de preven— ción”, dijo. Además, reveló que desde el lunes volverá a los escenarios en la , cadena de restauran— 33Para_prevemr a e e e Canseco. coronavirus",24
348.31,2490.86,68.03,23.76,89.24,"Ney Guerrero se recuperó del coronavirus y, aunque tiene algunas secuelas, está contando los días para reunirse con su hiji— ta Rafaella, a quien no ve hace tres semanas.",24
1199.33,158.67,88.17,23.33,89.67,DOMINGO 2 DE AGOSTO DEL 2020,24
1030.47,1495.45,61.1,24.35,87.8,"después de su separación de Jazmín Pinedo, con quien tuvo una relación sen— bimental de siete años, Gino Assert reveló que jamás pensó ni ha pensado en pasar a la fila de casa— dos, porque 'el matrimonio solo es un",24
977.06,1658.82,46.06,22.82,89.24,"”Si convives con una persona 7, 8, 9 o 10 años.... sea lo que sea, ya tienes",24
964.86,1710.29,58.43,20.57,88.86,un lazo amoroso con esa persona. El,24
938.7,1776.5,58.75,22.2,91.7,"matrimonio no es una muestra de amor, no es una muestra de afec— to. El amor y afecto se demuestran",24
934.39,1959.7,49.02,23.68,89.63,"día a día, en lo que le das a tu pareja y tu pareja te da a ti”, expresó el popular Tiburón' en el programa 'Estás en todas”. A su vez, dijo que a diferen— dias de muchas personas su hermano ”Jota' es el único que lo apoya en todo y no lo juzga. ”Mi persona favori—",24
1004.0,2142.0,50.5,22.0,92.5,ta es mi hermano.,24
1717.74,1480.11,62.17,24.34,89.96,"somos muy distintos, llevamos vidas diferentes, su camino es uno y el mío es otro, pero es la úni— ca persona que me comprende y entiende como soy. No me juzga y siempre apoya mis deci— siones. El y mis hijas serán mis personas favoritas siempre”, precisó.",24
1797.14,1607.71,66.57,24.86,87.86,be mencionar que el 'guerrero' evitó pro—,24
1822.23,1655.0,65.77,24.31,88.23,"anunciarse sobre el 'ampay' que difundió el programa TV: La firme', donde se",24
1806.2,1850.27,60.42,24.07,88.17,"le vio a Jazmín Pined saliendo del edifi— cio donde vive su expareja, el actor Jesús Neyra, pero aclaró que lleva una relación bastante cordial con la popular ”chinita”. ”Es la mamá de mi hija y nunca he dejado de estar bien con ella (Pined). Ya estoy acostumbrado a que se especulan cosas que no son ciertas”, señaló días atrás.",24
1715.67,2073.33,54.67,37.33,56.5,5'%(ÁUJ QUJ:: oi I! | AAA,24
1640.48,2347.39,60.42,27.87,82.03,"|U'“ow$í)) *(01H | ”Ya estoy operati— Sí, me dieron de alta el vo, gracias a Dios. Me recuperó del_ lunes y al día siguien— han quedado algunas o te empecé a laborar, secuelas como tener el ja YYO — somos obreros, es la cuerpo molido, fatiga _ a — única forma de salir y sueño, pero pronto h|]lta adelante. Lo que me",24
1381.29,2495.14,76.0,24.0,91.29,desaparecerán con las medicinas que la doc—,24
1356.6,2543.6,60.8,24.4,89.0,"tora me ha recetado”, dijo.",24
1830.79,2522.0,47.0,25.57,77.29,entusiasma es que ya podré ver a mi (6 0 a to. [C. Chévez),24
2242.81,720.72,67.24,25.2,78.31,"es| oro BARRUNTO. Lle— el el contarles las calienti— tas de 'Chollywood'... La actriz RAYA CRTE, quien interpreta a Este— la' en vuelta al barrio”, reveló que terminó su relación con SANTIAGO en la serie. Qué penita... XOANA GONZALEZ empezó a buscar ves— tido de novia para su boda con el pizzero XAVIER La",24
2243.0,1476.66,55.38,24.78,77.49,"gacha dice que a se vestirá de blan— co... La Chuecona' N y E no hace caso a las ps u 1 ea có una foto con su esposo OMAR mando que cada día lo ama más. E > DEJO anda en prefiere tener a su nue— vo galán 'bajo la sombra' para que siga haciendo méritos. Bien ahí... A pro— po, MACDOEL USAR se pateó cuando le pregun— e e su y y solo atinó a decir que no aclararía si tiene pare— ja. Hummm... ”CHROCTA'",24
2218.93,2275.35,65.63,25.17,80.69,a s a apareció con su E lee todas' y SHEILA ROJAS lo vaciló diciendo que se parecía a uno de los 'Teletub— bies'. Upsss... RIZADA se volvió ten— decia al aparecer en la portada de la revista francesa Maga— zine'. Asuuu... Somos fuga porque mi amorcito anda agility para jugar— nos una pichanguita...,24
1036.97,403.77,172.23,48.2,56.3,"(> ?3—3*IPQ'¡|'PE0 (tuvez que¡poner(de)m|lplata¡porque¡n0 .)/ hace1unos(anosífue.eleg¡da(como ./V es w¡noít¡ene, problemas st |pude]lr¿a1un(concursolmternauonal (con(elll¡|bro.que)publ|colEdgarlpaz,lres|porque&staba(enl£om?ate¿y s —. — — conmirsoe: [Í|_Q) w WÍ|KX£ lde,belleza “colgalll,rso[de IA51m|slmo¿anaá¡o(quelhene)muy¡bue 5e1que(e(lste(el|I|bro¡y¡noitengo]proelleza [ 20120 —",25
276.45,1517.66,169.07,38.69,51.79,"NManoílnvarren¡ Acomento(que(A'lePalao)no (e(pl|cac¡ones!a]nadlejde¡Io) (quetestátsurgiendotentre: tambios; |porque1los'dos. ¡smnzadultoswisolteros"" EE (golunall¡nda(am¡stad w4unzeannotenonne tampay?lNo'debe— e o ea it a lelimpor: (es!algo) (esporadlcolo pasa]erojporque(estamos. (adu|tossy¡smlteros. |prec¡so) guerreronylresalto.que¡ 5) …Grlnga(de,(Gamarra o 2 a",25
272.71,2426.57,124.57,49.57,41.57,se CT“W¿-EW en fsu l cast ta ] sls ©Vlllanueva ”Mél—,25
1063.25,562.75,148.25,37.0,57.0,"?2018,.tenla que)real¡zarllabor'soc¡al ¡perotalífinal —",25
930.14,680.29,289.0,50.57,55.43,RGIUUEM DICE CUE'U_Uwa' ©?©IW…E&M E£>”E E…£íí3€£€…”“i&í…33 ©CG]GQU,25
933.75,1529.85,196.88,43.96,51.85,"l:'-, p 2 .que(en1losxdoceranosxde) £su(esposallohana el ,1a'm_ Ie,fuel|nflel¡y(aunque, I[as¡mllar(que¡yalno) ¡son1un¡matnmon|of'el¡l/¡segu¡- lratadelante]portsus'huossyxsu¡ (bienestar:, ta en (…1tm1…mszstn& 1Tranqu¡Io¡y(enterandome¡ma9 (cosas(de_eseltema[[sobreisu[espoI y…e|£supuesto)romance conteo e ea e (z:;peroklto;'Marvm$$alas]¡ (Z£[es% 1Tei|uro¡que,hubo (gfhmuñ£nrexdu_slva? (0pantun¡dadesxy(esolla q¡[ej]d[ma%ast' porque EE muy(celosa yime: [0m¡p¿u[gnm£a%fas) llamaba t atada rate?*llbesde, (amenaziasique Ixedbe;y/ (quejestuverconteolaytnas: [go'g£n'íltdm Ue¡pqr? (casamosis¡emprelhexs¡do) ee ((F ,(dej10venítuv.elalguna1 Noltengo)pon(que!ame(escap¡dlta Lperolella(enluna",25
717.71,2025.43,147.57,34.0,53.0,arítodo*esto (d|ce…que¡sonram trata(camrespetoxy Ilama]porf elt ea (ah¡$yalhay(conf,25
1205.67,2012.78,190.56,41.22,47.0,lromp¡oi12¡anas(de¡matm' Pero)la¡v¡da[cont¡nuaxy way!a(darlemuelta[aIla|paglnalpor. |m¡slhuos?y¡porlml'IEste)martes i me no y ta ut ie [[C la,25
1350.39,2437.11,151.71,33.39,59.75,"(estresarme:;porqueícon [Detotrollado (debidojaquerdebe ¡preoesuparme:;nojgano (einco:mesestde renta. radio;localtel pagarle ”Eon latcuestióntde la isuslhonorarias: (casaya me'siento:más. tenerproblemas:conimil _ ”Siguenipasandoiles. tranquiilojporquelhabla— 'salud'_',uref in ”Melco— (comercialestdonde: pagando: todo agan”,/acotó. [F LiGamara] ©",25
1392.8,2234.0,137.1,37.1,49.5,tranquiilojporquelllególa: — (estátchévere;hablétcon_ — wtdesde:mañanajse:pre— _ _ (desalojo: Trato:dena: oe,25
2142.04,1585.8,185.28,31.67,54.7,"I delosvariosirealizadores: inacidos'a *Tarantino. Estilo |plraaon isiguióensusiprimerosffilmes: *Juegos, trampas dos'armas' humeantes'(1998) y Snatch: [2000] imedianterelusotacelerado:de la ||ngenlosos Sinembargo,llanovedad'del (est|lo%&fuaagotando es isiguientesitrabajos:Wipara icuando:diotelsalto:a Hollywood Ihabíatextraviado:ellzumbo: 8us;pel|culas isobreiSher— lockHolmes;, iconiRobert: downey Jr... isoniproductos. icomercialese, limpersonales: carney hueso— Talivezporesolle atentado la in ostalgia y i ha vuelto:aisustfuen— tanglo—estadounidense”los' icaballeros”(The;gentilemen),, icriminalllleno: de,g|ros.ylsub— S que mafioso inorteamericano!(Matthew ¡McConaughey);establecido:en pe lig rar n su l imperio ycomercializa: icióndemarihuana:, iconimuchajgracia,jun ines:— que,ha investigado'allnarco y tajada ¡parano;ponerloenevidencia: momentos la tabsurda,iperonuncajpierdefflui— delGrant,destacalla sólida presencialdeColin Farrell icomolentrenadondeportivo; i cuyos t alumnos t forman una",25
942.88,158.62,111.62,25.62,85.88,26 (CRUCITROME) DOMINGO 2 DE AGOSTO DEL 2020,26
1155.06,1407.04,38.9,28.25,59.98,MARCAREGISTRADA — TODAVÍA — RASPA — INDUSTRIA l a AGENTE — DELICADEZA (ABREVIADO) TURBINAS — (NGLES) — ¡FRANCES — [3 (en s %5 SERPIENTE DEL EL TORA LA 3 CÓNYUGE F 38 om © 32 3 2 OH 2 33 o Fel 3 ENES PORCIONES PROVINCIA ESPANOLA — o LEYES m EQ INGLES t1 £ l 2 3 A E 3 AQUI (i o F EM £ PERSONA 3 E H 2 la a y f— EFE 2 23 E %g PASTAR EL DIOSA 2 El Pv de — FE g 3 a E < SOMETIDO £ es 3 F 8 g E E SIGLAS EN o SOBRE DENOTA — DINAMITA — NIVEL — o DELETREA 25 A E s OH 5:z FE H sí a A E 35 3 a 5 : _E ],26
1747.0,362.55,104.09,32.73,51.36,"I pr 3 2 se ARIES xv.er¡guenza ra …©m l%!(espe jallparaft,faprovecha:",27
1446.2,436.2,192.3,44.1,54.7,ese I|bo)¡par¡a'¡(que.lme“ lpara¡estrechañlazos(con(tus. fa¡wudefal(encontrar|pane¡aSequenbes OH Iu¡ WE 5'(á'b|enque£X9'ooos' z,27
1327.72,998.6,121.25,39.25,58.67,"nc¡|qupoquue*lhablamosxde.[sen— [pene»fseyfalgu¡en(que1podrlal ugmn?wwowofoo e © %“""Ro'""o'teangmm [|nteresanle£a(cualqu¡erimu¡er*$$¡ ¿QTU eo M _£:3;;S£33£M893£!; |.|—n—_1P:K*_© esonoquii— ¿5,b¡eí uenesunc$mf:l?lepr D?m¿e¡d…ngo eal 1 E d p $r's'ala;aa g tusi5,glv _osl;“%' .?vaMINIS' Recuperatener C—¡/-X¡ VXg>,,,,, ro¿y¿g 3 g|asoy,(dálo)me]ar'iparatque, mX kn y $_ o“5el q ¿g m' 3 t¡estal'comolefo$ ee WD]Ú/ VV V'V—2 [una fam|l|a (en[al(g7unlmem », N a e.(a“Wlhatszph9'lZ $ e ea (>Sala2a'r(Nrabz&1r71 jtér'céír1píi…—siq:ll.'ím'a'18]=&…ll£:(die:c—tmnaíc—'a'nmnEmf&1©tro'meYc'o'm¡ :g&'oé……o'“oo” ÓfQUEESIGNIFI NIUNOMBREZ r ue TÚ UNDID?AKCOME]HW “3er e a A ©s'lml a '1955 €o'sos[enllatcom¡dalneces¡tas. Y©…A e5deel'20mN““aD ia5|ntnx¡cantuor eu ea %Tlerratde4n;|1uezas—1De¡l|oggenHatm A 23 %Zelandawentavmn€“a K ace1la¡ca|ntat|fó e e e m española IsabellPan— el M ltamblenfadoralla1t£anqullldadifamlllar45e %&*;…“Lm…_(… e 13¡%?¡%A£;5£3&m fadapta[conífac¡I|dadfa(dmrsas&s¡tuac¡o' M que ¡¡¿ug|íu'an—* 5 (como oMannero[deiluces,, |gensa¡b¡enqu |nes(que¡se1le¡puedan]presentar4£n(elfamorr 'Re%'a&(í""$to'mei…f'. 'Hgy[qu¡erolconfesanneay; 2 e ¿3%LIBRA Hay;s¡tuac¡ones'que, PROPIEDADES MEDICINALES DEL BOLDO — y , F S Y E X P E € L A R V T A N | A € F $ R Fiables pamítodo)lgorglauo— |nado'a1lo(eoonómm Excelente Wy X 8 E T © R A N G D A z W n b $ E F $ E ie",27
1124.95,1476.47,71.79,35.53,76.42,FF P R © P | E D a D E s E Y x x* 5 %¿E£?££&ogg?f¿£g; Pero¡s¡;sorynecesañas&valen1lal,27
1042.24,1537.0,33.38,34.14,81.71,L E J € B N & s x B € t E E D R W P G s P,27
