left,top,width,height,conf,text,page
1065.96,2523.48,69.52,24.52,87.65,"€$ Delincuentes arma— dos causaron pánico en una tienda de ropa urbana ubicada en San Martín de Porres, donde asaltaron a dos clientes.",4
1463.87,2520.2,57.9,23.2,91.27,El atraco se produjo en el local Urban Outlet ubicado en la cuadra 1 de la aveni— da Hábich. Los maleantes llegaron en una moto y tras esperar unos segundos,4
2180.58,494.83,226.58,30.5,67.62,"haceochomeses) y una chica subieronalcuartoqueeljo— ven al quila ba en el tercerpi— sodeuninmuebleenlaman.— zona Bdelasentamientohu— manosean Miguel. ”Tomamosunpardecerve— zasyalas10:50delanoche, poreltoquedequeda, achica sefue.Laacompañamosyno merecuerdomás. Quedé dormidoenmicama”,contó. Elpresuntodelincuentese apoderódedosmezcladoras de DJ, unalaptop,celular,así",4
1890.98,1489.25,123.9,35.56,70.82,"como tres mil soles que eran losahorrosdelavictima.Los colocóenunamochiladere— | gular tamaño y segundas 3 D imágenes, seretiróapiealas dos de la madrugada del 24 dediciembre. V fl l ”Hastaahoranoséquésus— A < a pandemia le dio el tanciamedieron.Desper— primergolpeyaho— téalastresdelamadrugada raselodioelhampa. A del25dediciembre. Comedia sus24años, CésarHua— — cuenta de lo sucedido hasta no Ricopa, conocido como el Estuve l ”DJCésarestaba abriéndose _ con dolores de cabeza y vómi— V V A""x(o:'/ D — pasoenelmundodeloscon— — tos”,precisóHuano. M 2 | |4 ) 1 ! ciertos virtual es hasta que el _ VÍAFACEBOOK m y taxi sta que lo transport aba Según el agraviado,eltaxis— v/ ( ly seganósuconfianza, lo'pe— taesdeunos27añosyteztri— | | W l ) W | | N peóú' por 28 horasylerobó los — dueña Trassudenuncia,vio 1¿ (. instrumentos musicales con — que sus pertenencias eran losquetrabajaba, valoriza— — ofrecidasenunapáginade dos en unos diez mil soles. _ Facebook Leescribióal ven— El hechoocurrióenSan dedor,peroestelobloqueó y JuandeLurigancho. despuéseliminólasfotosde Cámarasdeseguridad losobjetos.(). Yucra) o grabaroncuando, el 23dediciem.— bre, DJCésar', ferqueleha.— chaparreras desde Mezcladoras, laptop y celular de O u víctima se ofrecían © en Facebook CESAR CUANDO (24) ingresaron con sus armas y amenazaron a dos clientes. ”Les robaron sus celulares y demás pertenencias. Lue— go huyeron en su moto”,",4
2261.79,2500.91,58.79,24.73,87.73,"dijo Angélica Díaz, propieta— ria del lugar. Ella señaló que llamó a la Policía por la acti— tu sospechosa que notó de unos sujetos merodean— do su local, pero que nunca me o",4
1583.33,160.0,106.78,27.67,79.89,MARTES 29 DE DICIEMBRE DEL 2020 …J& (AVISO) 5,5
1926.78,1505.56,90.22,36.78,55.33,a v y y ”l TODOS LOS DÍAS a,5
2038.6,1643.4,114.2,30.9,67.9,| EMBARQUES: . DE 6:00 A.M. A 11.00 PR.M.— DESEMBAROUES:,5
754.8,1743.2,150.0,56.4,73.0,"202—=1 111 Anexo 860 á,",5
570.5,1821.5,217.5,62.0,81.25,945018 248 / 985330016,5
1401.14,2030.71,210.29,56.29,63.57,NO.ATENDEREMÓOS E* VIERNES 01 |D ENER. | Retoma¡remos la atencion ellu$a[oado 0'2 de Ene,5
2306.8,2736.6,103.2,31.6,69.2,"D press reader …eucmn"" 1 60(2784602",5
864.0,157.0,105.11,29.67,84.11,6 — (ACTUALIDAD) MARTES 29 DE DICIEMBRE DEL 2020,6
1417.48,352.76,68.62,21.64,73.7,Todos.los días inscribe ganador pe $/500 el oia 28/12/20 tu Numero de h suerte NOMBRE: MARIA PALACIOS llamando al 710—0260 No en www.trome. | d I No DE LA SUERTE: 1125907 w Inscripciones todos los días de 6:00 a.m. a 4:00 p.m. Sorteos: 5:00 p.m. Términos y condiciones en www.trame.pe,6
1067.08,497.58,154.83,26.08,70.33,'»—/ t LLAMADA GANADORA ¡…q;» » eva acabando este 2020 y me.pe). Desdelas6delamañana,6
1288.0,566.08,84.97,38.83,67.81,"y < | …?'; Tromesemantienecomo hasta las de la tarde, registrate RE[G A LAMG,S . 1*qff Idiariodemayorcircu— de la suerte' y datos per— ¡ —. y ** avión en todo el Perú. Por sonales, aquellas delatarme",6
2258.75,510.0,73.25,22.0,75.75,&HOY ES EL SORTEO,6
2254.5,573.5,147.0,53.5,91.25,Gana con el Crucitrome,6
2258.31,752.0,59.31,25.44,88.0,"G> El Crucitrome cum— ple con su gente y hoy, martes 29 de diciembre, sortear dos",6
1535.27,718.67,137.45,27.64,77.45,"ello, agradecemos a nuestros lec— — se conocen los nombres de los ga— tores regalan do dinero en efecti— nadores. vo todoslosdías. Recuerdaquetodas nuestras pro— Tomanota:delunesasába— _ moci ones se realizan bajo la aten— dotu'diario papá' entre— mirada de un notario públi— premio 500soles y — co,quienotorgaeltradicional'es",6
1384.3,988.02,80.74,27.34,76.8,"losdomingossaleel'Reven— — conforme” gift cards de 400 soles tan semanal' debil soles. PASADOR cada una. 3 Entonces, para participar,loúni— — Ayer.nuestralectora María Yolan— —| Para participar debis— < = ? a coquetees que hacerse inscri— da Palacios (1125907,del Callao) te solucionar tus juegos' $3Ha?o más de 19 años ||€V&[l10$ A b . *—— birtellamandoal710—02600me— — fue la feliz ganadora del sorteo de sin erro— a|egr¡a a los hogares del Perú a —=” — los 500 soles. res|,, E colocar— les tus m los ni tejido muscul_a_¡¡y datos la amarlo i miami cular] y hierro [se i ” ¡ O d letra legible y",6
2237.8,1282.8,88.9,29.1,78.4,"depositarlos %“Í en las ánforas —— autorizadas. Más sencillo, imposible.",6
419.75,1477.0,131.5,25.25,80.75,VIDENTE — GUIA ESPIRITUAL,6
487.36,1562.82,58.45,20.18,86.36,"Se hacen toda clase de Limpia ! curaciones, le trago al",6
2200.5,1569.7,50.2,15.0,87.4,"DAMOS SOLUCIÓN A TUS PROBLEMAS DE SALUD, DINERO Y AMOR,",6
1843.36,1583.0,84.07,30.93,76.0,r !! R TE REVELO A TV ENEMIGO OCULTO EN un ESPEJO DE ETERNOS,6
554.73,1599.0,56.4,17.47,79.47,"e do que esté, si quiere que vuelva regresará dominado y arrastrado a tus plos",6
574.25,1639.88,57.38,24.5,75.0,EE ¿Se siente cansado? Trabaja y siente aun,6
1118.3,1676.46,69.08,21.8,76.04,"DOMINO CUERPO, MENTE Y CORAZÓN DE TU PAREJA AL INSTANTE Y ALEJO AL :=::s RH |:[rynhh— y n l=n; 3:fl:£""¿£á':?&%…n AMANTE DE TU PAREJA, CURO Con MUY NEGRO, FLOREZCA CON KIRKNCHO. 1 GARANTIZADO de dudas y sl es así, necesita un amuleto PRIMERO CUMPLO Y LUEGO PAGAS IFAV/ALFONSO UGARTE;1454 OF/402",6
2073.0,1727.1,47.7,24.9,54.3,ea ! Ye UED?DE y (AM/2 Cdra?de la Bolognesi) ud,6
933.7,1781.15,85.0,31.96,76.26,"© salud, mala suerte, *10 QUE YO ATO NADIE LO PUEDE DESATAR” = PAREJA CON 7 NUDOS 5250 e g no 7686 na gurldad. ENDULZAMIENTOS IMPOTENCIA SEXUAL",6
2145.83,1999.73,64.71,22.94,71.96,"Tengo u| don ] Ia dlspo¡lclon para poder | ATRAER AL SER AMADO sh 1 s e s ”Mondn de ofrecimiento [ E atraigo lo someto y domino a 'Am¡rte¡ tu voluntad por Imposible que parezca 'AMARRE$ Retiro maleflcios, entierros se(¡edad¡ 'conocimiento 'E'Poda sala clones y enfermedades Incurables SE cumplo con mi palabra",6
506.73,1917.27,41.33,16.53,87.53,"¿ No me confunda con otras, no soy la única pero sí la mejor. FE",6
1454.75,2006.5,129.12,31.88,57.88,demuestro mi TRABAJO … 'AMARRESICON FOTO NOMBREIDE!EL 01ELI.A1,6
693.8,2085.2,221.2,71.0,45.2,© VALENTINA (m ::w w=,6
1551.4,2152.47,122.93,30.27,76.4,"m ra HUMVYIDBNTE ASTROLOGÍA II.I""11I2'M “0…… D 965900302&3?£m:» en 2 noches uniendo la fuerza de",6
1452.59,2195.51,59.28,29.74,76.92,"7 animas y la baba de lucifer EFECTIVO EN ENDULZAMIENTOS — AMARRE GARANTIZADO 9 et mu SI AUE IUSTED MEDINE 7 SULA UMBRA 993407231— 964759903 | —— |xuce LUZ A TOM | No dudes, ahora y comprueba mil poder",6
2012.52,2473.46,112.78,21.17,76.8,"MAIGIRI EN 12 HORA AMARRE DE MAGÍA SEXUAL CONAMPUAEXPERIENCIAAVUDMDOTE A'I'RAIGO, RECUPERO, ENAMORO A LA PERSONA | QUE AMAS. SOLO DESEARA SEXO CONTIGO et L'AMARREMREI'0RNOTEST100%(EFECTIVO $ANAOIONES DE ACI'OG MALEFIDOG BRUJERIAS, ALEJO RIVALES Y ENEMIGOS, LECTUR. oí EURE IMIEMTO¡&BQTECOIÓN YPROSPER1I)A ¡ AV. ALFONSO UGARTE1064 204 — LIMA 2l>o (ALT. ESTACIÓN GUILA DEL METROPOLITANO, cosTADO LOCALAPRA) PISO",6
908.0,2470.91,58.88,21.3,63.85,"> lee A — e e a Amulalon. Velas, etc. Se retira espiritu FRACASADO, TRABAJAMOS CON LAS VAGIAS. SANTERÍA TABACO Y TAROT maligno de su casa; oooo'04o J ” , H ee e",6
1098.79,2515.97,74.62,23.21,67.41,") o o ¡ POR TU CONSULTANTLEVA © M 1n[ckmomvenounus AES, DORMIRA JUNTO A 11 VENCER A TU Enemigo FLORECIMIENTO 9RA'ÍI81 ; CURO:. DANOS, BRUJERÍAS TODO TIPO DE ENFERMEDADES",6
549.29,2575.0,89.86,32.0,48.86,"(»h/' € …3… D:,%..%.E£E&%ñ,mz¡% ) d",6
2223.6,2746.6,106.0,31.0,46.0,D pressreader” Pressteadercom se l,6
690.0,161.67,56.17,43.83,36.33,e e e e d a,7
926.5,461.86,101.43,30.5,49.07,(SEPAQUE: ©Hay;amplio:cotillón AñolNue— woody piñatastestrellas: ©Sagastiltiene ( 20 a 7 E presidente” y ”Los:,7
655.4,1258.4,177.1,34.8,42.8,"< x(ea'méhfas.,—,¡p;erolm'o r 2 dellosimunecos;piñatatde. SheylalRojas:Manuel Merino;, RichardiSwing, [Keikolkuijimoriy MartínWizearra,¡perotambién",7
1904.83,962.69,91.86,35.83,43.34,"e la (gusta lalparranda;tatmílme: s a ley;Jlossmery; poríestaRantene:más px ei el i es l s Nuestroftatógrata, FRernandofSan: o (registró quellas: (euñánisalencon mello toquenjalNeymar.. ea trofFlores¿Aráoz' e y s (y",7
2230.9,642.48,171.9,35.42,42.97,[lamasytallaswieuñasino tsellesipregunta” E E Nt e oye l RU'ñéfaz£ili?'il%ld?' Ígd!be'_sien1la&i&'a:-.: | MADUROYSAGASTI (Haytdelatexasistentajpre — ¡s'iden'eiál_!)ll(oánem fotorconWizcarray frases: ”Eres.unateínicay”Túteres: mi [NicolásiMadurotonfYono: perofaweces: a es e E igobemarles” perilla Poresotambiéntse: (otrasidelipresidenteSagasti tdes/ArturottaTrome:((Isabel a,7
274.1,634.1,58.33,24.19,87.69,"e todo se dijeron ayer varios congre— pistas en el pleno, donde se deba— ti el dictamen de la nueva ley agraria, que fue aproba— do el sábado pasado en la Comisión de Economía. s r César Combina Alianza para el Pro—",8
1425.15,463.43,77.38,26.57,82.28,"o ] TENORIO (MINISTRO DE AGRICULTURA): ”Esta norma debe ser considerada como punto de partida” MENDOZA (MINIS— TRO DE ECONOMÍA): ”Si aumentamos al 150% el jomal, al día siguiente no habrá más empresas” S dg U a NISTRO): ”Nueva ley agraria podría acarrear daño en la economía”.",8
1463.3,821.6,59.9,22.6,91.9,muy activo en medios ata— cando a las zancadas que,8
872.27,1027.67,87.44,38.71,62.75,"greso—APP) fueron los defienden a los primeros en prota— / ('; X¡ OW V X trabajadores del go piz atr un'ac¿tilorado |m ,_ |X__, a' a cgmpg>_"". enfrentamiento. combina res— EE a n (GU](DIIKdIEZIHHU|1I ”“(:(>) pondió: ”Este ea 6 D]r(ln(o|lb + xmurinm. 1(…… ox…1nunnum M p1*,, cu en diose do lobby... (IJ(& Ia in)&]mo(o]”( 5 a[a]íí3]'1(ok; pésima |EEE CESAR COMBINA",8
472.33,1326.83,86.33,23.17,81.0,&PIDE FISCAL POR DE LA POLÍTICA',8
604.38,1374.5,127.75,53.25,89.62,Hasta 22 años de cárcel para Luna Talvez,8
264.68,1634.36,61.45,24.98,86.16,"(© i a Hasta 22 años de cárcel recibiría José Luna Gálvez, congresista y fundador de Podemos Perú, de ser culpable en el caso 'Los Gánsteres de la Política”. Así lo estimó ayer el fis— cal Jonathan Nureña, en la audiencia de prisión preventiva",8
456.32,2243.48,72.17,25.19,88.14,"ARTISTAS, CANTANTES, FUTBOLISTAS, ”INFLUENCERS”, PERIODISTAS, EXAUTORIDADES, entre otras personas más, figuran entre los candidatos al nuevo Congreso que nos representarán desde el año 2021 hasta el 2026. Las listas fueron presentadas la semana pasada por los partidos políticos que competirán en las elecciones generales de marzo ( ¿Ese Congreso será igual o peor que el de Keiko Fujimori, que fue disuelto, o el actual que es manejado por una gravilla de golpistas?, se preguntan muchos. Como siempre, algunos líderes de los partidos están llevando en sus filas a figuras con arrastre popular, antes que gente preparada o con destacada trayectoria profesional y experiencia en los sectores públicos y privados. Sin querer desmerecer sus cualidades, está la actriz Vanessa Terces (de Alianza Para el Progreso), exesposa de George Forsyth, candidato presidencial por Victoria Nacional. Ambos terminaron diciéndose la ”vela Dicen que se trató de una astuta estrategia para desinflar la candidatura del otrora arquero aliancista. Se encuentra Diosdado Capitán Castro [Podemos Perúl, cuyo",8
1074.69,1637.82,65.88,24.71,89.0,"por 36 meses en contra del también dueño de la Uni— verdad Telesup, quien E acusado de organización criminal y cohecho activo. ”Fue el hombre clave (líder] de un grupo criminal que se constituyó para tener poder político y económico”, dijo el fiscal al juez Jorge Chávez. Además, Sureña lo acusó",8
1452.69,1555.46,59.04,24.18,87.66,"de obstruir la investigación y mostró un video en el que se le ve entrar al despacho de la fiscal que antes veía el caso. Según la Fiscalía, el exlegis— lado corrompió a la Oficina Nacional de Procesos Elec— morales (ONPE) para inscribir a su partido. En su defensa, Luna exi— dió 'justicia y no un juicio eb ea Esta mañana se retomará la audiencia. (). Arce)",8
1852.33,742.98,68.28,24.96,85.84,"Nochebuena a miles de tra— bañadores que querían una solución... solo obstruyen”. La presidenta del Legis— lativo, Martha Vásquez, les apagó los micrófo— nos y pidió calma, pero los ánimos se volvieron a caldera cuando Cecilia García [Podemos Perú) lla— E A Agrupados) 'defensora de empresas”. Luego, esta últi— ma le recordó la denuncia por tener dos DNI. ”METERBALA! La situación empeoró al escucharse de un micró— fono prendido: ”les deben meter bala', cuando se hablaba de los trabañadores agravios y las protestas en el norte y sur del país. Al cierre de esta edición, el debate seguía. Susan Quintanilla, repre— sentarte agraria, ha prometido que no habrá bloqueo de E ta [",8
1856.89,1472.56,65.78,31.33,41.11,l o m t planchas E d at dimit si oles a,8
2267.55,808.28,67.36,24.49,88.01,"”No se puede enga— dar a la población diciendo que estoy fugando”, afirmó ayer el investigado congresis— ta Manuel Merino [Acción Popular] sobre su reciente viaje a los Estados Unidos. Detalló que dejó el país por temas familiares' y acusó a Migraciones 'de filtrar su pasaporte”. ”A los congresistas se les sigue violando su intimidad personal”, reclamó. Cabe señalar que Merino es procesa— do por las muertes y heridos en las mar— chas contra su corto gobierno. (AY]",8
2236.57,1636.86,68.86,32.86,42.86,(ut4thomIny|k y e ne [Setitoxs cabos sep puli ren,8
2062.45,1927.15,66.45,24.25,91.15,"corrupta Obrecht pagaba al mandatario y a sus funcionarios más allegados, pese a que un testigo llevó pruebas. Su esposo",8
1257.82,2362.32,66.69,25.16,87.88,"Ra ne líder, Luna Gálvez, está detenido por comupción. Capitán se hizo popular por su canción 'Amor, amor”, que cantaba a gritos el expresidente Alejandro Toledo durante sus interminables días de También figuran los futbolistas Germen Seguía (APP) y Jean Ferrari (Victoria Nacional), entre otros deportistas. Lo que más le ha llamado la atención a este columnista son las postulations de Gladys Echar, Katherine Muero [APP) y Julia Príncipe [Avarza País), quienes cuando desempeñaron altos cargos en el Estado no precisamente desollaron por sus funciones que debían cumplir. Echar fue fiscal de la Nación durante el segundo gobierno de Alan García, quien era su amigo. En ese lapso ni ella ni sus fiscales descubrieron los millonarios somos que la empresa",8
2039.01,2273.29,63.56,24.3,88.74,"Julia Príncipe fue procuradora pública y también era allegada al aprismo. En el año 2017, la web Utero.pe descubrió fotos de ella en reuniones familiares con Moisés Bambini del Valle, un aprieta de la vieja guardía y el abogado más leal de Alan García. En las tomas, además, aparecía Alberto Kouri, el mismo que fue filmado en un video recibiendo sobornos de Vladimir Montesinos. Muero, que también fue procuradora, fue sacada de su cargo en 2017 cuando se opuso a un decreto que permitía asegurar una indemnización a la empresa Odebrecht. Hace unas semanas, durante el breve gobierno golfista de Manuel Merino, la misma Muero anunció que sería nombrada en un alto cargo del El Partido Aprieta no tendrá candidatos, supuestamente que hubo pugna internas. Pero eso huele a 'cuentazo” Sus astutos eternos dirigentes no quieren hacer el ridículo, pues saben que ni siquiera aparecen en las encuestas. Como bien dice mí amigo El Búho, ”habré nacido de noche, pero no anoche”. Nos vemos el otro martes.",8
2050.92,2626.46,60.23,35.69,88.46,Los artículos firmados y/o de opinión son de exclusiva responsabilidad de sus autores.,8
235.14,886.86,105.07,38.0,86.0,lo hallaron gracias a mujer de buen corazón Será entrenado como perro de rescate,9
252.15,1240.96,121.65,28.38,73.38,"( Finalfeliz!Entreabra.— los y lenglietalos, el travieso y tierno pe— r rito labrador Scott se reencontróconlosbom— besos voluntarios dela Compañía No Olivos, luego queestuvie— ra maña— nade pasadodomingo.",9
1298.5,160.5,102.17,23.5,89.5,MARTES 29 DE DICIEMBRE DEL 2020,9
435.88,1563.0,149.88,55.25,89.12,Vacuna peruana en gotas estaría lista para julio,9
279.73,2021.85,56.27,26.0,76.04,"CD e a 5 a e e biólogo Miro Zimic, jefe de Bioinformáti— ca, laboratorio encargado de crear la vacuna perua— na contra el coronavirus, al",9
661.59,2026.96,64.63,25.04,88.7,que podrían producir treinta millones de dosis por mes. Mimic añadió que la vacu— na peruana tendría que estar almacenada solo a ocho grados y que los,9
463.99,2341.5,61.16,25.7,83.46,"afirmar que podría empezar — ensayos clínicos en huma— a aplicarse en el país para l ee e ie 0 |[ a ”Hemos tenido conversa— ”Probablemente (la vacu— — clones con el Gobierno... na) estaría a fines de es una inversión de veinte julio, si es que podemos ir — millones de dólares”. muy rápido y tener todas De otro lado, Jesús Val— las facilidades”, dijo el verde, presidente de la experto. Asociación Peruana Las dosis se adminis— de Medicina Intensiva, traían por la nariz y a advirtió que solo quedan través de gotas (no 50 camas dispo— a nobles en el país. [J. Además, estimó BIÓLOGO Carcel E",9
968.57,1657.57,126.29,66.29,77.57,Choque de taxis colectivos dejó 7 11,9
1071.29,1981.61,60.29,25.19,89.13,"G) Siete muertos, entre ellos dos niños, dejó el choque entre dos taxis colectivos en el kilómetro 156 de la Carre— tera Central, sector de La Balanza, en La Oroya, Junín.",9
1019.5,2190.0,76.25,29.75,42.25,e es s— Recibes,9
1042.75,2376.0,38.75,22.5,48.25,o ta emi el,9
1460.24,407.83,64.1,23.69,83.66,"S unas semanas, Scott empezará a ser entrena— do para convertirse en un gran perro de rescate. A joven pareja que al sepa— darse lo dejó en un alberque.",9
1484.34,897.76,111.37,25.29,71.24,"Víaredessociales, los ”hombresderojo' hicie— ron pública sudesapa— ración ybúsqueda, has— ta que ayer una mujer de buencorazónlos contac— tenía WhatsApp, a uno delos númerosque indicaron decon— tacto. ”Nosmandóun mensajero la foto de nuestro peque— p 1 ea tabaél, dur— mienten unacami— ta. Asíque fuimos inmedia.— toareco—",9
1457.93,2038.67,54.87,23.47,90.93,"El accidente ocurrió a las 2:50 de la tarde del domin— go, cuando dos autos",9
1837.35,852.75,129.39,27.34,70.19,"gerlo. Menosmalnoes— tableros yhabíacaido en buenas manos”,dijoa Trommel bomberoCésar Chirinos. Elcansehabíaextraviado luegoquesalieracorrien— dodetrásdeotro perrito que pasaba por el frontis delacompañía. Minutos anteshabíasidobañado, porque no llevaba su colgaron su placa. ”Lobuscábamos hasta tocando puerta porpuer— ta . Gracias a Dios, la se— ñoranoslo regresó.Co— mo agradecimiento le hi— vimos una canas tita y se ladimos”, manifestóChi— rinos. HERMANO MENOR Para los bomberos, Sco— tess hermanomenor”, noslo una mascota sino también el integrante del equipo que se encarga de llevarlesalegría. Hacemos mesesquellegódeun al— berede Huaral, pero ya serobóelcorazóndeto— dos, incluso el de Taty, la gatadesieteañosque vi— veconélenlacompañía. (Jordan Arce)",9
1898.14,1807.84,70.07,24.34,87.86,"chocaron frontal— mente, quedando destrozados. La Policía identificó entre las víctimas a la enfermera Milagros Churampi (33) y al ofi— cual de la Policía Diego Hermano (41). Ambos vehículos tenían pape— tetas por infracciones de tránsito. Para las autoridades, el acci— dente habría sido porque ambas uni— dades se desplazaba a velocidad en una zona don— ] [+]",9
1788.4,2382.0,141.2,34.8,51.8,"[o[v.w…u.mi(…a|n)r[…ív.nm'»1t…a V[oL.nto]lnt»iou¡ |Inuu t¿u,¡!qpiu)x»1|n ni(oxisl",9
2195.0,516.0,86.5,34.0,84.75,HASTA MAYO DEL 20,9
2228.75,641.5,187.75,62.75,55.5,Ampl¡an vigencia ea ee,9
2259.01,1110.45,58.95,24.5,84.83,"El Ministerio de l Comunicacionesf…d prorroga la vigencia de las licencias de conducir en todas sus catego— 5 E a a hay autos, ómnibus, camio— nes, taxis, entre otros. La ampliación será has— ta el 31 de mayo de 2021, dependiendo de la clase y la categoría. Según el cronograma, la medida se aplica a las licencias con vencimien— to desde el 1 de enero de 2020 hasta el 31 de ene— ro de 2021. (L.M]",9
2227.6,1756.0,121.6,58.4,78.8,Ingresos hasta S/3208 no s,9
2272.07,2256.09,66.57,24.69,89.69,"Q> Los trabajadores inde— pendientes [Cuarta Categoría) que emitan reci— bos por honorarios y cuyos ingresos mensuales no supe— ren los 3208 soles no estarán obligados a efectuar pagos a cuenta del Impuesto a la a Así lo establece la Sunat, por el incremento de la Unidad La disposición compren— de también a directores de empresas, síndicos, manda— tarios, gestores de negocios, albacea o similares con rentas de Cuarta y/o Quin— ta Categorías, cuyo total no pase de 2567 soles al mes. Puede consultar llamando al o",9
