left,top,width,height,conf,text,page
1519.86,2371.33,199.57,35.62,53.29,") se¡podría (dellamejormanerajyisobretodo Muy(d|f|c¡l;y(compl¡cado)porc|uex t0me1la(dec¡s¡on(detcu¡dar(a rmis: ¡padres, quer son wu l n era bles Mivi: imo si dentro (de lamisma(casa;pero (contdistanciamiento, hasta en i mil Ihogarwso;mascarilla,soólexen mil (cuarto[estoy I|bre*lHa¡s¡do)un?ano) (de¡sacnflc¡o lunalbendlc¡on¡y'esexermml (Gamarra))",18
1979.33,295.17,122.33,39.83,52.0,el que no l ha wiajadojpara: ie con'suesposo ¡polace,18
2148.71,618.71,144.43,70.57,49.29,íí'z%f%mñ ['1 U & a W sultam ilia,18
2117.8,800.8,217.0,43.6,70.4,"C> Stephanm(©rue(descarto[queihaya v¡a1adolal[extramero,para1re (el[polace,'/&'dr n",18
2141.33,883.67,167.33,33.83,60.33,"¿Slkorskl!,'delqu|en[se(encuentra es ea |rada f|s¡camente 'deísdelhace[dosfanos",18
2037.23,1099.92,198.23,37.31,60.85,"'en|un'av¡ón,y¡muc osfcreenquema,» 4 o'lEstoy¿grabandolun p|loto[enlun| avión festunaiserie. '$igu&s*separada'” lNoldeseo)hablar¿de_eso lEstare(con|mls¡papas¡y/mllher. imana: Estelanolm¡[cabala[sera¡ ©",18
2186.38,2133.79,149.55,34.86,48.03,"ese [ eo ee |programa“.£l ls lnazoxdella((:hola |ratlng[conl10©]puntos,, a XWasapxdeilB' ta zzaron(9 ”¡Paramasotrostsiempre: ,gramatquella,gentexehge) |momentosicompl¡cados ;solo Ibuscamos(darlefalegna : e||c¡dad'¿,[comento a a ee a o taliCongresoyinoshantaproba: a o (declarar(ell0¡a[del(ClrcolPeruae",18
256.4,173.6,71.8,47.2,75.6,2 — (AL DÍA) r1…3(f91,2
437.5,382.0,170.0,54.0,88.0,BUENA SALUD EN NAVIDAD,2
472.85,1263.21,70.7,24.73,88.98,"M i amigo, el fotógrafo Gary, llegó al restaurante por un pollito al maní con papa amarilla, una pequeña porción de arroz blanco y roc o tito molido. Para tomar, una jarrita con refresco de cocona. ”María, las familias ya están pensando en cómo pasarán la Nochebuena. Por la pandemia, habrá carencias y ausencias físi— cas, pero hay que levantar el ánimo por estar unidos, con amor y pedir que esta fecha tan especial, por el nacimiento de Jesús, nos traiga salud y fortale— za. La festividad hace que, en cualquier hogar, dentro de sus posibilidades, se comparta algo especial. Clá— sicos son el chocolate y el rico panetón, así como el pavo y el chanchito, otros optaron por pollo. A eso le sumarán salsas, ensaladas, dulces y licor, pero muchas veces con malas combinaciones y excesos que pueden requerir atención médica. Incluso colas por cervezas se han visto y ya varios aseguraron sus o 'six packs' para no salir de casa. Cuidado, todo eso pasa factura, afecta al hígado, juega a favor del sobrepeso, la diabetes y otros males que incluso complican nues— tras defensas frente al coronavirus. Para cuidar la salud y la de nuestra familia, especialis— tas en nutrición como Imena Trujillo, de Laboratorios Hersil, y Sabe Mauricio, actual directora de la Escuela de Nutrición Humana de la Universidad Norbert Wie— ner, aconsejan: 24 desayune ligero: Fruta picada (papaya, melón, sandía o piña), yogur bajo en grasa y tostada. Cena navideña, chocolate y panetón: No todo a GA ME| ú|tima combinación podría ser el desa— uno del 25. No añada mantequilla ni mermelada al carnes blancas: Pavo, cerdo, pavita, pollo o pescado. La digestión será más rápida. ©Acompañe siempre con ensalada, de vegetales crudos o cocidos. También salteados o al vapor. aderezos: vinagre blanco, limón y si usa acei— te, de preferencia que sea de oliva, sin calentar. bien las combinaciones: Son nutritivos los tubérculos (papa, camote), pero evite consumir a la vez con arroz o fideos. No le añada mantequilla al puré. de porciones y sin excesos: No abuse de brindis (cerveza, vino, pisco u otro) ni comparta copa. la tradición de la cena de medianoche. Mejor entre las 8 y 10 de la noche, para evitar indi— gestión, problemas para dormir o subida brusca de glucosa. principal, cuídese y cuide a su familia del virus evitando recibir gente en su casa. Se puede arre— pentir”. Gary está en lo cierto, celebremos sin excesos. Me voy, cuídense.",2
1112.5,872.5,100.25,43.0,91.5,Apuesta por la tecnología,2
1215.19,953.38,56.81,25.12,89.5,(D Tiempo atrás era muy reacio a estar al día en los avances tecnológicos. Era muy,2
1210.0,158.33,96.67,23.67,91.33,MARTES 22 DE DICIEMBRE DEL 2020,2
1810.41,955.53,51.29,24.24,89.47,"€9 Sería bueno que en los colegios, una vez que las cosas mejoren y se haya con—",2
2292.19,344.86,55.33,28.38,86.67,Fuerza Popular no puede ni inscribir bien una plancha presi— denial en su tercera elección y vaa poder ”rescatar” al país.,2
2277.34,628.86,51.41,28.48,77.59,"Alex Valera: ”Esta oportunidad para mí es importante. Vengo a sumar, vengo a hacer goles y a darlo mejor de mí para (e e e et d e Libertadores”.",2
2282.33,961.33,53.33,32.33,88.0,¿Aprueba la labor de Pilar Gazzetta,2
1693.15,1482.77,63.74,26.53,79.36,"cerrado. Las circunstancias cambiaron y tuve — tronado el tema de la pandemia, enseñen, i e que adaptarme a los nuevos tiempos, pues de manera obligatoria, primeros auxilios. Es AYE|R si no lo hacía, perdía mi trabajo. Hoy sé que algo que será muy necesario a lo largo de la —* 20 l la tecnología es importante, pero no hay que — vida. Podría impartir en los alumnos del ¿Cree que Sporting Cristales justo abusar de ella. nivel secundaria. (ei d i o Arturo Villarreal B. Honesto HuertasF. 5)) 68% 32% e eal e La situación actual ha hecho que recurra— Interesante la propuesta del lector, ya que P, mos a la tecnología mucho más para realizar tener conocimientos de primeros auxilios EL DOLAR nuestros trabajos. Todos los días surge algo nue— — haría que las personas puedan reaccionar mejor e vo, pero también es cierto que un celular o una ante cualquier emergencia, Tenemos entendido computadora no superará jamás a una buena con— _ que algunos centros educativos tocan ese tema, — compra sensación o leer un buen libro. pero deberían profundizar mucho más. EMERGENCIAS _v_u XJ_ …Ó ( Bomberos Emergencias 105 Defensa Civil ] Salud Aguilas Negras e Escuadrónverde 4276904 lee 3178000 Indecopi 2247777 Enel Perú 2 ©ALO TOME l y p e sls o o e Impreso en la Planta Dando de Empresa ... Hecho el Depósito Legal en la Biblioteca Pertodístico: —. por empresa Editorial —— Página web: Editora El Comercio SA.JF. Paracas Nacional del Perú No2001—1992 a Los artículos firmados y/o de opinión Espinosa — Victoria Lima e Olnay — Teféfono: 311—6500. — Publicidad: 708—9999, —— Prohibida reproducción total parcial, — sus autores,",2
502.67,703.33,82.0,33.33,90.17,que esperará para tener el varoncito,20
1210.0,158.67,96.67,23.33,90.83,MARTES 22 DE DICIEMBRE DEL 2020,20
737.4,289.6,39.2,54.6,69.2,La actriz cómo a o,20
845.0,518.53,59.33,23.84,88.93,"rro crudo”, contó que está disfrutando de su etapa de madre primeriza junto a su pequeña Victoria. ”En febrero cumple dos años, es una coto— rra. Voy a esperar que mi hija crezca un poco más para pensar en un varoncito”, dijo. (L.",20
1127.43,2245.14,70.0,24.0,89.86,Nicola Porella contó que cumplió cinco meses de rela— ción con Alejandra Campaña y,20
1730.17,323.67,65.83,24.0,91.17,Federico Salazar les deseó el mayor,20
1765.57,370.86,45.86,22.86,83.57,de los éxitos a sus colegas su,20
1385.74,1426.35,111.31,27.35,72.81,"Conductor de Amor y fuego, Ro— luchin, afirmóque elimitadorJorge Benavides secundaria a ATVjuntocon todo suelen humorístico. Gonzálezcontóquedos he— ch os motivar on a 'JB' tomar esta decisión. Primero, que el canal les haya quitado un auspiciado y, segun.— do, su parodia del presi— denteFrancisco Sagasti,quefue promocionado so— ciales y nunca fueemitida. ”Estonolo veía— mos venir, sereti— radelaprograma.— dónde Latina y se mu— da a ATV 'El imitador Jorge Benavides abandona San Felipe y se muda a la avenida Arequi— pa. Dicen quelecensura— ron un sketchdeSagasti yeso fuera gotaquede— trammel vaso. Incluso, anteslehabían quita.— do un cliente que ellos consiguieron”, preci— Fuentescercanasa JorgeBenavidesco— mentaronqueelimi— tadortienecontra—",20
1466.17,2243.67,71.5,30.33,91.33,Cumplió 5 meses de relación con,20
1724.86,416.29,69.29,26.29,86.71,"y amigos Sol Barreño y Augusto Thomdike,",20
1816.4,579.17,64.97,26.17,85.03,"quienes se despidie— 'Cu_arto ron de 'Cuarto poder' pOder ”A mis amigos y colegas les deseamos lo mejor, estamos seguros que en el camino que comiencen van a tener muchos más éxitos”, señaló. _ O",20
1841.59,1480.38,135.68,26.72,76.39,"toco Latinahastafinesde año queen lastimas se— manasnoexistía buen en— rendimiento para su reno— vación. Luego, ante lo sucedido con la inexplicable censura de imitación deSagasti,ha— bríadeterminado que bus— que otras opciones para continuaron subprograma cómico. Además, sesa— be que todo el elenco apoya benavides proseguirá adondede— cidamudar— se,talcomo sucedió el 2016.cuando estuvo Willa y en bloque pasaron unamo después Latina. CENSURA Aunque sketch sobre laentrevistaquelehicie— ron las conductora s de los programas dominical es a FranciscoSagastinose emitió, se conoce que la pa.— rodeado atacaba al presi— de n tenia las periodistas, y sehabríarealizadocon mu— chorespeto. Con la presenciado JB' en ATV elcanalreforzaríasu programación delfin de se— mana. [<]",20
1774.39,2246.22,60.89,25.33,85.44,"porque eres mayor que ella... Sí, pero nos reímos. Tengo 32 años y ella 22, solo nos llevamos",20
1417.88,2310.94,61.25,26.56,80.25,"aclaró que solo se llevan diez años novia ) aclara _ diez años, pero algunas personas",20
1094.5,2374.5,90.75,28.0,88.25,”Ayer (domingo) cumplimos un,20
1767.92,2362.83,62.0,23.33,85.58,creen que tenemos una relación de 40 y 20'... Somos bien pareci—,20
1445.33,2406.53,55.33,28.8,84.13,"mes más juntos y siento que esta— _ — dos, nos conocemos hace un año,",20
1121.86,2498.64,69.36,25.57,89.14,"mos afianzados, estoy feliz y la verdad la estoy pasando bien. Ale saca lo mejor de mí y me apoya en todas mis decisiones”, sostuvo. Enredes sociales siempre temo les tan",20
1758.8,2473.27,69.67,21.8,84.47,estuve siete meses atrás de ella porque no me hacía caso. ¿Entonces no eres ”rompecu—,20
1692.5,2575.88,49.12,27.88,79.25,"la, ja, ja, no... jamás. (D. Bautista) 0",20
2252.25,824.96,66.4,24.84,82.59,"s o _ BARRUNTO. Llego embalada para con— tardes las últimas de CORTA señaló que está harta de que espe— culpen sobre su supuesta separación con el padre de su hijo y reafirmó que siguen juntos. Hummm... El hijo mayor de CHO DIEZ CANSECO, el modelo RODEO COLA— RETA, estuvo ayer en el programa ”En boca de todos', y LUCIANA FUSTER estuvo bastan— te coqueta pues le dijo que era más guapo que SEBASTIÁN VATRA.",20
2270.5,1224.94,64.31,27.31,83.31,"Yaya yy... El 'guerrero' ebi contó que está sufriendo ahora que vive solo, pues debe de",20
2259.51,2143.62,62.49,23.72,86.49,"cocinarse todos los días, pues mantiene una die— ta estricta. Buena... La de Gamarra, ALE— BAIEZORRMA, dice que no ha planeado nada en Navidad, pues va a trabajar hasta tarde y ya verá dónde la pasa, pues tiene varios her— manos. Full chamba la chica... NACIO BALA— contó que no viajará a Uruguay por fiestas y que ha recibido la invita— ción del para cenar en su casa. ¿Y PAULA MANZANAL?... ea a a a ese te que en breve se irá a México para grabar los temas de su nuevo dis— co... Bueno, soy fuga porque mi amorcito se alucina pastorcito, pues me para echando maici— to. Suuuaaaveee...",20
726.05,939.12,111.19,27.91,77.82,"G Cruzolosdedos pa— raregresaratraba— jar”. afirmó Mónica Delta,quienviajóa España para recibir la Navi— adjunto a sus hijos, asedio con la sorpresa de que el go— tierno suspendió los vuelos deEuropaalpaís gordos se— manas. ”Acababa dellegaraMadrid yel presidenteSagastiin— forma sobre la nueva medi— tomada para prevenirla nuevacepadecoronavirus. Estoysorprendida porque vinea veradis hijos Sebas— tán y Paloma parabasal laNavidad”, expresó la",21
1298.5,160.33,102.17,23.67,90.17,MARTES 22 DE DICIEMBRE DEL 2020,21
1174.0,748.8,84.4,39.6,37.0,ei NaVídadieo || o e,21
1100.56,1166.0,206.11,30.22,76.56,"Laperiodistaañadióque viajóparaestarencasacon familia ynosalirdema— siado. ”Laideaesestarcon mishi— jos...Sinembargo, allle—",21
1018.16,1522.87,60.11,25.93,85.51,"Desi Abajo marcó dis— C<? taer11/cia conlAnelhíArias y aclaró que ella no realiza desnudos en los shows vir— cuales que realiza. ”Mi show es artístico y lo suyo es más ”hot'. Yo no hago desnudos ni vendo 'pack (paquetes) de fotos, eso no ha pasado por mi cabe— za. Creo que hay otras maneras de ganar dinero”, dijo Arayjo. (L.G) G",21
929.0,1738.0,75.0,31.71,71.0,$% Marca distancia de estilo de shows,21
1957.09,808.15,98.37,28.48,76.71,"hev1;jsto mucho lmovi— e em 7 lle, todos los centrosco— Q(%Z' MÁS mercia les abiertos y lagentequeentra— o baysaliadelastien— | [[cj | das. Esmuyabruma— 27 dor porque hay diez mil contagio s diarios ' acercado 200 muer— (<$ Giuliana Barrios felicitó a Les— tes”,comentó. lie Shaw por consagrarse Respecto regreso como 'Mejor Artista Sur' en los 'Pre— a Lima, dijo que todo mios Heat 2020' agnes incierto. ”Como peruana, me siento feliz por ”Cruzolosdedos sus logros. Es una cantante de talla para regresar en el internacional y viene trabajando tiempoestimado, duro desde hace años”, dijo. espero volveratra— Porcierto, vimos que llevaste bajar, pues olivine alegríaamuchosniñosenVi— porla Navidad. Pa— llaMaríadelTriuntfo... reingresar Espa— Sí, junto a 'Corazón con Barrio', ñamepidieron una mis hermanos y mucha gente prueba molecular que colaboró logramos llevar y entiendo que hay juguetes y ropa a 70 niños una locura en las del asentamiento huma— líneasaéreasenel no Cristo Salvador. (D. Perú, puesreciénaca— Bautista) G ban esperar muchos salieron a versus familia— 3 Afirma que es una b de talla internacional /Í?7 e e w¿“Í%ALZ/",21
2003.54,1579.32,63.82,25.47,81.95,"m Guay Carrera aseguró que su relación €> con Brenda Mambrino marcha de mara— 23Cuen¿tg¡ A villa, tras los rumores de una separación. — ”Nuestra relación sigue firme, muchas perso— el nas dijeron ”se han (en las redes _ Nuevo Con sociales), pero no es cierto”, indicó. 1 pareja Además, contó que recibirán el Año Nuevo e — juntos. ”Aún no tenemos definido el destino, pero estoy seguro de que nos vamos a la playa”, comentó.",21
951.12,158.62,105.88,25.62,90.62,22 (FAMILIA) MARTES 22 DE DICIEMBRE DEL 2020,22
1831.88,519.25,57.0,28.38,85.88,€» Si quieres enseñar— le a pedir perdón,22
332.12,516.0,62.88,27.38,86.5,"€» La crítica puede ser constructiva, pero si",22
1082.44,617.56,60.12,25.0,83.21,"supera a la cantidad de Í» En vez de gritarles a tus cuando se equivoque, felicitaciones, la autoes— niños cuando pelean por tú tienes que ser capaz tima de los chicos puede un juguete, puedes decirles: de hacerlo. Tu ejemplo l e *¿Qué les parece si se turnan?”. i la ld a",22
1430.62,1507.87,65.22,23.84,90.64,"para los niños llegarán a casa de dife— rentes maneras. Por eso, debes hablar con tus reto— ños desde ahora sobre la importancia de desinfec— carlos antes de tocarlos y abrirlos. Esto como parte de las medidas de prevención para evitar la propagación del coronavirus. Si ya sabes quiénes les darán obsequios a tus hijos, pídeles que te digan a qué hora los traerán, así estás preparado y evitas complicaciones. Es normal que los niños al día siguiente quieran mos— traerles sus juguetes nuevos a sus amiguitos de la cua— dra. Pero este año no podrán hacerlo porque corren el riesgo de contagiarse. Para que tus pequeños no estén desanimados dales alter— nativas, como hacer una videollamada para que ambos muestren sus rega— los o también pueden ir al parque más cercano de casa para que se vean,",22
725.36,2087.45,120.27,40.55,82.09,Habla con ellos y explicarles que antes de abrirlos deben desinfectarlo,22
307.14,2451.24,69.86,27.14,80.52,"INGREDIENTES ea E +1 palta, picada en cubos +2 tomates, pelados y en cuadritos +6 hojas de lechuga orgánica de limón",22
684.67,2319.56,52.56,25.11,72.56,+ Sal y aceite de oliva +Mostaza al gusto,22
704.57,2499.9,70.48,24.76,84.33,PREPARACIÓN En un tazón trozo la lechu— ga previamente lavada. Luego agrega los toma— lr ea Remueve y listo. Para el,22
1097.61,2383.21,55.39,24.07,90.64,"aliño combina el jugo de limón con el aceite de oli— va, sal y un poquito de mostaza. Mezcla bien y rocío sobre la pre— operación anterior. Esta",22
1073.8,2544.4,50.4,24.0,86.0,"al pollo, pavo o lechón.",22
1818.61,917.28,61.39,29.0,74.56,"s e Í»Í [o_=""j libres en Navidad :I.':l'Hpara evitar conta— Javier Herreros Kuipers gios, los regalos ee",22
1853.7,1463.93,67.26,24.96,86.57,"siempre respetando el dis— tan ci amiento social y bajo la supervisión de un adulto. MOTIVACIÓN Y COMPRENSIÓN ”Esta Navidad será diferente para ellos, por eso hay que motivarlos y transmitirles alegría. Pídele a tu hijo que te ayude a cocinar, limpiar la casa o poner los platos para e d e e E hagan videollamada con sus abuelitos o sus primos”, aconsejó Walter Dávila, psi— terapeuta y director de la Escuela de Desarrollo Perso— nal Supérate. [+]",22
1834.14,2027.57,81.57,30.29,84.14,Los juguetes que ((9 compres aratus desinféctalos bien antes de envolverlos. ¡No lo olvides!,22
1620.5,2205.0,100.75,47.0,79.75,Ensalada de pata y,22
2211.25,1050.0,117.0,41.5,62.5,|Tx PF PRUDENTE ESPERA,22
2267.7,1833.09,67.25,23.4,89.02,"Íoé)) Todos queremos la *> vacuna ya. Muchos medios han criticado que no tengamos las vacu— n ue Para contar con las vacu— nas hay que tener en cuenta factores de efi— cacia, seguridad, tiempo, logísticos, económicos y, desgraciadamente, pare— ce que políticos. ¿Cómo firmar contratos si su efi— cacia recién se confirmó hace pocos días? ¿Cómo pagar por adelantado si su seguridad recién fue evaluada? ¿Cómo saber cuál comprar si no sabe— mos aún qué es mejor? Por apurarnos, ¿debe— mos gastar más por una vacuna más cara y de distribución complicada por la temperatura a que se debe conservar, en vez de esperar y obtener una más barata y que se pueda conservar en un refrigerador?, ¿o que en vez de necesitar dos dosis sea una sola? ¿No debemos ser solidarios y buscar que todos los paí— ses tengamos acceso a ellas en vez de disputár— noslas? No es fácil tomar estas decisiones. Con— fieros más. Crítica sin conocimiento genera confusión y desconfian— za en la población.",22
142.15,616.31,59.65,25.42,88.46,"Si pides un G» crépdito, elige uno que tenga una tasa de interés menor y que las cuotas se afecten a tu capacidad de pago mensual.",23
1298.5,160.33,102.17,23.67,90.83,MARTES 22 DE DICIEMBRE DEL 2020,23
1036.6,235.2,214.8,40.8,63.4,NO AFECTE TU ECONOMÍA FAMILIAR,23
1453.57,551.87,58.56,22.72,90.19,"¡ has pensando en solicitar un crédi— to en esta época del año, antes es necesario que analices la situación y veas si real— mente te conviene hacerlo o no. ”La economía en nuestro país aún es inesta— ble debido a la pandemía, por eso sí vamos a pedir un préstamo es fundamental tener bien claro qué vamos a hacer con ese dinero. Mi consejo es no comprar",23
1815.46,380.85,87.77,38.54,84.0,< Ten claro para qué necesitas ese dinero y evalúa tu capacidad de,23
1829.32,685.84,71.56,24.24,90.44,"cosas que no necesitemos con urgencia”, señaló Jorge Luis Ojeda, docente de la Facultad de Negocios ESE de la Universidad Perua— na de Ciencias Aplicadas",23
2216.26,541.32,69.39,23.04,89.11,"Un error que muchas per— solas cometen es pedir un crédito para pagar otro. Esto no funciona porque al final se estarán endeu— dando más. Las entidades financieras están dando facilidades para refinan— criar las deudas. Infórmate y accede a este beneficio, de esta manera no man— harás tu historial crediticio ni afectará tu economía familiar. G",23
329.2,468.0,55.6,27.4,86.0,[ Cómo Papá Noel llega,24
383.0,555.67,67.33,26.56,84.67,"hasta nuestros hogares? Pues, la tradición dice <-J que lo hace en un magní— fico trineo mágico tirado",24
301.73,1229.85,62.0,23.89,87.49,"El trineo de Santa Claus está compuesto por 9 renos, los cua— les tiran de él para que Papá Noel pueda volar y llegar a cada una de las casas con los regalos para los chicos. ¿Quieres saber cómo se llaman? x Rudolph: en castellano se llama Rodolfo, es el más popu— lar porque tiene una particular nariz roja y lidera el trineo. x Blitzen: Relámpago en cas— tellano, ya que hace honor a su rapidez. x Donner: este es Trueno, pues hace referencia al Dios del x Cupid: este es Cupido, colo— cado justo delante de Trueno y representa el amor. ee l idioma es Cometa, uno de los renos encargados de repartir felicidad. x Vixen: juguetón para los que hablamos español. Es el que más resistencia y belleza aporta al trineo de Papá Noel. X Prancer: si lo traducidos al castellano es Chiqui y su especialidad son las acrobacias. x Dander: este es Bailarín. x Dasher: su nombre significa Brioso y es uno de los renos que encabezan el",24
418.33,2086.83,163.67,49.83,81.83,¿CÓMO SE ESCRIBE? A EXPENSAS DE,24
445.74,2407.5,63.28,24.76,85.65,"La fundación del Español Urgente [Fundéu BBVA) señala que la expresión 'a expensas de' quiere decir ”a costa de, 'por cuenta de': viaje fue a expensas de la empresa'. Eso quiere decir que la empresa cos— te el viaje. Sin embargo, es frecuente encontrar la expresión 'a expensas de' usada erróneamente con el sentido de ”a la espera de': ”El traspaso del jugador está a expensas del chequeo médico”. Lo correcto sería a la espera del chequeo médico'.",24
1210.0,158.33,96.67,23.67,90.67,MARTES 22 DE DICIEMBRE DEL 2020,24
1442.25,1475.0,26.0,32.5,76.5,15 4. 3. (3,24
1276.83,2105.21,63.72,32.72,77.79,| ]| ¿Por qué no tenemos | recuerdos de cuando 3 [) [) |J éramos bebés? Es un EX ' fenómeno llamado | I)] 1| /&£ infantil”. Se desconoce,24
1478.71,2222.29,69.14,24.86,86.86,"la causa de dicha amnesia. Sin embargo,",24
1490.75,2273.25,76.25,19.75,80.75,los neurocientífico Paul —,24
1495.58,2361.33,81.67,25.67,82.83,ei 5 Josselyn piensan que el rápido nacimiento de muchas neuronas nuevas,24
1479.6,2476.4,48.0,24.0,91.8,el acceso a los viejos,24
2257.08,629.5,61.5,24.33,73.08,E eg sale en esta página y responde las siguientes _ preguntas:,24
2249.73,804.8,55.8,24.27,74.87,"— El reno líder del trineo de Papá _ ¡Noel es: B. Cupido, £ Rodolfo.",24
1866.6,732.4,45.6,35.6,59.8,/ () Y! El …'J/._!.,24
2247.27,1192.0,56.04,23.46,78.73,_que no 'debe emplearse la expresión 'a expensas de' con el sentido de: A. A la . B. ”A la espera de A la orden de,24
2171.45,1554.7,65.45,24.3,74.5,"8 por el cual no y ”tenemos recuerdos *) de cuando éramos d d B, Olvido patológico © Demencia senil",24
2209.0,1820.6,80.6,20.9,75.3,"— El castor canadiense A. Herbivoro. B, Omnivoro. € Camivoro.",24
1918.75,2371.0,69.92,24.23,88.1,"Es el mayor roedor del hemis— ferio norte. Habita en las regiones predominantemen.— te frías y boscosa de Canadá, Estados Unidos y, en menor medida, México. Con frecuen— cia son cazados por su piel. No están en peligro de extinción. Son herbívoros y prefieren comer hojas, cortezas, ramitas, raíces y plantas acuáticas.",24
950.88,158.62,118.0,25.62,86.25,26 (CRUCITROME) MARTES 22 DE DICIEMBRE DEL 2020,26
1295.59,1427.64,40.96,23.69,59.01,"COSTIPADO, RESFRIADO ”ELSOMBRERO 501000 . LLAME — PREFIJO LETRA _ INCORPORA, EXTRAÑO — DECOPA' (ROMANOS) PERTENECE CONTRA — CATALOGO COMPUESTA — APACIGUAR ó ] d FE mg 2 <3 58 a y EF P [ 53 :x:o ñ; m E 3 o 3 y OLFATEAR — NINGUNA — REZAR i o 8 SIMIO,E' 2 EL a & PRESO — SUROESTE SEPTIMA LETRA 3 r b g (*1 IU= X E . xo PINTURA INFUSIÓN a a s on AUSENCIA — DEIANEIRA — E FE e= g F EF ORIGEN E — eem e E — E SATURA 3 Fr *] EVIDENTE, E N ' E o F 35 3 l y Espiritu |F 2 323 el 23 dio …8 *B LETRA —— RASTRO HILOPOCO INDICA —— Esposa —. e e NORTE d REY TORCIDO — PLATICADO MANERA — DEJAMOS DEL P o a 3 F F 2 E a 2 ll A t F 32 EF 3 EL 32 E",26
1652.25,471.0,196.0,49.25,53.5,"Eño'=*£nlos%ammosf&”elamor e u'r;6¿egg;g»£m.e,—p '""'tudde.la'»",27
1044.0,400.12,236.18,35.88,57.82,"&PEDRG)([BS] — Ilexenwo:lmrcarta!por— quexestoy(con(elkcorazen(dest ( Estuvexsal no l linda, ibamos 'cemer5yítodo)(el(dla 1Elllaisab|a¡(quelmls. |nnen<:¡onesxeran(mas(que.tamlcales 3y&5|empreilasfa_c_ep_tr due)|para¡(que&sea |mn(enamorada trquue.(estabaisal|endo)(cen(otro)",27
1075.3,726.3,99.4,37.1,56.5,"(tra 55¿I,o)ll ex ec¡a'(q ue1la[querla'(ella IMe$s¡ento i o o eo",27
413.7,1913.1,34.15,33.41,76.19,E B P W F S x B $ E © R E _ W E z A T D E F F A V T W z 8 W N H _ A F A A W © E D Z Y L 1 _ y S A F S € z 6 bB A E E F A 7 F P D $ z E N A P W A B A E € z A L F E ( . . : . M D A z R € E I W z B R D © W D A R E W l 6 F A y 1 € z M W P D € D € 3 © a Cmu id,27
751.25,1949.25,36.5,33.75,63.0,E € 2 €,27
