left,top,width,height,conf,text,page
1110.88,1362.49,38.13,23.19,57.61,"ACONSEJAS, RECOMIENDAS PORTUGUES . ABEJAS — DIOSES — NOMBRE — Tesla OKAY e in t e ee n l ea © l 58 w .¡S E EL l PA Bl E GENERO, 3* nu o E PI 1 36 Pg 33 n E 3 Eg la E ( FE 3 F FA F 2 E INGENIOSO,INTELIGENTE CORDERITO — RELATIVO P3 oe 3 MOLYBDENA ALGO % u El eu 80 A F F HALLARAS cede 05 o w PUEBLO F P4 3 F w Fel F EF E 33 2 37 LETRAS E 3 la ra F — CLONES y 71 F F HACIA a EF A ese — El F FE E %€ EF E $g_ 3 a E < 23 —FE + *) 5] < o Ed EE e E ra W un 30 W E po %E d 3 M o a EFE E © — a a",38
1296.67,160.5,104.0,23.5,90.17,VIERNES 18 DE DICIEMBRE DEL 2020,39
1121.86,522.15,80.77,23.26,87.96,":y FRENCH.— Buenos días, doctora *&& Carmen, reciba mis saludos y ben— ediciones por la labor que hace al leer nuestras cartas y darnos buenos con— lejos para encontrar el amor. Antes que termine este año quisiera cono— cer a un hombre, entre los 55 y 65 años, que sea leal, sincero y compren— sido para empezar una bonita amistad. Conforme vayamos hablando tal vez surja algo más. De preferencia que esté en Arequipa, pues yo vivo en esta linda ciudad. Los interesados en cono— verme pueden escribirme a mi correo: frenchllerena&gmail.com.",39
1675.06,608.41,152.35,48.12,62.18,"hifpta: Gradas£rtusbuenosd_eseos£stgz quealgunodem¡slec_tores be cartaysepmmaráaes_;)g crib¡rteparaconocerte¡Auníananvzge días parafina de año, 351 qpetodopu| lo asarenesteúempo.0u¡én sabey¡ade 2edaunagran A",39
587.9,838.6,86.2,34.8,80.5,"CARTAS: Jr. Jorge Salazar Arroz 171, tercer piso, Lima13. _",39
362.75,889.25,147.25,33.0,77.5,$¿QUE SIGNIFICA TU NOMBRE?,39
478.2,1005.2,50.2,25.2,75.4,”*De gran De origen celta.,39
531.5,1037.0,38.0,28.5,40.0,ee l d E,39
449.07,1091.43,59.64,23.14,90.29,"situaciones nuevas. Es un tanto sensible, pero a la hora de tomar decisiones impor—",39
492.12,1137.0,46.38,24.0,92.5,antes deja intervenir a la razón. En el,39
362.6,1171.6,53.0,27.6,90.0,"amor, es fiel y prudente.",39
413.96,1926.3,25.62,28.44,78.01,D E G E N E R U T S D 1 S — M C G D V G M G D U N V N S —y P E A H F A C C Ro P N F S E J E F Ro D V A N V L V o y F A G D U D N E N B C A L R O [ G Ro G V A — M G G D 1 D S S [ G O B 1 Ro S G D C N V O F U N U P R E G D F 0 ES T S B U E N F E H S Ro A L U C e D ea UNAS DE TIPO NEUROMUSCULAR. — DEL,39
989.9,997.7,55.8,30.5,62.4,"la i Guínness, las rosas Son laS uld más antiguas",39
905.67,1095.17,54.0,22.83,54.0,"*— ción, Los antiguos romanoS E",39
1631.75,889.25,91.25,30.75,76.5,&UN DÍA COMO HOY,39
1567.33,1044.44,69.11,25.56,80.44,"'Nace el actor estadounidense Brad Pitt, quien protagonizó ¡",39
1582.0,1170.0,62.0,29.0,74.0,pareja de Angelina Jolic.,39
1314.75,1246.0,243.75,61.5,87.25,LA ESCLEROSIS LATERAL AMIOTRÓFICA,39
1088.65,1926.12,27.88,29.54,71.51,A T l V A E V S | C G D T S | | el D V U N F S H a V X E A T G D — C S M S E N N V — N Lo Co M A E D E y N A U Y 1 O — N N F U L M 0 — M U O N E A A E R | | D N Ro T Ro S — y S O N S M E G N | A— Ro E | = » D S l G C Ro D E X E O C E O N A T Ro L U 0 F V G P F M T O — N | = o Ro Y M U Y D S — Xx S U M 0 R U | e E GRADUALMENTE MOTONEURON — SU FUNCIONAMIENTO — TUNA PARÁLISIS,39
1741.55,1884.96,26.44,29.25,70.52,J Y U G S X A— Roo A — L [ _ D M O Ro T A L T V L N M S S R L E 0 l E G A Ro D A M V 0 — |1 F A — N L V S D 0 E A Y A A F U R = | U V F V Ro P V X 0 V X A kal E 0 T— F N D Ro T Y o uU [El T A RD —M Roo D U D | el | T E D p <>DE PRONÓSTICO,39
2277.47,378.58,56.63,24.89,76.95,"e ! ARIES: Verás que todo cae M porsu propio peso, no hagas caso a malos comentarios. Esa 5",39
2255.67,534.33,63.89,21.22,85.0,". u TAURO: Realiza esos trá— mites pronto, no pierdas tiempo. Recuerda que en lavida hay que seragradecido.",39
2235.89,678.42,59.63,24.95,81.47,"GEMINIS: Podrías enterarte © < algo poco agradable, pero no te preocupes. Ese dinero lle— hará a tu poder.",39
2270.66,886.91,58.56,27.5,74.44,"e y : *.> artus propias fuentes de ingresos, seráimportanteparati. a ee ell Rp LEO: Lo que logres en el 1* futuro será producto de lo que hagas hoy. Planifica y orga—",39
2269.6,1082.4,75.2,28.6,65.0,La familia merece st ea a hagas aunlado. Buscasolucio— narco,39
2260.56,1220.81,58.75,19.25,82.81,.% LIBRA: Conversa con tu / Pareja sobre ese tema que te incomoda. Podrías concretar 220,39
2245.87,1409.35,69.06,26.35,78.74,"* , ”ESCORPIO: Intenta disfru— — < tarente día, pese a tus obli— naciones laborales. B%pode Cambios a nivel profesional. Actúa con <* *<* madurez para alcanzar tus metas, Deseas conquistar a esa",39
2267.71,1641.5,88.07,24.57,69.5,CAPRICORNIO: Lucha con (rasión e e ee e ese deseo largamente acari— ciado. Evitaderrocharesedinero.,39
2260.43,1774.67,55.81,23.19,77.38,m ACUARIO: Hay cosas que se * te pueden ir de las manos si no tomas precauciones. Mándale prevenir que lamentar.,39
2256.84,1923.16,63.32,21.05,85.95,£ *a.PISCIÍS: Recuerda que los inconvenientes son parte de la vida. Dale más atención a tu pareja. Todo saldrábien.,39
1116.0,156.38,96.25,30.88,76.62,TK _ VIERNES 18 DE DICIEMBRE DEL 2020,4
1999.33,1189.22,100.22,19.22,79.22,JUEG£:VII)LELFESA UNICORNIO LUCES DE COLORES 30 CM p FALDA,4
1296.38,1624.9,46.86,19.33,59.81,e PRECI_O E IMBAN EF 9 y AVIÓN CON ENCAJES l l y a WIN FUN TOYS [9 (e ' ATÚN,4
662.88,2093.06,79.47,19.82,69.47,ea COMERYACCESORIOS / HUECA CON CUNA Y ACCESORIOS en a UNEEDA TRIMOTOR BASICA CON CIRCULIN KING BABY,4
258.9,1822.4,14.1,44.7,83.6,"*PRECIO EXCLUSIVO CON CMR, Stock: 100 un a nivel nacional",4
1439.25,2161.0,60.0,15.5,90.75,LOL REMIX EARCLIP LOL,4
2144.6,2297.8,30.8,13.0,77.4,Elige el horario [ O,4
969.34,2345.9,21.76,20.07,64.45,l e= '£7 I__Ir a r o agenda ( guarda | = | | ¡ y a pv 'U J' U' l M J e e o E a,4
2396.17,2727.67,36.0,28.67,54.17,.. — paNteD Ano ey Pnusaunsz,4
265.0,478.5,144.38,54.25,78.0,MARISOLAFIRMA £UE LE DA MIEDO SALI CON ALGUIEN,40
957.75,2224.0,97.75,32.0,86.25,MALDITOS DEL CONO NORTE,40
1394.4,204.4,84.8,27.6,90.4,3 DE DICIEMBRE DEL 2020,40
1799.0,340.0,143.0,68.4,70.0,EL PILOTO —y NARCO Rico,40
1987.64,1634.6,65.36,24.02,88.24,"ste Búho no se sorprende de que el acaudalado miem— bro de una familia 'distinguida' de Lima como Fernando de Olazábal, Zeus', esté metido en el sucio negocio del narcotráfico internacional. Recuerdo el tristemente célebre caso de la banda internacional de la droga ”Los Camellos”, inte— grada por el corredor de autos y conocido empresario Bruno Chiappe. Es que en los años noventa se puso de moda que entre los jóvenes hijos de empresarios, que estudiaron en los más exclusivos colegios, algunos se convirtie— ran en 'manzanas podridas' y se dedicaron al nefasto negocio del narcotráfico. Como ocurrió con Gallos', banda liderada por los hermanos Pardo, que inundaban del desquiciado polvo blanco las discotecas de las playas del sur y Miraflores. Según los investigadores, reclutaba a bellas chicas para usarlas como y llevar algunos kilos de cocaína al extranjero a cambio de miles de ”verdes”. Uno de esos 'burriers' era Fernando de Olazábal, de solo 21 años. Cuan— do se sintió 'canchero' se puso a ”traquetear” por su cuenta. En 1999 fue arrestado por primera vez cuando preten— dió ingresar 4.5 kilos de cocaína al aeropuerto de Frankfurt, en Alemania. En el 2005 volvió a caer en el aeropuerto de Dublin, en Irlan— da. Sus influencias en la diplomacia le abrían las puertas de las prisiones en el extranjero. De regreso al Perú se vuelve jefe de 'burriers' y llenaba a Europa de droga al menudeo, sobre todo a Alemania, desde Bolivia y Perú por la ruta de Brasil, hasta ese momento no monitoreada por la policía antinarcóticos. Cuando cayeron algunas de sus 'mulas' y lo delataron, las autorida— des emitieron una orden de captura internacional que a la fecha se encuentra vigente y rige en toda Europa, pero el popular se hizo humo hasta hoy. Su nombre volvió a sonar en el 2012. Según fuentes de la Dirandro, hizo contacto con líderes de cárteles del narcotráfico, como el sinies— tro ”Grupo América” de la mano del capo Zoran, ”Mil Caras”. El serbio famoso por tener 43 identidades, quien mandó a construir un túnel para escapar del penal Miguel Castro Castro hace menos de un mes. Esta relación se probó en un vídeo realizado por el grupo 'Orión' en el 2016. Allí los vemos conversando como dos viejos a De Olazábal y el serbio Zoran, el de los dos metros de puro cinismo y maldad. Esa reunión constituyó el inicio de una alianza peligrosísima. El peruano suministraba la droga de Perú y Bolivia, y hasta consiguió secuaces del Callao para que 'preñaran' los contenedores de droga. Una vez que el barco paraba del Callao, la 'chamba' era del serbio en los puertos europeos. Con esta alianza tanto 'Zeus' como el pelado Zoran se hacían inmensamente ricos con toneladas de droga llega— da a Europa. Hasta que los sabuesos de antinarcóticos le echaron el guante. Tres cargamentos de casi una tonelada de cocaína le fue— ron decomisado en Pata y Lima. Cayeron sus socios chalacos, pero desapareció del mundo. Han pasado dos años y con el roche de su socio y su túnel se reactiva el caso de De Olazábal. El narco cometió el error de involucrar en sus sucios negocios a su esposa y a su familia. Hace unos días su pareja y su suegra fueron detenidas y acusadas de ser testaferro del susodicho. Además, le incautaron propiedades y vehículos por un monto de más de tres millones de dólares. Don Vito Corieone, ”El Padrino”, célebre personaje de la novela de Marzo Puzo, se volvería a morir en la ficción, porque para él la familia es sagrada y nunca se le involucra en los negocios turbios. Pero seguramente la justicia lo está presionando para que se entre— gue. Que no sea cobarde. Apago el televisor.",40
203.0,153.5,56.0,40.0,71.5,6 — (AL DÍA),6
475.03,1285.98,64.93,24.43,89.99,"Mi amigo, el fotógrafo Gary, llegó al restaurante por un espectacular caldo de gallina con presa grande, papita amarilla, dos huevos, limón y adicto molido. Des— pués se tomó una jarra con agita de anís para la buena digestión. ”María, no hay duda de que esta Navidad será muy diferente por todo lo que estamos viviendo con esta terrible pandemia. La noticia de que aún no hemos cerrado nada oficial con ningún laboratorio por la vacuna ha sido un golpe muy duro para el ánimo de la población, pero con mucha mayor razón es momento de cuidarnos y proteger al máximo a nuestras familias. Me parece genial la frase: 'Esta Navidad regala salud”. Más allá de las celebraciones, la paz, el amor, la esperan— za, la alegría y los buenos deseos, hay otros sentimientos que deben ser recuperados: el perdón y la reconciliación. En toda familia o sociedad es común que haya proble— mas causados por diferencias de criterio, malentendidos y también errores o faltas de alguna persona en perjuicio de otra. A veces también nos equivocamos o comete— mos una mala acción, pero debemos tener la hidalguía de aceptarlo y estar dispuestos a la enmienda. Esta fecha es propicia para ofrecer disculpas o darlas, según sea el caso, pero luego ya no pensar más en los problemas, sino solo en lo positivo que tiene la Navidad. Muchas veces el ajetreo de las compras, los gastos o el esfuerzo que hacemos por dar más de lo que podemos, nos deja ago— todos y terminamos entorpeciendo el espíritu navideño. Aquí te dejo algunos tips para pasar una bonita Noche— el las pequeñas cosas. El dinero y el poder no lo son todo. Las cosas sencillas, que parecen insignifican— tes, son las que verdaderamente tienen valor. Un beso, un gesto o un regalo humilde, pero dado con el corazón. &Habla con tus hijos. Estas fechas son ideales para reencontrarse con uno mismo y con los demás, incluso quienes viven con nosotros, pero que parecen estar lejos. Es una excelente ocasión para hablarles sobre el corona— virus y el valor de la salud. anticipa, prevé. No dejes todo para últi— ma hora, ni para mañana lo que puedes hacer hoy. Ten mucho cuidado si vas a salir a hacer compras, protégete. atrás los resentimientos y Es importante dar las gracias y enseñar a nuestros hijos a que las den, por todo lo que recibimos, por la vida, por el amor, por la comida, por el placer de convivir y estar |U 3 ejemplo de bondad y solidaridad. Enséñales a tus hijos a dar, a compartir y a reconocer que existen perso— nas que no cuentan con las mismas condiciones de vida que ellos”. Tiene razón mi amigo Gary. Qué linda es la Navidad. Me voy, cuídense.",6
1161.62,855.0,108.62,35.75,83.38,HABLA ENORME Extraña a sus amigos del barrio,6
1166.51,1029.88,58.33,21.86,86.71,"Extraño reunirme con los amigos de —* y y mi barrio. Lo hacíamos en la cuadra donde vivíamos. No tomábamos licor ni nada de eso, solo nos poníamos a conver— sar largo y tendido. Era un mate de risa. Hoy no se puede por esta pandemia que nos ataca.",6
1398.57,1217.43,34.43,28.0,58.57,(e E 1 a Vecino de Brea,6
1154.5,1382.85,67.65,23.98,89.9,"Debido a las medidas de bioseguridad para frenar el avance del coronavirus, todo tipo de reunión se encuentra prohibido. Sin embargo, esperamos que todo esto pase y las cosas vuel— van a la normalidad gradualmente. Solamente nos queda tener paciencia.",6
1397.27,2118.53,39.93,22.67,65.67,"ii e por Empresa Editora El ea | A No 171, La Victorta, La ee",6
1217.83,158.5,98.5,23.5,90.33,VIERNES 18 DE DICIEMBRE DEL 2020,6
1719.5,879.33,83.17,32.0,85.0,_ Lector está cansado de abusos,6
1772.22,1036.37,58.15,24.44,91.07,"C© Todos los días soy testigo de diferentes tipos de abusos, en la calle, transporte público y hasta en el centro de trabajo. Por ejemplo, existen personas con cierto cargo que no tratan a todos por igual y dan prefe— rancia a quienes, como se dice, les pasan la franela. Eso no debe ser.",6
1948.75,1212.5,113.0,25.5,79.5,Fernando Torres P. fertonparágmail.com,6
1769.05,1340.64,64.0,26.32,88.0,"23 Entendemos las molestias del lector, pero lo que debe hacer es relajarse, respirar hondo y seguir para adelante, Las injusticias se",6
1728.5,1406.4,48.8,22.2,86.0,— dan en todas las partes del mundo. Los proble—,6
1771.71,1452.71,54.06,24.06,91.24,"mas hay que tirarlos a la espalda. Eso sí, no hay que soportar abusos que sean extremos.",6
1797.5,2086.0,54.88,23.5,72.12,"E | Editora El Comercio S.A.Jr. Paracas g""m';n…",6
1860.75,2140.0,62.5,28.5,80.75,Todos los derechos reservados.,6
2254.76,415.95,80.05,33.62,88.11,"d Lima (verdaderos hinchas) voy a darle bombazos a Ricardo Burga por meterse en lo que no le importa. En el fútbol hay dignidad señor Burga, algo que ni usted ni su partido tienen. ©margarita_roro MARGARITA ROMERO",6
2261.0,687.08,74.62,32.38,82.85,"Bueno, me parece bien que dinero, Al menos es sincera con M d",6
2261.67,1009.83,49.75,24.33,90.0,¿Está de acuerdo que no acuden carros en Navidad y Año Nuevo?,6
2211.22,1121.11,78.11,32.22,87.22,AYER ¿Cree que pronto traerán las vacunas al Perú?,6
2270.6,1249.2,120.8,34.4,57.6,24% NO76% * TROME.PE DÓLAR,6
2173.29,1703.43,61.64,21.57,78.07,Tn + e Águilas Negras Escuadrón verde Luz del Sur Semanal Indecopi Enel Perú,6
2416.0,1733.56,67.78,25.0,57.0,105 5 sr 4276904 3178000 2247777 TA TA A,6
2107.93,2065.07,40.93,21.6,85.13,Impreso en la Planta Dando de Empresa .. Hecho el Depósito Legal en la Biblioteca,6
2280.5,2126.0,57.83,27.0,82.08,p Los artículos firmados y/o de opm|on son de exclusiva responsabilidad de,6
1870.8,2173.6,45.4,26.4,43.8,m9999 la ee ea d,6
247.77,1539.85,122.69,30.85,82.23,"ntegrantesdelaban— da'Los MalditosdelCono entretenlos un padre y suhijo, que se dedicaban pa— das, fueron arrestados cuando sedesplaza—",7
252.0,2433.6,139.8,69.6,75.6,o cabecilla de ”Los Cangris',7
266.57,2593.14,47.14,32.57,64.14,"es a G? cía (23), cabecilla de",7
643.77,1555.69,161.23,29.31,74.0,"banenunvehículohurtado, en 0 Antelasmúltipies denuncias derobosdecamionetasendis— tritosdelCono NortedeLima y graciasavideosquecapta— ronestosatracos, agentes de la Di—",7
711.12,2453.77,64.62,23.46,86.08,"la banda 'Los Canario del Norte”, se presentaba en sus redes sociales como un peligro— so delincuente que portaba una réplica de minimi para atemorizar a",7
1006.77,1137.69,98.08,38.92,77.92,Viejo y Fresa' son integrantes de la banda ”Los Malditos del Cono Norte',7
1033.3,1508.15,168.45,30.65,64.65,"reccióndelnteligencia (Dirin)y delaDivisióndeRobosdela Di— rin cri empezaron a seguir les lospasosaestosladrones. Graciasadatosdeinforman— tes, los detectives llegaron a la zonate Belaunde, enComas, donde dos miembros de esta organizacióncriminal, enana e la ee a",7
1031.91,2480.34,61.43,22.97,91.34,sus víctimas. Pero en realidad era un asal— tante que se dedicaba a atacar mujeres en buses de transporte público para arrebatar— les celulares y demás. Las amenazaba con un arma de fuego y luego,7
1424.06,1522.98,158.69,28.72,67.55,"tier on para reunirse con sus cómplices. Lossospechosostomaronsus precauciones y luego de acudir lle— garon al cruce de las avenida s ChimpuOclloy Condorcan— llo, sin imaginar quelosinvestigadoreslosse— guíandiscretamente. Cuandounautoazulcondos ocupanteslesdioelencuentro, losinvestigadoreslosrodea— (P (e DETENIDOS Eneloperativopolicialcaye— ronFélixMundanaVargas (55), Mundana' y hijo Bryan Mundana Huertas(31), 'Fresa', quienes salieron de Belaunde enunacamionetaminivánro— badael23deenero delpresen— teaboy quecirculabaconpla— duplicada deotrovehículo consimilarescaracterísticas. Conellosfuerondetenidos JuanCarlosRejasGorzales (41),'China' y MiguelÁnge!Á!— Chucha” quienseidentificó con otro nombre porquees— tab a requisitor i ado por robo agravado. Estabanenunauto Toyo— ta Yaris, en cuyo interior los agentesencontraronunre— vólver. Oraciones deinteli— agencia sesupoqueestaban— dahabríarobadoamanoar— madaunvehículo en el interior deunlocaldelavadodeautos, DE y la es a e y ea conocido para la Policía.Enla décadadelosnoventa sele vinculóalabanda 'Los Des— tructores”, que asaltóunban— coenSayán,alnortedeLi— ma.",7
1502.26,2465.94,61.74,25.03,86.06,de les roba— ba sus pertenendias. Fue capturado en la urbani— nación San Antonio de Carabao llo. El detenido cuenta con denun— dias por robo agravado y violación sexual. (M. [<],7
1811.29,707.71,151.14,42.29,88.29,EL SALVADOR Empresario se enfrenta a rateros,7
1850.55,1072.6,68.24,23.74,88.52,"Arriesgando su vida, el empresario Tener Ortiz (42) se enfrentó con sus propias manos a dos delincuentes armados, quienes no dudaron en dispararle para robarle su moderna camione— ta, en Villa El Salvador. la víctima resultó ile— pese a la ayuda de",7
1802.62,1507.25,110.75,48.62,76.62,EL A ”Pichón' cae por muerte de policía,7
1831.97,2061.19,62.2,24.84,85.45,"G» Un delincuente comer— realizaba drogas en inmediaciones de un hos— pital, en el Rimac, fue arrestado porque habría asesinado de un disparo a un teniente de la Policía Nacional en retiro. Pese a que opuso tenaz resistencia e intentó esca— r, Jorge Espinosa Carrillo 25), Pichón;, fue arrestado en el parque Mater— no Infantil, frente al nosocomial de la PNP 'Augusto B. *Pichón' habría matado al oficial Vic— tor Torres Novoa, cuyo cadáver fue halla— do el 17 de julio pasado. Se le encontró pasta es marihua— — Giro G",7
2274.22,805.28,59.38,24.65,84.19,"[ ea e no pudo impedir el atraco. ”Metí la camione— (e y cuando estoy saliendo los tipos l golpearon la cabe— za y dijeron: 'Ya perdiste, tío'. Uno me apuntó a la cabeza, pero, en un descuido, lo agarré del cuello y pido ayuda. El otro disparó al aire y me E l a e con el cuerpo de su amigo hasta que este se liberó”, contó. Los vecinos de Ortiz salie— ron a la calle y colocaron piedras en el camino. Los ladrones abordaron la Hi Lux de placa AVS—931 y lograron escapar. En el vehícu— ee e! 800 soles destinados para comprar productos. (. Yucra)",7
2261.61,2270.13,63.48,25.0,88.35,"Un venezola— © no de 30 años, aproximadamente, fue asesinado de cuchilla— das en el cuello, luego de sostener una pelea con El cuerpo del extranje— ro fue encontrado en la puerta de un hospeda— je ubicado en la cuadra 3 del jirón Miguel Eljoven [Cercado de Lima). Efectivos policiales indi— caron que hasta el momento la víctima no ha podido ser identificada, pero tendría pocos días de haber llegado a nuestro país. (M. Flores)",7
1217.83,158.67,98.33,23.33,90.17,VIERNES 18 DE DICIEMBRE DEL 2020,8
1762.0,284.2,108.0,23.8,65.8,GANADOR $/500 peL pia 17/12/20,8
1717.38,360.62,54.46,14.0,84.46,NOMBRE: ALLYSON LOVER DISTRITO: LOS OLIVOS No DE LA SUERTE: 4909474 E 5,8
1090.67,537.17,299.67,107.83,84.17,Este domingo regalamos 5 mil soles,8
1177.7,1035.72,87.54,30.49,71.34,"ojos el diario ga einscríbetellamando A esta a Recuerda quedas anotados desde e lunes más leído del Perú — al710—02600mediante p nuestras promociones 14 hasta el domingo 20 ynos debemos a nuestra web (trome.pe). ganador ||ena realizan bajolaaten— — dediciembre. nuestros lectores. — Puedes hacerlo desde 7 b | "" ta mirada de un not ario _ PASAPORCAJA Por eso, este domingo las6delamaña— uS público, quien siempre Ayer, jueves 17 de di— sort e aremos los 5 n a hasta las 4 otorga el tradicional 'es — ciembre, la lectora mil soles del delatarde. superior dela portada), — conforme” que se llevó el premio tan semanal' dela Anotatu'nú— DNI y teléfonofijoy/oce— — Yparaquetengasmás de 500 soles fue la si — SúperLlamadaGa— merodea lular. A las Sen punto de — chances de llevarte este — guiente: Allyson Love— nadora. suerte' (apare— la tarde, reconocerá el billetan, concursar los ra (4909474, de Los Oli— hagamos lar creen la parte nombre del ganador. diarios que hayan sido vos). [<] OTRAS 500 LOQUETIENECADA i —— CANASTA: [q e |: e ea E$¡TIE MARTE$ ;; ipa“m'¿m 21 E;1;|o1 comilsade, m it ¡ AA n M A$ CAN A$?A$ man;aá::mnas. H] P"" nl. (c[oin£xemu.1íiima) lo)¡(gfalníivás¡ E a 52¿)|'UIUK?MB] on . ;;2 mu e harina. | 0%o] re ) rfñ_] |l_n_ijmri'gguc. l |tg!e ¡i'(ciFsiñkuss;xy¿anxcito)¡?r. NAV""ENAS > 3 bolsas de pan de I I .$(l:(olnnlE?íle|Iis¡áj¡£0(íul¡ll!k'd[eí¡[o]nl y ir ) l""[£fx&iili[lá$lúl[olhl,E€í—*…fg]úlhl(d| ra ta d 1 © Con Tome y Don Lucho pasa— e a rás una linda Navidad, ya que srd to adion err a — pies pollícetes en el regalan mil canastas. Ya salieron senales y el S stonitanties: y",8
352.83,1534.89,64.89,24.67,89.67,las primeras 500 y las otras 500 serán cortadas este martes 22 de diciembre. ¡No dejes de participar!,8
1046.0,1543.0,41.75,23.17,92.75,"de la suer— te' de tu diario, el que aparece en la",8
695.78,1766.61,66.37,25.32,85.58,"Participar es muy fácil, solo tienes parte superior de que inscribirte has— la portada. ta el domingo 20 de ”Las mejores pro— diciembre en https:// l ea e e eg e promociones.tro— mi diario favorito y ahora me.pe/registros/ con Don Lucho se han ano— canastas— tado un porotazo. Espero trome/, que la suerte me acompañe y donde pon— así poder ganarme una de las irás tus canastas”, indicó Gabriel Urtea— datos per— ga, de San Miguel.",8
1418.25,1650.25,122.25,23.75,78.0,&BENEFICIO DE LA GUANABANA,8
1335.67,1868.1,86.0,25.43,84.33,"G» La guanabana aporta múltiples beneficios a nuestro organismo, entre ellos tenemos: Alas sustancias que contiene te ayudan a combatir enfermedades",8
2270.07,1685.57,72.07,23.71,90.29,cia y retrasar el proceso de envejecimiento. rica en componentes no nutricionales. Uno de,8
2031.56,1835.33,66.81,23.92,87.56,"comunes, como resfria— ellos es la gran cantidad dos. Es rica fuente de de fibra, muy buena para vitamina C. tu salud digestiva. Contiene exce— Posee fósforo y calcio, lentes propiedades por lo que resulta benefi—",8
1697.86,1961.43,75.86,24.29,91.14,"antioxidantes, y ayuda a aumentar la resisten—",8
2324.0,1946.29,42.14,23.43,90.29,coso para la salud de tus o,8
1491.12,158.62,85.12,28.75,87.0,VIERNES 18 DE DICIEMBRE DEL 2020 — 9,9
460.82,787.32,101.0,29.86,84.82,"Cerámica Palma Belga 45 x 45 cm Uso: paso Aplicación: interior / exterior Rendimiento por caja: 2,44 m? Acabado: brillante Sku: 3656179",9
1033.54,1487.14,60.34,23.54,76.0,"LEVANCE 9 Pack de 9 cintas de E & oo Embalaje 740 Prismáticos LED Largo E/18|d¡dzt-15: E e Dimensiones: 120 x 13.5 Cinta doble contacto Uso: pared Í$%|%Tca p iu ie Medidas: 2,4 cm x 10 m ápli5ación: interior | E Colar: blanco rendimiento por caja: 1.63 m I MI",9
1357.29,1619.71,86.43,43.0,62.71,8/ 8/ 2.90 / 25.90 x m?,9
1440.5,1852.75,90.88,44.75,62.38,Hidrolavadora I!QR£.'(&Q I! QR£ (g? T' CRE (€o,9
1204.97,1961.03,57.73,24.27,62.3,EE F Tripla Fanático l|;¡::g ?ne desagüe ;:¡bg d Ilu'go gc eléctrica l a Md a ... M P Material: PVC aterial: tripla fólico . p r Uso: agua fría,9
1151.4,2041.8,81.6,29.2,57.0,ie g:horz ;2¿grza7l Sku: 1865048,9
