left,top,width,height,conf,text,page
781.0,117.0,115.25,35.25,46.25,a ea Whatsapp (951:665.767 — (facebookcomiitromepe; — (atromepe,1
1018.0,1169.0,58.6,37.6,62.2,Wl F GA 1 |3,1
262.17,616.17,112.0,58.83,44.5,Arrestada 1| el e ee e,10
266.83,773.0,70.33,25.5,84.92,"Acusándola de vestir © F prendas provocativas, lo que está prohibido por",10
252.4,836.0,63.0,25.2,90.6,"ley, la modelo Salma al—Shi—",10
343.25,933.0,192.75,40.0,66.75,"SEPA — >Tiene3.2metrosdelargo, 0.6metrosdealtoylmetrode",10
675.0,524.89,61.67,24.28,88.14,"mi fue arrestada por la Policía de Egipto en las cercanías de la pirámi— de de Zoser, que tiene una antiguedad de 4 mil 700 años. el bién fue detenido un fotógrafo. La mode— lo lucía un vestido blanco muy ceñido al cuerpo y revelador. Ade— más, portaba joyas al estilo faraónico. Le esperaría una fuer— te multa y una serie de trabajos comunitarios.G",10
631.91,1006.91,56.73,26.36,71.45,—Su forma es como la de una gota de lluvia EE,10
1158.0,518.0,87.25,32.0,45.0,©%í)j'&íñáalnnmr lentes ss a,10
1194.83,157.33,93.0,24.67,90.67,SÁBADO 5 DE DICIEMBRE DEL 2020,10
1293.3,636.7,50.0,25.2,37.4,a e ii e ese e ”Revitz quiere mls ls,10
682.82,1091.27,92.0,29.09,83.82,—ShellEco—Marathon reúnen una competencia anual jóvenes ingenieros metodo el mundo para,10
688.0,1142.0,85.0,28.33,56.0,aplicar soluciones energéticas máslimpias en el a,10
401.75,1432.5,491.5,144.75,59.75,temne su primer auto f elect nico,10
298.38,1867.38,154.88,30.25,72.88,"rua nos no solo se han ganadoelrespetomo— vilizándoseporlasca.— les exigiendo unaverdade— rademocracia, también vie— nen haciendo gala desusco— nocimientos, sobretodo el",10
771.72,1844.67,145.0,27.39,69.83,"Ungrupodeelloshan creado primer carro eléc— rico hecho el país,conel que buscan participaron la ShellEco—Marathon,lacom— potencia más grandedelmun— doenlaconstrucción de vehí—",10
1089.22,2285.11,40.06,27.06,40.78,"la los S unos e st a ie ld úpxoxa""|ríisfs a on n avión puesto a om n",10
799.22,2340.78,57.0,27.67,43.67,odian ecamenció con llos 6 consejos e ea s,10
2010.86,318.57,159.29,58.86,85.86,Cuentan historia de la pandemia en cerveza,10
1813.43,661.86,63.54,24.57,88.29,"G» Wang Far3, de una microcer— vencería en China, decidió crear una cerveza llamada la que conmemora los 76 días de con— refinamiento en la ciudad china don— de apareció por primera vez el Covid—19.",10
1805.73,1026.36,159.09,30.36,80.55,"culos especiales paralo— gr arla mayor eficiencia energética. David Tenorio Niñez (19), unodesuscreado— res,miembro del equipo",10
1864.85,1293.07,115.74,28.07,69.81,"KON Team y alumno de la Universidad delngenie— ría y Tecnología(UTEC), cuentaquealcarrolepu— dieron ''Jaguar. ”Sequie— re con cient izar a la socie— dad peruana sobre uso energías renovables y promover desa— lv e e",10
1514.31,1919.85,101.08,38.0,88.85,y se busca concientizar a la sociedad sobre el uso de energías renovables,10
1632.38,2119.75,157.62,55.5,88.62,Solicitan aprobar ley que autoriza uso de vacunas,10
1986.17,2242.0,44.67,26.0,90.83,"de la Digemid, y así pue—",10
1455.71,2254.86,67.43,29.14,82.0,"El viceministro de GO Salud Pública, Luis",10
1463.38,2326.0,70.25,25.62,90.88,"Suárez, solicitó al Con— preso aprobar el proyecto",10
1483.98,2492.1,62.64,23.95,89.6,de ley que permitirá autori— zar el uso de emergencia de la vacuna contra el Covid—19. Señaló que es importante que el Legislativo otorgue el vis— to bueno a la norma porque permitirá que las vacunas que lleguen cuenten con el registro,10
1943.94,2355.18,57.47,23.65,85.65,dan ser aplicadas. ”Hay varias situacio— e vacuna y una de ellas es que pueda ser regis—,10
1878.0,2461.29,71.86,23.0,90.86,trata oficialmente en el sistema de medica—,10
1933.67,2544.83,75.5,22.42,91.17,"mentos, como vacuna de emergencia, como se está haciendo en otros países”,",10
2327.6,625.15,53.2,24.2,83.88,"”Si uno jala la etiqueta de la cerveza, que se vende en lata, podrá leer, como E e e (e la historia de la pandemia. Fueron días complicados y con el esfuerzo de todos se pudo salir adelante”, 1 o",10
2222.79,1426.23,167.91,28.85,72.11,"llosostenibleeinnova— ciónenlaindustria pe— ruana”, acotó. CONSTRUCCIÓN Indicóquelapandemia delcoronaviruslosretra— sun poco en sutrabajo, peronosedetuvieron. ”El diseño del vehículocon— fluyó y empezamos con suconstrucción, saque debe estar terminada pa— ra febrerodelañoentran— te”, manifestó. Tambiénreveló quealca— bioeléctrico pusieron por— quees serálaimagen quenosidentificará para representar al KONTeamseencuen:— tra con formado por universitarios dedife— rentescarrerasdein— geniería: Mecáni— ca, Industrial,dela Energía, Electró— nica, Mecatrónica, Ambiental, Civil y Bioingeniería.",10
1218.38,567.69,99.25,39.69,83.25,33 Jefferson Harán se habría desanimado de llegar a Alianza Lima porque no desea jugar en,11
722.4,2078.2,76.3,21.8,89.7,Y AYACUCHO FC DEFINEN AL GANADOR DE LA FASE 2,11
585.22,2480.92,63.45,24.76,89.06,"(($ Para uno es una obligación, para el otro un sueño. Sporting Cristal y Ayacucho FC definen hoy al ganador de la Fase 2 de La Liga 1, a las 2 de la tarde, en el 'Monumental. Los celestes ganaron el grupo A sin conocer la derrota, mientras los a ya cuchan os vinieron de atrás para adueñarse de la serie B con una racha de seis triunfos seguidos. Roberto Mosquea enviará lo mejor que tiene con Horacio Calcaterra, Jorge Cazulo, Emanuel Herrera, Washington Corozo y Christopher Olivares. Los *Zorros' apostarán por Carlos Olascuaga y Mauricio Montes en su ataque. G",11
1747.17,890.06,77.19,25.48,80.57,"Pienso en regresara Alian— alima cuando termine contrato con Lokomotiv”. Aquel deseo de Jefferson Harán queilusionó a los hinchas se desmoronando con el paso de los días. Trascendió queya setenta un recuerdo con la 'Foquita”, quienes habría mostrado contento porvol— vera vestir los colores blanquiazu— les y tener actividad pensando en la selección. Parajugar en la Liga 2 es algo queno lo entusiasma. El delantero preferi— ría una oferta del exterior paracon— tintarron sucarrera. Los directi— vos lo siguen buscando para fichar— lo intentar con gracia rse con la hin— chada, pero Tartán no daría subra— zoatorcer. Sesuto que algo similarhabría pa— sado tonel seleccionado ecuato— piano GabrielAchilier. El defensa, de 35 años, tenía arreglada su llegada a La Victoria, inclusotrascendió que percibirla un sueldo de 20 mil dó— lares mensuales, pero al acerque",11
2218.22,740.35,71.18,26.43,80.53,"Alianzajugaráen Segunda Divisin desistiría de llegar al Perú. PUNTOYAPARTE Alianza Lima lucha por seguirán Pri— mera. Se aferra a todo lo queest a su alcance, peroempezó perdiendo el partido en las oficinas. La Comi— sin Disciplinaria de la Federación declaró infundado su reclamo para que le otorguen los puntos del due— lo ante Sport Huancayo, aduciendo queen técnico rival, Wilmar Valen— cia, incumplió los protocolos debio— seguridad. Ellos próximos días reconocerá el fallo del pedido que hizo para que le esten puntos a Carlos Stein porin— cumplir con los pagos a sus jugado— res.",11
2137.87,1241.07,66.27,29.53,84.67,E ALIANZA LIMA acudiría al TAS y se calcula que obtendrían respuesta en medio año.,11
2264.02,2300.34,64.44,30.7,85.8,"_ SHAY EMPATE en tiempo reglamentario se usarán 30 minutos más. e persistir la igualdad definirá por penales. — SI CRISTAL gana jugará de frente la final con la 'U' por el título nacional. AYACUCHO FC VENCE, volverá a chocar con Cristal en semifinales determinar al rival de la 'U”.",11
291.75,446.0,30.75,24.0,31.25,o EE p a,12
290.99,1547.97,62.81,24.28,88.83,"DEL SAQUE somos carnecita... YA ME CONTARON QUE UN GAMBITO que tiene una pelea de gatos en la cabeza está prohibi— do de ir a Muñoz, en el Rimac, porque la gente de ese barrio le ha puesto la cruz. Aseguran que se ha portado mal con una chica que le daba cari— ño y le alzó la voz un par de veces con ajos y cebo— llas. Los ”palomillas' de la zona están volando y también desean chapar— lo del cuello para pasarle dado al equipo íntimo a Segunda. Qué palta... ASÍ QUE UN VOLANTE que cuando iba al cine siem— pre pedía canchita, está con roche por la aveni— da La Paz. Dicen que le ofreció un billete a una viuda sin que ella le pida y lo malo es que la ilusio— nó y hasta ahorita no se aparece. La doña conta— ba con ese ”centro' y él la ha bloqueado del Whats— App. Así no es... A TODOS LOS ENTRENADORES les aviso que en un hotel mira flori no anda alojado el más grande ”parti— dor' de nuestra pelotita, el popular El hombre llama, timbra, ”pinta pajaritos' y se ofre— ce para dirigir. A ese le das un ”sajiro' y se va de avan— ce. Nooooo... EL OTRO DÍA VI al Racing de Argentina eliminar al Fla— mengo, último campeón de la Copa Libertadores. Los gauchos, grandes estrellas, con un fút— bol dinámico y veloz, se tumbaron a los garotos. Pensar que el chama— co Peli se puso en plan y no quiso ir para quedarse a pelear la baja con Can— toldo y seguir en la ”joda' del Callao. Ojalá que reac— cine a tiempo y no se pierda. A veces el tren no pasa dos veces. Así es...",12
237.75,2578.75,54.25,25.75,91.5,"Me voy, soy fuga.",12
784.12,813.97,56.54,24.73,88.49,"menos Aires.— Diego volvía felices a los tristes y sabio al B Burrito” La partida de Mara— dona sigue dejando historias y ahora le tocó el tuvo a Ariel Ortega. El volante de River Plate se emo— clonó hasta las lágrimas al relatar su convivencia con el 10' cuando partieron con la albi celeste una gira previa al Mundial de Estados Unidos 155 ”La verdad no quería que me tocara estar en la habitación con Diego, me daba vergúenza... Al final, fue increí— ble: parecía que yo era Paradoja y él era Ortega. 'Agarrá el control [remo— tol, hacé lo que quieras', me decía. Yo, en vez de mirar la televisión, lo mira— ba. No quería tocar nada, me tiraba en la cama a ver el techo. Ahí vi su humil— dad en persona. Un ser tan grande, el máximo exponente del fútbol y que me tratara de esa forma fue increíble”, contó el en ”TyC Sports” De posición similar en la cancha — ambos volantes creativos— Ortega siguió describiendo sus emociones en aquella gira. ”Durante las prác— ticas quería quedar afuera de los equipos para sentarme a un costa— do a mirarlo. A Diego lo amo. No tengo palabras para describir lo que signifi— ca para mí, me apoyó en momentos",12
808.5,1370.33,70.17,26.33,90.0,difíciles. Cuando sos pendejo y estás,12
1449.45,1419.32,89.68,37.29,85.89,"bordeando por ahí, chupando, uno ___ 33 Ariel Ortega recordó cuando le tocó compartir habitación con Diego er necesita un abrazo y un consejo: — la selección argentina y que el 10' siempre estuvo en sus momentos difíciles",12
776.73,1519.0,60.73,24.0,84.88,"lo dio, Siempre estuvo en los momen— tos difíciles. En ese Mundial dijo que ”le cortaron las pienas”, fue un golpe durísimo. Con él éramos campeones”,",12
1721.6,1565.73,72.87,33.27,89.6,"Para mí, Diego no ha muerto. Está aquí” Quiero que mi hermano descanse en paz”",12
1497.93,1750.4,80.41,31.28,81.72,"finalizó. o MIGUEL BRINDISI, ARGENTINO ESTADIO DE Nápoles.— El estadio del M H£-*&…o… Napoli ha pasado a llamar— TQZ©S se, de manera oficial, HAY UN CONTENIDO Armando Maridona' El recin— 200 artículos de Marido ILA ©A$ A to donde brilló el 10' dejó de encuentran bajo custodia ser 'San Paolo' gracias a una EN DICHO BAÚL hay :",12
2417.33,1957.73,84.13,30.87,79.73,"|c 0 Andrés Calamaro, hast de Dubái. ALMA MARADONA, Diego, confirmó que seg¡ s ir",12
1178.39,1983.74,60.92,24.95,89.39,"resolución, aprobada por una— nimidad, por el Ayuntamiento de la ciudad. El estreno del fla— mente recinto será el 10 de diciembre cuando el cuadro napolitano reciba a Real Socie— dad por la Liga de Europa. — 8",12
1831.71,2110.86,93.29,31.43,81.71,en la Copa L|bertadores LIBRÓ CARCEL %LL%XIDA,12
1014.0,2208.0,170.0,79.0,77.8,SE HACE EL DUQUE nei,12
1431.8,2378.38,67.42,25.4,86.81,"© Buenos Aires.— La vida de Diego Paradoja © Buenos Aires.— Leopoldo Luque, el médico que también estuvo marcada por los videojuegos cuidó los últimos días a Paradoja, fue eximido que se hicieron en su honor. El primero fue 'Peter momentáneamente de prisión por la justicia argentina. Hilton Handbal!, allí Diego no aparecía y se cen— El galeno era investigado por 'homicidio culposo”. La traba en el fútbol inglés. Luego vino el 'Seibu Cup defensa alegó que 'Diego decidía por sí solo y rompía Soccer”, donde el 70' se mostraba con un ”african constantemente los contratos tácito con sus profe—",12
1439.21,2510.44,67.88,24.85,82.82,"Jook”. El *PC Fútbol 5.0' fue exclusivo para compu— sionales”. Mientras, Fernando Signorini, preparador adora y podías jugar con el Diego en Boca Juniors. físico del 710”, despidió a su amigo. ”Gracias por trans.—",12
1458.46,2570.69,60.96,23.27,86.31,"Los últimos en aparecer fueron ”Winning Eleven” formar una vida ordinaria, como la mía, en una vida y con el que Paradoja mantuvo un litigio, E",12
1824.0,2610.83,67.83,23.17,91.67,pero terminó llegando a un acuerdo.,12
305.2,702.0,151.6,40.2,65.6,"I_[n (gresala Ia'Gopa1L|bertadores¡ponla puertajgran— |_(de,y¡em",14
341.48,987.1,153.88,35.57,55.0,"[2££ (qu¡en Jug0ene|'descendldo]Llacua— (baniba;arreglócon Ios'crema ¡_p0r temporadas Elatacantetanctó 9(goles'en lal temp0ra— lllego'a'senconvocad0'a laselecciónyitambiéntestu— vo en""a*agenda'de'A'l|anza1lea a e ee unigrandenoesifácilTie= exp en ment adapa E a (gu¡en,y ei o que;s¡gn|flca&¡ugar (entla” ¡U""¡,lleaconsequaur0 tudiantil. Lostdirectivosteremasise |parajped¡run'adelanto'de |05ítreamullones'de o regibirán; p0nsu¿partlc¡pac¡on nenlafaseide; (de.la(00pa lLa ee pelearon sugoleadon]onatha es",14
270.73,1642.67,84.93,27.87,49.4,M e Lateral Rodr|go'Cuba¡ (es/el a a CesarVallejo (queitambiéntenovó ¡contratotal DTijosé;del To e ea l,14
1059.54,1352.54,105.08,39.0,78.85,£3 Delantero ÁALSLVALERA dejó Llacuabamba y es el nuevo refuerzo de la 'U',14
857.6,1633.0,283.0,39.4,58.2,"IElargentmoPabloGarabello» [47]sepusoelbuzod reemplazode¿FrancoNavarm (El (Rekermanenilaselecciónde,",14
1967.83,698.67,167.5,38.0,52.04,"C)>Renato |Tap|a$s¡gue(consolldandose(en(Gelt/a u (queI|ogr0)su15egundo¡tnunfo.en ( ” peruanossupero»2*'0(de&v|S|tafa|/Athlet¡c'deiB¡l' (bao (9 ) en l la fecha no (de l all liga tespañolay' |Tap|aise;gano todos lastglagios. Gan0112'deí1&duel05í¡ndw¡duales¡y'e|lbra— (ex(Celtayylhoy<ean8G llodlestacé: ”Aplausos: RenatoiTapia”, Tw¡tter",14
1919.1,1056.58,76.02,27.32,78.58,"©Suhmpecable actuación ante Cali, con gol inclui— do en la Sudamericana, disparó El zaque— iro de Vez integra el de la vuelta de delitomeo. Abram fue convoca— do para el duelo delo (5:20 pm./ Ty C Sports) contratPatronatojpor gallina argentina. Mientras, cuatro _ DE. compañeros.suyos; entre ellos.el — LA SUDAMERICANA",14
1959.6,1237.8,116.6,30.6,75.4,"¡polémico Ricardo Centurión, fue— /A….RAM",14
1882.75,1272.5,99.5,21.75,67.0,tron involucrados:en una v¡olac¡on,14
2105.12,1352.12,141.0,44.0,50.75,) CA'M PO MÁS/GANADORIENIORLANDOCITY a ni a (e,14
1880.48,1624.38,141.34,34.76,61.72,"C) EI p0rterolPedro G'allesexse1que— 'd05.premuos.lnd|V|duales ten TalMLUS. |Trasl|askv0tac¡ones¡deilos lh|nchas,(elÍ Pu|po(gano(en la igoríatal mejor fichajedeQrlandolGity 'en,2©205y|me¡or Jugad0r'de a parada enteliclub, ísuperando(al(ex Manchester United, El |p0rtugues e ea íteo(el|peruan0(queífuesubcampe'ón Back'en lajprime=",14
330.6,1262.0,98.8,22.0,84.2,&$LEEDS VISITA HOY AL CHELSEA,15
1306.33,159.17,98.0,24.83,90.5,<ÁBADO 5 DE DICIEMBRE DEL 2020,15
1143.57,294.0,76.57,22.0,78.57,& 'NEY PRESIONA A PSG CON FICHAR,15
1192.75,949.88,66.75,30.62,82.38,para negociar con cual— mier club desde enero,15
1171.38,1072.38,73.5,47.38,70.38,H?Y:Mont PSG (3 p.m./Fox Sports) ñ£uven VÍ. Torino,15
1080.18,1692.12,58.04,25.96,84.78,"(© Londres.— Leeds, de Marcelo Bielsa, tendrá hoy (3 p.m./Espn 3) una dura prueba cuando visi— te al Chelsea por la fecha 11 de la Premier League. El equipo del ”Loco' ganó tres de sus últimos cinco par— todos fuera de casa. Los *Blues' vienen de golpear en Champions. Manches— ter City será local ante ( e l United juega ante West Ham (12:30 p.m.) y Everton visita a Brumley (7:30 a.m/ )",15
1523.29,692.3,59.52,24.63,87.23,"© París.— Ney— mar condiciona su renovación en PSG y solo lo hará si fichan a Messi. El presidente del club Nasser Al—Khelai— fi se encuentra en España y respon— — dió al brasileño: ”El es jugador del Bar— celona. No puedo hablar de eso”, dijo. Según medios fran— ceses, el directivo tendría contacto con el entorno de 'Leo' para empe— zar a dar forma al fichaje. La 'Pulga” reaparece hoy con 'Barza', que visita al Cáliz [3 p.m./Espn Madrid choca con DTV—610).",15
1880.88,782.5,69.12,26.0,61.0,220 d y 5 VOLVIO CON SU FAMILIA,15
2046.3,1047.49,71.12,24.36,89.26,"(© El reencuentro. Luis Suarez volvió a su hogar, tras supe— rar el coronavirus, y tuvo un emotivo recibimiento de su familia con besos y abrazos. El 'Pistolero' olvidó así las penas, luego de enterarse que cuatro profesores universita— rios italianos fueron despedidos por facilitarle las respuestas en el examen del idioma, que dio en setiembre, para obtener el pasaporte comunitario. El uruguay aparecería hoy con Atlético de Madrid ante Valladolid (12:30 p.m./Espn).",15
1529.78,250.89,72.33,41.11,91.33,EL DÍA DE LA MUJER SON TODOS LOS SÁBADOS,16
1865.38,988.54,121.04,26.42,72.67,"scon— ducto— ra, mode— [ Z amiss Mundo 2004Ma— glt mi halogra— doconempeño y dedica— cióncumplircadaunode sus sueños, como actuar entelenovelaseincursio— naren el negocio delhos— pedaje.",16
1787.13,1400.87,138.17,30.09,78.0,"Maju, ¿quéeslomás bonito quete ha dado la E Poder llegara muchas familias peruanas que buscan un momento de alegría y compañía.Que se te acerquen y tengan que sediviertenmucho, mehacefeliz.",16
1802.4,1683.4,121.3,32.0,78.7,¿Qué haces primero al despertar? Agradecer Dios.Abrazar a mis hijos y a miesposo.,16
1781.67,1860.0,87.08,30.67,58.75,"¿Cuál es el último libro queleíste? 'Elalmaestáenel cerebro', de Eduardo e a",16
1749.6,2102.4,207.6,29.2,81.0,¿Aprendiste alguna nueva habilidad durantelacuarentena? Hemejoradomis habilidades en lacocina. Tambiénapoyéamishijos ensustareas.,16
1770.42,2381.0,117.0,24.83,81.58,"e conducción? Dimelo hubieses preguntando ancestral vez respuesta hubiese sido conducción, pero",16
2152.2,801.8,129.4,30.0,63.9,ahora elijoambos. ¿Quécanciónescuchas y no puedes dejarme bailar? Marinera norteña.,16
2225.4,1008.4,86.67,26.87,67.53,"¿Teconsideras una 1 d ] 44 Mientrastenga a mi familia con salud estemos unidos, soy feliz.",16
2172.6,1246.93,144.27,27.07,64.73,"¿TegustalaNavidad? Laamo, siempre me ha gustado. Navidades muy esperada porlos niños uno hace todo para que ellos reciban tonel mejorespíritu.",16
2174.38,1526.31,149.38,25.31,71.31,"¿Yadecorastetucasa? Redecorado la casa de mis papis, porque esposo yo con mucho esfuerzo estamos remodelando nuestra casita recintos mudaremos próximo",16
2164.45,1870.1,164.1,27.4,68.35,"A ee d el compras aúltimahorao conanticipación? Yo soy muy organiza da encasa, y ahora con las comprasonlineenripley. com.pe puedo recibir las enmicasa, enmiauto, recogerlasenTambooen cualquiera delastiendas.",16
2166.56,2296.5,178.5,26.94,70.94,"¿Cuálestusueñomás grande? Tengounhospedaje enZorritos (Tumbes], ”AquaMare Bungalows”'. Mi sueñoestenerlo completamente terminado para apunta r aunsiguientehospedaje. Además, sueñocon un protagónicocomo actriz.",16
1306.33,159.17,98.0,24.83,90.67,SÁBADO 5 DE DICIEMBRE DEL 2020,17
928.23,411.65,65.46,37.77,69.88,"Nl I D 'J La actriz Daniela Feijoa suele llevar un look bastante relajado D /A HH““H_/ cuando letona grabar. Siempre es algo sencillo, pero bonito, que",17
1974.5,371.0,161.5,62.0,56.75,"TIPOS DE HELADOYLO a,",17
845.56,474.0,86.0,36.0,69.44,2222 le permite hacer rápido sus cambios devestuario. EJOO,17
2042.7,585.5,110.9,25.9,82.1,¿Optimista? ¿arriesgada? El helado detu preferencia puede revelar cómo actúas,17
1279.5,735.33,106.67,42.22,59.17,DIVIDÍ ante ciertas situaciones. Descúbrelo a ÁE&%% a;aí%%'¡23£ ee i eal w'oo'€g¡%g:g';:g básica.Usaaqyellos w;;;23¿2 ;g'::¿g —dice—marcan su e eg,17
1716.28,1519.78,110.6,35.37,67.01,"GANADO DECANO MALTEADAS XSitegustanlos ] b anlusoestás libre. Eresjovende defudgeoalmibar, E corazón, intrépida ZAPATILLAS eresar%biciosa, arriesgarte ante ysinmiedoac&rer extrovertida, ( E E ea riesgos inesperados. Además, combinan bien con los jeans y en complicada. Dejas — Amasviviralmáximo losjoggers”, cuentalajovenactriz. llevarporelcorazón. — ydisfrutastulibertad. GORRO b E sirve para protegerse bl la solares darle un estilo chica AA CONFUSAS XPráctica, ingeniosa — XPasartiempocon X Buscas equilibrio e tu familias alomejor constante.Nada LENTESDESOL %ásicamente E i hacer j para xNollevamuchos cómohacereltrabajo — recargartedeenergías — siempre hay un punto accesorios, pero algo que sin perdereltiempo. yserfeliz.Nonecesitas . medio en todas nunca le falta son estos Eresmuyoptimistaen — nadamos queest e 1 lentes negros para cuidar todoloquehaces. a tomas.",17
456.33,2154.0,84.83,29.0,72.83,Jeannette Marcharte Ginecóloga — CM 24371,17
2038.9,2140.2,68.6,26.6,54.8,de las bacterias que se adhiere n a la pared de la vejiga,17
1305.0,2175.0,126.8,24.2,64.4,veces causa da porun infección. Provoca dolor,17
1122.4,2206.8,134.0,29.2,77.2,"al mencionar y deseo deiralbañoconfrecuencia,",17
1159.58,2398.53,115.83,27.74,79.32,"quedando la sensación de un vaci amiento incompleto de la vejiga. Entre las causas másfrecuentes deunacistitistenemos: sexuales, durante las bacterias del ano pueden propagarse hacia laregiónvaginal. La batería másfrecuentees escherichia coli. &Después reutilizar el baño, limpiarse de atrás(región anal)hacia adelante (regiónde la uretra). &Elembarazo que produce dificultad para vaci ar por completo la vejiga, lo que permite la multiplicación",17
2005.45,2390.47,127.77,28.83,80.04,"produciendoinflamación. &Beberpocaagua y orinar pocasvecesaldía. hormonales, especialmente en la menopausia. La falta de estrógeno hace que la superficie de vejiga se adelgace, permitiendo el ingreso de las bacterias. &Alteraciones deltránsito intestinal. Tanto el estreñimiento como las crisis diarreas predisponent infeccionesurinarias. bebidas alcohólicas o gaseosas, vinagre, chocolate, alimentos enlatados y harinas blancas. [<]",17
298.39,2388.81,106.23,31.06,47.81,"C) d i ea Dordan;_desmmba|lar|na3ylaseguro(que ee d a iii ea lidad, binode imutuolacuerdo) y |porlmcompatlliilida'd (de (caracteres” '“La&senora/Azucenaw,yo U! E (ea hemastsidotesposos, (convivientes. Nuestratsepara— t o D ds (e w",18
903.75,1233.25,311.25,64.25,53.25,annlnaíLmah*aseguro.que) Jlsaí]lomnoesta*acostum— brada*atser 3alaíotraítras'ente;o,18
901.86,1576.36,310.0,43.95,52.55,"(conh1nuacmníjacksan…ana tal (captadoíp(mlascamarasde¿Magaly/ “Wálaíñmxei(coniunaimu1enemunores* '“¿Bllaesteúmasgu€acdstumbmda)á (dlspuesta'aísenlahncand1c¡onal¿,la, (otraíporque_esajle.generaídmen 0 era etonta¡no'ñlenannunjpelo*¡lo“ (desende ¡ araday:smverguenzg,(eso)lo» t¡eneen|las—¿dubjlaimodeloeneljpro—[gramaí¿Esp,l T “]!sh0w¿;que,se&rans* )mlteenilaiplataf0nm reaí]Dlgltal£ Asmnsmo*aconse;oa“a[exconductora, (defélexisiónsobreelcolondelwestido ugdebenmusar5¡[enial'",18
873.43,1972.71,285.43,49.71,48.0,".rrohp0nlaísuc' (¿Quecancep'ñoten'g""o'de:ella'&€o— ¡mos¡empre(eljpeor&ljnaípersa— l falsa__' H1pocnta;quevasutc0n, xvemenc¡a.%1£mdos'estfosoahfos'coj",18
720.5,2530.0,123.0,35.25,36.75,tamibiéntrecalea i i wolver con i ella,18
1320.17,156.33,93.83,65.67,54.17,"%Ú&gwc a dora st ii ga,",18
1620.33,1347.17,120.83,54.33,68.0,oo debajo ©;:ñm¡ $£Urt€í?3 con pelear,18
1452.64,1655.27,249.91,41.45,53.73,"w,lamente)la*amante!s¡empreserála, Eamante,¿añmw $An)ehcah(o)fxy¡leárespmndlm ea Í_]ane'fíBarbmza,;qu¡en©p&nosobresu on[co]1 asdebajodemitcama;nigo ul :í1é)lkaíí:uya.lEni&ummm'en;— íñ0de:r…u¡ma '¿1'",18
1442.27,1913.45,279.91,38.55,59.36,"¡ra,w¿yorse¡que. ) esoun[ccotrabaja— (d0r%1mlila_que)mqpanece.extraho» esquema fte!dejes&engatusavr1pfmunajper— a$alla(quellefgust>aWendemnugnew i ílkozano*aclmrandorque;adnñra)y¡ Eaprec¡aímucho¡aijao¿leñ¡osMaíEthell",18
1556.73,2261.13,155.87,31.67,48.93,"incompatibilidad (detcaracte— ires, y (decidimostsepararnos: llevando unalbuenateoordina— ciénppornuestrosihijos, casino ¡porlinfidelidad míaoxde. la seño> esf falso x que (",18
1639.75,2546.75,87.5,40.0,63.25,n0tarlal(que [[C. Chis ©,18
2000.12,826.52,154.0,37.68,54.84,"C> La|mama(d.€.lM6mo) 'cela,¡ase_guroique ¡pocoltóxicaytespecial” £su o L'a(qu¡ero¡y¡lexdeseo)lo, |mejor¡pero[ella 'c¡ertasxcosasxque(con fel no |puedoicr wanillenando(élisaco: Ihastamue¡rewen— sobrellevarlo d ción [ayudarla porque: |neces¡taba¡untapo— 3yo*fEl t i |pero[ellateraiun]pocoitox|caI )",18
2207.25,1909.5,172.0,67.0,40.25,"n eo ch,1H asististe",18
1966.0,2104.0,274.25,41.0,62.25,€>>Lu¡gl(Carba|aI[cumpln89)anossy(contólquetestá [talzada!atcausa'del(de' .Enrestos,18
2159.78,2330.11,98.5,34.5,51.78,"2$1Cuenta(que4 ¡porque hace tdo si meses _ perquest Iperdimosiatuna tíaWisBo: taimi madrina, hermana '¡'tema'da' papá; (esta""del '… | ,'d'é|' ee a",18
