left,top,width,height,conf,text,page
319.18,1790.76,180.61,35.76,58.91,"l ?HAM CD No sabemos aún.si ise celebrarán losljue— (gos.©llmplcos de Tokio. ILO (que¡susexsabe(e5(que Rusia notestarátentellosfritenilas, (0||mp¡adas<de e P E|Iínbunallde[ArbltrajeI[Dep0rtwol[TA5]lIo)san— (c¡ono*con(dos¿anos¡ponman¡puIar|prueba5(de(dopmg(de ¡sus(deportjstvas presentando¡resuItados¡fa|sossy<el¡m¡nandw t archivos t de t casos posifivos: Endiciembretdel 'ano¡pasado 5) /Agenc¡a1Mund¡al/Antldopajelle había dadoxcuatroranos, pero Eltcastigomolinciuyetallatselecciónide»",26
1052.3,1862.17,162.61,36.17,53.61,"CD A'Izó & técnico portu— (d|sparoxcontralla Rederaciónlclom— o et i |051p0bres.resultvados ie 'c0ra¡e(de(enfrentarsefa1lasítormentas(que Tomaron¡una(dec¡s¡6n(queítuve(quefaceptar per0(conlla(que lno(est0y(defacuerd0.,¡senalo (Ellluso !ap0rte F Jameisodqguez ”Ruellasensación 'en(el (de,201h3ylnoífue",26
2141.57,603.91,152.54,35.24,57.89,"mandas de pate mi dad pendien— ¡tes¡proyoc6_que lajusticiatargen: prohíba queel(cuerpo de Die— guardando Paradoja nerado»El reclambmástcercano; (es'de1Magal¡Nlejandra Gil (de:25*anos,(cuya[ma— b|o|0g¡ca'la en'adopc¡on,y]le ee defensa de,|ahoven1llevo el pedidoalaFisca— ||amcontact0 elaborado dellexfutbolista, aseguroqueante5'dehfa— e e a a d|spuestoa ise trodescendientestenGubat argent¡na hijosre— JanajyiBiego'Fer= lnando*ademasfde.[olegojlr e (cuyapatemidadita reconocen pese tasu j gran podríanisumar por(el momentodhastaseismásqueentra— —",26
2088.67,1174.89,136.78,44.22,54.11,BATAZOS SE SORTEARONIÍas. |Iaves(dé¡&sem¡s l |a$Supercopa Españdlatl Rey 30,26
2121.17,1238.83,110.0,58.67,64.33,¡ Barcelona | Madrids: /Athletlc<delBllbaoi 4(enero,26
1967.47,1340.84,126.95,47.0,50.74,e 1 WERIPLATE(&V&HZOÍ& semifindles: %RF5£NIIM iBE&%%SADL/% qe l all libertador es f|g 0Iea*rx6 ?olea— JJUS'HGVA/A M (c¡onaltenuUru enla ee e s a,26
1973.44,1878.96,160.59,41.3,59.96,C)La extensa María .c¡o(que.se_casara.c0n(ell tempresarioibritánicoyAlex: (e a 'amlgof|ntlm01de I|os.pnnc¡pes'Harry5y e lLalrusa*;ganadorau Siamliniciósu romancefaífinaIes(derf20183y ltevine; hijo t dell lpres¡dente(deI|a(cadena1norteamencana NBCI[20(DS 05); Sascha&Vu¡ac¡c o e 'esa(epoca(enlLos /Angeles Lakersf[2©1ú) 12]'3y'e| tenistalbúlgaro Grlg0rlDlml—,26
1618.09,160.18,79.09,23.55,74.0,VIERNES 18 DE DICIEMBRE DEL 2020 — f H (AVISO]) 27,27
612.57,453.43,225.57,62.29,54.43,SENTIR CERCAATU 17 ASUMIR UNA NAVIDAD P,27
374.0,2361.2,61.0,22.0,87.0,Evelyn Vela cuenta los días para reunirse con su novio,28
904.0,183.75,68.88,38.25,63.0,gue nb e y ello que todos ds,28
906.98,1502.11,117.41,31.24,76.88,"A alcomoseveníaes— peculando,laactriz FlaviaLaosconfirmó queseencuentadis— anciana del Pato' Patricio Parodi y, porello, Miami donde seen— cuenta vacacionando y trabajando desde hace tressemanas. ”Estamos bien, tranquilos y felices.Cada unen lo suyo, cuando nosema de viajeros distancia— mos un poco. ¿Si la relación continúa?, pues efec— vivamente ha habido un distanciamiento, peores algo que colonos compete los dos. A veces hay cosas que nos queremos guardar paranosotros, todarelación tiene mucosas buenas, mucosas malas. A veces una está superbien con la pareja yotras veces no”, preciso la actriz el progra.— ma boca de todos” Luegoserefirióa las indirectas' quedamos habrían mandado en las redes sociales mediante unos TikTok. ”Nosoy demandarindirectas, si tengo que decirlo lo voy deciden privado, yaesta— mos grandes para mandarnos ese tipo de cosas”, agregó Flavia, quien en octubre pa— sadocelebró dos años de relación jun —",28
914.25,1934.25,69.38,30.0,73.75,"tal A su vez, la protagonista de Prince—",28
983.93,2223.43,68.63,24.67,84.41,"¿Tuamor Valery ya regresó de Miami? Llega el 30 y estoy ansiosa por verlo nuevamente. ¿Cuándote casas percivale iglesia? Todo será el mismo día, tendré una ceremonia muy íntima, creo que lo haré en Ica... quién diría que me voy a casar. Ases el amor, inesperado...",28
1579.88,1413.15,99.62,27.17,80.56,"sas' aseguró que planea quedarse unos días más en Miamiporque dentro poco grabará un vi— de o clip con un reconocidocantante. ”Vinede vacaciones, así que la estoy pasando bien... pero también estoy trabajando. Metan he— cho una propuesta para un video musical con una persona que admiro muchísimo, recontra conocido el mundo urbano, del reguetón...he venido y se me han abierto demasiadas puertas”, añadióFlavia. Finalmente, comentó que encuentra muy con— tenta con la sintonía y buenos comentarios sobre su participación en la novela ”Estoy feliz por los resultados y orgullosa porque es un personaje que jedi el ciento porciento”, señaló.",28
2164.13,1093.16,61.19,24.6,85.9,"© Brunella_ Hora reconoció que es una mujer muy sen— sible y llora mucho, + e ei en fa Richard Acusa la trata con mucho cariño y paciencia. ”Yo no sé por qué tengo ese problema (sen— sibilidad), siempre lloro... no puedo pelear, simplemente lloro, soy súper sensible. Siempre he sido así, es mi forma de ser. Noso— tras (mujeres] somos más sensibles que los hombres y nos duelen el 0 muy cuidadoso con las palabras, se aguanta con sus fra— ses”, dijo la modelo en el programa 'Améri— ca hoy”. De otro lado, contó que toma con humor que la sigan vincu— lando con la canción *Olvídate de mí, que le dedicó a su expa— reja Renzo Costa. ”No canto, pero esa canción tiene más de tres millones de visitas. Sin Sergio George, sin pro— ductor”, concluyó la chiclayana. G",28
2223.33,1867.58,63.08,33.42,84.58,que es muy sensible y Acusa la trata con cariño y paciencia,28
2046.97,2290.35,62.68,25.97,86.55,"(© Cassandra Sánchez, novia del Debéis Orosco, lan— z su marca de ropa 'Casemaze Store' y el cum bi amber o la felicitó. ”Hoy comparto tu éxito, esta es la pri— de su M&Ca",28
1954.2,2375.6,81.8,23.6,91.4,mera de muchas metas cumplidas.,28
645.0,2410.82,70.09,25.36,90.55,"Valery Burga y confesó que por Sí, estoy superemocionada, me caso",28
735.0,2463.65,75.55,24.95,78.3,"primera vez está realmente enamorada. La primera vez fue de EE loca, estaba chibola. (C. Chévez) 0 ¿Dónde pasaránAño Nuevo?",28
1040.33,2523.33,57.83,33.17,75.17,+t del sur' tendrá boda civil,28
614.57,2555.21,55.36,26.57,87.43,Aún no lo sé porque no habrá fies— y religiosa con su novio Valery,28
269.2,2577.6,61.4,25.4,90.2,"tas, así que todo tranquilo.",28
2316.0,2239.0,116.5,39.25,41.5,a a E lanzamiento,28
2037.93,2490.33,63.74,25.21,89.98,"Estoy orgulloso de ti, reina. Aquí estoy para caminar juntos de la mano”, señaló. En tanto, Cassandra contó que está emociona— da por haber lanzado su marca de poleras pues muchas veces lo intentó y dedica 14 horas diarias al trabajo. o",28
1579.11,160.33,111.0,27.0,80.67,VIERNES 18 DE DICIEMBRE DEL 2020 …E (AVISO) 29,29
1987.64,2398.18,81.55,31.0,75.0,CI.IENTRALO N LOS MEJ _ PUNTOS DE VENTA DEL PA SE,29
310.75,792.77,59.62,26.42,78.3,"(> 'Choca' Mandos con— — firmó que seguirá el próximo año en la conduc— ción de 'Estás en todas”, Ju e a Además, animará el con— cierto Ven Año Nuevo 2021, que transmitirá Améri— ca este 31 de diciembre, desde las 11 de la noche, ”Estarán 'Son Tentación”, Amy Gutiérrez, Yahora Plasencia, Jota Benz, 'Orquesta Bembé' y — £ l E a [ E",30
555.71,1045.29,73.71,43.43,66.14,de f|n a animará show e l,30
872.1,1291.7,129.2,42.7,71.0,ndreaLlosa asegu— róquenotieneamis— N ¿Á&tad enemistad ”& con Fagaly Medi—,30
930.5,1388.25,106.5,29.0,55.62,"na, destacó que susprogra.— mas'Andrea' y Nuncamás' go—",30
257.75,1407.5,74.0,30.5,81.5,Georgette Cardenas © [*,30
634.88,1591.02,74.01,27.52,81.06,"contó que comenzó a zar on de buena sintonía es— vender algunos muebles . u . teaño. Asimismo, seguirá en de su casa porque “©E ATVenel2021. planea mudarse, y ' Andrea, estamos a punto de tras separarse de su ¡ ¡ terminare año, ¿cómo con— ¿ sider as que te fue? ”Es bueno desape— A .Á Nos ha imuy bien en los garse y, sí, me he dos programas con pande— separado y tiene ox mia y todo. La segundatem— que ver mucho con A parada de'Andrea' estuvo",30
271.8,1794.9,42.5,22.4,82.3,eso. No tengo cla— ro sí me quedaré en *,30
917.67,1794.17,146.5,30.5,76.17,casi siempre en losdosdigi— tos (derating) y Nuncamás',30
471.28,1893.0,93.4,26.32,75.0,"Perú todo el 2021, liderómuchos domingos. me gustaría viajar ) Continúo(enelcanal)hasta yestud¡ar en Euro— ( 3 r1] diciembredelpróximoaño, pa”, dijo. (D. BE a estoy tranquila y contenta.",30
632.75,1973.88,135.25,44.62,57.62,Teman querido enfrentaron SZTermmo ea qov¡o y ahora ov ren dej 51,30
734.8,2020.5,91.6,34.0,82.1,"Fagaly Medina, ¿tienes una cosas para mudarse, enemistad con ella?",30
398.29,2307.66,70.54,25.1,90.74,"© Pilar Gasta pidió al público evitar las aglomeraciones y seguir todos los protocolos de bioseguridad, a la hora de hacer sus compras navideñas en Gamarra. ”Tengan mucho cuidado al salir de com— pras, usen siempre las mascarillas, eviten las aglomeraciones y no vayan en gru— po, pues exponen su salud”, dijo la empresaria. ¿Estás atendiendo entienda de Ga— marra? Por seguridad aún no he abierto mi tien—",30
919.6,2496.8,90.0,31.0,85.6,compras no ha abierto |,30
539.27,2542.82,70.73,31.73,85.36,"da, estamos con la modalidad del delivery. ;Su tienda en Amarra",30
475.56,2581.33,69.67,23.0,90.89,Con mi mamá hemos decidido no abrir a contagiarse,30
1366.28,1580.12,119.38,25.38,71.85,"No, paranada. Ni ga, ni noes mi una persona másdelcanalcomo cualquierotra. Amigos míos son Pamela Vértiz, Fernan— do Díaz. Quizás no mantenido la opor— unidad de compartir... Desdequecomenzó la pan— decia estamos grabando — % Barranco...honestamenteno [ , melacruzonicuandograba.— mosel spot (de ATV) porque cada contiene un horariodi— ferente. Hace poco contaste que abri— rás'Lacasadelamor'... Sí esunaempresafamiliar,de '* miesposoymía, usamosto— dos nuestros ahorro s para haceruncentrodondeha— brátalleres, consultasso— bre temas que tienen que ver con la salud mental. 0 un",30
1720.85,2365.75,64.23,25.38,88.48,"por precaución. Ahora estoy trabajando en nuevos modelos de ropa y planeo abrir en ( Hace poco Milena Párate felicitó edwin porque dijo quelegustaría casarse y te— nervios contigo... Si ella desea opinar del papá de su hija, que lo haga, pero que a mí no me mencio— ne porque no la registro. No me interesa su opinión, ya sea buena o mala. No ten— go ningún vínculo con ella ni deseo tenerlo. Tengo muchas cosas que hacer, mi mundo no gira en torno a ella. (D. Bautista)",30
2282.21,773.55,59.3,21.91,80.45,"TO, Llego e A tardes las últimas de ”V deslizó que NESTY tiene < nueva pareja 2 M llamaría KAE— LAH MÚBEZ, con quien estaría desde ) hace unos meses. Manya La expare—",30
2251.58,1880.56,63.0,24.34,81.8,"la 'charapa' DRA MATHEWS 1 reveló que el fut— g o a ll 3 MARCO le decía cosas obscenas a través de Instagram y que incluso le propuso e E m ( LLE SOFER luce sus cur— portada de la revista 2 contaría que se encuentra separada del *Principito' GIUSEPPE Nooo... Se conoció que todos los programas de Prolv, 'Esto es gue— rra', 'En boca de todos' y *Emprendedor ponte las pilas”, seguirán en Amé— rica Televisión durante el 2021... Me pasan el talán que TIESA LOZA— estaría por pasar un casting en Latina, pues están pensando lanzar un nuevo programa que iría por las tardes. Man— ya... La garita CACHAZA estuvo grabando ayer en el balneario de San— ta María, y el serena zg o casi le pone su multa porque no tenía permiso. Ayayayy y... Bueno, soy fuga porque mi amorci— A a e me pide su Nochebuena. Suuuaaaveee...",30
2299.67,2743.83,30.0,31.0,83.17,| D +1 604278 3604 l,30
1037.97,2031.61,54.21,15.24,84.63,";3 Visitanos en nuestras tiendas de Lunes a Sábado: a.m. a 7:30 p.m. Domingo: 9 a.m. a 6 p.m. (Solo Lima) — 9 a.m. a 3 p.m. (Chincha, Iquitos, Moyobamba. Ayacucho, I Piura, Huanuco y Arequipa Jesús 2).",31
2179.8,2107.2,15.8,16.4,61.2,34 — 4 a a,31
2122.29,2131.86,75.29,21.86,66.0,proceres de la Incaperzencia 5304 Malote z,31
589.0,2576.25,38.25,11.75,56.75,e como medio de,31
2338.25,2745.25,82.75,20.25,46.25,e Dpresmoder E E,31
947.38,158.12,106.62,33.12,74.25,32 (FIESTA) trome: 1s»'*e mr V1¡BRE DEL 2020,32
1607.68,706.28,75.33,25.16,82.12,"Siempre hay, pero no pienso en enamorarme...además, qué miedo con todo esto del corona— virus, yo no podría salir cono— cera alguien, aún estamos en pandemia. Mejor sola... Portadora sí, a no seque ven— ga con su prueba negati— A ja. ha &4 quedado en espera hasta que llegue la vacuna. Sacaba el año, ¿qué ba— lance tienes del 2020? Esun año buenos ha de— lado muchas lecciones y debemos dereflexio— assobre el futuro. Nos ha golpeado, a muchas familias les ha quitado a sus seres queridos. Pe— ro también nos ha he— cho solidarios y debe— mos de salirdelante. Aunque te has reinven— * tado contuschacras, no f¡ 4' se puede dejar la músi—",32
378.27,1248.48,95.62,26.0,75.63,"a'Faraona' Marisol confesó que se en— cu entra soltera y no piensa enamorarse hasta que, al menos, aparez— cala vacuna para el corona— EL ”Tengo el corazón muy tran— quilo, estoy soltera y dándo— — una etapa muy complicada metodo el amora mis hijos, a en varios aspectos”, comentó mi familia. Creo que no es el la interpreted 'Laescobita”. momento para enamorarse, — Peronodebendefaltartelos todos estamos pasando por galanes...",32
1556.4,1291.69,80.29,28.09,77.54,"IP, f 47 Asíes,nopuedodesam— .-./ //' parara mis músicos y por 33 ello voy a realizar un show virtual gratuito el 1 deener ) para empezar bien el 2021, que serátransmitido en mis redes sociales. (E.C.)",32
918.32,1646.38,79.62,23.85,86.18,"”Existe la propuesta, pero no está confirmada... y no sería un programa diario”, dijo. ¿Quénos puedes adelan— tardelprograma? EE et básicamente de entre— tenimiento, va a tener f— concursos, entrevistas y muchas cosas diverti—",32
521.5,1879.94,73.59,29.47,73.71,"(D El actor y conductor Adolfo Aguilar ”suena das. (L. Gamarra) fuerte' como uno de los fla— ,____'———'—j_ mantes jales de ATV para ay ¡mTene /e el 2021. 3 conducir programa en ATV, A—",32
2009.18,1808.47,59.47,25.14,86.88,"Christian Domínguez comento que 22 cada día se encuentra más e i a que ”Un amor como el que siento por Pame— muy la llega solo una vez en la vida, pues tiene 'enamomdo otros cimientos. Esto por la madurez, por la edad, Ambos estamos pendientes del otro y va a ser una madre espectacular”, dijo el cantante, quien el domingo estará en 'Mi mamá cocina mejor que la tuya!”, junto a Lucía de la Cruz. o",32
2065.29,883.83,51.6,21.97,84.02,"derecho, pues reveló que debutar en la pantalla grande. l ”Hacer cine es una — — y de mis sorpresas es — para el 2021, será a mi debut con la pelícu— y la ”Mundo gordo' junto a Majo Mantilla y Ren— zo Schuller. No haré el papel de mala, pero sí de una mujer con carácter”, dijo la actriz, que mañana cele—",32
2051.68,1187.58,63.0,24.32,81.26,de 'Cielo Torres y orquesta” y brindará un concierto que será transmitido por Casa de la Salsa'. Gamara] G,32
1999.0,1322.8,108.0,45.4,46.0,r ee Tp Renzo la;chuller,32
2060.0,624.0,47.25,24.0,90.62,Cielo Torres cierra el año con el pie,32
2027.5,1104.0,67.25,25.5,91.75,rá el primer aniversario,32
1500.86,2112.21,220.29,55.79,61.21,…fsexsuopneEpemog;c_q… [SexoOfentas|SEXSHO Ps POTENCIA eal w…% g€£áf%% |3H Fy| | U TITAN SEXUAL RIGIDEZ,32
884.98,2220.07,61.26,23.14,69.42,"Erección con solo una pastilla EXCITANTES NATURALES A:) o + y o A 2|72?¿32;"";'33 dartos OF — Producto 100% Natural E'ooo la me a| AFRODISIACOS El tamaño si importa! <E — sin efectos secundarios. Te … í A dura má$. , FEROMONAS HUMANA",32
436.8,2432.6,52.4,37.0,59.2,704 ne ter Piso| MIRAFLORES,32
2283.0,2162.83,68.17,33.0,51.67,4 Producto natural| 'Exctantes — Spanish,32
2089.05,2338.63,95.42,24.84,73.0,DESARROLLAR Y ENGROSAR| or 43 Hom GUAIRA ANTA ANITA [MIRAFLORES) o 948555904 [ 964329993 was |rm …N'1l1 11 =IEENADV:DNE_SI1I'.,32
990.96,2374.22,74.78,20.87,65.57,"r L I] A a e CREMAS Muñecas — Vnglnus An|llos a 933861 503 SAN MIGUEL &'….';3…J“£…E.&.o£,&3?.a¿%% ©940410781 rt A : …qu11 D",32
1237.25,2476.67,131.92,65.08,42.67,r pr o nen a E y — pue uca tu anuncio — (01)708—9999,32
1030.48,2542.09,66.65,24.87,67.91,"CRUCE CON AV ABARCA A cu¡mnew 6 Tda, 221 Tda. 203 SANTA ©9223062 cand ; Y. * LLAMAND© AL o a. (©996942475)",32
545.93,2577.29,77.93,24.14,69.93,"Rl l A $...;¿...""¡ AV.EAITA 1250 ser r=3g Av Ia_l.u m 0F;_ogqusc 9943157926 gz4737a",32
1459.71,2597.71,51.43,16.29,72.14,197 Av Balta 4GL Juro F Morena,32
587.5,2610.0,72.12,15.5,69.12,CON MALLSANTAANTA_ ca 937561037 m 987561037 2209338 t,32
2208.17,2746.17,46.83,21.83,57.5,( | Dpresreoder e r —,32
1495.62,160.75,104.0,25.75,85.88,VIERNES 18 DE DICIEMBRE DEL 2020 …& 33,33
1219.2,717.6,85.7,44.1,81.6,” Hasta 7. /© ducto o DEL 16 AL 21,33
1099.86,774.71,134.57,35.86,68.57,l art¡culos selecc¡onados © * DE :DICIEMBRE,33
314.8,1461.2,83.4,31.0,78.4,Bicicleta para . Aro 18”,33
1884.2,1442.6,129.8,33.0,89.6,Concentrador de Oxigeno 6 Litros,33
1153.5,1599.33,104.08,45.92,72.83,Potr!lllo c¡.ie Fou<:c'?1lráb S/125 Azul y Blanco Clu Alianza Lima S/ 99.90,33
1343.56,1872.67,185.0,71.89,51.33,con Pago€fect¡vo S a eo ©¿/' $/ 3©'53%%na! g,33
1232.88,2073.38,71.38,20.33,82.67,Por compras mayores a 5/799 y 5/199 respectivamente Por compras mayores a 5/799 y 5/199 respectivamente Por compras mayores a 5/799 y S/199 respectivamente,33
1080.57,2246.86,157.29,79.57,73.43,Encuentra más en Lum|ngo Com I egg_=gg¿go,33
809.14,2371.86,102.0,50.57,75.29,Con el respalde de | © no,33
1168.14,2508.51,72.97,17.71,85.54,"Promoción válida del 16 al 21 de Diciembre del 2020 o hasta agotar stock. Stock minimo 1 unidad por producto, Imágenes referenciales. Para consultar los términos y condiciones de la campaña y promociones visitar www.lumingo.com/legales",33
957.0,158.88,107.25,25.38,87.88,34 (FAMILIA) VIERNES 18 DE DICIEMBRE DEL 2020,34
1102.46,494.91,65.06,28.91,82.06,frío y déjalas por unos Dolor Malestar 5 o 10 minutos. Pue— de oído estomacal e e a G» Hacer estiramientos €» La infusión de zion en el cuello ayuda a es ideal para aliviar,34
1056.7,639.2,91.4,26.4,89.8,dolores por problemas digestivos. Bébela después de las comidas principales.,34
303.47,633.6,65.33,26.4,90.07,"relajar los músculos y aliviar el dolor en el oído, especial— mente, cuando hay estrés.",34
1015.5,811.5,55.0,46.75,59.5,E po sip A,34
545.25,1048.5,457.25,126.5,62.5,UD[[ TORTURA PARA AQUÍUSM©,34
1242.2,1372.4,79.4,22.8,90.8,Cuando las personas con autismo,34
1349.17,1403.17,89.67,26.67,89.33,escuchan los pirotécnicos hacen QUE HACER,34
1540.19,1472.67,71.52,27.19,88.74,"lo siguiente: Pídeles a tus amigos, vecinos y/o Se tapan los oídos familiares, que viven cerca de tu casa, anuauuu1u(dnmx;d fuertemente. que eviten el uso de pirotécnicos.",34
1766.43,1592.39,67.87,23.43,91.57,"Es recomendable que la persona con autismo utilice unos auriculares para disminuir el efecto del sonido. Busca un espacio de la casa, de",34
1292.07,1587.6,61.13,25.87,76.27,l ea a el hacerse entender que les molestan los ruidos. Tienen crisis de llan—,34
397.43,1581.57,40.14,37.14,62.71,k»ro4u a — — — ¡(¿;3Jz&amd s,34
1510.97,1798.86,70.88,25.93,80.33,"(G preferencia sin ventanas, para que Muestran un alto la transmisión del sonido sea nula o el nivel de ansie— menor. l]t1(Jí=(tfl[o):]0)l]¡(0í'l['—l£l¡]l(&(o£$]k&.*¿i dad y estrés, No le digas no pasa nada' cuando a eal suenen los pirotécnicos. Más bien trata t llegar a auto— de hablarle para distraerlo y mostrarle ee ea algo (álbum, juego, libro). Hazle sentir Ja l]'**mnr…ík»xutaz]Pmmaika¡oíeuuke]t 1 desorganizarse. — que tú estás ahí para protegerlo.",34
310.67,2056.44,120.22,40.67,48.78,"tiesa lImppoñente )¡(ama¡7/""(arw ell uso, po? gpnn10 eme ese",34
1333.2,2176.0,142.0,48.0,47.4,©©E)D i e ea p,34
1900.4,336.8,57.6,28.2,88.4,© Coloca sobre tus ojos,34
773.11,2412.76,64.59,24.99,87.98,"INGREDIENTES PREPARACIÓN la leche. Une ligeramente 4+2 tazas de harina Coloca en un tazón la hari— — con las manos hasta armar preparada na, el azúcar y la canela la masa. Déjala reposar 4+3/4 taza de azúcar en cernidos. Haz un hueco 10 minutos, cubierta con polvo en el centro, pon dentro la — un paño. Estira sobre la cdta. de canela en mantequilla y mezcla pre— mesa enharinada. Corta las polvo sonando con ayuda de un — galletas y colócalas sobre",34
276.12,2559.25,58.5,25.25,87.5,+125 g de mantequilla +3 cdas. de leche,34
707.29,2557.71,87.29,24.57,90.14,tenedor hasta lograr una textura arenada. Incorpora,34
1101.0,2554.0,55.78,23.33,90.78,las latas. Hornea a 175 oC durante 12 minutos.,34
2195.14,954.86,60.86,26.43,67.14,o M r Máximo Lazo Urólogo astrólogo,34
2257.44,1844.51,67.78,24.71,88.3,"QD La disfunción eréctil también puede ser de origen psiecológico. Es más, antes del adve— pimiento del silden a filo (viagra] se pensaba que [ E E a antiguamente llamada impotencia, era de ori— gen psiecológico. Hoy se sabe que gran parte de causas de la disfunción eréctil son orgánicas y algunas psicológicas. La disfunción eréctil de causa psicológica sue— le ser de origen brusco. Aparece de la noche a la mañana. En cambio, la de causa orgánica sea pre— sentando poco a poco. En la disfunción eréc— til de causa psicológica se siguen presentando las erecciones penianas: invovoluntarias noctur— nas o matutinas. En la de causa orgánica estas suelen disminuir o en algunos casos desaparecer. Si bien hay exámenes auxiliares, que ayudan a diferenciar el origen psi— ecológico u orgánico de la disfunción eréctil, estos datos de la forma de aparición y la presencia o no de erecciones invo— voluntarias pueden ayudar a definir la causa.",34
258.75,259.5,25.25,33.0,37.0,a ps A f,35
351.24,946.35,84.0,26.24,88.29,"BALANZA FITTIT ARIA Monitorea el peso y tu IMC, además se sincroniza con tu celular. En: www.fitbit.com/pe/home",35
1296.67,160.5,104.0,23.5,90.0,VIERNES 18 DE DICIEMBRE DEL 2020,35
1306.31,947.49,61.49,25.57,77.91,"CELULAR NOVIA 5.3 cámaras y la batería te puede durar hasta dos días. (3 ( Hiraoka, Saga Flabella ARO DE LUZ Para realizar videos, tiktoks, E a e d desees. En: C.C. Cyber |y £",35
1159.07,1564.93,61.0,25.87,76.4,"G—SHOCK Te permite medir tus niveles de oxígeno, ritmo cardiaco y más. (3 4 d",35
1419.8,2532.0,75.5,27.1,78.5,"] INALAMBRICOS SONY Son a prueba de golpes, agua, a",35
1110.8,2608.4,118.0,24.8,86.4,POR: FRANCESCA BRAVO En: store.sony.com.pe,35
1767.7,1993.7,146.2,125.1,48.1,"/LÍ”… a! l | UÍ_ÍD Ui …_,i i ! 3U_¡Ú…",35
2362.31,758.5,73.44,25.12,88.69,"ROBOT LIMPIADOR Olvidate de la escoba y el recogedor, este robot lo hará todo En: ripley.com.pe",35
1830.77,1070.0,77.62,26.15,87.0,AMPLIFICADOR DE PANTALLA Amplía la imagen de la pantalla de tu celular para,35
1785.75,1152.75,56.75,28.25,83.0,ver videos y más. En: C.C. Cyber Plaza.,35
2315.12,1734.12,135.88,26.88,87.12,"TECLADO UNROLLABLE Superpráctico, inalámbrico, flexible, con altavoz incorporado.",35
2310.27,2373.73,71.67,26.27,85.2,LAPTOP LENTO Con sistema operativo Windows 10 Home y 9 horas de duración de (3,35
1052.27,1475.25,99.97,45.51,49.53,"os ei a w&nnñ&ñ8&hm a e o | o ei| X € l ”e M d ] S 2 VO j ío'íL' $' J W| ?xí1(*3 ( 1 U( (o (') '1( —? (._o'1LE L D ""([_a ?xí1(*)$'7()l W©mmmw e y E — í [ a ml| > 0 ($á%?h… e a E ea mo a¡&?'£$…o&$ Ingredients l [M|de'areñand»shutganly l (In—gri—dients)) Ingredientes 1I""… ?lBltfan( |] E:II:IZ Want£sonhia“)l %|íígkqg_g[lggl a unif?uevw m 1P'!B(…]lro ffnr;%rñkmmas). ml p a jelpimam! *50/9 dem ante gui ill a &W%£…J…o e a a %%o'cooo (eho—ko“lelt4kup(60 ea f 4ko,—.ko¿ kelks¡da a ofñbfla'ckíf:9cqf_a]pnw_def Ífla“wer¿¿andwu£¿| f -…' ” ” ) ielko»ko pau=rer]l lBre¡kía|iartfardar“ Ie¡t*b'a¡¡l] l /2(D/g (degacas negra*en pálvo: l st na ie ei e barra(de1chocolate. ? E e l, (dulegsquieres punrofylsr3l p ee ñKcucharad¡ta(deilevadura a para la cenade: | en ayuda '70£9 (dedf¿a(f&mglk (o ?lBe¡ksífoñuen&¡]Mimítsi(om lmama(a|preparar o30)l n do* lh' m ” p want hundred dikgris) deliciosas 5¿%“ e(:fkec Ií€|í( eo ¿&nm M p ta IHOnnealos|p0rr201m¡nutosfa ¡pastelitos de F“ g¿o o'oiba? [ a Aquila oe ] [E'Ilm(dalkup ra $5(D<g'de…checolate:negro(en d ] Añádelotallaimezcla — o [ os e | ee . 09002 € o 008 > A:Doll add (Trans=lelt dizmvords)) (Duralizd mit=k)) 'Traduce estas ¡palabras. >5¿.? y &Añado la leche? f¡% SÍ 1 F&g IB:Yes!iRight'afterilsiftcocoa, | — f|our'andveast. — ___________ r P e :",36
344.88,2543.12,123.0,40.25,53.5,"¡Sit Inmediatamente:después que cena el cacao, harina y!llevadura.",36
1495.38,160.75,104.0,26.12,86.38,VIERNES 18 DE DICIEMBRE DEL 2020 …& 37,37
2094.16,758.96,85.56,27.0,86.04,"Colocando una silaba en cada circulo descubrirás las palabras escondidas en 1 y 2, sabiendo que cada silaba es la primera de los tres rectángulos.",37
754.44,767.0,89.0,26.78,89.22,Ubica 3 detalles que se repiten en esta escena.,37
618.82,2038.88,87.18,24.06,82.12,Completa los cuadros escribiendo las palabras que empiecen con la | silaba final de la palabra anterior.,37
2185.85,1993.8,70.05,26.25,47.5,¿ a E e ?¿Cya!_esgso_mlgs dentalise o so 202 spa s 38 0 ” *quémo' corresponden = — (e nqegá_gtuyo?:,37
2229.71,2517.43,32.57,19.14,37.0,n ie e ie ee E olo,37
1217.83,158.5,98.5,23.5,91.0,VIERNES 18 DE DICIEMBRE DEL 2020,38
