left,top,width,height,conf,text,page
639.75,120.75,162.0,30.25,86.25,www.trome. p 951—665—767 facebook.com/tromepe,1
1348.53,777.33,198.67,60.47,69.2,DARÁN APOYO A LA POLICÍA PARA EVITAR MULTITUDES Y QUE SE CUMPLA ESTOQUE Ds QUEDA,1
337.0,1152.4,98.6,32.8,79.2,ACTRIZ CONFIRMA QUE SE DISTANCIARON,1
1349.14,1438.57,56.43,28.57,76.0,3 Pm'll'0 a Páginas 10 y 12,1
945.75,2298.0,144.5,43.5,67.75,PREM 3 Vl©LETA BERMUDA,1
813.57,2386.57,159.14,51.57,83.0,AFIRMA QUE ES PARA CONSEGUIR VACUNA ||…*H¿lon…i¡oi,1
348.67,1085.33,58.58,27.5,88.42,G Se ha dispuesto que las Fuer— zas Armadas participen con 50,10
271.76,1255.0,54.21,24.37,91.55,"mil efectivos, que esta— rán apoyando a 60 mil agentes de la Policía Nacio— nal en el control de foros para asegurar el distancia— miento físico y en el toque de queda”. Así lo dio a conocer la",10
885.31,1189.47,67.04,24.12,89.24,"ministra de Defensa, Furia Esparch, quien puso énfasis en que lo importan— te en esta situación es que las personas sean responsables, con el propósito de que colaboren, ya que de esta manera se evitaría que se impongan medi— das drásticas. Agregó: ”Tomemos distan— cia física, nadie prohibe ir",10
1342.66,1248.06,65.28,25.22,88.72,"gobierno oficializó, mediante decreto supremo, la restricción del transpor— te privado los días 24, 25 y 31 de diciembre, y también el 1 de enero como medida para mitigar los contagios de",10
1257.04,1481.0,64.65,24.46,88.96,"a los centros comerciales, nacimiento y — técnica, y el viceministro de de la Policía Nacional del Orden Interno, entre otros. Sobre este tema, el ministro",10
478.25,1565.5,158.25,50.5,91.5,modernizar a la Policía,10
232.92,1807.22,59.03,24.83,89.42,"G» Median_t(_e resolución publi— cada en el diario oficial El Peruano, el Ministerio del Interior hizo oficial la crea— ción de un grupo de trabajo que se encar— hará de elaborar las bases para el forta—",10
285.67,2219.5,82.62,24.08,88.38,EXHORTA ©Nos cuentan que el Ju— lado Electoral Especial Lima Centro exhortó al mandatario Francisco Sacaste a no utilizar co— lores ni emblemas alu—,10
499.82,2364.73,56.45,21.36,79.82,vivos al Partido Morado. . . — fuji mori stas no se po—,10
265.82,2463.27,88.86,23.45,88.86,"Por ahora no encontra— ron motivos para abrir una investigación, pero guerra avisada no mata gente. Ya saben... CANDIDATO ©Desde Fuerza Popu—",10
680.56,2193.48,73.44,23.88,90.36,lar confirmaron que Fer— nando Rospigliosi será uno de los invitados en su lista de candidatos al Congreso de la Repúbli— ca. Cómo cambian los,10
761.4,2314.8,65.6,19.6,90.4,"tiempos, pensar que an— —",10
682.6,2341.6,55.4,23.6,91.0,tes el ministro y los,10
686.6,2410.4,63.4,24.0,87.2,día pasar ni con agúita.,10
609.8,2449.6,50.4,24.0,79.4,Así es la política... :,10
684.4,2509.2,52.6,22.8,86.6,©0ído a la música. El,10
587.12,2559.0,80.88,21.75,70.38,: — Tribunal Constitucional *_ (TC) declaró inconstitu—,10
1041.52,1720.9,67.0,26.0,84.86,"Cabe indicar que este gru— po de trabajo, de naturaleza temporal (60 días), lo con— (Pl e Interior, José Elice, quien lo presidirá; el comandan— te general de la PNP (César Cervantes); el viceminis— tro de Seguridad Pública, quien ejercerá la secretaría",10
1068.29,2228.77,67.97,24.49,88.86,"clonal la Ley Nro. 31039, que permite los ascen— sos automáticos del personal de salud y que fue aprobada por insis— tenia por el Congreso. O sea que les enmendó la plana a los 'otoron—",10
1005.89,2417.22,50.89,26.56,54.67,", gos. Ayayay... ELIMINAR o e = > 2",10
1102.75,2495.5,77.38,25.0,86.12,temacional) planteó eli— minar la elección de re—,10
1050.0,2544.0,68.5,20.5,79.0,: presentarte al Par—,10
1499.52,1733.61,61.67,24.46,87.43,"Elige dijo: ”Se proyecta que, para febrero de 2021, se cuente con la propuesta de estrategia de fortalecimien— to y modernización de la PNP. Esta será elabo— rada con la propia Policía, en traba— jo articulado con la sociedad civil y la ciudadanía”. (. Salazar] 0",10
1482.7,2174.1,65.6,23.8,87.85,"consideró que se ha convertido en ”un espa— cio tranquilo para de—. darse a la política, sin carga de En",10
1472.44,2289.0,67.22,21.0,85.78,. buen cristiano: se la lle— van recontrafácil. ¡Qué,10
1406.29,2395.71,66.43,26.29,87.57,. GOLPISTAS — . ex fiscal supremo,10
1463.58,2478.42,75.25,26.25,91.17,Avelin Guillen dijo: ”Los golpistas han pasado a la ofensiva y quieren,10
1430.9,2560.8,56.7,19.0,79.7,© continuar con la elec— : ción de los miembros,10
2198.05,337.55,101.4,38.95,89.15,Apoyarán a policías en control de foros para asegurar el distanciamiento social y que se cumpla el toque de queda,10
2190.99,938.5,67.1,24.25,89.75,"pero lo que se debe evitar al máximo son las concentraciones de personas, eso expone nuestra salud y la de nues— ull 25 Asimismo, defendió las medidas anunciadas por el Ejecutivo para fre— nar el avance del coronavirus. Sin embargo, preciso que si la situación se agrava, se pondrá la mano dura que corresponde. ”Si se requiere hacer cua— centenas focalizadas, pues así será”, RÁN Por su parte, el ministro José Chicora (Producción) informó que si se presenta en el país la segunda ola de coronavirus, se revertirá las últimas medidas de la reactivación económica de la fase 4. ”Si viene la temida segunda ola en algún momento, vamos a revertir en las siguientes semanas. Queremos hacer una operación más quirúrgica, más preci— sa regionalmente. Si vemos que en algún lugar se presentan las condiciones para una segunda ola, sí vamos a revertir las actividades que presentan mayor riesgo”, [Jorge Salazar]",10
1980.7,1542.6,61.8,30.4,44.5,"(e 1 ¡' ID'¿_, ea ©HI[li'l.1(¿|'[¿t'»'i'(»]|:ll.(*idencia a l 3",10
1977.75,1852.0,53.5,26.75,44.88,"N alijo, Contaste el pre oe Atico 150",10
2233.15,2256.26,74.47,22.76,85.21,"CULPABLES — ©Para Manuel Merino, a quien llaman ”El el expresidente Mar— tan Pizarra es el culpa— ble de no haber concre— tado las negociaciones _ para la vacuna contra , el coronavirus. También",10
1809.12,2430.25,77.12,23.0,83.0,del Tribunal Constitucio— © nal (TC) para nombrar,10
1881.25,2477.5,75.0,22.0,89.0,una institución que es—,10
1833.56,2535.5,50.62,21.12,85.19,"_ té a la medida de sus in— : treses y objetivos”. Mu— , cho cuidado...",10
2220.0,2412.2,57.2,19.8,80.8,— afirmó que la respon—,10
2274.3,2458.5,58.8,24.1,90.1,habilidad es de los alia— dos del exjefe de Esta—,10
2219.1,2526.0,57.5,18.8,89.5,.. do que no hicieron su : chamba. Toma mien—,10
285.42,679.66,62.68,24.61,85.39,"a dr €Dy palos, e incluso con armas de fuego, un grupo de personas trató de ingre— sar violentamente a la zona del Damelo A del emporio comercial de Amarra (La ”Estos sujetos, que según me dicen también esta—",14
854.53,635.11,61.38,26.11,76.91,"ban armados y dispararon al — Agregó: ”No son comercian— aire, quisieron invadir la zona _ tes informales, se comportan de Aviación con Barranca y como delincuentes, des— la ea d a l de temprano han intentado ( el e E ta e gl romper las rejas, romper la los seremos que resguarda— seguridad y lamentablemen— ban la zona”, señaló Susana te había muy pocos efectivos",14
675.4,798.8,80.5,25.8,89.9,"Saldaña, representante de la Coordinadora de Empresa— rios de Gamarra,",14
1069.93,803.33,58.53,24.53,91.53,policiales en la zona... Hago un llamado al ministro del Interior y a las autoridades,14
328.94,1004.75,79.69,24.38,89.12,"+Es bachiller en ingeniería aeroes— parcial de la Universidad Virginia Tech. Además, estudió ingeniería mecánica en",14
251.0,1070.0,62.25,24.0,92.0,la Universidad de Rice.,14
368.41,1122.94,50.06,24.0,88.59,"+Para el 2021 se espera que se ejecute la misión Artemis I, que llevará a la cáp—",14
234.0,1170.0,70.75,25.5,91.25,sula Orión sin tripulación.,14
389.0,1710.67,110.33,43.78,85.67,<Supervisa misión que llevará primera mujer a la Luna,14
273.12,1881.88,56.19,25.81,64.75,"a peruana Rosa Ávalos— Warren, quien vendía n Chilca, supervisará ne e ee ta E e",14
644.17,1869.83,51.25,24.75,90.58,"que busca llevar a la pri— mera mujer a la Luna en el 2024. Cuando aún no caminaba sus estudios, en el 2009, la",14
1932.53,469.32,62.79,26.26,88.37,G$ Se hacían pasar como chofer y falso pasajero de una cotopaxi para asaltar a los vecinos de Comas.,14
1717.89,566.75,64.96,25.89,84.71,"pertinentes para que no nos — Gary Flores Ruiz (21), 'Zancudo', y dejen solos”. Moisés Torres Párate (30), También se supo que estos zas', fueron capturados luego de",14
1475.04,713.62,74.58,25.29,87.0,"”invasores' habrían roto una puerta posterior de la Esta— ción Amarra del Metro de Lima. ”Delincuentes no pueden ingresar a nuestro emporio comercial”, manifes—",14
1819.61,1349.61,63.51,25.04,89.61,"ingeniera aeroespacial y mecá— nica comenzó a trabajar en la NASA [Estados Unidos) y ya ha liderado más de 20 misiones. En una entrevista para el pro— grama NASA STEM, compartió su experiencia con jóvenes de las carreras de Ciencia, Tecnolo— gía, Ingeniería y Matemáticas, y les aconsejó que luchen por sus metas. ”Pueden llegar más lejos que yo. La universidad era un sueño muy leja— no para mi familia,",14
1941.45,722.29,65.26,23.39,88.97,"cometer su último atraco. Le habían arrebatado su celular y otras perte— necias a una de sus víctimas, en la urbanización Los Viñedos. Tras ser identificados se realizó un operativo y se capturó a los maleantes. (M. Flo—",14
2235.6,1017.43,61.74,25.71,87.71,"esa puerta. El llegó a una de las mejores universidades del Perú y me dijo que yo también podía ser ingeniera”, contó la peruana, quien es gerente de misión para vuelos espaciales tripulados. SU META",14
2229.3,1377.02,62.55,24.62,89.85,"Sin embargo, afirmó que cuando miró con sus padres a Esta— dos Unidos se convenció de lo que quería hacer. ”En la televisión vi por prime— ea de la misión Columbia, pero lamentablemen— te hubo un accidente y perdimos a los astro— nautas. Desde ese momento me puse como meta que debía tra— bajar en la NASA para evitar que",14
737.29,2214.0,43.14,23.14,38.71,[Al lo m este zs s en Ar a d S,14
321.6,2128.4,90.0,46.0,60.4,fa S e del Corredor,14
1115.67,2377.0,45.25,28.5,44.25,"ez m doit os s o d en l allimienos;, no es tie t no rss n d 6. ]",14
2151.89,2031.81,64.06,25.26,87.38,"ea a este tipo de accidentes vuelvan no José abrió sl ese Actualmente, Ávalos, quien es mamá de una niña, trabaja en el programa Artémis. Bus— ca que los astronautas pongan un pie en el Polo Sur de la Luna. A la fecha continúan las inves— citaciones con un satélite para determinar el lugar del aluniza— je. [Sonia Obregón) ©» Hermosos árboles y je. En otros puntos, árboles muñecos navideños, de siete metros con unos incluso un trineo eco— 2500 envases cada uno, lógico con renos, se esferas navideñas con 5 mil han elaborado con frascos de plástico y 10 mil botellas recicladas, — capital, y un trineo con cajas de televisores, — renos hechos de eucalipto y capital y árboles molle secos. &CON MATERIAL En San Isidro, el parque RECICLADO En Surco, la comu— Pedro Murillo luce un árbol",14
1940.5,2504.58,54.83,23.08,85.67,"na luce en su Plaza Mayor a ”Frozzi— to”, un 'muñeco de nieve' hecho de 1800 botellas y cartones de su planta de recicla—",14
1377.0,2490.4,189.0,62.0,60.0,Construyen árboles y E 15,14
2279.36,2504.52,58.09,24.21,88.18,"navideño de nueve metros, con 8 mil botellas recicla— das en su estructura, lazos y fajín. La iniciativa es de la ONG Recicla, Pe!, Coca—Cola Perú y la comuna local. (I. Medina) o",14
1220.6,158.6,76.2,23.4,91.0,VIERNES 18 DE DEL 2020,16
1430.32,770.3,64.53,28.29,78.17,"M AUSTRALIA F|guran SC&HG& ”Avengers”. Es segui— Johanson listas.20minutos. _ da por Margot Robbie, Encuentra eal es [España) ela— — quien encajó a la alo— E Margot Robb¡e, borró un ranking —— cada 'Harley Quinn' en arena ALEMANIA M n Fox e es ”Escuadrón Suicida”. nt LI | | ega y compiten por conver— eu alga e en¡a oca otras famosas irse en la mujer más tenemos a la siem— 1 sexy del 2020' re guapa Megan Fox — Cuando Jack Gray, un con Ositos T)c(>ydavía )) FTragrl1sfcl))ramersg ”, Anne €? (t ee a Qllfgens— panda, una ganadora, — Hathaway ('Diario de land (Australia), fue a (e una princesa') y Jennifer hacer una limpieza gene— ee mer lugar Lawrence del ral en su cochera, jamás Fichera, pro— aparece la hambre'). pensó encontrar al inusual petardo de un estadouni— — Completan el top ten': e l e E e ea restaurante ita— r Sofía Vengara ['Modern una pared. en ta Res l family'), Alexandra Halló una araña gigan— (Alemania), decidió pro— Johans— Caddaric te de la especie Colonia testar de una singular son, nes de la bahía'), Jessica immanis”, que se carac— manera por las medidas recor— eriza por tener un voraz de restricción impuestas dada por Kate Upton [[Muje— apetito. Aunque muchos a los negocios de comida su papel res al ataque') y Mónica pensaban que contrata— debido al Covid—19 y que Te Beluchi [Trreversible!). ría exterminadores para están a punto de llevar— da Negra' Y para usted, ¿quién acabar con la plaga, Gray los a la quiebra. en la saga ganará? © — aseguró que la manten— Es así que decidió lle— irá viva y será su 'amigo nar las sillas de todas Go lo] Isn ell — nmrlu|m|nta…o;arml Cosa de locos.G las mesas de su local — — ese si ici es £dbmés con peluches de osos ,' Q""] '] '] | 0%3 e d panda. ”Estos muñecos — <;á./ no e 0 no pagan, no tene— | 1 [0 ( ] Í | :1 |",16
641.19,1310.22,68.52,34.37,65.19,"mos ingresos y estamos ,Kd *(O—K,-,— pete on Peor cada díg""%manifes(o J¡'t=;)I perelman — feo pesa io tó Fichero a diferentes l( W a medios locales. 'X",16
555.44,1833.29,71.56,26.51,85.65,"afuera vencedora. Jorge Caulo, con 38 años, es el rostro que representa a Sporting Cristal y el domingo buscará igualarlo cinco campeonatos que ganaronJorge Stoy Carlos Lobatón. alzó los títulos ponlos celestes en 2012, 2014, 2016y 2018. En Florida hasta se habla de la renovación de vínculo por una temporada más, debido a su profesionalismo entrega, al— go que contagia a sus compañeros. Caulo lleva nueve años en el club ha jugado de volante, mixto y central. El plantelvolvió a los entrenamientos con la alegría de que Christofer Gon— zales y a está recuperado de su lesión al tobillo podría reaparecer el do— mingo. Pese a la ventaja de 2—1, el técnico Roberto Mosquea aseguró que nada está dicho. ”Saldremos a jugar como estuviéramos empatando”, afirmó.",19
675.0,2137.7,87.15,31.7,88.15,"DEL PLANTEL TITULAR, solo Gianfranco mz© Chavez y el ecuatoriano Washington Corozo no saben lo que es campeona con Cristal.",19
2193.3,669.71,80.94,26.06,80.55,"0 Dimelaverdad y quitameestadu— da...!Angel Comienzo sela'can— tó' clarito a sus jugadores. Des— pués del pitazofinal, el técnico crema quedó muy molesto porel desempeño de Universitario, que perdió 2—1 ante SportingCristal. Cuan— do ingresaron al vestuario del Estadio Nacional despegó toda surabia. El argentinoreclamó a sus pupilos por sermón 'tibios' en unafinal. ”Estos partidos juegan con la sangre en el ojo... Novio enel equipo...Asínova— mos ningún lado”, habríadicho el DT. El plantel escuchó en silencio los re— claros conscientes de queelmarca— dor pudo serás abultado. Después de abrazar a su almohada, la bronca no sele pasó a Comienzo.Ayerenla prácti— volvió a llamarla atención, aunque estuve fue una charla motivacional donde apuntó al corazón para apelar al amor propio de los jugadores. Mientras, el central uruguay Federi— colonos volverá a sobrevaluado por los médicos del club para versi puede jugar el domingo. Conelcharrúa, la 'U” disputa 13 encuentros y solorecibió9 goles.",19
2196.35,1305.06,59.71,29.94,85.35,EL COLOMBIANO Donald Mi— lrán no seguiría en la Eres 110 estaría en los planes del técnico.,19
1086.64,2586.29,124.79,48.64,79.21,"JORGE CAZULO, con 38 Años, ES DE CRISTAL Y VA POR SU QUINTO CAMPEONATO",19
1652.94,807.56,125.11,39.5,85.94,ROBERT LEWANDOWSKI SE LLEVÓ TODOS LOS PREMIOS ESTE ANO Y AYER GANO EL ”THE BEST SUPERANDO A CRISTIANO,20
1448.72,1335.67,82.76,26.52,79.28,"úrich.— Estuve hubo alfombraroja, perosico— conexiones contados los rincones delmundovíain— temet. Enana ceremonia atípica, el polaco RobertLewandowski se llevó el premio The Best 2020' al mejorjugador del mundo, supe— dando nada menos que a Cristiano Ronald (2o) y Lionel Mess (3o). El delantero del Bayern rompió conlahegemonía de los 'mons.— truos' en las votaci ones y conquis— tóelgalardón enen añobrillan— te donde también fue campeón de la Bundesliga poroctavavez, qa— adonde primera Champions | eague, alzó la Supercop deAle— mania y de Europa, máximo go— leadore mejor jugador de la Liga alemana, recibió el den Player que otorga",20
1378.14,1746.14,80.86,23.0,72.86,£ SE LLEVÓ TROFEO POR SEGUNDA VEZ,20
1433.5,1989.4,57.4,27.8,74.7,m El alemán Jurgen Klapp €$ (Liverpool) fue el gana—,20
1909.52,1312.62,74.03,25.27,78.38,"”Tutto Sport”, a mejor delantero y futbolista de la Champions y tam— bién mejorjugador la UEFA. Es— te 2020 levantó todos los trofeos. ELINGREDIENTESECRETO ¿Cuálha sido la receta de suéxi— to? Trabajo y la dieta. La alimen— tación, gracias a na, quees nutricionista, hajuga— don papel clave en su carrera. El día nueva a jugar come muchas proteínas. Siempre hay atúnensu desayuno, evita todo lo que ten— ga gluten y lactosa. El día previo al partido, después de la cena, co— men plato de arroz con lechepa— ra llenarle cuerpo con carbohidra— tos y glucosa. Después de un en— cuentroserecuperaconvegeta— les paltas. Cambióencasa, mo— edificó su cuerpo hoy es el mejor",20
1605.36,2070.64,72.36,25.64,88.64,"dor del trofeo a mejor técnico, por segundo año consecutivo, en un podio donde también postulaba su compatriota Hans Flick (Bayem) y el argentino Marcelo Biela [Leeds United).",20
1702.71,2207.57,95.0,27.57,66.71,PUSKAÁS: Hyung Min Son [Tottenham) porsu gol'marado—,20
1664.15,2312.15,102.08,31.54,77.62,Sarah Bouhaddi (Lyon). Sarina Wingman (Selección Holanda). *MEJORJUGADORA : Lucy Bronze [Manchester City).,20
1646.0,2386.67,131.0,41.17,68.33,//ONCEIDEAL: Alison Becker [Liverpool); AlexanderAmold [Liver—,20
760.92,2401.67,68.08,34.67,90.58,LA GALA fue conducida por el futbolista holandés Rud Bullit y la,20
386.5,2453.0,82.75,31.0,62.75,presentadora in ENLA CER,20
658.6,2530.4,50.4,25.2,76.7,"Paolo Rossi. , l ARECA votó por: Mess (1o), N",20
615.88,2568.25,77.62,39.25,73.38,"í3&íolo Guerrero eligió a: Hago Alcantara [1oí, EE",20
819.89,2470.0,73.22,29.78,89.11,ONIA se rindió homenaje a los fallecidos Diego Armando,20
1627.42,2465.68,91.23,30.0,74.42,"pool), Virgil Van Dijo (Liverpool), Sergio Ramos [Real Madrid), Alphonso Davies (Bayem); Joshua Dimmick (Bayern), Kevin Brune (City), Thia— o Alcantara (Bayern); Lionel Mess (Barcelona), Robert Lewandowski Bayem)y Cristiano Ronald (Juventus)",20
1644.36,2593.71,82.29,27.0,77.43,/MEJORARQUERO: El alemán Manuel Never (Bayern) superó a Alis— son Becker Jan Obla (Atlético).,20
2397.72,1557.2,61.97,24.36,86.91,"DEL SAQUE somos carne cit z POLACO ROBERT LEWAN KI es justo ganador del premio Best' a mejor jugador del mur Siempre he dicho que soy Messi, pero en este 2020 el g del Bayed se llevó todos los [ míos que disputa y creo que F sido injusto que no ganara. Es segundo futbolista, junto al cr ta Luka Godric que ganó el de Oro 2018”, que rompe la he ponía de Cristiano y Leo' en l últimos años. Pensar que cua *9' empezaba hizo dupla de at con el Rendido en Le Poznan, pero su trabajo, escu profesionalismo hasta para es sus comidas lo ha llevado a la Acá algunos creen que con ce ”chelas' y ron pueden hacerla. yayay... LO HABÍA DICHO PREVIA, el 'U'—Cristal iba a resultado cerlado. El 2—1 fue p premio para los celestes, que plantaron mejor en el campo”* ron cada dividida como se tier hacer en una final. Nada está para la revancha del domingo creo que el marcador se just a lo que desea la La ' irá por el gol y dejará espacio que le gusta al juego rimense, dado que si los cremas se des les pueden llenar la canasta. / es... YA ME CONTARON QUÍ HERMANO del fue d lado persona no grata en su k de Pamplona Alta. El hombre | pedido prestado un billete par hacer un buen negocio con ca de la zona. Lo malo es que ya la ”pepa' y lo están buscando | en su casa de Surco. Lo mismo con compañeros de la pelotita ra está como no habido. Qué y BIEN EL ARQUERITE QUE ' atajando penales en lz de la Fase 2. Los huan cai nos f a buscarlo y le ofrecieron un b que fácil le alcanzaba para un del año, pero el muchacho pic que mejor le compren un terre porque no tiene casa propia. [ ce que el chibol piensa prime el ”techo' y después en otros I Vale... Y LO VI A ©CHILAVEG full fotos con su princesita. El semana estuvo en el Parque ( Aguas haciendo las tomas col hija mayor, que acabó el cole ya ingresó a estudiar para abc Chévere... Me voy, soy fuga.",20
6.27,1512.6,42.49,22.64,71.85,"DWS— The o. a E leñador re— E y león 3 aque ch coger cima. la 110 e a LA Il cO pl e que dicho Pero e , algo pidan sí EL cla— arreo había | 10 da asta hizo W alta... 3 Ti ó no are— ro en in de o y gada.",21
1296.67,160.67,104.0,23.33,90.17,VIERNES 18 DE DICIEMBRE DEL 2020,21
1217.83,158.5,98.5,23.5,90.67,VIERNES 18 DE DICIEMBRE DEL 2020,22
1620.97,716.55,79.66,26.21,77.38,"Beto'Da Silva sería el únicoju— dador confirmado parajugar por Alianza Liman la Segunda, pero los representantes del delante— ro no desean verlo noten 2021. Trascendió que des— de hace unos días, sus empresarios le estarían buscando equipo y Melgar Vallejo seríamos primeros interesa— dos enel”9”. Ambos clubes estarían condicio— nes de pagarlos 20 millares men— sales que ganaría Beto, además el cuadro ”poeta' le ofrece jugar la Liber— tadores, algo que sus allegados con— lideran importante para re lanzar su carrera. En Matte se habríanentera— do de las gestiones y aunquenoestán de acuerdo, insectoide la directiva considera la posibilidad de abrirle las puertas para ahorrar 240 mil dólares portemporada, teniendo en cuenta quele quedan dos años de contrato. Dentro lado, los blanqui azules con— fianenqueelTAS les dé razón a sus reclamos y exigiría a la Federación una millon aria indemnización. G",22
1605.35,1319.1,75.85,29.6,88.0,ALIANZA EMPEZARÍA a entrenar en la segunda quincena de febrero con mirás al Torneo Bicentenario que se disputar desde abril.,22
2305.9,475.29,58.26,28.16,81.29,"Los laterales Alexis GO Cessio (ex Ayacu— cho FC) y Carlos Negra (ex Melgar] firmaron una tem— parada por Municipal. ”Es un club de mucha tradición, será lindo representario”, el o",22
2077.06,843.87,51.97,25.61,70.87,G) Manuel 'Avión' Corra— d e del Cusco FC. El lateral de 38 años estuvo en Mannucci. Los imperiales también ase— juraron al defensa uruguay et el ie g FZ [<],22
2326.91,1207.71,57.23,28.29,85.54,"ANGEL VENGADOR Sport Huanaco GO ñ€ñó F golfo Ángel Zamudio, quien fue pieza clave para que Ayacucho FC gane la Fase 2. ”El hijo vuelve a casa”, anunció el club en sus redes socia— %",22
322.41,1275.18,122.45,32.55,69.36,"delaLiga2 y seis equipossueñanconse— guirencarrera. SoloAlianzaAtlético, que enfrentará al JuanAurich, es único asegurado en los play off. El'Ciclón' estáobligadoaganar— leal Sullana, enel paraasegurar— seunlugar.",24
397.43,1155.71,96.14,24.71,59.86,buena Navidad Hoy reconocerán los cuatro semifinalistas,24
807.67,226.67,147.22,40.56,54.11,3 p eo ee i semifinalistas de la Segunda'que—,24
2082.0,190.0,91.0,24.5,90.75,CON TAP Cabezón imparable.,24
2065.0,221.0,50.82,23.82,76.09,"© _ — GOLPEO Y AVANZA u Celta, con Renato Tapia",24
1991.78,261.44,58.56,32.78,65.56,desde los 77 golpeó 5—0 a _ COPRA DEL,24
1897.19,456.67,60.51,25.3,86.49,"Llanura de la Tercera divi— = [REVNATO sin y clasificó a segunda —— ronda de la Copa del Rey. El cuadro del peruano sumó su cuarto triunfo consecu— tipo y el domingo chocarán con Través por la Liga. En Arabia Saudí, Al—Hilal, con André Carrillo, cayó 2—0 ante Al—Fateh y quedó fue— los octavos de la ”King",24
2053.75,636.75,57.75,55.25,41.25,Nerese et V F:¿_.¡,24
2261.1,1181.72,63.34,24.95,87.92,"G» Vuelve a Europa. Nues— tra matadora Ángela Leyva, de 24 años, fue anunciada como refuer— zo del club ruso VC Yenisei Krasnoyarsk, que jugará los play off por su permanencia en la Supervisa femenina. La vole ibo lista arribó a Rusia y será su tercera experiencia en el exterior. Anteriormen— te jugó en Owasco de Brasil y Spor Kiluba de Turquía. G",24
1445.22,1064.3,70.78,31.89,70.52,"la FILAS LLAVES de _ ”semis' quedarán defi— vidas así: primero vs. cuarto y segundo vs, tercero, Ambos parti— i ee se¿ugaran el 23 de pt elA",24
1070.45,1266.59,129.98,36.84,68.43,"Laúltimafecha de la primera fase sejugaráensi— simultáneo alaunadelatarde. UniónComercio chocaron Pirata (Videna), Santos [(queyaestá eliminado) jugaron Chelines (AlbertoGallar— do')y Comerciantes Unidos, quepresentósiete — y ascenso a Primera positivos coronavirus, latendrácomplicadaan— _ en partido único el reunión Huaras ['Miguel Grau'.Ayer, Copsole _ domingo 27. despidióganando 3—2a CulturalSantaRosa. G",24
1493.71,1953.14,91.14,45.14,82.86,| | _ Consulta nuestras tarifas y,24
1617.25,2017.0,122.75,53.25,80.0,publica tus avisos de,24
2320.43,2740.0,33.71,30.14,48.29,f p D + los 278604 l,24
