left,top,width,height,conf,text,page
382.93,1793.12,116.5,26.86,77.97,"lta exactamente una semana parcel levantamiento de la cuarentena, pero las cifras de contagio siguen en alza y locura parece estar lejos de aplanar— se.Según programación del Gobier— no, hoy reinicia la fase de de s escala da contra el coronavirus y regresaránala actividad un total de 22 profesiones. De acuerdo a loscálculosdel ConsejodeEstado, liderado por el presidente Martín Vizcarra, alcie— fredel presentemesestarán operando cerca del 50% de las actividas, quedese hoyseiránin— presentando poco a poco. Además de la reactivación económica, uno delos principales objetivos es aumentarle número puestos detrabajo.Como lo ha anunciado Viz— carra, quien ayer descanse sus diariasconfe— rencias, cada mes la actividad un 10%, propuesta revisa da por el Trabajo Multifactorial para la Reanudación delas Acti— vidas Económicas” CIFRAS Sinembargo, las cifras no son alentadoras y poreso loses— especialistas piden no bajarla guardia, debido alentusias— mo porlareapertura.",9
386.5,2414.5,39.75,34.0,38.0,n n S O,9
1381.17,160.67,76.17,23.33,90.5,LUNES 4 DE MAYO DEL 2020,9
1023.0,346.0,217.25,36.0,81.25,MUNICIPIOS NO RINDEN CUENTAS,9
1074.55,679.21,67.31,25.44,89.51,"© E! EE d_e munici— dios no rinden cuenta ni reportan los registros de beneficiarios de las canas— tas básicas familiares, reveló la Contrataría Gene— ral de la República. Según un informe, 802 alcaldes no registraron la cifra de beneficiarios y 418 no cumplieron con consignar el monto ejecuta— do para la compra y entrega de canastas, situación que limita las labores de control y no contribuye a la rendición de cuentas oportuna de los recursos públicos asignados.",9
1171.37,1985.1,107.68,26.65,75.4,"EleconomistaJorge Gonzalez el Perú es uno delos paísesdelaregión en mejo— re s condiciones para la reactivación, perono hay que descuidar tema del contagio porque las consecuencias pueden ser peores. Hastaayer teníamos 45 mil 928 casos con— firmados deCovid—19 y los fallecidos llega.— ron a1,286.En un díaloscontagios seele— varon en mil 394 y las víctimas morta.— lesen86. Porello, paradas lasactividadesco— merciales, productivas y deservicios deberá seguirán protocolo.Las empresas deberán, porejemplo,to— mar pruebas de descarte, entregar mascarillas, guantes y gel, asomo promover trabajo remoto.",9
1924.83,300.67,265.5,81.0,84.33,Consejos para hacer las compras con seguridad,9
1945.14,465.43,111.0,34.07,88.5,"Recuerda que, por muchas precauciones que tomes, algún producto (o superficie) puede estar contaminado.",9
1979.69,1411.01,58.95,25.25,71.45,"] mascarilla y exige e el mínimo 1,5 e a r t Sigue las los otros dispuestas por las M autoridades. d [ poder atender. e d ee desinfectante de manos. ] e pd dd es e mucho rato en la Una compra, ra _ persona (sin sintomas) 0 s | menos afluencia _ Verifica que el vendedor de público. y puesto estén limpios y seguros. ] productos. Indica al vendedor lo que requieres. . As1únhdequelw productos estén Bien conservados. Revisa la fecha de vencimiento.",9
2279.11,2507.78,42.33,22.11,39.67,el oe s ea ta s ea no Rot,9
