left,top,width,height,conf,text,page
1112.33,122.0,56.56,26.33,50.67,Whatsapp 951—665—767 e a l ea © o e,1
1674.88,1053.25,320.0,90.25,59.88,RESTAURANTES Y FOLLARÍAS EIE.'$Í [H] PE©I]I.S POR DELMER,1
1743.33,1761.33,155.5,54.17,68.83,POR [UIES ID)E (C©R.NA RADS S[I(GUEN,1
805.91,2420.0,106.82,58.73,49.36,l MUEREN W 1' “ '“ “ (_([_ /íf .©S m¡ou¿%'¿,1
182.86,365.86,175.57,48.71,86.71,&AFIRMA ESPECIALISTA Compartir lápiz labial es peligroso,10
670.83,490.33,70.1,25.43,88.19,"G> El lápiz labial, bases, correctores, máscara de pestañas y brochas son los principales cosméticos que suelen compartirse entre familiares y amistades, pero hay que tener cuidado. ”En estos tiempos de pan— demia, el maquillaje debe ser solamente de uso per— sonal”, señaló la especialista en salud ambiental del Ins— titulo Nacional de Salud [INS), María del Car—",10
1139.83,158.5,72.5,23.5,89.17,LUNES 4 DE MAYO DEL 2020,10
1457.64,450.18,54.09,24.0,43.36,50 ta la dades Nicole e |oit»mn( ell sin a 1IE£%(¿[*,10
1953.8,327.0,204.6,53.0,86.4,Darán orientación _ oftalmológica gratis,10
1864.12,575.19,82.44,25.41,83.31,"GD eie! gratqita. . Oftalmosalud brindará orientación oftalmológica a distancia, a través de las redes sociales, plataformas virtuales, teléfono o video— llamadas, mientras dure el ”Estado de emergencia”. Se usará Google Meet,",10
1840.25,737.5,66.75,25.5,91.0,Zoom y WhatsApp. Los,10
740.4,794.8,42.0,29.6,64.8,que el Covid—19 ul E,10
1109.5,769.5,46.25,27.0,41.25,esta e ds e,10
825.0,1078.86,107.14,51.14,54.14,el AFIRMA QUE VIDEOLLAMADA l ta ei,10
392.64,1873.14,171.14,32.71,74.0,"en tir se cerca de la — elcontactofísico(abrazos familia, pareja amigos ahora es zad o por las videollama— másfácil,puesen — dasylasreunionesvir— tiempos decuarentena. tuales.",10
198.25,2024.0,34.75,35.0,41.0,fo T AO Nid,10
1051.9,2194.8,55.3,22.8,55.5,ts e (doi|k—…3/lfil0(o].q d ne S [o'i'm[c: lll.lnl (crahiitdl [qu—,10
1016.12,2350.5,53.75,28.25,54.25,|oxuiltox» M Jlnn;»tt: |Enl IIII|1IVA(0(“X(I mi est ir,10
1818.0,782.8,121.6,24.0,84.0,interesados deben escribir a contactoQoítalmosa—,10
2271.27,768.27,58.8,23.07,86.07,sus datos y número de con— tacto. También se puede escribir al inbow del Face—,10
1874.49,1344.56,131.79,30.61,75.14,"lud.com.pe un mensaje con — book. [+] RECOMENDACIONES caquesibienesbeneficio— Establezca horarios para usar el celular, sotenerestecontacto, hay tablet o laptop. queestablecerreglas. ¿Cuidado con enseñar imágenes sugeren— 13 — tes a los amigos, todo queda grabado en el ”Porelteletrabajo tendre— . móvil. mos reuniones virtuales, — padres comuníquense más con sus video conferencias y no hijos y establezcan horarios. Pueden bajar la toallas personas pue— < aplicación Familylink para controlar sus lla— de n conectarse cuando : malas | mensajes serequiera.—Laparejasde— en ben comunicarsebienpa— ParalapsicólogaNan— raevitarresentimientos”, e — que E cySánchez,e(jstas hen;;1— r[r)1er;ílionó. N mientas ayudan mucho etallóqueno hayquesa— aUtoe_5tlma y ano sentirnos solos, ele— — turarlasconversaciones, perm[ten saber que var nuestra autoestima cadafamiliatienesuscos— P darnos cuenta de tumores algunos |GS Importamos a 3c/uámtolesimpo¡.'ta— no les gus y ta qu gg los otras personas personas. ”Puedenunir— ”Porlasherra— sala reunión, qui— mientas de internet tar le la imagen y solo (WhatsApp,Zoom, hablar Esonosigni— Facebook) pelea— NANCY — ficaquenolesimpor— :mos'menos,nonos — SÁNCHEZ talafamilia”,advirtió extrañamostanto y Japsicóloga. ”Losma— — yo rcitos del hogar se han jorsonrisa. Ynosarregla— — sentidomásacompaña— pues sabemos dos,semuestranmásfeli— quetenemosuna'cita”, ces,puesyanosesienten afirmaSánchez. excluidos”, indicó.(Natha— Lapsicoterapeutaexpli— — lieSalazar) &PUEBLO LIBRE",10
1482.2,2109.8,196.2,58.2,86.8,Vecinos de edificio temen contagiarse,10
1725.47,2324.76,63.35,25.88,88.12,"Vecinos del edi— G» oficio ubicado en La Mar] 1081, Pueblo Libre, están preocu— lados porque un",10
2045.8,2125.6,173.4,51.2,89.0,Abuelos infectados en casa hogar,10
2033.82,2321.68,64.77,26.77,83.95,"Unos 20 ancianos GD de la Casa Hogar ”Los Abuelos', de Sur— co, necesitan ayuda. La enfermera Gladys Correa [43) contó que",10
1039.0,2455.2,26.8,25.8,43.0,ee puesta ei D a,10
1126.4,2552.4,36.0,21.6,53.0,pue ses em loss a,10
1545.85,2524.07,62.41,23.88,90.0,inquilino es médico y ha sido trasladado de Hacho para reforzar a la Contrataría en la lucha contra el coronavirus. Afirman que puede contagiarse y ser un riesgo para los demás. Piden que le den aloja— miento en otro lugar. [+],10
2130.74,2529.66,64.0,25.29,90.11,"5 ancianos y 3 técnicos han dado positivo para Covid—19. ”El Ministerio de Salud vino, hizo algunas pruebas y se fue”, dijo angustiada. Pidió que a todos les hagan la prueba rápida. Para apoyarlos llamar al 273—3046. G",10
222.33,551.83,99.17,66.17,54.67,GA l'?-aa3 m*1€s©© 61 EWC¿ I_Q,11
1477.6,422.6,109.2,35.4,52.8,noxdellostereadores: delhmuneco[d¡ab& o a /A,11
1693.29,703.77,125.16,37.9,51.03,tcióntentelimundoxdelksétimo: ngeles'llohnl (artg¡yllos(c¡ne ie Lafiateoescribióllasipro: u ones'iChuckV' p i IWQÍ1 990) P IElfautor¿de Íluego)msplra5) famosa a % | Chucky¡((el A e ee ltema(6€fanosicuanIhzoílasic¡ntas* dorderidiódejar: ThelBlueílguana ”Manisibestifriend: s a ea,11
1219.0,1232.17,277.0,43.5,49.17,C)Una(gata mamátsorprendióta Ios&medlcos&y(enfennerastde) unihospitalidelEstamibul .qu|al¡aI|IIwar(axsu(gatnta(eníerma¡ |paratqueílafat¡endam La(gatalllegolcomsu(crla(coligadatde:la boca; traspusolla: |puerta(del(centro'de¡saludW!la colocóldelizadamenterelante,11
1788.0,1243.56,223.22,40.78,58.11,talla madre*llos?medlcosil&h|C|elronítomograñasfallgatlto w'llamarontauniveterina |r|o]para(quellotatle da: la (crlatselrecupero]luggo[dell tr$tamlentoxy5yarestafal,11
2228.96,944.46,87.0,35.12,49.42,< 'íLaINASA iestá |pub|lcac¡on irio:de Facebookique uniwideoton— a %ura5'…de ttese'l(alejarse)ien'cada N em ee sl d selle uno (de lositestigos. ¡comentó: ME a ne (.,11
595.84,1732.88,159.92,49.36,75.68,CLUBES DE La LIGA Y |A FEDERACIÓN SE REUNEN HOY PARA DEFINIR PROPUESTA QUE MARCARÍA EL REGRESO DEL FUTBOL PROFESIONAL Y QUE INCLUIRÍA PRUEBAS MOLECULARES,13
1332.45,2116.42,64.13,24.86,89.61,"a espera desespera y la vida sin fútbol aún más. Porque mientras los esta— dios siguen en silencio y as, debido a la pandemia del coronavirus, desde la Federa— ción Peruana de Fútbol se sigue pensando en propuestas para que el torneo de Primera División pue— da volver y en las próximas horas podrían llegar a un consenso para trasladárselas al gobierno. Se supo que hoy por la tarde habrá una reunión por videoconferencia entre el presidente de la FPF, Agus— tan Lozano, y las de los clubes profesionales para hablar del tema. Es probable que desde la Viena se presente al Ministe— rio de Salud un protocolo en el que han trabajado los doctores Jorge Alva y Julio Segura, el infectólogo Eduardo Gotuzzo y el preparador físico de la selección nacional, Nés— tor Bonillo. A esa propuesta se le apuntarán varias partes de la pro— posición elaborada por Sporting",13
1811.11,2090.06,64.96,24.27,89.55,"Cristal y el comando técnico lidera— do por Roberto Mosquera. Uno de los apuntes más importantes sería que la Liga 1 se comprometería a realizar pruebas de descarte en los equipos profesionales previas a arrancar el tomeo, aunque por ahora no se conoce quién financia— rá esta iniciativa. Lo que sí queda claro es que deberán ser molecula— res por orden del máximo ente de Por su lado, las instituciones están dispuestas a poner todo de su par— te —incluso no descartan jugar con guantes o mascarillas—, ya que la televisión les estaría pidiendo su apoyo para agilizar el regreso del fútbol y, con ello, seguir pagando los derechos del campeonato, úni— co ingreso que tienen por ahora. Por otra parte, los clubes tendrán hasta el 29 de mayo para hacer uso, según el presupuesto que pre— sentaron, de los 50 mil dólares que la Federación ya empezó a entre— darles como ayuda económica que viene desde Conmebol.",13
2239.57,1892.79,48.43,28.36,87.64,dió la cancha de su escenario en caso la Liga 1 se jugase solo,13
2285.0,2291.81,85.04,33.27,90.23,"La FPS y el hipódromo han tenido un acercamiento para ver las condiciones que puede haber para el retorno del deporte”. Víctor Zamora, Ministro de Salud",13
2055.18,1533.55,132.27,36.73,47.09,fsum100cupanel ra ie lEl[quejjuega o l o 't0dos)lo*hace dsñiés!ifámbi€m“ (es'elque¿usaehumfo]m distinto,14
1852.65,2101.9,190.87,41.55,55.58,"let0(goleno 200 'trraslada(esa5¡ngulandad%úla Xv1daim¡sma… (¿p l |1Í'os*sejgu ¡Qorestienes (gnlllr&ta%mm. Nousolastedessociales:, f¿l)&' ee 'tenerjasjpero)no)me]llamaila Esos¡'jpero“& _eees;mejhan (ocumda cosasextrañasconese t fewq,ueíte¡reñleres») Haugente;ála(que]llamoypne (corta'1porquejpreñeremahdan F e[ partido? eesome |los)m010c0n'agu amíumns¿aellabuíéllmjla¡ W o porque eso tamibién; _1rect0'del&envase",14
2309.13,479.73,200.67,42.67,58.13,"a e íl""ampocogporquedespu1 (estanmlrahdoesaraya!q1 odelopartudo¿¿(l?ldes¡uníunft'o'rme) gemela 13 lo busco l que la si media ¡mequedenrsabre)lasmd¡ D)espuesícualqu¡encalor igual oCuanÍds¿g&fresde) (chl nooo",14
2401.8,758.0,185.4,44.0,58.0,oa110)much0fres > í¿l_ll'efauegala ngatosfñ &u'ñmlaíloamñsfchlbd,14
2339.41,1689.0,228.04,41.84,51.09,"7""encuentrr0aíun qquanavse)lqgas t e (elimlo'in0'ledoy,mada… ¿u%iolf_'es[elílns_ul&o'q_ue& ea Cas¡¡nome;ahacahipemc WowállManumen al pi (e Ky¿aWeces)me!ha¿ a (suplente3y;semgprendel o lEra's¡flgurafenmllhnu gre1exl&fdláe!a(&e*s&¡ callejo>= Fueunamejomferta&ydo porquedeb¡aíapoyaraím hemnanospara'quetenm 1umvers¡dad Wexmlh'arojúl'acann Sljy,(estoy¿orgullasa'deah (que:son5grandes¡profes¡( Huaneayohace9¡ahas»f£] fauuemelhan1llegadonne1 (0fertasinahnewoxporqw s? r¡fellz» [te_da'sel_sobre*aftu'e'g1 Sl1lasfmu1eres'admm&stnr imejonelidinero» fnÍemmblhs(eamls_¿ e1hanjpedldofentregoy Que¡hacenqumum up'llnañ(fque) £g. Judlea*altequfg_d» ¡Jefhablawsúnoent¡emtema[de)los'dmgentes* 2 Concentraciones? Guandocompantialhdbit (c0niEmesto?¡o&rakakl$ler ¡ganabaíal¡play¡stat-10]1!o1aI &o'&1 (cumnawlr se (:' todos los pasos y antdosalgola% rato lb1enjproteglda&m desinfectoconmuchola!",14
2361.2,2552.0,194.2,37.8,50.8,o'dl Gracia s¿g6r'íiafrnusílm (0p_o:¡¡funldad Áustedes<ponestaconve¡,14
0.83,1109.67,60.33,25.67,63.33,"este les? paso + 3 amí,",15
0.0,2210.0,56.25,24.0,53.75,E ] ción aja.,15
383.75,445.0,25.25,28.0,40.5,p E d E,15
344.32,1554.75,64.74,23.38,88.93,"DEL SAQUE somos carnecita... LA FIRME QUE HAY UN CHA— LADO que se me ha caído. Ha dejado mal al barrio. Cómo va a decir que su mujer es la Vizca— rrita' de la casa y todo para que le agarren la cabecita y le digan buenito”. Y ella chapa moral y se autodenomina la porque pone orden en el hogar. 0 sea que yo camino a control remoto. Aquí no hay machis— mo ni feminismo. Las cosas son como son. Allá los sacolargos, ese es su problema. Sí, seño— res... EL ”NEGRO ROCKERO”' y un se junta— ron en un charla por Instagram y la verídica que fue puro male— teo y puñal contra entrenadores y dirigentes. Este par, en vez de contar cosas positivas y ale— gres, tiró barro con ventilador. El parrillero se metió con la hermana de un colega y el pela— do cobra cupos a sus pupilos y de eso ni de sus cochinadas se acuerdan. Curuju... YA ME CONTARON que el árabe del Misti va meter su mechada de sueldo a sus jugadores a pesar de que en los últimos años ganó casí seis palos verdes por los torneos internaciona— les. La gente está asada porque el equipo siempre llega míni— mo a la Sudamericana. Lo peor es que el billete era para trans— formar el club y hasta ahora no tienen ni una cancha de fulbi— to y todo quedó en proyecto. Qué feo... NI LA CUARENTENA pudo con el amor de un zam— bito con apellido japonés de un equipo del norte, que cuando se enteró que su pareja estaba por dar a luz al toque regresó a Lima. Se subió a un camión que transportaba fruta y vío nacer a su bebé. Y pensar que hay otros que se desentiende de su san— gre y no les pasan ni un tarro de leche. Rexuxa... ME AVISAN que Roberto Aspen se moles— tó porque le pusimos que había fiado una caja de chelas en una bodega de su barrio. El hom— bre no liquida, se cuida más que cuando estaba en actividad y es un tipo serio. Tranquilo, 'Canda— do', el ratero ya tiene que usar",15
379.0,2578.43,59.29,24.14,88.86,"lentes. Así es... Me voy, soy fuga.",15
888.25,736.0,122.5,36.0,87.75,Y EL EMPRESARIO TRATA,15
816.34,1561.44,57.91,24.12,89.34,"G» Querer es poder. La cuarentena no es excusa para no mejorar el físico y eso lo demostró el volante de Alianza Lima Altair Fuentes, quien posted una foto suya con los",15
1381.17,160.67,66.17,23.33,89.83,LUNES 4 DE MAYO DEL 2,15
1341.02,890.78,59.59,24.82,89.55,"G'» conoce como empresarios, representantes o mánagers y llevan en el fútbol muchos años. Como en la vida los hay buenos, regulares y malos, los que solo ven su bolsillo y poco o nada les importa el jugador. Con uno de estos se cruzó Juan Carlos Obligas el año 1975. El *Ciego' estaba en su mejor momento. Semifinalistas de la Copa Libertadores con la ”U' y titular indiscutible en la selección peruana, con la que estaba por disputar el pase a la final de la Copa América ante Brasil. El zurdo tenía como sueño jugar en Europa y por eso, cuando un empresario extranjero le dijo que tenía una propuesta de un club de España, no lo pensó dos veces y aceptó a pesar de tener ofertas de Argentina y México. El puntero llegó al Elche, un equipo de media tabla donde el entrenador era el veterano argentino Néstor Raúl Rossi. La primera toma de contacto entre jugador y DT fue extraña. ”¿Qué tal peruano? Tu empresario no vino contigo, ¿no te dijo nada?”, le preguntó. El puntero no sabía qué quería decirle el como se conocía al entrenador, y fue al vestuario a cambiarse. En los siguientes días, cuando técnico y jugador se cruzaban, el ”gaucho siempre insistía: ”¿Cuándo viene el que te trajo aquí?”. Llegó el día del debut y el rival no era otro que el Barcelona de Neeskens, Cruyff y Hugo Sotil. Obligas jugó los 90 minutos, pero su equipo perdió 3—2 con doblete' del Cholo' para los azulgranas. La crítica le dio una",15
2079.23,827.59,58.33,24.48,89.99,"buena calificación a la actuación de Juan Carlos y él se sintió bien en la cancha, por lo que creyó que en la siguiente jornada sería otra vez titular. Pero cuando el martes el estratega empezó a preparar el equipo para el próximo partido, mandó al a trabajar con los suplentes. El hoy gerente de selecciones no entendió nada, pero aceptó. Esa semana Rossi no lo puso ni de suplente y el 'incaico' se empezó a preocupar porque faltaba poco para jugar contra el ”Scratch' y quería llegar con fútbol a esos partidos de la 'blanquirroja”. Por eso, luego de otra derrota del Elche, se acercó donde 'Pipo' y le dijo: ”Profesor, hay algo que no entiendo. ¿Por qué pasé de titular a no ser ni suplente? ¿Qué hice mal?”. El DT lo miró y se la soltó: ”Tú no has hecho nada mal pibe. La verdad, no te conocía ni sabía cómo jugabas, pero el que hizo las cosas mal fue tu empresario, que tenía que mandarme un dinero por traerte aquí y no cumplió. Por eso no jugarás hasta que cancele lo que debe”. El peruano se quedó sorprendido y le respondió: ”Si es así, me regreso a Perú. Yo creía que usted me había pedido”. Al día siguiente, el atacante rescindió su contrato y regresó a Lima para jugar ante los brasileños. Fue titular, destacó y finalmente ganó la Copa América con la selección. Como brilló en los partidos claves, le volvieron a llegar ofertas, ya no de Europa, pero sí de México, del Veracruz. En 1980 recién pudo cumplir el sueño de jugar en el Viejo Continente”. Se fue al Secesión de Bélgica, donde destacó por cuatro años, y ya no lo llevó un empresario trafero.",15
1845.2,1478.4,57.6,22.0,85.8,NO SE MUEVE DE LA,15
810.72,2078.58,55.0,24.28,85.44,"resultados de su rutina (e i la que ha potenciado la i e ”El secreto del triun— fo es nunca poner excusas”, fue el men— sabe que lanzó el mediocampista ”gro— kg E 0 donde se le aprecia con los abdominales marcados. El jugador tiene con— trato con los íntimos hasta 2022, pero a fin de año podría ser la segunda transferen— cia del club, tras la del lateral Kluiverth Agui— lar, ya que estaría en la carpeta de las posibles",15
1187.17,2251.33,106.67,25.33,81.5,VOLANTE DE AL MOSTRO CAMBIO FISICO,15
998.5,2401.5,125.17,53.0,76.67,de ventas al extranjero. [!<% …S,15
1109.25,2586.9,68.8,29.8,89.15,HINCHAS DE ALIANZA Lima entregaron 1500 platos de comida a fami— lias que esperan en las calles volver a provincias.,15
2062.02,1848.6,62.92,24.28,87.77,"Pasó la tormenta. Luego de que surgiera el rumor que el delantero Jonathan dos Santos podría dejar Univer— sicario por la falta de pago de su pase, la calma volvió a Ate, después que el mismo presidente de Cerro Largo aclarara el tema. ”Me llamó el señor Moreno y me dijo que en bre— ve se pondrán en contacto con nosotros para resolver lo de la deuda pendiente por la Crema'. Somos dos clubes amigos y cuando hay predisposición siempre se encuentran los caminos para solucionar los problemas”, señaló el direc— tipo ”charrúa' Emeto Del a UC] Noticias.",15
2060.42,2433.21,68.59,24.76,89.14,"Un mas (D 'Chela” al congelador. Cuando todos pensaban que este 2020 iba a ser el último viendo a Jorge Caulo con camiseta de Sporting Cristal, el volante uruguayo, nacio— analizado peruano, podría cambiar de decisión. Se supo que el de 38 años, renovarla un año más —o mínimo seis meses— su contrato con los rimenses. El técnico Roberto Mosquea quedó sorprendido con los entrenamientos del",15
2051.15,2579.08,55.54,25.54,87.15,jugador y daría el visto bueno para la ampliación de su vín— culo.,15
313.83,301.83,190.67,73.0,43.5,N*AIL'I© LIEREG*<L©(MN ur EIEI)E$BENZ D)EHK¿©LIJF¡/IDI ¡X,16
291.62,902.38,79.88,44.38,50.38,"V hay,4una¡sola'(/&yer;, es I“ ¡mayo es o E",16
203.15,1221.23,182.62,39.54,48.69,"Madretean0rtuga| sy/(Cr|stlanoil?onaIdo)n0(esca— gen|tora',ll30l gCR7'[0bsequ¡o Benz(queífue(decora g|gante¡y,(colo— (cadotentelestacionamiento; ea e e ea (euros,[||ev&a1latsenora MgUue)",16
630.27,1232.45,205.82,36.64,57.73,"lhace(dosimesesífueropera— 'da]por¡untmfartozcerébral,, fatembcibnarseyydeditar— lleuntmiens! Je.tantofa(el .comora¡sus(otrosqretono,s ”Erac 'alm|síhuos]porllos¡reg' los .que1hoy,4helrec¡bldo 5]",16
1030.73,1094.14,159.14,37.73,50.59,"'&un|mensa¡e1tantolatella (comota¡su|pare¡a(Ge0rglna¡ lRodrlgue21pordla(celebra— (c¡0n misqdes: 0 ee ee E s eo ee o todosfsus,]u (dores; ;ya(que[este'm¡ercoles (61de1may(mreanudaranllos* ¡traswec¡b¡rdlal [gob|emolde ItaliaSegún mediosfitalia: nos,,(Cnstlanoupodr|aMajar",16
1386.5,1128.61,172.78,64.33,59.44,"FeSth'£9 f|char*aíhagutam) b?ey,mar? RONALD sr f xfutb0l¡staxylhoy¿l…de) Xo landa fuel mternado» emergenc¡a1poñun¡ [pr0 lematentellcorazón 1BUNDESLIGAX lrecord0)ayeñlun¡golaz—o (de*chalaeatdeí(]laud¡d IPmarr01entsu(etapa(en",16
1961.61,591.87,246.57,42.83,52.39,"C NM|lan 3 ¡|ejasihendas' ¿anos(dellhustonm(gelpe1que/lened|ne/Z/|da el let dib la Marco» Mhteraz:z¡'enllaíf¡nal[dellMundfal'de[Alemañ¡'a200&[e|(exdefen— razón poría: (que'rec¡bl'!latagres¡0n!delífrances*,(queifuerexpuIsado ”Nosfhabía lhecho)un¡golsy,(eas¡ hacelotro*[Gatussoxy¡elít' o (que1l0-marcara' Huboxcontactosyy sen05y¡ (e||melduo ”núilcamisetattellatdaré despues*&Y4y0lle¡respondl(que: |prefenataxsulhermana' |nosíbamosfa|ivestuano¿,(cont*&el[ex(lnter(deiM¡lan'",16
2201.29,1049.33,129.42,33.75,53.12,( NBuenos…res*—/Amor 7 incondicional. El (deitresttítulosiconiBocalJuniors: entre;1968y 1972 se deshizo e [ ¡Cadena Xeneixe'. e e morir feliz. Te: dajpresti— As ee .Negro (qu¡enítamblentse¡ref¡r|oñ(€arlos,16
2062.83,1254.17,116.67,63.33,61.17,l Zambrano: ”Esunjugador para P5%%'A ”|,16
2237.89,1332.0,101.0,32.78,60.89,": sal|0(campeon' *— papa, quetdaibendiciones; isoy; isulhincha”, aseguró. ©",16
100.4,555.4,183.2,69.4,53.8,£G¿2ñ“sy qm©m©©© %Zíí%©ñ] om [ñ%;3[:,17
180.67,2519.0,266.83,42.67,52.17,Ít$o$erenazgoyllalPohc¡a I|Iegaron*a[su(dom¡c¡lm ¡porquerestabanihaciendo: i mucha l bulla eni¡pleno: i to quer der queda,17
1108.72,909.72,104.56,44.44,52.39,"(A I Rea F¡gúnre— K (4 E Monen¿2)[a ""Ta kgú*e¿ses¡enhe l£sdl,y_adb'rd el ide: qúe¿nose; _lgjplaxa©no msasmvpagand_¿s_hoz¡i¡as“&hib'",17
1622.17,1239.83,119.67,49.17,49.83,Antesemní$¡ffgangaddy áhora'sb'n e i a ;,17
1449.06,1318.0,87.88,37.25,48.19,"y mójla! t H'í%' ii a fme»an1]os$xlletes!a'la (gzín¡e?£%n , íbolas¿y ue d Y U ) na",17
1054.17,1426.83,109.83,46.92,51.08,"t¿lvletega&e(asú”erda dees— toñmepú'eden“d J,a_r:¡5úlca %T G'ongrí tso& e ea eso Iy 1",17
1203.14,1554.79,124.0,48.93,47.07,"Salvo rafa l ¿Z;%?E%e …¿mer%zc02]apres¡, n E ; ífádel£$ere_faaoñeibosfá¡ 2 ie eo %lawhosfáas resq,_dondjhay",17
1101.57,1696.43,76.29,38.71,53.0,"T P 7 ) ¡gerden ue…eláinero%&athbua:,",17
975.0,1779.0,135.5,43.83,50.0,:e¡skome¿loduolúna…enew'q¡fec no EE _/_?ÍJ_Lof1¡l&¡ Y,17
957.29,1938.5,153.29,45.36,60.29,m' ) conservera re :eseú”ehéa[¡ínpoblador(&éí m%gf) <l nd0qúe(estaba*'anep 'Fd0 fq: —velagestaba ] yene¡— mafsecen!lag¡ódecomnavu%Á,17
917.5,2204.0,150.25,45.0,49.25,a €aplinse$50¡días—:de(cuarentenay 'ellgobier=,17
996.58,2441.33,202.83,34.08,53.08,"no jp ideta lostciudadanos, KatialPalmaihabría: tsegundadwÍfuel¡nterven¡da1la tenisudomigilio:de: (Miraflores, trasllardenunciatrdeialgu— no swec i no si por lalbulla:que había (enisutdepartamento: ¡personal",17
1682.0,1679.0,112.5,41.25,60.0,'Y3Pa!*as ymoda¡ Á's*¡'stema( im,17
1486.06,2434.28,199.94,30.72,53.89,"(deliserenazgodeltdis— itrito'acudieron'alrededor Ibarrealizandojuna reun|on,y.!al ¡parecer, noíseweríanirespetando llasimedidastderaislamiento. ¡Aunque Katia'ha preferidotelisilen= nataclarariloisucedido,ise'sabe: (que latactrizyyisusiamigosise. mostraron tranquilo si ant ella lintervencióntdella Polica. ©",17
1988.5,841.75,257.75,37.25,46.0,"…ch¡charron[de.calamar &1temamos¡todo)reservado¡para]pasar) llatenfSevilla, perotel)",17
2110.0,995.0,125.83,37.0,43.33,"e p l ue e (ch|preparaste'.ch|- (charronclto*en'el'de. opuna? W(eltalmuerzo,fuexeeb¡che) o e a",17
2046.55,1248.64,187.64,38.82,59.55,"lejgúusta.. lLo'|mportante estestarijuntosiycon' alud.... Fel|2mente(ml(esposmm¡ffam¡l¡a,l fsegundad!lastenfemeras(que]as&enta |m|[papa,I todo si ha ni salido negate (en las",17
2177.15,2071.33,207.26,36.93,54.44,"C>NLa1ballarlnalEmlly“largas,. Áqu¡en¡hacelalgunos1meses. ffuew¡nculadaisent¡mental|mentelcen,lefferson1Farfan (aseguro_quemo¡es un l logro (queuna mujeriseafoficiali— 1|uego]quellaí.Foqu¡ta ” treveló'públicamenterque |pasallatcuarentena(con1la¡ isalseraahaira'Rlasencia: el e o a |melalegro,,pero (dewerdadtesometienelsin (euidado¡porquejparalmií notes.untiogrolquetofi— (cialicentatalguien, o es e n|nguna1mu1er. 'eso(debena¡s¡gnlflcar",17
2185.0,2501.08,70.17,35.33,56.0,e — ¡zonasiqueisean felices — isu manera l el I|ntegrant€(de ¡Alma' ©,17
668.51,493.39,58.05,28.05,78.88,"© El productor Ney Guerrero contó que pasó su prueba de hisopado y salió negativa. ”Pasar la prueba no es lo más l difícil, lo que te frikea' es la — pruebame ;./K — espera del resultado, el mío — coronaviruS, %"" / salió negativo”, contó. pero aún no AN AZ Yapuedesestarcercadetu a sy — F la a ([-; J':(le e e ) puerta de su casa, ella adentro y yo sentado en el patio manteniendo mi distancia. (C. Ch)",18
1139.83,158.67,60.5,23.33,85.17,LUNES 4 DE M DEL 2020,18
1663.73,554.41,65.15,25.14,86.28,"€$ Edith Tapia y Junior Silva conducirán, por streaming, el programa ”Sin megas' que será una guía para que los jóvenes optimise sus pla— nes de datos. ””Sin argollas' lanzó nuevos programas como Te reto en casa', ahora sale 'Sin megas' y 'Bueno, boni— to y barato' que lo conducirán Leslie Stewart, Mónica Torres y Rosana Hernández Maldonado. Ellas darán pautas a las amas de casa para sus compras”, dijo Gino Tassara. (C.Ch] 0",18
656.5,847.5,129.5,66.0,61.75,(* O madurado M,18
330.0,2561.92,84.92,36.08,83.42,eo que está preparando todo el protocolo para poder abrir su peluquería,18
822.11,1851.85,134.75,35.85,65.64,"ras los rumores de que estaríanaciendo un ro— manceentrealalcal— victoriano George Forsyth y empresaria de Gamarra, Alejandra Baigo— rria, araízdesucercaníaen lacoyunturadelapandemia, Laura Borlinicree quees posi— abilidad se puedecristalizarpor— que abstienen cosasencomún. Laura, ¿quépiensas delosrumo— re s de romance entre George t ir Aejandra? p ea s e d a Creo quedando Alejandracomo _ Georgesonsolteros se gritarlo los cuatro vientos si — sy 24",18
1126.59,2415.38,62.73,24.13,90.95,"© El estilista Koku Belaunde contó que se viene preparando para reabrir su local cuando el gobierno lo autorice y que solo atenderá a unas personas en la mañana y otras en la tarde. ”Ya estoy preparado con todo el protoco— lo de bioseguridad para poder atender otra vez. Estoy invirtiendo porque quiero dar seguridad a todas mis clientas, para que tengan la confianza de que no se van a con— caminar ni lo harán con sus familias, porque",18
