left,top,width,height,conf,text,page
950.09,154.09,121.45,55.64,81.91,2 — DÍA) JUEVES 1 DE MARZO DEL 2018 —— —,2
1234.04,460.8,84.96,35.16,82.36,H[|J]© JUNTO AL NO SABE:NO OPINA ABRIRÁN EL | fotógrafo Gary llegó al restaurante por un rico SABE PERO NO OPINA Y EL ows¡gg£me? p,2
1589.0,522.6,71.2,33.2,91.6,OPINA PERO NO SABE !!!,2
513.52,591.33,72.27,28.67,89.73,"estofado de pollo con arroz blanco y papita amarilla. ”María, se acaban las vacaciones de los chicos. En unos días, cerca de 8 millones de niños volverán al colegio. Los padres de familia,",2
2384.6,588.2,115.2,26.0,76.6,"©tuesta FERNANDO , TUESTA —",2
1020.55,952.21,80.32,31.66,85.77,"entusiasmados, esperan que sus hijos saquen m3;g&%m;… buenas notas, no que tengan rojos en la libreta Ya pues, ya está como PAK que dice que y, si es posible, que sean los primeros en su cla— la empresa era de él, pero no sabía, Ya se. Pero ellos deben entender que el éxito o el pues, más respeto a los peruanos. fracaso en la escuela empieza en casa. Diversos ©Yuri_RV m estudios indican que el bajo rendimiento escolar T y universitario es causado, además de la capaci— RODRÍGUEZ v. dad intelectual del alumno, por factores como la = —— mala nutrición, obesidad, problemas en el hogar ENCUESTA y la falta de apoyo de los padres. Las investiga— clones también han permitido determinar que ¿Cree que la delincuencia sique siendo las más altas calificaclones son obtenidas dprifgalvob…ddps;?57 por estudiantes que viven en hogares donde ©© HABLA TOME | existen hábitos saludables, rutinas regulares y y y — y buena comunicación. Cuando los papás se in— |_ Destaca el rol de las mujeres :_Caos vehicular en Brea a involucran en los colegios de sus hijos, estos tienen H",2
1213.58,1335.02,62.67,29.39,86.48,"más posibilidades de destacar. Para que los ni— () En el diario Tome leo un informe que H C> Es terrible el caos vehicular en Brea y ños puedan tener éxito en la escuela, los padres destaca la participación de la mujer en la — : debido a las obras que la municipali— SI89% y las familias deben participar activamente en el | — economía del país, que —según las proyeccio— — : dad está ejecutando en forma simultánea, sin aprendizaje de los niños. Los padres, en la medi— | — nes— este año será mucho mejor que el año : haber calculado los perjuicios que iban a cau—",2
1176.09,1737.62,75.43,31.01,83.51,"da de sus posibilidades, deben acompañar a sus | — pasado. Se viene el Día Internacional de la : sar en el transporte público. En los jirones hijos en su aprendizaje, estar allí para ayudarlos | — Mujer y sería bueno que se aproveche la oca— : Arela y Jorge Chávez, por ejemplo, todas las EL IDOLO cuando lo requieran y hacer de esta relación un | — sin para impulsar medidas a favor de este : mañanas se forman 'cuellos de botella' donde acto satisfactorio, no una imposición. otrora marginado sector de la población. : los carros se demoran más de media hora. ©Promueva hábitos saludables: Elija una hora América Valderrama : de dormir, estimule el ejercicio físico y limite la : Vecino de Brea — *COMPRA $ — >VENTA & cantidad de tiempo para ver televisin, videojue— | — | —— —— mm gos, escuchar música y usar la computadora. El lector se refiere a un estudio de la consut— —| ©—)> Sonreiteradas las quejas de los vecinos de = EMERGENCIAS ©Siga una rutina: Debe haber un horario para tora Kantar donde, efectivamente, se destaca : Brea. Por ejemplo, el jirón Castrovirreyna Bomberos cada actividad. De esta manera, lo ayudará a | — que el incremento de mujeres en la Población : está lleno de huecos, es un desastre para los pea— — Emergencias 105 organizar sus días y no tener problemas con el | — Económicamente Activa (PEA) influye en las pers— — tones y choferes. Los vecinos están decepcionados — Defensa Civil 115 (T activas de crecimiento de la economía del país. : del alcalde de dicho distrito, Ángel Wu. 2553_'Ud 4118000 ©Dele un espacio para los estudios en casa: H e> :EI am%¡ente es |r_1gfortantea%e%e haber suficiente F as E | 6175000 un y, de ser posible, comodidad. C£ gg 7 e 3178000 ©Animelo a leer siempre: Dicen que la palabra ( . PALABRAS DEL ALMA Indec%pi 2247800 escrita es una puerta a toda clase de aprendizaje. P a 22 Enel Perú La lectura hace más sensibles y conscientes a los Sí (volvería a defender a Kuezynski), sí porque lo que —— niños y jóvenes, además de ayudarlos a aprender se tiene que defender es la institución presidencial. MALO TOME muchas cosas. Durante este tiempo, (PPK) gobierna”. ev",2
1233.63,2300.12,80.19,31.92,72.1,"©Comuniquese con su hijo: ¿Sabe qué siente ALBERTO BORDA (ABOGADO]) s|u hijo sobre su clase, maestros y compañeros de 3T“ y 6399 clase? Una pregunta sobre este tema puede ser te . . | —. a ea i i 'a;s::zo¿2¿a2&2¿o5¿1?%2&&3…o p emitirá saber qué tan contento está en su colegio”. |_ [ ] Carlos Temerosa . . — en a Tiene razón mi amigo Gary. Me voy, cuídense. Espinosa — — tre meat rome s com _ | 1000SH9S derechos eservados. — son de exclusiva responsabilidad de Olnay — Teléfono: 311—6500 Publicidad: 708—92999 — | Prohibida su reproducción total o parcial. — sus autores,",2
292.0,2517.2,57.6,23.2,77.2,A SARITA COLONIA m¡ Lealtad,2
1192.7,2675.6,319.0,67.3,60.2,QU$IA %©31. crust a í.4./f—'…s .<… LASESTABITICAS CD©TAS S?MA© C©NTADAS,2
1619.29,152.43,79.0,27.14,87.0,JUEVES 1 DE MARZO DEL 2018 __3,3
637.6,1028.9,70.3,27.9,74.1,Shampoo o acondicionador o _ — tratamiento Sagital © E,3
1876.62,1027.5,81.12,26.75,81.0,Shampoo o acondicionador —— Triseme o Clear :,3
1229.0,1052.0,36.0,22.0,90.5,Kenzi x 375 mi,3
1337.67,1577.48,75.38,39.02,68.43,"& | | Do ¡w13.:3 Asilo 3-QÚ i Asúm13 g © '& As&n13-9 a , | S/ | y S/ A : Sham¿m_o o , Tratamiento y Shampoo o a Qm W acondicionador acondicionador — L capilar NutriBela acondicionador p = Dove x 400 mi Inexpert M i a —Q — x 350 mi l Y.m Elvie x 400 mi",3
1594.92,2205.38,64.15,29.31,79.85,Tinte Excellence Shampoo Cuidado | En el segundo I producto Nivel —— L,3
1177.14,2243.43,50.29,30.57,48.86,) e a * H&Sx700 m 100 S y K : €%€ a y,3
2380.71,2202.86,32.29,38.71,60.57,y/ E o | | | Marcelline,3
639.46,305.38,67.31,37.38,62.92,ea i pistoleros de la ban— At|rapan n ”Los casilleros del — ¿3Á,4
663.12,428.5,69.88,29.25,89.0,"Agucho' fueron atrapados por la policía, que les",4
535.27,546.64,60.09,26.82,83.0,incautó dos armas | G') Camuflados entre otros _ de fuego que usa— jóvenes que se encon— — ban para perpetrar 28,4
364.83,611.5,59.0,24.67,82.67,"traban en un parque, dos ii",4
498.5,2366.0,161.75,32.25,76.0,MODELOS DELINCUENTES MURIÓ BALEADO,4
609.05,2519.35,85.65,33.45,77.4,"EL CALLAO clientes por usurpación de terrenos, fue asesinada de T0mumn cinco balazos después de V g e ni l",4
256.2,2806.0,47.2,31.2,81.8,€9 En un claro acto,4
274.57,2865.43,68.0,26.57,90.86,"de venganza, una mujer, que tenía ante—",4
776.0,2786.14,55.57,26.57,82.62,"fueron dos los pisto— leros que llevaron a Flor de María Papaya Román ” x de Solari (47), 4 'Negra”, hasta",4
1094.25,321.33,63.92,29.83,74.92,"ea Agustino. 3737 La captura de Enri— & que Persona Apaga (35),",4
1237.17,151.0,83.5,26.0,90.0,JUEVES 1 DE MARZO DEL 2018,4
1198.22,498.22,64.26,30.17,72.87,"E ( ) Ambrosio Rodríguez EE e e y se produjo en el par— que Constitución, de la cooperativa Huancayo. e )] o",4
930.0,713.0,100.83,31.83,70.83,|_ 1 SAN JUAN DE LURIGANCHO,4
1194.43,1608.36,104.14,39.93,81.0,ingresaron a distribuidora de celulares para llevarse 100 mil soles en equipos TX S,4
1571.5,520.64,77.57,31.07,79.29,"©Agentes ( a ción Criminal atraparon al moto taxi sta Genes Cel— so Chavez Hermosillo [24),",4
1943.31,420.72,60.62,27.69,85.38,"acusado de ultra— jar a una mujer con alteraciones menta— les, en San juan de Lurigancho. El sujeto fue detenido en la cuadra 20 de la — avenida Proceres de la Independencia.",4
1877.65,1501.01,121.51,31.86,80.5,"cincuenta muerto otros tres detenidos, travel frustrado asalto a una distribu idor a decelula— re s de donde se pretendi an llevar 100 mil solesenequipos, en Sangran de Lurigancho. Alas 7 de la noche, losdecincuentas, disfrazados con uniforme s de una empresadetelefonía, ingresaron local ubic ado en avenida Próceresde la Independen— cia, cerca del paradero Bayar del treneléctrico. ron y después sacaron sus armas pa— ra sorprender al vigilante del local, ascoma los trabajadores, a quie— n es amenazaron y metieron a un ba— ño. Luego, en costalilloscomenza— ron a llenar todos los celulares de úl— tima generación”, dijo un testigo. UNO LOGRÓESCAPAR Fuesen ese momento que unos veci— nos se percatar on del asalto y alerta— rona los policías de una patrulla. ”Los agentes se fueron acercando al local yunodelosladro— neslesdisparó. Lue— go,losotros hicieron lo mismo y desató unabalacera”,contó un vecino. Uno delos pistoleros fue herido mortalmente la cabe— za, mientras nuestros tres fueron atrapados. Un quinto asaltante hu— yó. (Jesús Palomino) [+]",4
1898.0,742.12,116.25,30.75,66.5,n fe roz enfrent amiento aba— lazos con la policíadejóun de,4
1499.75,2310.0,181.75,45.75,90.75,estaban disfrazados de trabajadores,4
1122.7,2662.23,72.38,27.21,87.89,"la calle 1 de la urbaniza— ción 'Aeropuerto', donde la golpearon y después la acribillaron. Cerca del cuerpo hallaron su bolso con 700 soles y varias tarjetas de crédito. ”En su Facebook reconocía que estaba en una relación sentimental muy compli— cada”, refirió un detective. (E.Cirilo) +",4
1878.89,2709.67,64.8,27.57,88.7,"€9 Frente a un parque y delan— te de varios niños, el feroz hampón conocido como 'Garrapa— ta quien tiene diez denuncias en la comisaría de Santoro por ata— car a sus vecinos, hirió a balazos al comerciante Guillermo Matas Chavez Rodríguez (40), en El Agustino.",4
2385.33,226.17,58.5,36.0,84.0,"4“o¿y…—"" ”A este individuo lo bus—",4
1989.6,238.8,64.6,26.6,89.6,quien era buscado por estar,4
2424.24,361.52,49.29,25.48,83.05,"... dábamos por una denuncia de vio— nación de una =3) / muchacha de 20 & años, a la que atacó",4
2417.0,515.8,63.5,30.1,78.6,"ss a su vehículo”, dijo un detective. (M. Rocha— brum)",4
2354.5,1188.0,83.75,35.75,73.0,e de que un,4
2405.25,1479.88,53.25,24.62,68.0,E accidente se pro y dijo cruce dellas,4
2358.6,2116.8,84.6,31.6,50.0,Richard Ruizttio] (de la menor,4
2442.33,2189.5,90.67,39.5,73.0,Quise Higuera [33%conductor del busty el,4
2411.5,2291.0,55.5,29.0,53.25,Vilela (42] fueron G],4
2060.5,2516.0,137.75,41.0,90.5,| bala a comerciante,4
2376.52,2725.63,65.96,27.12,89.56,"El agraviado, quien fue trasladado por su hermana al hospital Hipóxico Unanue, contó que le llamó la aten— ción al delincuente porque sacaba su arma delante de los niños y este le disparó a quemarropa en ambas piernas. El atacante fugó, pero antes amenazó de muerte a todos los testigos. (M. Rochabrum)",4
1500.14,151.71,79.29,29.0,83.57,JUEVES 1 DE MARZO DEL 2018 —,5
1398.0,378.5,294.33,157.0,86.5,ESTE LUNES A LAS 9 AM,5
1298.8,600.8,369.6,84.8,84.6,Fagaly cambiará tus mañanas con:,5
326.58,1625.56,59.15,25.4,78.4,"G» El C_rucitrome _tiene los mejores premios para el hogar, y el martes 27 de marzo sor— e el o a su k<M'—— en 5 A — Solo tienes que resol— g 0 (e res, ponerles tus datos personales y depositarlos en los luga— res autorizados. o",6
1141.75,150.62,66.5,24.38,81.25,"I, l“ JUEVES 1 DE MARZO DEL 2018",6
637.0,937.0,266.0,31.75,74.25,"apromociónfavo— rita de los peruano s esla 'Súperllamada zanadora'deTro— me,puestodoslosdíasre— galadinerocalientito. Delunesaviernessalen",6
1086.77,949.54,170.08,35.77,67.92,"trespremiosde500soles cadauno, y los domingos un 5milsoles. Participaron los sorteo s muy sencillo, pues solo tienesqueinscribirtella—",6
735.33,1411.57,63.81,28.67,79.71,¡Más ganadores! 'El Billetrome' trae 134 mil soles en premios en ee ] p entre 500 lectores. Ayer ganaron 100 soles:,6
688.5,1680.39,87.06,30.39,75.5,"10625138), Esther Durand (07365373), Luis de la Cruz (43265014) ee e r44495489]. que Elogio Meza (DN!: 25498662) _",6
385.4,2147.8,66.6,23.2,91.6,(Asociación de ayuda para la,6
566.43,2666.71,73.29,20.86,85.57,"pegamento tisseel, sin puntos y sin dolor]",6
495.68,2769.89,71.68,28.84,78.79,costo AV. SAN BORDA SUR 536 — SAN BORDA (Altura cuadra 30 de Av. Aviación) —— © —417 5240,6
493.54,2255.31,86.69,28.0,83.31,1197 Centro de Catarata y Laser FUTURO VISION (Perú) American Eye Center (USA),6
714.25,2146.75,75.75,23.5,80.5,prevención de la ceguera],6
1129.43,1457.94,63.11,27.26,89.8,"cobró 200 soles. Todavía quedan cientos de premios y uno puede ir directo a tus bolsillos. No te duermas, sigue pegando las bolillas en tu cartilla. Si llenas una colum— na, ganas el monto que",6
1224.5,1737.05,53.75,26.7,92.2,"Recuerda que para reclamar tu dine— ro debes llamar al 311—6399, de 9 de la mañana a 6 de la",6
1240.6,2319.38,62.15,26.79,88.17,"La revista +Mujer ya está en los quios— cos, en una edición de colección que en la portada trae a la guapa Tula Rodríguez, quien se considera una mujer 'bien cham— ba', Tenemos los tips para ellas, entrevistas y consejos para la crianza de los hijos. Conoce cómo hacer que tus hijos aprove—",6
1089.82,2662.91,55.76,26.91,88.26,"chen su tiempo libre y qué p deben faltar en tu tocador. e de las perua— nas más destacadas, el Horóscopo del Amor, Consul— torio Intimo y mucho más, a solo un sol. G",6
2220.2,526.8,137.0,40.2,82.0,Inscríbeme al 710—0260 o mediante,6
2019.48,862.29,129.45,34.06,67.88,"nuestra web trome.pe 6delamañana — ciadelsorteo. —. — a6delatarde, _ MÁSSUERTUDOS puedesregis— Y ayer, miércoles, gana— P % — trartu'númerodela — ron 500solescadauno mandoal710— — —— ,Fñ suerte' ytusdatosper— — lossiguienteslecto— 02600me— ” l res:Tito Reza (3937831, diantenues— *— * — nochesalenlosnom— — deAte),RichardUsca— trapáginaweb bresdelosganadores, mayta(3984213,deSan y '¡— siempre ante un not ario — Borja)y NicolasaRojas |1 %! públicoquecertificala — (3672271,deSanMartín Todoslosdías,de * legalidadytransparen— — de Porres). [+]",6
1953.6,1686.07,56.22,27.62,81.07,"57 200 Hasta el lunes 5 de marzo 7/ — |saldrán las bolillas para que ""K fí.r'4 _5 ' llas pegues en tu cartilla y tengas la posibilidad de lle— lr s E es LOS IREMOS ©1 premio de 10 mil soles ©7 premios de 5 mil soles ©12 premios de mil soles ©50 premios de 500 soles ©90 premios de 200 soles ©340 premios de 100 soles",6
1883.67,2100.33,103.67,60.67,32.83,n e ea s a es,6
1809.39,2523.26,68.13,27.41,86.79,"GD El ministro de Vivienda, Carlos Bruce, presentó una oferta de 5,585 nuevas unidades de 'MiVivienda Verde' (de sistemas aterradores de agua y luz), con una tasa de interés de 6.99% anual, la más baja del Para una vivienda de 150 mil soles, la cuota mensual sería de unos mil soles mensuales, De otro lado, la a das en Lima aumentó impulsada por programas sociales como Techo Propio y MiVivienda, informó la Asociación de Desarrolladores Inmobiliarios del Perú (ADI Perú). [L.M.) [+]",6
2391.14,1421.29,131.14,36.0,49.43,FZ€RW“*&»5 &' f5fvo'*?':5%?¿—¿$&-&¿ $_*:3:…¿$*&' 1 e /,6
2421.0,1674.8,106.2,34.4,67.2,es Una planta que contiene,6
2322.0,2012.0,209.0,40.0,53.25,cia stalest os inu trientes gm&:m vínierrotquel combaten,6
2391.6,2521.8,58.4,27.4,63.2,deja la migrana! la circum,6
2445.17,2611.75,48.25,31.08,72.0,nación della sangro y A protege el corazón © O q es,6
1108.4,331.4,206.2,31.4,88.0,"aspopularesfra— se s del recordado Daniel Peredo,que nosacompaña—",7
1091.09,871.57,151.0,31.28,70.83,"MundialRusia2018ja— másseolvidarán.Los comerciantes del MercadoCentral sonsacado polos y / gol más va a haber'y 'Qué delanterotenemoscon— tigo, Peredohaquedadoenel corazón delos hinchas y sus palabras fueron im— presasenmásdetres mil gorros y polos,conlosco— loresdelabanderana— cional.Suspreciosson de y 15soles, respectiva— Para Arturo Buques,de comercial 'Cotillónjesta producciónesunhome— natal fallecido periodis— ta,quiennosregalótan—",7
1570.07,849.14,75.21,41.14,74.79,"<Tienen & ”¡La tocól”, S va a haber' y de pata, anda al área'",7
1487.0,1174.12,216.5,31.62,71.38,"golyempecéasaltarde emoción”, precisóelco— mercianteaTrome, Antelacercaniadel Mun— dial, Buquestieneprevis—",7
2027.75,539.25,9.25,17.5,45.75,"ra, o | y",7
1923.11,949.89,162.7,29.89,67.67,"toaumentarlaconfec— cióndemáscarasconlos rostros Paolo Gue— rrero, Cuevita,'Foqui— ta' Farfányotrosju— —, gadores,asícomo 3 copas y manoplas con el rostro dePedroGa— ”Nofaltanada parcel Mundial, así quenosestamosrein— venta ndo para que la clientela disfrut e de esta fiesta,asícomole",7
2337.0,355.83,174.83,44.0,82.67,<Comerciantes preparan más máscaras de jugadores,7
2373.44,867.34,130.15,32.0,64.73,"hubiera gusta do a Pere— do”, indican su localubi— caden la quinta cuadra deljirón Andahuaylas,e PARALASCHICAS = Durantes parti— o| dosdenuestraselec— ee e E a S | restambiénpo— ” dránalentar X'inperder N elglamour, puessalie— roncoquetasvin— chasconloscolo— re s de la bicolor y frasescomo'Arri— 3 ba Perúl(Tábatha y Paredes) G",7
1530.0,1320.8,190.2,44.0,75.6,tosmomentosdealegría _ PALABRAS DE DANIEL....,7
1634.49,1440.34,71.12,30.12,76.29,"consunarración. MÁSMÁSCARAS ; O”Jugaba fútbol al Perú en ”Quién no vibrion las — i como cualquierchico, — mí, Paradoja — las alturas”, frases Peredo... Re— ; pero más me apasio— — es el mejorjugador bien patea— del mundo”. (r e y",7
1376.78,1501.33,65.11,28.33,89.11,cuerdo la vezquegritó : nada volver a casa y,7
2476.06,1444.44,49.06,26.62,83.0,"sé si es justo, solo sé que es cierto”., A”Un consejo de pata, anda al área”.",7
1536.15,2273.85,153.15,45.25,64.8,CARRERA PROFESIONAL DE CIENCIAS ECONÓMICAS CARRERASIPROFESIONALIES 50% PRESENCIAL 50% DISTANCIA [Ciencias) 2 ay y — |Tn t%arnaaes trabajo [ db$ñmmsy©%¡m&“oo,7
2291.6,2719.4,162.6,51.0,46.8,OEICINAJDEJADMISIÓN 290 e Il 6'7_168170,7
761.69,2810.12,65.81,17.69,76.0,"Todo el Sistema de Educación a Distancia Se basará segg'g!a_Ngg:a_Lgy_o_nive(;ig|¿éa¿l"" uso d_5|a&ataforma Virtual ey inscripción de",7
785.16,2830.44,58.24,15.48,58.64,rr men — 5—*1 m ei : : < postulante no es devolución de de la Universidad está modificación Sin prev¡oav¡?53T63a [3información proporcionada sujetaba hombros,7
1561.64,612.06,124.45,29.88,77.27,"as declaraciones de Jorge Barata, en Brasil, cayeron co— mo una bomba en el Perú. Elexrepresentante deOdebrechtnosolocon— firmó entrega de dine— roparalascampañaspre— residenciales de Alejandro Toledo, Llanta Huma— la, Alan García, Keiko Fu— jimori, Pedro Pablo Ku—",8
1242.88,2025.29,69.82,27.47,91.06,¿Porqué la defensa de Keiko Fujimo— declare en portugués? Esa traducción va a demorar. No será que,8
290.75,2197.0,91.25,24.75,76.0,SE LAVAN LAS MANOS,8
1540.0,2208.25,84.25,29.25,86.0,el ministro Augusto Bedo—,8
1209.45,2303.78,61.0,31.02,73.16,F Anunció que este ya Comere y el expresidente T©dl©$ dncem] e a i a a de la Confie Ricardo Bri— que Mo ee d tuerte ”* — | z responderá ante la _ ceño hayan recibido dinero Comisión Lava Jato del — de Obrecht a favor de su,8
1340.95,2424.65,68.35,30.3,87.75,"Congreso sobre este partido, a pesar de que su ITD6](CHB) tema. abogada lo confirmó des— En conferencia de de Brasil.",8
1056.72,2585.05,65.06,29.16,84.02,"El presidente Pedro g gt El expresidente Alan García Pablo Kluczynski salió ri también aseguró no hizo lo propio. ”Ni mi cam— a defenderse y negó cual— tener nada que ver, ”No —— para ni el Partido Aprieta quier aporte de Obrecht he recibido dinero de recibieron en el 2006 dona— a su campara electoral. Obrecht. Ni ha entrado _ ción alguna de Obrecht.",8
1123.5,2709.1,50.0,27.6,84.2,. | a este partido (Fuer— za Popular] dinero de,8
1563.57,2703.86,97.86,28.57,90.71,Las cuentas fueron debida y oportunamente presentadas,8
284.8,2715.1,62.0,28.2,89.7,"”Yo, Pedro Pablo Kuczyns— ki, no he recibido jamás una",8
967.44,2805.93,70.02,29.24,87.07,"donación del señor Barata. esta empresa brasilera”, _ a la ONPE. Otros se venden, Yo no he recibido ninguna para mis campañas aseveró. yo no”, publicó en su cuenta financiación de dicha fuente _ presidenciales”, escribió en Negó que Jaime Yoshiyama, de Twitter. (M. Beteta)",8
1711.36,280.64,124.0,43.64,84.45,¿<Dio detalles de montos y asegura que tiene documentos para probarlo,8
1679.93,2074.57,58.29,30.0,82.07,"; — reglas y con los mismos estándares y, : — además, con independencia”.",8
2002.2,453.15,88.7,29.9,86.95,"El día previo, ante el fis— calGermán Juárez, Bara— ta también involucró al expresidenteOllanta Hu— mala, a quien —según su",8
2092.72,723.22,103.83,33.39,81.61,"Ayer, el ejecutivo de Odebrechtrespondióto— : £ daslaspreguntasenpor— :* tugués, a pedido de los : : (ALAN GARCÍA)",8
2322.67,442.72,79.78,29.39,81.33,; FUERZA POPULAR FUJIMORI) ; Jaime Yoshiyama : Augusto Bedoyo Comere ; US$ 1000.000 ; Ricardo Bracero Villana,8
2112.4,566.0,106.8,32.6,73.0,versión— entregó US$3 US$ 200000,8
1791.57,1401.97,95.84,34.14,71.65,"ez y n ski y SusanaVillarán, _ anteal fiscalJoséDomin— —| Luis Alva Castro sinoquetambiéndiodeta— — goPérez. llesynuevosnombres. Ladiligencia,realizadaen : En un interrogatorio de — el MinisterioPúblicoFede— —| PERÚPOSIBLE casiseishoras,enSaoPau— — ral fue presencia da por los | [ALEJANDRO lo, afirme que la empre— — fiscalesOrlando Martello : TOLEDO) sa brasilera financió las — (Brasil)y Rafael Vela(Pe— ! Avisan On campalas de Alan Gar— — rú).Loscuatroabogados : yS$ 700.000 cía(2006)con 200mildó— — de Fujimoritambién hi— : lares, Alejandro Toledo — cieronpreguntas. ee dinero las de Totedo,| — — INVESTIGACIÓN para … »| — KeikoFujimori(2011)con _ : PABLO Humala, Keito, Alan y _ millón 200 mil dólares, — losKauffman,sostuvoque | KUCZYNSKI!) Pedro Pablo Kluczynski _ su patrocinado tiene la : Susana de la (2011)con300mildólares, — documentaciónquesus— : Puente y hasta de la alcaldesa — tentasusafirmaciones'y : US$300.000 de Lima, Susana Villarán, _ estádispuestoaentregar : PARTIDO — laspruebassilafiscalía. —! NACIONALISTA larevocatoriaenel2013. — Porsuparte, ladefensale— : (OLLANTA HUMALA) balde Keiko Fuji— : Ugh 3'ooo£%o y : mori,GiulianaLo— : Nadine Heredia » F APORTES: —— : za,negóque jorge : Valdemar Carreta ___ US$ millones i Baratasehayare— : a & F : l / : Keiko Fujimori (2011): US$ millón 200 mil : feridoasupatroci— | ¡ Alejandro Toledo (2011): __ US$ 700 mil : nada,peroconfir ! ) ; Pedro Pablo Kluczynski (2011); US$ 300 mil i me la versión so— | . ía (2006): ¡ bre la entrega de : FUERZASOCIAL _ p p i dinero a Fuerza : (SUSANA VILLARÁN) .… i 7 el GILBERT VIOLETA: : — CARLOS RIVERA: : MERCEDES ARÁOZ:",8
2070.04,2028.62,59.48,31.79,85.46,"H _Ah:olr¿íl1e toca a la justicia investigar, juz— : Vuelvo a decir, en mi breve campaña : — gar y sancionar a todos con las mismas : como candidata presidencial, invitada : del Apra en 2011, no recibí ningún aporte : ni de Obrecht ni del Sr. Barata”.",8
1991.0,2822.47,68.0,29.76,87.0,"©) Culminado la diligen— cia, el fiscal Rafael Vela, quien acompañó a José Domingo Prez y Germen",8
2433.54,2595.87,60.4,25.82,80.22,"Juarez en Sao Paulo, expresó d que el interro— i d Agregó que , 1 eg ( e E ee d 3 hacer pregun— tas y repreguntas, las que permitirán que los fiscales continúen con su investigación, ”Nos retira— mos con la satisfacción de que la diligencia se ha lle— vado a cabo en absoluta normalidad y, por supuesto, los fiscales continuarán con las investigaciones”, dijo. _ 0",8
554.41,1290.38,164.38,30.34,70.03,"Inombredelaexal— caldesadeLima, Su— sana Villarán,tam— bién salta la pales— tra durante declaración degorge Barata, quiencon— firmóque Odebrechtapo— yólacampañadel 'No'ala revocatoria. Diopormeno— resdeestefinanciamien— toy, además,revelóqueen— tre garon dinero otros % , personajescuyarelación [S",9
773.33,2847.83,94.5,22.17,47.83,a e E mns.o Ó»ono …oonmm.u:,9
911.2,455.0,112.2,45.2,61.8,(N TTE WE I'ELAPUENT£ CASTRO,9
1006.32,1313.68,111.26,43.32,84.68,"para apoyar el ”No' a revocatory ¿<También soltó nombres de Susana de la Puente, Alva Castro y Jaime Yoshiyama",9
1473.33,154.83,64.33,22.17,92.0,5 1 DE MARZO DEL 2018,9
1513.14,465.86,150.36,31.64,77.29,"dios millones de dólares paradichacampaña, ase— dorada porel publicista LuisFavre. MILLONES mil dó— laresparalacampañade",9
1545.5,644.0,100.0,29.75,81.0,Pedro Pablo Kluczynski fue—,9
1501.69,936.92,140.69,30.49,69.41,"ron recibidos porSusana dela Puente, actualemba— jad ora en el ReinoUnido. También indicó quelaem— presadio1millón dedóla— reses 2011 para lacampa— ñadelfujimorismo,atra— vésdelosexministrosJai— me Yoshiyama y Augusto BedoyaCámere. Además de 200 millares através Ricardo Briceño, el expre— si dented el a Confiep. Sobre dinero para apo—",9
1528.96,1334.7,112.91,29.7,77.3,"que fue recibido por Avra— haidan On, quien fueje— fedeSeguridad de Palacio. Otronombrequedio Bara— ta fuelle Luis AlvaCas— tro, quien —segúndijo— reci— mildólaresparala",9
1585.6,1500.8,79.4,29.0,74.8,campaña de Alan García. G,9
