left,top,width,height,conf,text,page
1478.8,1707.9,122.69,27.79,79.04,"palados que venden para brisa sen la calle y los chorizos, para que cuando te cogote en no haya contagio. Lasencuestaslo ponen el primer lugar para la presidencia... Después de la alcaldía encuentro trabajo, postularé. Resiento prepa.— lado para estático departidos, nadomuchosclásicos. Alejandra Baigorriadice que sonso— loamigos. Ellaesuna buenachica, nola pue— doolvidar,esbonita, trabajadora y muchos quisieran conquistarla. Por ahora somos solo amigos porqueto— davíanoempieza lacampaña. Gracias, alcalde... Denada, los invito al show Toque derisa' querealizará el imitador Miguel Moreno, estesábado27 vía Zoom.(E.C.) o",16
985.81,2477.78,54.19,23.65,89.11,"© Fario Gripa con— tú que se animó a hacer un trío musical con Amy G y Daniela Darcourt, para dejar en claro que la música no para a pesar del confina— miento, y el reinventarse es",16
1387.1,2369.73,81.22,24.31,84.53,"la carta de presentación para salir adelante. Farik, ¿cuándo nació ladea deshacer este Medley Salsa Perú'conAmy Gy Daniela? Salió del deseo de hacer música en confinamiento para reafirmar que la industria musical en el Perú no morirá. El video se ha convertido en un boom en redes sociales. ¿Esfácilhacermúsica en cuarentena?",16
1801.93,2342.35,63.07,24.52,86.06,"Creo que el ser humano tiene la capacidad de sacar lo mejor de sí en tiempos adversos. Es una oportunidad para hacer— me más fuerte en los medios y redes sociales. ¿Seguirás grabando con E a el Claro, somos talentos de exportación. La idea es lle— var la música del Perú ara C. Chévez]",16
2272.99,1017.51,64.1,24.65,84.47,"030 HOLA, MIBARRUN— o — TO. Llego embalada para contarles las últi— mas de 'Chollywood”... Cuentan que a MIGUEL ARCE le despertó el inte— és por ser nuevamente ”guerrero”, pues el último lunes estuvo en los foros de Televisa, practicando los juegos de ”Guerreros 2020”, pero se quedará con las ganas porque no superó las pruebas. Snif, snif... La modelo DUELA ECHEYARRÍA y su novio DOMINGO cumplieron dos años de rela— ción y dicen que casi no pelean. Pasen la receta... Me pasan el talán que el modelo GREG MICELL le estaría tiran— do maicito' a M cida salsera, que dentro de poco lanza— rá una canción. Hummm... JAZMÍN | d a tando por todos lados su soltería, tanto así que se unió al cha— llene 'Soy soltera' de la cantante LES—",16
2245.81,2329.21,71.03,24.31,87.08,"LIE SHAW. Manya... Mañana es el estreno virtual del cortometraje protagoni— lado por ALE FULLER, cuyos ingresos serán destinados a una planta de oxígeno en Conta— mana, Loreto. También participa el actor espa— sol PEDRO ALONSO, el recordado *Berlín' de ”La casa de papel... Bue— no, soy fuga porque mi amorcito está con antojos y voy a mimarlo toda la noche. Suuuaaaveee",16
343.57,679.49,63.18,24.09,89.52,"€© El bailarín Lucas Piro se sien— 27 te contento porque pudo ser repatriado a su país natal y se reencontró con su familia, con quien pasa la cuarentena. ”Ya estoy en Argentina, gracias a Dios me repartieron hace unos días y estoy con mi familia. Necesi— taba estar al lado de ellos”, dijo. ¿Tunoviaviajó contigo? No, ella es colombiana y también viajó a su país. Llevaremos la rela— ción a la distancia hasta volvernos a juntar. (L.G) o",17
400.38,954.75,65.38,40.88,70.0,*% Fue repatriado y está con Su familia,17
433.93,1606.98,75.07,24.89,87.26,"© Pilar Gasta retomó sus actividades laborales en Gama!”, en el emporio Gamarra, tras someter— se a la prueba de descarte de coronavirus. ”Empezamos con fuerza para recuperar el tiempo per— dido. Nos estamos 'poniendo las pilas' confeccionado ropa de invierno, y espero que el público apoye com— dando al empresario peruano”, concluyó. LGamarra)",17
407.5,1781.0,61.75,31.0,73.0,su negocio de ropa,17
568.62,2260.03,56.77,28.58,80.48,"<© Evelyn Vela había planeado cele— bar los 15 años de su hija Anne, pero debi— do a la pandemia ha tenido que cancelar todo. ”El cumpleaños de mi hija es el 5 de agosto y he cancelado todo [- hasta el próximo año por la situación que Z,r_% /(% — l Z artista ir¿temacional — n —y a el eO Cal koí—”'j Lv] lo primordial es tener t . e> ... ... .. Salud”, señaló Evelyn. o a traer un artista intgmac¡onal para celebar el cumple de su hija",17
1272.5,160.5,79.25,26.5,86.25,JUEVES 25 DE JUF”,17
1088.62,592.25,59.5,30.25,87.25,sábado es la final de su reality virtual,17
1103.36,1352.71,218.57,41.29,68.21,"a conductora de Alex __ todía, MónicaCabrejos,Vi— vióelmawrsustodesuwda alsermmñonadagonurg istolaporunosdelincuentesen©t g£:?itog£3morñuos_,adondeuego realizar un reportaje para Supro—",17
1840.26,454.0,70.23,24.84,89.67,"El cantante criollo Mar— co Romero comentó que su reality virtual 'Casa talentos' ha tenido mucho éxito entre niños y adultos, por lo que realizará una segunda edición en julio. ”Muchos niños y adultos han enviado sus videos a mis redes sociales mostrando",17
1547.0,1314.73,315.36,42.55,53.45,"rohastaelm0mmtgsolohappodl— recuperar un teléfonomóvil. 'Hanloga£lodetme&jalos ea deldelitoporquehabíaunacama— peronohanapare— cidolosoelulamsml_awnard,ac& tólaconductom,qulencopñaquese puedan recuperar lo se qmp os en los",17
1360.0,1764.45,167.56,40.55,48.6,"mna'untoasuequ¡pgdetrabajo. ml %Salimjosagmbarpaqu _pm)flmosd ip l conelcamarógrafo.mi ; sol mMon=s…? s pm duc tomy elcho fer td ea a ez d a $:puntodesubiralau— a (…_Q…“Lo[.r [igmporunins_ 3 la ea a | tc%nngfg¡l)&0£ggsm S ?5Íaíu](_v_fíué23£&t;£££ r eo en y el ea | — alac¿;om%amtemmdempe_— ¿sl;……amwv&u? daSueloserbastanteefus¡— una vay¿%oci0nal,pemmesemomepl;(¡)¡g¡a;¡rne ;q ta t0entrggu£rg';%€&m&(£emtenns elsustodeserapu;¡t3;3 ?s?r?¡ín?o acotóquehorasdespu& dop0…n…'l%“r:srtlgl lan a Ree",17
2245.33,427.8,61.46,24.37,90.15,"su talento, ya sea musical o deportivo, y un jurado los ha evaluado. Este sábado será la final donde Cristian Vaivén y Amy Gutierrez serán los jue— ces. Todo lo hemos hecho de manera virtual y espero que más adelante lo podamos llevar a las escuelas”,",17
2225.25,1298.5,53.5,31.0,54.5,contó. [E.C) W e,17
272.2,504.4,45.6,28.2,81.0,G» Si no aceptas los,18
324.25,536.0,51.75,23.5,90.5,límites de tu pare—,18
250.12,625.82,58.47,23.47,89.47,"ja o no toleras sus defectos e imperfec— ciones, es probable que no te guste lo suficiente.",18
287.6,2318.0,103.6,23.2,79.2,INGREDIENTES +8 choclo enteros o,18
363.75,2391.5,39.5,22.5,91.25,de 4 ramas de,18
276.18,2486.55,66.64,24.55,86.18,hua catay 4+200 gr de maní o pacanas tarro de leche evaporado,18
1164.83,158.33,79.33,25.67,90.5,JUEVES 25 DE JUNIO DEL 2020,18
1072.76,590.48,58.68,24.68,89.72,"€) Antes de dar ese paso, hagan todo lo posible para averi— guar si la separación es realmente la úni— ca solución a sus problemas.",18
1914.45,481.18,78.45,27.36,87.09,"(D Comuníquense de forma abierta y honesta, sobre todo en situaciones",18
1843.17,619.83,55.5,22.83,88.83,de conflic— el tema con calma.,18
697.4,979.0,337.6,129.0,63.2,ME PIDO =.. ¿QUE MAGO?,18
587.4,1310.0,119.33,40.13,79.8,"<NO TE MOLESTES Y, SI QUIERES, DALE ESPACIO PARA QUE ANALICE EL FUTURO DELA RELACION",18
629.93,1845.6,66.32,24.49,88.81,"elves a ver per— totalmente a tu pareja después de 100 días de cuarentena y lo primero que escuchas de sus labios es 'necesito un tiempo”. Tres palabras difíciles de asimi— lar, sobre todo cuando pensabas que todo iba bien, al menos eso era lo que parecía cuando soste— días videollamada con él. ”Después de haber estado todo este tiempo de confinamien— to sin ti, ¿ahora te pide más tiempo?”, se pregunta con extrañeza la psicoterapeuta de parejas Juliana Sequera, quien",18
609.14,2394.62,67.43,25.95,83.29,+2 paquetes de galletas de vainilla +2 dientes de ajo trozos de queso fresco +8 aceitunas de lechuga (bien lavadas) e,18
1099.8,1879.01,61.37,24.63,87.79,"considera que generalmente las e Ten d ie maquillar sus deseos de termi— nar la relación, ”solo que no lo dicen abiertamente por temor a la respuesta y reacción de la otra 5 Aunque para la experta lo más recomendable es no aceptar el tiempo y terminar la relación, también puede ser que la persona decida otorgar el tiempo solicita— do. El problema es cómo queda ella. ¿Cuál es su condición?, ¿es la ex?, ¿la actual?",18
1038.24,2438.59,60.78,23.96,90.04,"PREPARACIÓN Sacchar los choclo y reservar. Licuar el maní, las hojas de hua— catay, la leche, el ajo, las galletas y un poco de sal, hasta obtener una crema con la consistencia que se desea. En un plato poner una hoja de lechuga y encima el choclo bañado con la crema.",18
1617.41,1444.21,63.72,24.59,88.9,"© Petj|r tiem— po implica un compromiso con el otro, se trata de respetar al que está esperando y darle una explicación en cuanto se esté listo para hacerlo.",18
1556.77,1872.19,60.89,23.07,89.56,"Se supone que el tiempo que se dan es para pensar, reflexionar y saber si se necesitan, no para andar en busca de un nuevo romance. La experta señala que es importante que cada pareja converse la manera de transi— tar ese momento. ”Establezcan un límite, cuando llegue el día pactado y se vuelvan a ver con otra mirada, se podrá decir que triunfó el amor o decir adiós”, senten— cia Sequera. [<]",18
1642.6,2206.8,108.0,41.6,71.6,Chelo con salsa de copa,18
2214.0,935.2,93.8,22.4,81.2,Carlos Sandoval Cceres Médico Geriatría,18
2259.0,1028.33,97.83,39.5,89.0,EL COVID—19 NO RESPETA A NADIE,18
2264.33,1807.36,69.13,24.86,85.61,"© I_ieviyido la d a fui víctima del Covid—19, ( D d (o siva de la enfermedad. Estuve internado en la Unidad de Cuidados Intensivos del Hospital Rebagliati de EsSalud. Si no hubiera sido por la tecnología con la que cuentan y los excelentes profesionales que me atendieron, no estaría escribiendo mi columna. Estuve en ventilación mecánica, en coma medicamentos duran— te tres semanas, y luego se hizo el milagro, ayu— dado por las cadenas de oraciones y misas reali— hadas a mi nombre que organizaron amigos y seguidores. Hay cuadros asinto— máticos, el paciente no s s a e ee toma, pero sí puede contagiar; casos leves, el paciente recibe cuidados mínimos en casa; casos graves que requieren oxígeno, y los catastró— ficos, como el mío, que necesitan de ventilación mecánica en una UCI. No bajemos la guardia, distanciamiento social, uso de mascarillas y lavado de manos.",18
1049.55,950.86,186.27,37.27,50.5,"(a ¿Ilmplar ponnoíba¡ar(elkvolumenu (dellarradio?Situaciones: (c_omo(e,staspasan|a(d¡ano, s i notsolemos(comprender ei S|gnlflcal :advert¡rllasmec, sidades. IEn(el(contexto¡aclual es ivimos;tenseñaráa lostniños, taltenerunatconeiencialsoli— (darla(es,muyumportant& porquelaprenderan'a ee prender*.valorara,y1aprec¡ar¿a lostdemás:",19
1424.5,733.25,200.5,34.5,63.5,Ilmpllcalreconocerllas. neces¡dadessyfsufnm¡enttostdel ltomanacc¡on;y(estar(d¡s(porque. forma(de(contnbuliratunawida mejoren:,19
1445.4,1095.1,124.8,33.3,46.1,"l e y (gamosges.importante, ffom1aremos¡personas ssontcapace€de¡pensar(enu sino tent su pro= ee a",19
1777.57,739.0,139.57,40.29,55.57,"mientan promover && 53Í0o fLCÍ;” ÚZÍÚ©U© o_""_l©mím©_3©8",19
1803.0,1013.8,121.2,31.0,56.0,n|t5[.n nb3|a 9o”bCa» €1 mtááb'íí'2&'t,19
2189.83,830.11,150.94,36.11,51.97,"g> Doctor,'con mi parejatengo: 2 (el no taxi.Ahoratella no:quiere: Ihemos*aportado para l tener el xvehnulo,&que¿puedoohacer7 RESPUESTAS ”Tendrá' que,lnluarluna solicitud o tun] procesoxde¡reconoam¡ento¡de; tuniónide;hecho,¡por lavía'notariall Manñestanqumt¡ene¡ lmas'de?2%anos'convmendo,y que: fambos'se;encuentran librestde, ||mpedln¡entos'maannles3y ei originalque;el patrimonio: dellalumon|n¡a de15mledades;gananaales A dec¡r;que¿odo t",19
301.57,251.29,116.71,46.14,81.57,2 — (AL DÍA) APRENDE EN INTERNET,2
496.15,1267.26,68.47,24.59,89.53,"i amigo, el fotógrafo Gary, me contó por Zoom que mucha gente está saliendo a la calle no solo a trabajar, sino también a 'relajarse”, a 'tomar aire”, luego de cien días de encierro por la cuarentena. No hay que confiarse porque los expertos advierten del riesgo de una segunda ola de conta— gios. ”María, lo más inteligente es, si se puede, quedarse en casa y solo salir si es estrictamente necesario. La no está controlada. Más bien, esta crisis nos ha demostra— do la fragilidad de nuestra economía, no solo del Estado, sino de la inmensa mayoría de peruanos, ya sea porque perdieron el trabajo o si se vieron obligados a ir a una clíni— ca y terminaron arruinados. Por eso, hoy más que nunca es imprescindible tener más conocimientos, pues estos te darán más posibilidades de trabajar y ganar dinero. Internet nos da la tremenda ventaja de estudiar desde casa. Solo es cuestión de decidirse y ponerle ganas. Hay cursos online como: Gldiomas. Existen numerosas páginas web, la mayoría de pago, pero también algunas gratuitas, que enseñan inglés y otras lenguas como el francés, italiano, portugués. Saber al menos dos idiomas abre puertas para trabajar y hacer nego— dios con gente de otros países. Incluso, hasta se puede emi— gran a otras naciones en mejores condiciones que alguien que no sabe la lengua del lugar. ©Coaching deportivo. Cada vez son más las personas que se preocupan por su forma física, pues no solo se trata de verse bien, sino de mantenerse sano. Este curso te dará los conocimientos para dar asesoría en ejercidios físicos y todo lo relacionado a estas actividades. El mercado cada vez es más grande y podrías dar esas asesoría desde tu casa. Dietética y nutrición. Aprenderás a hacer planes de al— tentación especiales teniendo en cuenta las características y necesidades de cada persona. Lo requieren desde niños hasta adultos, ya sea para adelgazar, para subir de peso, para ganar masa muscular, por salud... en la Bolsa. Estos conocimientos los debe— iríamos tener todos, pues es una excelente forma de hacer crecer el dinero. En este curso te enseñarán cómo funciona el mercado de valores y la mejor forma de invertir. digital. Te enseñarán a crear estrategias de ventas, desde lo básico hasta lo más avanzado. Cada vez más personas y empresas recurren a la internet para ofrecer sus productos y servidios, pero se requiere de preparación especial para tener éxito. Tú podrías ayudarlos. GMaquillaje. Si este campo te interesa, qué esperas para aprender. También enseñan métodos y técnicas profesiona— les de peluquería y estética. jamás te faltará trabajo! Decoración de interiores. Te enseñarán sobre diferentes estilos decorativos, materiales a usar, texturas y colores. Todos quieren espadios agradables y únicos para vivir y tra— bajar y tú podrás satisfacer sus expectativas”. Qué buenos consejos. Gary tiene razón. Me voy, cuídense.",2
1164.83,158.33,79.33,25.67,90.33,JUEVES 25 DE JUNIO DEL 2020,2
1811.85,1270.9,63.81,27.9,79.25,"TWITTER Martín Pizarra sobre las clínicas: Rehizo na oferta, luego una contraoferta, se está llegando al l o llegar a un acuerdo, Ya era hora de que pusiera un ultimátn. ENRIQUE PATRIA 101 sin poder ponerse de acuerdo colas dínicas. 101 días. Más de 8 mil muertos y Pizarra aparece con una nueva cortina de humo. ¿Ya __ _ y compraron pruebas moleculares? uA un A) ©Jaicec JUICE HABLA TOME Opina sobre los ambulantes 'Claudio Pizarro es un ganador' — ©ENCUESTA 2 Hago un llamado para que el presi— — Claudio Pizarro ha anunciado el fin de su [H]©V (D dente Martín Pizarra, los ministros y GD carrera como futbolista profesional. Lo _ …Wo“g los alcaldes den solución al problema del hace jugando en una liga top de Europa, la dado el presidente Pizarra a las cínicas? comercio informal [ambulantes). Ya casi lle— de Alemania. Es el jugador peruano más exi— gamos al final de la cuarentena, sí es que no _ toso de todos los tiempos a nivel de clubes AYER la amplían, y los lugares donde están se han _ y eso nadie se le puede quitar. Por eso digo ¿Aprueba la labor del ministro de convertido en focos de contagío. que es un ganador. et m ] Antonio Melinde — 22% Vecino de San Borda = a El lector sugiere que los ambulantes sean El también llamado de los P, em padrona dos con carácter de urgencia Andes' fue formado en las menores de Canto— _ ©EL DOLAR obligatoria y reubicados en zonas que cumplan lao y desde allí paseó su talento por Sipesa, Alianza a 354 estrictamente con los protocolos de salud y seguri— — Lima, Perder Bremen, Bayern de Múnich, Colonia y dad. La pandemia ha puesto al descubierto la gran _ Chelsea, Sí es un ganador, pero quedó en deuda con — Compra SIENTA informalidad en revivimos y debe solucionarse. la camiseta de la selección. y , EMERGENCIAS _¡_'/ “_x?]_xf)_¿ ese Emergencias 105 Defensa Civil 115 7 4118000 Águilas Negras ea Escuadrón verde _ 4276904 E 6175000 3178000 Indecopi 2247777 E PTT ©ALÓ TOME ta d in e 311—6399 p e s o e Impreso en la Planta Dando de Empresa ..— Hecho el Depósito Legal en la Biblioteca Periodistico: —. porEmpresa Editora El —— Páginaweb: Editora El Comercio SA Paracas ns a y , No530, Pueblo Libre, Lima?!. Los artículos firmados y /o de opinión Espinosa _ 10005 derechos reservados, son de exclusiva responsabilidad de ee £.lr“£%“'“ Publicidad: 708—9999, —— Prohibida su reproducción total o parcial. . sus autores.",2
296.22,658.0,166.0,53.0,84.89,más pequeños aprenderán la importancia de trabajar en equipo,20
389.44,1588.83,60.14,25.18,79.75,"res lápices de colores, el azul, el amarillo y el rojo, que esta— la e 0 a la ea l la mucho entre ellos. Cada uno se creía el más importante. Imaginense; solía dedo el lápiz amarillo, 'Doy el color que simboliza el oro, es dedo, las riquezas. Donde hace falta ] El lápiz azul respondía: '¡Gran cosa! Cuando hacen falta cielos en un paísaje, allí me encontrarás. Aporto fres— cura a cualquier dibujo que necesite agua”. El lápiz rojo replicaba. *Oh, por favor. Yo soy quien aporta color y vivacidad a las frutas. ¿Quién querría comerse una fresa",20
1164.83,158.33,79.17,25.67,89.0,JUEVES 25 DE JUNIO DEL 2020,20
1009.5,1589.03,59.67,24.15,88.45,"Un día les tocó participar en un paisaje. Colocaron cielos, un sol, una casa, unas manzanas... hasta que les tocó colorear unas uvas, unas naranjas y unos limones. Entre ellos se veían sin saber qué hacer, porque sus colores no eran los de esas frutas. Pero el dibujante los puso atraba— jar en equipo: combinó al amarillo con el azul para lograr el verde de los El azul con el rojo para que las uvas tuvieran ese color violeta. Y el amarillo traba— ja con el rojo para darle color a las naranjas. Al terminar el dibujo, los tres lápices aprendieron sobre el traba— jo en conjunto. A partir de ahí todos mostraron más cama— radería, aunque no dejaron de bromear entre ellos.",20
1360.44,2124.89,53.31,24.0,87.17,"| : | | ¿Por qué los helicópteros N se elevan verticalmente? Por la propulsión vertical del E aire, una fuerza mayor a la 5) de su peso producida por la gran velocidad de la hélice",20
467.26,2350.85,60.85,24.3,87.04,"En el habla familiar del Perú y de muchos otros paí— ses de la América hispana, puentear se usa con el sentido de 'omitir o disfrazar la verdad'. Martha Hil— rembrandt explica que el término puentear parte de la lengua general, en la cual cuento tiene también el sentido de 'embuste, engaño' [DRAE 2007).",20
458.5,2508.5,63.62,25.75,92.38,"Ejemplo: No te dejes cuentear, analiza bien el",20
1441.7,2305.52,65.22,24.22,88.17,"al girar, así como la forma aerodinámica de sus alas. El aparato es 'empujado' hacia arriba, haciendo que se eleve. La hélice posterior,",20
1496.0,2408.0,64.5,25.0,72.25,"llamada 'rotor de cola',",20
1459.36,2475.29,61.29,22.71,91.07,compensa la tendencia a girar y mantiene a la nave en la misma orientación.,20
2263.29,614.57,71.86,28.14,86.0,Lee bien la información que sale en esta página y 'responde las siguientes preguntas:,20
2205.11,873.67,61.17,26.11,72.78,;| Al combinar _ lel amarillo con el azul. conseguimos el _ A. Rojo: B. Violeta. C. Verde.,20
1957.31,1129.88,66.75,25.0,89.69,ACCIÓN! Colorea siguiendo el código de color y verás lo que se esconde en esta imagen.,20
2235.52,1190.09,64.26,27.57,74.87,"<, y En el habla ”/ familiar del' [ usa con el sentido de: A. Llegar tarde: B. Omitir o.disfrazar la verdad. lee",20
2237.74,1565.57,64.17,23.3,83.57,"La pequeña , que ... ./Hevan los helicópteros en la parte de atrás se llama: A Rotor de cola. B. Timón. €. Estribor.",20
2261.0,1800.0,40.14,26.43,86.86,.. El deg es | A. Mono.,20
1921.56,2350.63,57.24,23.93,90.81,"Es un ratón semejante a la chinchilla o al jerbo. Proce— de de América del Sur, se le puede hallar en Perú y Chi— le. Tiene una cola más larga de lo normal y orejas grandes. Generalmente son animales de color marrón. Puede medir hasta 118 milimetros y pesar entre 92 y 250 gramos.",20
917.12,158.62,104.88,27.12,86.38,22 (CRUCITROME) JUEVES 25 DE JUNIO DEL 2020,22
1046.41,1395.93,40.08,27.03,56.13,"— — NoOTAMUS. — 11 BRAZO a a e n TRAICIÓN es 2 3 AVENIDA =8 5 (ABREVIADO) 53 2 SMBOLODEL ea E F 2 E F E FRECUE&&A g Asuntos 2 g & es et o E e 8 ( d a la y ta y TRICHINA — FETICHE — DIOSALAAURORA ¡¿,g el Ed l ta [Si 3 ] 25 ATURDE E F nu EL E E DE Supe NOBLE g a INGLES < % S l E 9 a 2 j r l 52 E PREFUOVIDA —— CAPITALED — ARTICULO <E ANA ... NORUEGA — NEUTRO ESPOSA DE 85 la RINDE — et ] a ” IGUAL so 8 e a i a Fr F o oe ee ] es 2 0 85 3 b 25",22
1367.0,160.33,83.33,25.67,88.5,JUEVES 25 DE JUNIO DEL 2020,23
1151.58,427.12,72.31,24.6,88.89,"$ DEBORAH (40).— Estimada docto— & ra Carmen, sé que este espacio es para buscar pareja, pero tal vez mi caso sirva para prevenir a aquellos hombres que sufren por estar solteros y se ven sorprendidos por mujeres inescrupulo— sas. Mi padre es un hombre de 77 años, que es víctima de una mujer 40 años menor que él. Y digo víctima porque lo manipula para que le dé dinero. Lo está",23
1757.6,470.1,85.3,37.7,65.0,id d e hacer eshablarcontupapavhacgy£ef entender con pruebas esa must,23
1784.77,540.85,20.15,23.62,55.77,n l ) 2 M tan l ) d“e elC 1 L |,23
694.92,838.92,110.0,33.23,80.46,"CARTAS: Jr. Jorge Salazar Arroz 171, tercer piso, Lima 13. . MAIL: doctoracarmen01©trome.com",23
362.75,889.25,146.75,33.0,71.0,$¿QUE SIGNIFICA TU NOMBRE?,23
464.31,1075.06,56.22,24.0,87.69,"”*Bella como una flor”. De origen lati— no. Es indomable, valiente y solidaria. Siempre ayuda a quien está en problemas, y en el trabajo se compromete con los pro— yectos. En el amor se entrega totalmente",23
408.39,1956.37,29.24,28.72,76.1,"S D 0 U N Rol A T P E R ON Y S K L N C P Z N E L Z U J T A G A X N O A S Ro U 1 S M Lo P |1 E E D O V S F E A— N D V N uU 0 y E O D Q E A N E N E A C C V A D 0 S ES L E D T U T A E 0 S B 0 T l T G E | U D S E y uy S F K 0 Q B y A C B 0 Q — N | _ Y N 0 uU o T t <3TEN A LA MANO DE QUE ESTES LO QUE CÓMODO,",23
1044.09,954.27,77.09,35.82,73.0,<mr..(;91 m única dorada del papa :'Í».<_haáaéin¡nnglgummm más caro del mundo,23
1276.96,697.93,89.09,26.25,83.85,"engañando de la peor manera, inclu— 9ueloa""¡;asvug%r&reenrazón.Talvez so descubrimos que es casada y con el el.T[a¡'3 marido se han puesto de acuerdo para ps abogado detucon— arruinar a mi padre. El, al parecer, está el ge sapers oo av tan enamorado que no cree y continúa fianzapafad_o“qnf""a'a con esa relación. Me preocupa su salud. quesehaga)usucm.so DIA COMO HOY",23
1390.86,1007.71,60.43,24.57,74.57,e cañas de 'Nace el cantante británico,23
1356.28,1883.17,33.31,29.79,75.36,"poroma camarade o” y ganador dos veces del marfil. TIPS PARA ESTUDIAR A DISTANCIA (3) N C O N C |5d D H X V W Q A P o » = M A S | D O E Ro R U E S N Ro Z S C V S A H E A N A O — A S | el |5d A E S P T Rog o D H S yÁ O — N A A D U A | = = | = F S Z R L o U = U C M = | V E S A A E P R Q S R C V G Xy | C R Z A O ] = N C U = D E 0 T S L E U | U R | U S N M E O P D S C D N U T o S M E E N Q S | A U C E T A— 1 C = U = R S U Co B | | a o | = = = | Ro A M D No T A A D y C C Z S N U Ro N E V N R | S =3 N TO A TT E D 0 = C U e y | = > » | el yÁ =3 Xy S y U | D E e <>S1 EN TU CASA <*TALVEZ PUEDAS ui o a <NO QUE TE DUERMAS. <PARA ESTUDIAR, p a 1",23
2246.95,399.58,63.89,23.58,81.95,"Em ARIES: Evita la rutina, haz .zñ'algo diferente. Planifica mejor tus gastos, recuerda que las cosas no caen delcielo.",23
2253.06,539.33,65.39,23.33,81.89,". TAURO:Recibirásunanoti— *</ cia que te hará feliz en el plano sendmental. Busca la paz, evita la confrontación.",23
2268.43,689.71,66.36,25.71,72.93,u l i A ahora disfrutarás más tiempo con esa persona. Evita el estrés.,23
2274.29,822.86,58.21,24.29,72.14,o —©”:* momentos difíciles gra— dias a tu capacidad. No hagas en a a,23
2242.72,945.72,62.06,24.61,85.0,"'T,,5 LEO: Será un día con bas— tante productividad. Deja que tu imaginación y creatividad te guien. Tenfe.",23
2283.6,1076.3,66.0,23.9,87.9,Es importante que remueves tu imagen y anali— ces bien lo quete,23
2240.05,1230.37,58.53,22.58,82.05,_YR LIBRA: Debestenermás cui— / Dado con tu alimentación. Un familiar recurre a ti para que le brindes ayuda.,23
2245.18,1363.76,66.41,21.94,72.41,"* a Si hay algo que — € temolesta,eshoradeexpre— sarlo. Busca soluciones a esos problemas, abrete mente.",23
2244.11,1507.79,61.11,30.74,77.26,",,.éaa&rmmm :: =* tarte por las cosas que pasa— ron, da el salto para lograr tus (r el e",23
2209.22,1630.56,113.11,31.22,58.11,"N , CAPRICORNIO: Sihasalcan— zadoeseobjetivo, seedbed tuesfuerzo, pero note duer mas en a",23
2305.83,1765.33,52.5,24.33,78.0,"2 mental y deseos de avarzar,",23
