left,top,width,height,conf,text,page
1792.76,1387.2,121.3,28.34,74.54,"nostienetambiénayuda, co— mo la señora las manzanas y papas, quedó suapor— durante laconvocato— ria que hiciste ayer enel Asíes, la gente don a membrillos, papa...son |O ¿Solo por redes se transmitirá 2 E Sí,eslaprimera velen mi vida que hartazgo así (seráncinco ho— rasdetransmisión), yaquesiem— pelo he hecho paralatelevisión, peores bueno, hay ganas y el Perú selevantará. Esta pandemia hizo que aflore el espíritusolidario y de empuje que tenemos los peruanos. Esoes loquesalió a flote, nuestra solidaridad, creatividad y fuerza, por eso no si l us iona lo de unirnos yllevarcomida. ¿Participaránotros artistas? Nacionales internacionales. Luego, la animador a dijo quele pondría un 11decalificación al pre— siente Vizcarra. ”Al principio le puse y 18 porquecreoqueem— pezóacomunicarbien. Hoy no, la— mentablemente, (tiene) porque loslíderesdebensaberactuaryte— n er respuestas deinmediato.Sipa— s a algo como lo de debes responder de inmediato y no dejarnoscontantasdudas”,comen— tóenradioCapital.(C.Chévez) 0",16
1510.14,2370.05,70.27,24.16,89.7,"sado encontrarse con tanta desgracia y necesidad... no sé qué tanto le pue— de haber afectado el cambio. ¿Tesientes cómoda compartiendo laconducciónconKarina? Sí, todo tranquilo. Es más, como muje— res nos apoyamos. De otro lado, agradeció al público que los sigue fielmente a pesar de los cambios en su horario. ”Ahora salimos a las 2:30 de la tarde pero siempre tenemos el respaldo de la gente, se engancha con las historias que mos— tramos”, indicó. (M.C.) o",16
2261.16,892.65,67.3,24.59,87.39,"HOLA, MI o$o BARRUNTO. Llego embalada para contar— les los últimos chismes de TIL— SA LOZANO dijo sin noches que es 'la reina del canje”, pero que en esta cuarentena ha apo— lado gratuitamente a muchos emprendedo— res que la están pasando mal. Bien ahí... La actriz ALESSANDRA FULLER contó que pronto pre— sentará una obra virtual y reveló que no es celo— sa con sus parejas y que sus amigos le dicen ”corazón de piedra” Aya— yayyy... La miss Perú, SILVIA CORNEJO, afirma que tiene. un exhaustivo protocolo de seguridad para protegerse y lo apli— ca todos los días en América Televisión. Bue—",16
2267.71,2116.52,61.01,23.85,88.14,"na... En México pesaron a NICOLA PORELLA y la producción lo mandó a ponerse a dieta. El capi— tán tiene 100 kilos y por eso no puede estar agi— lito en las pruebas. Más verduras y menos papa... Una lluvía de críticas reci— dió ayer LAURA BONZO en las redes sociales tras haber afirmado que fue Ministra de Cultu— ra. ¿Quéee?... El cómico FERNANDO ARMAS contó que tras haber cri— tocado a ROSÁNGELA ESPINOSA en un con— curso en ”Esto es guerra', sus fanáticos se le fue— ron encima en las redes sociales... Bueno, soy fuga porque mi amorci— to ya es todo un chef y esta noche me coci— s ne e",16
330.08,429.25,120.08,42.25,61.5,"/)(_)'""7 AA é¡(¿?u/aw/ l |I'I a EZ Istisiredes Con entrevistas enla ducha",17
357.93,1616.94,112.57,25.46,78.89,"cantante AmyGutié— rrezcontó queest sol— tera y no tiene apuro en encontrar el amor porque estoy enfoca da en mis proyectos” ”Estuveenamorada, ahora estoy soltera, totalmenteconcentra.— Ten o yentratardesobrevivirmásque enotrascosas”, dijolaintérprete de'Nosé” ”(Enamorarme) lo dejo al desti— no, siempre me ha pasado que entremos planeas las cosas salen muchisimo mejor, si se fuerzan, se van rápido. Estoy pensando mucho en el amor, ob— via mente como toda mujer me gustaríaenamorarme, casarme, tenerme familia, hijos”, añadió Amy en una entrevista con Julián",17
260.2,2514.4,72.2,30.6,84.2,que no sale a la calle porque sufrió de bronconeumonía,17
1367.17,160.5,83.17,25.5,88.5,JUEVES 18 DE JUNIO DEL 2020,17
1213.86,427.36,68.33,24.42,88.39,"Nancy Castelo, la popular acaba de lanzar una cumbia cantada en espa— sol y portugués. ”El tema se llama ”Me valo— ricé', la canto en espasol y portugués. Yo siempre estoy tratando de hacer cosas dife—",17
1395.28,1308.72,87.49,26.96,81.67,"Zucchini subcanal de YouTube. Dentro lado, contó que a sus 21 años estácumpliendo su sue— ño de ser solista, pero para lle— gar tuvo que tomar difíciles de— ”Cuando empecé con Sal— sa' cantábamos para 5010 per— sonas. Sin embargo, nosotros ibamos a gozar, bailar y can— tar;queríamos trabajar y hacer música. Es más, a veces hemos cantado so— lamente para los que cui dan las dis— cotecas.Cuando cumplidos 21 años me cuenta que no había hecho que soñé desde peque — ña, quiera ser solista, pero el que no arriesga no gana”, señaló. Porúltimo, dijo que a fin de mes lanza su nue— vo tema y también una canción bajo la producción de Sergio George, que ha gra.—",17
1394.76,1848.24,66.18,25.41,76.47,lado durante la cuaren— tena y con la cual espe— ra abrirse camino en el ex (e,17
1198.87,2287.09,65.52,23.9,90.01,"GD El cantante Segundo Rostro contó que vive encerra— do en su casa en Guayaquil desde hace 90 días, pues a sus 59 años es una persona vulnerable que ha estado al borde de la muerte en dos oportunidades. ”Llevo 90 días encerrado en mi casa, no me dejan salir para nada porque he sufrido de bronconeumía, y ya vengo sufrien— do de ansiedad porque estaba acostumbrado a viajar mucho, a caminar con el pueblo y hacer mis shows. Sin embargo, estoy aprovechando el tiempo para disfrutar de la familia y grabar nuevos temas”, comentó el cantante ecuatoriano. Es una persona deriesgo, ¿cómo vaareinventarse? Así me han dicho, además, tengo 59 años y he visto la muerte dos veces. Una vez a los 3 años, y otra a los 22. Por eso, este sábado 20 estoy empezando con los shows virtuales para mis seguidores en todo el mundo con una previa inscripción en mi pági—",17
1694.21,422.21,68.42,24.32,89.39,"rentes, con mi propia esencia para que mi público se divier— ta”, señaló. Además, contó que a través de sus redes sociales ha lanzado tres secuencias. ”La primera es de entrevis— tas desde la ducha, la segunda M.C.]",17
2190.49,399.9,64.46,23.08,91.28,"de ejercicios donde invito a un personal trainer para que me instruya y también a mi públi— co a hacer actividades fáciles en casa, y la tercera es de coci— na, con recetas baratas hechas or la garotiña”, finalizó.",17
1960.75,901.5,29.0,22.5,33.75,l a y i,17
2008.93,1181.33,67.9,25.68,85.42,"El cantante Fary Mar— C) tenez está fe||2%orque d Slete esta a punto de convertirse meses de gestac¡on ”Mi novia tiene siete meses de embarazo. La verdad, estoy muy feliz y emocionado. Por primera vez seré padre y justo me tocó una princesa”, contó Fary, quien añadió que la boda será en noviembre. Además, dijo que ahora que no habrá shows musicales abrirá su empresa de transporte de personas, encomiendas y courier. [M.C.)",17
1979.5,1459.0,74.75,80.0,36.5,o p o e,17
2166.86,1827.79,70.14,25.71,85.07,"CD Dacron Martín calificó como una 'mons— truosidad! las acusaciones que hizo Alejandro García en contra de Anelhí, a quien vinculó con drogas y prostitución, y pidió a",17
2042.29,2028.39,70.22,26.06,85.55,"las autoridades de Migraciones tomar car— mano — tas en el asunto. ”Las autoridades de Migraciones deben cubano actuar de inmediato porque le está C haciendo daño a una mujer peruana. Este tipo no tiene ni documentos porque vincula — es un refug|adoy está maltratando a los peruanos”, comentó. o id",17
284.79,579.79,61.26,24.89,88.68,€» Permite que tu pareja desahogue sus emociones con total libertad y se sien— ta cómoda al contar lo,18
379.25,764.0,88.38,34.0,63.88,"que le sucede. '""3'|>[qu/ |11I* >Ú]""'…H RO N",18
436.63,1850.85,56.06,24.52,91.85,"amá, sabemos que muchas veces no estás de acuerdo en cómo papá hace las cosas y crees que solo tú lo puedes hacer y a la perfección, pero no es así... debes alejar esa idea de tu mente y empezar a valorar y, sobre todo, darle el lugar que le corresponde al padre de",18
423.26,2057.31,59.74,23.6,91.14,"”Los chicos deben ver que mamá y papá tra— bajan como un equipo, en el cual se reconocen las virtudes y cualidades de cada uno. Si los niños ven que sus padres se respetan, cuando",18
295.29,2468.0,62.43,24.5,83.64,INGREDIENTES es 4+250 gr de harina 4+200 gr de azúcar cda. de polvo de hornear taza de leche tibia +6 cdas. de aceite +1 cdta. de esencia de,18
709.25,2333.5,71.75,24.0,76.0,TE de canela molida,18
696.38,2501.25,70.62,24.71,87.92,"PREPARACIÓN Batir los huevos con azú— car, leche, aceite, canela y vainilla. En un bol poner harina y polvo de hornear tamizados. Luego, untar",18
1165.0,158.5,79.33,25.5,87.83,JUEVES 18 DE JUNIO DEL 2020,18
1123.25,503.5,74.75,32.0,82.25,CD Muestra empatía con,18
1098.37,601.26,63.11,23.32,91.0,"tu amado, teniendo en cuenta que las cosas que son sencillas para ti puede que para él sean complicadas.",18
1775.25,386.5,70.25,33.25,72.0,a C© pequeño que,18
1782.6,530.3,59.45,23.4,89.2,"sea el esfuer— z0, reconócelo y felicitalo, así tu galán se animará a seguir haciendo otras cosas en el hogar.",18
1441.77,830.46,127.62,41.23,87.85,"maltratarlo o desmerecer sus acciones delante de los chicos, mejor trabajen en equipo",18
1215.27,952.55,81.27,25.18,88.36,"ellos sean adultos también los respe— tarán”, explica la psicoterapeuta Juliana",18
1264.59,1090.21,60.69,23.45,90.55,"Por eso aconseja a las madres no rega— ñar, tratar mal o desmerecer al papá delante de los menores, así estén sepa— rados, porque él también tiene una labor",18
1823.85,1123.29,66.29,24.17,90.73,"nación de los niños. ”No te olvides que los hijos aprenden de los padres a cómo comportarse. Por eso, es fundamen— tal que el buen trato y el respeto estén siempre presentes”, precisa la experta. Agrega que la pareja debe entender que ambos tienen el mismo valor en la vida de sus hijos, así tengan muchas diferen— cias. Si el niño crece en un ambiente saludable se convertirá en un adulto con autoestima alta, respetuoso y con herramien— tas suficientes para enfrentar cualquier problema.",18
1933.27,1805.0,71.27,25.6,80.13,"Las [ e conducta y las decisiones sobre la crianza se deben con ambos padres,",18
1406.25,2209.5,77.0,36.5,76.0,ee Beca de leche,18
1087.97,2403.68,59.65,23.61,89.55,de mantequilla un molde y espolvorear harina para que no se pegue el bizco— cho. Verter la mezcla en el molde y llevar al horno precalentado a 180oC por 40 minutos.,18
2214.0,935.2,93.8,22.4,85.8,Carlos Sandoval Cceres Médico Geriatría,18
2263.32,1783.76,58.68,24.1,90.34,"Pablo quedó viudo a los 36 años y con 3 hijos pequeños. Fue duro, pero supo sacar— los adelante, ahora ellos son profesionales y tie— nen sus propios hogares. Hoy Pablo es un abuelo de 8 nietos y bisabue— lo de 2 pequeños. Este domingo se celebrará el Día del Padre y aun— que es un año diferente, Pablo se lo pasará boni— to a la distancia, pero en contacto a través de videollamadas. La idea del Día del Padre surgió en 1910 en Esta— dos Unidos cuando Sonora Smart Dodd quiso homenajear a su padre, un veterano de la guerra civil, viudo y que crió solo a sus cinco hijos. Se insti— tuyo en 1966 y desde esa fecha se celebra en casi toda América. El padre es muy impor— tante en la vida de sus hijos, no solo en la supervivencia económi— ca, sino que es el ancla, la fortaleza y el ejem— plo para crecer fuertes, sanos y responsables. Un saludo a los padres peruanos que luchan p a titular a los padres 6",18
857.43,176.71,174.57,40.29,58.71,— trabajemos JUNTOS PORUN MEJOR ! 2020,19
305.09,991.72,69.39,23.63,90.72,"e dice que los perua— nos somos creativos, que ante cualquier cir— constancia aflora esa capacidad que tenemos para salir adelante. Y eso se con— firma frente a la pandemia del coronavirus, porque el peruano está mostrando actitud para enfrentar a la adversidad y está sacando adelante a su familia y empuja al país hacia un maña— na mejor. ”La actualidad es nueva para todos, pero también nos está ayu— dando a potenciar la creatividad, porque estamos buscando la forma de convivir con esta experiencia trágica”, sostiene la psicóloga Mari— cielo Valenzuela.",19
1256.5,854.7,75.35,26.9,86.3,"© _Este el ideal para reprogramar el cerebro, superar viejos patrones y actuar de manera rompedora ante los nuevos retos.",19
798.19,1207.73,67.3,23.89,90.89,"Afirma que los peruanos somos creativos e ingeniosos, algo pro— pio de nuestra idiosincrasia. Pero eso no escapa de la for— nación de padres a hijos, estos deben ser estimulados en su espíritu creativo, dinámico y positi—",19
1725.0,549.3,63.82,24.38,90.07,"vo para afrontar con optimismo las desventuras de la vida. ATENCIÓN Alimentar la creatividad en los chi— cos pasa por desarrollar un espacio privado donde puedan pintar, dibu— jar y dejar que su imaginación vuele. Hay que dejarlos que jue— buen con libertad y sin presiones. Y no te rías de sus ideas, aunque te resulten graciosas, porque es importante que los niños perciban que lo hecho o dicho por ellos tiene valor. Así serán en el futuro perso— nas seguras. [",19
2267.6,397.4,40.6,25.0,38.2,E e E et a,19
2238.91,597.42,65.39,26.48,90.42,"(D Doctor, mi padre acaba de fallecer, él ha dejado tres cuentas de ahorros en distintas entidades financieras, ¿qué podemos hacer para reclamar el dinero que ha dejado mi progenitor en el banco?",19
2224.27,1026.99,63.83,24.21,90.49,"RESPUESTA: Lo que tienes que hacer es solicitar una sucesión infestada, esta solicitud la puedes realizar a nivel notarial o judicial y tendrás que anexar el acta de defunción, acta de matrimonio de tu mamá, las actas de nacimiento de tus hermanos y copia de sus respectivos documentos de identidad, y luego de inscribir la sucesion infestada en la Sonar como los nuevos herederos del causante (padre). Podrás solicitar la devolución del dinero al banco.",19
203.5,153.25,55.75,40.25,72.0,2 — (AL DÍA),2
493.0,378.5,163.75,57.5,88.0,LA IMPORTANCIA DE PAPÁ,2
518.62,1298.82,62.86,24.23,90.07,"i amigo, el fotógrafo Gary, me llamó por teléfono para co— sentarme que Lima ya no parece una ciudad en cuarentena, pese a que la medida está en vigencia, pues las calles están llenas de gente. Tres meses de encierro han sido demasiado para mu— caos peruanos. ”María, este domingo se celebra el Día del Padre y es bueno recordar la tremenda importancia de papá en la forma— ción de sus hijos. No solo la madre. Antes se creía que solo la mamá era impor— tante en el desarrollo físico y emocional de los niños. Desde hace años se reconoce que el padre también es una figura central. Su trascendencia no solo se limita a la de proveedor de dinero para el hogar. Gun estudio de la Escuela de Medicina en Baltimore de la Uni— verdad de Maryland, señala que los niños que tienen cerca a su padre aprenden mejor, tienen una mejor autoestima y muestran menores signos de depresión en comparación a los que no lo tie— Glos niños que tienen cerca al papá lo perciben como un gran apoyo, lo que les genera una sensación de aceptación social y de más seguridad. Cuando un papá se involucra con sus hijos, hace realmente una diferencia en su crianza, sobre todo en el desarrollo intelectual, emocional, sexual y psicológico. La mayoría de los niños se desa— brillan mejor cuando el padre es cercano, cariñoso y cuando vive con ellos. Expertos señalan que el padre aporta más en el desarrollo mo— tor del niño, por el tipo de juegos que tienden a hacer con ellos. Les ayudan a salir al mundo y en el proceso de 'destete' de la mamá. Son un modelo de identificación masculina para los niños, y un modelo de diferenciación para las niñas. Los varones limitarán la forma de actuar del padre, y las mujeres verán su forma de actuar como algo natural. Por eso los papás deben esforzarse siempre por mostrar un comportamiento tranquilo, sin violencia, respetuo— so, siempre en control de sus emociones. No deben gritar en casa y mucho menos golpear a nadie. Gen el caso de padres separados, estos jamás deben olvidar sus obligaciones y responsabilidades en el cuidado y la crianza de los chicos. Estos tienen derecho a tener a ambos padres presentes. La separación de la pareja no significa, bajo ningún punto de vista, que el padre haga a un lado a sus hijos. Glos padres no deben confundir la protección con la sobreprotección. Esta última corta las posibilidades de los niños de aprender a desarrollar mecanismos de defensa ante los hecaos el Cuando los padres hacen las cosas por ellos (darles la comida, hacerles las tareas, bañarios, vestirlos, no dejarlos ir al parque a correr, no dejar que se ensucien jugando, entre otros) el mensaje que les transmiten es que no son capaces de hacer estas cosas por sí mismos. Lo real es que sí pueden hacerlo, y es importante que comiencen a realizarlo para que ganen seguridad y autoesti— ma”. Gary tiene razón. Me voy, cuídense.",2
1165.0,158.5,79.17,25.5,91.0,JUEVES 18 DE JUNIO DEL 2020,2
1778.99,1210.38,61.36,27.38,78.87,"TWITTER Buena noticia: el doctor Oscar Usarte ya fue dado de alta, está reposando en su casa Debe cumplir 14 días de cuarentena y luego de eso, espera volver a la cancha. ©Tartalora LAURA . AMASIFUEN Que no se construya el terminal ( San Martín. e a ee ne 0 r a s ©VezzintidosP pA Lamenta salida de Don Goyo' se ha desbordado' — €) Universitario de Deportes a €) números días del ”Estado de emer— [H]©Y dando una campana muy regular en el gencia' los 'marcas”, 'raqueteros y otros — ¿Está de acuerdo que el toque de torneo de este año. Llegó la pandemia y todo _ ”se pero pasó el tiempo y hoy han — quedaseahastafinaño? se paralizó, El trabajo de 'Don Goyo' (Gregorío — salido a la calle como loquitos. Cometen sus Pérez) se notaba muy claramente y llegaba a — fechorías a pleno luz del día o en horas del _ AYER los trabajadores. Es un técnico de experien— — toque de queda. La delincuencia se ha des— — ¿Está de acuerdo con reapertura cia y lamento mucho su salida. : bordado y es muy peligroso. de los centros comerciales? Juan Carnaval H E guicamaza977Qgmail.com — 1 > Según se informoó, la rescisión del contra— Es cierto lo que manifiesta el lector. Hace to del buen entrenador uruguay fue porque unos días, sicarios mataron a un padre de EL DOLAR sus más de 70 años lo ponen en la llamada pobla— — familia y su hija de nueve años, en el Callao. Nadie a 343 ción vulnerable ante el coronavirus. Los jugadores _ duda de los esfuerzos de la Policía, pero hoy se P han rechazado su salida y Juan Pañuelo es el téc— _ pide que los militares los ayuden en lucha con— — tra los criminales. AGENCIAS <_/.'1E'J.k?]_&().( ee Emergencias 105 Defensa Civil 115 Águilas Negras kms Escuadrónverde — 4276904 Luz del Sur 6175000 3178000 Indecopi ©ALO TOME o s oo | E Pertodistico: —. porEmpresa Editora El —— Páginaweb: Editora El Comercio S A. . Paracas on …¡ e… %t;d530£muo Limagld. Losfn?£nulosylo&mi2n os las derechas reservados. arespomdíxhd Bpglcay w%… … Prohibida su reproducción total o parcial. . sus autores.",2
379.66,1128.92,66.28,24.2,89.53,"Papá; tu cercanía, cuidados, juegos y mimos me hacen crecer feliz. Cuando de bebé me cuidabas y apoyabas a mamá, me sentía tranquilo y bien atendido, inclu— so cuando ambos estaban cansados. Or tu voz cerca siempre me ha tranquilizado. Tu contacto me hace sentir querido y guiado. Tus abrazos son mi mejor cobijo cuan— do tengo miedo. Así calmas también mis enfados. Jugar contigo es muy especial. Lo que me enseñas no lo puede hacer nadie más. Tú eres mi papá. De ti aprendo a expre— sar mis emociones, a tolerar las frustraciones, y a aceptar normas. Tu amor me muestra que puedo )A en mi fuerza. Tú me enseñas que puedo equivocarme, respetar y aprender: cuando lo haces mal conmigo me pides perdón y me abrazas. Los latidos de tu corazón dicen que me amas incondicionalmente. ¿Sabes lo que dice mi corazón? Que te necesito mucho. Tu amor y cercanía me dan segun— dad, apoyo constante y buena guía para aprender a ser feliz cuado sea mayor.",20
375.57,1704.86,64.86,23.43,83.0,"¡Gradias papá! ¡Te amo, te amo mucho!",20
409.91,1895.96,54.04,24.22,90.0,"Si tú no eres mi papá, trata de ser un papá así. Te aseguro que tus hijos serán felices, te lo agradecerán siempre.",20
410.8,2097.0,186.6,54.6,68.0,¿CÓMOSE ESCRIBE? Ojo AL Piojo,20
459.36,2404.3,65.01,25.16,88.39,"Martha Hildebrandt explica que en la lengua gene— ral el sustantivo 'ojo' tiene, entre sus múltiples usos, uno interactivo para llamar la atención sobre algo (DRAE 2014). En el castellano familiar del Perú y países de América se registra la expresión 'ojo al piojo”, ”usada para indicar que se preste aten— ción a lo que se dice o se presencia” [Diccionario de Americanismos, ASALE, 2010). Ejemplo: Se están acabando los alimentos, ojo al piojo.",20
1165.0,158.67,79.0,25.33,90.17,JUEVES 18 DE JUNIO DEL 2020,20
1650.38,834.0,80.69,26.31,82.23,FONTEENACCÓN 1. Pinta a tu papá y responde las preguntas del quiz. [3,20
1446.78,1311.33,35.56,24.89,73.78,años ol a t que tengo de él es,20
1512.75,1471.5,58.25,20.5,92.5,©Su frase favorita es,20
1479.0,1608.6,55.3,22.8,86.1,Este es su plato favorito (dibuja o pega la imagen),20
1630.68,1922.53,58.68,24.74,90.26,2. Coge una hoja de papel y un lápiz. Escribe una carta para tu papá y léemela este domingo.,20
1457.51,2277.91,72.61,23.84,90.02,"¿Por qué mascar chicle da hambre? Muchas personas que están a dieta mastican chicle para 'engañar a su mente y pensar que están comiendo alimentos. Este truco no funciona. Con el chicle nuestro estómago sí cree que estamos comiendo pero, en consecuencia, genera jugos que producen la sensación de — hambre, ardor estomacal y acumulación de airé.",20
2261.76,680.96,69.04,28.16,80.84,Lee bien la información que sale en esta página y responde las siguientes preguntas: . El Día del Padre E E el __ _”domingo de:,20
2169.83,909.0,59.83,23.67,49.17,A. Tercer. B.Último. (* eu a,20
2172.74,1180.0,56.88,25.06,80.32,usada para i_ndicar que se ©Sus bolsillos preste atención a i e lo que se dice o se presencia. Ojo: A. Por ojo. ' es b B. Que no ve. ( in haciendo piojo.,20
2159.59,1469.14,56.9,22.28,74.66,", ) Con el chicle _|—. ”*nuestro ©Cuando *”” cree | E E E que (e l trabajo, le A. En ayunas. B. Fuera de casa. €. Comiendo alimentos.",20
2196.73,1790.83,58.23,23.23,79.8,f . Para proteger l E e ! se las ___ para luego _ H A. Amarra a la aleta / abandonarias. B. Lleva / entregarlas. €. Traga / regurgitarias.,20
1913.16,2372.72,60.66,24.41,89.48,"Es un potente y rápido nada— dor que habita las plataformas continentales de América del Norte, Asia y Pacífico Norte. Mide hasta 5 metros de largo y tiene una gran aleta caudal. Puede saltar fuera del agua. A fin de proteger a sus crías se las traga para luego regur— citarlas tras haber pasado el peligro. Come peces.",20
1036.4,1279.56,45.27,27.52,56.36,"TRABAJADORDELCAMPO ALCURNIA, PRESIDENTE PARTICULA — NOR ee LINAJE ” — VENEZUELA — PEQUENA — PRECEPTO — pg SUDESTE DENOTA (e ADMIRACIÓN o de i ex ll a EF 3 …< 2 HOSTIA a €z <-' EE l lr ma o 25 t es F 8% ea tr E % 8 E 3 fe NTROGENO, 58 A nt =Hl l POBRE Ed ANE ea g f gl 3 22 es E 2 d2 LETRA NOTA —— TANTALIC — AUMENTÁTIVO — MUSICAL HEROE Este GUERRA DE 3",22
1164.83,158.5,79.33,25.5,89.33,JUEVES 18 DE JUNIO DEL 2020,22
1769.25,661.0,29.25,19.5,29.5,d a ii ea,22
1878.76,1429.41,35.86,22.73,57.43,EF E E e . NOMBRE fat E t — E BANDERA a CASA EL FE El ta S 3 8 3 EL Fi ] í 3 38 a F o Arte © ENFOQUE *— ] E,22
1609.62,160.25,91.38,27.0,88.5,JUEVES 18 DE JUNIO DEL 2020 (FIESTA) 23,23
1325.0,295.71,117.29,39.14,72.29,$ JAIME (37).— Estimada doctora D©©t©ffa ],23
1140.71,338.86,63.29,19.43,85.71,"*& Carmen, recurro a usted no para",23
