left,top,width,height,conf,text,page
466.65,1509.8,66.22,24.09,88.26,"| Chato Matta llegó al restaurante por su seco de cordero con frijoles y su jarrita de cebada calientita para bajar la grasita. ”María, mi hermano Pancolón convocó a una reunión por 'Zoom”' junto a los abogados del Callao, Callo y 'Onur'. ahora que Perú va a jugar con Chile en Santiago, no puedo dejar de recordar la primera vez que ”debuté” como narrador deportivo. Mi viejito 'Ma— zamorra' me dijo: el año pasado Perú fue un desastre en las Eliminatorias. Se cumplió un ciclo y grandes figuras como Julio César Urbe y Franco Navarro ya no están más. Hoy debutar chabolas como Flavio Maestri, con 17 años. Tú también vas a debutar en Santiago'. Me emocioné tanto que boté algunas lágrimas. Me fui con una gran bolsa de viaje. Después de la chamba, con mi 'batería' nos ibamos en las noches a los bares y discotecas del barrio bohemio de Bellavista, en la calle Pío Nono. Estába— mos tomando ”Piscola”, un infame trago mapochi— no, cuando mi asistente técnico, ”El Cura”, me dijo: ”Panchito, esa blanquita te está comiendo con los ojos”. Era una belleza que reía con sus amigas que tenían el uniforme del local. Era la hija del dueño y también la administraidora. Escribí en una servilleta: ”He venido de tan lejos para iluminar mi vida observando tu sonrisa”, En— trégasela, le ordené al mozo y le di 5 dólares. Cuando vi que la leía y me miraba y sonreía, grité ibingo! Al rato, el mozo llegó con un recado: ”Está ganado caba— llero, dice Ximena que la espere en la esquina para ir a una discoteca. Y que su consumo va por cuenta de la casa'. ¡Chita la payasá! Llegó con dos amigas que trabajaban en el bar. Mis amigos 'El Cura' y 'Carepan' se ganaron con ellas, que fácil podrían trabajar ahora en ”Esto es guerra'. Pero Ximena era la más hermosa. De frente la llevé a la pista de baile y la mareé dándole vueltas bailando ”La bilirrubina? de Juan Luis Guerra. *Panchito, eres lo máximo en la pista, mis paisanos no saben bailar'. La agarré en de amor' y la besé apasionadamente con ”Estrellitas y duendes”. Esa noche los tres peruanos nos fuimos a nuestro alojamiento con las bellas mapochas. Pero sucedió algo imprevisto. La habitación esta— ba helada y pese a que Ximena estaba encendida, hasta las seis de la mañana no me vi con Paraguay'. ”No te preocupes Panchito, de repente te puse ner— vioso... Felizmente la Copa América recién empieza y tendremos más partidos”. Cuando bajé a tomar el desayuno buffet me encontré con Cura' y 'Care— pan' con unos cacharros de velorio. 'Panchito, no sé qué pasó, dejé mal a los varones'... El viejo adminis— traidor escuchó nuestra conversación: 'Po cabritos, ustedes no son el problema, po. Es el frío, po. Sus cuartos no tienen calefacción y estamos a menos de diez grados de noche, po'. Ese era el problema, el gélido frío santiagueño que te congelaba los huesos y hasta el Como teníamos buena bolsa de viaje, gracias a 'Mazamorra', compramos tres cale— factores. Desde esa noche y durante los veinte días que nos quedamos en Santiago, los tres ganamos por goleada para felicidad de las chilenas que que — rían más ”goles peruanos””. Pucha, ese señor Pan— colón es tremendo sinvergüenza y todavía cuenta sus historias. Me voy, cuidense.",2
1224.83,158.5,101.0,23.5,90.33,DOMINGO 8 DE NOVIEMBRE DEL 2020,2
1043.2,842.0,141.0,38.4,72.0,HABLA TOME Opina del Chile—Perú,2
1142.55,1036.55,57.64,25.69,90.53,"€) Este viernes 13, Chile y Perú se medirán, en Santiago, por las Eliminatorias al Mun— dial Qatar 2022. Será un partido difícil, pues los chilenos están con la sangre en el ojo por la goleada que les dimos en la Copa América Brasil 2019. Los jugadores de la 'Blanquirroja” deben de entregarse al máximo en el cotejo.",2
1320.29,1222.86,70.14,26.0,84.0,Enrique Amarra C. Vecino de Salamanca (Ate),2
1157.74,1390.65,62.15,23.85,90.3,Solo tenemos un punto sumado en estas Eli— minatorias. Sacar un resultado favorable en tierras chilenas nos servirá de mucho para nues— tro objetivo final: volver a clasificar a una justa mundialista. En este partido todos los selecciona— dos deben dejar la piel en el campo.,2
1664.0,883.2,60.2,30.4,77.8,_ gente se las busca',2
1751.71,1025.43,64.06,25.16,88.69,"GO En estos días de pandemia del coronavi— rus, he sido testigo de cómo la gente se las busca para ganar algo de dinero hones— tamente, ya que perdieron sus empleos. Muchos han optado por vender comida y sus entregas a domicilio las hacen con protoco— los de bioseguridad.",2
1938.0,1212.5,102.75,27.0,76.25,F. Milagros S.V. fimisavi©hotmail.com,2
1782.03,1379.89,57.39,23.97,81.18,"En momentos complicados es cuando se ve la verdadera capacidad de las personas el e E e el a el ta somos ingeniosos y, mientras usemos eso correc— tamente, nos irá bien. Lo que debe primar es el",2
1716.6,1472.6,47.3,23.2,84.7,” respeto y las ganas de hacer las cosas bien.,2
2255.57,399.62,61.68,30.59,78.05,"Detienen a Pepe Luna por caso ”Cuellos Congresista José Luna dice que es ”cortina de humo' de Vizcarra, Cecilia García le echará la culpa alas AFP y es como siempre. Una verglienza. ©UrsulaMoscoso URSULA | la a",2
2255.22,700.85,53.44,32.22,76.96,po os intereses: Lajaula va avenir a romperse el alma jugando porque esa va a ser la vitrina que l a y pasar a un mejor equupo.,2
2202.0,835.0,117.5,32.0,85.0,©CarlosJibajaCh CARLOS J IB)A)A,2
2260.0,1022.55,68.82,24.91,89.73,¿Cree que Gianluca Lajaula debe ser titular este viernes ante Chile?,2
2248.15,1137.38,67.31,30.46,90.92,AYER ¿Cree que fue injusto el castigo de tres fechas a Carlos Zambrano?,2
2342.18,1674.64,87.82,22.73,73.36,Emergencias 105 Defensa Civil 5 ud 3623277 4276904 3178000 2247777 EXALTADA,2
2167.33,1735.0,72.75,22.33,90.08,Salud Águilas Negras Escuadrón verde Luz del Sur Semanal Indecopi Enel Perú,2
2244.0,1958.75,78.5,22.0,68.0,"LA PROMOCIÓN, LLÁMENOS AL:",2
1799.82,2113.18,55.57,26.42,72.59,"Director — Contenido elaborado _ Fac 311—6353. Impreso en la Planta Dando de Empresa ... Hecho el Depósito Legal en la Biblioteca Pertodístico: —. por Empresa Editora El —— Páginaweb: Editora El Comercio S.A.Jr. Paracas r ( ¡Croggg'ga%wm dr Los artículos firmados y/o de opinión Espinosa — e TE la Victorla, ma — tro me gt rome com 105 son de exclusiva responsabilidad de Olnay — Teléfono: 311—6500. Publicidad: 708—9999, —. Prohibida su reproducción total o parcial. — sus autores.",2
307.58,614.0,61.71,24.58,85.29,© Tener contacto con tu mascota al hacerle cariño te ayudará a ganar su confianza. Sé amoroso y realizarle masajes para que el 2,20
417.28,1750.83,59.3,24.88,86.8,"u perro habla, no con palabras, sino con movi— nl o de y sonidos que te © Acostumbra a que indican algo: que tu perro tenga te ama, quiere cariño, jugar, _ horarios fijos de comi— o si tiene hambre. da y controla su peso, La etología, que estudia el — sobre todo si es glotón, comportamiento de los ani— — para evitar la peligrosa males, nos señala cómo los — obesidad. canes domésticos avisan cuando necesitan comer e incluso que la ración que le diste es insuficiente.",20
213.44,2439.33,142.28,29.67,80.33,"Envíalafotodetu mascota para que forme parte de nuestra galería. TROMEATROME.COM DIRECCIÓN: JR. JORGE SALAZAR Arsono 171 URBANIZACIÓN SANTA CATALINA, LA VICTORIA TELEFONO E",20
653.56,2228.59,53.85,25.59,87.81,"© ( E ta, soy muy despierta y juguetona. Tengo 10 meses y me encanta que me paseen en coche, hagan bailar y salir a la calle.",20
1224.83,158.5,100.83,23.5,85.83,DOMINGO & DE NOVIEMBRE DEL 2020,20
1115.08,571.08,62.85,26.46,88.46,"© Cuando pasees a tu perrito, permite que juegue con otros perros y",20
1123.6,638.4,59.6,22.8,91.4,"personas, eso lo hará más",20
1070.67,687.0,76.67,24.0,90.0,amigable. Sociabilizar es bueno para él.,20
891.5,1062.0,142.25,43.0,56.75,+LEE CON ATEN 1[0N,20
1067.11,2216.37,64.0,25.37,89.41,"© Soy Coqueta, la peque— ña de la casa. Tengo mi camita, pero duermo donde me alcance el sueño. Como todos me quieren, cualquier lugar es perfecto.",20
1852.1,530.29,72.57,24.52,89.38,© Los animales domésticos tienen una vida más corta que los humanos. Apro— fecha cada momento para disfrutar de su compañía.,20
1714.6,860.7,113.2,39.3,87.4,las señales que emite tu engreído cuando reclama por comida,20
1660.52,1267.95,58.29,23.47,90.04,"O Da vueltas en tomo a su plato o lo mira fijamente, a veces se para o echa a su lado. Cuando va una y otra vez a su plato, y lo huele o revisa sí hay algo, incluso sí lo lame en busca de rastros, te dice que tiene hambre. O Causa alboroto o tira y coge cosas para llamar la atención. Si eso sucede alrededor de la hora en que lo ali— mentas en forma habitual, te está diciendo que es hora de comer y debes hacerlo ya. Los perros tienen buena memoria. O Come lo que halla al paso. En estos casos nos encon— tramos con canes que comen tierra, papel, bolsas. Algunos hasta rascan paredes y se las ”comen” O Ingiere su excremento. Esto, que lo hace vulnerable a contraer enfermedades, es una práctica que debes evitar que se repita. O Ladra o gime, sí lo alimentas se queda calmado, pero al ratito vuelve a ladrar. Es posible que tenga hambre por— que recibió menos alimento del esperado, pero también no debes descartar que ya sabe cómo salirse con la suya y reclama para que le des de comer más y más.",20
1664.37,2150.74,81.26,30.79,87.95,"Dormilón Hermanitas © Mi nombre completo <D Nosotros somos Negra es Percival Argus Dum— y Pipa, dos gatitas que",20
1497.33,2210.33,47.17,24.67,92.83,bledo y aquí estoy en la,20
1508.33,2241.0,54.67,24.0,90.33,escalera de mi casa. Soy bas—,20
1462.0,2294.4,57.4,23.0,90.3,tante dormilón y me gusta salir a pasear al parque.,20
1853.26,2255.26,50.53,22.95,80.68,vivimos en el Callao. Aho— ra estamos todo el día en casa para protegernos del (e (e ( 0,20
2289.8,974.0,58.0,18.0,67.8,Pancho Casero s CMIP 5216,20
2195.33,1082.33,98.0,32.0,89.83,CUIDADOS DE LOS ANIMALES DE COMPANÍA,20
2254.5,1800.44,75.81,24.47,88.43,"© 1 seg a nación Colegial Veterinaria de España compartió un documen— to con recomendaciones generales sobre trata— cientos obligatorios a animales de compañía. Iniciativa que debería ser replicado en nues— tro país, sobre todo por la cantidad de animales abandonados y callejeros que existen en el Perú, los que podrían desenca— denar una epidemia. Este documento estable— ce cuatro prioridades: la vacunación antirrábica, que debería ser anual; la identificación, esen— cual y fundamental para concientizar sobre la tenencia responsable y evitar el abandono; así como el chequeo anual completo, oportunidad ue a los propietarios sobre medidas que contribui— rán a una convivencia segura a nivel sanita— rio, y la desparasitación, recomendación común en todos los animales de compañía, que es una medida preventiva de bajo costo, eficaz contra",20
1289.83,160.67,106.33,23.33,90.33,DOMINGO 8 DE NOVIEMBRE DEL 2020,21
591.56,393.11,247.56,86.22,78.0,Cómo utilizar uma mascarilla de forma correcta y segura,21
531.88,576.35,95.18,32.59,83.53,Mantenga la distancia social y lávese blen las manos con frecuencia. Incluso si lleva la mascarilla puesta.,21
798.85,1417.82,53.53,26.15,74.68,Sujeta ambas tiras de la mascarilla y colócatela. e d ( paso para M La más popular en %ot:etgg¿:1rtlaal A E pero debemos estar atentos al proveedor r es I ea tiras para colocártela.,21
350.28,2096.67,50.83,24.22,90.5,No le des importancia a los diseños de moda si no cumplen la función principal que es protegerte.,21
1806.74,1804.31,50.18,23.95,88.56,”No sé si la persona al lado mío tiene un hijo batallando con el cáncer o cuida a su mamá adulta mayor. ”No sé si tengo Covid—19 y sabemos que las personas transmiten la enfermedad antes de los síntomas”.,21
1285.0,2541.29,55.35,23.74,88.39,"Si estás usando una mascarilla casera, asegúrate de guardarla en una bolsa cuando la dejes de utilizar. Recuerda que la puedes lavar con agua caliente. Hazlo a diario si es posible.",21
1891.16,886.8,56.32,26.88,82.72,Revisa que siempre esté bien puesta Cubre todo el E Ponte bien la mascarilla. No te la en la barbilla. E ee a la nariz.,21
2242.16,1895.35,48.52,24.32,82.1,"Protege al que la utiliza, pero no a los demás, porque filtra las partículas del aire cuando inhalas, pero permite el escape de partículas cuando exhalas y E a ta el",21
2461.4,2291.8,23.6,52.4,63.4,(DC/ Infografías César Mauricio Trome.,21
1834.6,612.0,123.2,51.65,46.0,"IE%*L©©U —/A¡I© IP&©IF% TODOS ADORA ¿JUGAII©FW”3 GUY ISIS GLITNIR DISGUSTADOS [ ik ASN(QLU[E [F F%7AÍNINY N nl IESFo©SA,, (GOMO LLEVA",22
2206.21,1981.87,217.49,35.38,54.38,"X)(uapa (extrmvent¡da3y A /Alexandra[Mendez .. lNambodelowenezala— | hama 3ylhmy talejadatdellosrefles: ttores; (ex¡ste|una|pensmna(espec¡al(cmnu qu1enít[enelunalreIac¡mn abier— [ IE5'0(S]I(eIIa(deja(en(clarm(quelnm (es1de1[as¡mu1eres(que15alen(con (daddy.. (eeny¿quíenxeslllexanúa'»? LUna[pensmna¡superífam1har tsin— (amm(estarxen(easa3y |mmítexdéñím'em(eamm|p'ens,a)n'a',lmay(qu1enesap1ensan(que]pmrque1mues— inímerdatisa: (trabajabias? lEstud[abalDerechmxyltraba1a— lba(cmmmfaSesora1deílmagen(enIla| |mejmrítlenda(delmmda(en¡Vene— auela, Chino Nacho; Ias*¡m¡sses e (esjah[(dmnde(cmmen— ¿Noterestdallastchicasiquella í9ustmllasfío;$x&á') Puedmxsal¡r(emuna(mcas¡mn ¡pero",22
1102.6,152.0,267.0,185.0,41.2,|s varada [eS [SL (dall,23
225.94,1997.58,61.2,24.01,88.38,"vaditos', prefiero estar en casa. ¿Es cierto que estás enamorada (de Chris Denha)? Conocí a una persona en la boda de Laura Spoya, lo quiero, lo res— peto, nos vemos, hablamos todo el día, nos hemos ido de viaje y ahora tenemos un paseo planificado por su cumpleaños. Su familia me adora y yo a ellos, conozco a sus amigos, pero soy una persona ”abierta' con él, en el sentido de que no tenemos nada formal, pero existe una rela— ción ”abierta' por la distancia. Cuido mucho a las personas que quiero porque hay mucha maldad. ¿Es cierto que es un mexicano 2 Es estadounidense y para mí es un chico normal y corriente, no le he visto la cuenta (del banco). Traba— a muchisimo, tiene su franquicia de donuts y negocios familiares. ¿Qué faltaría para o fic icl izar No soy capaz de renunciar a la vida que tengo aquí para irme a otro país. Cuando eres una mujer inde— pendiente es bien complicado, si fuera otra quizás ya me hubiera ido y estuviera viviendo como reina, pero no soy interesada. Tengo mis planes y prioriza mi vida. ¿Hay chicas que le han ”echado ojo”' a Chris? Le han escrito al Instagram, no sé si serán personas conocidas, pero él",23
956.97,1500.03,126.91,36.12,81.15,"ACTUALMENTE TIENE UNA RELACIÓN ABIERTA: CON UN JOVEN EMPRESARIO ESTADOUNIDENSE QUE LA HARÍA VIVIR COMO ”REINA”, PERO ”NO SOY INTERESADA'. ACLARA QUE JAMAS TUVO UN ”SUGAR DADDY PORQUE TRABAJA PARA DARSE SUS GUSTOS.",23
720.47,2158.48,66.72,24.09,87.56,"no contesta. Igual, si él responde, es su decisión, no soy nada celosa. Nos queremos mucho, pero si mañana conozco a una persona, normal. Los te deben llover, en especial los ”peloteros'... Tengo amigos, conversamos, hay muchos jugadores internacionales que me escriben y mandan flores. No cierro las puertas de mi corazón hasta que tenga a una persona. ¿Uno de esos fans es Cristiano Ronaldo? Cuando vivía en Europa me escribía, me llevó entradas para ver el parti— do del Real Madrid y 'cool”. Digamos que ahorita el Real Madrid me quie— A i ¿Siguen siendo amigos? No hablamos más, tengo su Whats— App, pero él tiene su esposa y no tengo nada que hablar con él. ¿Podemos saber el nombre de algún admirador? No te puedo decir porque no me gustaría dañar la amistad, pero son personas importantes que juegan en equipos súper buenos. Por cierto,",23
1214.86,2155.6,58.36,23.47,88.15,"no es Neymar, nada que ver con él. A 1 2 Los jugadores de Perú, después de mi de la verdad, donde man— dé a volar a todos, nunca tuve nada con ellos, creo que ya se dieron por vencidos. No me escriben y tampo— co me importa que me escriban. En esa ocasión, mencionaste a Jefferson Farfán, Paolo Guerre— ro, Christian Cueva... Varios, el peor de todos fue Cueva. No me caen mal, solo que no com— parto su pensamiento, su manera de ser, sí tienes mujer o esposa tie— nes que respetar. No soy de las mujeres que se meten con hombres casados o comprometidos. ¿Luis Advíncula te ha invitado a algún viajecito? ijJamás! Lo he visto en Barranco Bar, pero no estoy en su círculo y me parece que es un chico súper bien, caballero, nunca se ha expresado mal de nadie. ¿Jean Deja te ha escrito? No lo conozco. El que me escri— be siempre y me tiene harta es el",23
1709.57,1734.42,60.62,24.75,88.69,"”Churrito”. Lo he bloqueado de todos lados, no lo conozco ni lo quiero conocer. ¿El mismo que estuvo con Chris Sofer y Yahora Plasencia? He escuchado algo así, pero no entiendo cuál es la necedad. ¿Y qué te dice el 'Churrito”? Antes me escribía al Facebook y me decía cosas. Hace poco vi que me escribió al Instagram y quedó total— mente declinado su solicitud de mensaje. ¿No es tu tipo de hombre? Imagínate... está en el mismo saco de Cueva, aunque el no es casado y puede escribirle a la chi— ca que quiera, pero el otro es un descarado. Del 1 al 10, ¿qué tal besa Paolo Guerrero?",23
1699.99,2341.66,56.87,23.57,87.09,"la, ja, ja, ya ni me acuerdo. La ver— dad que no fue importante para mí, pero lo que sí recuerdo es que era una persona educada y chévere. ¿Jefferson te ha invitado nueva— mente a su'búnker'? Por todo lo que salió me agarró bronca y creo que hasta ahora me tiene bloqueada del Instagram. La verdad, no creo que ningún futbolis— ta peruano me escriba después de e i a ¿Has tenido un daddy'? Jamás van a decir que me han vis— to con un ”sugar daddy”, un 'peche” o algo así.",23
2209.18,1996.66,59.82,23.92,88.07,"¿Te han ofrecido dinero a cambio de ”compañía”? Hay una chica que me escribe varias veces (para 'acompañar'), hasta personas que uno conoce y pien— sa que son amigos y te dicen: te pago mil dólares y te vas a cenar con tal. Sé que hay personas que sí lo hacen, pero yo no soy de ese tipo. Hablando de otro tema, hemos visto que estás rayando' con tu ”<Oriyfans”... La verdad, estoy muy agradeci— da con la gente que se suscribe, siempre me conecto a mi cuen— ta y les respondo personalmente a todos. Estoy trabajando con un gran equipo, invierto mucho en mís producciones y este mes se viene contenido un poquito más calien— te. Me ha ido súper bien, el neto (ganancia) de este mes fue 11 mil y algo de dólares. ¿Cómo te proyectas en diez años? La televisión la veo como un ”hobby”, para mí lo primordial es tener esta— bilidad, salir adelante con mis marcas. Tengo un negocio con mi exnovio en Venezuela y hace unos minutos estaba coordinan— do el tema de las fajas que traigo de Colombia. En un futuro me gusta— ría casarme y tener tres hijos, tengo 27 años, estoy muy joven, la vida recién empieza, así que para ade—",23
181.0,355.5,66.5,31.0,82.0,Con ”Los del show',24
387.39,978.49,62.35,24.91,86.54,"€9 La candidata a 'Miss Perú', Lesly Reyna, debutar en la con— succión con el programa 'Los espías del show”, que irá todos los jueves por 'Crea ”Estoy feliz porque voy a conducir un pro— grama que saldrá por redes y se llamará ”Los espías del show'. Me parece un pro— recto bien lindo, además la gente lo que más ve actualmente son las redes. Será un magan e informaremos de distintos temas y también busco entrete— ner al público”, expresó Reyna. [L Gamarra) o",24
305.7,1586.4,62.0,27.3,88.9,© El actor Nikko Ponce lan— z la segunda temporada,24
313.36,1672.5,68.5,25.5,84.57,"de su programa de viajes ”Peruaneando”, que difunde _ en sus redes sociales. lanzó",24
349.74,1841.33,73.33,27.13,82.1,"”Empecé la segunda tempo— Segunda rada con un especial sobre _ temporada Máscara y como se vienen — 0£ reactivado todas las acti— _ vidas turísticas, luego mostraré los atractivos de Oxapampa, Pozuzo, Chiclayo, Cus— co”, comentó. [E.C.) o",24
1224.83,158.5,100.83,23.5,91.0,DOMINGO 8 DE NOVIEMBRE DEL 2020,24
1262.33,451.0,69.11,22.78,90.11,aura Apoya envió su total solidaridad a Tefi' Valenzue—,24
1229.8,502.4,68.2,24.4,90.6,"la, tras haber sido masacrada",24
1232.4,535.6,59.6,23.0,91.4,"or el actor Eleazar Gómez,",24
1509.38,608.31,97.69,38.08,51.08,p ii t ss a ls do en unpenal de —. Al sufrir violen— eo,24
1315.52,924.31,51.29,23.93,87.86,"cia psicologica a tóxica, una está metida en eso y ni siquiera lo sabe. En los casos de vio— encia física, todo el mundo le dice a las víctimas *por qué no lo dejaste a la pri— pero el agresor se hace",24
1674.75,792.0,45.25,38.0,35.5,i e i a,24
1628.06,958.24,57.29,23.82,87.65,"ie dijo Torres y anun— dió el estreno, para este 14 de noviembre, de su programa radial",24
1372.81,1154.38,58.12,23.62,87.34,la víctima y con— ”Sin tapabocas” vence a la mujer que será porque la tie— marinado ne dominada. por la actriz Lucía Es lamenta— Méndez. ble todo lo que ”DE ESTA ME,24
1172.45,1653.18,60.77,24.09,90.58,"está pasando, no sabemos si tuvo aler— tas sobre esto, pero mi total solidari— dad con ella”, añadió. Por otro lado, el pro— ductor teatral Richard Torres contó que en el 2017 trabajó con Eleazar Gómez y siempre le pareció un tipo extraño. ”Con él trabajé en la realización de un videoclip en Acapulco y siem— pre me pareció un tipo extraño, diría que hasta con pro— lemas mentales. Me da pena lo que está viviendo Stephanie, todo",24
1084.18,2467.26,55.12,23.62,88.03,"La periodista Car— la Tello contó que ya tiene novio y está atrave— dando un buen momento e! ”Sí, tengo novio. Lo que me gustó de él es que es un hombre muy confia—",24
1584.5,2146.5,58.25,29.5,90.25,cuenta que lo que,24
1778.79,1557.44,64.31,23.64,89.89,"En tanto, 'Tefi' en sus redes socia— les agradeció el apoyo que le han brindado. ”Gracias Gloria Trevi, soy una mujer fuerte y sé que de esta me levanto”, A su vez, medios mexicanos informa— ron que Eleazar Gómez debió rendir ayer su manifestación en el reclusory don— de permanecerá detenido dos meses, en el área de prevención, mientras se investiga su caso. Trascendió que la pena por el car— go de ”violencia familiar' con el que está denunciado tiene una san— ción de 6 meses a 4 años de prisión y recibiría tratamiento psicológico especializado. (C. Chévez)",24
1875.8,1949.07,34.27,34.27,41.47,e iii e s i 2 : 5 u| IPO a p en ds a,24
1585.25,2176.0,50.75,32.0,89.75,más le gustó de,24
1848.25,2177.0,59.25,22.5,90.0,Tello se casó sorpre—,24
1791.42,2260.5,67.79,26.92,79.5,"2 vivamente en abril del hombre positivo, 2019 con el actor Junior inteligente y _ Silva, conocido como cariñoso _ 'Pollo gordo', en Las",24
1874.0,2341.5,65.0,25.5,92.25,"Vegas, pero la relación",24
1718.25,2474.83,64.25,25.33,81.28,"( E et solo duró seis meses. perseveran— £ te, positivo, estado que espera inteligente y que se cumplan los dos cariñoso”, fue el años de matri— comentario de mono para la conductora de l ea",24
2255.89,758.73,62.03,23.82,83.39,A embalada para con— tardes las últimas de *Chollywood”... YALLA BLUSA regresó al Perú después de un año que estuvo sin ver a su fami— lia y posteó que los extrañaba mucho. Man— ya... GISELA VALCÁRCEL subió un video a su cuen— ta de Instagram en el que se le vio recibiendo tra— amiento por un desga— a a T que tuvo en Fuerza... MATHIAS ALIVIO,24
2235.77,1891.96,66.48,24.16,85.97,"conducirá E magan por Lati— diría con *La banda del Chino'”. Asuuu... NICOLA PORELLA estuvo ayer como invitado en 'Estás en todas' y de inmediato se convirtió en tenden— cia en las redes sociales, pues cuestionaban su regreso. Ayayayyy... A propo, HATALIEVER— lo ”cuadró', pues el guerrero le dijo que era una buena reemplazan— te (de SELVA ROJAS) y la ex Miss Perú afirmó: reemplazo a nadie, yo brillo con luz propia”. Chúpate esa... RA jura que no tiene ningún resen— pimiento con ESPINOZA, ya que su bronca pasó hace más de dos años y ya volteó la página. Esteee... Soy fuga porque a mi amorci— to le he puesto orden de ina— movilidad y ue para nada... Suuuaaaveee.",24
1311.33,160.67,85.0,23.33,79.0,GO 8 DE NOVIEMBRE DEL 2020,25
1320.11,458.67,59.22,24.67,75.67,"3 e ds da porque su guapa hija, Anne",25
908.5,718.56,68.39,28.18,81.38,"=91 PI¿1 _ Thorsen, participará en el 'Miss Teen tola Killanin revelé tres meses — Perú' — €9 Daniela C|I!oplz reveló que *” medio de ""Vererqos Ell desempeno, a se convertirá en madre por embarazo una chica muy estudiosa, excelente tercera vez, fruto de su relación con su pareja Luis | ta hija y, si quiere participar, la apoyaré Miguel. t > ría en todo”, mencionó Vela. que ”Ya tengo tres meses y medio, siempre soñé con que Sea Eres su sinnúmero uno, aun— es estud¡o%a tener varios hijos, pero después de este bebé me Ratoncito — quetambiéndebetenermu— ligo, porque ya estoy tía”, dijo Cilloniz. chosfans... y apoyara Tienes dos mujercitas, ¿tegustaría el varoncito? Sí. No me considero una mamá celosa, en concurso Sí, pero que sea lo que Dios quiera. Lo más importante es que pero igual la cuido mucho porque ahora se M|5? a nazca sanito. (L. Gamarra) ve de todo. (L. Gamarra) y la eal JIJUVAJNVAMAJ P /AMIR%I& lA / |el INO",25
982.8,1438.65,68.75,26.3,85.55,"—L ', _I juliana Barrios dijo que Yahora Pla— esencia solo buscaría promocionar el lanzamiento de su nuevo tema al",25
