left,top,width,height,conf,text,page
1191.0,874.33,75.5,34.33,90.0,No te quedes visitando mucho tiempo.,30
1181.2,1746.4,79.8,30.8,91.4,No compartas platos ni cubiertos.,30
1547.5,351.0,132.25,53.0,60.75,EL GABINETE D QUIJOTE',30
1970.09,1577.97,66.9,24.47,89.01,"rr Rico POR:ELBÚHO IW ste Búho analiza la composición del gabinete de Francisco Sacaste y comparto la extrañeza de muchos, pues al ver algunos nombres de sus ministros de Estado podemos advertir que no encarnan lo que prome— ti y enfatizó en su discurso de asunción de mando: ”Este gobierno de transición será un gobierno pluraP. Tenemos que decir que no hay que ser un brillante analista para darse cuenta de que empezó su mandato con una primera mentira. Un gabinete ”plural”, de 'consenso”, como reclamaba todo el país, después del ”golpe' de Merano y su gabinete conservador del jurásico Entero Flores—Aráoz, tenía que haber convocado a personalidades destaca— das en sus profesiones, con probado compromiso con el país y de distintas simpatías. Me parece que no lo hizo. Mucho se le compara a Sacaste con Va— tontín Paniagua, pero por sus primeras acciones ha actuado en forma opues— ta. al igual que el nuevo mandatario (Partido Morado), provenía de una bancada minoritaria como Acción Popular y eran varios los partidos que habían luchado en la calle y en el Congreso una década para tumbarse a un fuji mori smo comupto. Al ser elegido presiente, en el 2000, hubiera sido suicida nombrar premier a un accio populist a o cercano a su partido. Por eso convocó a un gran demócrata como Javier Prez de Cuéllar, una de las pocas personas para lograr un consenso en esas horas dramáticas. Igual nombró a personalidades representativas cercanas a las distintas fuerzas políticas que combatieron al fuji mori smo, como Javier Silva Ríete [Economía), Marcial Ru— bio (Educación), Antonio Keten Vidal [Interior], el policía que jefatura el Gein que capturó a Abigael Guzmán; o técnicos como Juan o Car— los Amat y León. Muchos ni se conocían ni conocían a Paniagua, pero eran destacados en sus respectivas ramas, no fueron llamados por amiguito o camiseta política. Sacaste no imitó a y me temo que ha conformado un gabinete con viejas amistades de su dilatado paso por las ONG. La calle no tumbó a Merino y su apócrifo gabinete para que los ministerios los copen los amigos del pre— siente y los amigos de los amigos de Sacaste. Este columnista lo advirti un día antes de que asumiera el mando: ”El nuevo régimen no debe cometer el error de Pizarra de querer gobernar con un premier y gabinete opacos que no le hagan sombra. Lo peor sería dirigir al país con los amigotes de la argolla...”. Pienso que ahora corre el riesgo que este gabinete termine sien— do un club de viejos conocidos en los que todos piensan igual y ante los pro— blemas, crisis y conflictos, se brindarán y dirán: ”los malos están afuera”. La Presidencia del Consejo de Ministros puede convertirse en una burbuja ajena a la teórica situación política y social que se vivirá una vez que pase la anes— tenia de la caída de Merino y los golpistas. Mucho se habló que le aconsejaron a Sacaste apostar por un premier experimentado y con un respeto ganado en todas las tiendas políticas, incluso se habría mencionado al exprimir Allan Wagner, para que contribuya a abrir un necesario mínimo entendimiento con los partidos del Congreso derrotados en esta coyuntura, y que están con la sangre en el ojo, al acecho para tumbarse ministros, pero el nuevo presiente optó por Bermúdez. es conocida en los ámbitos académicos, ONG y la izquierda, pero desconocida para el grueso del espectro político nacional y menos para la ciudadanía. Este columnista también percibe que este gabi— nete, en lugar de buscar 'consensos”, del saque ya produjo fisuras innecesarias. Militares y policías se sienten incómodos con los nuevos nombramientos. En las Fuerzas Armadas, de impecable comportamiento para preservar el orden constitucional en los dos últimos intentos de vagancia presidencial, espera— ban que uno de los suyos sea ministro de Defensa. En la Policía se cocina un polvorín. El nombrar a un abogado, viceministro de la época de PPK, para que haga el papel de odioso investigador de 'asuntos internos' no cayó nada bien en la institución. No olvidemos que el ministro del Interior tiene la tremenda responsabilidad de encabezar la lucha contra el principal flagelo de nuestra so— ciedad: la inseguridad ciudadana. Sé de buena fuente que hay una gran in— donación en el seno de la Policía, pues se sienten humillados por algunos ”intelectuales de café' que no están en la calle para combatir a peligrosos ”marcas' y ”raqueteros' que disparan a matar. Durante la pandemia, eran los héroes del país, ahora son los ”asesinos' Mucho cuidado. Apago el televisor.",30
1285.5,160.33,107.17,23.67,89.17,VIERNES 20 DE NOVIEMBRE DEL 2020,31
1138.71,502.57,74.26,23.65,89.25,"... RODOLFO (45).— Estimada docto— *& ra Carmen, me atrevo a escribirle porque he tenido muy mala suerte en el amor y espero que esto cambie. Siento que me falta una nueva ilusión para florecer y ver de otra manera la vida. En mis antiguas relaciones me han pagado mal y creo que eso me ha marcado. Por ello, le escribo porque espero que, a través de su columna, pueda encontrar a la mujer que me ayude en mi camino a la felicidad. Solo pido que sea sincera, honesta y cari— ñosa. Me pueden envíar un correo a: branco85©hotmail.es. Estaré muy atento.",31
1789.38,557.54,144.23,40.54,51.08,m:Loscaminosdelamor — sonmuvindeños.peronodepgggsr derlases.peranzas…l&ntesde¡muéhas debespensarengSa y ea a a a las — me¡oraryenelíutmotenerun,31
695.15,838.92,109.62,33.23,71.77,"CARTAS: Jr. Jorge Salazar Arroz 171, tercer piso, Lima 13. _ MAlL: doctoracarmen01©trome.com",31
487.21,1069.29,58.43,24.71,79.96,”Amable'. De origen griego. Es una mujer muy emotiva y sensible. En el aspecto sentimental le cuesta mucho l d j en personas que se acercan a ella.,31
415.79,1929.34,25.6,28.08,77.64,D D T D E |— P Ro E F R S N O N A G | C C M O D R C D Z P V L A Q M E E F A Z U S C [| V N F 1 A | C N A O G B E Z A V U 1 E N S F J E T S T D L D E N A O E B A A F Z S U C G 0 — l E Ro E N Ro L R S M U P P N F H Y M U V Z V A S D A Z D K E R 0 M M ES UN ROMPECABEZAS — <INVENTADO e e PROFESOR,31
982.2,1101.6,55.8,27.8,58.2,| e a a por,31
757.67,1888.67,24.44,28.0,84.56,m » n O > O 4 m n z 4 C m n o < o o,31
1263.11,992.07,87.3,29.85,71.07,"SABÍAS QUE—. &UN DÍA COMO HOY © e d 2004 FE A.<_mones, ellos respiran por La surfista peruana na Sofía Mulánovich se ee ul consagró como campeona",31
1588.0,1105.5,49.25,22.5,92.5,mundial de tabla en,31
1395.26,1874.07,28.6,30.52,68.68,"e ee a e ea e ”” EL CUBO DE RUBIA A Z D | ] D PA PA ] N D F A T R be = D PA ] | be S D D S Ro C F A o | el D R S |) E — F E — E = C o ] = PA U T D N N T o | A* yÁ U yÁ [€] E Ro U L | = PA = D PA = T M D l | | D S y D e A Re | = R D — A C PA y S O — F A N | = o] Y — C = AA U T A D E a = U C R D o | N V E K N P 5) | | PA E N M 1 M E A U D R D PA O V Z B A— T M N R PA y PA F Ro V U Ro D = | PA = M F A Z R A! O — N D = M R F G R O S D U D D | S X B D G N H | | o R = ) | K — R e . | C Xy Xy R | D | = <NOVECIENTOS ©HÚNGARO DEL JUGUETE RUBIA, EN MIL _ <>ES CONSIDERADO MÁS VENDIDO",31
2245.39,386.22,68.39,24.0,79.22,e o %hARIES: Esunbuenmomento ? para dejar atrás los malos momentos y dar un salto profe— sional. Hazlo.,31
2257.42,536.42,77.33,26.5,79.58,"._%-mum: Opinión es muy a rodean, da el ejemplo. Recibirás algo agradable.",31
2278.27,664.8,63.4,24.47,85.67,". GEMINIS: Siempre hay posi— <bilidades de estar mejor, es importante mantener la fe.Cuida l",31
2270.35,813.59,61.53,22.41,76.29,CÁNCER: Cualquier cosa : *: que digas o hagas tendrá sus consecuencias. Rodéame de dd ie =,31
2249.29,947.76,61.57,26.38,75.62,"'?o,¿í LEO: A veces te presionas *. demasiado y eso no permite quedas casaste salgan bien. Res— pira hondo y relájate,",31
2265.48,1171.52,73.32,27.03,80.97,"” Si te esfuerzas, verás que todo lo que consigasten— drámásvalor. Prepárate parados LIBRA: Una persona espe— 3.cial podría volver a tu v¡%%. No hagas caso a malos comen— tarios. Chequea tu salud.",31
2247.81,1363.48,61.33,24.14,81.24,"* , *ESCORPIO: Estás en una : < etapa de cambios, debes adaptarte. En el campo senti— mental, surgen dudas ytemores.",31
2228.18,1518.24,65.41,23.53,81.53,"¿¡á:,'¿smlmmo= ** >* obstáculos en tu trabajo que debes superar. Capacidad te lo permitirá. No te rindas.",31
2248.46,1650.08,94.92,29.92,69.08,"CAPRICORNIO:En el amarte llevarásunalinda sorpresa, (s la ei calma y piensa en positivo.",31
2237.53,1778.73,81.6,27.33,78.47,"”3 ACUARIO: Recibirás una “x|pro esta muy interesante, analizarla bien. Esos malestares serán pasajeros. Avanza.",31
2259.22,1889.22,50.56,32.11,66.78,"_QAx… a el d “;—aD zar las situaciones, pueden",31
2273.29,1931.86,49.29,32.14,91.57,resultar peor de lo que se espera.,31
953.33,156.78,92.89,29.78,77.33,32 (AVISO) _ VIERNES 20 DE NOVIEMBRE DEL 2020,32
1329.14,1421.14,86.57,26.71,74.14,Pmc¡ozomtwjetn Precuamsm… Precioso sin tarjeto: s/ 8.99,32
1090.6,1490.25,74.8,26.75,89.5,COTTUS COTTUS PRECIO UNO PANTEÓN BOLSA X 900 G CAJA DE PANTEÓN X 6 UN PANTEÓN BOLSA X 900 G,32
2165.67,1481.56,96.33,24.78,86.67,Preuazomtunm:/49” PRECIO UNO CAJA PANTEÓN BOLSA X 6 UN,32
1184.38,1777.38,115.12,56.0,53.25,es eo o /1590 s&> ”15% A /1550,32
1236.54,1931.15,63.5,19.15,79.04,»umn…mumoo Preciada sin tan eta s/ 1690 ' l …n……;/1&50 BIMBO BLANCA FLOR PANTEÓN BOLSA X 800 G PANTEÓN BOLSA X 900 G PANTEÓN BOLSA X 900 G,32
180.9,1381.2,15.1,51.4,78.9,"”PRECIO EXCLUSIVO CON CMR, Stock: 100 un a nivel nacional.",32
2253.71,1941.14,79.71,18.86,85.86,…mmpm.5/2].” GLORIA PANTEÓN BOLSA X 900 G,32
2120.5,2110.0,103.25,21.25,73.25,PRECIADOS EN i TOTTUS.COM,32
1760.75,2336.75,34.5,29.75,57.25,sin torjeta: s/ 2490,32
1378.94,2386.65,58.0,18.41,88.94,TOCINO PANTEÓN x 900 a BAUDUCCO + TODINNITO CAJA X 100 G PANTEÓN CAJA X 908 G,32
843.33,2409.17,42.17,17.67,86.0,PANTEÓN BOLSA X 900 G I,32
1229.62,2513.69,38.96,12.68,72.35,"TEA Máxima Referencia 125.23% k¡.mp¡n: Consumo S/ 1000 p aro 1? meses, con envía mutua de estado ae cuenta mensua: mempres'a cual tarjeta CMA seguro S 6 pera pago atrasado. ño 360 dias, Acabe a las tarjetas CVA Mempres'as varian por tpo ee taota, ver Pantano de nuestras Tarjetas CMA en y Aagencias Condiciones: V agencia el 20 al ?? de noviempre se 2070 o hasta agotar stock en Cottus y Cottus.com. Ofertas ro válidas en Titus N Callo /, la Fontara, Comandante Espnar, Vita €: Savados, Arequipa Para, Chiclayo l eguía, Careto, Coincha, Av Central, Ser Chiclayo Belurdo, y | cra, Pacasmayo, Huanuco, Casamarca Huacho, Chepér. n. lom.s Super Chiclayo San Jose, luslagos. Próceres, Campay. /om'os, Centro, y Curso Precios para consumo ”am har y/o hasta agotar Precios mo con otras promosiores. Shock fisgón o e 10 un por producto de no en toda la cadena, Máx mo 6 unidades por persona por producto. Fotos reterenciaes, Para las ofertas excusas con CMA 6 un por tpo de producto por maceta por la viagencia del 20 al 22 de ron empre de 2020 Descuentos y promociones no aplicables a CVA Visa Basica, d fundida de acuerdo a de Gestión de Conducta de Mercado verte",32
343.0,909.05,40.24,26.62,48.33,"sr e ¡omn|¡omtoxs¡, la xa d mne se ea ell a ta ea be ss a st es (ut¿/*(iur— s o",4
261.8,2252.12,69.09,25.19,87.65,"(D Oficinas de la pro— doctora 'Butaca Live”, donde artistas como Daniela Harcourt y Yahai— ra Presencia han realizado conciertos virtuales, fueron asaltadas por delincuen— tes que se llevaron equipos musicales por un valor superior a los 150 mil soles, ei e Aprovechando que no había gente el domin— go, los ladrones llegaron al local, ubicado en la cua— dra 39 de la avenida Paseo de la República. ”Robaron cámaras de video y foto, parlantes, Iaptops. computadoras y memorias”, dijo el encargado Alfredo D|",4
662.64,1060.36,34.0,26.0,50.27,"ea, ell ee es d [ [E) y 2 [IÍ o",4
651.8,1651.2,47.4,33.2,63.6,Policías del © la ey,4
644.22,2228.46,66.75,24.56,86.87,"de Emergencia Te delincuen— te, luego que robó una moder— en Comas. Tras varias cua— días de perse— cución, detu— a do Vargas Oré [24), 'Fer”, frente al local Tres Ruedas en la avenida Panamericana Norte. Cuenta con ante— clientes policiales por robo agravado y estuvo preso por el mismo deli— to. Se dedicaría a robar camionetas para luego desmantelarlas. (M. Flo— res)",4
1222.83,158.67,101.5,23.33,91.17,VIERNES 20 DE NOVIEMBRE DEL 2020,4
1685.67,196.22,126.0,39.22,87.78,LOS ATACARON SIN PIEDAD Y LES DISPARARON 18 BALAZOS,4
992.3,1282.62,174.24,30.58,71.94,"lapuertadesuca— sa,alaqueacaba— bandellegarlue— odetrabajarco— moc hofer y cobrado r de un bus de la empresa de transportes ElChino,dos primos fueron asesinado s de18balazos por sica rios que sedes plaza ban en una motolineal,enSanta Ani— ta.Lospistolerosnoselle— varondinero, por lo que se presumequesetrataríade unajustedecuentas. MiguelAngel LedesmaBu— leje(36), quelaborabaco— moconductor, yRafielNoé LedesmaCuri (48), queseen— cargabadeco— brarpasajes, habíanllega— doenunau— toKiaalcru— cedelaave— nidaJuan Ve— lascoAlvara— doconeljirón ManuelUgar— teche,cerca del puenteNo— chet o de la Vía deEvitamiento. Granjas 10delanoche del miércoles y, aparen— temente,todoestaba tranquiloenelbarrio. ”Seestacionaron y cuando estaban sen— tados, antesdebajar, llegaronlosdossi— carios. Unodeellos, concascoenlaca— Deza, seacercóaRa— fiel que estaba en el asientodecopiloto, y ledisparócomodiez veces”.contóunfa— militar Sudecesofue enelacto. MiguelAngel, que ibaalvolante,corrióva— riosmetros, perofueal—",4
995.43,2390.86,171.71,56.86,76.29,Chapa a ”Los Marcas de Aviación' ©,4
1063.6,2592.8,56.2,24.1,88.4,"cerca de dos bancos, inte— grandes de 'Los Marcas de",4
1537.0,645.7,56.6,27.17,87.43,"73 intentó huir corriendo, pero fue alcanzado por los sicarios, tienes lo acribillaron de 8 alazos. Las víctimas eran chofer y cobrador de un bus de la empresa ”El Chino”.",4
1551.0,848.0,98.4,26.0,78.8,DE LA EMPRESA EL CHINO,4
1732.5,1354.0,318.75,28.0,67.75,"PERRITOVALIENTE Alescucharlosdisparos, Viejo,elperritodelafami— lia,corriótrasunodelos",4
1460.33,1330.33,146.67,33.0,81.83,"cansado porlasbalas. ”Le dispararon como ocho Murió lapista”,",4
1918.62,2334.5,54.5,24.88,63.38,*Cachaco' fue— E E i de las agencias,4
1681.0,2409.33,72.5,23.33,85.67,"Aviación”, entre ellos Scotiabank e Inter—",4
1680.56,2518.65,59.53,25.59,79.29,"una mujer, fueron bank, ubicadas en la detenidos, en San esquina de las ave— vidas Aviación y Esther Terrones Soto — San Borda Norte. (47), 'Chata!, y César e a rA E robos también",4
2253.94,339.81,48.1,27.03,87.61,"1| — Los primos llegaron en carro a su casa y tras ellos dos sicarios. Rafael Edema que iba en el asiento del copiloto murió Bgtl)ducto de 10 disparos de la,",4
2214.97,1560.0,152.94,31.62,72.12,"pistoleros, pero poco pudo hacer. ”Al parecer, hubo un tercer sujeto, pero eso es materia deinvestigación”, preciso inefectivo policial.Losase— sino huyeron porlaaveni— da para le la a la VíadeEvita— Segúnlosdeudos, Rafael Ledesmaera padredecua— trocitos y Miguel Angelde— jatrespequeñosenlaorfan— dad. Detectivesdel Depin— cri del distrito investigan el móvildeldoblecrimen. _ 0",4
2287.86,2439.3,66.56,26.0,80.19,"detuvieron a Julio Rodríguez Chinga (53), ”Sano', Orlando Gutierrez Vargas (49), 'Cholo Matón”, y Pedro Savick Delga— do (45), 'Canas” Estaban en dos moder— nos autos, donde había envoltorios de droga. A ”Cachaco, los agentes le encontraron una pistola. (E. Cirilo) — ©",4
370.54,936.31,101.69,64.85,50.38,"—_) )Z, N , , y W ¿2 (> 5 ENEDLELOSID EVANIA BO",6
1222.83,158.33,101.5,23.67,91.17,VIERNES 20 DE NOVIEMBRE DEL 2020,6
1739.0,284.83,96.17,23.17,75.33,ganador pe $/500 peL pia 19/11/20,6
1263.36,748.04,91.98,25.32,73.98,nuestros lectores nos han llevado a seres diario de mayorcircu— nación en todo el Pe— rú y lesagradecemosregalan— do dinero en efectivo todos podías del año. Ya no fal— ta casi nada para que llegue el domingo yeso signifique la SúperLlamada Ganadora sortea.— rá los 5 mil soles calientitos del 'Reven— tan semanal”. Nola hagas más larga einscríbetellaman—,6
1075.5,1128.0,123.0,23.5,87.0,PARA LA GENTE TRABAJADORA,6
1710.54,359.46,53.0,17.23,87.38,NOMBRE: ANA SAUCED DISTRITO: LOS OLIVOS No DE LA SUERTE: 4052209 El 5,6
2010.83,493.33,108.0,40.67,83.33,HACE MÁS DE 19 ANOS REGALAMOS,6
1809.21,837.21,105.69,26.48,78.97,"doal710—02600 mediante nuestra web (trome.pe). Pue— des hacerlo desde las6delamañana castañas 4 dela tarde. Registrate númerodela suerte'(apare— creen la parte supe— rodela portada), DNI y teléfono fi— joy/ocelular. A",6
2214.7,831.74,90.92,25.16,76.52,"lastre la tardeseconocerá el nombre del ganador. Y para detengas másopcio— nes llevarte este billetón, concursar los diarios que ha— yan sido anotados del lunes 16 domingo 22 noviembre. PASAPORCAJA Ayer, jueves 19 noviembre el premio de 500 soles contan— test sonantesfuepara: Ana Sauced (4062209, de Los Oli— 3 o",6
275.86,1486.67,52.43,26.05,38.1,"negro es ni 3 ss os e o a of a os l en ese el la! teni io jen fr 13 fnvezstoss,",6
645.83,1353.83,38.83,20.5,36.83,[Aurerites sra ei na d ie,6
763.75,1747.5,62.75,26.0,52.25,a en retiene la!,6
380.25,2099.5,160.75,48.5,65.5,M COLEGUITA hace crecer,6
261.96,2426.46,70.81,26.06,86.29,"tu negocio G» En 'Mi Bodeguita” — encontrarás los mejores consejos para hacer crecer tu negocio y también tiene una versin digital en trome.pe, auspiciada por Pilsen Callao. Encontrarás historias de per— solas que salieron adelante a base de esfuerzo, consejos para hacer que tu inver— _ sin genere más ganancias y",6
650.67,2522.0,61.81,24.15,90.63,"sabrás cómo atender mejor a tu clientela. Las bodegas, tiendas y afines son uno de los motores que impulsará a nuestra economía a salir de la crisis.",6
1044.04,1443.4,59.96,24.68,87.66,"m La gente trabaja— GD dora de nuestro querido Perú ya tie— ne una cita agendada los lunes, ya que no se pierden las entrevistas de 'Emprende Trome'. Va vía Facebook Live, desde las 11 de la maña— na y es conducido por la periodista Kitty Gines.",6
1086.4,1777.6,109.4,49.0,69.8,DE LIMA Realizarán e ue,6
1098.13,2061.4,67.47,23.8,81.47,"E a a ma Zoom, se realizará el primer matrimonio civil virtual comunitario, que es",6
1475.8,1572.8,59.33,24.0,91.73,"En el Facebook de Tome puedes ver la entrevista a Ana María Bugosen, de la",6
1458.24,2009.34,65.31,24.86,90.41,organizado por la Municipa— vidad de Lima. La ceremonia se realizará el 18 de diciembre y cuarenta parejas deseosas de for— matizar su relación inscribirse hasta el 4 de,6
1852.2,1436.2,77.17,25.26,86.23,"Cafeladería 4D, quien recomienda ser hones— tos con los clientes. En 'Emprende Trome' también encontra— rás los mejores tips en el 'ABC Emprendedor' y se promocionar pequeños negocios en *Yo Te Apoyo Emprende— dor'. o",6
1848.35,1907.59,69.88,24.94,82.68,"diciembre para dar for— malamente el 'sí, contraer nupcias debi— rd Los trámites son virtuales y para detalles de requisi— tos y reservar cupo puede escribir al siguiente correl electrónico: luis.ramirez© ( a a",6
1449.29,2264.29,148.43,55.71,90.14,Amplían carriles en Paseo de la República,6
1055.26,2483.44,58.79,25.21,85.85,"G) Con la finalidad de g ea to veh¡culary peatonal se inauguró la vía auxi— liar (sentido de sur a norte) de la avenida Paseo de la República intersección con Angamos, la cual aho— ra cuenta con cinco carriles,",6
1875.25,2484.2,65.75,23.8,90.62,"en Surquillo. Durante los trabajos, se eje— curaron 406 metros cúbicos de losas de concreto y 128 metros cuadrados de vere— das. Del mismo modo, se realizó la instalación de 268 metros lineales de baran— das metálicas, además de la",6
2238.92,1691.12,69.18,24.62,88.38,"El Crucitrome tiene los mejores regalos para su fiel legión de seguidores y el martes 24 de noviembre sor— tear dos E de 400 cada una. Para par— ticipar, resuel— ve tus juegos' correcta— mente, colócalas tus datos personales con letra legible y depo— sitios en las ánforas autorizadas. A más ”crucis' que envíes, tus posibilidades de ganar aumentarán al",6
2263.17,2413.93,71.33,24.33,88.78,"implementación de mil 809 metros cuadrados de áreas verdes y mil 564 metros cuadrados de asfalto. Finalmente, se realizó el pintado de la señalización vial horizontal y vertical, así como la reubicación y mejoramiento de dos servi— dios higiénicos públicos de 37 metros cuadrados cada 1",6
467.0,1234.71,114.43,75.57,71.14,. 8 © &mñu en productos seleccionados,7
472.8,1690.6,67.8,31.6,85.6,90 Polos S/ de algodón,7
427.0,1765.29,43.71,14.57,71.14,Se apoc nro ml co x.lw c,7
544.75,2008.25,85.0,27.75,83.25,en avance de temporada,7
1024.25,1329.75,146.5,49.0,84.75,en relojes DUCTO se¡ecc¡onados,7
1011.33,1444.33,34.67,13.22,74.67,Sark m man dr MI un|(| »d 'x¡ modelo,7
988.25,1658.5,121.75,72.0,68.5,% el p¡;oductos oscuro,7
1113.4,2031.2,44.2,32.2,40.0,a ] es M|¿ro id,7
1629.25,1330.0,92.5,31.75,88.5,en prendas e temporada,7
1509.62,1440.25,44.5,17.75,77.5,Se ap| Stock mínimo: 3 unidades por modelo.,7
1639.2,2010.4,82.4,31.4,89.2,Bodies y polos de algodón,7
2090.25,1431.62,44.75,14.12,60.0,E ph rs ur sulu en tienda. ei,7
2054.8,1657.4,163.8,63.8,58.2,en reductos Á. ¡¿g sele%c¡onados,7
2145.71,1767.57,51.86,13.86,55.71,pl( u1vc(o»…<n .x|& mrr: el y,7
929.63,1299.61,63.98,24.05,90.0,"on amor, respe— to, juegos y nuevas experiencias en casa, hoy al fecha que recuer— da el compromiso con la niñez, más en tiempos de pandemia. ”Son la nueva generación que crecerá en el Bicentenario y los primeros ”héroes del aisla—",8
1837.96,343.81,60.08,27.12,76.58,"© curlosos, más creativos, Oo Hasta fines del 2019, gl A más autónomos y tec— o” Perú registró 9 millo— / y y y nológicos. Aprendieron",8
2274.33,690.52,55.77,23.0,82.41,"que la escuela pue— de estar en casa, se reúnen vía Zoom, se relacionan y conec— , — tan de manera distinta, l e l 2 ea e l n requieren cosas que lla— men su atención”, agregó. CRECER FELICES ) Respetan y se relacionan u — desde la seguridad y coherencia, no desde la ”Tienen mucha información, son más críti— cos y pueden ser líderes. La situación los lleva a ser más",8
1463.61,567.56,80.41,26.56,85.85,"nes 652 mil niños, según World Vision Perú lanzó la app gratuita 'Protección: Juego y APPrendo”'. Para niños desde 8 años, sobre sus dere— chos, identificar situaciones de violencia y pedir ayuda. O_Compartan juegos: de mesa, estrategia, memoria, plastilina, rompecabezas, dibu—",8
1883.93,1137.97,77.83,27.0,86.59,"empáticos, se preocupan se convertirán por otros, desarrollan habi— en personas alidades como perseverancia miento social. Han vivido más resistencia y los padres los cambios por el confina— responsables deben ser b|.Yen ej%mplo"", miento, adaptándose, y lo han Pa E hecho muy bien. Generemos Enfatizó que de noso— un espacio en casa donde se tros depende que crezcan",8
2238.13,1326.33,85.73,23.6,91.27,"felices, con recuerdos agradables pese a situacio— nes difíciles y puedan ser adultos emocionalmente estables.",8
1491.0,1360.63,62.26,24.33,90.3,"sientan protagonistas y no solo importantes”, dijo a Tro— me la psicóloga clínica Juliana Sequera. Ellos no son ajenos a lo que pasa en el país, escuchan,",8
888.38,1672.0,58.62,24.75,90.75,Guillermo Miran— donar el país. A través de,8
1063.34,1755.4,62.17,26.85,78.28,"da, quien fue un comunicado, Lata Penal de Miraflores abrió © Ehsemc_lggratu1to por agre— informó que, ee :ÍS_* una investigación preli— volvio a Pez dir a un repartidor sus normas de seguri— — ¿ l f de delivery de nacio— dad operacional, se lee d ea en",8
1036.26,1926.79,61.11,24.95,89.63,reserva el derecho de embarque 'de todo aquel pasa— pero que pueda perturbar la debi— y da tranquilidad y,8
238.43,1930.86,69.29,25.76,89.52,"calidad venezolana, intentó viajar a Los Angeles, Estados Uni— dos, pero no le dejaron abordar el avión. Según RAP Noticias, Miran—",8
649.89,1989.11,67.11,25.89,88.56,da llegó hasta el aeropuerto ”Jorge Chávez' para aban—,8
713.8,2193.04,61.68,25.16,89.28,"Un trasplante de médula salvó la vida de una niña de 5 años, que padecía de leucemia linfática aguda. La exito— sa intervención se realizó",8
1063.83,2208.06,63.11,24.39,90.89,"seguidos, con dos sesio— nes diarias e intervalo de Y en el Instituto Nacional del Niño—San Borja, Leo—",8
1460.8,1571.6,65.8,24.0,83.2,** adecuada operación de los,8
1110.83,2091.5,61.5,35.67,75.5,a dicción fue de tres día&¡,8
932.62,2433.52,55.81,27.71,74.65,"nardo (14) donó parte de Rebagliati (EsSalud). las células madre El doctor Julio de su sangre Rojas Landecho, — para el tras— 1 á—=,1> < d en plante que A 7 terapia del ¿_ Rebagliati, pre— hermana ( casó que la Liana (11). [I. > ira— Medina) 8",8
1467.38,1651.38,72.12,25.88,92.0,"Además, por la tarde, la Segunda Fiscalía Provincial",8
1842.75,1847.25,126.25,31.5,63.75,"dades' |mplementadas y, acondicionadas!",8
1789.44,1938.0,50.88,27.64,67.56,"la humanidad, discriminación en — | A y agravio de Junior —| o Hasta la cuadra de y Ramirez Falcón. _ | ”B S Tla",8
1796.0,2150.67,151.0,60.67,74.33,A Cyber Days y Black Anda,8
