left,top,width,height,conf,text,page
1406.88,169.38,85.62,52.25,66.62,__ — (atromepa año 12 LUNES 27 DE,1
781.67,508.5,153.67,57.83,63.17,IDIVERSIÓNISANA ) IPARACHICOSY © v GRANDES,1
1213.4,686.2,515.8,101.8,47.8,|PIR2IEK$IIWIENT1EWHVZCARRA(©RH¿WCA&NMH MNOS(UEIII%CHAN |…R&GAS(C.MS IPAIRA(C.MPMR(CAJ]&S D,1
1651.75,717.25,305.25,70.5,61.75,CIHIIIE IM]IIWIEINTRA !AUMIEWAN ILOSJIMUIEIIRT,1
1098.9,2343.67,187.1,75.62,64.67,qu[s msos&s¡5¡nnmm Z)j— )| [/ “l NOLETTA A LOS QUE YA RECIBIERON WL: sí l £… KOM(O RE S> COMENZAPANAREPARTIRPEDIDOSIDESDEELADEMAYO! SUJBONO,1
301.5,331.33,156.17,51.33,90.83,Tom Hanks dona sangre para vacuna,10
228.29,592.82,63.59,24.29,87.0,"© El actor Tom _Hank;y es ( quienes se han recupe— lado del coronavirus que contrajeron en Australia, ofrecie— ron su sangre y plasma para ayu— dar a desarrollar una vacuna contra la pelado,",10
243.67,1506.57,59.52,23.66,90.08,"G La vida ya no será como antes, pues ] cambiarán una vez concluida la cuarentena por el bien de nuestra salud”, afirmó la médica infectólo— ga Karim Dioses a Trome, al referirse a las acti— dudes que tienen que cambiar los peruanos por la pandemia. ”Esas viejas costum— bres que se tenían de beber cerveza en un solo vaso, dar besos y abrazos a los ami— gos o ir en grupo a un restaurante o al bar tendrán que quedar— se en el olvido, porque después de levantarse la cuarentena, pue— de existir un pequeño rebote del virus como ha pasado en otros paí—",10
567.25,451.5,55.5,26.5,90.75,el prota— agonista de,10
714.14,677.95,67.32,26.86,84.36,y 'Forrest Gump' l e residencia de Los Angeles. En Austra— lia participaba en la preproducción de una película biográfica sobre Elvis,10
337.4,2100.5,92.6,52.3,91.3,Más de 40 mil gringos se van a la playa,10
244.36,2373.15,58.26,23.46,89.0,"Pese a que Estados Unidos se acercaba al millón de contagia— dos por coronavirus y que los muertos supe— daban los 55 mil, ayer unas 40 mil ea ron el aislamiento y se bañaron en las playas de California.",10
681.0,2403.51,50.86,23.31,90.24,"En España, los contagios se ele— varon a 207 mil 634 y las muer— tes a 23 mil 190. En Italia se registraron ayer 260 muertos, la cifra más baja de las últimas seis sema— nas. En total ya son 197 mil 675 casos y 26 mil 644 fallecidos.",10
1154.0,158.33,76.67,23.67,90.67,LUNES 27 DE ABRIL DEL 2020,10
1157.5,258.0,33.0,22.0,33.5,Ó o Ri o,10
1043.0,677.0,63.0,24.0,35.25,25 eal! lítdrinene t,10
1035.29,2459.15,59.82,24.26,91.0,"Alemania es el cuarto país más afectado con 157 mil 495 contagios y 5 mil 944 muertos. Hasta ayer, había en todo el mundo 2 millones 954 mil contagiados y 205 mil 398 muertos.",10
1480.3,467.0,55.2,24.0,46.7,eques ir o pr sed to S ell em eun el en men,10
1450.5,917.0,55.75,42.0,54.75,x]' U 'l/o |x…,10
1392.91,1242.47,69.76,24.88,90.53,"que evitar y va a depender de los ciudadanos y su respon— habilidad de seguir cumplien— do las medidas del Gobierno”, añadió. MASCARILLAS Y GUANTES La especialista aseguró que el uso de mascarillas y",10
1492.5,2073.2,119.9,45.0,86.7,£>P.OR RIESGO DE VIDA Piden bono para policías y soldados,10
1458.47,2310.65,67.76,25.12,89.0,"Ante el © aumento de efectivos con— tagiados, el Instituto Legal de Defensa Policial solicitó al Gobier—",10
1867.08,692.98,57.98,24.28,88.58,"© En la localidad de Ceres, en Santa Fe, una pareja de esposos le puso de nombre a su niño 'Ciro Covid”, en alusión al virus que está causando zozobra E Eduardo Siquiera y Débo— ra Maidana, los padres del",10
1859.23,1511.87,78.13,26.19,87.48,"guantes en los perua— nos seguirá por un tiempo prolongado. ”Muchos harán teletra— bajo, no habrá clases presenciales en colegios y universidades, y los comercios empezarán d línea”, agregó. []|mmy Hemande3]",10
1923.25,1865.0,165.0,40.0,32.5,e it e ta,10
2257.38,715.54,57.3,24.68,84.22,"pequeño, que nació por cesárea y pesó 3.2 kilos, dijeron que es un 'bonito nombre”. ”Yo feliz. Es mi nie— to número 15. Me emocionó su nacimiento, aparte que es un nieto muy esperado”, (e E e",10
2246.83,1303.0,68.58,25.88,80.08,"NUEVOS HABITOS ©Uso de mascari— lla y guantes hasta diciembre. et , por 30 segundos. ee d el a Airear los espacios interiores de la casa. O©Mantener el metro de distancia en mercados, bancos y farmacias. ©No dar el celular a otra persona y limpiarlo cada 24 horas.",10
2269.83,1568.0,60.33,40.67,84.67,LO QUE YA NO SE PADRE,10
2279.0,1655.0,46.5,18.33,79.17,: Tocarse la cara con las,10
2255.8,1715.2,72.0,21.2,83.0,"manos. ©Saludar con la mano,",10
2201.25,1756.0,56.75,23.5,72.75,. abrazos y besos.,10
2269.36,1821.45,69.45,22.91,87.18,©Compartir el vaso de cerveza con amigos. Otra los mercados en,10
2242.6,1887.8,47.6,18.6,80.6,—— familia. Solo uno por,10
2153.86,2107.71,127.0,44.86,71.57,Bomberos se — _ suman a campaña,10
2086.92,2305.28,62.39,24.56,90.14,Los miembros de la Compañía de Bomberos Voluntarios Gari— balde No 7 del Callao se unieron a la campaña itinerante de Salud para salvar vidas a tra— vés de la donación de sangre. Personal del Ban—,10
1564.41,2527.54,53.98,23.98,89.3,"no que se otorgue un bono especial para ellos. ”Son más de 1,300 infec— todos en la Policía y este bono por alto riesgo de vida es un derecho que se debe dar para ellos y para los militares”, indicó la vocera Nicole Jurado. [JIHV] ©",10
2295.96,2518.83,66.91,24.3,90.48,co de Sangre del hospital Rebagliati llegó a dicho local para recoger las unidades de sangre. Debido a la emergen— cia faltan donantes.G,10
1437.71,501.29,196.57,74.14,43.57,LALIA Y E_PÚBLCOESPERA a a d ee,11
265.47,856.53,117.87,33.8,39.87,arSINIPLAYORES e llestoanálisisde lata— Iblaacumulada;lin— clu so nada de MAperturayGlausura tienen e ie e e s ee ie,11
272.5,1323.11,84.72,32.83,43.56,"e—/RECORTEDEL, — /Lfa:quem'enios. e lizadoelApertura s E sA rl sería e ea o ls a o ee tacumulado;",11
294.6,1603.4,46.0,30.0,44.2,pT y N ea o,11
243.5,1827.0,229.75,37.5,61.75,leseltorneosejugaríaconto— competencia cul: iminaria'afinesdeenerooiini—,11
829.88,2066.93,102.43,37.36,54.21,", = . la 2 enfArgentina, (el traten Espa— j ) ; Ú I? ;'. !7 ñl'a'.IL'a(dist'an'c'i¿?lmoífúeíinqp'ediméút0?Ro .. ue ¡para 'E&TA$wgñojg…uestvas&s£ínanlllevaídasfmrjepríesentantes¡del — Adviínculajpor.unajpublicaciónique (e|i155(dfe1M | lateral en BACOPA — cilio: 2021. | 202 i una j piscina y con re pat deport iva de lalNBA. eeltealendario:de la El",11
902.58,2305.33,111.0,33.0,65.08,any55¿ ©&1Huang¿ay_<& —. | _'NOX6-5:tana'.c€roa(dell|e¿%arfa'lu3¡a'c_u€r.d0!oonlel plantel ¡co lecomerntáóel z ague roy de _ C ',11
495.0,2334.5,177.0,38.75,35.25,parar redue ir lost salarios ten 25tportIENTO: ei,11
329.82,1533.78,67.69,23.92,89.46,"DEL SAQUE somos carneci— ta... LA VERÍDICA que la gente ya lleva encerrada 42 días y se está loqueando. Y eso que están comiendo con sazón casera, viendo Neelix y disfru— tando a la familia. Imagínense cómo será la 'cana' y que te sentencien por varios años. Es el infierno en la tierra. La cosa es que muchos ya no saben qué hacer, sudan, trasnochan, hablan solos, se alteran y sien— ten picazón por todo el cuerpo. Y hay algunos que hasta con— vulsionan. Es el virus de la calle, de la joda' y de la tramposería que los tiene nerviosos y ansio— sos. Entran de madrugada a las redes para incendiarias con fuertes revelaciones. Han subi— do un video y una foto de un delantero playero en la recep— ción de un hotel acompañado de una 'bebita' con sorpre— sa. Estamos todos locos... YA ME que jugado— res de dos equipos de altura se computa *Pantaleón” Reclu— daban chicas de Lima y se las llevaban a sus respectivas pro— vincas para hacerla linda. Todo iba según lo planeado hasta que llegó el aislamiento social y las muchachitas se quedaron en el aire. Los primeros días se las arreglaron para tener don— de dormir y comer, pero se les acabó el billete y la pasan mal. Los culeros no les mandan fru— ta, ni mascarillas, alcohol ni guantes. Eso no se hace... HAY UN RUN RUN que está volando por la venta del cha— maco Kluiverth Aguilar al grupo empresarial dueño del Man— chester City. Es que esto le ha dado aire y fuerza a nues— tro mundial i sta Jaime Duarte, quien le ha hecho ganar buenas monedas al club porque ”des— cubrió' al lateral. Este parrillero es tan mala leche que su lema es que viene a revolucionar las inferiores y maleta horrible al chinito que ahora está en la Federación: ”Tuvo años como jefe de la Unidad Técnica y solo sacó a Altair Fuentes que es una tortuga”. Tirador al mango. Ya no recuerda que se hizo rico en San Luis a puro fracaso. Aya—",12
337.4,2579.4,71.0,25.4,90.0,"yayayay... Me voy, soy fuga.",12
800.03,2152.18,173.85,34.82,58.21,"(denuestro¿depor.te, haceunal: oensustdistinitosquehaceres, n el hogar para encontrarse (consushinchas.. (Cump||endoal piedelaltralasrecomenda— (ciones. e Pistolas mai o s estoy dejan de o tosifrelucientes) 'en eljardínsiemprehayal: g go por hacer (éHacedeporfe?» Jugam05voleyAmamosdosequ¡posdetr&s (conm|esposa'huaymetasmlapartepost& e s |Tamb¡en unpocodebaile. ? $S|empreleayudoaml Picolacebolla, pelo papas/ayudoentoquepueda. E Estalgonormal [ (ensenomlmama'desden¡no",12
1556.86,2578.0,115.14,54.57,58.71,E DIDI G© (CAMIS*ETA$ PRETENDAS AN MAS,12
1341.26,2070.74,185.85,35.38,48.28,"e e a Frijoles;olluquitotallarines/arrozconpato; (cuy, éW]pñr¡su1mus&qpersonal? Habíaempezadoaarreglarioyalasemana' (dehabercomenzadesed¡dlacuarentena, todoquedóparadohastanuevolaviso: a e a Lacasaqu¡llaro] ide Perúconla quejugué (elMundial todeAmenca¡ylacamlsetade [ Mehab|anoperadodeltendendeAqu¡lesen la p|erna|2qu¡erda f estaba in tema do en lacií— In|camB0calun|ors'hablaven|doa jugarali— n Marad0nai£nesoapareclobl&…ea ee u g a e e Ihastaahorañoguardeenml Esedíafueunalocurajtodos, (quenanveowsaludara1[)¡ego s pefdióel[Mund¡aldef£(spa&fe“8&mn&s—aw",12
1878.14,2053.7,248.35,35.68,55.86,"racióntotallEstábamosconcentradosentell GlublEiBosquet entrenandomplsemal!me xvofv¡aromperelúendon Aniseacabólaposi— abilidad de poderjugartresmundiales.. (3F naleonese¿golfa18u[ganaenihd P lEsa]ugadasepract|c0'Nomereñeroañacal— b||lasyyoeramos*los|ndlcados parapatear.. lLaresbaíadafueporqueelcampoera (Perdiamos?— 20 elentret|empolngresoal xvestuanoelpres¡dentedelllPDcont|erraen macetaparadec¡mosquelahabla*lleva— (dodesde Reúno lepodíamosifallaranues; Itragente[tresd|asdespuesdelterrem0t0x (del?0] lNoshmoplsarla, muchosselapasa— ronporsuropalEsacábalaseusóenlosde— máspartidos. lNos'eriteram05;porlbshimchas,léllos nos icontaroncuandohacíamos eg A l to del campo Enesetjempolacomunlcac¡0n noerantanfácilcemodhoera..",12
2357.39,2084.65,197.96,38.22,56.35,"lLoduoelpres¡dentedela <ces']oao'Havelaqgesy;lo< (golamayoncant|daddet nunca sql lg de la cancha m|larf lLomascercanopodnah( (gp|dem|adelcolera'que… menos peruanos.. EEstoescomalascontee lEsacreoqueduroselsm( os e paamosenelcolegloLe /Arequ¡pa ¡ a Muchaggracuas'por¡sut¡ ífutboL,cunde_sezm : Grac¡asaíromeponacen worl hay que cuidar se mu <casayatodos*loshlnchao",12
1855.75,2545.0,220.75,70.25,57.25,R(GHUMPW SCÍ©N IL©SJH|INÍCHA*SWÍA*IQ USAN,12
20.75,1736.25,134.0,32.75,66.25,nlahistoria... istentóasí:'Seju— empo pelota,13
76.3,2140.5,78.0,26.9,63.7,"(ei] e anticipación. Em— indio Prado, fuimos Santa rminamosasí lle—",13
11.75,2408.0,141.75,28.0,83.5,"arsedemí.Porfa— ho, quédense siganlasindica—",13
365.0,275.5,97.5,24.0,86.75,SUAREZ CON NUEVO LOOK,13
618.91,651.23,59.37,24.14,90.13,"© En plena cuarentena, el uruguay Luis Suarez no deja entrar a su casa ni al barbero, por lo que hoy luce una inusual cabellera alborotada. Su esposa Sofía Bambi realizó una encuesta en Instagram para ver si le metía tijera al ata— cante del Barcelona y el 85 por ciento votó por el sí. ”Esta vez no te escapas”, escribió ella. De otro lado, su compatrio— ta Enzo Francescoli, idolo y directivo de River Plate, expresó públicamente que sueña con ver a Suarez defendiendo al",13
566.8,854.4,92.0,23.6,90.4,SERÍA DEPORTE EN EL FUTURO,13
601.5,890.75,172.0,57.25,74.0,NUEVO RINCÓN DEL BOX,13
591.61,1554.99,69.3,24.33,89.92,"Managua.— ¿Cómo serán los espectáculos deportivos después del coronavirus? Nicaragua dio una muestra de lo que podría ser el futuro. Organizó, la noche del sába— do, una velada balística en el coliseo ”Alexis que llamó la atención por las medidas sanitarias que se toma— ron. La entrada fue gratuita, pero el miedo al contagio pudo más y no hubo mucho público. Los asistentes respetaron el distanciamiento social dejando varias bancas vacías y usa— ron mascarillas. Los boxeadores tuvieron cub re boca s que solo se quitaron al momento de pelear, luego de ser total— mente rociados con desinfectante al igual que el árbitro y chicas que subieron al ring.",13
376.29,1873.14,108.71,22.71,87.14,CONSTRUYE EL ESTADIO MAS GRANDE DEL MUNDO,13
614.27,2454.6,60.75,23.95,90.61,"© China.— Mientras el mundo se paraliza debido a la pan— demia, en la ciudad de Cantón, a solo 850 kilómetros de Wuhan —donde se originó el Covid—19— el club Kuangchou Evergrande, vigente campeón chino, inició hace unos días la construcción de un estadio para cien mil personas, con un presupuesto de 1,600 millones de euros. El recinto, en forma de flor de loto, se convertirá en el más grande del mundo, superando al Nou”. La idea es que en dos años Chi— na tenga 12 escenarios nuevos para poder postularse a ser sede del Mundial en el futuro.",13
1369.5,160.33,81.0,23.67,91.0,LUNES 27 DE ABRIL DEL 2020,13
1584.69,1448.06,121.0,44.0,77.62,DT DELLUIMERPOOL SE COMUNICÓ CON PAPÁ DE MAPLE PARA SEDUCIRLO Y FICHAR A DELANTERO DEL PSG,13
1261.15,1690.91,81.88,26.06,79.15,liverpool.— Jorgen Klopphace verdadero teletrabajo. El técnico del | liverpool mantiene activo a pesarse la paralización del fútbol el mundo vislumbra un poderoso equipo para la próxima temporada con el francés Kalian Mbappécomo,13
1497.68,1986.0,76.41,30.41,84.82,"PAULO BALA Y GOMEZ' perdieron la subasta por la camiseta que usó Paradoja en un amistoso en 1987. EL MEXICANO ”CHICHARITO* HERNÁNDEZ perdió ayer a su abuelo Tomás Balcázar, un histórico del fútbol azteca.",13
1708.17,1690.6,115.77,29.0,67.03,"principalatractivo. Segúnrevelaron medios ingleses, entrenador alemánaprovechó susdíasencasa para llamar por teléfono al padre del astrodelPSG, Willied Mbappé, e informarle interés por suhijo. Parcel DT de los'reds” el popular'Donatello' —cuyo pasepodría ron dartos",13
2184.11,1668.37,73.89,25.16,82.55,"200 millones deeuros— sería recambio ideal para el senegalés Radio Mané, quien dejaría al actuallíderde la Liga Prefieren busca de nuevos retos. Portadora Sloppy dío el primeras con un gesto que podría haber calado en la intimidad de la familia del",13
2144.42,1970.0,86.92,33.17,80.92,Soy pesimista al pensar que el circuito retome la actividad normal” a,13
1593.8,2068.5,76.8,31.6,83.2,"EL DELANTERO DEL EVERTON, Moise Kean, realizó una fies— All",13
1306.43,2102.86,70.0,29.43,91.71,ta en plena cuarentena y será sancionado.,13
1610.17,2315.33,78.83,22.0,89.33,LLEVO AYUDA CON SU AMIGO DE,13
2122.88,2433.87,69.18,24.92,88.69,"© Porto Alegre.— El volante argentino Andrés D'Alessandro, compañero de Paolo Guerrero en Inter, repartió comida entre los más necesi— tados, en compañía de su compatriota Heman Barcos, delantero de Gremio, clásico rival de los Con guantes y mascarilla, el 'Cabezón” sirvió personalmente 300 raciones en Canoas, un municipio a 20 kilómetros de Porto Alegre, gra— dias a la gestión de su propia fundación. ”En este momento de crisis mundial, los pequeños ges— tos han sido grandes ayudas para los que más nos necesitan”, señaló el 10' del Inter.",13
993.09,715.82,125.36,35.18,85.27,EN PLANTEL DE LIMA POR REFERENTES QUE NEGOCIARON CON ”FONDO BLANQUIAZUL,14
447.97,1108.64,88.18,28.27,81.47,"alejaron la plaza. Alianza Lima, el término empieza a perderfuerza, puestas decisiones finales sobre vacaciones oreduc— cion es de salario no manejado contentos todos en el plantel. Sesuto que varios jugadores del equipo estarían de acuerdo con la negociación que tuvieron los referentes con el Fondo Blanquiazul, pues habría cambiado el acuerdo que tuvo el grupo. Trascendió que los voceros aceptaron lasvacacio— nes que los obligan a tomar en abril, pese a queto—",14
641.67,1359.17,80.0,30.83,90.67,EN ALIANZA no han descartado aún aplicar la suspensión perfecta de LABORES.,14
1107.98,1075.75,90.44,26.11,75.23,"dos hicieron trabajos ordenados por el club hasta el 23 del presentemes. La cosa no quedaría allí. Podría haber una reunión víavideoconferencia donde varios pedirían explicaciones sobre cómo se llevaronaca— bo las negociaciones y algunos líderes no quedarían bien parados. De otro lado, el preparadorfísico Osval— alegría reveló cuánto tiempo necesitarán decentre — amiento en campo antes devolvera jugar. ”Debería— mos contar por lo menos con cuatro o cinco semanas detrabajo”, señaló.",14
1674.17,548.83,128.33,23.83,81.0,&U' ACEPTARÍA MEDIDAS QUE TOMEN DIRECTIVOS,14
1744.43,921.52,60.72,24.3,90.2,"© Sporting Cristal sacaría pro— hecho de lo que ocurre en el fútbol azteca y estaría en conver— naciones con el portero nacional Alejandro Duarte (26), quien mili— ta en el Zacatec de la Segunda División y finaliza su contrato en junio. Luego que la Federa—",14
1737.4,1070.8,77.4,23.2,89.0,ción Mexicana anuló los ascensos,14
1727.55,1123.27,67.0,24.18,89.64,"por cinco años, Duarte aceptaría la oferta piense para retomar al",14
1733.86,1172.0,54.57,25.71,92.43,país y pelear el puesto con Patricio,14
1682.5,1205.5,64.25,24.0,81.0,Alvarez y Renato Solis.,14
1670.67,1267.33,104.0,24.0,79.33,CRISTAL TRAERÍA A DUARTE DE MEXICO,14
2221.29,474.17,68.81,24.77,86.25,"é» El Monumental' parece ser un ”castillo del terror'. Luego que Universitario decidió el despido de varios empleados, entre ellos el equipo femenino, los jugado— res del cuadro que dirige Gregorio Prez habrían decidido ”claudi— car'. Antes que el club les aplique la suspensión perfecta de labores, habría un consenso para acep— tar las reducciones de salarios o tener las semanas de vacaciones anticipadas que ordene la admi— e",14
884.31,1434.09,195.88,29.47,65.44,"acantanteGiulia— ei ta l ral sumolestia, luego queenredessocia— lessedifundióun videodon— de seve que sus paisanos de Piura formaron largas colas paracomprarcajasdecer— vezaenplenacuarentena. ”Eso(quecomprencerve— za)mepareceirresponsa— ble,esunafaltadeamor tanto a ellos mismos como a sus familias yalprójimo.Prime— ro porque seles vio sin mascarillasniguan— E a l dando la distancia Es— tánpecandodeignoran— testotalmente”, sostuvo Ren—",15
1285.67,1161.56,182.78,32.0,70.89,"gifo,quien lamentóquehaya alta demanda en cerveza y no deartículosdeprimeranece— sidad. ”Soypiurana ya la gente de",15
1293.66,1551.88,151.41,26.06,81.06,"pan, porelmismocaloryam.— Haybastantedeman— dadecerveza,peronosonlas medidas ni la forma correcta queestánteniendo”, acotó. Enredes sociales han cri— tocado a tus paisanos por— que la cerveza no es un producto de primera ne— cesidad... Todosestamosafectados (económicamente) estrago noesunproductodeprime— ranecesidad.Ahinosdamos",15
1700.85,1401.54,166.98,30.62,72.0,"cuentadequehayignoran— cia, meda mucha penapor— quePiuraes mi tierra yquie— romuchoamispaisanos, pe— ro depende decada unocui— darnos.CreoquePiura colap— será y habrá muchisimosfa— llecidos. Derepentehasta van amorirensuscasasoenlasca— lles, asíquedespuésnovengan alamentarse.La gente no hace caso, hace lo que se leda la ga— na, los hospital es yacolapsa— ron y la gentepideayuda, pero eso pasa por no aca tar lo que dice gobierno,niquererse aunomismo. Nolepodemos echartodalaculpaalpresi— dentenialasautoridades, por— que uno decide si se contagia o no.(LGamarra)©",15
1402.0,1918.5,100.5,38.0,39.5,esta hicimos n mastoid,15
918.05,2059.05,53.67,26.0,85.71,"€D Florcita Polo está triste porque pasará el 'Día de la madre' alejada de Susy Díaz, a quien no ve des.—",15
688.8,2107.6,73.0,23.6,90.0,de que comenzó la cuarentena.,15
880.54,2224.23,57.8,24.16,90.07,"”Me siento muy triste porque estoy lejos de mi mamá. Todos los años nos reunimos por el 'Día de la madre', pero ahora no se podrá por la cuarentena. Sé que no seré la única persona que estará lejos de su mamá, pero qué podemos hacer, es por nuestro bien, tene— mos que pensar en nuestra salud”, expresó la hija de",15
866.87,2473.13,58.84,25.79,77.63,"mucho y sería bonito, por nuestro día, compartir el Afirma que (_.¿ a e almuerzo, ella en su casa y yo en la mía, a través de Su programa E L (e una vídeollamada. (D. Bautista) G %39tgfon?:gd¡g",15
641.78,2582.22,66.11,27.0,70.56,i|J % 7'v Y © a comunicarán por videollamada,15
763.38,2395.54,94.23,27.54,89.08,"¿Se han comunicado porvideollamada? Sí, todos los días. Mis hijos también la extrañan",15
918.62,2555.88,57.12,29.12,78.0,¿<Cuenta que el Día de la madre' se,15
1626.29,2571.71,65.0,34.57,78.0,las medidas de ( c) o seguridad,15
2076.62,1328.0,95.0,30.5,90.38,programa con Luigi Carnaval apenas acabe la cuarentena,15
2275.3,1166.69,65.43,24.71,87.54,"€9 Karla Amazona anun— dió que dentro de poco retornará a la conducdión al lado de Luigi Carba— jal, con quien estará al frente del pro— grama 100 % Negocios' de Panamericana ”Ibamos a empe— zar las grabaciones antes que se dé la cuarentena, así que ojalá todo esto pase rápido para retomar el pro— yecto. No me puedo que— dar esperando que la plata caiga del cie— lo. Tengo que seguir traba— dando por mis pequeños, no puedo salir a dar pena”, sos— tuvo Amazona. ¿Quétalvolver trabajar con Luigi? Bien. Ya hemos trabajado juntos durante 7 años en de risas'. Hace poco hicimos una trans— misión en vivo para ”calentar motores' y esperamos que levanten la cuarentena para regresar. [L. Gamarra) G",15
2030.65,2310.17,63.68,23.94,86.73,"La conductora de ”En exclusiva', Lau— ra Borlini, se mostró en contra de las cnt¡cas ] está recibiendo Fagaly Medi— na, a raíz de que la periodista anunció Teve, la firme' segu¡ra al gire pese a que varios de los integrantes de su equipo dieron polvo para el corovirus. ... ”En la situación que vivimos, me parece importante que los | programas sigan al ya sea para informar sobre el coro— ; virus o para entretener a la gente que está en casa. Fagaly < no tiene por qué cerrar su programa, debe continuar siempre y cuando se tomen las medidas de seguridad”, preciso Borlini. También continúas al aire con exclusiva”. ¿Te has hecho un descarte del Covid—19? Sí. Nos tomaron la prueba a todo el equ¡po y dimos negati— vo. Gracias a Dios estamos bien y seguimos cuidándonos.",15
626.25,155.25,117.0,34.25,65.0,16 ((FIESTA) 27 ABRIL,16
1944.33,470.83,102.0,28.17,47.67,'¿g¿o)unaú%lm E alPuntcalcanz i '0: a,16
1593.5,555.83,101.33,32.67,69.83,éaue_s'lie. Moscosojeele; de 'Chollywood”... El 'cha—,16
1619.29,652.79,92.5,33.86,65.21,"'¡3""b_a_a ito' dijo — que. pensaba i regresar ”Ya hoy—con su esposita: — aniversario ORINA RIVADENEIRA,",16
1260.67,754.44,74.89,23.89,62.78,wiajaralPurta CanallRepú— A o e su embarazo; pero toda—,16
