left,top,width,height,conf,text,page
1644.12,2318.58,122.38,28.0,56.92,"¡Además, 6 E ( ””Como 'a quedar mal económicamente, wy wolveré'a ”romperme el lomo'ipara isaliriadelante. Estando(len:cuaren— tena:sufro:cuandoimisthijos me ¡pidentir'aliparque,¡poreso.creo ¿que despuésideesto debe— mos revalorar:cadaicosa",25
2192.57,1656.6,78.19,26.18,79.01,"E'I'mel'odrama, al igual que la comedia y eliterror, es' I un género que no'tiene está dispuesto a reír, asustarse o es lo que la película turca ”Milagro enla celda 7”, realizada por Mermelada los espectadores, que haya una sensible empatía con la historia y susiprotagonistas. No.se trata—deuna cinta origi— inal, sino de la nueva versión de un largometraje coreano de 2013, que también ha dado lugar aotras'dos ¡produc— ciones, de Filipinas e Laodicea eljoven discapa— citado imental! con una hija de 6 años, acusado de la muerte deunaniña y condenado a la calado muy i hondo en los seguidores de Netflix. Sobre el papel, el l hecho de que un hombre con re tras o sea condenado a morir puede t result anim propio e ilegal, y peor sies inocente. Sinembargo, tal y como.se dan los aconteci— imientos, una es cometida porque ipadre de la i menor falleci da es un despia— dado alto oficial militar que solo El guion está calculado en'todos sus'efectos y la realización, fluida y prolija,manipula las' emociones'evitando abusar de la truculencia. Hacia eliminar el drama cambia arreglas dell con un giro ”muy mila— groso”, que la manga', y pudo ilustrar manera más convincente. Lo mejor son las escenas en la iprisión, donde el discapacitado bien encarnado porArastBulut. Iynemli)hace'amistad con.sus compañeros'de la celda 7.",25
206.25,1239.0,72.25,17.0,57.75,MEDIDA CAPACIDAD dios et,26
627.6,1021.0,24.0,55.2,52.4,RECIPIENTE _ COMIENZO — RAUDOS,26
1201.17,158.33,86.17,23.67,89.83,DOMINGO 12 DE ABRIL DEL 2020,26
1474.86,1459.98,44.28,25.06,58.76,"PALOMA . SEGLAR — SERALA, ENROQUELARGO — DUENO — MAYOR — PATAGON — RECHAZO (GUECHUA) A S 35 E <3 3 E TEXTUAL FE E E DEPE _ ) 32 no gg 3 3 EL POTASIO go 3 PLANTA 3 50 FE 1 3 mi H'fm id CONCEDER Pg ACCION F — — & %8 —3 _, PROPIO ] go 26 : BUQUEDELA n l MARINA ..— DIVINIDAD — APOCOPE — MONO INCA —— DEPORTE — PEQUENO — (NGLES) A Ed ea (S o o ea A DECRISTAL, o 3 VIDRIO E F oÍ 33 w F 33",26
1604.25,160.12,96.62,25.62,90.5,DOMINGO 12 DE ABRIL DEL 2020 (FIESTA) 27,27
1402.72,283.17,83.72,35.67,72.44,".. . SUSAN (34).— Estimada doctora $ Carmen, soy una mujer profesio— D ©á©jfa &_.?_.__Q_ ] 41_fk_gí )",27
1179.71,334.86,72.43,26.29,87.57,"nal, independiente, sin hijos y leal. Sin",27
1269.85,742.9,78.42,29.77,76.33,"A ARIES: La fe mueve monta— embargo, haciendo un recuento de Wm 'fm has, no te dejes vencer por el mi vida sentimental veo que siempre pesimismo. Recuerda querido lo he tenido parejas tóxicas. No sé si me mQu¡zásiguesu“93“onv malo pasa. Renuévate. dejo engañar, si no detecto las seña— tropiecesCon A les a tiempo o me llevo por lo que dicta es?hace¡gge;l¡e_ot?ue es que puedes rf 53£53:35“3o&'5£?£ SIEMPRE mi corazón, pero el asunto es que no __ d 2214 H a soy feliz. Mi última relación me dejó una cambiar identific o m¿assñmmdemm L| … N¡ I—_Iw fuerte depresión que creo haber supera— — entre la stela cion es n y e do, por eso quiero volver a enamorarme p¡ob¡emasquehasañon d 5 P GEMINIS: Haz un balance | Újírl'-.xl IEN E y no equivocarme. Deseo encontrar a puedemnarentomara19““asbauero Md ue f¡o'¡tasl *á“'|'f!'dol» A V*c > un hombre no mayor de 43 años, profe— eo e o ei i LI f(ll)/Dv <] Kl_—,—;/'w,&¿; sional, detallista e inteligente. Escribir a S¡“cerov¡ea…egaráatuv¡da.sue susan.melgarejo28&gmail.com _.:o:.__CÁNCER: d a]g;wa]ioso,e¡otelleqará CARTAS: Jorge Salazar Arroz 171, tercer piso, Lima 13. gg,f;$de,'gif_'g;ífgg;¡,govo $¿QUE SIGNIFICA TU NOMBRE? SABÍAS &UN DIA COMO HOY 50¡ Terl:áegit mea,]¡_¡a qu€ los e d ) y 1956 n harán que tu salud mejore. No ”Aquel que es justo”. De origen grie— Ú=Á3;¿%%Td£ Nace el atorando García pierdas tiempo en frivolidades. go. Es sensible y protector. Necesita el ¡¡'mt'¡-)ñamenio EE Paciencia y buen apoyo y el cariño constante de su familia. —— 3049 A esta Configuración p Lo que más detesta es la falta de sinceri— te denomina pie padrino III, 'Los Intocables' y adelante. Practica actividades dad. En el amor es fiel. el E dentro del hogar sonríe.",27
2259.83,1207.42,48.58,21.75,86.67,"X LIBRA: Momento ideal para / N dejar las tensiones de lado,",27
1383.88,1237.75,184.38,74.88,76.12,FURASUEITRAS ¿POR QUE SACRIFICÓ Su VIDA JESÚS? —,27
1172.02,1932.11,30.49,29.12,72.19,"D E D C F D D A Z A Ro E C E D E B o v z 5 puedes, aprovecha el día para E N L O F A E C A D C C A A J F A Z O P 5. . M O A M V Z A M A Ro A O D M E C z A D 9 o ls ea ta 0 s z E V F A Z O D A |1O M s 0 Yo D A 10 u N E CAPRICORNIO: La fu A C T D Ro C Z A S N P U E L R o w s ""ífo£?.€ y ” — a, a Ro A A O A Ro E O M O T Ro M D P Co z Ro D 1 D a a / verás que es más diver— S A D U P U A U P A M U 0 — S | A A S E E C tido. Planea adelántate a lo que podría suceder. Usa tu intuición. e e N Q 3 H D M — A 3 la o Q B O B M f 3xPISCIS: No te presiones Ro D J P A A T B Y Ro Ro Ro O H u N u A 0 a D TO Co z E L 1 N T E T A G s Ro E o s s C a ps O N P S E E E E S Ro Ro P A J F F T z C fe |K. no V E A N U A N E — T D Ro A |) E C z Ro D E j O E C D V z s y v o s E A H G Vv T A 0 A P% N Ro D O F A N E M | B E V P X A Z N D v L g Ro D A V Z Ro A E Ro |o A u yv A Ro Co | A E o V Z A O D D V L A A Ro A 9 F S D A Z L D % P> D A P Ro F E C T O Y N V N A D A Z E i ERA <3POR NUESTROS 0 1 (3 <3NOSAMA AL ¿3 0 1 e <POR NOSOTROS, ©LA HUMANIDAD. E 2 UN PECADO. <3AL ENVIAR l *JESÚS TAMBIEN Y LA MUERTE. g To E | e! QUE %",27
1375.67,204.67,88.17,27.33,90.17,DOMINGO 12 DE ABRIL DEL 2020,28
1072.4,1679.5,78.5,27.1,89.5,Se tomaban fotos con armas y las subían al Facebook,28
1167.6,1827.0,72.4,60.6,48.2,106 w ¡ aw |,28
1673.0,320.4,110.2,105.4,44.8,"es . — o JJ""L…?[£%",28
1875.67,1562.13,63.77,23.96,89.48,"te Búho leyó la última columna de Mario Vargas Llosa, donde cuenta que está sometido a la rigurosa cuarentena en su residencia de Madrid y le está sacando provecho al máximo, asegurando que se halla encerrado diez horas varias con su más grande pasión junto a la de la escritura: la lectura de libros. Este columnista, como muchos, aprovecha el encierro obligatorio para releer algunos libros convertidos ya en clásicos, como uno cuyo título va de acuerdo a la dramática situación que se vive en el Perry ' el mundo: 'El amor en los tiempos del cólera' (1985), del premio Nobel colombiano Gabriel García Marquez [Aracataca 1927—Mexico 2014). Recuerdo que todos en la universidad esperábamos con ansiedad en aquel 1985, la anunciada nueva novela del escritor. Se había demorado cuatro largos años en es— recibirla y estaba, sinceramente, en deuda con sus lectores. Si Cien años de soledad” (1967) había sido su obra maestra, casi imposible de superar, la siguiente, otoño del patriarca' (1975) estuvo a la altura, incorporando a su estilo nuevas técnicas na— creativas que colocaron a la novela sobre un dictador latinoamericano, al mismo nivel de la monumental presidente”, de M¡guel Ángel Asturias, Su siguiente novela, ”Crónica de una muerte anunciada' [1981] si bien es una historia con el sello del de Aracataca, se necesitaban para decorarla solo unas horas al ser un relato atrapante y de narrativa perfecta, pero definitivamente una obra menor al compararla con sus dos anteriores libros. Por eso todos se sorprendieron cuando 'Gabo' anunció que sería una ”novela de amor'. Hasta ese momento, sus historias transcurría por tópicos que iban desde lo ”real maravilloso', cuentas guerras civiles, las vicisitudes de un viejo dictador sin edad en un alucinante país caribeño o la increíble historia de un asesina— to, donde todo el pueblo sabe que van a matar a un joven y este recorre la ciudad sin saber que va a morir. Muchos de sus detractores se adelantaron a anunciar la 'deca— dencia' del colombiano. ”Las historias de amor no venden en América 'Se le acabó la imaginación', decían los envidiosos de siempre disfrazados de críticos. Pero 'Gabo' les calló la boca a todos. 'El amor en los tiempos del cólera' no era la historia de un amor cualquiera. Flo— renting Aria mantiene un romance de juventud con Termina Daza, enamoramiento destruido por los padres de la joven que no permiten que se case con un ”don nadie' y los separan mandando lejos a la joven, en un barco, por el valle y la sierra. Pero el novio no la olvida y se las arregla para escribirle poemas y fogosas cartas de amor, tras im— llorar a los telegrafista de los puertos donde regalaba el barco de su amada para que se las hicieran llegar. Pero después de dos años, al regresar a casa, ella le dice ”no, por favor, olvídelo”, Sin embargo, terco, apasonado, desesperado, Florenting no encuen— tra la fórmula para mitigar el dolor que le significa no estar con ella y decide seguirla amando, a pesar de que la muchacha se casa con un doctor rico y de buen corazón. La llama del amor se aviva en Aria aún al saber que ella anda con su marido recorriendo Europa. El matrimonio de Termina con el doctor Rubeola es tan apaciguado que ella misma se confiesa que lo más problemático de su matrimonio *es aprender a mane— jar el tedio”. Los jóvenes lectores nos conmovidos con aquel apasonado relato de un hombre que esperó 50 años, nueve meses y cuatro días para recién volver con el amor de su juventud, de su madurez y de su vejez. Florenting tuvo muchisimas mujeres en cuerpo, porque en su alma siempre estuvo Termina. Por eso lo mejor de la novela es la parte final, cuando la muerte se convierte en aliada del enamorado: el esposo de Fer— mina muere en un accidente doméstico estúpido. Allí empieza el cortejo de Aria y allí también García Marquez lo relata con una maestría bebida de sus admirados Faulkner o Hemingway. Esta es la mejor parte. Lo difícil de aceptar, por parte de Termina, es el volver a amar al final del camino y la conmovedora cruza— da del viejo telegrafista en revivir ese amor adolescente que algún día sintió por ella y esta por él. Catalogada como una de las más hermosas historias de amor de la literatura e incluida entre las mejores 100 no— velas en lengua española de los últimos cuarenta años, 'El amor en los tiempos del cólera' es una historia ideal para quien se siente apri— sonado por la actual cuarentena. Al leer las casi 300 páginas, el lector se sentirá también aprisonado, pero de amor. Del amor más puro, el de esos dos viejitos envueltos en una pasión y que sienten que cada segundo de sus vidas puede ser ya el último y, por lo tanto, hay que amar hasta morir. No por nada 'Gabo' sentenció: es el libro que siempre soñé con escribir, la novela que siempre quise escribir'. Apago el televisor.",28
389.0,1296.86,41.86,24.0,37.71,a o es Toe ie s es,4
206.8,1530.0,165.2,50.8,90.2,Capturan a venezolanos en bote,4
214.13,1855.74,61.59,23.69,82.95,"€? Navegando en altamar a bordo de una chalana de nom— bre 'Mi Gotita' y con un arma de fuego, i ea venidos por la Policía dos ciudadanos 1 ] durante la orden de inmovilización social obligatoria, en Pucusana.",4
171.75,2316.5,133.75,50.0,61.0,Aal T] para salir,4
266.32,2532.29,53.35,25.13,86.68,m José Ataca (45) no G? pudo aguantar el encierro por la cuarente— na de Semana Santa y para salir a la calle no tuvo mejor idea que ponerse el unifor—,4
671.56,766.0,39.78,23.78,33.56,id i en a i Ia st a id,4
772.8,1256.8,37.2,18.8,48.0,ss E a e que i les m a,4
691.88,1713.87,66.01,24.42,89.32,"Diego Marchan (38), que tenía una pistola calibre 38 con dos municiones, y Tomás García (26), que dijo ser su agente de seguri— dad, fueron abordados mar adentro por los efectivos policiales que los conduje ron al muelle pesquero del distrito. Según los extranje— ros, el arma estaba en la chalana; sin embargo, un hombre de 40 años asegu— re haber sido amenazado por ambos sujetos minutos antes. [<]",4
628.38,2373.23,67.1,23.59,89.79,"me, distintivo y grado de un suboficial de la Fuerza Aérea del Perú. La Policía lo descubrió e intervi— N La detención se produjo cuando el hombre caminaba por la avenida Francisco Bolognese con nueve frascos vacíos, un alcohol",4
1244.38,227.06,122.12,36.81,82.06,"3 Vaquita!”, 'Steven' y sus cómplices derrochan dinero en discotecas en Facebook fotos posando con armas",4
1354.5,828.0,112.0,31.25,74.75,'STEVEN'Y ZEUS' ELUDÍA DESUCAPTURA,4
1066.04,1986.23,108.19,26.69,83.73,"| dinero que los inte— grantesdelabandacri— final 'Los terribles de LaPascana'robabanen losasaltosagrifos, farmacias otros negocios era der roch ado juergas ycostosascompras. Hoy estos delincuentesestán presos y de esa vida de placer",4
1108.29,2383.16,60.65,25.32,83.9,"en gel, tarjetas de crédito y documentos. Al inicio aseguró perte— l luego cayó en contradicciones al ser consultado el de origen y dijo que está en situación (y Yucra) [+]",4
1421.25,1956.4,164.6,31.65,76.3,"solo quedan las fotos que publi— cabanenredessociales. Despuésdedarunnuevogolpe, Joel Rodríguez Gonzales (22), Vaquita' yStevensonCaseldela Cruz (21), ”Steven”, colgar on una imagenensuscuentasdeFace— book, donde mostraban las dos pistolasqueusaronparacome—",4
1852.52,1943.16,104.9,30.84,74.94,"lleves de 10th 200 soles quese repartieron. ”Vaquita' disfrutaba divertirse consus cómplices endiscote— cas, bebiendowhisky, en cebi— caerías restaurantes degus— tan do sus platos preferidos. ”Steven”, por su parte, aparece desafi ante con una pistolaque, segúnlaPolicía, fue inc aut adala",4
2285.08,1204.67,119.25,33.17,57.67,"nochedesucaptu— ra, cuandopreten— díanasaltarel gri— fo'Gasored' enel cruce delasave— nidasJamaicayUniversitaria. u p",4
2240.39,1743.06,104.25,27.93,78.25,"En esa oportunidad también cayeron Vaquita'yWalterMore Aspel30), Zeus'Eneltiroteocon los detectives de la DirinyelDe— pincriComas, Renny Marquez Bonilla (26), Joyce', fue herido y díasdespuésfalleció. Otromiembrodelavanda,iden— notificado como Anthony Peña Arroyo, 'Orejas', recapturado días antes. También seducen unodesusasaltos. Entre setiembre del 2019y fe— brendel presenteaño, 'Loste— horribles de La Pascana'desata— ronunaoladeasaltosenelCo— noNortedeLima. Según las pesquisas, apenas unía antes de sercapturada, lavanda asaltó el minimarket (6 d E u a ubicados en la avenida Tapa Amaru.(E.Cirilo)",4
1728.0,2224.57,121.14,49.43,85.0,Preso de 81 años muere en ”Sarita',4
1633.0,2424.85,59.75,25.26,88.6,"© Por causas que se investigan, un preso de 81 años de edad que estaba condenado a cade— na perpetua por violación de un menor, murió en el interior del penal del Callao (ex Sarita Colonia). El cuerpo del octogenario fue hallado en el jardín del auditorio de la prisión. No presentaba signos de vio— encia y se sospecha que murió por el virus Covid—19. Padecía de hipertensión y días antes había sufrido",4
1499.4,2575.6,66.2,26.0,78.8,un derrame cerebral. (E. Cirilo],4
579.17,494.67,71.0,29.33,65.33,ú SEMANAL' SALE sí 0 sí,6
1201.33,158.33,85.67,23.67,89.83,DOMINGO 12 DE ABRIL DEL 2020,6
1739.0,284.83,96.0,23.17,74.0,GANADOR pe $/500 peL pia 11/04/20,6
885.6,565.2,297.0,116.8,87.8,Hoy regalamos 5 mil soles,6
387.52,882.55,90.89,28.3,70.95,"legó el domingo y con éllos 5 mil so— les quererla el sema— H nal' de la Súperllama— bOISIIIOS da ganadora” Así que no — bolsillos. esperes más einscríbe— Registra tu 'número de te, pues esta pla tita pue— — la suerte' (apareceen la de ir directamente a tus — partesuperiordelapor—",6
361.75,1090.0,25.25,22.0,44.25,es l l N,6
229.25,1341.0,54.0,21.0,48.5,<qu ¡uumnio) G …iimnmni,6
652.43,1455.43,82.71,27.14,46.14,el mi protege ni ti i corazo no e a o |nnlug¡,6
262.88,1504.5,68.38,26.38,47.75,"[E1)+.'1Ix—m?¡u¡am¡f(-mío el f los ezlidio, re saul lica a s",6
706.4,1716.0,42.4,24.0,53.8,"“é]l) ¡( (e,(4n y e",6
891.73,764.27,89.18,37.64,90.73,"con mucha fe, que esa platita puede ir directamente a tus",6
1440.58,871.81,115.35,28.15,70.46,"tada), DNI yteléfonofi— joy/o celular llamando al 710—02600 mediante nuestra web (trome.pe). De6delamañana a de la tarde puedes hacerlo, aquellas 5p.m.seco— no ce el nombre del ga.— nador, siempre pre—",6
1048.0,1090.0,100.5,22.0,74.25,&DE 'LA FRASE GANADORA',6
1208.75,1145.0,173.75,57.0,89.5,Guarda bien tus cupones,6
1060.33,1257.56,55.0,25.11,82.33,m Recuerda que con G? los cupones que tie—,6
1032.4,1305.2,61.2,22.8,78.2,nes de 'La Frase Ganadora',6
1065.6,1374.13,59.07,23.87,92.13,estás listo para participar en el próximo sorteo de 50 vales de consumo de 200,6
1457.77,1318.63,55.6,23.9,91.53,"soles cada uno, 20 Smart TV y 150 vales de pollitos a la brasa con papas fritas, ensalada y refresco. Pero si completaste una de las columnas de las dos",6
1455.0,1715.35,75.7,25.77,86.93,"m La Municipalidad de G? Lima informó que más de diez avenidas principa— les del Cercado de Lima han sido desinfectada [ayuda a reducir la carga microbiana). Entre las áreas que fue— ron fumigador tenemos: las avenidas Abancay, Grau, Emancipación, Alfon— so Ugarte, Morales Duárez, Argentina, Enrique Meiggs, Aviación, Nicolás Ayllón, Teodoro Cardenas y otras arterias. [<]",6
1853.31,1375.85,63.62,24.54,90.85,"cartillas de la promoción que estuvieron en jue— go, ten paciencia, pues el",6
2273.22,728.9,84.39,25.94,83.02,"senicide un notario pú— blico, quien otorga la le— galidad, conformidad y transparencia del caso. Olvides que por este billetes concursar los diarios que hayan si— do inscritos del lunes 6 hasta el domingo deabril. PASAPORCAJA Ayer, sábado de abril, el ganador de 500 soles fue:Sixto Cardenas (6783106, de [ [<]",6
2336.7,1264.43,67.48,24.96,85.78,"premio que ganaste está bien guardado y lo cobrarás más adelan— te, cuando se levante la cuarentena decretada por el coronavirus. _ G",6
2256.05,1715.97,64.64,24.95,88.03,"(_D Para servir de enlace ante cualquier emer— agencia en horas de la madrugada, oficiales de la Fuerza Aérea del Perú (FAN) se incorporaron al servicio de videovigilancia del Sere— yazgo de Miraflores. El Comando FAN tiene a su cargo la seguridad del dis— trito durante el Estado de emeragencia”, para conte— ner el riesgo de contagio del coronavirus.",6
467.59,1356.06,84.53,36.53,88.06,"Francisco Tito dice que jirafa es como su hijo, lo baña con espuma y acaricia su cuello",7
1029.36,637.98,160.07,29.7,73.89,"sicomolosdocto— res,enfermeras, policías, militares, renos y personal limpieza son héroes' en estosdíasdeaislamientoe inmovilización socialobli— gatoriía porelcoronavirus, elParquedelas Leyendas también tienelossuyos. Nosreferimosalosencar— gados de estar al tanto de los animal it os del zoológi— coubicadoenSan Miguel. Incluidosmédicos vete— rinarios, cuidan juegan conlosinquilinosdees— terecinto, yademásdesin— afectan losambientesdon— deviven. ©COMOMIHIJO Entretenlos tenemos Francisco —. A",7
1447.67,777.97,45.3,24.7,87.06,": Aliada trabaja en el Par— ; que de las Leyendas y hace ; unos días ayudó a traer a : este mundo una cría de vicu— ; ña. ”Es mi nueva engreída”,",7
1400.38,1056.25,214.88,31.75,57.38,"alimentaciónde'Domin.— go'lajirafamachoquelle— góalzoológicoalláporel año2013.”Domi' escojo mihijo, midecasi6 me—",7
1715.4,729.6,142.0,28.4,65.8,: deespumaymeloagrade— : ce baja ndo su largo cuello :,7
178.29,1636.14,169.0,44.57,79.71,&EN YOUTUBE Profesor enseña mismo ”Doctor Gero',7
472.55,1881.95,64.59,24.91,88.82,"©3 Para motivar a sus estudiantes y hacer disfrazado de curiosos per— más divertidas sus clases, sonares de 'Dragon Ball Z' y",7
653.67,1973.0,49.27,25.93,85.73,"hasta de la famosa serie 'La Casa de Papel”. En uno de sus videos, el",7
259.69,1976.69,72.15,25.0,90.77,el profesor Gosip Antony Volarte Bravo decidió incur— sonar en Youtube y enseña,7
678.73,2282.83,62.88,25.21,86.31,"© La temperatura mínima que registra Lima por estos días es de 19 grados, mientras que la máxima es de 25. ”Ha disminuido por la mañana, ya se sien— te un poco más p * ] Raquel Loayza, ingeniera del Servicio Nacional de Meteorolo— la e Ideología Senamhi).",7
695.0,2582.0,37.8,22.0,80.6,el 11| Preciso que la,7
1042.74,1743.08,56.38,24.89,80.89,"maestro, que trabaja en un colegio de Chancay, apare— ce vestido del cruel científico *Doctor Gero' Mientras sue — na la música del anime, comienza a dar su intro— succión al curso de Ciencia, Tecnología tl I+ el a e cación, con el atuendo de [ el ga ee nave de 'La Casa",7
1045.14,2320.94,73.04,27.04,83.06,"temperatura irá disminuyendo principalmente en las noches. ”En esta época el clima no cam— día automáticamente. e e porque en la sierra dejó de llover y eso hace que el cielo se despeje, Sin embargo, los amanece— E de capas nubosas, sobre todo en distritos costeros”, precisó. [N.",7
1459.28,1592.39,64.72,23.94,87.5,"de Papel”, Gosip aprovechó para explicar a sus alumnos cómo afrontar esta pande— mia. ”Vamos a usar ese",7
1439.8,1670.6,56.0,25.2,88.4,"M, golpe a nuestro favor",7
1465.8,1707.4,48.0,19.2,85.4,* para cambiar el mun—,7
1451.0,1743.14,40.71,23.14,75.43,n ) do. Su primer golpe nos,7
1476.0,1771.5,65.5,21.75,93.0,© mantiene cautivos en,7
1538.94,1922.94,50.82,25.76,63.35,"nuestras propias mi e d la y al mundo”, dijo a ) el maestro. [S. Obregón) o",7
1776.88,843.62,131.12,31.25,67.88,": Tito,quientambiéntiene : asucargoalavestruz,los ; emús, lascebrasdeGrévy y",7
1840.58,1167.42,155.29,31.29,67.68,"losbúfalosdeagua. ”SOCIABLES Mientrasque Paola Ve— la(27)eslaencargadade lospingúinosde Hum— boldt. ”Estosanimalitos son muy sociables, lesgus— taverpúblico yque losalimenten. Ahora yojuegoconellos, re— se voloteanenelagua, hacensuspiruetas. Losalimentobiencon unadietamuynutri— tiva:pejerrey yan.— chovetas”, precisó. (NathalieSalazar) G",7
2271.94,1146.55,62.4,26.61,83.48,"© ra donado en medio del ”Estado de emergencia' en Lima. Al ver totalmente desprotegido al cachorro, integrantes del Ejército no tuvieron mejor idea que adoptarlo. Ahora, el can los ayuda a vigilar las calles y hacer e d 5 e a dócil, juguetón y fue bau— tirado con el nombre de *Covid”. Su foto fue subida a redes sociales y ha recibido excelentes comentarios. (S. Obregón)",7
2293.5,1919.0,101.5,37.75,59.25,a http mica seri tain forma mina,7
1862.12,2324.48,70.33,25.96,86.15,"©) vecinos_ vulne— hables y con diversas discapacidades recibieron canastas con víveres del Consejo Nacional para la Integración de la Persona con Discapacidad a e pobladores de las zonas de Los Viñedos, Francisco La Rosa y otras, en Surco. ”En los próximos días se repartirán más canastas. Ire—",7
1788.71,2541.71,57.29,27.14,59.57,COM — mos a varios distritos con,7
1844.89,2595.33,65.22,24.78,91.11,"bolsas de azúcar, galletas, arroz y otros productos de",7
2264.08,2225.27,67.05,25.76,87.78,"primera necesidad”, señaló el Contados en un comunicado. La jornada de ayuda fue apo— yada por serenos del distrito y miembros de las Fuerzas Armadas, que llevaron las canastas hasta las viviendas de =os pobladores. (N. Sala—",7
2471.75,2734.0,106.0,43.75,55.5,PressReadercom xT 604278 3604,7
266.51,728.94,140.91,34.14,52.54,"contag|os¡ponel (cor0nav.¡ms&s¡gue sub¡endo pa|s;ylla ee arecedesbordarse% 8H]peruanos,lentreellos lun[med¡coiun1rabajad0ñde limpie— vza?/.tam bién n es decombate;con— esta j pan dem la quenodaltregua: Parque noté mástaleances'del [ G o eo con (destacadam&dicadsalubristagtin— xvest¡gadora]penuanalPatnc¡a |n|strad esa ) ray desde re ll punto desist a a Ihg|co*%en1queetap'a nos E ss",8
254.25,1650.79,208.23,36.71,52.62,"Estamostodav¡a e oe cua|qu¡era e pa|ses[ltal¡a Un|d05]1pero,grac¡as*a lasmedidas: ”tempranasy muyextremasihemos: |muy.emplnada* dlasituaciónpodiííaempeorar? XVaaaumentanelnumerodeenfer— ee ¡sigúientes<semana53perode*ah'ñla— unacosaplana,(como meseta5y.veremo€que lrodemfectadosemp|e2aadlsmlnu¡r Esodependedequelas personasteo: laborentEstamosienesta partedela: (cunvateniquellasicosas poldriandes— (c0ntrolarseqponesosehant0mado taccionesmásseveras. |rfamos'en]las*prox¡mas”dossanfa— Hayungrupoespec¡al¡zadoquees— haciendo |as*pr0yecc¡ones N (qu¡s¡eraant¡c¡par peroftranquila— p0dnamos'llegar(a S nt finfectados: porque'hay.unibuen: |porcentaje e pac¡entes'en1U(íl [Urii— (daddeCu|dad05*lntens¡vos]y.ne*se wanatecuperarWanaserdramáticas: (estasdossemanas o a meniquelestosedes;",8
255.73,2372.87,142.13,34.73,60.93,Es*¡mportvante 1 Ia¡gente i sienta mal p0r.todoel esfuerzo que que.tener.tranqu¡— pac¡enc¡a1porqueestan ha— qu ue humana mente se e hacerlR'ecordemosque (Qquierahay o esperaba,8
