left,top,width,height,conf,text,page
2010.02,921.78,164.49,30.89,69.11,"”Todavía tenemos un esfuerzo y seguimosaumen— tando laoferta. Noesqueel sistema haya co laps ado y estemos de brazos cruzados, seguimos trabajando para poder atender a todos los pacientes querequie— ren hospitalización y atención médica”, precisión conferencia prensa en Palacio Gobierno. Aseguróque hay 165camasen UnidadesdeCuida— dos Intensivos (UCD) disponibles nivel nacional para paciente s graves con coronavirus. ”Tenemos554camas Ubique hemos informado queyaestán siendo usadas y ¿cuántasentotalen el Perú? 719. ¿Cuántas disponibles? Tenemos 165” afirmó. Remarcóquevarias delascamaslibresestán regiones ”dondefelizmentenotenemosma— y or necesidad de hospitalización (...)cuando",8
655.0,2266.0,195.5,36.0,85.83,MOLESTO POR COLAS PARA COMPRAR CERVEZA,8
360.91,2450.4,72.62,24.49,89.16,"€) El presidente Martín Pizarra expre— só su molestia por las largas colas que numerosas personas formaron en el distrito de Castilla, en Piura, para com— par cerveza, cuando una vendedora mayorista abrió su tienda después de mucho tiempo. ”Ayer, seguramente a muchos de uste—",8
954.91,2459.36,63.4,23.4,90.0,"des, como a mí, les llegó un vídeo de ciudadanos en Piura haciendo una larga cola para comprar cerveza, la cual no res— pegaba la distancia mínima requerida para evitar el contagio”, inició el mandatario. ”La gente se pasaba la voz entre amigos. Parecía que era un sábado de fiesta, por lo menos en esa urbanización. Todavía no",8
1563.56,2491.62,67.21,23.85,89.0,"hay con— ciencia 5) magnitud del problema, eso es lo que nos: preocupa y es algo que debemos cam— biar”, indicó. Además, enfatizó: ”Aquellos que salieron a comprar cerveza, exponiendo su salud y la",8
2174.28,1462.03,174.59,30.14,73.21,"hayregionesdondeestamoscasialli— mite como Loreto, Lambayeque, Lima. ¿Tenemosdisponibles? Sí, tenemos, pero no con mucha holgura” dijo. Además, enfatizóque delas5mil258camas quehacer distintos centrosdesalud, 3 mil 765estánocu— padasymil493seen— cuentrandisponibles. ”Elesfuerzoesincre— mentar(lascamas). Esteeseltrabajo yes— fue r zo diario del sector",8
2166.11,2398.22,65.71,24.34,89.47,"de sus familiares, pueden haber contraí= do el virus en la cola y llevarlo a su casa, donde posiblemente hay una persona vul— nearable que es a quien debemos cuidar”. El Ministerio Público abrió investigación preliminar contra Silva Georgiana Cárde— nas Salazar, la dueña de la tienda ubicada en la localidad pirana de Castilla, por el presunto delito contra la salud pública en la figura de violación de las medidas sani— tarias. [+)",8
1369.83,160.33,80.5,23.67,91.33,LUNES 27 DE ABRIL DEL 2020,9
333.25,277.0,101.75,36.0,86.0,Fallecidos según sexo y,9
249.53,375.79,65.68,36.95,81.79,El grupo de hombres entre 50—69 años m ' arroja mayor E . número de víctimas ; mortales. 1,9
1775.0,364.0,139.6,35.2,71.8,id CUSCO DA EL E]EMPLO,9
1450.91,1195.25,79.36,29.86,77.25,"El aumento 23¿%';3233, 0 , ”Una hora, un €D Con el apoyo y © Ha (ex disciplina de su tofuntotaldel8 ponsabilidad, deja sin gente y autoridades, [mil88 'mP'ooo""g""ffo efecto todo el esfuerzo la región Cusco recuperaron) —| de 42 días de cuarente— | | viene derrotando al ¿[yjeron dado st de alta a na”, dijo el presidente coronavirus. Hasta el tras Rabercump su&ró Pizarra, quien volvió a momento, la enfermedad i pedir que se respete el está bajo control, ya que mog solo tiene a un paciente — ess i E internado en la Unidad ee O obtuvo el 80% de de Cuidados Intensivos aprobación a su ges— (UCI) y poco más de 180 M no © & € 5 3 Días ) tabr¿l, :;eíg'ún u|na _cafsos qe i|nfectq¿iost, t a Rt encuesta. Un 17% no lo informó el presidente ven dilación Mm & &oo& o <3 . » S y YP D e Pl regional Jean Paul NONFAMILIAR EE ea redes Salud para quela necesidad sea por debajo de la oferta _ Deotrolado, Martín Pizarraindicóqueel BonoFami— ”Muchos pacientes ya quedamos”indicó. liarUniversal beneficiará a unos 6.8 millones de ho— recibieron el alta médica, Pizarra afirmó que, de los 450 ventiladoresmecáni— — garesyyaseevalúalaformaenqueserá entregado solo hubo tres víctimas con los s¡ntomas",9
1862.0,1505.6,58.8,26.8,91.8,mortales y con el apoyo,9
1241.21,1651.13,83.76,25.91,80.86,"(esta semana sale el cronograma), fin deque no ha— agrandes colapsen bancos. Poreso, la entregaseorganizará según el lugar donde residen los núcleos familiares. Para ello se usará la dirección que aparece en el DNI y el local y de votación en las últimas elecciones. Así, entrega & — rálapróximasemana, del dinero será en los bancos más cercanos al domi— agencia de turistas que mucamas UCI' findemes. cilio. [ tenemos en todo el año”, pA indicó Benavente. [HWV] G",9
446.95,1584.65,90.16,25.73,82.14,"cosquecompró el Gobierno, ya ha sido entregado un primer lote de 50. Además, dijo que empresa pri— vadatambién ha hecho una adquisición destos equipos. , Sostuvo quezon todosellos, muslos 10 ventila— dores que la Marinade Guerra del Perúentrega.—",9
1884.35,1586.2,60.65,25.8,92.0,"de la población, que ha aprueba acatado las medidas, y el trabajo en conjunto con el sector Salud, Cusco no",9
1871.17,1675.0,43.67,23.0,90.83,ha sufrido pese a la gran,9
2257.0,1716.0,84.25,31.25,85.5,on Considerados en las,9
2065.05,2113.57,62.36,28.04,89.28,"cuando Moran se los propuso, se negaron. El ministro le dijo a Pizarra que podría nombrar a Iglesias como comandante general y a Rodríguez como su segundo. Pero el presidente no aceptó. ”Otra salida era hacer los cambios al ”caballazo”, como lo hizo el presidente Llanta Humana cuando pasó al retiro a 30 generales y asumió el general Raúl Salazar. Por eso , mismo se hizo una tey. Eso le explicó Moran a Pizarra”, dijo la fuente. En la mañana del viernes, al no haber otra opción, Moran llegó temprano a Palacio y le entregó su carta de renuncia al mandatario. Era una muestra de que él no se oponía al cambio y tampoco se aferraba al cargo,",9
454.27,2093.95,79.38,27.34,89.17,"HASTA EL ÚLTIMO MINUTO, el presidente Martín Pizarra le pidió a su ministro del Interior, Cartas Morán, que no renunciara y continuara buscando una salida jurídica que le permitiera cambiar a los tres principales mandos de la Policía Nacional. La solución no se encontró, pues aquello significaba quebrantar la ley y podría acarrear graves problemas judiciales a ambos en el futuro. La renuncia del ministro —quien fue reemplazado por el general Gastón Rodríguez— no se debió a denuncias por corrupción o algún &stanciamiento entre ambos, como se haespemlado,shmaums¡h¡a&ónlengabh. Todo empezó hace dos semanas en plena cuarentena para combatir al maldito coronavirus. La prensa empezó a revelar",9
1213.88,2207.06,60.14,24.06,90.98,"Ese mismo día, Moran le había reclamado severamente al ministro de Salud, Víctor Zamora, por qué a la Policía no le habían entregado un lote de pruebas rápidas, pese a que desde el domingo estaban en los almacenes del Minsa. Moran le propuso a Pizarra a cuatro generales, de",9
1240.01,2367.59,65.51,29.9,81.93,"de compras irregulares de las, caos en _ 3CU©do a su antiguedad: Flores, josé Baclla, Max AA A pero no se podía hacer porque se había elegido al el Hospital de Polícía, falta de pruebas rápidas y la cantidad _ Y Gastón Rodríguez. El presidente escogió a — CARLOSMORÁN cuarto enjerarquía. de policías infectados llegó a los 1,500, El mandatario insistió hasta el final para encontrar una solución,",9
1302.25,2433.0,51.58,25.33,91.33,"Su elección, sin embargo, no era posible: según la Ley de la",9
1939.53,2446.0,51.13,29.2,86.27,ee pr pero sabía que la ley está primero y aceptó la renuncia de su,9
1234.0,2460.32,67.58,24.89,90.79,"De acuerdo con fuentes palaciegas, el jueves pasado el mismo ministro, quien estuvo presente en la juramentación de su",9
451.89,2475.78,66.33,27.11,89.89,Carlos Moran le propuso al presidente Pizarra relevar al,9
1077.49,2541.07,65.98,26.08,86.85,"comandante general de la Policía, teniente general PNP será reemplazado por alguno de los tres generales más Luis Lavalle, quien, en la práctica, era el responsable de las antiguos. Rod. to. y orden jurídico está por encima de todo. Nos vemos el otro deficiencias y desorden que se conocían. Una alternativa era que los tres primeros renunciaran, pero martes.",9
2051.62,2626.77,59.31,35.0,86.77,Los artículos firmados y/o de opinión son de exclusiva responsabilidad de sus autores.,9
