left,top,width,height,conf,text,page
1542.62,2380.42,66.39,27.01,92.38,"¿Por qué nos quema el sol? El sol mantiene a nuestro planeta lo suficientemente cálido para subsistir, nos da luz para que podamos ver, pero también nos puede quemar. El sol nos envía grandes cantidades de energía. Existe la radiación infrarroja, que es calor, la luz visible, que es la que podemos ver, y la luz ultravioleta, que no podemos ver, pero allí está y puede quemar nuestra piel.",20
1965.5,2403.81,60.19,25.94,90.43,"Es un lagarto de tamaño medio, con un cuerpo cilíndrico, corto y grueso. Parece",20
484.63,2532.26,70.36,27.12,92.49,"Esta expresión nominal se documenta en el Perú, Bolivia, Chile y Paraguay, con el sentido de da que se prepara con el aporte de varias personas, para indigentes o víctimas de algún desastre natural. En realidad, la olla común se realiza cuando hay necesidad y faltan los recursos. Manuel Scorza escribe en La tumba del relámpago: “El año pasado, durante nuestra huelga, Yarusyacán contribuyó para nuestra olla común. Nos envió víveres”.",20
2332.0,365.5,143.75,44.25,61.37,“ALA RESPUE$EQ C U[fnl?,20
2430.12,1829.5,66.75,27.5,86.61,el eslabón 4 Ibérico es un: A. Elefante,20
2125.07,2612.62,83.72,26.21,89.79,"una serpiente, pero tiene pequeñas extremidades. Posee cinco dedos en cada pata. Habita en toda la Península Ibérica. Son animales camivoros, comen moluscos, lombrices, larvas, arañas e insectos.",20
2411.86,635.71,75.0,28.64,92.31,Lee bien la información que sale en esta página y responde las siguientes preguntas:,20
2415.5,812.0,76.83,26.5,91.15,En la mitología es una criatura,20
2407.0,884.17,91.83,41.67,91.98,que solo puede ser domada por,20
2310.0,1029.6,87.4,26.6,80.12,"corazón: A. Manicomio B, Pegaso",20
2280.0,1106.5,45.25,17.25,57.16,AM Minotauro +,20
2378.23,1393.08,76.23,24.69,86.64,A. Abundancia y apogeo E Plata para cocinar Necesidad y faltan los recursos,20
2373.5,1623.9,79.2,29.3,83.81,Es una luz podemos ver: A. Infrarroja E. Ultravioleta Solar,20
1586.58,229.33,265.58,34.75,78.49,"espuésqueelabogado de Jefferson Harán revelóqueel futbol is taa porta a Melissa Klugmilesdesolesmensualmenteparasushijos,la BlancadeChucuito' se encuentra bastante afecta day pre ocupada porque teme por su",21
1476.52,691.14,221.43,31.76,73.07,"pors¡llamanlaatenc¡onpomueseparecenmuchoasupapa | A (efferson),yahoraconestodelascifrasquerevelóelabogam do,lasituaciónse poneterrible.Hoyen díatematanporun N » ¿Melissaestá pensando ! final no hay lugarmásseguro queen hogar. NO SEAFERRAASUSHIJOS",21
1712.28,1064.08,238.68,32.6,73.54,"tade mantener la tranquilidad y cal» maensufamilia,pueslosúltimos dias hap referido pasarla junto a 3 sushijos,conquieneshacomparti3xX dondesemuestranacostadosjuntosenunacamaytambiéndisfru- tan do delmar de Asia.Además, espera realizar le una pequeñareuniónasu hijo Adriano,quien mañanaestádecumpleaños. Sinembargo,Melissanoha querido desaprovechar la oportunidad para utilizar",21
240.0,1213.0,184.25,91.0,59.99,“ — //J%¿v! f,21
1063.09,1647.07,160.18,33.16,68.53,"re hacen sus redes sociales y enviar Muchas, veº?añº masdeu mensaje sub liv minal,queestaríadirigique quieres . doaJeffersonFarfán. Y — “Muchasvecestehacen tantodaño,quequieres hablar y decirlo que se merece, pero novale la peºs na.Créeme,todostienen unaversiónde loshechos. una Dejaqueeltiempoponga CA D acadaunoensulugar.Callaresdesabios”selee. o Además,compartió eltexto:“Son- - - ríebonita,quese necesita mucha eQ LUGARES DE'5A_8;93""“ o locura",21
414.63,2435.75,70.93,27.21,89.2,"l CD Laura Forlini se sumó ————— a las innumerables críticas que recibió Melissa Klug, tras conocerse que Jefferson Harán aporta 43 mil soles mensuales como pensión para sus hijos. “Es un poco buscar la sin razón, pelear por pelear, fregar por fregar. Me imagino que Melissa debe tener sus razones para estar molesta, pero no es la forma de botar esa molestia, , no es adecuado y no lo ha manejado j inteligentemente”, comentó la con[53che que e Melissa ( doctora de “En exclusiva"". pelea con Harán",21
602.43,2709.3,69.0,29.13,86.39,“Yo entiendo que muchas veces porque nota superar - Melissa ha salido a hablar y lo ha __ cosas del n sado —,21
1712.14,2383.87,69.17,27.29,89.69,"hecho dolida por lo que vivió, tal vez por sentirse engañada... y esas cosas cuestan superar, f muchas veces ha hablado por la herida"", añadió la …x i conductora. Y *PIENSEN EN SUS HIJOS? Por otro lado, la cantante Katy Jara aconsejó a Melissa Klug y Jefferson Harán recapacitar porque los únicos afectados son sus hijos. “Como madre me pongo a",21
1927.75,832.5,141.25,25.75,56.66,"Entanto,la'BlancadeChucuito'tra_“ , N",21
1750.5,2681.82,51.32,30.23,85.56,"| pensar en los niños, en lo expuestos que están y que no / / Ies hace nada b|en en su for",21
2376.51,1229.29,62.24,27.36,85.31,"C(D La conductora de “Estás en todas Sheila Rojas, se esta dando una nueva - oportun¡dad enel N Xx amor, pues reveló * que no está soltera, sino acompaña da de un apuesto . galán extranjero. “Estoy soltera, pero sola “Y no. ¿Si estoy & | acompañada? — Obviamen"" te que una tiene pretend dientes y no se puede negar. Es de afuera, pero novia dar / detalles. Estoy /' empezando bien el 2020, acompañadi* ta y no tengo nada ¡ que ocultar”, dijo la conductora. De otro lado, precio so que no está en a contra de las virus , días estéticas. = “Nunca he negar do el tema de las operaciones, siempre - he dicho que estoy favor de los retoques. Tengo un centro de estética y obviamente tengo que probar todos los tratamientos”, acotó.",21
2328.44,1975.89,95.0,41.89,75.07,"22 Afirma que está empezando, [le| 2020 acompañadital |",21
2363.59,2432.53,72.74,28.0,87.05,"mación, al enterarse que sus padres pelean a nivel nac¡onal Ojalá puedan ,_ sentarse, ceder y arreglar sus problemas *? como adultos civili* 7 zados”, comentó. Además, dijo que le parecen excesivos los calificativo de 'vividora hacia Melissa. “Ella ha sido clara al decir que esa cifra la puso Harán con su abogado"", comento. (F.L/ ECHO",21
1006.38,152.38,102.88,27.25,88.96,22 (FIESTA) MARTES 11 DE FEBRERO DEL 2020,22
1860.42,609.09,133.86,32.35,75.08,"atras Brivio,quienlució rejuvenecido, fue presentado como el conductor de o “La Máscara; el nuevo programado Latina; y conque tomó la decisión de dejar 'Estoes guerra” para pasarmástiempoconsufamilia. “La Máscara' salelossábadosy mi familia estaráconmigo deludes aviernes,queera algo que no puA| dehacerdurantemuchosaños. Nomequejo trabajo Yy hay queestaragradecido” precisÓóMatras. 2 ¿Tuviste problema con Améri| F ca para poder ingresar a Latina? [ No. Yo norenuncié, simplemente ,' norenovécontrato y no huronian",22
383.47,854.96,65.14,27.64,89.08,"©» El vocalista de “Los Iracundos; Jorge Gatto, aseguró que el romanticismo en esta época todavía no se ha perdido por completo. “Pienso que nuestra música se ha transformado o cambiado. Ahora el lenguaje que se usa ya no es el mismo, creo que hay que ir adaptándose a las nuevas generaciones, por la forma en cómo hablan o entender los nuevos códigos del romance de siempre”, argumentó —| , el cantante, quien este jueves — '%% Asegura hará un show en 'Bianca' de Duque el",22
386.8,1120.8,102.6,35.8,74.4,Barranco. [F. López) 6 jromantícismoA,22
1859.94,1202.67,151.29,33.67,73.13,"gúninconveniente. ¿Mantienes amistad contar per) seas que trabajaste? b Terminé(micontrato)enmedio deuna buena relación. No creo que || haya algo quereprocharnos, todo estáperfecto. =—] ¿Quéteparece el ingresodejazPinedo a'Esto esguerra”? l Laverdad que no estoy viendo muchatelevisión, pero asícomoyoestoyasumiendo unreto,elta tam, biénloestá haciendo. Conozco y le deseo lo mejor,estoy seguro que también leerá bien.",22
1201.21,1520.93,87.57,22.43,79.59,". Ahoravasacompetirlossá, Erika Villalo... bados con Gisela Valcárbos le las col...",22
506.52,1673.59,69.41,25.74,85.32,"orejas' a su esposo Aldo Miyashiro, por no contarle que conducirá un nuez vo programa en América y Televisión, que competiría con 'La máscara', donde es",22
1928.53,1652.4,136.07,31.93,78.88,"Eltaesuna persona em, temática de la pantalla y sería un honor competirconella.Soncosas quesedanenlatelevisión. “LaMáscara se estren a el",22
1022.86,1831.48,80.14,32.14,72.56,"una dehlaíj '¡r;1vestigadoras'. | f xt_ próximo29de áebqer0,yel “No me ha dicho nada, voy , p , - - NE . v',areclamarle cuando llegue a Nuevo citación de investigado",22
462.46,1968.39,64.75,26.57,82.22,"¿/ la casa. El tiene un montón de cosas, proyectos, conversamos de algunas cosas, pero no sé ¡ todo. Ahora me tiene que explain cardijo. (D.B] E",22
1887.67,1936.11,133.67,32.89,88.04,"rasque serán:Gianella Nema Erika Villalobos,Carlos Vílchezy Armando Machuca,",22
1176.8,2033.8,141.0,64.0,46.42,N para ten en mas ¡ yle Q,22
1824.17,2037.0,209.67,29.5,90.0,quienes ayudaránalostelevidentes a descubirirquiénes sonlosi6artistasqueseocul,22
898.46,2138.5,118.96,37.65,71.58,"r no decirle que tendrá nuevo programa' - tandetrásdeuna máscara.(D. — los sábados y serían competencia jese a lo me jona jazmin » a V —Ú¿L*“—.º7____:_' _7'—.,—'º'_ T £ , -—I—_,=_",22
1092.68,2349.75,68.64,27.38,89.37,"©D Daniela Harcourt aseguró a coincidir en algún hay cordialidad y despegue le falta “'comprensión lecevento. to”, añadió Danieta. tora' a Yahora Plasencia, porque “No creo que haya un Finalmente, ponella nunca afirmó que su hermano abrazo, dudo de que tó que no tiene Jorge la agredió en una discoteca. nos pongan cerca en problemas en “Lo único que puedo decir es 'comlos horarios de pre aprender se la",22
1979.88,2495.0,56.62,32.12,74.37,"letra de “Cobar'<—,W el nuevo tema P",22
1448.67,2493.17,73.67,24.0,87.59,sentaciones. No % nos hemos sala,22
422.23,2490.31,66.23,27.08,84.93,presión lectorar. Te lapida por un “creo” pero pienso que hacer una acu,22
1028.29,2568.74,67.12,31.12,79.53,"nación es distinto, y yo en ningún ; A 7 º_ que prom ocio momento lo hice”, preciso la intérprete Eo?¡:cerg:5¡ I'%fal*taj ¡..x¡;> na Yahaira, tal de “Señor mentira"". ¡comp o comO lo hizo con",22
571.5,2645.1,70.7,29.6,79.71,"Asimismo, dejó en claro que no existe ,|eCtºra' porno _«",22
579.48,2695.24,72.33,30.1,84.43,"amistad con la 'Reina del totó, ya que ¡entender lo que dijo ta=6 descartó darse un abrazo si vuelven sobre su",22
1988.92,2694.92,59.31,31.92,62.09,", 3|aanteriorcanN? ción Y le dije MN nO (F. López) S 2",22
1484.8,2700.6,49.0,27.1,88.43,"Lo cortés no te quita % lo valiente, creo que",22
2400.21,896.31,69.33,26.18,86.06,"o ME 6 BARRULNTO. Llego embalada para contarles las últimas de NICOLA PORELLA reapareció en pantallas junto a KARINA RIVERA, y comentó que los años lo han hecho madurar y aprender de sus errores. Además, que anda soltero y sin ganas de volvera enamorarse. ¿Y Angie?.. MARÍA PÍA CAPELLO compartió una foto con el cantante ESTOY y contó que casi se desmaya al encontrarlo en una exclusiva tienda en Miami a donde fue a comprarse un vestido para una",22
2404.83,2149.95,69.29,26.77,89.02,"fiesta. Bien ahí... Un supuesto audio de TURBE alborotó las redes sociales donde se le escucharía decir: Voy a bailar como BA para quedarme con [EFFERSON. ¿Qué cosa? Pasaron las horas y la “Princesa Inca' no lo desmintió. Hummm... Las cámaras de 'Magaly Tv: la firme' emitieron anoche un amply de SACO ESXENAZI saliendo de una discoteca a las 6 de la mañana, pero sin VÉRTIZ. Ayayayyy... La actriz KARINA CALLET dijo que le gustaría retroceder el tiempo y conversar con las personas con las que tuvo algún desacuerdo, porque lo importante es la amistad. ¿Será para Bueno, soy fuga porque mi amorcito anda estresado y necesita una sesión íntima, Suuuaaaveee...",22
440.5,602.83,63.17,26.08,92.86,"Tras perder hace unos días a su abuelita Lola, el productor musa",23
378.18,729.25,67.25,24.75,91.05,"cal Tony Surcar afirmó que le dedica Su exitosa carrera “Mi abuelo tuvo un accidente pero felizmente sobrevivió y, una semana í después, mi abuela se rompió",23
340.16,942.16,67.39,26.03,91.63,"la cadera. Estuvo peleando por Su vida casi un mes, pero hace una semana falleció. Ha sido un momento muy difícil para toda la familia”, recordó el ganador de dos premios Grammy Latino. Asimismo, no descartó tra",23
814.0,1164.5,92.0,40.75,81.4,Encontró que falleció hace,23
337.79,1317.09,92.16,32.35,85.31,"bajar con Yahora Plasencia. “Hay tanta juventud haciendo música y se presta para ¡'* hacer cosas increíbles”, aña— y= dió el percusionista, quien Qg_, este 18 y 19 se presentará en el Gran Teatro Nacional con toda su orquesta y artistas invitados. (F. López) G [GRANIMAESTRO]DELWAMORI =. J_ a MAE_STRO]DE[FAMA INTERNACIONAL'.CON ASIDE É 5'ANOS'DEIEXPERIENCIA'ENYS'CIENCIA",23
407.36,1771.27,84.91,17.45,90.97,"FUE E CURADA D * FLORECIMIENTO DE HOGAR, NEGOCIOS Y EMPRESA",23
396.75,1846.25,273.25,36.25,42.61,LOSIOLIVOS: ICODPWIVIENDMHIJDS!DEIGARAGAY¡ (AVAUNIVA ATOMASIVALLE),23
570.91,2132.35,66.03,20.39,80.04,"ÍSB""&F£E&8::LF DENTE us'ínu.us'cb“ínírb's'ñe NEGR'A1 * LA UNICA QUE HACE AMARRE DOMINANDO CUERPO SEXO Y VOLUNTAD. SI TE HUMILLA TE DESPRECIA YE MIENTE TE ES INFIEL. SE TE BLOQUEO DE WATSSAPY NO QUIERE SABER NADA DE TI. CREAS O NO CREAS EL O ELLA VENDRA SUPLICANDO DE AMOR SOLO TRAER NOMBRE O FOTO' ENVIAMOS AMARRES DNA RASTREO* CTABCP 19136152926006 CURO TODO TIPO DE ENFERMEDADES CHACRA, EMPRESKNEGOCIOS FLORECIMIENTO PARA EL AMOR.TRABAJOESTUI",23
551.7,2295.1,152.0,44.1,66.33,'º“ºº945434803 980873979 4241146 ALFONSO USARTE 1346 3er.PISOof. 301-LIMA e,23
295.0,1972.0,159.25,39.75,52.51,RECUPERAR EL'AMO?M POSIBLEÍSINTDANAR a,23
524.25,2390.5,160.75,19.25,74.62,DE: ENGAÚOS&YAFRAUDES'LO ULTIMO EN'AMARRES,23
537.0,2402.17,72.0,55.5,51.96,¡Y;' BS¡' 1 _1 Í ;,23
560.28,2507.0,59.59,25.75,82.11,"BRUJ() w""60 D£¡…0R VENGARTE DE TU HAZ QUE SUFRA POR TI QUE TE SEA FIEL. QUE SOLO TE OBEDEZCA A TI CIEGAMENTE Y NO PUEDA ESTAR CON OTRO INCA DE MAGIA'NEGRAYAMARRE: $EXUAL1",23
419.56,2630.78,128.67,24.3,67.58,"'AMARRE: E$PECIAL”AMARRE MAGIA'ROJAN 'AMARRE: HASTA'L'A*SEPULTURA'AMARRE DE x7ÁNUDOSXYIAMAR ES:| DELL'OSXSLSEXOS T ? AYA 'A, TA CURAMOS DAÑOS: ALCOHOLISMO DRDOADICCIÓN'RASÍREO ROBOS.Y|TE ARRANCA LA RAÍZ DE|YODO MAL'ALEJAMIENTO DE:TUS ENEMIGOS (AS)",23
388.5,2738.33,118.67,23.5,63.05,AV'UNIVERSITARIACDRA.'GO CDRA'ENTRADA VILLA SOL REF (FRENTE'A,23
1214.07,915.2,68.32,27.47,87.98,"GD Renzo Schaller no descartó reunirse con Gian Piero Díaz en un set de televisión, ante el pedido de sus seguidores, a quienes les gustaría ver juntos a la dupla del desaparecido programa ""Combate"". “Vivo el día a día, no sé qué va a pasar mañana. He leído muchos comentarios [de los seguidores), la gente que nos ha seguido es muy cariñosa”, comentó el conductor de “América hoy”. ¿Siguenteniendo una amistad? No voy a responder ese tema. Puntualmente de eso no hablo ni hablaré. *LAFRASE GANADORA DELVERANO' De otro lado, Renzo felicitó la promoción de Tome “La frase — . y ganadora del verano”, que rega”I la 2 mil 800 premios en efectivo. “Es una muy buena promoción, — « ya saben, junten sus cupones para ganar un billetito”, acotó. [D. Bautista) O",23
2109.3,1042.21,63.4,26.74,90.11,"El cantante Debéis Rosco contó que este año no tiene planes para casarse con su novia, Cassandra Sánchez. Sin embargo, no descartó que pueda darse en el futuro. “Mi vida privada la voy a manejar en invado pero el día que se dé [el matrimonio) lo sabrán. He aprend¡do que uno no sabe lo > que pueda pasar mañana, así que trato de vivir y aprovechar los momentos tan maravillosos que estoy pasando. El t¡empo dira, pero estoy muy feliz”, sostuvo el “'Bomboncito de la cumbia” en el programa 'En boca de todos”. Asimismo, negó que le haya regalado un anillo de diamantes a la hija de Jessica Newton en su último viaje a Disney, pero reconoció que tuvo un lindo gesto hacia ella. | Además, acaba de grabar el videoclip del tema “Por ti, que identifica a la pareja “Paloma' y “Henry' de la serie “Chapa tu 6",23
2136.22,1159.89,82.22,42.89,77.49,1 disfruta su relac¡on con que los fans; Cassandra,23
2269.6,1658.4,82.4,18.4,85.45,"AIRE EN 12 PODEROSA MAESTRA FATIMA, CON AMPLIA EXPERIENCIA AYUDANDOTE",23
1041.5,1803.0,63.75,26.75,43.53,"y, coma I…..º SA",23
1349.0,1846.73,154.64,58.91,55.58,CUANDO cmncp191zeeemmss momnog¡uwn ALONSO 1907083008 ss 057662555 AZASOBOTATEN DESDEÍGAM HASTA tPH,23
2106.8,1882.8,314.0,32.0,62.4,'AVILOSIPROCERES 7¡78 PRIMERAYDEIPRO PAN'NORTEÍLOSÍOLIVOS ÚUNICAIDIRECCIÓN,23
1885.62,2269.29,125.12,36.54,56.53,"ÁVENGAYCONIFE SÉ NADAUMPOSIB = . , %W£%%3&VT3 SUGUIRSALIES E] o 1…í… (e I A = 101M' 1&'¡'!H?4269 Í S ©99098.3.2417 (¡: mecdgytglr'a deJAv: ¡?bancay)]",23
2390.25,2389.0,98.0,31.0,40.12,R VIVÍS I IC,23
1363.33,2468.5,96.5,27.17,78.26,) SE REALIZAN TRABAJOS'A CORTAW.LARGA DISTANCIA',23
1508.67,2522.21,66.21,18.62,83.9,"SOLUCIÓNATUS PROBLEMAS DE SALUD. DINERO Y AMOR, TU ENEMIGO OCULTO EN UN ESPEJO BISELADO DE rr( SIETE PUNTAS CURAMOS ENPRESAS, CASAS, MINAS Y NEGOCIOS",23
1305.94,2598.76,77.59,25.47,69.66,"O SI CAMBIADO ¡ TENEMOS LA' AUINSTANTE""LO, HACEMOS REGRESAR'PORTAMOR! ZA OJCAPR! DEL AMOR NO IMPORTA EL SEXO",23
1243.67,2656.56,126.0,33.89,56.52,AV'ALFONSO UGARTE(1454'0F7402: UN NDE a ¿*:%A TEM';%¿EQ rºº..m1:z |a“Pl5zía'aolognes¡),23
1376.4,2694.0,50.3,39.3,84.67,UNIÓN DE 7 NUDOS 9946 767 457 9988 412 274,23
1302.27,2748.55,62.0,18.36,81.68,EN 3 HORAS CON NOMBRE COMPLETO BCP: 19136267598035 “a O) DE AMBOS Y EN TU PRESENCIA Banco La Nación 04346009441 —= —,23
2352.8,2558.87,41.0,17.47,75.23,"- PARA ESA PER$ONA QUE TE A JURO AMOR Y HOY S NGANA, d AS",23
2331.4,2688.33,68.8,19.0,73.74,ATENDEMOS EN 28 DE. JULIO N' 296 HACHO ?' PISOOF.N*4 FRENTE A LA SUNT,23
1403.25,722.79,130.0,27.84,77.58,"levisión. “Vamosaseguircon la mismalínea (de despuésdel show”),con muchosjueg0s,mucha diversión, nos acerca remos misal público,vamosa salir adelantó Ethel. Cambiar el nombre al * programa se debe a que Gisela no regresarán El artista delaño""... No,Gisela regresa enabril.ConGVestamos lanzando América hoy; luego viene Mima| cocina mejorquelatuya'y en abril rey gresaGisela. *Mujeres al mando' se quedó sinjazmín | Binedo, ¿cómo ven ala competencia? |< Puedestenerunconductoryhacerlobien. Nosotrosingresamossinsentirnos más 4 quenadie,laidea es divert irnos y que lepaya 5-% bienatodoelmundo. ! ¿Podríantener visita de Fagaly Medi",24
390.3,913.3,137.34,28.7,81.16,"the Pozoaclarógueno “carga una mochila' por ser la hija de Gisela Valcárcel, y porelcontrario,leencanta haber heredado las'señitos”. “Nosientoquecargoconunamochila, encanta ser la hija de Gisela. Cadavezlagentese va dando cuentaquesomosdistintas, me siento feliz de haber heredado alas'seEthe,quienjunto a RenzoSchuller, Natalia Salas y Edson Dávilaregresanestemiér“ colesalas9:30dela mañanacon",24
1421.7,1130.4,147.0,33.1,82.0,"ex Nosotros tenemos ningún problema, pero hay acuerdo sen los canales y nose puede.",24
2092.96,760.85,68.35,27.96,88.19,"(D La líder de 'Son tentación; Paula Arias aclaró que está soltera, lue— % go que el programa 'Magaly Teve, la ; | firme' la apagó en un restaurante — Y la Costa Verde, acompañada de un misterioso galán. “No era una cita, fue una reunión de trabajo con un empresario para ver algunos eventos a nivel nacional. Déjenme soltera y sin compromiso, porque así estoy mejor y feliz”, sostuvo. Soltera, perros galanes note debenfaltar... Sí, pero estoy enfocada en lo mío, en mis hijos y en la agrupación. No tengo tiempo para los pretendientes, no deseo ningún tipo de distracción. [L.Gamarra) O",24
2133.67,1169.25,96.75,45.25,79.03,"[Aclara que 'ampay' fue una c|gn__a] de trabajo con em empresa ,",24
967.56,1231.33,102.61,27.28,72.65,/'K 'América hoy; porla señale América Te' Nosencantaríateneratodos.(D. Bautista) — ¡___ z - - —— — *,24
2246.5,1313.7,72.7,31.0,76.24,— A* < … > Agnella Negra aseguró que con,24
1133.58,1419.54,63.83,27.58,89.61,"infórmenme y si quieren glúteos de infarto, que me busquen. Soy la experta en glúteos i y última “Miss colita Reef”, indicó Luján.",24
788.61,1438.83,70.78,27.11,93.23,"na Lujo criticó a Tiesa Lozano por promocionar unas pastillas para adelgazar, donde aseguraba que la",24
1119.5,1809.0,52.62,24.38,84.28,no se casa con nadie. L. Gamarra] <],24
760.71,1815.0,72.86,26.71,92.81,"informarse. Por favor, no se dejen estafar,",24
1105.0,2333.67,125.5,42.67,70.24,room dlabetlcºs hipertenso y cardiacos TRATACNECTO,24
1433.58,2519.84,60.74,23.0,81.82,Y Lograrás tener erecciones firmes y duraderas. NE E EE | 7 Mejor recuperación después de cada acto sexual.,24
402.12,2560.05,55.14,20.4,89.51,"= APTO para Diabéticos, hipertenso y cardiacos. Fórmula Americana 100% natural, ahora en el Perú. = Tenga una erección firme, mayor deseo, máxima duración, mayor volumen y grosor “ Para hombres de 20 a 90 años. DELIVERY Gratis a todo el Perú",24
319.0,2638.75,150.5,31.5,76.49,entrega totalmente confidencial 01:01-7028700,24
1150.56,2671.56,121.78,34.0,57.08,"DISFRUTE DE UNIDA SEXUAMACTIVAW PLACENTERA! '£ el 2,€I'ratam¡ent¿al 2989882824",24
1370.83,2752.0,95.33,20.67,89.38,DELIVERY GRATUITO A LIMA Y PROVINCIA,24
1618.73,1662.76,64.86,27.16,89.05,"grasa del abdomens “Con las chicas nos reunimos siempre, no vamos trasladaba al terrier llamó 'cabeza hueca dejar de vernos [por el cambio de canal), herede las chicas que lo mos amigas hasta viejitas. Vamos a hacer el show consumían. Los adjetivos se los “Mujeres de la PM' y varias cosas que teníamos “Qué tal burrada lo que - gana ella misma. TV vi a Lat comentó la actriz, agregando que se ha dicho. Hay que estuMagaly es mi conduce siente feliz de regresara dar un poquito más e — tora favorita, es sincera seguirá en otros| “Latina fue mi casa por muchos años, samplemen",24
1658.0,1792.0,95.0,33.75,69.08,". roy$aos con Rebeca,",24
1456.14,2572.0,70.0,20.86,83.43,v También tenemos tratamiento para la próstata.,24
2221.04,1434.04,77.5,26.58,90.03,"C tinta su amistad con Rebeca Escribens, Katia Condos y Almendra Gomelsky, tras ser presentada como 'investigadora' en el nuevo programa “La máscara' de Latina.",24
2208.44,1810.56,71.5,27.0,90.47,"te es volver y comenzar una nueva aventura con amigos súper chéveres”, acotó. [D Bautista) º",24
2039.71,2126.66,71.2,25.46,90.46,"v ÚNICA cápsula 100% americana. Y Para hombres de 20 a 90 años. Y Erección FIRME, máxima DURACIÓN, volumen y GROSOR en una cápsula. Y 72 horas de potencia. v Aumento semmel Y Efecto rápido",24
2258.5,2391.0,95.75,26.0,74.01,tiradores MEJORES MUÑECAS vagas,24
2195.5,2484.83,114.5,53.17,80.23,EL TAMAÑO IMPORTA .- POTENCIA SEXUAL,24
2140.31,2616.98,97.11,21.49,81.33,"AGRANDA Y ENGRASA EL MIEMBRO MAL DE PRÓSTATA E IMPOTENCIA — mcc'º” INMEDIATA Y DURADERA ADIÓS EYACULACIÓN PRECOZ ——— CUALQUIER EDAD 100% NATURAL EXITANTES, Yhomblna,caramelos,ºeromonss.lulb dilatador ENVIO GRATIS A DOMICILIO Y, PROVINCIA ©“BCP I99599431 7 É ORIZ|BREÑA CUENTO Í. 4230805 AV ABACAY 270 toda 122",24
2256.83,2748.33,53.83,32.5,74.76,AY ALFONSO USARTE 1064 06 20,24
2483.14,2742.57,66.71,22.29,71.12,< >=5-1090 CAI.LE NUEVA 466 of 202,24
1686.0,153.56,129.22,29.33,82.78,MARTES 11 DE FEBRERO DEL 2020 TN (CRUCITROME) 25,25
1294.0,404.87,200.87,39.67,63.33,"& NOMBRE: 'E… ] DIRECCIÓN: Solotienes) UG©GIWGB apostarlo 5 lugares ú'ír¡m%g, DISTRITO: m3133&393 - a",25
1395.38,723.21,45.25,20.12,67.28,"q LUCIFER DEVOTO PADRE ue FR | DEDICARA ] . sE ' swsco.o . — | PASADOR = — Y - SELENIO EN ,",25
1459.5,803.67,49.42,18.58,68.63,", a ; ELLAS EXCÉNTRICA - R SEPULTURAS Y a. one Y",25
1657.25,1068.25,13.75,39.75,87.04,CONJUNTO | DE DOS,25
2384.83,1174.17,52.0,25.5,78.43,! APUNTE VIVIENDA DE AVE [PLI,25
851.25,1264.75,64.25,31.75,72.4,EL LOS | COCINA,25
1072.3,1123.3,36.4,51.1,73.21,D 2:l o Z €o = un — » m,25
1064.44,1796.67,72.56,47.56,67.34,"- INTERJECTION 7 I - ""LACAJA - o ocu mem L",25
1490.5,1912.25,26.75,10.0,77.59,- - IDENT F,25
508.25,1839.5,40.25,77.75,83.49,E NOMBRE | DEJARON,25
1309.1,2042.1,143.5,56.2,71.74,- Z TÁRTARO ARR¡BA < ARYICULO“ INGLE S) -..,25
