left,top,width,height,conf,text,page
2383.0,785.52,90.89,26.04,92.61,"asesoría para Obrecht. “Prestamos en algunos momentos servicios a Obrecht, pero era de naturaleza regulatoria y cuando me contrató Obrecht no tenía ningún cuestionamiento público”,",8
2219.66,1059.61,67.05,28.71,86.55,": MILAGROS SALAZAR indicó : poco a poco los Indico. . peruanos conocen embargo, en su decla| serán la entraña ración jurada de intereses, corrupta deteste no consigna haber brindagob¡erno do tales servicios. — El referido trabajo de asesoría se realizó en el año LO RECONOCE 2012, y fue con el objetivo",8
1965.29,1283.18,71.24,26.06,91.88,"Tras el informe periodístico, el ministro emitió un comunicado en donde reconoce que sí realizó",8
2400.53,1265.53,79.4,28.0,86.95,de “definir si el proyecto (Gasoducto del Sur) era financiado o autosostenible”. Hernández)S,8
2366.4,1466.0,109.8,39.2,51.44,amiga CONOCIO Que eS y,8
2052.22,1605.78,172.0,53.11,70.28,"w& A|a expres¡dente Enmmaniite mmºmº N E911 secretario ,",8
2173.46,2065.46,73.6,33.89,89.13,"salgo, gracias a Dios, me invitan”. Su caso llegó a la Comisión de Et|ca que entonces presidia Humberto Lay. Semanas después, fue archivado por Lay, Rogelio Canchas y comino podía ser de otra manera",8
2156.26,2340.39,74.67,28.39,91.79,"Mauricio su compinche León tenía una suerte única. El año 2016, el entonces fiscal de la Nación, Pablo Sánchez, también le archivó una investigación por enriquecimiento ilícito. “En estos casos las pericias son determinantes. No había un desbalance importante”, dijo Sánchez. En el disuelto Congreso, los fuji a pri stas colocaron a Luciana León como presidenta de la poderosa Comisión de Defensa. Era como poner a la muñeca Barbie como jefa del Pentágono. Su única misión fue atacar, investigar y denunciar, sin prueba alguna, al ministro de Defensa, Pedro Cateriano, el principal",8
2189.0,2544.25,58.58,27.67,87.29,_ cancer b ero de Alan García y el fujimorismo. Se trató de una,8
2175.9,2625.33,68.33,28.5,91.46,"venganza política, a la que León se prestó. Todas sus denuncias contra Camerino fueron archivadas por la Fiscalía | de la Nación. A estas alturas, muchos se peguntan: ¿Cuántos clientes",8
2145.8,2719.5,60.5,27.6,86.13,v .7 más tuvo Lucianita? Nos vemos el otro martes.,8
2190.0,2784.31,58.54,22.54,89.99,Los amigos firmados y/o de opinión son de exclusiva responsabilidad de sus autores.,8
1414.33,153.33,101.17,25.67,93.14,MARTES 11 DE FEBRERO DEL 2020,9
315.35,1508.8,66.9,27.27,92.67,"sus 74 años, el destino de Luis Castaña Bosnio parece estar tras las rejas. En la audiencia de 36 meses de prisión preventiva, las pruebas expuestas ayer por la fiscal Milagros Salazar revelan sospecha 'grave' de que habría recibido más de medio millón de dólares de Obrecht y OAS en sobres",9
284.14,2281.25,71.29,27.49,89.17,"habría lista única para la presidencia del Congreso. A la cabeza esta ría la lampa, Alianza pa ra el Progreso, Somos Perú y el Partido Morado. Vamos a ver qué dicen los de Podemos, UP y los “pescaditos' del Frepap. ¿Se resistirán los fuji mori stas a llegar a consensos...? IMPUNIDAD echarme Omonte, virtualmente elect ta en el partido de César Acuña, afirma que la inmunidad parlamentaria q solo ha servido para la H impunidad y",9
373.0,1902.17,53.0,28.5,85.16,Nos pasan la voz que i,9
680.67,2221.67,54.0,24.33,87.66,; por eso en otros países,9
943.04,2273.82,71.89,29.57,85.91,": declaración jurada, Ella : mala eliminaron. iFuera : dice que no lo hizo pori los corruptos...! : que fue 'subsanada al : “MECHITA : irater apia psicológica.",9
699.58,2418.58,59.42,30.84,89.86,"i el general (r) : Otto Guibovich, electo ¿ por Encash y vocero de N Acción Popular, el pri",9
684.4,2539.4,59.6,25.6,83.44,; h Congreso debe ver,9
1111.67,355.56,113.89,41.56,91.68,audiencia Soltó sonrisa nerviosa y se rascaba la cabeza,9
1130.36,864.01,65.29,26.09,88.47,"junto a su ex mano derecha, Martín Bustamante (ahora colaborador eficaz), su exiliado en Solidaridad Nacional, José Luna Gálvez, y su funcionaria Giselle Agarra. TWHATSAPP Según la fiscal, a Agarra se le descubrieron mensajes de Whatsapp con Leo Pinheiro, expresidente de OAS, por lo que es acusada de ser el 'nexo entre el alcalde y los brasileños:. - Bustamante es sindicado de RA recibir toda la plata con el codi no me de mientras que a Luna se le A d imputa el dinero a través de la Universo",9
803.75,992.75,23.75,6.0,64.51,"N , — Qe",9
1011.76,1486.49,75.36,31.93,84.48,"' y dad Telesup. — Castaña lució o hay sospecha mirara la fis'grave' e cal. de movía mucho, reía sobornos de Y rascaba la Obrecht y OAS y cabeza.Solo le Y dijo alaprensa: manila. y ""No |puedo hablar, l 1 La investigación apundiscúlpenme”. La INCLUIDO ta a que fue 'cabecilla de audiencia continua",9
1086.33,1743.33,49.33,30.83,67.17,rá hoy. (lordan € F roche..,9
1106.22,2072.54,61.37,27.59,89.83,": Todo se sabe. Aho: resulta que Mónica : Saavedra, quien logró : más votos en Acción : Popular, tiene una sen: tenia en su contra por : violencia familiar. Y en: cima no la incluyó en su",9
1079.2,2542.52,68.85,29.02,85.57,"i Huuurmnmm.. : “CUELLOS BLANCOS” : Según el fiscal Aves lino Guillén, Podemos : Perú, el partido de José : Luna, no debió ser isi grito para participar en : las elecciones pasadas, ¿ debido a sus vínculos i Cuellos Blanc cos: Ayayay...",9
675.6,2507.2,56.4,23.6,86.6,N mer día del próximo,9
731.8,2581.8,46.0,21.4,79.89,_ Se la renuncia de,9
762.0,2669.7,67.4,29.4,88.08,sº Y pensar que un día juró como presidenta. Qué,9
1982.95,2523.67,65.9,23.84,90.73,"¡RESERVA Y COMPRA YA! LIMA 634 2424 LLAMA GRATIS AL: 0800 00 699 VENTASWEB.PERUGDECAMERON.COM - CHICLAYO: (074) 274377 PIURA: (073) 394833 TRUJILLO: (044) 290278 Lima: Av. Jorge Chavez 160 - Miraflores (Cruce con cdra. 8 de pardo - Centro Empresarial Multipropósito 2) TC. referencia S/. 340 Tarifas expresadas en dólares americanos y nuevos soles. Incluyen impuestos y cargos obligatorios. Solo hotel: Tarifa por adulto por noche en habitación estándar y acomodación doble (noches de domingo a jueves). Tarifa válida para comprar y para viajar únicamente en temporada baja, consultar fechas. Tarifa válida para estarías mínimas de 02 noches. Tarifa no válida en días festivos ni feriados. Niños menores de 5 años no pagan. Aplican suplementos por tipo de habitación y fin de semana. Todas las tarifas están sujetas a disponibilidad de cupos y a cambios sin previo aviso. No aplican anulaciones y/o cancelaciones luego de realizado el pago, ni cambios de fechas ó de nombre. Stock 10 habitaciones. Otras condiciones pueden aplicar.",9
300.72,1364.89,129.78,32.0,80.79,ntentóarreglarel jardíndela vereda de casa y hoy se debate entre la vida y la muerte. Angel Palomino Guardia(27) quedó grave luego de sufrir una des,10
663.0,1367.15,190.38,30.0,73.28,"cargaeléctricacuando sembraba plantas,enla cuarta cuadra de la avenida Recuay,en Breña. Víctima trabajaban unalaska e hizo contacto con uncabled e luz que",10
416.0,1635.86,171.29,69.29,84.75,Respalda que soldados - paitmlll%n las calles,10
528.12,2185.0,78.0,36.0,86.71,©Como una medida positiva fue calificada For el,10
500.87,2472.88,73.78,27.77,91.1,"director de la Policía Nacional, general [] Eduardo Prez Roca, la decisión que tomaría el Gobierno de emplear alos militares para apoyar en ciertas tareas a los efectivos policiales. “La población será la más favorecida con dicha disposición, pues se sentirá más segura en las calles”, sostuvo. Añadió que “sería una gran decisión. Los militares están preparados para que apoyen a la policía cuidando las fronteras, embajadas, aeropuertos o penales, eso liberará a muchos policías que cuidan esos puntos en estos momentos y que salgan a patrullar a las calles. Habrá más seguridad y la población se sentirá segura"", indicó. Asimismo, Prez Roca advirtió que la inseguridad ciudadana se debe aa falta de planificación del gobierno para combatir a la delincuencia. (). Hernández| [e]",10
1044.86,723.29,61.95,28.29,83.15,Angel Palomino Guardia [27) recibió una u descarga cuando <y tocó un cable co una pala 7 … mientras sembraba plantas.,10
1922.81,886.84,184.92,28.45,79.17,"sufrió tres pre in far to s antes de llegara un centro salud y reencuentran observación en el hospital 'Arzobispo Loayza: VECINOS Losvecinos denunciaron que existen muchos cables de luz expuestos en lascallesdeBreña,pero quesecansarondereclamaralnohallarunaso- luciónantelamunicipalidaddel distrito y la ""| empresaeléctrica Enel. La Municipalidad de Breñainformóque » ALOMINO[Z7) denunciaráalaempresa Enel Perúporel accidente.“Eneleslaentidadqueprestaelservicioy vamosasolicitarinformaciónaniveldetodoeldis- tripara saber pordónde pasansuscableados”selee enelcomunicado. Asuvez,Enellamentó loocurrido, pero precisóqueloscables subterráneosestabaninstala- dos debajo de las vere das y que ahora reencuentran bajounárea verde habilitada porlacomuna. (JimmydHernández) B",10
1484.53,957.68,60.26,30.05,89.15,">2 Después de recibir la descarga, Palomino se queda de uénsle. pero unos segundos después cae desplomado al piso.",10
1318.91,1229.33,78.57,26.98,88.94,"Luis Capellán Yanac, del Colegio de Ingenieros del Perú, recomendó para evitar descargas eléctricas: Olive un cable expuesto, no se acerque. Ono permitir el contacto del cable con agua. Osi alguien sufrió una descarga, llamar a los servicios de emergencias. No intente ayudar a la víctima. Ocurrir los tomacorrientes, sobre todo si tiene niños.",10
1130.0,1446.5,120.3,29.3,88.72,"escarabajo 20 centímetrosdetierra. Trasrecibir la descarga, el joven per",10
1531.57,1439.29,150.14,29.43,66.74,"manecióalgunos segundos pie, peroluegocayóinconsciente. Paloma",10
1515.43,1621.43,152.29,68.0,88.43,Cúter choca con pallme¡ra y deja Ihe¡rndlos,10
1138.07,1891.86,70.34,27.09,90.64,"€» Una mujer embarazada y cinco personas más terminaron heridas luego que la cúter de transporte público en la que viajaban, se despistó y chocó contra una palmera, en Comas. Testigos contaron que la unidad, que cubre la ruta Carabayllo - Jesús María, se",10
2005.27,2004.0,60.8,27.8,90.07,retorcidos de la cama Lo - rescataron luego de cortar el metal con sierras,10
1542.4,2078.8,61.8,25.2,91.37,“Ha sido una falla mecánico,10
1544.04,2141.21,64.74,27.89,87.47,"desplazaba por la avenida eléctricas. Universitaria, pero al lleca”, expresó el chofer, quien — Algunos pasajeros dijera al cruce con Jamaicano — terminó con una pierna ron que la unidad iba a alta salió de la vía. atrapada entre los fierros velocidad. [). Yuera) e",10
1873.0,2359.55,69.73,23.18,76.41,C&D£M : e | = No de ? lista de fallecidos!,10
1978.9,2609.7,102.4,32.0,50.24,"el presid en y v¡sitó larzonatdel) milla pidieron apoyo y) separatists casas afecta,",10
1520.25,2541.0,68.5,33.25,34.57,o 2 N YE,10
1396.14,2628.14,112.57,51.43,55.97,MM dios el y %Milh I Salud,10
2320.4,537.0,210.8,52.8,82.73,GIN'CERTIDU'MBRE Dólar sube por coronavirus,10
2410.38,1074.95,60.3,26.42,91.72,"9 El precio del dólar comenzó la semana con un ligero incremento, ante el contexto de incertidumbre en los mercados por el coronavirus, que afecta a China y avanza por otros países. En las calles paralelo, cambistas) y casas de cambio el billete verde se cotiza entre 3.37 y 3.39 soles la compra, mientras que la venta entre 3.40 y 3.41. En tanto, el tipo de cambio en el sistema formal estuvo en 3.39 soles la venta, según datos del Banco Central de Reserva. [IMM)",10
2410.12,2372.58,63.6,28.33,90.32,"Masacra a viejito de 71 €D El cobrador venezolano de una cúter 'pirata' atacó a patadas a una mujer, que viajaba en un taxi, y a un anciano de 71 años, en Santa Anita. Según ATV Noticias, todo comenzó cuando la cúter chocó con el auto y la mujer bajó a reclamar. El extranjero la atacó y Mariano Pablo Raimundo (71) intervino, pero recibió una golpiza. Luego, el chofer de la unidad “pirata' embistió a varias personas. Se informó que la cúter, B3A-758, tiene dos órdenes de captura, carece de SOTA y debe más de 41 mil soles en papeletas. UHY)",10
587.94,613.54,68.31,27.76,88.66,"1,/ - CD Un joven británico recorre Europa y - Á trepa, sin sogas ni arneses, los edificios más altos para, desde arriba, tomarse temerarios selfies. Se trata de un in stag rammer que publica sus fotos en su cuenta littlenuisance, donde tiene miles de N seguidores, quienes se quedan asombrados de sus proezas. Hace unos días estuvo en España, doy de escaló los rascacielos de Boniform",11
552.38,870.38,53.12,20.38,80.74,"a . Y cante, para tomarse selfies. o",11
1414.33,153.83,100.83,24.67,92.88,MARTES 11 DE FEBRERO DEL 2020,11
1155.0,424.0,106.17,38.33,67.35,©&)lh localidad de Kera | lh.&0€m(íbll¡ñ¡&;le,11
1200.5,532.33,110.33,46.0,57.05,"pobladores ES "" [con| de e",11
1290.75,713.88,163.12,44.12,85.45,de determino q empleados Racha Bary Hotel arrojaron,11
777.39,1567.11,100.43,45.71,79.14,"_ LLAMARON LA Además, dej | ATENCIÓN LOS y MEBO|R Y PEOR para recordar, VESTIDOS ee Y HASTA UN como el del ' 'DORMILÓN MARTIN SCORSESE DORMITANDO t|'r:ºsºctg;5ºggé",11
746.25,1883.44,66.34,26.72,88.27,"a 92* edición de los Premios Oscar de la Academia pasó a la historia por haber coronado como Mejor Película a la surcoreano “Parásitos', el primer largometraje de habla no inglesa",11
557.57,2039.71,74.57,33.71,91.59,CAMILA MORRONES en ganar la estatuilla más,11
439.75,2226.62,128.88,54.0,78.97,Permito fiel vela” cadáver de su dueño |,11
292.4,2519.16,64.85,27.33,89.48,"R Un perrito demostró CE ser un fiel compañero al quedarse a dormir a pocos metros del cuerpo de su amo, Víctor Magia Harán (37), quien falleció producto de una intoxicación alcohólica en una calle de San Martín de Porres. La víctima fue hallada boca abajo sobre un colchón en el asentamiento",11
726.73,2645.86,67.68,26.45,87.74,"humano *Nazareth 1' y durante horas el can estuvo cerca. Incluso, no se alejó cuando los peritos de Criminalística y agentes",11
1108.94,1903.72,66.22,28.19,91.37,"durmiendo. La bella novia de Leonardo Diario [45), la argentina Camila Morrones (22], impactó en la gala del Teatro Dolby de Los Angeles. En pareja desde hace dos años, la actriz",11
1129.95,2644.14,62.14,28.71,88.16,"del Depincri revisaron el cadáver, “Siempre andaba con él. Era su perro”, dijo un amigo de la víctima. (1. Yucra) o",11
1979.29,725.62,67.97,27.76,91.08,"€D La empresa turca Walk construyó el primer bastón inteligente, que navega en Google Maps para servir de guía a personas invidentes. Tiene sensores con alcance de 2 metros y medio y",11
2393.31,743.36,65.81,26.53,91.39,"alertan a la persona sobre los obstáculos y peligros. El aparato, que posee altavoces incorporados y un asistente de voz de Google, ya superó la fase de prueba y se encuentra disponible en el mercado",11
2136.14,875.29,48.71,21.57,86.76,un motor de vibración que . e],11
1700.0,1111.8,273.8,26.0,60.47,"— , anúl¡ mlllo— em&m%li)",11
1742.0,1231.0,87.62,33.0,77.71,EI principe Harry y esposa Meghan Markle Mejor,11
1776.44,1472.19,58.3,27.3,91.11,"y modelo compartió con él Oscar como mejor Actor por primera vez una gala de — de Reparto por “Erase una los Oscar. vez en llegó solo,",11
1757.0,1545.5,67.5,27.62,93.58,"Brad Pitt, ganador del pero estuvo sentado al",11
2428.46,1068.54,89.69,26.23,91.71,lado de su manager Cynthia PettDante.MEJOR VESTIDOS La sudafricana Charlie Theron,11
2403.75,1221.5,92.5,27.0,76.79,'ZAZ|EBEETSJ] destacó con un,11
2394.9,1526.69,68.71,27.11,91.34,"vestido Dior negro. Llevó un collar de Tiffany, con diamante, de 5 millones de dólares. La española Penélope Cruz, Deena Davis y Natalie Portman también fueron halagadas. En los hombres, el español Antonio Banderas no falló con un traje clásico. PEOR VESTIDOS La estrella del pop, Billie Eilish, con un atuendo lleno de logos, fue de las más criticadas.",11
1676.2,2113.7,110.0,42.7,74.14,"BILLIE __Z"" PORTER PORTMAN “EILISH &>EN PATA Í Desaparece la",11
1694.64,2544.86,58.1,28.4,86.04,"J reina dle la palta” ¿ . Santos María — 4 Te Sillón Viera — (77), quien es conarial da como la 'Reina de la palta' en Pata (Piura), —| desapareció y su familia =1 no descarta que terceras personas le hayan hecho algo. Jonsy Aguirre afirmó que su madre sufría de Alzheimer y fue vista por última vez el 15 de enero cuando salió de su casa. La jovenllegó a Lima con la finalidad de pedir ayuda ala Dirincri. [). Yucra) G",11
2163.4,2509.4,63.2,23.0,87.45,f Salud descartó que tenga,11
2439.88,1919.75,68.42,27.0,92.32,"Mazie Beets, de Joker, también desentona por su cabello mal arreglado. Billy Porter exageró con el dorado, plumas, volumen y zapatos.",11
2179.43,2221.86,145.57,45.0,72.99,"CONTAGIO Peruano no tiene y , Coronavirus",11
2232.81,2400.81,70.75,27.06,91.23,"Luego de realizar pruebas a un estudiante peruano procedente de Hong Kong, el Ministerio de",11
2273.88,2668.28,65.6,26.72,89.35,"coronavirus. El joven se encuentra en cuarentena en el hospital “Dos de Mayo.“Cuando hacía trasbordo en París sintió un dolor en el pecho y lo trasladaron a Lima, Fue a Hong Kong becado”, explicaron los familiares. (NSI] [e]",11
590.2,282.6,210.2,86.6,62.83,DO |!© RIEIS¡ ce CUNINA,12
585.67,406.87,73.53,21.07,87.33,Humberto Cubas Rojas: Naturista chiclayo cura dolores a la cervical dorsal lumbar (LUMBALGIA) Escoliosis Hernia,12
555.71,475.67,69.83,23.92,87.68,"discal, Pico de Loro, Nervio Ciático, Espolón, Dolores X 0 Musculares, Esguince, Tendinitis, Tratamientos sin Medicamentos ni Fármacos, evite las molestosa y costosas operaciones.",12
559.31,927.46,85.08,27.92,85.14,33 THAN CAMPAÑA MÉDICA S. J. LURIGANCHO — HASTA EL 21 DE FEBRERO,12
391.5,1110.83,74.83,19.67,84.06,Con tratamiento modelo que evita cirugías,12
436.53,1320.22,80.45,25.22,80.8,"PLASMA COLONIZADO ... |, Y CELULAS MADRE de * ARTROSIS: RODILLAS, CADERA, COLUMNA, HOMBRO, TALÓN * Desgarro Muscular - Meniscopatías - Dolores Neumáticos y Articulaciones - Hemia Discal (Cervical, dorsal y lumbar) 9 * Tendinitis_- Fibromiálgia_- MEGADOSE DE VITAMINA C u ] CAÑETE: Av. Ramos 398 Imperial Cañete. Atención días domingos",12
709.5,1473.0,45.08,19.5,69.48,4685003 19 928762829 Atencion Lunes a domingo de 9.am a 10 pm,12
509.75,1686.25,132.5,40.0,57.21,…… D 535as =,12
777.5,1709.5,109.0,30.75,66.21,… TA %J VITAMINA,12
806.0,1775.17,39.0,19.17,55.59,Valija uu/-'j m o f “,12
515.93,1969.71,51.43,22.07,73.01,"SANTA ANITA (01)543 2298 Bgº ung Los Ruiseñores 47 Of 50 5 4440 2Q,1&,“º Carlos aguirre HB ler. piso | Fic 201 al odra 14 de ? de ¡u|.º Pnnapnl 054)299-977 Av. El Ejercito 107 Frente a Calle Quesada E— Sucursal 983-402-173 Cubra Volver A1 Pablo YI La Papilla B (O£ 222 114 Alfonso Usarte 6 c z b |(044) 293-206 Ca.los Zafiros 204 06401 Urb.Sta.Inés £.,º (084) 658-222 Av. La Cultura 1706-82 Of.103 (Paradero M.Prodo)",12
487.25,2091.2,53.25,21.95,67.73,"(052) 638-443 Calle Blondell 425 y (064) 410-954 Jr. No 166 98¡ 402 1 051) 358-282 r. Jávregui 522 9'44%7:7,9)",12
598.15,2381.75,49.15,21.85,87.76,"3/8 x 9 mts 1/2 x 9 mts 5/8 x 9 mts 3/4 x 9 mts 1"" x 9 mts",12
642.23,2556.85,64.31,17.62,74.3,- Ladrillo Kinnon - Techo (15x30x30) - CementoSol _ ___ + S CE,12
668.23,2664.81,53.81,24.71,79.94,Calle Santa Teresa N'129 Los Sauces - Salamanca » Ate (Ref. Cára. 19 y 20 Av. Circunvalación SAN LUISLIMA; T: 01 473-0063/ 01 473-0862 ($ 950-590-430 / 993-454-642 / dos a cog mail,12
1278.0,152.67,95.67,25.33,93.62,MARTES 11 DE FEBRERO DEL 2020,12
1108.37,515.48,125.89,18.93,81.91,CHEQUEO“GINECOLÓGICO NNTEGRA!U * Papanicolaou O/ONCOVIP - * Colonoscopía * Exámen Microbiologic * Estudio Citohormonal * Ecografía Transmarginal * Ecografía de mamas * informe Computarizado * Consulta Especializada,12
1369.78,1385.02,74.49,27.71,87.47,PRECIOS PROMOCIONALES POR CAMPAÑA o MÉDICA HASTA EL 25 DE FEBRERO CONSULTA Atención de Lunes a Viernes de 9 ama 1 pm GRATUITA Av. AREQUIPA 1148 - LIMA to Piso Consultorio 510 CITAS: 613 9292 Anexo 1504 / 968 197 750 / 994 615 681,12
1334.83,1559.0,168.67,66.5,73.37,y FUNDACIÓN GLAUCOMA ) | GLAUCOMA,12
1332.0,1692.0,244.5,59.17,41.96,TROJESRECTALIZADOJEN ECO MA CA%I'A*R'ATA a l,12
1319.55,1982.21,71.52,22.45,88.23,* Catarata con láser + Glaucoma (Láser) * Corrección de la Miopía e Hypermetropia con láser * Perigon (carnosidad) con pegamento sin suturas EVITE QUEDARSE CIEGO - COSTO SOCIAL — C 01476 1601,12
1365.33,2080.72,77.06,25.61,87.19,? Av. San Luis 2272- San Borda - Lima € 012257602 O Eglaucomalimacenter www.glaucomalimacenter.com ( 924 878 833,12
2185.29,530.14,97.86,31.71,90.96,* CEMENTO PORTLAND TIPO I POR 42.5KG.,12
2079.0,625.75,105.62,29.0,92.52,- FIERRO DE CONSTRUCCION EN TODAS LAS MEDIDAS,12
2290.67,812.67,121.83,40.5,49.88,VENTAW(DESPACHO DIRECTO:A IBELGICAJ1216 LAWICTORIA S LIMA!,12
2152.8,940.0,128.8,50.6,75.02,6 © ED)LINICA DENTRO MEDICO 36 Años | N suº93' Laboratorio Clínico & Dmgnost¡cos 4h,12
2083.8,1063.0,256.6,65.2,80.71,RESONANCIA | TOMOGRAFIA ECOGRAFÍAS 4D/5D/6D,12
2227.62,1225.88,76.25,37.0,67.27,Paternidad y/ 17025 )| RAYOS X — —,12
2148.89,1302.94,64.17,29.61,89.74,O LIMA: Jr. Auto 100 y Av. Gran 740 (Al costado del Hospital Almenara - EsSalud) £5 956-490-595,12
2231.83,1368.72,44.55,38.41,69.74,"O IEÁ: Av.Los Maestros Mz. D Legua San José — O TRUJILLO: Je. Bolognese N* 678 Ofi, 106 (Fte Plaza Vea) 212-843 090-051-581 — (AN. Puerta 4 del Belén)",12
2220.21,1454.79,62.21,22.64,68.93,"Tef.:(044)251-547 6 942-039-857 Presente este aviso y obtenga 10% Dscto, Elo Clínica Dr| ,",12
2409.25,1571.75,80.75,34.5,73.97,FUTURO VISIÓN (PERI (n.nú),12
2093.67,1854.33,172.67,31.17,75.8,< ©A'E'ARAYA y ©LAUC©MA E CURIOSIDAD,12
2221.0,1930.56,67.22,19.22,90.68,"* Con pegamento tisseel, sin puntos y sin dolor",12
1722.8,2367.0,115.8,48.4,91.05,la mujer en la sección,12
498.18,453.59,133.35,49.0,88.56,FUERTE HUMEDAD Y 30 GRADOS DE CALOR SERÁN RIVALES DE LA(U MAÑANA EN VISITA A CERRO PORTENO,13
523.57,2310.71,88.71,35.71,90.79,ERA RECIBE A RIVER PLATE Y SPORT,13
712.82,2378.18,139.09,27.36,69.49,HUANCTAYO VISITAAARGENTINOS JUNIORS POR LA SUDAMERICANA N _ 61 ZD,13
1439.17,2500.33,63.0,33.67,67.45,EI Caballeros los mares' de -,13
1326.0,2529.0,104.5,39.5,77.34,puta hoy enla Sudamericana.,13
1330.89,2659.96,88.96,31.61,79.15,"Atlet¡co Gran se lanzará al ruedo mternac¡onalcuando reciba royal River Plate de Uruguay (5.15p.m./ TV 610] en el estadio 'Monumental dé Ate. El histórico clubpiurañoclasificó, tras ganarle Torneo",13
1852.14,2620.04,114.64,30.43,85.27,"centenario2019.Losdirigidos de Pablo Agarra entrenan en Lima desde el pasado sábado y tendrán en el ataque a la dupla Cristian LassoyJefferson Collazos. El cuadro dirigido por el seleccionador uruguayoJorge Fossati, entrenóayeren nuestra",13
2443.42,464.25,100.33,29.17,81.87,"sunción.- Enelestadio la 'Nueva Olla;, Universitariodebe evitarse cocinado. Sibienel cuadro",13
2391.58,1124.08,87.38,28.2,83.93,"cremado tendrá'enemigos'enla tribuna portación al equipolocal, el duro clima paraguay será rival más cuando mañana se mida ante Cerro Portero buscando c las if i cara la tercera rondadelaCopa Libertadores, tras el 1-1en Lima. Los merengues arribaron ayer esta ciudad y fueron recibido por casi 30 grados de temperatura y una humedad bastante alta, mismas características que se repetiría ala hora del encuentro. El grupo descansó en el 'Hotel Bourbon'y porla noche realizóunentrenamientoligero ellas canchas de la Conmebol. Hoy, el comando técnicorealizaráuna práctica suave buscando no fatigar al plantel y porla tarde reconocerála'Nueva Olla"". Allose definirá al reemplazante del lesionado Armado Alfageme, que sería Jesús Barco o Gerson Barreto. “Tenemos mucha expectativa de lograr un buen resultado. Hay que llevar una estrategia buenos permita sacaron resultado positivo. Estamos con mucha fe y confianza, sin de s conocer el poder del rival”, aseguró el DT Gregorio Pérez.",13
2376.0,1955.38,78.25,37.62,84.46,ensa3íara penales en caso tenga que de m¡rla,13
2388.2,2126.05,66.85,32.85,89.3,César Vigevani dejó de ser técnico del Bmac¡onal y según el club su salida fue por una me gr oferta laboral del,13
2366.61,2606.54,92.89,36.89,73.64,"capital tendra un solo punta, Nicolás González. Buenos Aires, SportHuancayo también iniciará su“andaren ) Sudamericana visitando a Argen(5:15 p.m./DTYV611]en estadio 'Diego ECA dona'. ue",13
1006.62,152.75,111.88,26.88,91.22,14 (DEPORTES]) MARTES 11 DE FEBRERO DEL 2020,14
880.25,797.75,155.5,59.5,87.91,JEFFERSON HARÁN Y MELISSA KLUG EM PESARO El,14
1349.73,859.36,206.18,52.18,75.45,ASCENS©YCMDADE UIN]AM©)R QUE NACIO DENTRO DE LO PR©HI]II©© PU S EMES?ABA…,14
1813.67,1758.61,124.33,34.0,81.4,"Enamores La*Foquita'eraconocido un cálculo de Melissa'desde que equivocado, jugaba enel un salto al , _- luego de meses vac¡osmred” porP5Vde",14
1852.0,1881.67,119.89,34.56,73.18,entom Holanda en variosmillones: italiano Federico .de dolares Aldiablolos,14
1740.76,1965.95,108.0,33.24,66.85,""" Locura autor del libro - y' s co drg os y mientras mejor - T'Pe¿dona sitellamoá amor ,q_epoca de Latón había Puedesvolar tambrenº ¿Basado yse encontr¡gpa,",14
1701.94,2132.77,135.09,36.63,69.0,"q )estrellarte ]efferson'Farfan voo1ugandoenTrunllo cony,M¿a¿rssa Klug tuvieron El CesarValle10 Io segundo Un aternza¡ Íen¿novrembre de ese»anodoloroso en m la tierra *Jefferson y…Melrssa . frrme'Envueltos oyen am paya dos paseando tenía batallas Iegalesycnt¡cas ¡camiorieta de 52.mil dólares. mutúas, debemos retrocede r",14
