left,top,width,height,conf,text,page
1747.33,2339.26,98.07,33.04,71.94,"15angsen eltiempo para — mostró un programado sábercómo, salida que hoy * espectaculos*5e lucieron "" los: separa los junto aquella enana ceb r chena elsan ! Miguelyesei mismo ""día,el",14
1532.09,2554.35,100.22,36.04,74.07,"'Melissa Klugsedlo el: 'sí' - por civil con el futbol¡sta Abel Latón *Todo parecía irrumbo¿ E ¡Donito hogar, , pero Ia amistad Iglmpldlo porque Farfan,am¡go del",14
1985.47,2552.4,129.73,39.4,80.5,f|esta donde de par treron con otros fut boh stas Al . nolermportóqueellafuera casada. Mascotas entonces cayeron porsu prop¡o peso. -,14
1659.67,2716.61,95.83,35.11,60.7,", b |ago parecían * :e¡anadademaloen e| ut , otos'antesquesu reláción” - AN £ .'?ir?»* A r&%_,_9!.-.ñ)._. .AQ",14
2245.89,2432.22,88.89,32.89,72.34,“jugagordelf Pavia llevó aí una. n pero otra vez en2010 se,14
2547.0,2144.0,84.0,31.5,84.25,se term mara Peroyo que *,14
2478.47,2310.53,150.4,30.6,74.8,VlaFoquita'yMelrssa queenesemomentoteníatres hijas empezaron a convivir . desde2005.Dosaños — . despu est uvre ron primera separación:Regresaron; -,14
2543.75,2634.4,85.35,29.1,77.55,"de otro “fuerte alejamiento, Jefferson - medianteun: . comunrcaql_o que relación madre de sus dos A verano y]eremy, habra =",14
2794.0,2460.6,6.0,20.07,62.8,1 ; ¡ | L 4 | . | | 1 | N 1 “,14
2392.3,824.1,114.9,53.9,78.27,A MACE 16 AÑOS Y AQUI LOS ANTI (CONE: T¿ÁZ©,14
2681.17,1032.33,59.0,30.83,92.4,KLUG el ciencia física desde 2,14
2643.4,1126.2,90.6,39.4,62.08,"2016, la 'Foqu convivió.cori Melissa",14
672.67,1160.67,71.71,26.9,91.46,"DEL $AQUE somos carnecita... VUELVE LA CANALETA DE LAJAULA en la selección. Yo no tengo nada en contra de él, nunca hemos hablado ni lo conozco, es más, me parece un buen delantero pero ahí nomás. Convocar a un atacante de 30 años es maquillar el problema de fondo, donde no se avizor un posible sucesor de Paolo Guerrero. Hasta ahora no aparece un joven que nos dé la esperanza de ponerse la '9' bicolor. Lajaula ya fue tentado hace cuatro años para defender a Perú y la rechazó. No siente la rojiblanca, no jodan... HAY UN RUNNIN fuerte que un corralón chiquito de un club del final de la avenida Javier Prado últimamente anda sin piernas, porque se está entrenando con una “chamita' que le hace cariñitos cada vez que sale del club. Como el campeonato recién ha empezado, lo están modificando para que no sea muy rocoso su falta de físico. Asuuuu... YA ME CONTARON que",15
1414.33,153.5,101.17,25.5,93.36,MARTES 11 DE FEBRERO DEL 2020,15
1731.0,485.06,141.69,52.69,85.95,"DEFENSA DEL SPORT BOYS, AGREDIÓ A MUJER Y GUAIRDIIADE SEGURIDAD EN UNA PELEA EN PUNTA HERMOSA",15
1770.5,1617.38,144.25,27.25,92.48,DE ALIANZA TENDRÍAN CRONOGRAMA PARA SABER CUÁNDO ATACARÁN,15
1438.88,1794.25,94.88,31.88,90.45,Desde que Pablo Bengoechea decidió no confiar ciegamente,15
1792.49,1080.65,87.51,29.29,83.64,"n futbol i star udo dentro fuera del campo.El defensa de Sport Boys, Adrián Zela, protagonizó una pelea en Punta Hermosadonde,además de pegar le aun encargado de seguridad, agredió también una mejorque quiso detenerlo. El pasado findesemana, el zaguero fue grabado porlascámaras de seguridad de un condominio y se levereclamándolealos pasajeros deuna camioneta que abandonabaellugar, donde la dijoveranear. Seacercandos personas y Zela reacciona con golpesaligua! que sus dos acompañantes. Una mujer intenta fren arlo y el agredearrojándola al piso. Momentos después, se repite la acción vuelve a agrediralajoven, quien es auxiliar porsu amigos. El jugador rosa do declaró horas después, pero solo hizo hincapié los golpes que propinó al miembro seguridad. “Ya hablé conelguardia, felizmente está bien no ha tenido ningún pro bie made salud. Ha sido un error mío, reaccionar de esamanera. Leche pedido perdón las personas perjudicadas. Nota sido nada mayor”, dijo el zaguero enRPP.El club prefirió el silencioso se pronunció sobre sufutbolista.",15
2360.25,1345.25,150.0,41.75,76.02,BATAZO VOLANTE paraguay Luis,15
2356.5,1410.75,65.38,31.62,84.64,"Cánceres llegó ayer para unirse a la 'Misilera""",15
661.82,2026.98,66.05,27.19,89.54,el volante que cada rato hace la del Chavo anda derechito y su 'patrona” lo - marca al milímetro para r“n¡ñ'a'd que no vuelva a meter las cuatro. El hombre es inquieto y la doña ya no confía ciegamente y por eso le cayó de sorpresa el fin de semana para ver si lo chupaba en alguna g.q travesura. Las malas len,15
1429.17,2017.63,74.69,27.18,92.1,"te en Leao Botón, empezó a tener dolores de cabeza. Y para encontrar una salida, pensó en la rotación. Trascendió que el técnico se habría reunido con los tres arqueros de Alianza para comunicarles el cronograma que tendría pensado usar en los siguientes partidos. El último domingo, en Trujillo, fue el turno de Steven Rivadeneyra y este sábado, ante Gran en Matute, Botón volvería al arco dejando a átalo Espinosa para el duelo de la cuarta fecha de visita en Ayacucho. Posteriormente, contra Municipal en Lima, Rivadeneyra enfrentaría a su exclub. Para el debut en Copa Libertadores ante Nacional de Uruguay -5 de marzoLeao partiría con ventaja sobre sus compañeros. Bengoecheadejaría la línea de tres defensas para volvera cuatro",15
687.88,2497.04,70.09,27.59,89.28,"gas aseguran que si el muchacho es convocado a la Copa América, ella será la primera en sacar los boletos para acompañarlo al torneo. Curuju... LO DE LA “ROCA' ZELA es un pastón de aquellos. Los *guapos' ya fueron en la calle porque ahora abundan los 'gatillo flojos' y eso de empujar y zarandear a una mujer es 'cana”, Guerra avisada... Me voy, soy fuga.",15
1208.14,2399.29,109.86,23.29,86.23,CRISTAL PUSO ENTRADAS CARAS PARA LA COPA,15
2260.27,2540.15,68.46,27.82,92.21,"©> Golpe al bolsillo. Luego que los hinchas insultaron y criticaron al equipo en el partido contra Cusco FC, la dirigencia celeste decidió que tas entradas para la revancha con Barcelona, el jueves por la Copa Libertadores, tengan precios elevados. En la ida, Cristal perdió 4k y necesita el apoyo de su gente, pero los boletos costarán desde 30 soles las populares hasta 150 [occidente central). Los fanáticos reclamaron en redes sociales: “Parece que quieren jugar con estadio vacío”, señalaron. El cuadro ecuatoriano arribó anoche a Lima con todas sus figuras. G",15
457.1,1672.6,106.9,56.0,61.74,COMPAÑEROS [| Xx 14¿3 — Gº “$ EL DISCURSO UU€L,16
513.51,1994.23,59.68,27.37,91.47,"€» Barcelona.- Palabra de Ya con 32 años a cuestas, Lionel Mess parece haber dejado la timidez de lado y ha asumido su papel de lider y capitán del plantel del FC Barcelona, por lo que el último domingo arenga a sus compañeros en el entretiempo del duelo que terminaron ganando 3d al Betis. “Dale, dale, vamos jugar al fútbol. Vamos a golpear ahora, vamos a poder hacer más goles. Vamos a defender bien juntitos como el otro día. No puede ser que en un partido lo hagamos y en el otro no”, les dijo “Leo” a sus compañeros cuando el marcador iba 2-2. Hace tres partidos que no anota",16
732.0,1165.12,126.75,34.62,89.03,CALIGA ESPANOLA INV£STIGA IRREGULARIDADES EN EL SALARIO DE,16
1278.0,152.67,95.67,25.33,93.52,MARTES 11 DE FEBRERO DEL 2020,16
1656.25,365.88,75.88,27.12,80.25,adrid.- Escándalo rojo y blanco. Luis Advíncula se,16
1593.32,804.38,90.92,29.67,86.06,"visto envuelto enana polémica, luego de que la Ligaespañola abriera unainvestigación contra el RayoVallecano, raíz de una denuncia hecha nombre del jugador peruano porun representante de futbolistas, debido a que supuestamente parte de salario ha sido pagado en Panamá através del ex delantero Ronald Baroni, quinque el intermediario de fichaje a Tigres de México hace unaño. Según medios españoles, la demanda, que fue confirmada por el máximo ente del balompiéibérico, señalar RaúlMartin Presa,",16
2006.12,337.25,109.38,31.75,91.78,"Vallecas, David Cobeño, director deportivo y a abogada del equipo,",16
2207.7,520.03,95.5,34.8,85.85,"GemaBarrasa como pre su ntos responsables — delosucedido, e incluso se — CARRILLO anotó y presentaron grabaciones de dio una asistencia audio como pruebas de la — en el triunfo 2d del ilegalidad de los pagos. Al Hill 'jº con 3)",16
2101.88,638.75,92.12,35.12,78.0,"Sinembargo, másrápido sobre SI queunrayo, el lateral salió",16
2402.29,639.0,45.57,36.43,83.92,"hr Kodro 4* con Oí de Irán,",16
2204.3,762.81,105.07,35.93,79.33,"ades mentir mediante por la primera fecha un comunicado que del grupo B de la haya irregularidades Champ¡ons League ensusalario. ""Nohe $_E denunciado Rayo |.Técmco DEL Vallecano.AranchaMérida BOTARGO de",16
2191.14,986.04,116.36,35.0,79.49,"noes mirepresentante, Alexander Lecaros, noche autorizado anadie Alberto Valentim, fue denunciar en mi nombre y no — destituido tras perder hay ninguna ir regularidad — 3d ante Fluminose ellos pagos que me ha de Fernando hechoelclub"",señaló 'Bolt, — Pacheco.",16
2005.5,1136.0,87.62,32.38,88.08,aunque la investigación ya está en marcha. ¿Severá,16
764.18,1202.18,101.64,37.82,90.38,"ADVÍNCULA, QUE NEGÓ ESTAR DETRÁS DE DEMANDA HECHA A SU NOMBRE",16
1616.25,1189.0,78.75,32.25,63.37,presidente del club de,16
1032.33,1659.17,99.67,24.67,87.27,OCRE ENTRENA HASTA CON SUS HIJOS,16
1370.65,1992.43,62.0,26.14,92.05,"C© Turín.- Es una máquina. Cristiano Ronald terminó furioso el pasado sábado tras la derrota de la Juventud ante el Hellas Verona, a pesar de que él marcó un gol por décima fecha consecutiva, por lo que a la salida del estadio rechazó atender y tomarse fotos con los aficionados y para recuperarse decidió trabajar el doble en el gimnasio, incluso en su casa y con sus hijos. El portugués no se detiene y ayer subió un video en sus redes sociales en el que se le ve haciendo abdominales, con su pequeña hija sentada sobre él. ""Sin excusas”, escribió que con 35 años recién",16
1991.0,1636.0,83.5,22.5,60.73,—. 11)1¡: mswómco *,16
2194.85,1997.08,63.52,27.7,90.83,"D Sao Paulo.- Dejó huella. Paolo Guerrero está marcando época en Brasil, por lo que el diario deportivo 'Lance” lo incluyó en los equipos ideales de la década 2010-2020 tanto del Corinthians como del Internacional de Porto Alegre. En el Timao, donde jugó entre 2012 y 2015, aparece al lado de su ex compañero Emerson Sheik, con el que ganó el Mundial de Clubes 2012, mientras en el Inter, su actual club, figura junto a Diego Forman y Leandro Damiao. De otro lado, el elenco “colorado' recibe esta tarde (5:15 p.m./Fox Sports] ala U de Chile, por la vuelta de la segunda fase previa de la",16
1512.77,2419.31,104.73,44.33,65.35,"[algo que no sucedía hace dos años), pero asiste y arenga. 6 cumplidos pretende seguir haciendo historia. Q CopalLibertadores, tras igualar tp0 en la ida. s SERVICIOS © EONOAVISOS ; .'.»_' d l ! A ( ; up¿¡q: MA PALOMA .. COMA MEXICO PERS© NALES E _? ££ gí%|¡l%% E'MIÍI74]616E: M era 9672 í ""RA 952 an o1::%ºa'3% ;m£% 7690718 950499810 N $?E£%€ p ggº u. m ssg;'r gg;g %Íá: M HAYAN NAZI |.u|s , l ;ºe""7 9935642 984202722 ñ%%% ""º'“º 938850465 971003559 992610909 93%%""Í£ 928175257 ¡oz1 ouzo 98 ¿%3%37 131 ETA 417 94 8' a e ee",16
1653.29,2726.71,165.57,50.43,69.8,ggººº 992877686 922610618 9ao?4¿34o 3%%333?Z% 0060273 860424935,16
2380.38,2707.62,131.12,41.0,72.36,826830 9saozsose tromel] SJMrmm ¡ trome] 926099258 953245515,16
1477.0,153.86,110.86,27.71,88.17,"MARTES 11 DE FEBRERO DEL 2020 '—""'W",17
871.79,511.24,45.56,27.99,70.15,"' | - 2320 Perdonamestos — Chapatucombi — ENEN — es V . pecados 2230 ?g¡e_qca£?goffc¡|a& [iwasanaka 00 ATV Noticias 0000 aas ggñtaaosos CO TE ción Central V Noticias. into y ] — 0538 Edición matinal _ 0900 Pochoclo - 05:16 América Noticias. VM 0600 Noticias. 09445 Como dice el dicho — 1000 Cocina fusión . Primera Edición EácpaMgt<fnal de - 130 Mujer casos 11:00 Sies la vida Martes egg á¡¡;u£rjca Ee¿1¿o(rttáecs 2 Bue?ospbígá Pg 09:00 V 100 $ Íw?t? ¿$2' g% Xáxat¡ones en Grecia — b rica Espectáculos : 09:00 Quality Produce . premio ma 5.—""EAUN 10:30 La Rosa de Guadalupe - 10:00 omb%adp 13:00 Pá_P€;u Nohg¡ái; 1500 Cu%_ado conelángel — 1490 La%¡ora W [ 1115 Cita aciegas: 1150 ¡En Exclusiv! . . — Festividad - 2999 Pasión 14:30 La casa de la risa 09-00 Mujeres al mando 258 días para 12:55 24 Horas. Mediodia Cd 1730 Alborada 1520 La familia P. Luche 12:00 90 Mediodía encontrar el amor — 15:00 Pobre diabla 1700 Cs 1900 ATV Noticias, 1530 Vecinos 13:00 Válgame 1200 América Noticias. — * 16:15 Dame chocolate 100 : estilo Juliana 16:00 Chespirito 1500 Casocemado — Edición Mediodia — 17:30 Amor temo 100 aPe - Andrea 1700 Los pica piedras 1600 Tengo algo que decirte - 13:00 En boca de todos — - 19:00 Dama y obrero 2000 — Mfº33W — 1800 Echado del ocho 17:00 Caso cerrado 150 Al fondo hay sitio — - 19:30 Duele amar — 2300 AV Tias 19:00 La banda del Chino 19:00 90 Central 1690 Lareena soy yo 20:30 Los mejores 290 € Centra Edición central 200 Envozalta con RAP 20:00 Karin 1700 La Rosa de Guadalupe documentales TU Dénos —] 2190 Valiente 21:00 Yo Soy Kids 1850 Esto es buena 21:30 horas — 2200 Sucedió 2200 Risas de América 22:30 90 Noche 20:30 Los Vice 23:00 Te amare por siempre - 2300 Código 7 eu 0600 Lacajtamusical — 2300 inolvidable",17
1753.59,511.16,50.81,24.49,82.58,"06:00 POR Digital 09:00 Nutria 10:00 Guazuma eleven 10:30 Sakura card captor 11:00 Healer, el sanador 12:10 Papá es extraño 13:20 creciendo sin querer 14:30 Un dia enema 15:30 Healer, el sanador 16:40 El especial de Pop 17:50 Guazuma eleven 18:20 Sakura card captor 18:50 Papá es extrano 20:00 Milagros Leva entrevista 21:00 Primer Mano 21:55 Tuiio; el candidato 22:00 Computers 23:00 La hora caviar",17
462.92,1719.31,95.77,38.85,82.65,32 'PARÁSITOS' DIO EL GOLPE AL SER LA PRIMERA VEZ QUE UNA PRODUCCIÓN,17
560.5,1798.33,130.17,45.0,93.51,EXTRANJERA GANA COMO MEJOR PELÍCULA Y,17
2381.1,1318.69,149.91,31.26,71.99,"todos, aunque mes si que pareciendo muy disc utible lo de Alamuybuena*Contraloimposible le dieron dos premios tambiéntécnicos (edicióny edicióndesonido)y Guasón'se alzaron segundo Escarola mejormúsica. Discutible igualmente.'Había unavez...enHoIIywood'seadjudicóotro Oscar,al mejordiseño de producción.Comoparaque Tarantino sonríaunpoco. Nofuesunoche,sinduda.Y los gala r dones consuelo fueron para'Elescándalo”[maquillajeypeina- do].'fq£oRabbit'[guion adaptado) y Mujercitas' (diseño de vestuario). Curiosamente, apertura que supone eléxitode Parásitos'noalcanzó alacategoría de mejorfilmedeanimación, puesnuevamentePixary Disney,conToyStory4', recibieroneltrofeo.",17
1038.06,1967.03,162.09,36.49,71.16,"NadiepuedeneMEJOR LARGOMETRAJE INTERNACIONAL %arqgeestacm' , aesbuena,pero 22 EL IRLANDES' FUE EL GRAN PERDEDOR habiendo entregas areciacasitodocanta— culturas.Lamexicana*Rema” c¡onºf£gf£fjaíf¿ffggf¿ dito enlaentreganúdiolaclarinadaelaño pasado. superiores,como*Mr,Link*o mero92delOscar,pe— |afrancesa""¿…ee.stámi roalfinalhubounama— jeonhoobtuvolostrofeoscuerpo?”, hubiese sido sala",17
254.5,2143.25,179.25,33.0,77.82,yúsculasorpresa queprácticamentenadie la esperaba y ha,17
486.3,2298.7,176.43,34.83,86.21,"roto todos los es que mas al ser doenesteúltimorulaprimeravezqueocurreenla — broaQuentinTaranhistoriadelevento mástrastinopor “Habíauna cen dental de Hollywood. El vez...en morealizador, hechodequeunamismapro— queeraelmásvoceado quiensostuducciónganelos premios de inicialmente. vo que el veterano ci",17
656.25,2132.75,138.5,41.0,77.46,"alomejor directory mejor guionoriginal,vencien",17
2405.4,2319.55,151.15,30.6,77.21,"dab le op tar por el cambio y premiaraotroestudioonaciona- lidad. Loquemequedacomoconclusiónesqueelgran perdedor delaveladafueScorsese. Sin embargo, el maestro hatomadodeportivamente. Y sigue encarrera. Está preparando un",17
1939.8,2383.6,101.8,29.3,68.48,tricespreviamen=34/-4 | te anunciado scos y | mosegurosgana(A | d ores con siguieran,17
1148.75,2565.75,163.06,36.63,74.05,"metrajeinternacional.Laestu— zazoocurrióloqueestabapla— guirlacarrerayestususrespectivases- — nuevoproyectoparael2021: pend?lcirgtísurcgreana Pará— nificado.Unareparticiónde dió|varios de%usdfilmes tatuillasdoradas: lo ha logrado y parecie premios más menosequienlauniversidad. - - _ radar inicio a una apertura de nativa parque lamayoríase Sobrevalorada 1917 '¡….Gua smúPhoen…e_m g%?t'áºg£¡argdº DiCaprioyRo cara al futuro delcine mundial vayacontenta. sologanóenlascatenée2elhu¿ger "" desde la mirada de la industria — noganónada, perosudirecgoríastécnicas que cier(Judy),BradPitt (Había hollywoodense.Unasuertede — torMartinScorsesefuemetamente umvez,. enHolywood) y cambioymayorintegracióne re cida mente o vacio nad otras — grafía,efectosvisualesymezLwraD&n['lñstoriadeun _¿'f£5¡º¿'¿'¿ gg",17
1206.86,151.86,102.29,29.57,86.81,¡trome MARTES 11 DE FEBRERO DEL 2020,18
302.47,569.35,87.59,28.47,87.97,"© Si estamos desorientados y no sabemos cómo actuar, siempre podemos consultorio con un profesional. No tenemos",18
1016.25,254.75,194.75,84.75,52.92,P Lº…m—-…' a )í'f__/,18
1285.75,582.3,56.45,26.45,92.39,"De nada sirve sermonearnos con la misma historia si tú, como papá o mamá, no haces lo que les",18
2359.18,638.18,66.91,29.36,91.63,"¿Has probado preguntarle a tu hijo: 'Qué piensas tú Hazlo, así",18
1645.65,760.24,84.38,30.68,89.33,nada que perder. criticas o pides. sabrá que te interesa su opinión y él se sentirá querido y escuchado. ASEGURATE DE QUIE EMPIECE . Hablar sobre el cambio angustia. Dile que te acompañe a,18
1272.23,952.97,90.58,39.9,84.68,"de colegio. A estas.alturas, CON EL PEE DERECHO debe saber queiiráa otra escuela%segurate de que / comprenda las razones de ese cambio. . , . Llévalo a conocer las insta",18
1512.4,1083.4,73.8,27.8,88.43,laciones. No saber adónde irá,18
1593.5,1147.75,60.25,26.75,75.01,"le puede, generar, N",18
764.33,1665.33,102.13,48.73,79.79,"LOS cambiar de coleg¡o pueASPECTOS Ef¿?33?íá£%""fí&º N p s:1eenn%?;)ío(f,zsegn;f;s e?1r DE LA NUEVA a",18
357.89,1925.95,68.75,27.75,90.54,psicología brindan los siguientes consejos para que tu hijo tú puedan empezar esta nueva etapa sin mayores problemas. El cambio de colegio genera estrés en el pequeño y la mayor parte de esto está vinculado al hecho de tener que enfrentarse a algo,18
624.78,2149.46,72.59,24.85,78.05,I E desconocido. La idea es redu R cir ese nivel de estrés dándole la - “_ mayor información posible del Y - ] - lugar adónde irá a estudiar. Los — N expertos recomiendan: :_?7* ........................ PE l3 Dl,18
875.15,2539.01,73.76,28.38,86.48,"INGREDIENTES cuadritos te superior de cada uno, retira el + 8 tomates medianos * 1/2 taza de pimiento amarillo, corazón y las semillas. Lávalos <2 tazas de pechugas de pollo — en cuadritos nuevamente y escúrrelos. sin hueso, cortadas en cuadritos — «*zanahoria pequeña, cortada En un tazón mezcla el pollo con pequeños en cubitos el resto de los ingredientes. Aña410 aceitunas verdes, cortadas — *2 edas. de mayonesa de la mayonesa, sal y pimienta. rebanadas finas +Sal y pimienta Rellena los tomates con la pre+1taza de alertas PREPARACIÓN operación anterior, conserva en la",18
716.79,2704.43,69.0,28.36,81.91,"+1/2 tarde pimiento verde, en — Lavabos tomates y corta la par re fri hasta servir.",18
1983.07,1491.98,68.47,28.1,89.52,"ver Su nuevo centro de estudios antes del inicio de clases. .Destaca los aspectos positivos de la nueva escuela. Si ya la conocieron, entonces habla sobre lo bueno de las instalaciones. Frases como: Tu nuevo colegio tiene cancha de vóley o fútbol y puedes formar parte del equ¡po ayudarán. » Dile que los cambios son por tum da de s Su nueva escuela será una oportunidad para hacerlas y nuevos amigos, e |maar divertidas actividades. 5 Prepara su primer día de clases Verifica que todo esté I|sto para que tenga el mejor inicio de clases l¡¡n|malo a que se involucre en actividades extraescolares. Esto le permitirá adaptarse más rápido y relacionarse más a fondo con sus nuevos compañeros. . Escucha y habla con tu niño. En los primeros días de clases es vital que hables con él sobre cada detalle de su día. Así podrás resolver sus dudas, ayudar a disipar sus temores y a proponer soluciones a problemas de adaptación. E",18
2367.67,991.33,86.5,26.5,90.02,Javier Herreros Kuipers Pediatra CM 18361,18
2405.73,1948.69,71.3,27.77,91.01,"Una vez que el niño empieza a hablar, progresivamente desarrollará un lenguaje más completo. De decir frases de apenas dos palabras, avanzará a expresar oraciones largas y más complicadas. Algunas veces, entre los dos años y medio y los cinco años de edad, los niños presentan un problema de fluidez al hablar, repiten palabras el inicio de una oración, y más cuando están muy emocionados. Esta situación, generalmente dura unos seis meses y luego desaparece. Sin embargo, en algunos casos persiste y pasa de un problema de fluidez oral a ser una tartamudez. Esto se hace más evidente con el tiempo. Repiten sonidos o silabas como 'mmm-mamá' o prolongan un sonido alargando la palabra como 'aaaaaallá viene papá; el niño puede sentir frustración de que no le salen bien las palabras y hace gestos de esfuerzo para conseguir hablar. La causa no es psicológica. Es más frecuente en varones que en mujeres y es común que haya un antecedente familiar. Se debe acudir terapia de lenguaje. 6",18
1697.33,153.67,117.89,28.78,89.34,MARTES 11 DE FEBRERO DEL 2020 …t (FAMILIA) 19,19
1812.6,365.88,108.08,37.65,81.01,"A PIENSAN OPCIONES SENCILLAS Y CREATIVAS — ©©© Ahora hay muchos — ©UEB» . tutoriales de cocina en €9 También puedes ( _J internet, puedes ayudarte sorprender tú PAZ “= con eso. Busca un plato pareja con un desayuno",19
2090.58,519.35,74.96,31.62,83.01,Ig ml sencillo y rápido de en la camatina canción preparar. Tus padres entonada a capela. o amigos pueden o — prestarte unas o -,19
1630.76,1075.99,69.13,28.18,89.96,"copas para el vino o el champán. Y no olvides comprar unas velitas para O darle ese toque de romanticismo al ambiente. . Pecera la *NO alta tres días para habitación. Trata de . Elabora un 'playlist” necesitas celebrar San Valentín llegar antes a casa y 'Selecciona las canciones y, Si estás pre ocu de cora el cartoon — que le gustan a tu pareja lado porque aún no globos rojos, pétalos — y aquellos temas que ostentosos es quincena y no te de flores y cintas signifiquen mucho para los alcanza para agasajar a tu de color rosa. No ambos. Cuando estén juntos, pareja con un regalo o una cuestan mucho esos — la abrazas y empiezas a para salida a un restaurante, aquí materiales. También — reproducir la música. Esto demostrar te damos algunas ideas impedes comprar puede ir acompañado de ples, pero bonitas y sobre todo una cartulina roja, una cartita, un corazón de tu amor significativas, para que descartarla en forma de — cartulina, una rosita o un “te",19
1293.92,1332.58,55.25,28.42,88.63,frutas el Día del Amor y la corazón y escribir amo' sincero.,19
1335.0,672.48,88.22,31.37,79.83,"Un Pegaso es un corcel alado: g_g¿natu_ggl_ s % lea mádgica, intetigente, bondadoso yalvaje. fantasmas |Ienas Es tímido y solo puede ser domat|10 p(|>r jinetes de buen ñ bº]ºg' Y corazón. Los pegados detectan el mal y no servirán . qe sim / y quien intente domarlos con fines malvados. - Interesantes ooooooooooocoooooooooooooooooooooo.;3:?¿ 'x",20
375.79,896.71,59.14,27.36,91.57,"muchos libros, películas o leyendas que viajan mediante el boca a boca",20
496.19,1015.44,61.0,24.5,85.07,"han narrado historias de ; seres mitológicos. La lista es , muy extensa y, si investigas",20
316.2,1101.2,62.0,25.1,93.21,"un poco, te darás cuenta de que existen muchos más",20
787.24,1361.14,67.39,26.64,84.69,"de los que crees. Aquí una UNICORNIO pequeña recopilación. 0,0 El Unicornio es una criatura mitológica representa. - o 90 da habitualmente como un caballo blanco con patas o de antilope, barba de chivo y un cuerno en la frente. En y AVE FÉNIX o la Edad Media estaba considerado un animal capaz de rº UN Es un derrotar a un elefante. Se decía que con su único cuerno » 17 90 pájaro se podían purificar las aguas contaminadas. ro mítico o y dentro de | o :a mito— y olía - gr?ega, o N©TAooo que cada > Existe una gran variedad de criaturas 500 años mitológicas, las cuales representan se vería supremacía, poder, pureza, bondad, destrucción,",20
855.43,1687.43,103.86,26.43,92.18,consumido por así como la resurrección. MINOTAURO,20
1132.59,1822.41,62.83,28.14,87.11,"y la acción del fuego, Era un monstruo con cuerpo que siempre — * | , 90 po de hombre y cabeza de resurge de sus trolas GÁRGOLAS toro. Habría sido hijo de Pasiva pias cenizas. Sea 3 Son representaciones que se encuentran y el Toro de Creta. Fue encerra convertido en un D / 90 en una gran cantidad de monumentos. Las do en un laberinto en la isla de simbolo de fuer/ gárgolas eran consideradas una representaCreta. Comía carne humana y",20
240.25,1947.5,93.25,25.75,79.96,"za, purificación e inmortalidad.",20
862.16,1975.72,73.32,26.32,91.87,"ción de los demonios que al intentar escapar de los lugares sagrados, eran convertidos en piedra. También son conocidas como un símbolo de protección.",20
1886.94,1979.94,72.56,27.56,90.33,"había que ofrecerle sacrificios de jóvenes y doncellas cada nueve años. Teseo, hijo de Egeo, mató al minotauro.",20
