left,top,width,height,conf,text,page
529.0,388.25,190.0,59.5,74.57,ACTIVIDADES PARA LOS CHICOS,2
513.18,1341.18,69.65,27.15,91.58,"i amigo, el fotógrafo Gary, llegó al restaurante por una milanesa de pollo con ensalada rusa, roc o tito molido y, para la sed, una jarrita de refresco de cocona heladito. “María, a los chicos les queda como un mes más de vacaciones y sus padres deben estar pendientes para que no se queden pegados todo el día al celular, la tablet o la computadora, viendo videos o juegos en línea. Febrero siempre es más complicado, pues muchos padres que pusieron a sus hijos en vacaciones útiles en enero, ya no pueden hacerlo este mes porque están los siempre pesados gastos de útiles escolares, uniformes, zapatos, libros y otros. Entonces esos muchachos se quedan en casa mientras los padres salen a trabajar. Algunos consejos para que los chicos aprovechen las vacaciones: Establecer horarios. Es normal que en vacaciones los hijos se acuesten y levanten más tarde. Pero no se debe abusar, pues si se quedan despiertos hasta la medianoche, al día siguiente perderán casi toda la mañana en la cama. Los expertos aconsejan que no vean televisión más de una hora al día y se debe tener cuidado en seleccionar los programas. € Que no se queden es alos videojuegos. Según un estudio del Hospital del Mar de Barcelona y el Instituto de Salud Global de Barcelona (ISGlobal), realizado con 2 mil 442 niños de entre 7 y 11 años, los chicos que juegan con videojuegos tienen mejores habilidades motoras y mejor rendimiento escolar, pero basta con que jueguen dos horas a la semana para adquirir estos beneficios. Los que juegan nueve horas o más a la semana pueden tener problemas de conducta, conflictos con compañeros y menores habilidades sociales. Es decir, los videojuegos no son buenos ni malos, es el tiempo que el niño pasa con ellos lo que los convierte en buenos o malos. Deben hacer actividad física. La Organización Mundial de la Salud (OMS) señala que la actividad física es esencial para la salud. Para los chicos de 5 a 17 años recomienda que hagan al menos una hora [más tiempo será mejor) de ejercicios al día, de intensidad moderada a vigorosa. Esto mejorará las funciones cardi or respirator ias y musculares, la salud ósea y reducirá el riesgo de adquirir enfermedades no transmisible como el infarto de miocardio, accidente cerebral vascular, cáncer, diabetes, enfermedad pulmonar obstructiva crónica y otras. Fomenta la lectura. Estar de vacaciones no significa que no toquen los libros. Que ellos escojan las lecturas que quieran y que se sienten a leer un rato cada día. Tú mismo debes leer y que te vean, pues no hay mejor forma de enseñar que con el ejemplo. Que ayuden con los quehaceres del hogar. Lo primero que deben hacer es tender la cama al levantarse. También deben realizar otras actividades que los padres señalen”. Gary tiene razón. Me voy, cuídense.",2
1329.33,151.17,106.5,26.83,93.14,MIÉRCOLES 12 DE FEBRERO DEL 2020,2
1255.02,1117.61,69.17,27.75,90.68,"Ó Muchas personas, venezolana o no, se molestan cuando alguien expre: sa su preocupación por el incremento de la delincuencia a raíz de la llegada de ros. Es cierto, los crímenes han aumentado, en especial los más violentos. Los hampones venezolanos tienen un perfil más sanguinario. Eso no quita que haya venezolanos de bien. Julio Egúsquiza : :",2
1923.64,995.07,63.0,26.14,92.26,En Youtube hay un video de Nicolás Fuentes ante Brasil en México 70. ¡Qué,2
1843.92,1140.17,63.23,27.25,91.66,": jugador! Era un marabunta izquierdo finito, : muy técnico y elegante. Nunca se regalaba, : marcaba de perfil y robaba la pelota como : comuna pinza. Raras veces cometía una fal: ta. Miguel Truco tiene algo de Fuentes, : pero le falta. Debería ver sus videos.",2
1239.03,1463.31,65.83,28.36,90.41,"Zg El incremento de la delincuencia, a raíz de la llegada de miles de venezolanos al Perú, está ellas cifras, no es una apreciación subjetiva ni xenofóbica. Han llegado muchas bandas criminales del hermano país.",2
1333.4,2221.6,57.9,28.1,62.34,u Director 2 ] Carlos Comercios Española Jr. Jorge Salazar,2
1510.25,2199.75,46.5,20.25,93.06,por Empresa Editora El,2
1492.0,2272.4,37.2,19.4,76.03,"N* 171, La Victoria, Lima",2
1941.5,1421.42,79.08,28.25,91.9,"Mollendino, Nicolás Fuentes fue un lateral izquierdo que integró la legendaria sele",2
1845.17,1509.93,51.66,28.1,89.11,": ción de México 70. Jugó en Chalaco, Defensor : Lima, Cristal y la U'. Con el equipo crema salió : campeón los años 1964, 1966, 1967 y 1969.",2
1909.2,2208.27,58.53,23.13,78.8,"Fq>c_ 311-6353. Página web: Editora El Comercio S.A. Jr. Paracas m¡-¡f'ºmººº N*S30, Pueblo Libre, Limaz!.",2
1945.6,2261.2,62.6,24.2,85.88,.com Todos los derechos reservados.,2
2411.3,360.35,72.75,24.55,88.56,"Realmente una verguenza que el Estadio Nacional no se pueda utilizar. Mucha especulación, desde deterioro del recinto hasta burocracia infinita.",2
2289.75,527.25,150.5,23.25,82.64,Osebas16San SEBASTIAN SAN MIGUEL,2
2395.0,660.16,67.79,27.89,91.31,Apesar de que le robaron a Sport Huanaco nole cobraron un penal claroes punto conseguido en Argentina es importante.,2
2408.33,1021.58,53.5,25.42,89.81,¿Cree que ha bajado la corrupción en el gobierno de Martín Vizcarra?,2
2397.8,1154.3,50.4,24.2,91.28,¿Cree que Luis Nava dice la verdad sobre Alan García?,2
2444.4,1519.8,57.0,28.2,64.41,“COMPRA $ — VENTA $,2
2396.33,1775.78,100.04,24.63,89.14,EMERGENCIAS Bomberos 116 Emergencias 105 Defensa Civil ns Salud 4118000 Águilas Negras 3623277 Escuadrón verde 4276904 Luz del Sur 6175000 Semanal 3178000 Indecopi 2247800 Enel Perú 5171717,2
2377.1,2032.9,89.1,21.0,71.3,"_a MALO TOMIE PARA CUALQUIER CONSULTA SOBRE LA PROMOCIÓN, LLAMENOS",2
2201.69,2174.23,46.23,23.62,91.85,Impreso en la Planta Dando de Empresa — Hecho el Depósito Legal Biblioteca,2
2411.4,2234.13,62.2,24.2,84.36,Nacional del Perú N%2001-1992 Los artículos firmados y/o de opinión son de exclusiva responsabilidad de,2
2147.22,2293.33,50.11,21.78,78.5,Prohibida su reproducción total o parcial. _ sus autores.,2
1244.31,2700.08,197.92,63.0,91.26,"TECNOLOGÍA, VIRALES, APLICACIONES, REDES SOCIALES Y TODOS LOS GADGETS QUE TE PUEDAS IMAGINAR",2
1698.89,152.44,116.78,30.78,88.18,MIÉRCOLES 12 DE FEBRERO DEL 2020 mj& (AVISO) 3,3
469.0,1258.4,60.0,21.6,89.13,EXCLUSIVO P. Regular: S/ 14.49,3
421.83,1340.5,70.17,24.33,80.79,Permitas y místicos de pollo fresco,3
429.91,1804.91,60.45,28.73,86.33,S I EXCLUSIVO 19 P. Regular: S/ 2.89 Plátano de seda,3
430.25,2326.0,48.75,24.5,84.68,P. Regular: S/ 7.50,3
435.22,2416.78,73.11,24.78,92.56,SAN FERNANDO salchicha de pollo unid x 500 g,3
1040.3,1264.3,65.0,33.2,81.67,s .90 - P. Regular: S/ 13.99 Costillar de res,3
1031.0,1811.8,62.1,29.9,83.01,s EXCLUSIVO '2:99 P. Regular: S/ 4.89 Papaya x kg,3
1062.8,2309.4,59.8,33.0,76.33,( P. Regular: S/ 12.90,3
1091.8,2395.1,52.9,25.2,83.13,Pack hot dog cerdo SUIZA 460 g + 230 g,3
1646.29,1238.43,66.14,30.43,77.4,EXCLUSIVO si .90 P. Regular: S/ 14.20,3
1635.12,1352.5,71.25,24.0,80.23,Chuleta de Pierna/ Orzuelo de Cerdo x kg?,3
1656.9,1811.4,56.6,30.8,79.74,s EXCLUSIVO (r P. Regular: $/ 1.99 Choclo x unid,3
1627.8,2308.2,85.2,34.4,87.3,"""1690 P. Regular: S/ 23.90",3
1639.0,2384.25,81.75,22.75,93.29,Pollo rostizado + papas,3
2234.0,1257.22,82.89,28.67,74.54,SI EXCLUSIVO 12:%9 P. Regular: S/ 13.90 Trucha eviscerado,3
2271.0,1847.12,53.75,25.75,88.61,P. Reguiar: S/ 2.59 Cebolla roja x kg,3
2286.25,2240.75,27.75,23.25,78.06,s I EXC: LUS'YO,3
2246.6,2348.6,52.6,22.4,92.99,Postres de la casa x,3
1172.14,2629.15,56.94,19.13,69.37,"Precios con del 12 alli de Febrero,o haste agotan stock en plozaVea En categoría frescos Kg/10 unid por (1) No disponible en PV' La CruzT.Centro GX©[LM | V © PróceresVLo PertoNVilla,Marina IR macMagdalena Wirón'de la Volcórcel Trujillo Agostino Grito lEl Ejército Cincha Nuevo Pisco y Moqueta (2) No en PV: La Iglesios"" Santa Centro SKA Chimbote Próceres""La Victoria""La Perla Willa Rimoc?Magdalena Tirón de lo RimacaTrujilto VolcárcelATrujilto Monticle Grito México El Agostino Chaclacayo y Grifo KIOT(3) No incluye Tiramisú no Mousse de Chocolate y Trilogía de accumulable contras promociones ni precios rebajados con Tarjeta Válida para compras presenciales ?Parg mayor información sobre Términos! Condiciones y Tarifario de la Tarjeta ohl vigente visita com.pe Esta información Reglamento de Gestión de Conducta de Mercado Resolución SBS",3
314.83,175.83,64.17,25.83,93.23,4 Wilmer Talvez cruzó desde el Centro Bancario hasta el estacionamiento de,4
1054.75,209.25,40.0,26.25,56.76,y Lugar del A,4
1945.17,750.09,114.47,27.55,74.69,"…1º:c¡ía“'º““º concurrido centrocomercial,dos 'marcas' atacaron tiros y dejaron herido a en retiro de la Policía Nacional para robarle los mil 500 soles que acababa retirar de un banco. Cerca de las3dela tarde,losbalazos » obligaronavarías "" personas acorrer | olanzarsealsuelo.Dosladrones que estaban en una moto lineal rojainterceptaronalca- patán (1) Wil",4
1278.17,377.07,77.59,28.74,76.32,"Plaza| 'á9rte naráfagadebacon el dinero, ] CENTRO RETIRADO FUE lascars página COMERCIAL coen Plaza Norte, :.os|“marcas"" — Y PLAZA NORTE INTERNADO EN |en ln;íep;n¡cáeno alcanzan : cia.A plena luz del día,en y le disparan y Ea HOSP|TALY $U razona de parqueo de es",4
437.08,611.23,48.38,25.08,92.51,"Con el botín en las manos, salen del parqueo y emprenden la fuga.",4
1938.0,1609.35,142.71,30.53,74.46,"A j quaalude grancantidaddeniñosconsuspadres. 7 Segúntestigos del hechodesangre, la víctimaopusoresistencia Y al robo del dinero que Z habíasacado del ScoL> 9 ti a banky guardaba en los bolsillo s de su el pantalón. Anteesta situación, uno delos Xy hampones,sinmiraa mientoalguno,ledisp1roamala¡",4
1257.6,1707.0,102.4,49.4,47.32,: 543..A hi l$'E:r,4
1175.43,2035.43,167.86,43.86,67.82,COSTURERO DE AMARRA u [í5£í£)&1]£%f&] ») E,4
1237.0,2076.0,110.8,52.0,91.1,an de alma a mañoso,4
1426.85,2206.7,73.03,28.67,89.37,"C© Más de cien personas Un ciudadano [lalcasa (¿b. atacaron a patadas, argentino, que fue puñetas y jalones de cabe condenado a cadena pero al costurero José Antonio petua por haber violado",4
1137.95,2367.32,68.82,25.86,92.95,"Pinche Guadalupe (47), acusado de hacer tocamientos indebido a cuatro niñas en Gamarra, La Victoria. La madre de una de las",4
1957.0,2348.47,72.4,26.6,91.49,"asu hijastra desde que tenía nueve años de edad, fue arrestado en Surco. Detectives Con",4
245.88,2264.12,112.62,34.88,83.63,dar on e mero que punto escolares SD,4
198.4,2427.0,134.0,44.0,78.01,W|Ider Sanchez 34] de alqu¡la—,4
1241.22,2607.8,87.22,32.3,82.79,"¡$Bw agraviada lo atacó junto tra el Crimen donde Gñíg© nego— con otras personas, entre Organizado y la avenida 28 de Julio y el capturaron pues G|!E(ññ peque jirón Gamarra. Varios conforme Rubén [cuadrajis della) na a|canc¡a. intentes de policías, al Cortez (48), puerta mando del coronel PNP Luis — y condujeron a la comisaría — | 'Marrufo', en la v¡olentada ¡Entramos M comMpréporsu cumple Ladrón de Guevara, jefe — de Apolo. El detenido tenía avenida Las Flovitodorestabalrevuelto! ME A antecedentes por violación. restas. La Sala",4
1274.71,2752.0,77.57,27.29,86.25,mataron de la furiosa turba (M.Rochabrum) [e],4
2138.75,2064.75,182.0,62.0,91.05,Atrapan a violador gaucho,4
2398.75,2257.5,78.25,26.0,93.79,que atacó sexualmente a,4
2385.71,2331.29,51.14,26.14,83.19,— que se quedaba a su cui,4
2429.5,2570.0,60.75,41.0,89.68,€l 2013 cuando la,4
2381.5,744.29,99.38,26.16,76.89,"Tras n el feroz ataque y con el botín en sus manos,losasaltantes huyeron enla misma moto atodavelocidad. Lavictima,que había caidoalsuelo,con las pocas fuerzas que le que dabanpidióayuda , ?3 yeneslugarledie— rollos primeros auxilios. Con heridas de bala en el abdomen ». yenes brazo, WilmerGálvez fue trasladado al Hospital AugustoB.Leguía, dela Policía Nacional,en , 4",4
2205.47,1263.27,82.47,31.6,63.39,"'¡¡» avera (62),a elRimac.Se — pocos metros conocióque * 1 ¡ del W|LMERGÁLVEZ[62] estado ¿",4
2411.52,1588.6,93.58,29.8,73.25,"saludes delicado. ._ *'PLAN CERCO' Traslaemergen— 4 cia,la Policía acy tiró el Plan Cero co' en busca de los asaltantes,quienes habrianacX cuado tras recibir - "" eldatodeuncóm% pliegue hizo la * a suvíctiy ma en la entidad financiera. (EdgarCirilo)",4
2409.92,2180.42,78.17,27.92,91.44,"Penal Transitoria de Villa María del Triunfo ordenó la detención del extranjero,",4
2404.43,2446.48,63.19,27.0,92.04,"dado porque la madre, con quien convivía, se iba a trabajar. Los abusos empezaron en el 2005 y culminaron en",4
2401.2,2653.8,61.8,27.53,91.57,menor le contó a su madre que su padrastro Y la ultraje sexualmente. (E. Cirilo),4
1211.0,154.25,93.12,28.75,82.3,o 'J& MIÉRCOLES 12 DE FEBRERO DEL 2020,6
581.25,504.5,180.0,31.25,89.5,PROMOCIÓN FAVORITA DEL VERANO,6
375.75,677.5,101.25,116.25,91.19,5 mi y 10,6
299.17,991.42,106.25,29.5,86.71,"miren seguir como el diario de mayorcirculación en todo Perú, Trometiene promedio",6
254.27,1163.82,123.45,31.36,69.96,dora del Verano; lacunal trae2mil 800 premios efectivo. Con tanto dinero parare,6
866.5,303.56,104.44,32.25,76.47,"q h Todos los días inscribe SIW""?1 tu'Número de la Suerte llamando al 710-0260 25 www.trome.pe",6
1423.92,357.69,68.31,15.46,90.11,NOMBRE: OSWALD HERRERA DISTRITO: SAN JUAN DE LURIGANCHO N* DE LA SUERTE: 2074961,6
1269.25,679.25,157.0,88.5,55.97,Soles i. »—'I ©<7,6
636.14,896.57,139.29,28.43,69.54,partir tuschancesdeconvertir- teen uno de los ganadores son gran,6
1089.73,1054.41,98.0,37.32,70.56,"' al Itienes buccaro t¡;qartiila,que salió el Xx / canilla tus t unessayed mar.J H 'llesjgle%erás p%g%ren ella CUPOÍ'I€S grat¡s,",6
665.6,1183.6,184.6,32.0,88.86,los cupon es que recorte s y formara frase ganado,6
1776.82,329.59,78.35,18.59,85.85,GANADORES DE LOS 3 PREMIOS be $S/500 NOMBRE: HUGO GUAYLUPO DISTRITO: CALLAO N* DE LA SUERTE: 2845994,6
2244.67,358.0,65.5,15.33,91.7,NOMBRE: ARNALDO ACOSTA DISTRITO: CERCADO DE LIMA N* DE LA SUERTE: 2903621,6
2375.89,762.75,106.18,32.59,74.96,":(LOS - 03 wem:osde$/ 10,000 : GO prontos de S/.5,000 : O9prontos de S/. 1,000 - 932 de S/.500 : premios de S/.100 al'AlóTrome""(311-6399) de lunesadomingo,de9dela mañanaa6delatarde. Ahora quesevieneelcolegio, los gastos por la compra de útilesescolaresya no serán un problema site ganas alguno de los premios detesta pro",6
2003.2,1024.8,115.2,34.0,85.54,"las.Silohaces será tuyo, de mon",6
2076.38,1115.0,232.75,30.38,69.96,"to de dinero reaparece moción. anotadoalladoderecho. + ¡Ah!ynovayasabotarlos Haypremiosde100soles, cuponesquetesobren,",6
2198.5,1189.0,190.75,31.75,87.23,"500,mil,Smily10 mil. puesconellospodrás ganar",6
1720.71,1260.47,116.29,32.53,68.78,"ra enana delascincofiY Pa$a pº"" Ca]a Paracobrardeberásllamar grandespremiosextra. O LA 'SÚPER LLAMADA' &Q SOLO 1 SOL!",6
1578.29,1656.29,62.14,29.29,87.4,"todos los días del año, incl feriados.",6
1652.0,1391.12,118.0,59.0,91.93,Tuvia de dinero los 365 días del año,6
1775.14,1566.22,72.61,30.53,88.39,"© Si necesitas platita urgente, no te rompas el 'coco” pensando de dónde la sacarás. ¡Solo participa en la “Súper llamada ganadora' y asunto arreglado! Es que esta promoción re?ala miles de soles unidos domingos y",6
1647.29,1722.71,72.57,27.29,92.82,Toma nota: De lunes a viernes repartimos,6
2416.76,1649.8,55.44,23.48,83.47,El nuevo número de O) - - tu revista +mujer ya está en los quios— e cos comun especial de 2 San Valentín. Tenemos,6
528.25,2420.0,185.0,25.5,57.26,TECNOLOGÍA ALEMANA SEDESILIMAY: VAREQUIPA),6
644.54,2564.96,67.57,30.78,72.26,110 8541| PRINCIPAL (054)299977 Av.El Ejército 107 Frente a … ñ ste 1184 of 203 . S?573321 M173 Cu|iw;u Vt;l;lzz A1 Pablo VI La Bombilla ' $Á NTA ANI 9298 “ Alfonso Corte P £2?4 ?s' 'EEEBD (044) 293206 Co. Los Zafiros 204 Urb.Sto.Inés LOS OLIVOS — (01)782 4440 ICE N Carlos Iza virrey 1182 -ler. |so TACNA PUEBI.Qá 22'| )773 g 85 Mi (01)696 6573 - <>9834021 '73 S 944*779l063,6
353.57,2738.0,35.79,23.21,82.13,Calle Uranoso de Paula riza 813 Ofi 201 alt. 14 de 28 de juli,6
1526.8,2686.6,127.0,41.0,67.33,producto de [ñú|l!];1& pierdes w,6
1655.44,1999.76,68.68,28.79,89.9,"tres premios de 500 soles cada uno, los sábados salen mil y los domingos 5 mil. Inscríbeme cualquier día de la semana, de 6 de la mañana a 6 de la tarde, porque los — * sorteo se realizan a las 7 dela — * noche, siempre en presencia de un notario público. Ten presente que, mientras más veces te anotes, mayores serán tus posibilidades de ganar. MÁSGANADORES Ayer, martes, ganaron 500 soles cada uno: Oswald Herrera (2074961, de San Juan de Lurigancho), Hugo Guaylupo ¡2845994 del Callao) y Arnaldo Acosta 2903621, del Cercado de Lima)",6
2400.8,2041.35,70.19,26.72,90.89,"ideas de regalitos para * amigos que pueden ser algo más. Asimismo, cinco figuras nos cuentan sus anécdotas más curiosas en el Día del Amor. También hay entrevistas, como la realizada a Julio y su amada Brenda. Ernesto Jimenez responde a nuestras lectoras en “Pregúntale a.... Como siempre, están el Horóscopo del Amor, Consultorio Íntimo, ideas de negocios, tips de belleza, moda y mucho más. o",6
307.0,2151.33,114.33,37.0,63.59,del Amora reforzaron Ia Vigilancia [astcalles],7
232.14,2462.43,115.43,45.29,71.55,en a transito eel INFIEL Y an,7
1141.6,336.8,118.8,38.6,92.65,señala que no casarse se está volviendo una tendencia mundial,7
1138.89,673.89,119.11,26.33,77.59,"olteritos, sincompromiso, perono solos.Según cifras consulta das al Instituto Nacional de Estadística Lima,la soltería es el estado civil que pre domina (31%) y en Perúmásde5millones,mayores de a 18años,están solteros, espe",7
1127.98,1250.55,67.33,27.59,81.45,"SA SEPA 1 Erelici' 7 dad: Dentro de 4 símismo, acercándose y desarrollándose. No se case por presión, la familia, la edad. No necesita de otro para 'estar completo', sí para que lo acompañe (si lo desea], no para depender. y relación perfecta ( y, es solo de redes sociales.",7
712.46,1974.34,70.06,26.46,83.88,"Para celebrar 'el — © amor y la amish , los malls y centros comerciales y - de Lima ofrecerán diversas actividades: “MINKA: Este 14 se presenta Debéis Orozco y estrena videoclip “Por Fotos con Daniela Fijo y Emanuel Sobrino (Chapa tu combi”. -MEGAPLAZA: Taller de tapas y",7
1122.06,2230.5,67.19,28.31,87.32,"$ Soy"": imitadores de Luis d Fonsi, Miriam Hernández y , José José. MALLAVENTURA SAN",7
628.29,2455.0,170.57,47.86,78.58,ADIÓS A NÚMEROS Calificaron conjeturas en colegios,7
702.69,2702.94,68.56,28.44,89.51,"©» La calificación_ alos escolares será ahora por letra. Según el Ministerio de Educación, se",7
1143.08,2720.83,80.5,27.17,92.35,"extenderá durante todo este año la evaluación cualitativa, expresada en letras",7
1545.55,1062.48,149.1,29.21,75.13,"cialmentehombres. ¿Cómovivenelamoren fechas como “San Valentín? “Sersolteroseestá volviendo una tendencias global.Cadavez son menos los matrimonio s y mayoress divorcios.Pero una cosa essersolteroyotrasolitario”dijo a Promesa psicólogaclínica y psicoterapeutaJuliana Sequera. Hay solterosporelección, deciden por voluntad no tener parejaocompromiso,centran subida en sussueños,metas, lo profesional,estudios, viajar yotrasprioridades, y se sienten realizados, lo disfrutan. “Noesquecarezcandehabilidades pararelacionarse, no sepan",7
1566.03,1873.42,67.83,26.5,91.16,"TA ANITA: Concierto de Maya Gobi con sus temas como “Karma; “Sola y soltera El sábado, Orquesta Combinación de La Habana. PLAZA: Conciertos con el imitador de Luis Miguel, en las sedes de Anga",7
1094.0,1645.62,138.5,66.25,88.12,Maya Gobi y “|Luñ Miguel por San Valentín,7
1476.25,2080.75,52.25,20.75,82.28,— mos y Atocongo.,7
1563.92,2210.67,59.83,26.58,91.06,"NORTE y MALL DEL SUR: 'Tributo musical al amor' y fotos con Cupido. En su Teatro Plaza Norte función amo, pero no",7
1592.4,2429.4,44.9,27.3,91.97,"(AD, A, B, C) en lugar de la escala vigesimal del 0 al 20. Ya se aplicaba en los nave",7
1521.17,2505.0,50.33,23.83,71.43,"J les inicial y primaria, pero",7
1557.25,2552.88,82.38,27.12,92.89,desde este 2020 se ampliará progresivamente hasta,7
1526.5,2609.0,53.17,23.5,88.45,4 el quinto de secundaria en,7
1535.88,2698.47,71.71,28.35,92.84,colegios públicos y privados de todo el Perú. Permitirá al alumno identificar sus fortalezas y dificulta,7
1963.65,804.58,132.04,29.42,86.4,"amaroesténcarentesde amor. Tienen prisa por tener pareja y tampoco se niegan si en el camino aparece” añadió Sequera. Otros sonsolterossolitarios,con nal.“Tienen claro por quénotienen pareja, peroañoran alguien que l_os acompa",7
1884.12,1266.88,84.69,29.0,82.38,"ciónenrelación,vi- viendo el momento;sin proyec— ya cóndor * miedo compromiso y alfa",7
1981.75,1890.71,74.29,27.18,83.28,"te soporto' y el sábado concierto al amor con los “dobles' de Juan Gabriel, Raphael, Sandro y José José. JOCKEY PLAZA: “Encuentra a tu pareja perfecta"" conectará personas, consultando preferencias en videojuegos, tecnolo+ gíayotros. Y Retos y circuit to de realidad aumentada de película “Locos de amor 3' vía experienciaslarambla.com.",7
1966.67,2588.21,73.88,28.1,89.87,"des, lo cual le ayudará a desarrollar autonomía y responsabilidad. AD Logro destacado. Supera el logro esperado. Alegro esperado. B Logro en proceso. Cerca del nivel esperado. C Logro en inicio. Mínimo de progreso en el nivel esperado. [S.Ogregón) — €",7
2420.47,780.83,124.26,27.69,76.57,"caso.Ahí entranlos“amigosconderechos;lossol- tero s de la adolescencia eterna”,manifestó la especialista. PRESIÓN SOCIAL Agregó: “Hay mucha presión social por casarse tenerhijos, proteger pareja esopción, no obligación. Preferible ser solteroporelección que divorciado por frustración. El soltero feliznotienemalestaremocional, sentimental ni rec la mo haciaélnialavida.Eneste SanValentín,celebrenel amor universal ya símismos(aceptación),com- partanconamigos, relájense experiencias quelesha) ) consentir 4 bien.No caigan consul Mismo, presión nidepreión”.(Isa- bel Medina) e",7
2409.74,2393.96,61.82,27.08,91.81,"C© Un show de danza en apoyo de los damnificados del incendio en Villa El Salvador, por la fuga de gas de un camión cisterna, se realizará hoy en la Sala de Usos Múltiples del Centro Cultural de San Marcos, frente al Parque Universitario. La función solidaria empezará alas 6 de la tarde y es organizada por la Universidad Nacional Mayor de San Marcos bajo la iniciativa “Ballet San Marcos y amigos bailan por Villa El Salvador'. El ingreso será donando alimentos no predecibles para las víctimas de la tragedia, que ya cobró 27 €",7
1992.71,434.68,131.3,33.62,79.01,"años de pri$egún lafiscal,a I(_Zasta» AFIRMA sin puedes seda y suscómplices se Y condenadoLuis — lesdebedarlos36meQUE EL DANO astaseda Lossesdeprisinpreventi- — CAUSADO POR si osis ecom prueba que — va,puespresentan percibió milesdedólaligrode fuga y buscan ALCALDE respetas y Odebreobstruirlajusticia. De 'ES ALTO' cht.Esta pena,quees acuerdoalainvestigalamáximaparaun ción,elexburgomaes— ciudadano en el Petresehizoelenfer- '-r SEPA QUE... rú,esloquecalcumoparanodeclarary 1 Ola fiscal reveló que",8
2065.16,736.94,91.16,28.47,72.68,"losdelitosdeco| = migo Martín Gustado una dirección distusión,lavado de mente,quienesco| tinta ala que está en activos y asocia—j laboradoreficaz, — 1 suDNI. ciónilícita. ni quenolosdelate. — CEnlaaudiencia,",8
2407.0,655.75,64.5,27.75,80.97,r Castaña Bosnio le,8
2394.75,833.0,75.75,29.0,91.79,"1 Mateo Castañeda, abo",8
2136.82,954.05,81.21,31.86,71.96,"díadeaudienESTE VIERNES ' gado de Luna Gálvez, cia,el exalcal( y “Eldaño causa llamó “chismoso'aun — ; devolvióaese, | doesalto,puesde— | vecino de su defendido | tarcaraacaT5 EE d fraudólaconfian— |1por dar información a Jl racon la fiscal — % 27 zadelapoblación — lla Fiscalía. ) MilagrosSalazar _fá queloeligió alcalde, 0 CU =",8
1760.62,1091.0,169.88,35.0,68.62,"flaqueza Maria Al¡'(;|$5|_|_5 seafectólos servicios varez.Estavez,no EGARRAdetransporteylasta",8
1622.51,1332.75,148.47,31.53,73.76,"sonrióniserascóla 1 rif as de los peajes”, cabeza, pero sídijo*a mí agrególafiscal sobre | ninguna constructor a Castañeda. R XF|S(EAL AIDE mehadadodinero.PaLosabogadosdelos MAXIMARENAROR ralosimges|tigad(¿;sjoil procesados rechaza= N luna GálvezyGiselle — ronla s acusaciones y DEDITOS ©E G©LUSI©N! Zegarra,quienestampidieronalajuezano VA S biénestuvieronpresenaceptarel pedido - í tes,seestiman conde prisión. El falso second ASOCIACION MENTA náédeí3y26años. res— ceráesteviernes. pectivamente. (JordanArce)",8
498.2,1666.2,116.07,51.6,68.27,"GILBERT VIOLETA ¿ ¿""f""'""""'“ “Corrupción sigue Y |7 € viva en el Estado” * N",8
1553.16,1698.95,71.16,26.21,91.26,"Parlamento. Por su parte, Víctor García Belaunde calificó como “falsa la lucha contra la corrupción” que realiza el",8
1157.3,1917.98,68.53,29.01,83.33,"€$ “La bandera del GobierGobierno. “Es acertada la ©&a no es la lucha contra BELAUNDE salida de Liu por conflicto Acción a s la corrupción, pero esta Carlos Liu, quien renunció — to de intereses, pero sigue BopularMesias e Y a aún sigue muy viva en el debido a sus asesoría la sospecha de las influencie NO expresó el excon/ a la empresa Odebrecias de Obrecht en el investigaeión. resista Gilbert Violeta. ' cht. Añadió que la gobierno. La renuncia no - El integrante de Contigo o corrupción no ha sido — elimina las presunciones de MM comentó así el escándalo desterrada, pesadas — favoritismo”, manifestó el protegerla aa",8
516.5,2077.83,74.33,28.83,68.34,por el caso del ministro layirtúal,8
275.0,2114.6,56.4,29.2,93.2,"de Energía y Minas, Juan",8
