left,top,width,height,conf,text,page
1583.11,2098.84,49.22,27.21,72.18,"demsayhfa……a&lde 'Quimn [14)[20] [Sub) 10:40 Sí miamor ( ) (20) (Dob) 150, 4:20, 4:30, 6:40, 750, 10:10, 910 Doittie(Apll (20) (Dob] 2:40, 5:10, 7:30, 9:55 Desde y ta fan tabu los a emancipación de mallaky0um (14) [ZDI [Dobl2l0 4:40,7:10, La foquita: El 10 de la (Apt) (20) (Dob] IZAR 140, 2:40,450,7:00, 9:10, 350 6:10, 8:20, 1030, 250. 5:00, 7:20, 9:30 Paásms[ldl IDI Sub) 1:20, 4:10, 7:00, 950 Jugando con fuego Apio (20] ÍDOb] 330, 550, 8:00, 1015 1917 [id] o para siempre 20) (Dot) 200, 450, 740 9:30, 10:20 Espías a [Apt](20]) (Dob) 210,6:50 % SALADIGITAL 30 Aves de presa y la fan tabu los a emancipación de una Harley ¿um [14] [20] [Dohl 200, 430 00, 9:30, 3:00, 5:30, 8: [ (znl[ºod3ao &nw [¡4 z",21
1550.46,2504.77,41.31,26.69,73.51,"boys … 730, 10:10 La El O de la lame (Dobl3:50.600, 8:10, 10:20",21
1603.83,2614.33,49.92,26.08,65.81,"— v SALADIGITAL 3D $/12.00 s……lml (2D) [Dob] 2:20, 4:30, 6:50, 920",21
1610.3,2671.0,77.1,30.5,73.04,"la fan tabu los a emancipación de ma Ih:;%um [14) fbl 2:10, 4:40, 7JO.",21
1533.17,2737.17,97.83,41.17,52.45,20640Lafaxm¡£liºdelade e [Dob] 9:00 Aves fa'td¡b£pl[ºl,21
2012.86,1004.14,54.81,28.59,67.52,"opción de una Harley Quinn (14) (20) [Dot) 3:10, Ea O CINEPLANET DEFECA .6 “ SALADIGITAL3D S/.12.00 bp…[14l (20) [Sub) 2:10, 430, 6:50,9:10 Pa(14) (20) (Sub) 150,4:40, 730, 10:201917 (14) lzol[swl&oo 5:30, 8:00, 1004 ae yla",21
1935.6,1131.6,97.4,53.6,47.97,ll &2Iá [Sd)%110 710d;40 &!g£;0::y,21
1929.31,1261.69,93.38,28.75,61.42,19)(20) (Sul 5dº 950ufa¡m … )& bl 250740Wl141l20][&bl 2083dbwspnsmm(]4![20l[$ul1640 0CDESWIA… SE “ SALA DIGITAL 30 S/1000,21
2050.86,1378.29,70.71,34.29,55.13,"m£7º' (Apt) (20) (Dob] 3:15, £30 T45,",21
2397.28,931.0,45.78,26.22,66.57,"una Harvey Quinn (Apt] |zn) (Dob) 345 3:45,5:30, 6:00, 7:45, 8:1510:00, 10:20 (20) [Dob] 3:00. 50670 945 maldita",21
2388.0,1185.64,62.82,20.73,79.85,0MSMRSJR SE + SALA DIGITAL 3D S/.10.00 Aves de la fan tabu los a emancipación,21
2430.76,1283.22,42.27,27.71,81.55,"presay de una Harley Quinn (Ap1) (20) (Dob] &15 3:45, 5:30, 6:00, 7:45, 8:15, 10:00, 10:20 Volando junW](znl(nobisoo 5:15, 7:30,9:45 Ciudad maldita (Apt) (20) (Dob] 7:30, 9:30 La foquita: El 10 de la calle (Apt) (20) 315 4:00, 5:00, 6:00,",21
2230.6,1436.86,61.74,29.95,74.01,"7:00, 8:00,9:00, 100055p|asescm¡idasl… 20) (Dob) 3:30, 5:30 Bad boys para re 10:00 Volando juntos (Ant) (20 EDob] 300,545 — [M] dl Dob] 5:45, Sí, mamor[|4]lafoqma:!]106ehde[hpt 20)730,930 15 omsrm… S.7 SALA DIGITAL 3D TD » SALA o|cmu30 5/ oo Aves de Iafandu!osa Desde",21
2046.2,1579.47,40.27,31.33,66.52,"de una Quim 100, 315,530, 745, 955 Volando juntos (Apt D] dobl 230, (20) (Dob]",21
2002.55,1673.61,48.76,31.82,74.95,"145,5:45,7:45 La foquita: El 10 de la cae (Apt (20) 115, 3:15, 5:15, 7:15, 9:00 Espías escondidas ID [Dob) 130, 3:30 Batboys para fiery M] 5:30,7:45,955 Los rostros del blo (14) (20] Dob!345745$u.mmh4]l20]",21
1955.62,1816.62,66.38,19.25,61.11,1:00. ommum… el * SALA DIGITAL 30 $/.10.00,21
2015.4,1967.38,57.86,32.72,68.15,"fan tabu los a emancipación de $º de (Dob] 3:15, 3:45,5:30 00,745, Volando juntos (Apt] (20) (Dob) 3:00, 5:15. 7:30, 9:45 La foquita: El 10 [A(p!l 520) 330, 5=30 7:30, 930 Espías siempre (14 Az nm) 3:30, ma;dab$fomls Sime antu (14) 2[ol (Dobj 0345 545, 7:45, lag siguiente nivel [Apt) (20) (Dob] 10:00",21
1974.25,2143.0,40.0,20.12,77.86,O COMAS ss “ SALA DIGITAL 3D S/.'(0.00,21
2011.0,2189.2,65.6,20.6,65.82,ARS* la fan tabu los a paci ECA,21
1987.33,2296.06,48.82,29.03,76.33,"000 juntos (Ant) [20] [Dob%300 5:15,730, 9:45 Lafoquita: El 10 de la calle | [ZD]345.545. 7:45, 945 Espias a 1 5308¡dbwspaa…[l flow 730, 945 “ SALA DIGITAL 30 S/ 1000 Aves de presa",21
1961.0,2419.22,94.89,33.78,76.59,"la fan tabu los a emana de una Harley m[wllznllom]m a 5so.sm,7.4am.oo…",21
1994.5,2553.33,78.5,30.67,76.97,"siempre [14] 8:15, 10:15 Jugando D[ohl&00$t.nim[14l[ml",21
1952.75,2743.17,39.75,25.75,84.33,“» SALA DIGITAL 30 Aves de presa y la fan tabu los a emancipación de,21
2489.0,1572.0,57.56,29.0,68.38,[20l Dob 745. 1000V…¡nt05 Apt) 7 Dob &00 515.,21
2428.36,1652.09,74.36,33.36,69.17,"9asuwumoawa[wrl ¡zolm 5:45, 7:45,9:45 Bad boys para siempre (14) (20) [Dob)345,7:30",21
2439.92,1759.17,66.17,31.17,71.48,"0…B.… sin Aves de la emancipación dema…úrm [4) [Sub] 4:00, 6:00, 8:00,",21
2435.94,1863.88,43.44,31.04,78.61,"10:00 Un buen dannel vecindario (14) Sub] 4:5, 6:15, 8:5, 10:15 La foquita: El 10 de la calle [Apt] 5:00, 6:45, 8:30, 10:30 Bad boys para siempre 10201917[14IÍ5UH 5:40,7:50, 10:10 Judy Garland (14) (Sub) 3:30,7:45 Parásitos (M)(Sut] 4:30, 7:00 Si, mi amor (14) 3:00 El guasón [14)(sub)9:30",21
2391.5,2046.67,52.17,25.22,70.1,O UVKBASADRE Sol “ SALADIGITAL 3D Parásito [14) [Sub] 4:407:20 10:00 Aves de y la fan tabu los a de una,21
2420.92,2140.22,40.14,25.72,75.6,losa emancipación um (14) [Subl 320 5:40 800 10:20 luf¡ (14 [Sub) 4257.00 9:30 Un buen día en ro [14) (Sub] 330 5:50 8:10 1025 Bad bus siempre [14] [Subl 4:20 1977 (14) 6:55 Festivales,21
2429.58,2396.15,71.91,33.06,74.93,Aves de tan tabu los a emancipación de h&f€m[…llºobl3m&muonoo fnquta:£llºdelaathl 500 oo a escondidas [Apt) dobl 230 :40 Ciudad (14) 6:50 9:10 Volando …[m[m]300515s.…… AptifDob) 7:40 955 Bad boys para siempre [14) (Dob] 2:30 4507:201917 (14],21
2302.8,2541.6,61.8,17.0,72.53,O UELAGUSTIZO » SALADIGITAL 3D,21
2402.27,2647.32,56.36,31.86,71.65,"Aves de fan tabu los a emancipación de [ 3005t207.40¡000 %¿”h""ºº""mpu 630 730 8:30 9:40 Ciudad maldita 650 9:00 Í 50 450 9:0 Estas a",21
1254.0,155.0,112.43,25.86,86.63,MIÉRCOLES 12 DE FEBRERO DEL 2020 AN,22
1982.2,494.0,82.0,36.4,80.65,"© Paraser, felino tas de:ló",22
966.65,608.0,145.8,37.35,58.91,"tieñenáltoconténido C> S|empre muestran en.f¡bra,protemas y tbuenad¡spos¡c¡on grahdes:lujos,amagrasas-saludables: para: trabajar enteguipo; Además, ayudanáreducir recuerda]que elfóbjetivoy sal a'caminar.",22
619.0,690.75,106.5,31.75,67.56,lá ansiedad: és conseguir.la.meta.,22
1061.4,835.9,45.9,25.6,86.13,n la vida es 1. BAILARÍN. Es el chico que,22
1313.36,1084.89,73.34,29.65,87.91,"necesario 23PU€d€S le encanta moverse al ritmo conocer los encontrar música, jamás te dejará tipos de . sentada, sino que buscará = enamorados al tieno, Il;1c_ilrse contigo en la pista de |P—S¡¡-¿gggm%'¡—ºátre CPP 3409 que hay, para aile. , saber lo que estás caba_' |er0, 2, BETALLISTA. El siempre ASÍ SE MALTRATA buscando y lo trabajador te sorprenderá con un que quieres en un H chocolate, peluche o una ALOS H|lº$ compañero de vida, y gfac'ºsº salida al cíne, sin necesidad de y asi formar una que sea una fecha especial. © Los niños suelen ser relación estable y 3. MIL OFICIOS. Sabe arreglar las principales víctiduradera. cualquier desperfecto en casa, mas de maltrato dentro de",22
271.0,1304.8,64.8,26.6,93.53,Estos son algunos de ellos:,22
1554.5,1315.25,59.42,28.42,92.98,es digno de admirar y siempre busca hacer sentir bien a su,22
1984.56,1312.89,68.67,26.89,89.71,"6, HACENDOSO. Es el chico que sabe lavar, cocinar",22
2424.8,1319.8,59.8,24.7,93.57,las familias. Muchas veces en nombre del amor o de,22
1855.19,1478.12,77.07,29.64,88.23,"pareja. Yy barrer. Atrae a muchas la disciplina. Pero lejos de GRACIOSO. Es aquel chicas porque da muestras lograr formarlos, los termi-:ALOLARGO DE TU VIDA que te saca una sonrisa de su independencia. na deformado psíquica, y por qué no una Además, es atento y sobre física y espiritualmente. a 4£¿ — carcajada. Es optimista todo considerado con su Veamos los dos grandes A N y le encuentra el lado amada. grupos o modalidades de positivo a las cosas por 7. TIERNO. Este tipo de maltrato hacia los niños:",22
1533.5,1647.17,106.67,28.0,92.37,más desagradables que parezcan. 5. CABALLERO.,22
1643.0,1853.67,60.17,27.83,89.84,quedan. Solos que te abren la,22
2000.5,1656.33,74.17,27.33,92.84,"hombre atrapa por su inocencia, ingenuidad y porque sin desearlo te hace",22
1939.2,1845.8,92.4,26.6,93.08,Recuerda que es imposible encontrar,22
2397.15,1653.62,62.85,26.38,90.64,"% Maltrato por exces0, casos de adultos que golpean sin parar, encie",22
2030.42,1757.46,72.77,27.65,89.33,"Dicen que de reír. Además, inspira cariño rran, torturan, insultan, — estos quedan y comprensión. agreden, obligan violentapocos, pero mente a un niño a realizar",22
2389.0,1854.67,99.17,28.0,92.5,"actividades cotidianas como, por ejemplo, tareas,",22
1853.88,2043.93,68.39,29.93,86.31,"' %J puerta al entrar, — un hombre con todas alimentación, higiene, etc. L % D º—; , que te ayudan a — estas características; Abuso sexual. : Subir o bajar del — sin embargo, el tuyo 2.Maltrato por défir'¡'=3¡ y auto,teceden — puede tener varias de las cit. Cuidados escasos de el asiento mencionadas. Pero, ten atención, de contención PA y siempre se en cuenta que lo más afectiva, es decir, padres preocupan portu — importante en una relación que no se hacen cargo de l_ bienestar. es el diálogo para llegar a sus hijos. Niños que crecen POR: PILAR CUYA G, N acuerdos en función del solos, desvalidos, bando",22
2041.0,2218.67,49.5,30.17,85.24,bienestar de la pareja. — G,22
2377.4,2241.8,86.2,26.6,91.05,"nados, etc. Ambas modalidades son",22
1972.3,2311.3,291.6,37.6,85.43,formas de sor|neter aun —é ¿ niño y generalmente es,22
260.09,2428.09,83.36,42.0,80.56,i INGREDIENTES 1 +6 piernas de pollo E 1 cebolla picada,22
757.55,2410.45,52.45,27.18,86.49,« 8 tazas de caldo de pollo “3 papas amarillas en,22
1176.0,2415.5,57.7,28.5,92.0,la cebolla con una pizca de comino. Agregar el ají,22
2411.0,2416.5,71.38,28.75,91.55,conectarse con el dolor o sufrimiento del prójimo,22
1153.71,2597.85,62.32,27.88,86.17,"rodajas amarillo y el cilantro. Meza menos el de las criaturas. 3 das de ají amarillo « Sal, pimienta y comino clar y dejar cocinar. Echar Esto necesita ser demolido las arvejas, el pimiento, notificado y atendido por 1/2 taza de cilantro PREPARACIÓN el arroz y las presas. Verespecialistas. Tanto el niño licuado En una olla con aceite tere caldo caliente, bajar maltratado como el adulto + 1/2 taza de arvejas caliente dorar las piernas el fuego y tapar la olla por o familia maltratadora. _el E + 1/4 de taza de de pollo con sal y pimienta minutos. Incorporar las y pimiento en tiras ta. Retirar las presas y papas y esperar que cocine",22
249.17,2756.17,41.67,27.17,64.43,",y 1 taza de arroz %",22
695.75,2753.5,55.25,25.5,93.91,en el mismo aceite,22
1321.4,150.6,81.0,35.6,82.94,MIÉRCOLES 12 DE D A,23
337.0,850.1,50.7,27.1,86.55,a época del año en la cual los padres gastan,23
304.71,1021.03,57.47,26.06,93.07,"más son las semanas previas al regreso a clases. Cada vez que los chicos pasan de grado, la lista de útiles crece y el gasto es mayor. Para aliviar un poco tu bolsillo sigue",23
2423.92,1043.77,75.69,27.54,92.86,donde te ofrezcan ambos productos por un solo precio. » Compara precios entre,23
1718.71,1052.89,63.24,28.09,87.57,"compra solo lo necesario. — que también tengan » Compra al por mayor hijos en edad escolar la prenda que más usted — yen grupo comprar hijo. Por ejemplo, la camisa — uniformes por docena. se usa al menos tres veces — Aprovecha que la",23
1402.44,1307.97,64.73,28.54,88.95,"estos consejos: a la semana, no basta tener — camisa, blusa, establecimientos, » Primero, revisa y reutilizar una sola. Si compras por falda y pantalón así no pagarás de los uniformes y calzado cuarto de docena ahorrarás — escolar son del más por un mismo que de mantengan en buen gn unidad y las prendas mi|smo digeñ|o. pro¿iucto. mi tendrás estado y todavía les sirvan i usarán más. solo cambia la que ir de tienda en a tus hijos. Lo mismo con la compara prec¡os » Otra manera de ahorrar — talla. tienda mochila y lonchera. y compra al por es reunirte con las madres » Si tienes que » Acude a las ferias » Haz una lista de las de los compañeros de comprar mochila y escolares donde se ofrecen prendas que te hacen falta y may or tus hijos o con familiares lonchera, hazlo en pack, mayores descuentos. G",23
1067.9,620.67,61.14,30.14,74.99,e 2<7 nesta época del año viviá¿%%£f“¿a mos días muy calurosos; sin — 4 Lee bien la información er:1bargo no Ze _comp;(>fa(ran í( …¡ h — - que sale en esta página y en Asia y Africa E v9?“ ' responde las siguientes donde las temperaturas pueden '¡=;'3—¿??& : 9,24
1201.68,891.0,67.24,28.34,87.72,"llegar a más de los 50 “C, sí, así EL VALLE DE LA MUERTE, preguntas: como lo lees... incluso según la CALIFORNIA SUDÁFRICA INDIA 'Administración Nacional OceáEstá ubicado al sur oeste de Cali— Tiene una población de 30 mil perdemos de ser un lugar que destaca El primer lugar nica y Atmosférica' [Noaa) y la fornia, Estados Unidos, y es el lugar - sonas, aproximadamente. Según por sus atractivos turísticos, Jamás caluroso del Nasa, después de realizar varios con mayor temperitura en el mun— estudios realizados por 'El Dorada está catalogada como una de las mundo es: estudios, llegaron a la conclusión do. El 10 de Julio de 1913 ganó — do portal que registra los ciudades más calurosas del mundo, A. Localidad de que los cinco años más calurosos récord Guinness por tener la tem— climas más extremos del mundo, pues su temperitura es de 49 *C en Noona , han sido después del año 2010. peritura más alta en la historia: — — Traneen alcanza temperituras dia— verano. Ciudad de Alodi ¿Quieres saber cuáles son? Sigue 56.7 C, registro que actualmen— rias de hasta 53.3 *C. Eel valle de la muerte leyendo. te posee. Matarla ¿hora quiere de HermosilloYen) dscir:",24
2095.86,1206.43,136.43,33.0,72.96,Entrenarse [Méxicovalcanza (de A8eCenllatemporada esperando a que,24
2380.89,1318.89,66.11,27.22,88.83,E. Dormir por largo tiempo €. Olvidarse de algo,24
1188.81,1714.78,84.1,30.29,82.83,"Los planetas sen redondos - s 'yracias a la: Zen Asia y Africa se hallan la mayoría de ciudades con temperaturas más altas Gravedad Tasación escorpión LOCALIDAD DE Qmwom, INDIA 4 gruesa Se encuentra en el , EC A. África distrito de Chatarpu, EL Sudamérica posee 46 mil ochoCIUDAD DE PHALOOI, € Oceana cientos habitantes y CIUDAD DE OMIDIYEN, INDIA alcanza, en temporada INDIA El estado de Rajasthan acoge uno de los",24
233.25,1938.0,67.25,26.25,92.75,"de verano, la tempera",24
1344.95,1943.84,59.47,27.95,88.8,"Tiene un clima desértico con largas etapas — pueblos más pequeños de la India, Pintura de 48.6 “C.",24
1613.56,2000.41,62.33,27.13,88.59,"de verano donde la temperatura se puede — lodi, que también es conocida como la elevar hasta los 48.6 “C. Está ubicada en la — 'ciudad de sal' y alcanza diariamente una provincia de Khuzestan. temperatura de 48.2 “C.",24
1652.64,2258.16,67.58,30.92,84.8,"— OO ¡nf£1l_'ybv ¿Por qué son redondos íqr1íqm D 0 B ""W los planetas? Tienen esa y] ú forma gracias a la gravedad que atrae la materia esparcida por el universo en forma de polvo y gas. Toda esa materia comienza a juntarse en torno al centro de gravedad. Cuando",24
2175.75,2255.0,154.5,46.25,92.31,Escorpión de cola gruesa,24
2009.5,2363.0,63.36,28.5,90.11,"Es uno de los escorpiones más peligrosos. Su cola es gruesa, de ahí provee",24
1143.5,2434.08,75.17,24.92,90.35,Martha Hildebrandt señala que el académico 'Diccione su nombre. Posee un,24
527.75,2467.75,75.38,28.12,78.46,"nariz de Peruanismos' (2016) registra matar la hora,",24
1266.34,2526.55,74.94,26.74,92.21,"el planeta acumula veneno muy fuerte y su así como su variante matar hora, con el sentido de gran cantidad de masa, apariencia tiende a que “entretenerse esperando que llegue el momento la distribuye de forma en ocasiones parezca de oportuno para En realidad, estas expresiones simétrica del centro hacia plástico o samplemen",24
443.68,2638.84,73.0,26.68,92.0,"son variantes de la general 'matar las horas"". Ejemplo: Ambos se quedaron matando las horas antes de la ceremonia.",24
1556.0,2626.7,61.8,25.4,92.79,"los bordes, esto hace que un planeta sea una esfera.",24
2003.18,2635.18,60.82,25.91,88.42,te un juguete. Habita en África y se alimenta de insectos.,24
244.0,269.83,28.17,22.33,47.94,y Te N oe e P,25
342.83,342.67,72.0,17.83,49.44,"- yoon _ ,l'_,… '""'”¡“…?:""""""º'm”) C",25
514.56,574.69,33.44,24.19,54.39,"… , 1 señal DOMINGO A:EÑA, del de e a de la »e7l de AMÉRICA Tr",25
630.38,623.25,31.25,31.25,61.75,Por del los de AA Un en de,25
919.57,638.86,24.43,24.0,56.16,y i 09 que $e ho generoso,25
373.79,1858.71,132.42,31.44,78.35,"segundo round. Después deque l elabogadodeJefferson Harán N revelara que entrega 43 mil soles mensual es a Melissa Klugcomo pensióndesushijos, la de Chucuito'nose quedódebrazos cruzados exigealfutbolistaelpagode200 — $ millares por concepto de penalidades violarlacláusula de confidencialidad quedamos firmaronenel2016. Trometuvoacceso a la carta notarial que el lunes reenvió Melissa aJefferson, donde expone que tuvo dos in cumplimiento s dedichoacuerdo.",25
1245.72,2446.11,67.87,29.72,90.71,"43 mil soles mensuales para la manutención de sus dos hijos. “Tengo tres trabajos, pago mís impuestos a la Sunat. No soy expresó la conductora de 'Válgame; jactándose de sus logros. ¿Temesuna demanda de Med lissa Klug? Pero si yo no la he mencionado...",25
1268.25,2668.0,94.25,37.5,79.65,V_JmAñrma que no temer,25
1264.0,2706.0,100.25,45.75,81.82,ninguna demanda de Melissa,25
354.48,2650.56,74.28,27.84,87.48,"GE Mónica Cabremos aseguró que no teme una demanda de Melissa Klug porque nunca la calificó como una 'mujer mantenida, tras conocerse que recibe",25
1626.31,612.95,148.77,27.95,78.3,"adrede futbolista, 7 / lupe,entregó copia delaconciliaciónal VigésimoJuzgado de Familia Lima (para pedir régimen S devisitasasusnietos)yel — segundo por las declaraciones del abogado Enrique Pardo Figueroa al programa Domingoaldía, donderevelólos montos de dinero que recibe Melissa Klugpara sus niños. Endichodocumento, Melissaexigeel pagode200 mildólares,de locontrarioadviertequeinicia— / ráotraacciónlegal. , Á “Siendolosacuerdos de obliga s to rio cumplimiento y existiendo “xuna penalidades caso deincumplir“.. los,atravésdela presenteleagradeceréquesirvacomunicarleasu ¡< poder dante que se ha genera do %",25
1737.41,1264.44,127.75,27.81,77.56,"en mi valor una creencia de los coalesces pido sean abonados a mi cuenta bancaria dentro delas horasderecibidalacarta;en caso contrariodeberérecurrir alavíacorrespondien/ / notarial / Entanto, Evelyn Vela contóquesuamiga Melissa vive aterrada y preocupada por su",25
1688.63,1654.77,148.3,28.07,83.04,"seguridad. Además, señalóque hace unosdías unos extraños sujetos intentaron cerrarle paso mientrasconducía en sucamioneta. i “Elabogado hizo mal en decir los montos.Creo que alguien estáasesorando mal jefferson y noseestádando cuentame dañoquelehacealoschicos.",25
1746.0,1883.3,80.6,30.2,90.53,Hace unos días Melissa pasó susto de subida porque un,25
1690.0,1939.75,104.25,27.5,73.2,"Y autolacerró, pero reacio",25
1786.5,2075.5,139.0,29.0,75.75,"nódeinmediato y huyó. Estaba sola,nosabesifueca- sualidadolaestabansiguiendo”di- Jo Evelyn.(L.Gamarra) [<]",25
1716.44,2531.16,66.44,27.33,87.32,"¿Nuncale dijiste que era *mantenida”? ¿Acaso su nombre es mantenida? Que se sienta aludida... les su problema). Cabe indicar que ayer Mónica se enfrentó con Evelyn Vela en el programa 'Válgame' y agreg0: 'Me pueden decir de todo, menos que ejerzo el oficio de ser madre para que me tengan a mí y a mis hijos”. (D. Bautista)j_ e |O",25
2205.75,351.75,202.75,66.0,60.54,Hay mamás; Que reciben,25
2368.62,918.01,59.85,26.81,84.43,"G» La conductora de “América Espectáculos, Rebeca Escribens, a aconsejó a Melissa Klug RN de que invierta muy N bien la pensión de sus NC / hijos, que recibe de = ( / Jefferson Farfán. “Entiendo que por la cantidad de dinero que recibe, que ya quisie ran muchas mamás que no llegan ni a mil soles y - están en eternos juicios | tonel papá de sus hijos. Te deseo de todo coral zen 'Meli' que ese dinero K sea bien invertido en la * educación de tus hijos. Un buen colegio"", comentó ; en pantallas. o",25
2347.14,1376.71,65.93,33.43,73.91,>__ que invierta dinero en la ¿— — 'educación de sus hijos / —,25
2290.29,2369.6,73.15,27.96,91.86,"G> La cantante Amy Gutierrez se pronunció sobre la reunión que tuvo con el productor Sergio George y reveló que están en conversaciones para trabajar juntos. “Fue un encuentro casual, amical. No puedo adelantar nada porque no hay nada confirmado. Ambos tenemos la intención de trabajar juntos, porque me lo ha hecho saber, pero todo es progresivo. Vamos lento pero seguro”, mencionó la salsera. Asimismo, contó que atraviesa un buen momento en el aspecto personal y profesional, porque su videoclip “No sé' ya superó el millón de reproducciones en YouTube. o que hay mutuo interés",25
1044.88,151.38,110.88,28.38,93.24,26 (FIESTA) MIÉRCOLES 12 DE FEBRERO DEL 2020,26
1294.81,401.25,59.57,26.77,79.89,"A © María Victoria Santana, la , , Y: €$ “Carloncho' tomó = aclaró que no es , con humores — 2 la protagonista de un video comentarios de Rosán), sexual que viene circulan T gela Espinoza, quien le EA '.$ do en las redes sociales … Y - dijo que parecia interesado en reto» cons nombre. “Me aler— mar el romance. “Me imagino que",26
1457.77,518.62,62.15,24.46,86.87,"ataron de ese video, pero An . Y esunabroma, felicito su sentido del",26
1210.53,586.79,56.6,22.91,78.25,": r 0 uno soy yo. Mis Panfilovers' - , É » Y humor. Ha crecido un montón y ahoF:.!La Pánfilo N — contaron que se trata de p 1) y ra sorprende con una vena _descarta tener DS una famosa actriz porno. Ni me A ' N humorística de primera”,",26
1265.23,693.81,65.73,30.15,64.22,"¡V|deo ínt¡modqug S **Z,t _ . E ""E""?£'ºg""º“fº'de j redes “ *| N “En boca de todos. CJ[CU|,3.e_ e . - [F L Ó pez] o",26
1903.71,1097.29,139.75,33.5,79.53,"“Haremoslo que sabemos,apostamosporuna propuesta divertida, entretenida y con juegos. A eso le suma remos algo de lo que hacemos de lunesaviernes(en La banda del chiel conductor.",26
2396.89,871.69,72.49,27.52,88.68,"embalada para contarles los últimos chismes de Todo parece indicar que ANNIE y SOTA siguen en coqueteos, pues la parejita fue captada haciendo compras juntitos. Bien ahí... Cuentan que el 'Tío terrible”, alista las maletas para volver a Lima, pues anda en coqueteos con un canal de cable. Ayayayyy... protagonizó un apasionado beso, en 'Mujeres al con DARJELA, hermana del recordar",26
1905.97,1258.93,99.62,31.55,72.2,"' <;ÁÚ' f ñ Asuvez,ledeseó suerte suesposa, do cantante LEGARDA. - ;,4” 7 7 actriz Erika Villalobos,quien fue Puro marketing... La l K a presentada como investigadora actriz KATIA CONDOS",26
1904.21,1432.46,140.61,30.54,69.24,"NC del programada máscara,y manifestó que, desde » = COMpetiránenelhorario. ,-º'r21 “Nosécuálseráel horario del ; otro programa.Es probable ! que nos vayamos a cruzar, peroasieslatelevisión, tediosas cosasraras. Nos divertiremos pensando en lo que tiene que",26
1938.29,1912.14,102.66,28.09,84.09,"deseo suerte a Erika” precisó. UNAÑOMÁS 1 Además, la noche del lunesre+ gresóalaconducciónde'La , banda del chino; con vuelta - martín Arredondoylaincorporación de Junior Silva y Andreas Martín. “Es miterer año en América,elcanallíder, y voy 12 años en el mismo horario. Suna aventura que comencé de casualidad, pero ahora se ha convertido en mi trabajo y lo disfruto”,acotó.",26
411.49,1887.03,107.8,29.37,83.95,Ido Miyashiroconfirmó que desdeestesábado conducirá un programa especial y 'calentará' el horario Gisela Valcárcel hasta que regres econ Elar“El canal me ha dado encargo que esperaba y es hacer unos cuantos programarlos sábados hasta que lle,26
2414.57,2187.74,67.1,26.88,91.36,"hace 24 años, está loca de amor por su esposito, el periodista CO SALAZAR, con quien atraviesa su mejor momento junto a sus tres hijos. Bien ahí... ERAN MARCO agotó en 4 horas las entradas que puso en presenta para su show por sus 30 años, que ofrecerá en agosto en el Estadio Nacional con invitados internacionales. Buena... La 'Sabrosura' KAREN DELO volvió a la competencia en “Esto es guerra' después del accidente que tuvo y la llevó hasta la clínica. Fuerza... Bueno, soy fuga porque",26
672.84,2097.6,145.84,30.64,78.42,gueGisela.Me parecequeserán8pro“Labandadelchino” gramas en el horario dela persona Luego añadió quela propuesta semásimportantedela televisión pero para entretener divertir al púruana”comentó Aldo en el inicio de blico.,26
872.72,2398.62,71.4,31.92,80.12,"“Lamento la salida de mis amigos (Erick Eleva y Tatiana NAstengo], les deseo suerte”, : dijo la actriz. | FRASE GANADORA X DEL VERANO' ; De otrolado, invitó a los N 7 lectores a participar enla ZA promoción de Trome, 'La Fra",26
1979.23,2396.23,63.66,27.63,92.6,"Alexander. Mi personaje es la mamá de una de las protagonistas, pero no puedo adelantar mucho”, expresó la actriz, quien junto a sus hermanas Celine y Karine participó en la película",26
873.0,2539.33,83.83,26.83,92.79,Mónica Torres contó Marisol Aguirre con,26
1615.29,2560.71,107.71,44.86,64.62,"©firmó queparticipará — -* *. — “Lacosa,queseestre",26
