left,top,width,height,conf,text,page
2402.35,974.88,39.41,24.29,86.94,La menor sale de su taller del local policial Y camina or las calles de la zona.,1
2563.75,1066.5,45.62,43.0,45.12,£ +l lee t *— fa FIE %,1
290.78,1387.89,160.78,75.33,54.89,"P a »-%—%SARALA ESDROGADICTO, . DENUNCIAS POR ' a",1
2410.25,1546.0,30.75,27.25,81.25,El sujeto la sube a la e [F,1
2414.57,2157.29,55.0,23.0,81.0,"o estrangula a la menor hasta matarla,",1
2426.08,2772.75,69.33,25.33,87.08,adolescente hasta un descampado donde le prende fuego. Lo acompañaba una mujer.,1
223.75,144.5,57.75,41.5,66.75,2 — (AL DÍA),2
528.4,373.2,140.4,62.6,65.8,IPEILIEAN P©IR¿ UIN]A WIEIN]E(CA [[IIIID,2
516.71,1409.28,66.24,28.71,88.28,"| Chato Matta llegó al restaurante y se pidió una papa a la huan caf n a con su huevito duro y, de segundo, un arroz con pollo con presa grande. ”María, la semana pasada te estaba contando del encuentro entre el gran Pancholón y el famoso doctor Chotillo. La conversación se puso caliente y el gordito comenzó a cantar uno de sus temas preferidos de ”El Canario' junto a su inseparable amigo 'Onur' y los bravos de la Asociación de Abogados del Callao: amores que he tenido/ pasa el tiempo y d recordar son momentos que he vivido/ situaciones imposibles de olvidar/ Emociones que sen— tí/ porque siempre yo al amor le dije sí/ Mis amores, yo lo sé/ Son amores que jamás olvidaré/No me pregun— ten cuál ha sido mi error/ a todas ellas les entregué el corazón/ No me pregunten con quién fui más feliz/ No se los voy a decir, no se los puedo decir.... PANCHOLÓN: Chotillo, dices E A e pero las chicas me cantan: ”A mí me gustan mayores, esos que llaman señores.... Todas me dedican un tema, me disfrutan, se divierten conmigo. Lo tuyo y esa vene— nolana que te 'bobea' diciéndote 'papi”, es interés puro. como una transacción bancaria. Te ven como cajero, y multifuncional todavía. Tú eres ”sangre chinche”' para las mujeres, no tienes carisma, gracia, te ven como patán, fu— lero, malo con su boca. CHOTILLO: Siempre has vivido engañado, Crees que to— das se te regalan, No te conozco una decente, agarras pu— ras loquitas, tu viejo te hizo daño al mantenerte hasta los 45 años. Con tus dedos llenos de sortijas de oro, eres un gordito pintoresco, chistoso... Hace tiempo que no chapas ni la gripe, solo hacen hora contigo y bajan cuando no hay otra alternativa. Van por el buen trago que pones, te aluci— y de ahí llaman al 'duro'. Ya fuiste. Tu época dorada de la radio ya pasó, hasta el Mariano Cross de los Andes' está en cable y lo veo con mejor flaca que tu psicóloga, que es de ”taco 5' para abajo... PANCHOLÓN: Veo que me envidias, eres un trauma— dito. A tus más de 40 años no has conocido el amor, te besan, cierran los ojos y piensan en otro. Tu mayor mérito es tu tarjeta de crédito. En junio voy a estar en el Mundial rodeado de ucranianas, serbias, francesas y danesas, que van a probar este sabor peruano. Bajo diez kilos y fácil me jalan para es guerra'. Esos chabolas Guty, Hart, Porella son puro anabólico, todo mi cuerpito es natural; así como el chanchito, con su grasita, ahí está lo rico. CHOTILLO: Alucino que en Rusia te van a ver como el ”brujo de la selección”, no estás en el ranking... [ la : Ruega para que tu billetera siga gordita, porque cuando estés aguja no se te van a parar ni las moscas..”. Pucha, estuvo bravo el fuego cruzado. Esos dos son un par de sinvergúenzas. Me voy, cuídense.",2
1829.75,213.25,415.25,115.25,41.75,ei p ©5U©©5?© I,2
1356.25,502.38,120.75,39.25,73.5,¿USTED A/05 PROTEGERÍA DE ASESINOS Y VIOL ADORES?,2
1170.0,977.86,180.43,49.57,84.57,© HABLA TOME Critica a venezolanos malcriados,2
1265.33,1206.49,60.51,27.22,87.33,"©» 3 muchos venez o la nqs que gado al Perú por la grave crisis que se vive en su país. Eso se entiende, pero hay algunos que estando en nuestro territorio han insultado a la mujer peruana, sobre todo a la provinciana. Sería mejor que se vayan si van a portarse de esa forma.",2
1887.8,1014.2,66.6,44.2,83.2,; de élite para bancos',2
1923.91,1094.18,45.45,28.64,88.91,C<D Ante la ola de asaltos a bancos que se ha,2
1951.5,1131.62,58.75,25.12,91.62,"desatado en todo el país, se debería crear",2
1850.26,1237.67,62.03,27.56,83.38,": una seguridad de élite para estos locales. : Quiero decir que debe haber una escuela que : capacita a personal especializado en este tipo : de trabajo, Serían las propias entidades finan— : ciertas que invertiría en esto.",2
1252.19,1577.57,66.57,27.89,91.41,"Lo de los insultos a peruanas sucedió en Huanaco y un grupo de venezolanos que rechazaron el comportamiento de sus compatriotas, entregaron rosas a las mujeres de la zona. Señores, al lugar donde vayan, deben mostrar respeto.",2
1732.02,2335.19,64.36,26.55,60.83,"u Director — Contenido elaborado _ Fax: 31—6353. up s i t…x p ta i e o l Caros Mal —— E r | _| 10005105 reservados, — Olnay — Teléfono: 311—6500. — Publicidad: 708—9999, | Prohibida su reproducción total o parcial.",2
1944.27,1522.8,61.73,27.6,90.33,"Interesante la propuesta del lector, pues en menos de un mes, cinco bancos fueron asal—",2
1879.92,1613.19,56.42,27.46,87.08,"tados. Se anunció que la Policía Nacional volvería a : resguardar dichas entidades, pero lo cierto es que : se necesita de toda la ayuda posible.",2
1798.36,1797.64,85.27,22.18,86.27,"¡NO SEAS COJINOVA, ANDA METETE UN RATO AL AIRE PARA REFRESCARTE!",2
2434.8,443.33,55.33,27.73,74.23,"ee e d a E l ull s Siento que todos somos, en parte, culpables de este abominable cri— men. Cuántos más estarán libres y al acecho de nuevas víctimas...",2
2415.59,721.44,63.94,36.78,79.22,"FIDEL HIDALGO SOLIS Qué delantero que es el Pana' Telada. Totalmente aceptable al equipo que vaya, Empezó a pagar con molesto que Boys invirtió por él, y el Callao ya lo goza.",2
2410.69,1082.15,45.23,22.92,81.38,¿Está de acuerdo con la pena de i e d menores de edad?,2
2429.64,1223.64,49.45,27.55,89.91,¿Cree que es justa la protesta de los productores de papa?,2
2398.12,1871.62,75.21,24.71,80.62,u ei . Emergencias 105 Defensa Civil 115 Águilas Negras 3623277 Escuadrón Verde — 4276904 Luz del Sur 6175000 Semanal 3178000 Indecopi Enel Perú,2
2358.88,2129.88,59.12,18.88,57.75,"m MALO e ta LA PROMOCIÓN, LLAMENOS Al",2
2448.94,2311.94,49.29,24.35,77.18,Hecho el Depósito Legal en la Biblioteca e Los artículos firmados y/o de opinión d de susautores.,2
1690.0,152.25,102.12,27.62,83.25,DOMINGO 4 DE FEBRERO DEL 2018 fAVISO; 3,3
1782.71,368.14,154.71,49.86,88.29,créditos el crédito que te hace crecer,3
838.33,1821.0,221.5,111.83,65.0,— |— iDe vuelta a clases,3
936.19,2072.44,164.06,53.25,87.88,La Derrama te acompaña con el crédito que te impulsa a seguir creciendo ¡Ven y solicitalo!,3
883.08,2344.25,279.67,64.5,53.83,DOCENTE DOCENTE NOMBRADO CONTRATADO] Solicita tu ejército hesta por Solicitaltufcréditolhastalpor: S2501000 52351000,3
1415.24,2603.52,50.3,20.27,85.07,"(*) Todos los créditos se encuentran sujetos a evaluación crediticia, Costos del crédito según tipo de cliente: Ejemplo en Activo Nombrado Monto Otorgado S/ 1,000 / Plazo 12 cuotas / Cuota referencia S/ 99. 03 J TEA 24.6% / FLAT 6.21% / Fondo de s gravamen 0.028% del saldo / TEA 38.6%. TEA Minima: 22.4%, TEA Máxima: 29.8%. Ejemplo en Cesante Monto Otorgado S/ 1.000 / Plazo 12 cuotas / Cuota referencia S/ 98.6 / TEA 24.6% / FLAT 5.76% / Fondo de s gravamen 0.019% del saldo / TEA 37.5%. TEA Minima 22.4%, TEA Máxima 24.6%. Ejemplo en Contratado: Monto Otorgado S/ 1, lazo 9 colas / Cuota referencia S/ 131.2 / TEA 24.6% / FLAT 8.46% / Fondo de s gravamen 0.028% del saldo / TEA 50.4%.TEA Minima 24.6%, l a escribanos a| correo electrónico: creditosQderrama.org.pe.",3
1059.92,966.25,111.08,43.58,78.0,¿3 Identificaron su cadáver en Morgue de Chancay después de 8 meses,4
1044.19,1688.68,277.19,33.03,72.73,"lídolodel Sport Boys yotrosequi— posprofesionales, Darío'Chacal' He— rrera(58),murióahogado enunaplayadeBarran— cayochomesesdespués, deconstantebúsqueda desusfamiliares,recién pudoseridentificadople— n a mente en la Morgue Chancay El23demayodelañopa— sado,elcuerpodeunhom— bre vestido con polo,buzo Adidasnegroyzapatillas fuehalladoentrelaspe— ñasdelaplaya'ElColora— do frente a la imagen del CristoRedentor. Elcadávernopudoser identificado,puesnosele hallóningúndocumento deidentidad.Pasóeltiem— poydebidoaquenadiere— clamóelcuerpo,fueenvia— doaunafosacomún. Conlasmuestrasrecogi— dasdelcadáver. quefue— ronenviadasaunlabora— toriocriminalístico,eloc—",4
518.79,2211.5,101.43,40.21,88.93,<Su cuerpo fue hallado en una playa y agentes dicen que se habría suicidado,4
1142.33,2592.61,56.26,25.13,87.15,"Las Delicias, después de sufrir el accidente en el parque Quiño— A | nes a pocos ””| de sucasa. | Julio Acuña, padre 7 del menor, y vecinos de la zona recla— maron que el alcalde de Corrillos no ordena que se realice el mantenimiento de",4
304.46,2721.69,69.31,28.0,83.62,"GD Destrozados anímica— mente se encuentran s niño de ocho años de edad,",4
709.27,2726.27,81.82,28.91,87.91,"deportivo, donde jugaba, le cayó encima aplastándote la cabeza, en Chorrillos.",4
1428.0,875.75,264.75,32.0,74.25,cisofueidentificadoco— moDaríoAlbertoHerre— ra Martínez(58).Secono—,4
1915.02,1588.23,142.78,36.43,74.03,"cióquelapoliciadel sector, enaquellaépoca,archi— rioldeltrabajotvio'al] vóelcaso, yaquesehabría d tratado de una persona dote quesesuicidólanzándose _ | [casino alacantilado,perolospa— [VoliRimarachin rien te s del fallecidosolici— Cabanillas!(29) fuel taríanquesereabralain— —| m| o el vestigación. dineroldella) nizofelconteo'total ENTRENADOR (oficina de Seconocióqueantesde Gitilo) morirelexarquerohabía (f51ymgdocontrattszara irigirporsegundoaño con se cut ivo al equipo de deLaPerlitaenlaciudad Ratels deVegueta. man Enladécadadelos80, d áihacal;álerremfueun Ca|rga (e y estacadoarquero.Por sus buenas actua cion es Nanmu enelJuventudLaPalma GD Después de enve— deHuachoenlaCopaPe— cenar a los perros ubicada en la primera cua— rú,el Sport Boyslocon— guardianes y secuestrar dra de la avenida Pedro tratóydebutóprofesio— al vigilante y su familia, Ruiz Gallo. nalmente.Delamanodel — una banda de pistoleros ”Los ladrones dieron pollo entrenadorMarcosCal— asaltaron una empre— con veneno a los perros. El",4
1454.55,2140.0,277.27,31.36,72.55,"derón,elequipochala— cocampeonóenelaño 1984.Conlacamisetadel Unión Huaralobtuvoel títulodecampeónenel año1989.Elarquerotam— biéndefendiólacamise— tadelaselección perua— na.(EdgarCirilo)",4
1988.82,2141.08,68.49,25.41,90.97,"sa constructora, de donde se llevaron un cargador frontal, así como otras herramientas por un valor superior a los 350 mil soles, en Santa Clara. El atraco se produjo, la madrugada de ayer, en el almacén de una empresa",4
2406.76,2134.08,77.59,26.32,87.43,"guardián fue encajonado y junto a su familia estu— vo cuatro horas cautivo. Durante ese tiempo se lle— varon un cargador frontal, compresoras, máquinas de soldar, herramientas, un televisor y dinero”, señaló un agente. [E. Cirilo) [+]",4
2305.97,2594.54,63.41,26.67,88.09,"Cuatro avezados delincuentes toma— &D ron por asalto un bus de transporte público y le robaron dinero y sus perte— necias a una decena de pasajeros. Esto sucedió en el Rimac. 1 ”Los hampones subieron en el paradero !] Plaza Norte de la Panamericana Norte al bus de la empresa Sur Express, conduci— do por Guido Ganchi, pero al pasar por el — Puente Habido sacaron sus armas y bajo L amenazas de muerte les robaron a los",4
303.82,2827.18,53.55,26.09,90.45,quien murió luego que uno de los arcos de un campo,4
755.67,2823.33,48.83,26.58,91.5,El menor (8) murió en el trayecto al centro de salud de,4
1124.43,2819.86,63.57,28.29,68.0,"las instalaciones del parque, (E. Cirito) +",4
2316.88,2842.04,57.12,26.5,82.58,"t pasajeros. A uno le rompieron la cabeza y bajaron por el puente peatonal Castilla, en . el Rimac”, explicó un policía. [E. 0",4
1690.12,152.25,102.0,27.5,82.88,DOMINGO 4 DE FEBRERO DEL 2018 fAVISO; 5,5
281.89,1884.11,47.11,45.67,54.67,Q/ o/ G/g 0/ o/ / / IJ A,5
1658.6,2466.0,94.4,37.8,65.8,o J '> ” Temporada.,5
739.77,2845.23,52.46,50.38,38.15,a a n e na olo e ea un o v u g,5
926.0,149.4,99.1,32.8,75.2,6 _ f(ACTUALIDAD) _ DOMINGO 4 DE FEBRERO DEL 2018,6
1431.4,333.8,129.0,30.47,76.53,"MOANAD, 3 PREMIOS DE $/.500 DE LUNES a VIERNES 1 PREMIO DE TODOS Los DOMINGOS",6
589.25,509.0,132.25,30.75,75.75,SEL SEMANAL SALE HOY,6
847.38,571.38,199.38,96.62,71.25,5 mil soles pueden ir a tus bolsillos,6
831.9,714.4,130.9,38.6,82.2,"legó el domingo, el participa con nuestrapágina web(www. _ ANTENOTARIO",6
1001.81,904.02,106.69,32.45,75.57,"mejor día paracom— y trome.pe). Todasnuestraspromocio— ©[B partirlo en familia y fe Clue tú puedes De de la mañana a 6 de la — nescuentanconlegalidad, ventaten] onde tu suerte pue— _ convertirte en el tarde puedes anotar tu'nú— — transparenciayconformi— de cambiar, ya que pone— AA mero de la suerte' (apare— — dadquedaunnotariopúblico. fedia mos en tus manos los5Smil _ proximo ganador creen la parte superior la _ Noolvidesquealsorteoen— ¡* [Enfportadaencontrarás] soles del sema— portada), DNI y teléfono fi— — trantodoslosdiariosregis— nal' de la Súper llamada — ya a tus bolsillos, solo tie— — joy/ocelular, puesalas7de — tra dos desde el lunes 29 de | ¡Cachazady) Cardo n es que in s crib irte llaman— — la noche sale el nombre del — enerohastaeldomingo4de Para que este billetes va— — doal710—02600mediante — ganador. febrero. [+] boda?",6
2425.5,1159.5,77.25,27.25,68.5,la l actriz Stephanie Que y,6
314.5,1148.5,114.0,26.0,85.0,Y COMBATE LA DEPRESIÓN,6
373.88,1244.88,117.0,54.88,81.88,La sabrosa | lucuma te llena & Ag,6
489.55,1572.88,72.62,28.19,82.91,"E do de niacina (vitamina más conocidas es la B3) incrementa el proceso lucuma y en verano, gene— — de producción de energía ralmente, la consumimos (xe g ei 0 en jugos, helados, mar— ©Combate la depre— cianos, refrescos y otros. sión, pues evita tratamos Sin embargo, muy pocos A a conocen los beneficios Además, reduce el nivel de que aportan a nues— colesterol.",6
1129.5,1545.65,67.15,26.65,82.39,"€» ¿Angustiados por los gastos esco— lares? No se preocupen, e a ea promoción, 'El Billetrome', tendrás dinero calientito para comprar los útiles de tus a Participar es muy sencillo. Busca la cartilla del concur— so que saldrá publicada en la edición del lunes 19 de",6
1939.31,1410.96,70.79,28.32,86.68,"QQ¿? rás seis columnas y cada una E“_-¡ de ellas trae un premio. Para Ú ganarlo, deberás completar tl Si ya completaste una colum— na de tu cartilla, al toque ganaste el premio correspon— diente. Así de fácil. ”Que buena noticia, Una ayu— dita con los gastos escolares siempre es bienvenida, de hecho que participaré”, indicó el taxista Rubén Morales, del Cercado de Lima. ESTOS SON LOS PREMIOS",6
2390.6,1423.0,129.0,56.6,44.0,mm= |33hijos. tipi i ie,6
1197.27,1846.77,61.06,28.06,86.8,"tro organismo. Entre ©Es buena contra la febrero. Tienes que lle— ©1 premio de 10 mil soles ellos, tenemos los tr diabetes, ya que con— darla con los cupones ©7 premios de 5 mil soles siguientes: L<_; A, atribuye en regular la que aparecerán del mar— ©12 premios de mil soles a su .n' R” concentración de glu— tes 20 de febrero al lunes 5 ©50 premios de 500 soles alto conteni— — ( (Z de marzo. ©90 premios de 200 soles _¡,. En cada cartilla encontra— ©340 premios de 100 soles. G",6
627.5,2119.0,36.0,43.25,40.5,e rr y y,6
1528.62,2369.02,63.86,34.97,67.24,"H ? | H ¡ | 3 a Motorizados y ld a ie ¡, y ECnoteresm, ¡ % o Desarrollo de Saltones | Cateo ..— o — 1 | o ilustración de Modas y 1 e Ondulación — Lacerado — o —! La Municipalidad de Miraflores desea contratar los servicios para los ; NIVEL INICIAL [] e p ra ”l e … i = X M 1 A e Brevete BI—C vigente SECUNA…A_[] H H es (motorizado) con fecha de a — H e ee Exp. de la licencia un año. H",6
490.16,2638.86,53.76,21.24,81.59,"transparencia, más transparencia y t t a convocatoria CAS marzo 2018) certificado de uso laboral o Brevete All—A vigente (choferes) y con para jóvenes, expedido por a un año, así como record de conductor. ! * vigente.",6
1421.88,2643.25,121.88,41.25,64.38,p PROMOCIÓN ESPECIAL DE a [PUENTE PIEDRA:J5562626 1,6
368.57,2752.0,121.71,26.86,79.57,Las personas interesadas que deberán enviarlos documentos'al,6
464.67,2826.33,85.83,29.0,75.83,indicando el nombre de la ¡:[:éa|gg%1%qugp_ostula.,6
485.14,2851.43,58.57,26.43,68.57,|a fecha de postulación es de febrero!,6
1843.78,462.89,229.89,50.78,71.67,"€©H©Wg© r es cacasiel60%delaventa — más,estosdeberántener anualdeestosartefactos. — lamejoriatecnología.",7
1703.9,572.1,207.0,46.3,73.3,"Paz A mag [?é][ñ](:d:|©g secoloquenenelmerca— moSamsung,LG,Pana— domásdeun millón 200 sonic y otras preparan",7
1299.4,756.6,193.82,35.74,71.16,"televisores para ver N Segúneldirectorcomer— — estos meses previo sala ME]ORTECNOLOGÍA para facilitar la compra 2018arrancaenju— — lospartidosdelaselec— cialdelamarcaLGenel justamundialistaseven— — Elhinchaperuanocom— — deestosaparatos,cuyo noy lafiebrefutbo— — ción,queenprimerafase — Perú, MarianoRabanal, dan — prarátelevisoresdepan— — preciovaríadependien— lísticatraeconsigo — enfrentaráaDinamarca, — laparticipacióndelcom— — últimageneración. tallasgigantes,de40pul— — dodelascaracterísticas. el aumento en la venta de — FranciayAustralia. binadopatrioharáqueen — ”Esacantidadsignifi— gadasparaarriba. Ade— (TPL) [+]",7
1179.62,150.75,76.62,22.62,84.12,2 S DOMINGO 4 DE FEBRERO DEL 2018,8
321.71,2145.75,106.28,29.16,82.15,"araalgunoscrí— ticos, el fujimo— mismo sedespe— dazó. Kenji nue— congresistas más fueron de bancada naranja. Fuerza Popular, liderada por Keiko, perdió la mayoría absoluta. Por tal motivo, conversamos con congresista Ursula Le— tona, quien nos recibió la tranquilidad de su hogar, pe— ro, con el temperamento que lacaracteriza, va con todo. Congresista, ¿le faltó liderazgo a Keiko para manejar subancada? No,bancada siempre ha podido gozar y sentir ese liderazgo que ejerce Keiko, que en muchos casos se traslada a las decisiones que tomamos en bloque. Entonces, ¿por qué se quiebra el fujimomismo? Lo que hemos hecho en el interiordebancadaes ponderar la disciplina y la institucionalizado versus el cálculo político...es un quiebre porindisciplinas. ¿Qué pasainternamente? Estamos muy cohesionados. Estosirve para que el país entero sepa queen Fuerza Popular pretendemos más allá de un apellido concreto, ode una memoria decoro largo plazo, hacia la institucionalizado. Hay voces que dicen que Keiko",8
2307.64,1043.54,104.36,43.89,85.29,fuji mori sta dice que | no se puede defender o la gober n a bili dad del país debido a las graves acusaciones que caen sobre PAK y pide que asuma Martín Pizarra,8
811.38,2103.0,113.5,29.8,80.63,"por Pier Figaro y AnaVega. ¿Escierto? ¿*Los avengers”' (grupo de Kenji) fueron expuls a dos o ellos renunciaron? Tresdeellos han sido expulsados:el congresista Kenji Fujimori, congresista MaritzaGarcía y el F parlamentario Bienvenido Ramírez.Losotrossiete han tomado la decisión (de renunciar) por solidaridad. INDULTO ¿El indulto a Alberto Fujimori fue pactado entre Kenji y PPK? No losabemos, pero nosotros, por la alegríaque siente el pueblo fuji mori sta y, en general, todos los que somos de Fuerza Popular, queremos verdigre al ingeniero Fujimori. ¿Poresoustedapoyael indulto? Nosotros hemos venido peleando por el indulto... Lo que hemos dicho claramente es que disc rep amos en las formas. ¿QuépasasilaCorte Interamericana dice que es nulo? Hay que analizar el contenido de la resolución. ¿Porqué? Corte últimamente ha hecho políticacon el derecho, entonces es necesario analizar el contenido para",8
1442.8,2835.4,117.3,40.6,84.8,POR: OSCAR TORRES / FOTOS: ANDRES PAREDES YQK< poder expresarlo.,8
1275.5,151.75,80.75,27.5,76.25,: ”3 DOMINGO 4 DE FEBRERO DEL 2018,9
437.5,916.5,112.33,49.17,91.83,desde el presidente de la República”,9
313.49,1453.93,99.4,28.89,78.7,"Con la salida de Kenji y sus partidarios, ¿cuálvaa sería posición de Fuerza Popular anteal Gobierno? Nosotros vamos a manejarnosigual,como un partido oposición. Para eso nos eligieron y vamos a ayudar al Ejecutivo en todo lo que sea positivo para el país, pero también vamos a hacerel papel de críticos y fiscalizadores. ¿Apoyarán el nuevo pedido de Siempre y cuando esté vinculado con temas corrupción,en opinión personal sí. Todavía no hay una decisión de la bancada, pero lo hemos mencionado: Fuerza Popular apoya firmemente la lucha contra la corrupción'. ¿Meche Aráozleparece una d t a",9
302.21,2451.69,97.79,30.34,78.33,"No. DOS MILLONES ¿Por qué sostuvo que Obrecht había ofrecido a Keiko como dos millones de dólares? Nuncadijeeso. He sido bien clara. Yo estaba refiriendo a un ejemplo, a una especulación. Yo no tuve presencien campaña del 2011 y lo que hemos afirmado alo largo de todo este tiempo, en forma coherente y sustentada, es quenna recibimos dinero, ni siquiera una reunión de parte de ellos. ¿Cuál es la principal debilidad deteste Gobierno? Creo quees lacorrupción, que parte desde el presidente de la República, y la debilidad queéldemuestracon esta inacción. ¿Usted pone las manos al",9
818.21,1915.28,99.08,29.16,81.78,"fuego por Keiko y joaquin Yo confío plenamente en Keiko Fujimori.Vinea la política invitada por ella. Adoquín conozco muy poco, él sigue un proceso judicialize está en el Poder Judicial. ¿Cree que Alberto Fujimori apoya políticamente a Kenji porque Keiko ya ha perdido doselecciones? No, yo creo que el ingeniero Fujimori quiere portugal a sus hijos. Yo no veo que, desdee punto de vista político, estéapoyandoa Kenjiahora. Algunos analistas indican que Keiko es la gran perdedora de esta coyuntura y las encuestas lo confirman. ¿Qué opina? No. Yo siempre hedicho, las encuestas son fotos del momento y creo que una líder políticadebe demostrar claramente que la disciplina esun fundamento de su partido. presidencial parcel 20210 sigue siendo, como usted me confesó, un Yo creo que le falta mucho contenido, sobre todo. e e de va can cia al presidente d que apostaban porla gober n a bili dad. ¿Por qué buscaban ese escenario en el (T Porquecreemosque la gober n a bili dad se sustenta en la figura presidencial y el presidente de la república estáacusado de gravísimo temas, entonces, ¿cómoes posible tenergober n a bili dad",9
1313.18,1972.28,110.12,29.44,76.62,"con un presidente pegado con babas, ausente? Hay que aplicar loquence la Constitución:la plancha presidencial y Martín Pizarra tienen que asumir. El Perú requiere crecimiento y gober n a bili dad. ¿Nocree que PAK debe terminar su mandato? Lodijeantesdelas denuncias que han salido: la gober n a bili dad no puede significarimpunidad. ¿Leparecequeeste gabinete es realmente de la reconciliación? No. Creoquees un gabinete parch ado con un juego sillas evidente y, finalmente, es un gabinete cuya conformación demoró muchisimo, porque nadie quiere serministro. Barata ha asegurado que Susana Villaránrecibió 3 millones de dólares como contribución. ¿Qué piensas respecto? Esas la izquierda del doble EE 0 Alan García asegura que el audio de Obrecht no dice nada sobre él. ¿Cree lo mismo? No puedo afirmar que sea así. Preferiríaescucharlo. Julio Guzmánmedijo el pasado domingo: ”Los dinosaurios tradicionales) están agonizando. Estánestirando la pata”. ¿Quétiene quedecir? Quel forma parte delos dinosaurios. El ha sido viceministro de Humala, que creo quees su peorlastre. Gracias, congresista, y que por encima de todo siempre reine la honestidad para el progreso del Perú... Graciasati.",9
2186.5,162.0,94.25,24.5,59.75,7 ; (fENTREVISTA; 9,9
1932.6,300.2,132.8,40.8,90.0,POR SU RELACIÓN CON OBRECHT,9
1996.0,460.4,147.8,76.6,55.2,M SI LAS Al FUEGO,9
