left,top,width,height,conf,text,page
983.25,111.25,110.25,37.5,62.12,pr stann es |m facebook.com/tromepe _ y ©trome,1
827.12,169.12,263.0,126.0,57.62,» ——*. ¡sTE…NESC A¡GR AT …E …../E.$ .,1
1815.2,289.5,121.7,61.1,71.7,fr . / mero la RO » I l vmm$/o£o,1
2154.8,349.2,67.6,26.0,51.8,suerte a 710—0260 5 Pe,1
1113.4,661.6,368.8,79.0,59.6,RISOTTO SIENFIEN[CHMD© A35M©SDEW& ©msu …,1
2402.2,1742.8,99.6,85.6,61.2,: g_ CITOS; l¿… SJÁR|A,1
2335.0,1896.75,227.0,88.0,59.75,DISRUESTOTA L[ ANASUS CÓMPLICES,1
806.8,2527.8,103.6,31.8,55.0,&mm r —¿_” > 2 acuerdo 3 . ra |a,1
555.57,534.29,71.59,29.41,88.94,"| fotógrafo Gary llegó al restaurante por un pescadito a la horri llana con amorcito blanco, una rodaja de rocoso y, para la sed, un refresco de doliente con linaza tibiecito. ”María, no deja de sorprender los increíbles audios que desnudan la podredumbre del sistema judicial peruano. Pero algo que la universidad",2
535.09,1543.86,69.98,28.64,89.7,"que pensar en el Perú. Creo que si todos hiciéramos algo bueno por nuestra patria, esta sería desarrollada y no exis— diría la corrupción ni tantas desigualdades e injusticias, Sería un mejor lugar para vivir. Por eso, creo que es importante que los padres in cul que mos valores en nuestros hijos, desde pe— queñitos. Esa es tarea de los padres y no tanto de la escuela. Algunos principios que les podemos enseñar en casa: &Honestidad: Se debe enseñar a los chicos desde que son chiquitos. Ellos pueden mentir para encubrir una travesu— ra con el fin de no ser castigados. Siéntate a hablar con él, pregúntale por qué tiene ese comportamiento y dile que las mentiras, casi siempre, traen consecuencias negativas. ©Tolerancia: Debe aprender a escuchar y respetar los pensamientos y actitudes de otros, a pesar de no estar de acuerdo con ellos. Aprenderá que su opinión puede ser tan válida como la de cualquiera. Debe entender que es mejor dialogar que pelear. Con más tolerancia en el mundo no ha— fría tantas guerras ni tanto dolor. GRespeto: Tu hijo necesita comprender que todos, perso— nas mayores y otros niños, deben ser respetados. No debe alzar la voz ni contradecir a otros de forma grosera. Para que aprenda este valor, es impor— tante que definas sus obligaciones y no dejes que las pase por alto. Le servirá para cumplir con sus responsabilidades en la escuela y el hogar. GBordad: Enséñale a ponerse en el lugar del otro antes de juzgar. Que desarrolle el don de la empatía. Cada uno tiene sus razones para actuar de determinada manera. Un niño que ayuda al que lo necesita será un adulto excepcional. Que aprenda a ser educado y amable. Una sonrisa puede cambiar la forma de ver los problemas. To— dos tenemos días malos y podemos estar de pésimo humor, pero eso no es excusa para tratar mal a los demás. ©Carácter: Hay que ponerle límites a los chicos, deben aprender que no pueden hacer siempre lo que quieren. Solo así podrán madurar y convertirse en personas asertivas. El niño debe adaptarse a las buenas costumbres. Al principio puede que le sea difícil, pero si se crea el hábito, ya no tendrá problema. ©Autoestima: Para que tu hijo se acepte a sí mismo, tú debes hacerlo primero. Ellos aprenden con el ejemplo. Debe llegar a quererse y no aceptar ciertos comportamientos aje— nos. Nadie tiene el derecho de hacerle sentir inferior o de tratarlo mal”. Gary tiene razón. Me voy, cuídense.",2
1241.5,151.0,82.33,27.0,90.0,JUEVES 19 DE JULIO DEL 2018,2
1356.6,1561.5,67.0,28.5,86.9,"misma, quien debe ser desaforada. Héctor Maldonado P. : :",2
1310.03,1757.22,59.95,28.2,83.15,"Yesenin Ponce, quien es conocida por los pro— — : mejores y compañeros de aula Tantasmas”, es : acusada de presentar documentos falsos sobre sus estudios escolares. Su caso será debatido el mar— tes 24 por la Comisión de Etica.",2
1262.0,2307.89,85.89,36.22,68.0,X ne i | x Periodístico: Carlos Espinosa Olnay,2
1248.0,1182.33,105.5,40.0,67.67,n et Pide desacuerdo de Yesenin,2
1267.73,1399.06,63.94,27.31,90.25,"La Comisión de Etica del Congreso presentará el informe final de las inves— citaciones contra la congresista de Yesenin Ponce. Se sabe que su bancada la sancionar (o premiará) solo con 120 días de suspen— sión, por lo tanto, los que apoyen esa sanción se harán cómplices del delito cometido por la",2
1878.51,1425.56,58.44,27.98,83.76,"10 : todas las fibras de nuestro corazón. Por ello, : seguramente, nuestro buen josé María Argue— : das tanto lo amaba y un gran consejo le dio: : 'Sigue tocando tu charango. No cambies. La : belleza está en la autenticidad”. Gracias por tu",2
1790.4,1203.4,116.4,57.0,79.0,: Agradece a Jaime Guardia,2
1928.25,1294.0,75.42,28.17,88.92,Acaba de fallecer Jaime Guardia. Ese cha— manguito parecía hablar y traspasada,2
1710.0,1540.25,66.75,26.25,71.25,": linda música, maestro.",2
1909.5,1687.33,81.0,30.5,87.67,"Jaime Guardia, de Ayacucho, fue charanguis—",2
1904.17,1724.5,86.5,32.33,90.5,"ta, cantor, compositor e investigador musical.",2
1872.61,1785.22,56.39,29.0,80.5,: Su trayectoria artística superó holgadamente el : medio siglo y falleció el último lunes 16. Dejó un,2
1472.71,2191.43,170.86,34.0,85.43,MARTÍN PIZARRA (PRESIDENTE DE LA REPÚBLICA) —,2
1523.33,2330.5,57.42,19.08,73.75,"Contenido elaborado por Empresa Editora El E Piso 7. Limal, Teléfono: 311—6500.",2
1357.28,2062.72,78.11,32.83,90.94,"”La alianza entre el Estado y las inversiones privadas puede lograr el desarrollo, a través de la reactivación",2
2075.21,2288.0,42.36,21.29,83.36,Impreso en la Planta Dando de Empresa Editora El Comercio S.A. Jr. Paracas N.o,2
2416.65,366.85,55.3,29.35,75.35,"Creo que caería a pelo un rock de la cárcel”, interpretado por e d Noquera, desde ”Canadá' por Bl ERICK",2
2431.67,648.53,53.8,28.27,86.67,Tratemos a Héctor Becerro como si hubiese fallado el penal en la final del Mundial.,2
2416.44,1051.67,63.89,30.22,87.44,¿Cree que Héctor Becerro debe ser desaforado del Congreso?,2
2405.44,1216.33,70.33,26.78,85.67,¿Cree que Deberle Rodríguez debería renunciar al Poder Judicial?,2
2407.93,1746.89,94.0,28.19,77.67,]I 95% » TROME.PE) —— % — 8 EMERGENCIAS 116 Emergencias 105 ] Salud Águilas Negras Escuadrón Verde _ 4276904 Luz del Sur Semanal 3178000 Indecopi 2247800,2
2409.77,2323.62,50.85,24.08,77.15,Nacional del Perú N.o 2001—1992. Los artículos firmados y/o de opinión E f,2
477.29,2580.54,51.06,15.34,85.89,"ACORDE AL ART. 419 DE LA LOS LA EMPRESA ”SCHLEIEN S.A. EN LIQUIDACION”, CON RUC No 20100521220 APROBO EL BALANCE FINAL DE LIQUIDACION MEDIANTE JUNTA GENERAL DE ACCIONISTAS DE FECHA 09 DE JULIO DEL 2018:",2
319.88,2648.0,110.62,23.12,78.0,BALANCEFINAL DE LIQUIDACION AL 07.07.2018 (EXPRESADO EN SoLES),2
191.0,2749.0,74.75,15.0,41.0,TOTAL ACTIVO Z id,2
499.5,2852.0,78.0,14.5,67.33,d EDGARDO BERNARDO SCHLEIDEN JORDAN (ei,2
1153.75,2506.0,82.5,22.0,90.25,ORACIÓN SAN JUDAS TADEO,2
1589.17,2576.67,90.83,30.67,89.5,Gracias por el milagro concedido G.M.R,2
269.75,190.5,112.5,26.5,74.0,", EN PUENTE PIEDRA",4
367.77,1102.31,131.62,42.54,89.77,"Silenciosos del Norte' subían a vehículos para llevarse celulares, relojes, billeteras y carteras",4
312.23,2678.82,59.87,26.38,88.28,"Junior Michael Alvaro Niñez (25), Junior, estu— N* vo escondido en su casa A tras cometer varios asal— tos, pero al salir a la calle fue atrapado por policías de la comisaría de Urbaniza— ción Pachacámac, en Villa El",4
767.77,2800.54,59.08,26.62,88.77,pareja y se le halló una pistola con caceria abastecida y droga. Está,4
529.56,2880.44,67.44,25.22,91.56,Fue intervenido junto con su involucrado en el asalto,4
1141.5,772.29,62.07,25.36,81.0,Los detuvieron cuando estaban vehículo. En una mochila se les encontró seis E e,4
1060.78,1428.56,261.0,32.78,71.22,"os integrantes de la bandacriminal'Los SilenciososdelNor— ladróninternacional, fue— ron arrestados cuando se reunianenunparaderopa— raabordarunómnibus detransportepúblico",4
1103.11,1827.84,141.89,30.0,69.47,"suscelulares, billeteras ycarteras,enPuen— —9 tePiedra. | Antenas múltiples denunciasenva— riostramosdelaca— rreteraPanamerica— f naNorte,entreáncón % yLosOlivos,lapoli— — £ ciaemprendiólabús— quedadelosdelin—",4
1133.3,2673.84,61.0,26.0,85.51,"a la sanguchería 'El Carmivo— ro, ubicada en la cuadra 5 de la avenida Vargas Machuca, San juan de Miraflores. ”Apa— rece en el video cuando hace una señal a los clientes para que no hagan bulla mientras los amenaza con una pistola”,",4
1112.4,2841.6,57.2,29.6,79.2,dijo un policía. [M. Rocha—,4
1529.36,558.73,65.45,25.82,90.18,La policía había recibido varias denuncias de los atracos en buses.,4
1628.25,331.12,74.38,27.12,91.5,Cuatro delincuentes Puente Piedra para abordar asaltar a,4
1508.28,1309.17,172.55,33.72,64.38,"Minutosantesdelas8dela mañana, detectives de la Di— recciónde Inteligenciadela PNP [Dirin]ye!DepincriPuen— tePiedraseubicaronestraté— gica mente en el punto donde losladronesseibanareunir. INTERNACIONAL Trasconfirmarsupresencia en el lugar losagentesdetu— vieronaJairo Harold Cañonero García (31), Eddy GermánFernández Mendo— zal37), Anthony MoisésMi— EE E| yAn(];elAní",4
1137.43,1610.14,42.86,35.57,36.86,(e ee el ese es es m,4
1588.27,1855.64,102.45,34.91,55.73,"et Enlamochilaque portaban,lospo— d ei sl e réplicas pistolas <s, queusabanparaame—",4
1484.89,2102.89,111.44,34.44,72.56,"_ * lladelabanda,sesabe A— queestuvopresoenSao = Paulo, Brasil, tambiénpor",4
1427.75,2175.25,82.75,17.0,43.5,s >> — robarcelulares.Parano,4
1494.75,2301.88,97.12,38.38,53.0,__ _conunagorra. (Edgar AIRE BAÁONEROL31) el )] [+),4
1925.5,1759.75,95.5,22.75,66.5,DE ESCUELA DE E,4
1902.4,1898.8,171.4,61.2,85.0,Asaltan a profesores y alumnos,4
2442.5,665.67,47.0,24.83,70.83,un televisor 49 dastan d d,4
1980.38,1259.77,46.0,22.62,65.23,cual fennel distrito del ( l a captura detesta banda fue en la,4
2411.1,1879.01,62.52,27.12,88.07,"— Un minuto y segundos G$ les bastaron a tres delin— cuentes para asaltar una escuela de barbesos y robar al dueño, profesores y alumnos sus pertenencias, por más de 10 mil soles, en Los Olivos. A las 8:55 de la noche, los ladrones aprovecharon que la puerta estaba abierta para ingresar al local 'Mas— ter King Barber School”, de donde regresaron los bar— besos de los futbolistas, en la cuadra 27 de la avenida Bajo amenazas de muerte y golpes en la cabeza a quie— nes oponían resistencia, los despojaron de celulares, bille— teras y máquinas de corte. Las cámaras de video capta— ron los rostros de los rateros. (E. Girilo) [e]",4
2266.56,2529.07,75.65,27.12,87.12,"© Simulaba ser una pareja de enamora— dos, pero en realidad eran dos escurridizos ladrones. Beta Andrea Ramirez Canaleta [22) y Enrique Marceline Sánchez Casas (31) se llevaron enseres de una vivienda y, al ser des— cubiertos, fueron atrapados por seremos de Villa",4
2230.74,2739.21,72.24,27.5,89.21,"El Salvador y policías de la comisaría de Urbani— nación Pachacámac. Se desplazaba en el auto rojo de placa BOV— 015 cuando se les capturó, y se recuperó una computadora y un televisor de 40 pulgadas robados. [M.Rochabrum)",4
1410.82,2681.86,45.07,18.61,72.32,"del <I|en!e E manluvue!a sa do de de s gravamen E a, aplica ue ) caso td penal¡dad pantano v¡genle IT (0 005%) tarifas de la tarjeta de crédito en",5
770.38,2732.88,45.0,17.25,81.25,"lo hasta agotar stock, Stock mínimo 3 unidades",5
1195.03,2762.69,58.69,18.84,82.88,"ican sobre precio regular, Válido sólo para consumo familiar (máx 3 prodactos por cliente o tarjeta), No aplica para ventas al u Noaplxcaparaprod actos Ahora o Nunca. No accumulable con otras promociones.",5
1462.0,152.33,87.67,27.67,86.0,JUEVES 19 DE JULIO DEL 2018,5
1775.0,1029.29,133.71,70.59,83.65,ven a la UIQUIPASIÓN de R 1 P L B Y ¿ SOLO HOY Y MANANA >,5
1699.75,1789.75,135.5,67.25,66.25,% AD|CIONA c[% R|pley,5
1860.5,2102.5,195.25,78.5,66.25,scar CGD% 3© DUCTO,5
1565.0,2261.43,89.71,37.57,44.14,TBO o TODO corono o D &J,5
1204.5,2630.3,42.33,15.17,84.13,"ut 139.66%. Calculada en base a cuotas de 12 meses, a un año de 360 un consumo de 5/ 1000, pagará 12 cuotas de S/ 121.76 que mte!eses final ea",5
593.4,2690.8,38.2,16.2,71.2,po: envío Íís¡co de es(ado,5
1381.43,2728.21,42.43,17.71,77.36,ripley. o a ucto. Válido en todas las Tiendas Ripley a nivel nacional El,5
1241.33,150.67,82.5,27.33,90.5,JUEVES 19 DE JULIO DEL 2018,6
429.79,960.63,198.79,33.11,72.42,"rome,eldiarioque — información verazyen— semantieneco— tretenida,acompañada molíderencircu— — deespectacularespro— laciónenel Perú, mociones. tiene para sus lectores la — La'Súperllamadagana— combinación perfecta: dora'regaladinerocon—",6
261.57,1282.71,113.57,57.43,55.0,EN QUIOSCOS %EÍ(DI&JJJ e © la ee,6
287.18,1480.18,51.82,26.64,87.09,a la venta hoy y trae en portada al ”goleador pre—,6
1147.15,1338.79,66.45,27.02,88.68,"histórico' Sergio 'Checho' Ibarra, junto a su familia. También te damos a cono— cer las 7 señales que te indican que estás lista para enamorarte. Y no podían faltar los consejos para la crianza de los hijos, Con— suctoria Intimo, Horóscopo del Amor y mucho más. G",6
1047.86,2730.43,97.29,38.71,63.14,Para ganar ingresa'a: / registro ¿latarumba /,6
1600.4,362.0,46.2,13.0,87.2,No DE LA SUERTE: 3252597,6
1483.91,774.04,217.74,34.83,70.78,"tanteysonante. Delunesaviernesregala— mostre s premios de 500 soleada unoylosdo— mingos, sinexcepción, sa— leer Reventónsemanal' deSmil. Entraralossorteoses muy fácil, solodebesins— cribirtellamandoaltelé— fono710—02600median— tenuestrapágina web (wwwtrome.pe). De6delamañanaa6dela tarde puedes registrar tu",6
1997.2,270.1,95.4,27.2,64.0,SANADORES DE Los 3 Premios oe $/.500 mia 18/07/18 w,6
1649.12,332.62,74.38,13.62,81.12,NOMBRE: ALEXANDER QUISE DISTRITO: SAN JUAN DE LURIGANCHO,6
2308.67,335.83,45.17,17.67,32.83,a e e ee ee i,6
1939.18,404.41,58.59,14.29,86.65,"Inscripciones todos los días de 6:00 a.m. a 6:00 Sorteos: 7:00 p.m, Términos y condiciones en www.trome.po",6
2199.04,800.02,154.26,35.75,72.23,"¿<Participa en la unnotariopúblico,quien 'Súper llamada (fiael tradicional'escon— orme” ganadora', la PASANPORCAJA promoción Ayer.miércoles 18 los lec— A toresqueganaron500s0— favorita de todos — les cada uno fueron los los peruanos siguientes:Alexander Quispe(3282537,de San númerodelasuerte, DNI — juanne Lurigancho), Fe— yteléfonofijoocelular. like Angles(3631398, de San Borja)y RicharOr— cheseconocenlosnom— tega(3267782,del Cerca— bresdelosganadores, dode Lima). ¡Felicitacio— siempre en presencia de — nes! [+]",6
1580.43,1616.38,59.65,26.83,88.68,"La promoción 'Cha— pa la Grati de Trome”, que entrega mil premios en efectivo con uno de 10 mil soles calientitos, es un golazo de media cancha. El lunes 23 de este mes publicaremos la cartilla, así que no te la pierdas. Los cupones empiezan a salir el martes 24. Si llenas con tus cupones una columna de las seis",6
1559.83,2095.71,47.17,32.96,72.62,p a 10 82 premios ( i > Premios de mil prem¡_os l la sales 90 premios de 200 Soles f Premios de 100,6
1648.8,1156.0,107.2,24.0,84.0,HAY MIL PREMIOS EN EFECTIVO,6
1934.13,1524.13,67.43,27.3,81.74,ganas el premio que aparece en la parte superior. Los ganadores deben llamar a Aló u (9 DE contante y sonante. MÁS REGALOS,6
2293.02,1947.25,60.25,27.29,79.93,"ea e E e de los premios, no te ea e i el [ ee en el sorteo de 25 vales de consumo por 500 soles cada uno. Es decir, esta promoción no tiene pierde. Para participar, debes ano— tar tus datos personales en la parte posterior de tu cartilla y depositarlo en los lugares autorizados.",6
1458.5,2397.25,225.75,56.75,87.75,Este sábado sorteamos muebles,6
1572.19,2746.17,60.19,26.33,89.33,© a sorteo de la promoción de Tome que renovará los muebles de 5 familias. Cada una se llevará un juego de sala y otro de comedor. ¡Tienes plazo hasta hoy para depositar tus cartillas! El gran sorteo se realizará en el,6
2109.91,2438.0,54.77,30.13,79.98,"Pasaje Acusa 120, Cercado s ; de Lima, a las 4 de la tarde. bam;'5tho 3, y Si depositaste tus cartillas, cenar puedes ser uno de los gana— Centro y dores de esta fantástica nl, promoción, que da el mejor f regalo de Fiestas Patrias. _ 0 —/ 01 m, esa?f E 1",6
1063.94,977.35,69.82,34.41,77.35,"n ii $3,F nen p|dl0 que lo Callao a recluso de internen en un penal. El Minis—",8
1129.66,1301.82,68.76,27.19,89.45,"serio Público ha pedido 36 meses de prisión pre— ventila para Walter Ríos, tras acusarlo de ser parte de un organización crimi— nal dedicada a 'negociar' la designación y ratifica— ción de fiscales y jueces en el Consejo Nacional de la Magistratura [CNM), y fallos judiciales a cambio de dinero y favores. Le podrían imponer una pena de hasta 35 años de",8
1241.5,151.0,82.33,27.0,89.17,JUEVES 19 DE JULIO DEL 2018,8
1502.0,500.11,116.22,42.0,84.33,¿Mafia tiembla porque delataría a sus cómplices para evitar que le den 35 años de cárcel por ”verdecitos',8
1550.17,1355.76,67.67,27.07,88.7,"cárcel, por lo que se aco— sería a la colaboración eficaz, lo que implica— ría que delate a sus cómplices. El fiscal supremo Jesús Hernández Alarcon hizo tal solicitud ante el Juzgado de Investigación Prepara— torta de la Corte Suprema, que fijó para el viernes a",8
396.0,1640.0,116.0,23.75,89.25,AUDIO QUE LO COMPROMETE,8
660.2,1692.0,227.8,71.6,85.4,Exigen desacuerdo de Héctor Becerro,8
285.8,2049.95,73.48,28.03,88.95,"G» Congresistas de diver— sas zancadas exigieron el 'desafuero inmediato' de su colega Héctor Becerro (Fuerza Popular] por interce— der en el proceso de elección del presidente del Consejo Nacional de la Magistratura. Ello, debido a que el con— sejero del CNM, Segundo Balthazar Morales, confirmó que el parlamentario fuji— moriste le pidió votar por el ”candidato de su bancada'",8
693.04,2666.17,71.35,35.83,87.09,Insiste en sacar a ”El país deman— M ©) da el retiro y cese de los miembros del Consejo Nacional de la Magistratura,8
724.38,2821.62,78.0,37.12,78.12,'X[CNM]”. invocó el presi— N_>dente Martín Pizarra al,8
1150.72,1904.69,59.42,25.97,90.36,"en una reunión en la casa de Guido Aguila. ”Me di con la sorpresa de que era el congresista Becerril. Ahí, a nombre de su bancada, me pidió apoyar la candidatura de Julio Gutiérrez. Dije no”,",8
1560.74,1833.7,72.45,26.89,88.11,"clonal en contra de Becerro para que sea retirado del Parlamento, ”No son indi— cios, son pruebas objetivas de cargo que ameritan el desacuerdo inmediato”, sos— tuvo Marita García (no agrupada), mientras que Tony Descanso ([AP) dijo que ”no solo ha cometido falta ética, sino también delitos”.",8
1393.67,2158.1,62.47,24.8,66.23,relató Baltazar. ¡h El procurador anti— La agru— = > y corrupción Amado el 50 Eco denuncia— e ei por tráfico de ee s 11974 ie a ) [M.Beteta] ©,8
1119.35,2637.5,66.5,27.93,86.31,"Congreso, que mañana, G (A resolverá esta situación. El jefe de Estado reiteró su posición tras promul— gar la ley para que la SBS supervise cooperativas de ahorro. La actitud del primer mandatario fren— te al caso de los llamados ”audios de la vergúenza' ha sido bien recibida en diver— sos sectores. [MBL) o",8
1482.75,2500.0,124.5,45.5,75.75,APOYO ep por sobrino,8
1543.67,2668.33,74.0,32.33,77.17,”Se confirman los €9 ”negociados' a,8
2047.22,323.67,127.56,26.22,54.0,"; ', '._ E bT y : é|'35táOJASESOR:SiQacnal",8
2001.53,1213.81,80.08,27.24,89.63,"las 8:30 de la mañana la audien— cia donde se decidirá la situación de Ríos. tan los delitos de integrar una organización criminal, cohecho pasivo impropio, cohecho pasivo específi— co y tráfico de influencias. En este caso también fue comprendido el juez Miguel Atahualpa Montalvo. El fiscal ha considerado como 'elementos proba— torios' los audios de las conversaciones telefónicas",8
1915.8,2691.6,68.8,27.0,75.8,*..— — una conversación tele—,8
1795.1,2825.1,52.29,29.84,69.39,"afirmó el exprocu— ” tj IDL—Reporteros, donde t y y r o s e ee Amarra al refe— ... l CNM, Julio Gutié— irse al audio de X%' rrez Pebe, pide",8
2412.31,1171.18,65.28,26.63,89.21,"de Ríos con funciona— del Poder Judicial y del Consejo Nacional de la Magistratura. En un audio, él pide 10 verdecitos' al asesor de su corte, Gian— franco Paredes, a cambio de favorecer a un abogado como fiscal en Tacna. EE Ayer por la tarde, fue tras— lavado de los calabozos del Ministerio Público a la sede central del Poder Judicial, a bordo de un vehículo ofi— cial. Sin embargo, no pudo ingresar a este lugar por no tener autorización judicial, por lo que tuvo que regre— sar a la Fiscalía. [Miryam Beteta) [<",8
2312.75,2130.0,137.25,40.0,50.0,Arequipa? inmediata miembros'del Consejo,8
2423.25,2207.25,89.75,40.75,81.5,Nacional de Ia G],8
2439.0,2648.88,73.88,27.57,87.19,"al suspendido juez supremo César Hinostroza interce— der por su sobrino. AUDIO Gutiérrez: Oye, te pedí un favor muy pero muy especial, hermano. Ya, que lo llames al amigo... del Callao. Hinostroza: Ya. Gutiérrez: Reforzando a mi sobrino Carlos Valdivia. (MBL) [+]",8
294.6,477.2,95.33,28.4,82.0,MANCHA ©Héctor Becerril: 'No permitiré que manchen mi honra' Daniel Abu— atrás le responde: 'No,9
299.28,694.4,80.52,28.04,87.16,"pueden manchar lo que no tienes”. Plop... SOBRINO ©Resulta que Juan Car— los Valdivia, para quien su tío Julio Gutierrez le pidió a César Hinostro—",9
685.46,588.88,66.46,28.77,79.71,"i za un trefuerzo” según audio, es candidato : a alcalde de Bellavista i por Vamos Perú, el par— ? tido de Juan de Soto— i mayor. ¡Qué cosa...! i ALCALDE Piura allanaron i seis casas del alcalde i de Pacaipampa, juan : García Carhuapoma, a : quien el juez César Hi—",9
1462.33,152.33,87.33,27.67,89.67,JUEVES 19 DE JULIO DEL 2018,9
1096.78,596.13,71.65,30.26,79.26,"i destroza absolvió. ¡Si— i gan escarbando...! : TELEFONO i ©Nos pasan la voz de i que jueces, congresis— EE a : ahora tienen mucho ; cuidado cuando hablan i por teléfono, Es que al ; final, todo se sabe... : ENCUESTA i ©Según Ipsos, Ren—",9
708.8,1231.8,197.0,79.2,85.8,¿Se puede amar al fruto,9
645.14,1878.29,131.71,43.43,89.57,Un amor que no conoce de pecados,9
1543.04,596.37,61.48,28.56,78.75,": zo Resguardo se man— R i e i encuestas. Le siguen el i 'Mudito' Castaña y el : 'Hermanón”' Belmont... : FLORES : ©La Contrataría audita— ! ; rá los gastos del Con— —! ? preso en los últimos E : cuánto se pagó en flo— : res, frig o bares y televi—",9
2351.44,600.78,65.83,28.39,85.33,"i sores. Como debe ser... i COOPERATIVAS : ©Se promulgó la ley ——| : para chequear a las ? cooperativas. i García Belaunde, au— : tor del proyecto, dice i que empezó a luchar ? hace más de 10 años i y siempre se encontró : con fuertes presiones : de lobbies. Así es...",9
252.81,465.81,115.5,42.94,83.56,"dan más casos de clonación de tarjetas, ”cambiazo' en cajeros automáticos y falsos préstamos y e",10
297.62,1153.8,143.58,34.09,74.33,"a PolicíaNacio— nalalertóque prestas fechas incrementada clonacióndetarjetas y | E y estafas porlamodali— daddel'cambiazo' en e y cajeros automáticos, robo declarasen In— terneteinclusoalgu— nasantiguas,como el tumideoro' y la cascada” Porello,invocóalapo— ablación mantenerse alerta tomar medidas prevención cuando transmita por la calle, reci— be mensajespore—mail o retira dinero de unca—",10
503.78,2540.61,65.14,27.91,89.7,"”Keiko Fujimori gobierna el país, decide las cosas más importantes del Perú, es más fría y eso la hace más peligrosa”, expresó el periodista César Hildebrandt al referirse a los últimos sucesos políticos. Agregó que la hija de Alberto Fujimori ”echa a minis— tros, se tumba un ”A Keiko no le va mal, le va rebién. Las encuestas no le hacen cosquillas a la gente, a Keiko no le importa eso hoy, en absoluto”, agregó Hilde— brandt a Idelle Radio. Sobre Alberto Fujimori, dijo que ”no ha hecho cuestión de Estado con la expulsión y la humillación de Kenji, porque ha entendido, de forma resignada, que su hija Keiko es la que manda en Fuerza Popular”. Respecto a la 'reforma judicial”, indicó que ”como aho— ra estamos, la respuesta es que no se puede hacer nada. Con este Congreso y este Ejecutivo no se puede hacer nada significativo, caritativo y de fondo”.",10
1525.32,888.08,123.45,29.15,72.38,"130 En las últimas se— mansion más recu— frentes las estafas por clonacióndetarjetas, porque hay queest alertasalretirarefecti— vos falta dinero en la cuenta. ATENTOS ”Ladistracciónes uno delos factores con los que juegan los delin— cuentes. Hayqueest muy atentos”, precise coronel Papen retiro Carlos Remy Ramis, ex—",10
2148.17,293.83,138.67,48.5,82.5,Aplican modalidades del 'cintillo' y otras,10
1994.24,628.34,54.1,26.0,79.76,"t entregue su tarjeta | a nadie. Cubra el teclado al escribir la clave. F Ono pida ni reciba ayuda ! de desconocidos. En los cajeros, la ranura :",10
1997.58,791.68,47.89,26.42,76.63,E_ por donde ingresa la tar— : i. jeta debe estar firme y sin : ? signos de manipulación.,10
2377.71,848.0,139.43,29.29,78.29,pialainformacióndela banda magnética. ORegleta: Es un traba—,10
2007.17,870.5,47.83,25.17,90.67,"De lo contrario, no lo use.",10
2118.58,971.61,99.84,28.9,81.39,"Oes recomendable con— dor metálico que blo— tar con un seguro contra quela calidades dinero. robos. Si se produce un OCintillo: Lazoqueevi— movimiento extraño en ta que la tarjeta ingrese su cuenta, le avisarán. alcajero.",10
1964.44,1134.78,81.0,28.44,88.22,acepte ofrecimien— tos de préstamos ni premios por Internet.,10
