left,top,width,height,conf,text,page
1880.04,1358.62,109.25,33.27,60.65,"perten Seguridad de partesupe— F Bancos. cordel te— pA , Enelcasodelroboenca— .. cladopa— 19 jeroautomático, los fa— regrabar generosos aplican lassi— á 18 ' i ”1 l sientes modalidades: e w u OSkimmer: Disposi— — y * conocerla tivoelectrónicoclona— — —. l N clave(Tabath¿ dordetarjetas,queco— a E?kga%5m Paredes)",10
1127.96,1941.07,70.86,27.65,86.58,"(D El Consejo Nacional de la Magistratura [CNM) suspendió a Adolfo Castillo Meza como jefe de la Ofi— cita Nacional de Procesos Electorales [(ONPE) mientras duren las investigaciones en su contra, por presun— lamente haber favorecido al partido Podemos Perú, e Gálvez, en el proceso de sg e El 24 de julio se decidirá si procede su destitución. Aho— ra, este cargo sería asumido por el funcionario de mayor jerarquía, el gerente general )",10
1817.8,1594.4,111.2,25.0,89.6,INSCRIPCIÓN DE PARTIDO DE LUNA,10
1720.75,1657.75,188.25,70.0,51.0,$uspenden E jefe s,10
1542.62,2168.0,71.71,30.9,79.95,Javier Velasquez a a (Apra): )Nolbasta con la suspensión. hay que decla— rar nulos todos los actos perpetrados por dicho ei,10
1983.88,2171.0,59.15,28.27,76.0,Yehuda Simon Juntos por el Perú): ¡Tratan de desviar la indig— nación pública a los malos manejos. Empiezan a dela— E la a| e l E,10
1799.36,2620.82,189.09,35.82,64.27,© losinecnosTaltrag m | lEsvñiñmlbd& &1m=3 A Paz refugios de mmm,10
2412.67,2158.57,61.48,27.03,87.34,"€» Se recuperaron y fue— ron dados de alta los más de 600 escolares de 12 colegios de Cadete que se intoxicado tras consumir un desayuno del programa Sali Warma, que consistió en huevo duro, pan con sangre— cita y compota procesada. La Digest realizará pruebas a los 3 tipos de productos. ee e rio de Desarrollo e Inclusión Social, a través de la Fiscalía, confiscó todos los alimen— tos del lote distribuido por la empresa Man & Liu SRL, hasta determinar las causas de la intoxicación, y a través de la Procuraduría, presentó [+]",10
1343.3,695.21,64.2,28.45,75.48,"G$ Empezaron ”. ) — le cívico—escolar en el lapon €» Toda la alegría de rj, ”Tomamos un taxi e e y ___ < — Parque Central de (enlllimalinvitóla Ios haber ido a Rusia © afuera del aeropuerto ” — Chaclacayo y con para el Mundial se N y el conductor nos en— Escolares de cole— personas con disca— % (í£!©ll%€![ñ> les borró del rostro al dios de Santiago de paridad bajo el lema Arte a famoso hincha P robó el celular mi hi— Surco tuvieron des— Todos somos igua— tasa del 69' y a su botódelau— file, pascale y concurso les', en la avenida c¡al dicho pa¡s *;—e>¡ )a e ee a — toysellevónuestroequipa— ee ee | — al ser asaltados por E i e ei E Aérea Las Palmas. — sábado será el desfile Ten/ (© | — un falso taxista, en toenlacomisaríadeAlfonso Mañana habrá desfi— wT' general alímismo. G | E Ugarte.(M.Rochabrum) O",12
693.29,996.76,96.0,41.1,88.9,"Psiquiatra dice que, si la diferencia de edad es amplia, es más probable el fracaso por celos y falta de comunicación",12
283.23,1610.37,68.71,26.9,89.31,"o dice la ciencia. ”Está comprobado que mientras más grande sea la bre— cha generacional entre dos personas que inten— ten mantener una relación, existirán más conflic— tos de pareja, ya sea por celos, falta de comunica— ción y hasta por diferencia de costumbres”, aseguró la psiquiatra Vanessa Herre— ra, del Instituto Nacional de Salud Mental Honoris Delgado. ”Para el amor, la edad es importante. Mientras más años de diferencia exis— ta entre ambos, la relación tiene más riesgo de fraca— sar por muchos aspectos, pero principalmente por las distintas formas de ver la vida”, dijo a Trome. La especialista detalló que, al mar— 1 + 3",12
327.4,2354.4,219.8,62.4,90.4,Falsos colectivos violaban a pasajeras,12
293.95,2573.74,80.26,29.26,86.26,"C© Despreciables delin— cuentes que, bajo la modalidad del falso colectivo, asalta— EE para luego abusar sexualmente de ellas,",12
699.69,2508.92,71.62,30.54,85.46,"(29), Wilber Antena Tape (21), Javier Caucho Verga— ray (23) y Gerardo Tape",12
1152.55,2578.31,59.72,26.72,82.45,"Montes [25) cayeron en la avenida Tapa Amar y el e la una Station Wagon blan— ca y un Nissan azul, Se les incautó seis celula— res, una pistola,",12
694.0,2795.0,59.4,25.93,70.4,a | dos en Comas. E Alexander San— r' una réplica. tomaría Acero (E.Cirilo) [<),12
1933.61,1270.09,64.39,27.53,86.38,"la edad, es importante que cia de una figura paterna o TÍ1]P$ antes de enamorarse, una un hermano mayor. persona deba haber alcan— — Sin embargo, pidió tener ” lado la madurez. De esta mucho cuidado, pues los Al manera podrá amar con res— — menores suelen ser vulne— ponsabilidad, sin correr el hables y manipulables. ”Los amor no se busca. Te riesgo de lastimar a la otra menores de 18 años tienen encuentra solo. persona. poca capacidad de decir no, _ | ©Nocenfundas amor ATENTOS son más vulnehables y esto con amistad. No te resig— ”Si no hay respeto, confian— — puede ser usado por abusa— nes a estar con alguien za y madurez, el amor se dores para sus fines”, alertó solo para evitar la soledad. vuelve dañino. Hay que estar — [Tábatha Paredes) a | Sno busques un padre o muy atentos a los signos una madre que te resuel— que nos presentan nuestras va la vida, El amor se trata parejas. Si vemos que algo compart¡r y progresar no funciona, debemos desis— de a dos. tir de ese romance”, acotó. v)",12
1568.83,1741.43,66.0,26.3,91.27,"Sobre las mujeres que se enamoran de hombres mayores, Herrera preciso que, muchas veces, bus— aquel afecto y respaldo que les hizo falta en casa, ya sea por la ausen—",12
1576.5,1922.0,116.0,41.75,89.5,"que sin respeto, confianza",12
1527.67,2022.5,98.83,37.33,89.33,"y madurez, una relación es dañina",12
1842.5,2318.33,146.67,55.67,87.5,Acribillan a policía por su mochila,12
1759.64,2650.98,63.31,27.87,85.24,"(> Feroces pistoleros acri— — cruce con la Panamerica— pillaron cruelmente a na Norte, una camioneta Kia un policía cuando manejaba _ modelo Portage ploma, con su auto para arrebatar— lunas polarizadas, lo le una mochila, en San Martín de Porres. Dos sujetos baja— A las 4:10 de la tar— ron, lo acripillaron de de, el suboficial PNP seis balazos y cogie— Ramón Vidaurre Ban— e i E ces, al volante de su carro y huyeron rum— carro Ford color azul, de pla— — bo a Carabayllo. El policía fue ca ADX—270, se desplazaba trasladado al hospital 'Ser— por la avenida Trapiche. A gio Bernales”, pero falleció en pocos metros de llegar al quince minutos. (E. Cirilo) G",12
364.0,456.25,89.5,34.42,41.92,"a a o — y en _f%77¡4( %¡9>'*—“»í'w&““'?&.'“ E r — ea,",13
778.86,925.57,71.14,28.0,89.29,lista maletas. Más de 1.4 millones de,13
651.4,1064.2,80.64,31.96,83.48,"VÍSÍtB, turistas nacionales viajarán en el Perú para. por Fiestas Patrias, que pa— atractivos ra el sector público vendrá Ey con feriado largo (desde el",13
704.06,1253.67,84.39,32.0,84.72,"27 dejulio). Según el estudio deViajedurante el feriado de Fiestas Patria 2018' elabo— ;rado por el Mincetur, entre",13
932.78,1459.96,53.19,24.44,83.85,"ovin— 74 cial; el 16 % avión y el 13 % su vehículo. 3CUNENICA se preferirán rutas cortas, 3 X pues muchos ya invirtieron en su via—",13
1713.96,2779.86,34.25,15.03,76.37,"ea a e ss a es s es e s s ns dd oonespondo,2n [* | lo, 02 el jueves 05 de julio, 02 el viernes 06 de julio, 03 el sábado 07 de jullo, 03 el domingo 08 de Julio, 02 el lunes 09 de julio, 02 el martes 10 de julio y 02 el miércoles oda la cartilla con los cupones que se publicarán en el Tome y depositario",13
667.22,2834.63,46.97,15.04,75.81,"válidos. En total serán publicados 21 cupones distribuidos de la siguiente manera: 03 el martes 03 de julio, 02 el miércoles 04 de jul a a a ra ie ss en ea ea tendrán 90 días calendario para recoger sus premlos, después de ello no habrá lugar a reclomo. Fecha de sortes: Cañate, Huaral, Huarochirí, Huauro, Oyó y Youyos. No participan canallas n| menores de 18 años.”",13
1442.77,2829.54,46.94,13.86,78.02,"or, 1 oparador, 1 centro de mosa, 3 centro de entretenimiento y 1 juego de muebles 3,2, bonqueta. Para ser ac 04 cupones para el juego de muebles, 05 cupones para el centro de entretenimiento y 4 cupones para la familia. Los cupones publicados en el presente aviso, no son válidos para completar las cartillas, yo que únicamente tienen una finalidad ea e e a",13
1766.3,2869.22,48.17,13.65,83.22,"sábado 21 de julio en presencia de un notario público. : Promoción válida para los departamentos de Lima y sus provincias: Barranco, Cajota",13
1586.47,560.16,95.75,33.08,84.51,"las motivaciones es— tán: recreación, visita a familiares y amigos, compartir en familia, conocer atractivo s tu— místicos o nuevos luga— res, descansar y rela— ) Entre los principales 3 destinos a visitar figu— e Junín, Arequipa, Piura, Ancas y la Libertad. También Ayacucho, Lam— bayeque, seguido de Caja— marca y San Martín.",13
1479.25,861.0,91.0,37.0,80.0,"* — Enpromedio, destinarán",13
1565.78,1098.33,85.93,32.35,84.93,"% 128 dólares por persona ” (para transporte, alimen— tación, alojamiento y ac— actividades recreativas). Roger Valencia, ministro de Comercio Exterior y Tu— rismo, estimó que la movili— nación del turismo encestas fechas generará un impac— to económico de 181 millo— nes de dólares. [Isabel Me—",13
1303.2,1405.65,40.0,23.85,83.55,"— — a 67 % usará transporte interior je a Rusia. | 47 % viajará en familia, el 29 %",13
1558.67,1466.89,43.78,25.56,93.78,"con familiares y amigos, y el 12 % en",13
1883.33,2817.0,36.0,13.5,75.17,"de alguno de los promios, se",13
1935.2,988.2,92.8,57.0,70.2,BORDA Salón del 0 E,13
2399.88,1214.28,66.36,28.15,80.67,"e e r es el ©del Cacao y Chocolate en el Centro de Convenciones de Lima (San Borja). Tendrá cientos de productores, cho— colateros, investigadores, rueda de negocios, expoven— ta, concursos y más. Este sábado Perú enfren— ta a Bélgica en el reto 'master chef de los mejores bom— bones de chocolate fusión. Competirán Juan Carlos López [Perú) y Mario Vandeneede [Bélgica). _ V [I. Medina) [+]",13
2359.75,2799.0,51.88,13.25,85.5,en las ánforas autorizadas con sus datos completos.,13
979.12,150.75,94.5,28.62,86.5,14 (MUNDO) JUEVES 19 DE JULIO DEL 2018,14
1542.75,360.19,55.19,26.5,85.44,"e es vida a Brittany Finde 32), una montañista que cayó a un abismo de más",14
1482.73,658.59,53.73,25.16,87.97,"de 100 metros cuando escalaba el monte Saint Helens, en Wa— shington, Estados Unidos. El can fue tras ella, evitó que entrara en shock, le lamió las heridas y le dio calor mientras la encontra— ¿ ) ron las rescatistas. &”. 4 ”Corrió por la nieve de inme— > *© dato y una vez que llegó a mí, j comenzó a lamerme la cara y la sangre de mis manos. ¡Se que— dó a mi lado todo el tiempo!”,",14
2345.9,488.71,93.05,36.67,76.14,"— Gordita ig figura Cuando tenía 23 años, Kathleen Gol— ding (26), de e e Norte, pesaba 331 libras (150 RS",14
2357.6,735.2,56.2,27.4,91.0,le causó pro— lemas de,14
1864.76,964.33,60.63,29.78,77.53,"escribió Brittany en Facebook. , cirugía de bypass La montañista, ¿uien a na creadolun] gástrico y ahora casada horas después de la 3 id e caída, sufrió fractura de cade— : €oooosa$ | Esta %9Vo""¿ k y es fotógrafa y ra, costillas y parte de la columna Í! |",14
2475.25,1119.08,57.5,27.92,90.42,"gerente de ope— raciones, dice que ha mejora— do su salud y",14
1514.29,1132.24,73.62,29.52,86.1,"vertebral, así como una con— moción cerebral y laceraciones profundas. 'Indy', que es pastor alemán, se ha quedado junto a [",14
1167.44,1219.33,57.83,30.17,73.78,"y su mascota Indy le dio f ella en el hospital, mientras se 22 es E e .",14
1132.78,1398.11,105.89,49.11,83.67,AUTOMOTOR / © INSTITUTO DE EDUCACIÓN SUPERIOR PEDAGÓGICO PRIVADO,14
1353.75,1442.25,154.5,73.75,87.0,ESCUELA DE GERENCIA EDUCATIVA,14
990.83,1508.17,61.33,31.33,74.67,mo ESTEMOS DEJATE S. No 032—92—E,14
1285.8,1621.1,95.1,74.1,50.9,” pt o Sy| |ME y egg oo y (Qw,14
1782.5,1938.0,79.75,61.25,83.25,EXAMEN DE a y,14
2095.11,2113.33,180.89,40.33,89.56,Av Principal 956 Barquillo Telf.: 01 2678208 WEB: AUDIOLOGICA.PE,14
921.86,2481.43,212.71,52.86,67.29,&.M]UWÍ]W©©.<:0m Laptop Intel Atom x5—78350 144 Ghz,14
2038.57,2484.0,114.0,44.29,86.86,Optimus Zone 3 KGB /1.5 GB RAM,14
1302.07,2869.11,78.75,34.54,81.68,"DESPACHOS SOLO EN LIMA, AREQUIPA Y CHICLAYO. Stock mínimo 1 unidad por producto, Imágenes referenqales. Para ver el detalle y restricciones de todas nuestras promociones, ingresa a comiegales.",14
361.67,1397.17,32.17,30.67,48.67,"a ¡""j' A 3 l !",15
676.83,1529.0,131.74,43.74,82.0,lé&[&']©lí? E CARIRBI]M.© SE DE]O SEDUCIR POR 31 DINERO ÁRABE Y YA SE ENCUENTRA EN AUSTRIA PARA REALIZAR LA PRETEMPORADA CON EL AL—HILAL,15
417.94,1968.59,82.97,31.38,86.64,"dormís destacado de la selección perua— na en el Mundial de Rusia 2018 todo apun— taba a que esta era oportunidad de dar el salto a un gran club europeo o de mantenerseenlacom— positiva Liga Premier, pero finalmente las oferta s no llegaron ono convencieron a la 'Culebra”, que seguirá su carrera en el fútbol árabe. Según publicó ayer el diario portugués A Bola, el extremo'incaico' se encuentra ya en la localidad austriaca de Lienz, donde realiza su pretempora— da el Al—Hilal FC, y en las próximas horas pasará los respectivos exámenes médicos para seranuncia—",15
500.93,1702.5,110.21,36.79,72.64,isboa.— Todos los caminos conducen a Ara— bia. André Carrillo fue para muchos el juga—,15
1144.26,1771.81,82.51,33.38,85.43,"Carrillo llega al conjunto árabe a préstamo por un año desde el Benfica, a cambio de 4 millones de euros, y ganaría un sueldo de 2 millones de euros portada latemporada, Niel club portugués ni el saudíhanhecho toda— vía oficial la transferencia y el jugador tampoco se",15
1227.07,1927.07,99.0,32.64,71.0,"hapronunciado, aunque ayersubió a su cuenta de ¿3 ” Instagram en la que s eleve trot ando enalgúnbos— *",15
1134.15,2082.89,71.37,30.8,84.0,"que sin determinar el lugar. ¿Será en Lienz? Lo cierto es que allá lo espera el técnico lusoJorge Jesús, quien ya dirigió antes en el Sporting Lis— boa y lo pidió expresamente en esta nueva aven— tura. Paso atrás o no, Andréparece haber ya toma— do una decisión que solo eltiempo dirá si afectará alaselección.",15
2381.5,2499.5,93.25,71.75,66.5,Cf | oe¿nopasa 0,15
2394.0,2630.38,71.38,53.25,87.25,"Trans ermarkt, está casa o en 6 millones",15
2396.5,2702.5,93.83,57.0,64.17,"e euros, aunque onfsC% E%%rton 1",15
1241.33,150.83,82.5,27.17,90.0,JUEVES 19 DE JULIO DEL 2018,16
1723.47,1333.58,119.74,47.42,77.58,"CAMPEON r CON FRANCIA, SEÑALÓ QUE EL PARTIDO CON LA BLANQUIRROJA FUE UNO DE LOS M COMPLICAB.S i t",16
839.8,2304.0,119.4,34.8,57.2,"“o$o'xt—,=za..'- E > Al£2018",16
1750.04,1577.08,67.76,32.24,82.36,arís.— Seguimos dando qué hablar. La selec— ción peruana no logró en la Copa del Mun— do el objetivo deseado de pasar de la prime—,16
1688.69,1935.59,84.46,31.9,77.78,"raronda, pero su fútbol impresionó a la críti— ell se E Ios contr¡ncantes. como el francés Blai— se Matuidi, quien señaló en país que el escollos difícil superar en camino artículo mundial fue el equipo de Ricardo Gareca. ”Para PaulPogba, como partodos nosotros, el de— donante no ha sido el partido contra Argentina, co— parecen pensar. La verdadera prueba fue contra Perú”, aseguró el volante de la Juventus, en una entrevista con el diario 'Le Parisien'. El mediocampista campeón del mundo quedó tam— bién sorprendido con el ambiente creado porlahin— cada peruana. ”Ese día llegamos fue como si estu— viésemos en Lima, en América del Sur. Hasta ahora nuncahabía conocido.algo así. Visto desdeFraricia, sé que este partido et catalog ado como forma-1¿dad¿pem EE |do un de todos",16
1531.6,2617.0,59.0,32.2,89.2,Pans.- Más allá de las,16
2408.1,1676.05,134.9,36.7,75.4,"”Enmiopinión, Perurealmentenomerec¡aq clasificaciones, Apartir de do, nuestroentrenadorpudodec¡r míiequipo””, añadió, Noesunprem¡oconsue E una prueba de que algunas cosas se hicieron bi",16
2588.17,1963.17,92.0,46.83,64.5,quel' nr anst|ang %anald%en el e,16
2499.82,2445.64,92.64,23.73,84.0,VOLANTE PIDIO SALIR A 'MATAR' A MESS Y A LOS ARGENTINOS,16
2241.55,2619.18,60.0,27.64,87.27,Podía realizó una polem¡ca video que se filtró ayer en las,16
1897.27,2718.69,57.03,26.07,86.8,palabras de Blaise Matui— — arenga a sus compañeros. d| lo cierto es que el triunfo ”Hoy en la noche vamos a ”No nos vamos a ir a casa. ante Argentina en octavos matar a esos argentinos. No ie t a de final fue una gran inyec— me importa que sea Mess o dial. Quiero que todo el mundo,16
1937.86,2845.0,65.5,26.18,87.32,"ción anémica para Francia. cualquiera. Me los paso por muera como solados, como Los jugadores lo sabían y por las pelotas”, grita el volante guerreros”, añade en otra par— eso, antes del encuentro Paul del Manchester United en un te. Todo un líder. [+]",16
1618.71,159.14,62.0,25.43,78.71,9 DE JULIO DEL 2018 E A,17
1695.78,825.59,126.72,30.09,76.28,"repreguntas diario: ¿Continuará RicardoGareca? ¿Loestánconvenciendo para que renueve? Y si esasí, el principal responsable de esa gestión debaser Edwin Oviedo y allí surge otra interrogante: ¿Dónde encuentra el presidente de la Federación Peruana Fútbol? Semana pasadadejóel paísparaestar presenten la finale Rusia 2018. Disfrutódel triunfodeFranciaanteCroacia, pero se fue a su hotel ynosesubióaunaviónquelotraigade regreso a Lima, sinoquepartiórumbo aSuiza. Nadiesabeaciencia cierta su paradero, pero una cordel comitéconsultivo nadado una luzdeesperanza. Según FelipeCantuarias, expresidente de Juan Aurichmañanadará una conferencia de prensa. Obviamente se sabe queallíse tocará el tema de asentadas queentregóa un vocal S n En lentamente futbolístico, la renovación del Tigre' sigue en espera, no hay un plan porque confía en convencerlo que siga trabajando en nuestro país. Lo positivo esque Juan Carlos Obligas y AntonioGarcía Pyemantienen el contacto con el estratega argentino. Y el acuerdo es quercin finde mes estará surespuesta.",17
1725.04,1557.52,75.26,37.26,87.74,"DE UNA CARTA dirigida al residente de la FPS, los integrantes de la Com¡s¡or|1 Hcenaas, con Gonzalo de las asas a la cabeza, renunciaron a su cargo. ADP DE LA SEGUNDA DIVI_SI%% publicó un comunicado en el que piden a la FPS ser considerados como clubes Brofes¡onales y pertenecer a la Asamblea de E",17
700.5,1619.33,101.33,47.67,91.33,SE FUE A EUROPA Y MANANA,17
525.25,1836.0,140.5,25.0,77.75,JUGARÍA AMISTOSO CON ECUADOR,17
494.1,2669.99,68.06,26.76,89.59,"GD No hay técnico, pero sí La selección peruana, que todavía no tiene entrenador, jugaría un amistoso en octubre ante Ecuador, que ya anunció a Serán 'Bolillo' Gómez como su nuevo técnico. Hasta el momento, los únicos duelos confirmados son los que la Blanquirroja sostendrá contra Países Bajos, en Ámsterdam (6 de setiembre), y contra Alemania, en Sondheim (9 de setiembre). Los conejos con los norteños y otro frente a Chile se dispararían entre el 8 y el 16 de",17
1497.48,2746.29,67.27,27.13,88.69,"G» Veracruz.— En el Mundial nació el interés. £l club Al—Nassr de Arabia Saudita será el nuevo destino del defensa central Christian Ramos. El peruano, que juega en el Veracruz de México, fue observado por los árabes cuando defendió los colores de la Bicolor en Rusia. Según el diario Al—Riyadh, todo estaría arreglado entre los clubes, aunque falta definir el tema económico con el defensa, pero se da por descontado que acepte, ya que será muy superior a lo que percibe en el balompié ”charro'. Con esta nue— va camiseta que va a vestir, sumaría su cuarta experiencia a nivel internacional. Antes defendió a Gimnasia y Esgrima de La Plata y Emelec.",17
2357.07,1738.13,70.52,27.53,89.65,"DEL SAQUE somos car— necita... EL MUNDIAL NO SOLO SIRVE para entrar a ei el impulso a seguir crecien— do. Los futbolistas, después de jugar un torneo de esa dimensión, tienen que partir a mejores ligas, más com— petitivas. Porque todo el que pisó Rusia, emigrar en busca de un mejor nivel futbolero, sin poner como prioridad el billete. Como todo en la vida, llegarás a recibir lo que te mereces. El futbolista siempre va a ganar bien y los verdes lle— harán como consecuencia del juego que muestres. Las próximas Eliminatorias serán complicadas y si nuestros jugadores no se potencian, de nada valdrá haber juga— do en la tierra de Putin. Será solo una anécdota... ASÍ QUE UNA MAMACITA con pinta de modelo le dio su despedida el martes a un delantero La mucha— cha fue, le dio el besito respectivo, el cariño necesa— rio y parece que el hombre le prometió hasta lo que no debía, porque ella se asomó al balcón del departamento que se ubica entre Mira— flores y Barranco, sacó el celular y en una se tomó una foto, que publicó en redes sociales. Allí escribió que empezaba su nueva histo— ria con el dueño de casa. De repente le ha dicho para ser la firme'” Hummmmm.... UN PAR DE LOS CHABOLAS a los que 'Balán' entrenaba se fueron a probar a un club que solo trabaja con meno— res y tiene su sede en la Panamericana Sur. Llegaron, los vieron, aceptaron, y el jefe de la unidad técnica los llamó y empezó a maletera al que fue delantero de la 'U' y Boys. Les dijo que habían perdido su tiempo entrenan— do con el chalaco. Lo malo es que después se cruzaron y lo quiso abrazar, el zam— bo lo retó a pelear y arrugó todito. Qué feo... Me voy, soy fuga.",17
1241.17,150.5,82.67,27.5,89.67,JUEVES 19 DE JULIO DEL 2018,18
1118.09,745.17,66.74,26.98,86.62,"ir el Mundial entre litros de agua, dieta balanceada y tra— bajo consciente. Cuando sube a la balanza, Juan Manuel Vargas son— ríe satisfecho, pues las agujas cada vez marcan más abajo, aunque aún , superan los 80 kilos, Los trabajos que ha venido realizando el popular",18
1248.39,1158.35,63.16,28.8,83.85,"durante la para de Rusia 2018 han sur— 0 E tido efecto y el técnico chileno Nicolás a Cordova le expresó su satisfacción por Ú KZ¿(© en Pro o ! 3: e Trascendió que ahora está a menos de SICARIO kilo y medio para llegar a su peso ideal VIAJARA ma— y sus reacciones en el entrenamien— nana vía aérea to están perfectas, como la fuerza en rumbo a Jaula sus piernas y los reflejos. Pero la ali— a e tentación especial continuará, pues se trasladarán el objetivo está cerca, y aunque toda— a Huancayo. El vía no está cumplido, será tomado en sábado juga— 4 cuenta para el duelo del fin de semana ) E 1 ante Sport Huancayo, en la Incontras— 8 de la noche,",18
1183.57,1431.29,75.57,29.14,84.86,table” donde rendirá una difícil prueba local.,18
1076.4,1469.2,49.6,22.8,79.8,con su nuevo peso. a,18
2241.5,276.0,186.0,25.0,76.75,RAMIREZ REAPARECE ANTE COMERCIANTES,18
2370.37,573.22,67.72,27.11,88.01,"€9 El fútbol es así, Une alegría y trísteza. En Matute, el profesor Pablo Bengoechea se enteró de dos noticias enfrentadas: No podrá contar con Mario Velarde, quien ha sufrido una lesión a su pantorrilla derecha y estará fuera del compromiso ante y| Comerciantes Unidos. Pero como no todo es malo en la vida, ya está listo para reaparecer a Luis 'Cachito' Ramí— rez. Atrás quedó la rotura del quinto metatarsiano. Ni todo fue completa— mente malo ni totalmente bueno. G",18
2131.39,1358.67,67.44,28.61,88.35,"© tiene dudas. Luego del partido de práctica en el Rimac, entendió que la dupla es Emanuel Herrera y Horacio Calcaterra. El toque de uno y la profundidad del otro terminaron juntándo— se y marcando goles. El equipo titular golpeó con amplio dominio a los suplentes y el estratega no tuvo dudas que ante Melgar, serán titulares.",18
1106.0,1775.9,80.4,61.9,52.4,í] Q o k P MOVE gt QEI £' N3©©cauw,18
2245.79,1966.86,89.57,36.07,53.79,a %K“ÓUÍ (03 /W E; H&BLA FRANCO A Servicio de orientación y consejería o,18
2080.62,2724.75,113.88,36.0,79.25,mujer peruana y Búscala cada 15 días. l,18
1462.33,152.33,87.33,27.67,87.33,JUEVES 19 DE JULIO DEL 2018,19
464.38,1350.97,66.44,31.47,72.38,EL EVENTO P OFICIAL DE y 0 C__“x¿2':3 TALLAS ) %g 24 — GRANDES — ( ' a Aal LLEGA CON MÁS DE 60 MARCAS JUNTAS EN UN SOLO LUGAR en L a AXL,19
301.0,1523.17,61.17,14.0,90.33,"39 a más, accesorios, maquillaje, carteras)",19
589.77,1637.85,84.0,22.31,77.54,C.E. MELTON CARNAVAL ur (a 2 cdras. de Ia ESTACIÓN CANADA del METROPOLITANO),19
674.33,1727.83,81.83,31.17,77.33,10 a pm — Ingreso Libre!,19
533.92,1862.75,76.17,22.5,89.83,"Asesoría de imagen, pasarela, show en vivo, sorteo durante todo el día.",19
469.72,1960.44,73.89,18.72,86.44,"Síguenos en Fb / Instagram ©plussizefashionshowroom NOTA, las personas que lleven el anuncio ingresan a un sorteo especial.",19
589.29,2370.29,128.43,33.71,74.71,2 TERAPIAS HEIL DOLOR CON CELULAS MADRE,19
502.43,2482.57,131.14,31.29,76.43,y LUMBALGIA (CINTURA) y NEURALGIA AL TRIGEMINI,19
517.75,2657.06,150.0,31.31,77.56,/ TÚNEL CARPIANO / TENDINITIS DOLOR DE ARTICULACIONES ¡EVITE MEDICAMENTOS O CIRUGIAS! Citas: T. 261—8724 996590243,19
242.17,2798.83,77.5,22.5,83.83,Dr. Ricardo Duran CMP; 25877 RNE:15012,19
1454.55,1571.42,98.06,29.52,83.0,"p l sy Cirujano — Urólogo CM 12339 — RE 10151 © CÁNCER DE PRÓSTATA Y GENITALES Prevención, detección y tratamiento o INCONTINENCIA URINARIA y/ o FALTA DE DESEO SEXUAL o EYACULACIÓN PRECOZ",19
1254.4,1765.4,127.4,39.4,76.2,g S%RWIaFCOS o IMPOTENCIA SEXUAL,19
