left,top,width,height,conf,text,page
1236.3,935.58,77.61,31.0,79.11,", — E rnest_dHemángwaydes| O rases ):3A dos días de E… considerado uno de los A > |a cumplirse 119 años || u;, información, a i i e de su nacimiento, que sale en esta lo certifican los nume— — r|osos recon¡oc¡mientos recordamos las s¡guien,tes preguntas: que obtuvo tales como el Premio F A Pulitzer (1953) por su famosa novela mejores CIFaá_del . Emes ”El viejo y el mar' o el Premio Nobel d escritor egoista de Literatura (1954) por su obra e ) Y P H mu'l'""ió E k>as.y completa. Fue autor de ”Por quién estadounidense .|| A. 62 años doblan las campanas”, 'Adiós a las l B. 50 años. armás' y 'Fiesta”, entre otras gran— €.90 años. des obras. Estas son algunas de sus y | Inexorable se emplea para calificar a lo: necesitan dos años A, Intratable. para aprender a hablar y Inevitable o sesenta para aprender a irrevocable.",24
1730.6,2065.0,67.4,29.6,84.6,mañanas' es mi máquina de,24
1337.29,2176.29,53.02,28.2,79.54,"7 op ;** ” ” rí——) y K% … © Nació el 21 de julio de 1899:A los 62 años, en 1961, el Alzheimer y la depre— sión, lo llevaron a tomar la decisión de quitarse la vida de un disparo.",24
1530.26,2431.32,66.34,26.26,89.68,"¿Por qué las personas tienen miedo a volar? La acrofobia es una de las fobias más comunes entre la población. Cuando las puertas del avión se cierran y se está dentro, estancados, la gente entiende que no puede",24
2120.67,2524.67,56.13,26.87,85.0,"Se distribuye por la isla de Nueva Gui— nea, Mide unos 30 centímetros — —",24
2440.8,1390.0,23.2,30.0,35.4,(ei i pl e 0,24
1657.78,1742.46,66.13,29.78,67.75,". Es el miedo a volar en y , | n! avión: E 'El hombrgñ0;está A, Cinofobia. ee _hecho 2. Aviofobia. E €. Monofobia. gente alegre” ser destruido, pero no Pon derrotado” macho s 2 uel ave del paraíso azul …5? 1 e es la hembra: e ” Á""€h d de las noches, no E es sirve de nada en las % C¡%Íff,'¿o'",24
531.92,2689.03,64.21,25.36,87.17,"Este adjetivo se emplea para calificar a lo inevitable o irrevocable. ”Teniendo en cuenta los antecedentes del equipo, se sabía que el fracaso en el torneo era inexora— ble”, Suele decirse que el paso del tiempo es inexorable. = > Esto se debe a que no hay forma de impedir que trans— 3 curra: por más que una persona desee eternizar un momento. La muerte también es inexorable. Todos en algún momento, moriremos: nadie es inmortal.",24
2087.13,2676.37,55.26,27.37,83.47,"y el macho es algo más grande y atractivo que la hembra. . Esta especie fue descu— E.X abierta por Carl Hunstein, — Va, en 1884, y debido al alto A precio de sus plumas, está clasi— a",24
1543.52,2631.0,56.39,26.61,78.96,"N|alir, eso es lo que más asusta a la mayoría. El miedo a las [ ei i o o a no entender cómo",24
1621.67,2758.89,66.0,27.78,90.44,"funciona el vuelo, también hace que surja el temor.",24
2334.63,644.15,62.39,26.35,85.87,"Melissa Paredes afirmó que extrañará a Estrella' y que es el inicio de su carre— ”Terminar la novela me dio pena. Cuando escuché la .% canción 'Ojitos hechiceros', 2' — me acordé de cuando recién empecé y me moría de miedo. Voy a extrañar mucho a",25
1654.55,947.09,91.91,42.27,57.23,o I Enkalvinalopos a o pasa mú E a_ho|ra ee Ejeat¡ro j ne a i o y ] musical para niños en,25
2317.12,1169.6,70.84,27.58,84.09,"| Tuesposo, el 'Gato'Cuba, y á teacompañóaver el 2 último capítulo... El está feliz por mis logros. Ade— más ha soportado las llegadas tarde, me ha dado la mano muchisimo con Mía (su hija). Es importante tener un esposo que te apo— [<",25
813.88,1438.55,67.8,25.78,88.03,"a protagonista de 'Mi Esperanza”, la actriz Erika Villalobos, se emocionó hasta las lágrimas al ver el primer capítulo de la novela, donde interpreta a 'Elsa' y cuya producción alcanzó 33 puntos de rating en su estreno. ”Me siento muy emocionada, porque A es un capítulo donde pasan tantas ma €3 cosas. El personaje me emociona, por— T* que me imagino qué me pasaría si me toca vivir cosas así. Anteriormen— te he tenido personajes fuertes, pero en este caso, 'Elsa' es una mamá que pasa por situaciones muy difíciles. Ha sido complicado contener la emo— ción durante las grabaciones”, sostuvo",25
1484.75,1227.5,117.0,27.5,62.0,"MIERCOLES ESPERANZA” , a",25
2257.75,1368.5,141.5,40.0,34.0,a e ii o,25
1617.67,1612.67,59.05,26.35,83.83,"etc muy cotidiano. 3 En tanto, la productora Michelle Alexander comentó estar contenta con el exitoso debut de Mi Esperanza”. ”Me han dicho que los números han estado bien, que ”Mi ha estado estu— penda, lo cual nos hace feliz y nos impulsa , a seguir trabajando. Es importante el rating, ¡ 7 pero ya no lo veo todos los días. Antes era una — [",25
1361.29,1798.8,75.26,29.57,85.4,"Villalobos. — loca del rating, pero ahora les digo a los chi— Hanempezado con el pie / cos [actores) que es anecdótico. Estar entre derecho, porque han liderado _ los primeros lugares es importante”, indicó",25
1205.86,2007.89,67.69,29.24,83.94,"enrating... —— Alexander, quien dejó abierta la posibilidad Me siento feliz de que este esfuerzo fue Í3| de realizar la segunda temporada de 'Ojitos rinda sus frutos, pero no quiero saber V U hechiceros', £ nada del rating, me ponen nerviosa ”La historia ha terminado, tiene un fin, pero —/ o,(*, las cifras. Solo espero que le guste a la gen— — hemos dejado abiertas algunas minihis— r torias, lo que podría dar un indicio a una F ¿Consideras que hay muchas — posible segunda parte. 'Ojitos hechice— ” en la sociedad en que — ros' es una novela tan querida, que",25
2165.6,2151.0,53.2,30.8,90.0,de mis bodas 2' con,25
1557.77,2267.29,54.76,27.96,77.17,"r ya es como una marca. Sí existe . a> > , 32 _ Sí Hay muchas ”Elsas' que se — una posibilidad de hacer una Laura Zapata — > levantan temprano, que — segunda temporada”, ©) Marcarme Marín está más que 8 — acotó. [L. Gama— entusiasmada con el inicio del roda— ” K '; y “¿' planchan y — real y je de la película 'La peor de mis bodas 2' y A ©——a grabó sus primeras escenas con la desta—",25
2275.54,2442.67,65.96,27.08,89.54,"cada actriz mexicana Laura Zapata, quien interpreta a su suegra en la cinta dirigi— da por Adolfo Aguilar, que se estrenará el próximo año.",25
1399.81,2487.48,58.52,29.56,87.89,"€) La actriz Cielo Torres, quien dad, al inicio del rodaje no pensé que interpretó a 'Sabrina' en 'Ojitos me iba a dar tantas alegrías, ha llega—",25
1564.34,2656.98,73.46,28.05,85.77,"£/ hechiceros', dijo que su personaje la do a muchas personas y me acercó a la ”Estoy feliz, es todo un reto para mí. e e BZ 7 acercó al público. La vida me está regalando uno de los m Parece que habrán segunda _ Hassidounagratarevelación. momentos más mágicos e importan— y 7 y parte y tendrás turevancha. He podido llegar al público de una tes dentro de mi trayectoria como actriz. alegras Sí, he dicho ”voy a regresar y liquidar manera increíble y estamos totalmente Actuar con Laura Zapata es remontarme a la doméstica' [risas%. pero no sabe— agradecidos. a mi querido Palo y ver emocionada sus Í)Z( Cielo Torres afirma mos qué pasará más adelante. Yo feliz De otro lado, contó que parti— novelas”, dijo la 'Dulce Princesita”,",25
1155.22,2805.33,58.94,28.11,87.56,que su personaje la de recibir a 'Sabrina' con los brazos citará en el circo de la 'Chola,25
1712.25,2826.06,67.06,27.19,82.38,quien divide su tiempo entre las gra— abiertos cuando quiera venir. De ver— Chabucal' (M.C) [+],25
2253.83,2843.83,55.33,26.0,80.5,naciones y el programa Yo G,25
1227.8,150.4,123.8,30.4,86.8,JUEVES 19 DE JULJO—QEL 2018,26
1590.0,354.0,42.25,33.0,78.25,¡voy a bajar a,26
1630.62,312.62,71.75,26.12,83.75,"calificó de 'disforza— me suman ni agradan”, pre—",26
1369.51,478.84,60.28,28.14,76.5,"dal' y aseguró que la ) & casó Effio. A F , actriz tuvo una pre— l $ i el e e e i algúntipoderoce $[© la primera gala de | anteriormente? ”El artista del año”. '4/ £ raciones, pero me — No. Más allá de serrado Ro$á“ ela ”Me conocen y .Í y de ”Esto es guerra', don— , A g saben cuál es la de mí porque me de di mi opinión y veredicto",26
1550.83,610.42,62.33,26.0,85.92,"línea que manejo. Lo 4 hace sentir bien. imparcial, Nunca he teni—",26
1388.34,689.05,60.8,26.56,88.59,"”Me dan risa sus único que le podría do ningún enfrentamiento declaraclones”, desear son bendi— de 40 años, así en mis 28 años de carre— expresó Marcelo Effio, clones y que le vaya > que está de ra y mucho menos",26
1931.33,760.0,36.5,25.0,92.83,lo voy a tener con la,26
1236.29,772.14,59.86,30.71,79.0,luego que la modelo señorita. [L. G.),26
733.25,794.25,70.0,25.75,89.75,1 Rosángela Espinosa la,26
1140.0,778.29,53.43,27.71,65.14,e e e contestar nada. Me dan,26
343.6,1379.19,73.29,29.29,84.14,"La actriz Fiorello Flo— rez está nerviosa, pues en octubre se casará con su e d e a ”Queremos que sea algo muy íntimo porque será un día muy importante en nuestras vidas”, refirió Florez, durante la inauguración de 'Zazá”, pri— — ( mer 'Med&Center' del país. ¿Hayplanes de encargarunbebétras laboda? Sí, para el próximo año. Mi hija ya tiene 7 años, quisie—",26
931.24,1715.0,119.14,28.1,86.05,"ra que sea hombrec¡to nomas aparejado Michelle esunidiota, aside senc1llo. (L. Gamarra) Soifer, Kevin Blow, Esunidiotaqueya no arremetiócontra encuentra argumentos para",26
404.2,1774.0,67.4,26.8,79.2,¿<En octubre se casa con,26
560.0,1803.6,113.6,38.0,73.4,isu novio Kurt Tomasevich se supone que,26
1437.4,1857.9,106.9,33.6,74.2,"yo era el pero si me roban, ¿porquétieneque opinar? ¿Porquéloponeen",26
981.27,1861.18,130.36,34.18,60.73,rickSabater. quien señaló quees 'sospechoso” que el dominican o haya tenido en su poder la suma,26
1109.85,2115.92,116.98,31.69,72.52,"defoil soleseldíadel duda? Tengo cinco puntos yo hubiera querido asaltoquesufrió. (decicatriz)en la generarcontenido, Erickpusoentela cabeza, no creoque hubiera dicho de juicio el robo que E a daño, como dice robaron Erick,en KarenSchwarz, plata,perono asola para hacer puedo mentir (,> El actor Diego Boneta, intérpre— palabra, contenido. 51 Te en te de 'Luis Miguel en la serie que ¿Tambiénte",26
804.2,2283.4,89.0,30.5,90.6,"transmite Netflix, llegará a Perú para un incomodó el cadena de oro",26
1003.14,2511.1,103.58,28.73,81.74,"homenaje al 'Sol de México'. ycelular. El Mediante un comunicado, se anunció la Q *x* deKaren? dinero tengo llegada de Bonita para un show íntimo micasatodavía. de más de una hora, donde entonar los | '*“ Schwarzesuna Sedicequeteestaban emblemáticos temas de Luis Miguel: 'La 17 mujer escandalosa _ extorsion ando con incondicional”, o no', Tengo todo £/f difundir fotografías excepto a ti, entre otras. La cita es este f quiere mover todo íntimas, que estaban en 29 de setiembre y el local está por confirm el Perúyseencierra celular quete robaron. en sucasa. Yo tomo ¿Escierto? deportivamente, me Cuandomeextorsionaron, robaron, pero debo seguir — losmandéavolar.Cuando trabajando. dijese habíacosas ¿Consideras que Erick privadas micelular, me",26
1390.8,2841.6,174.8,31.4,82.2,"teestáutilizando para figurar? Claro, porque no lo van",26
1941.38,2826.12,156.5,31.5,83.75,"refería a videos mi hija bañándose,peronoaotra cosa.(L.Gamarra) [+]",26
2370.14,615.36,90.36,27.0,83.14,go embalada con últimos chismes de *Choillywood... La actriz FLAMIALAGS comentó que su compañe—,26
2383.43,904.57,42.93,36.5,59.43,"|u EE e a go, cuando le — ( | e í por F&TRI—",26
2401.41,2002.74,65.51,26.63,83.94,"ev¡to hablar del 'guerre— ro”. Qué roche... El actor DIEGO LOMBARD] con— tú que todavía no la E e E otro bebé con su esposa, la actriz DRA— €0, pues su bebita recién tiene 7 meses y primero quiere recuperar las horas de sueño. Qué buena... Por cierto, TULA reveló que e ee había contado sobre el fin de su relación con NICOLA PORCELLA, pero acostó que vio con buen semblante y tran— quila a la La modelo MACARENA GASTALDO participó en una secuencia del pro— grama ”EN BOTA DE TOBOS', donde tuvo un problema con su vestua— rio y dejó ver su prenda Suave... BASTARDA indicó que le desea lo mejor a su expareja, la modelo VAKIA BLUDAY, quien está participando en un EE a se... Me pasan el talán de que SACO ASHKENAZI y NATALIE VENTI están disfrutando de unas cor— tas vacaciones por las playas del Caribe, jun— to a su pequeño Liam. Provecho... Ahora sí me quito porque mi amorci— to dice que esta noche me calentará de punta a punta... Suuuaaaveee.",26
573.42,498.62,62.88,28.54,88.0,"© La modelo Rocío Miranda dijo que Gino Assert es un 'mal ejemplo' al referirse a ella de manera despectiva, pues dijo que no",27
538.99,803.57,62.17,28.89,82.66,"”¿En serio dijo eso? Qué pena, pensaba que el mal ejemplo solo era en la televisión, porque están prácticamente obligados a armar show, pero me equivoqué”, expresó. ”La crítica fue a Jazmín y en forma constructi— va, para que se prepare bien. En Latina le están dando buenas oportunidades y debe aprove— e s e ea d es a * — es para que se moleste, pero qué se puede esperar de estos chi— % X [ la conoce porque a dife— ——",27
570.8,1008.2,55.8,20.6,71.2,"cos reality”, añadió. o a",27
403.78,1132.93,38.93,28.63,74.19,"| rancia de él, ella nunca a M *s — > / X € estuvo en escándalos. ——* | ( ”Si dice que no me cono— la",27
1134.83,912.29,64.25,26.92,88.05,"(D Rafael Cardozo dijo que Angie Rizada y Nico— la Porella se quieren un montón y no descarta que puedan retomar la relación. ”No sabemos lo que va a pasar más adelante. Uno nunca puede decir 'nun— ca'. Ellos son dos personas muy queridas, que también bonita. Se quieren un montón y todo pue— . de suceder”, indicó 2",27
549.2,1019.8,65.8,25.6,92.4,Rocío comentó que Gino no,27
576.27,1335.58,59.55,28.41,81.52,"| f ce, seguro debe ser el amigo de Nicola. | ] porque no salgo en la clase_N ie de programas que ve, ya que comentó que 1 nunca estoy metida en escán— Ignacio Bala— lb datos o * dán se 'picó' e m A _Dice que si no la conoce es ue, a diferencia de él, nunca ivo metida en escándatos da, durante",27
472.83,2235.33,49.5,17.17,52.33,"a """"' (x | o r",27
940.67,599.0,57.07,35.73,78.4,sabía quién era. _ _ — 0:3Ase a y no se sabe qué pueda pasar,27
2198.31,482.19,55.38,26.55,86.1,"Karen De¡o contó que es feliz con Lucas Piro y no | toma en cuenta los malos comentarios. __ ( ”Me voy de viaje de vacaciones con mi mamá, mi hija y Lucas a Disney Wortd. La más ilusionada es mi hijita”,",27
1924.93,856.54,70.55,28.07,85.99,"comentó Karen. Derepenteahípodna ser la pedida de Estamos bien así, todo poco a poco. r a Siguenjuntos a pesar de los comentarios dias de 'Esto que decían que a durar. P Los comentarios que no me suman, no los ”Esa vez él no tomo en cuenta. Yo soy de las personas que ( siempre cuida su núcleo familiar, y él, hoy día, se moles— por hoy, pertenece a mi familia y quiero tú y pasó lo cuidar mi relación. que pasó”, dijo ¿Ycómote Cardozo. suegra? pidió disculpas S a Margarita A acep— [mamá de Lucas)",27
1625.03,1344.74,59.55,25.77,78.9,"| tadas. Yo entendí * también que estaba ei i < porque iba a com— petir. Luego se f— arrepintió y de mi parte está perdo— nado”, finalizó. (B. Pashanasi) 0",27
2056.5,1305.29,57.5,29.53,85.06,"la quiero mucho. Es más, viene en octubre para el cumpleaños de mi niña. De otro lado, dijo que está feliz de pertenecer circo de 'Esto es gue— ( rra', (B. Pashanasi) © *—",27
2174.06,1472.33,76.28,31.22,86.28,"¿<Se va con Lucas, su hija y su mama y nohace. caso a comentarios negativos sobre su relación/",27
2011.0,1846.17,92.17,31.33,83.17,¡El tercero te lo Llevas GRATIS...!!!,27
2117.0,1727.2,159.2,94.6,88.4,COMPRA 2 y LLEVA 3,27
1424.31,2367.62,23.81,24.06,52.62,E l3 —3 l3 €9 la & = 2 l3 kt 3 = es 15 2,27
336.03,608.33,64.42,26.58,89.17,"La modelo Galería Piazza sien— te que volvió a nacer, luego de sufrir los estragos de una enfermedad muy delicada que la tuvo en 'cuarentena'. ”Sí siento que volví a nacer. Pensé que podía pasarme de",28
384.17,760.33,57.0,25.67,80.5,todo. El diagnóstico lo estoy 0,28
330.92,1125.16,66.52,27.51,89.4,"guardando para mí, porque es una enfermedad que se activa con el estrés”, comentó Piazza, quien señaló que su novio Pierre Cate— piano la acompañó en todo momento. Asimismo, acostó que prefiere tomar con calma la posibilidad de casarse, ”Este tiempo es para mi salud y para estar bien conmigo misma. Ya está el anillo, pero quiero tomarlo con calma”, refirió la modelo, quien anunció la película 'Lo que de verdad cuyo dinero de la taquilla será donado a la Liga Contra el Cáncer. [L.",28
734.25,656.5,54.25,82.75,52.0,"| & ?¡“""_of j)",28
1299.92,681.25,77.25,54.17,65.08,"ee e g /> mañana, pero 'él me hace sentir sola) ©",28
1246.83,1103.37,58.26,26.23,87.11,"La modelo Ivana Turbe reveló, — f— entre lágrimas, que sigue ena— — sol morada de Mario Irivarren, pero aseguró que él la hace sentir sola” ”Tengo 22 años. Es la primera vez en mi vida .. $U 3 que sentí este tipo de cosas por alguien. El amor no se va de la noche a la mañana. Estoy tranquila y es así como quiero que me vean las personas que quiero”, dijo. Asimismo, indicó que prefiere estar DECÍAN ”Es mejor estar sola que estar con una persona que te hace sentir sola”, acotó. ”Estuve 3 años con Mario. Para mí | Mario era no solo mi enamorado, sino — como parte de mi familia. No creo que sea un pecado amar. Lo que más duele son los comentarios o lo que la gente se inventa”, agregó la 'combatiente”, en entrevista con Tiesa Lozano en",28
2125.97,854.47,62.3,27.92,88.78,"© Patricio 'Pato' Parodi afirmó que desde que terminó su relación con Sheila Rojas, no ha vuelto a tener una ”Estoy soltero desde el fin de mi última rela— ción, que fue con Sheila, hace más o menos un año y medio. Obviamente, hago mi vida como cualquier persona de 24 años, que sale a conocer chicas y también sale con amigos. El día que encuentre una pareja con la que me sienta bien, feliz, y quiera formalizar, lo voy a hacer”, dijo el ”guerrero' quien, este domingo, participará en 'Mi mamá cocina mejor que la tuya'",28
2109.92,1130.5,44.92,28.25,84.0,y ¿'¿ 7 ”No sé si [Sheyla) me marcó... pero con la,28
2233.59,1287.81,55.13,27.78,79.93,"tuve una relación más estable y larga et e d E 0 en De otro lado, Patricio reiteró que no 1 volvería a 'El artista del año'. ”El nivel es muy alto. Lo tomé como un reto,. __ lo intenté, no me arrepiento de nada, pero ñ por ahora no regresaría”, manifestó. _ G",28
2289.83,1457.0,67.17,31.0,84.17,33 Dice que desde que terminó,28
2296.75,1479.25,92.5,53.25,70.25,”con Sheila está soltero,28
517.5,2789.38,81.62,34.0,90.75,*No es necesario pagar con tarjeta de crédito,28
1462.5,152.67,87.0,27.33,88.5,JUEVES 19 DE JULIO DEL 2018,29
1373.54,369.85,215.38,52.31,63.77,"CONSEJERO]ESPIRIT¡UALNDE(GRANIPREST Lo 'ENCIG MAESTRO AIF ESPECIATISTAJHACIENDO munzsmmnos*rumes Y, segundos M CON DI(DS m",29
326.4,376.2,207.0,51.6,70.6,BR Q ESPIRITIS_IDEL'AMOR 50LUION9II;OQU PODIDO,29
572.86,532.57,194.71,42.14,74.57,ARTES ENAMORADOS)Y PAREJAS SEPARADAS N0'IMPORTA'LA DISTANCIA EL'SEXO,29
1160.25,783.0,175.5,64.5,59.75,EXPERTOJENJUNIR PAREJAS 4|T| AMEÍI](;Y,29
1275.0,880.86,80.57,32.57,57.14,g ” | i? PUZ¡ANGA FE FLORECIMIENTO,29
1413.67,933.83,80.83,35.17,55.5,"Y CONQUISTAR, EL!¿XM0R'DETELYO | S d",29
1428.14,1006.71,72.14,36.43,45.86,a ee e x>99'112'7 12450 Lopez 99,29
1612.2,814.6,32.4,29.8,44.4,e. A en 133 6,29
521.67,1049.38,113.1,23.71,79.0,AGRADECIMIENTO PARA EL CURANDO R E NACIONAL ECUATORIANO E GARCIA RIVADENEIRA SU HERMANO CHRISTOFER LA DOCTORA IRENE DEL _ JESUS [con],29
528.43,1237.29,55.71,17.86,50.29,ERA radIO Zo Vefaaranecia se y =,29
505.2,1266.6,31.6,19.2,51.0,e REY pico t Á,29
1262.0,1448.0,104.0,24.55,75.0,AGRANDA Y ENGRASA EL MIEMBRO. S A try ADIÓS EYACULACIÓN PRECOZ,29
1227.67,1591.44,119.33,21.89,89.78,ERECCIÓN INMEDIATA Y DURADERA A CUALQUIER EDAD 100% NATURAL,29
1334.21,1673.79,112.07,26.71,84.43,"EXCITANTES Lubricantes Yhombina, Feromonas, Pretender | GRATIS A DOMICILIO Y PROVINCIAL CTA BCP, 191—10490315077",29
817.8,1466.4,66.2,33.6,58.4,'…:1 176 CEL$ ! —$,29
459.83,1829.5,91.33,30.5,89.17,"NO LO PERMITAS MÁS... ACTÍVALO HOY'""",29
269.31,1951.35,48.85,19.81,71.54,"* Único gel 100% natural de efecto in Hombres ds 20 EE * Erección firme, duración, volumen producto * Resultados Inmediatos y definitivos. e s ee",29
331.7,2075.8,94.2,38.1,67.9,"Total privacidad y sin rezar potonvb. Eoorlaoompradel metano ..;¿'—""- d",29
254.71,2125.0,90.57,26.0,72.86,descuento en el Spry Spray femenino (muluovgásmm)._,29
388.75,2183.0,58.25,36.75,89.75,© 913 060 596 — 992 375 158,29
1503.89,2332.05,79.68,27.89,84.58,PODEROSA MAESTRA FATIMA. CON AMPLIA EXPERIENCIA AYUDANDOTE ESPIRITUALMENTE A | MEJORAR TU VIDA TE AYUDAMOS A UNIR Y E,29
275.75,2285.25,464.25,92.25,54.5,AMARRES ErAmonwsexox1oo%1erecnvo¡ % ©IER©S©ESPIRITIIS'WA,29
453.04,2519.31,108.5,44.46,75.92,5spscmusn um5uno¡mms Tonollsexo)gem ARRESTA 170) RES C EAS.0) NO'AMOR 1 POSIBLE 0 ORGULLOSO ALEJADO INFIELWOLVERA'MTU LADO RENDIDO TUS PIE$ SOLAMENTE AMARRE ETERNO Sl 250 TEMPORAL S/.150,29
1451.08,2563.0,79.31,29.54,84.23,"y) PERSONAS QUE HABIAN FRACASADO. TRABAJAMOS CON LAS MAGIAS, SANTERIAS, TABACO Y TAROT",29
1244.75,2629.75,188.25,37.0,61.5,LOGRAR REGRESO DELESERTAMADO DAN,29
1264.25,2739.5,117.5,35.5,64.75,( ROD '[IPO¿DE ENFERMEDADES,29
467.54,2793.69,139.38,58.38,48.92,"%%'E%&T€* ENVIOS”A PROVINCIASY, mismo f .;3;;3¡; UGA;RBTEY3%2£%%5;? ) 05LÍM%£'I a LUN FERTH REVIAc¡1ñ95766255534245986",29
2164.81,980.12,138.31,32.12,71.23,¡N0¡TE SEPARESHNOSOTROS¡TE MOS RITUALES EFECTOS HACEMOS QUE ELISE QUERIDO SENUELVATAENAMORAR: DE1U'ALEJAMOS'AMANTES DESTRUIMOS INFIDEUDADESWTEIDEVGL VEMOS 37 INDEPENDENCIA ESTADO DE LA CLÍNICA SAN JUAN BAUTISTAJSAN JUAN DE LURIGANCHO,29
2241.8,1426.0,183.6,50.0,66.8,: ENCONTRASTE ee VIDENTE INTERNACIONAL,29
2200.14,1651.35,113.57,38.1,77.61,"OJTIRO:D 20R/ ALTAMENT51EFECTIVOS'ALEJO""DE¡TU.CAMINO'&YTODN PERSON NO IMPORTA SEXO, TIEMPO, NIDISTANCIA, PARA UNIRTE CON TU PAREJA MIS MESAS BENDITAS HAN UNIDO A MILLONES DE ESAS EN TODO EL MUNDO. YO TE PONGO A TRAVES DE FOTOS O NOMBRES AL SER AMADO. AMEN.AMARRES.PUSANGA EMIENTEATE! HUMILLA!DICE(QUE YA'NOJTE QUIERENYIQUE 0 UIERE' '0TRO£A¿!TE SUFRES No' €Y¡TE'ABANDON TÚ",29
2076.57,1899.14,200.86,65.29,68.29,AV ALFREDO MENDIGA 1965 | 200. 360—9729/994543359,29
2278.45,2096.09,55.45,37.64,71.27,SOY lA SOLOMON TUS PR08[EMAS DE AMOR DONDE OTROS TE ENGAÑARON,29
1987.6,1811.4,129.2,52.6,65.4,CUAN r¿ PREOCUPA PORÍELLOS%SE RÚ,29
2239.6,2287.2,162.2,41.2,59.6,leuenumlnmaoloelmonENCIENDETIATLLAMATDENTFUEGO] iY DESENFRENO SE,29
2219.79,2348.26,69.53,33.11,67.16,"…M… VENGARTE DE Tu PAREJA, HAZ GUE Sufra POR T1 , TE FeL. Gue Solo 0 TE OBEDEZCO IIHDEG…YNOWHÍMMD…NWNMH",29
2387.75,2644.5,101.25,25.5,65.25,D¡scouoaou nco uous u o ommcoóu RASTREO,29
2311.85,2716.69,62.08,42.62,52.08,o ma con 0 rotate taco be nu 962629849ÍT€1Í $[RIÍW Y GAY m…,29
978.88,150.88,110.25,28.62,87.25,30 (CRUCITROME) JUEVES 19 DE JULIO DEL 2018,30
1778.57,715.71,82.57,18.86,70.0,cm NTERJECC(ON INVENTO F l BEL s¡c¡uA,30
1745.09,1174.45,36.73,29.64,60.45,” AMPARO ) Eh $ >“£ <_t H Res y VATERIA,30
1077.58,1057.83,48.33,81.0,69.83,"i - DELTA -! la .- a 2 * DIOS DEL ANT,",30
1722.29,2074.0,79.18,36.86,62.46,"ENTREGARSE ASOCIO > | mo y PIE U“o”'$""o ROTURARLATIERRA o SF 8<% MINDANAO x x remos wmo ARTICULO [ '*EUTRo Sorpresa <) y s 5' METRO é E",30
1450.8,2600.47,113.93,28.8,53.87,mmmmmmwmwm*mu ©C es d 12 KWS…W&…S…$OM£$LQ¡5A» n l&$lñ£$'0&… Ay Weese y : Halaga Canto Ray,30
1279.39,2651.53,67.37,30.55,62.94,",……W Argenta 3026 Ay pau 2 Más VIRGEN DE LAS MERCEDES Padelion €3 Puesta de danos _ (terta sí 200 [ e I£…BOTWMU.ES Norman A SAC. Agenda S.cre 10TH —— 26 GRUPO VERDE SALAZAR SAC Ju San Juan 1066 PRETELL SAC , Av Guerra Vi 377 La Compra — REPRESENTACIONES SAC Av Jose Pards 0 d '4 IPMAG£NOAIB¿ÁEIRL hay.;uae…… EL , Proceres",30
898.19,2699.06,57.88,31.12,63.62,5…% ……M 20 Con 1 con 17. E DARLORES: PERU AVISOS 267 of 206 a a,30
937.06,2785.24,78.35,28.94,46.94,waum… a Chm5' Ey e 20.SANH BORJA: COCHELLACOSTA A: ra CA:E >rme26* 1o…mram¡m l— a e y,30
994.9,2850.0,64.76,31.1,66.43,um rn s se m .t Mateo 2541 —— 23 SANTA E : RL Los Ruiseñores 204 A am…amw…… 24 SAL:FARIMACIA Procesas de la 235,30
1462.33,152.33,87.33,27.67,89.67,JUEVES 19 DE JULIO DEL 2018,31
1459.57,461.49,83.69,31.88,77.71,"R / :3 WILDER (55).— Buen día, estimada doc— l ” l a tora Carmen, le escribe un hombre ©Ífál .4 z / | divorciado y con hijos ya grandes. Por el ©Tñl Se vienen posibili— a 1! momento solo me dedico a mi trabajo. Soy … 3/ dades de concretar viejo ”, | 9 l I' entrenador de fútbol tanto de menores como a E?to('iamo'» E a de mayores y me va muy bien. Mi intención HII¡II¡Í_ bl t ol ir dificultades. / es poder, con su ayuda, iniciar una rela— Hacesbien dejaatráslasoledad. TAURO: En la vida siem— / / ción sentimental con alguna dama solitaria, nida de n el jr les, cuestiones _ pre habrá obstáculos, lo ENTRENAD'0R/ sencilla, honesta, muy jovial, emprende— a 'paunabuena importante es luchar para salir ¿""o””r""*fijf//""'o/ dora, y que tenga entre 44 a 55 años de todoelderect¡ot_irec0unno;gamto e /BUSCA/A/ edad. Si alguna de sus lectoras se mues— p A oe r",31
1301.62,687.75,80.38,26.25,84.38,"tra interesada en verme, puede llamarme al nu",31
