left,top,width,height,conf,text,page
353.7,1694.62,63.9,26.97,90.16,"C> Listo para la acción. Raúl Ruidito arribó ayer a Lima y hoy se incorpora— ría a los entrenamientos de la selección en la Videna, con miras al amistoso ante Escocia. Vestido con camisa manga larga, la recibió el cariño de decenas de hin— chas en el aeropuerto. ”Estoy en mi mejor momento, esta— mos para grandes cosas en el Mundial. Aún está pendien— te lo de Paolo, hay que estar atentos”, comentó el delan— tero del Morelia, que tendría una propuesta para emigrar al Tigres de México. En las próximas horas llegará Jefferson Farfán, que el 15 de mayo celebrará el cumplea— ños de su pequeño Jeremy. El Locomotive de Rusia le hará una oferta a la para renovar su contrato por dos temporadas.",15
1710.81,1461.2,64.99,27.06,88.24,"PARA OBTENER UNA ENTRADA: 1. Regístrate en el portal fpf.joinnus.com y haz clic en ”solicitar entradas”, donde solo puedes aspirar a dos. 2. Ingresa una tarjeta de crédito o débito que esté activa y espera el sorteo. 3. La lista de ganadores se conocerá en el mismo portal donde te inscribiste. 4. Si eres uno de los ganadores, inmediata— mente se te cobrará el valor de las entradas. 5. El 21 de mayo se conocerán los lugares y fecha para canjear los boletos.",15
1768.17,1882.91,78.65,37.74,87.48,"LA EMPRESA Joinnus, la |nscr|paon para el sorteo será del 16 al 18 e PORTAL JINNS tiene registrados más de 800 mil usuarios.",15
1732.52,2134.66,78.07,34.72,89.31,"Ya nos hemos desprendido de la presión que temamos por clasificar Solo queda jugar, es lo que me¡or hace este grupo” JUAN CARLOS OBLITAS, DIRECTOR DEPORTIVO DE LA FPS",15
1630.12,2332.25,103.38,26.25,79.25,ENLA MIRA DEL PODEROSO CRUZ AZUL DE MEXICO,15
1489.3,2684.62,68.38,29.72,89.09,"© Pedro Aqu¡nñ e convertiría en el segundo peruano en jugar en el Cruz Azul, uno de'[fás grandes de México, luego de Juan Reynoso, que consi— guió su último t|tul0 de Liga en 1997. Según los portales ESP y Mediotiempo, el nuevo gerente <eportivo del cuadro cementero, Ricardo Peláez, y el técnico Pedro Caixinha han dado el 'OK' para la llegada del nacional, de 23 años, que en la última temporada descendió con Lobos BUAH (28 part¡dos] ”El tema lo está viendo mi representante, en lo personal me gustaría quedarme un año más en México, pero también tengo ofertas de Europa”, señaló Equino en RPP, El pase del volante pertenece al Monterrey.",15
2355.07,1710.06,66.21,26.82,89.27,"DEL SAQUE somos carne— cita... TODO SE SABE. Ya me contaron que un volante ”bombero' de un club a rayas ahora está tras los pasos de una modelito cuyo nombre empieza con G de Giane— lla. Un dato más, es amiga de un que se fue a su ”río' por largador. Y para seguir con su estilo, la fla— ca tiene novio. Es el nuevo *Cayo'. Ayayayay... EL VIER— NES PASADO, en la cola de una agencia de un banco de la avenida Alcázar, en el Rimac, el volante de bigotitos que tuvo como 100 despedi— das y en todas Hore, empezó a afanar a una ”veneca' que estaba repartiendo volantes. Primero le metió un chis— tácito y la muchacha no le respondió como quería, des— pués le comentó que había jugado al fútbol y ella acia— re que solo sabía de béisbol. Ya derrotado, tire la toalla. Nunca pintó con las chicas. Cuando levantó una más o menos provocó un moto'. Pobechito... POR SIACA, hay un runnin que los de San Luis le han pro— metido al 'Cholo' que lo van a llevar a Rusia con viáticos incluidos. Pero están que lo mecen y mecen y no le dan ni mela. Don Hugo hizo el gol del triunfo ante Colombia que nos consagre campeón de América en el 75 y participó en los Mundiales de México 70 y Argentina 73. La rompió en el Barcelona de España. Fue crack de cracks. Allí no se puso la 10. Le dieron la 20 y la escogió junto a Johan Cruyff y le metió 5—0 al Real Madrid en el 'Santiago Bernabéu”. Mis respetos para este tío que es más humilde que pan popu— lar. Así es... ¿SE ACUERDAN DEL CHIBOL MAURICIO LÓPEZ? El lateral que mar— có el penal con que la 'U' ganó la Libertadores Sub—20. Aho— ra juega para el AFE de la Liga de Primera de Surquillo. Ya se recupere de un problema de salud y está en la interdistri— tal de la Copa Perú. Vale... Me voy, soy fuga.",15
2129.11,616.78,109.78,24.67,86.11,NO RECIBIRÍA PREMIO ESPECIAL SI GANA TORNEO DE VERANO,16
2168.25,668.0,271.75,65.5,45.0,FOR LAGLORAY VOZ AVAL,16
2202.67,945.49,63.47,27.13,90.03,"€9 A festejar. Que se agite el corazón, pero no los bolsi— llos. Los jugadores de Sporting Cristal se quedarán con las ganas de tener un bono extra por alcanzar el Tome de Verano, pues la directiva no estaría dispuesta a salirse del presupuesto. Se supo que el plante! se reunió para solicitar un premio especial si derrotan el sábado a Sport Huanca— yo, pero desde las oficinas en La Florida les anunciaron que ganar el primer torneo del año solo los clasifica al cuadran— gular final por el título nacional. La noticia no fue recibida de la mejor manera, pero entendieron la lógica, debido a que un club grande solo incentiva a sus jugadores cuando suman o",16
1018.77,1431.27,97.0,32.05,72.23,"reparen los aplausos, loscelularesparagra— MMZ¿©B barylaplataparalasen— ¡ ee E tradas. El gran Ronal— Perú el 11 de junio y un día después",16
284.56,1671.84,175.76,32.84,68.96,"dicho vuelve Perúluegode dosaños—laúltimavezjugó unamistosoconCiencianoen Cusco—y sepondrálacamiseta de Alianza Lima y Sport Boys. Eleventollamado Ronaldin— hoenelbarrio' sedesarrolla— riel miércoles i3dejunio,a las 830delanocheen Matute, yel exfutbolistade38añosjuga—",16
1546.5,1565.27,65.86,46.73,54.05,¿£zana firmas de autógrafos. a a e e el Vlllamaá|n ]sm %ontllrl1u¡dad (Ár|1 EM % pi)artl 05 g; rla %zr a Állanza.,16
1234.11,1658.22,87.89,37.33,52.78,. a Jit/l&x6 LnunnwuhwE i a Ia San,16
1869.0,1707.29,120.57,34.29,62.0,ei o TÚ NO VENDERÁ A PANADERO,16
2172.89,1837.33,49.33,26.22,85.33,Es tiempo de comprar y no de vender a,16
1245.3,1812.5,99.8,33.0,75.2,X | rend¡m¡ento a nivel local tiene que taentrenóadoble horario con,16
1452.5,1839.0,42.25,49.75,48.5,e a i pud¡-,16
286.96,2019.35,163.54,33.5,72.46,"ráuntiempo parada equi— po. Lasentradasparael'show” tienen precios que van desde los39hasta 165 soles. ”Espera— mos un lleno total,esuneven— toleran magnitud y muy lin— do justo cuando el Mundial aempezar”,señalóBenjamín Romero, gerente de marketing delclubblanquiazul.",16
781.78,2057.04,187.3,31.83,66.48,"mirasalduelodelpróximo16 demayo, anteBocajuniors,en elcierredelGrupo HdelaCopa Libertadores. Para eseparti— dosedescartóla presenciado portero Leao Butróneincluso varios elementos titular es no viajarían y serían reservados para el de but en el Apertura an— tesoro Rosario.",16
1443.8,1921.0,152.0,39.6,75.6,"d PABLO BENGOECHEA, DT ALIANZA",16
1484.33,2027.0,79.78,43.56,84.44,"Será, hl sto nco (L ue un jugador de la Ronald",16
1577.0,2077.8,96.8,35.4,90.8,o se ponga ambas camisetas”,16
2190.66,2019.97,70.36,28.52,85.21,"rio se habría descartado la pos¡b¡l¡d|ad de que emigre el panameño Alberto Quintero. El 'Chiquitín' tiene contrato has— ta fines del 2018 y es una de las figuras del (e 1 cast¡gado con no poder fichar refuerzos hasta d¡c¡embre Por tal razón se le 'pondría candado' en Ate, pase lo que pase después de su participación en el Mundial con su seleccion Trascendió que la administración crema solo pensaba en venderlo si lle— ga alguna oferta extraordinaria. La s comentado al delantero, tomado con tranquilidad la ee eo dmgentes/ o",16
2334.0,2410.75,95.0,38.0,60.25,3_ Me n nu mumu Migas,16
1451.08,2541.07,92.85,46.76,55.24,"------- el 1anrmn SURCO rr o. Ja”zm“:o w“€&$¡ 92397?375 7 ar _ era a es X %o| QQ * VÍ : asz£5 ie s a 9Mé1asá'5áu 992967149 wñéé&&5_ … 933643175 Z$ Eseñuii%e¡ IoTff…… 332%%%%% Si,£i¡?3 AIF 'mm Ia oma< CARLOS ón … APERU 4268 % 983313540 i s5¡zñi né%o”""“ M a %'ám t n fm 913)3 INC £áu%'á",16
684.8,2736.8,48.0,25.4,50.4,z 50 |I+ ) a…w_¡au,16
1245.0,2684.67,75.39,46.78,49.0,"% 'á $$ % 2 ugh anm… no""'""v“o. ' DOMINICOS lA s ig %é“ 9413'40386 L£” AA",16
1017.5,2876.25,111.25,34.0,84.5,976921175 942733362 954143438 a%d,16
2420.38,365.85,89.69,35.46,85.77,IFREAL MADRID ya habría convencido a Keymar comparta delantera con R7' y Moha—,17
2380.17,606.06,69.71,34.6,87.94,"$-DANI ALVES elevó a 38 sus títulos en la profesional y es el jugador más ganador por encima de Maxwell, bien se retiró con 36. conquistó su no Copa de Francia y estableció un récord.",17
1183.34,996.72,176.99,41.81,70.23,"Capitanes del ai1¡¡lDeyr|is.—Notodos_son quf1enílp?¿coq?l'_5tade_ctlg Flran— qp_egfz¡1:óel tripl%;local,_perovol— ; goles, millonesopremios. ceelcentralbrasileñoinvitóalvo— — vidafracasarenChampions. | sí ty H eíblelrs Enungrangestodeelogioy — lanteSebastienFlochonalevantar — MEROESPECTADOR Estoy contento 5 levantaron juntos la reconocimiento,elcapitán — juntos el trofeo como un premio al — Neymarobservóelpartidodesdeel nuestra temporada, Copa de Francia — del PSG,ThiagoSilva,compartió equipede Tercera Divisióncon un palcosinemociónalgunaeincluso aunque |0 negat¡vo 5% Eq…po de Tercera __ — presupuesto250vecesinferioral prestándolemásatención asuce— fue la Ch et e modelpequeñoequipede LesHer— — delmillonariocampeón. lular. Estuvoalladodesucompañe— amp'ons y biers,alquederrotó2—0enlafinal. — romance Verratti(lesionado) ylue— , __ EMERY, pasillo' de_ CU8d[O Acabadoeldueloytras hacerle — Cavanidepenal(74”)dieronlacuar— gorec¡b¡olamedalladecampeony TECNICO DEL PSG millonario — pasillo a sus oponentes y recibir la taCopaconsecutivaparaun PSG posócontodoel plantel.",17
784.0,1289.0,122.5,31.0,65.25,BARCELONA CH(%;1]A HOY CON,17
802.43,1364.43,114.57,24.86,88.29,LAUREAL Y PAGARA 100 MILLONES POR FRANCES,17
504.88,1796.15,69.19,27.93,86.83,"€» Barcelona.— El delantero francés Antoine Riemann se convirtió en el centro de la polémica, debido a su posible paso del Atlético de Madrid al Barcelona. Según medios loca— les, el 'Barza' confirmó contactos con su entorno y pagaría los 100 millones de euros de su cláusula de rescisión, Por otro lado, Barcelona —ya campeón de la Liga— recibirá hoy (1:00 p.m. /DTV610] al Villarreal en duelo postergado de la fecha 34. En tanto, sin Cristiano Ronald [Iesronado? Real Madrid (3o con 72) visitará (2:30 p.m./ESPN2) al Sevilla.",17
1339.15,1791.24,68.34,27.72,86.24,"€'» Madrid.— Casi un año después de haber pisado la arcilla, juan Martín del Potro volvió a jugar en esa superficie y derrotó al bosnio Amir Dzumhur por un doble 6—3 para clasificar a octavos de final del Abierto de Madrid., Su próximo duelo será mañana contra el ser— bio Usan Lajovic. En tanto, Rafael Nada (o ATP) iniciará su participación cuando hoy (9:00 a.m./ESPN) choque con Gael Montfils. Por su parte, Novak Djokovic enfrentará (7:00 a.m./ESPN) al británico Kyle Edmund. [+]",17
2421.8,1323.9,91.0,20.8,70.6,d * BUSCA HOY SU DECIMOTERCERA 11198 COPA ITALIA E,17
2180.55,1795.79,65.75,27.46,87.76,"C> Roma.— A vestirse con la moda. La Juventud se medirá hoy (2:00 p.m./DTV612] en el estadio ”Olímpico' ante el AC Milan por la final de la Copa Italia, donde intentará levantar su no trofeo y el cuarto seguido (récord). Los 'rossoneros' rán este título luego de 15 años y en esta liga perdieron sus dos encuentros frente a la En tanto, Roberto Mancino sería el nuevo entrenador de la selección 'Azzurra' por los próximos dos años, cobraría cinco millones de euros por temporada y estaría acompañado por Andrea Pillo en el comando técnico. [<]",17
612.78,2464.82,103.36,37.56,76.18,"cou EXPERIENCIA AYUDANDOTE ESPIRITUALMENTE A ) MEJORAR TU VIDA TE AYUDAMOS A UNIR Y 1 / LA DISTANCIA 0 EL SEXO CONTRIBUIMOS A MEJORAR S TU FELICIDAD, HEMOS LLEVADO AL TRIUNFO PERSONAS QUE HABIAN FRACASADO, TRABAJAMOS EEE e rico v mor GLEELSIH [cmsm¿veum T ruri¡mñ",17
1576.0,2200.25,112.75,26.5,70.25,E T Y7© v,17
1258.82,2454.18,180.71,48.06,61.76,9 4 P RA 3 | Wg[!b£gd1…gg DESERP©.RE €R$5&9©=MW problemas ow [einogar ©añ9m&mmsa K …w%?$mm&oo nv©wr UNA,17
1580.73,2663.64,62.09,32.18,79.91,(A ;€%E 3) BANOS DE FLORECIMIENTO PARA LA BUENA SUERTE 99,17
1292.83,2739.67,243.5,46.0,54.5,t a o $ =mm…sm—=wmma DAR,17
1240.5,2838.0,156.33,57.17,45.5,9ss»mll % E AS RE O,17
2424.0,2570.14,74.29,32.0,64.14,puede Tepetinel acto Erección c5n—¿lo una cápsula,17
2225.5,2734.2,145.3,36.0,48.1,on s <v PREGUNI'E INUESTRO; I EYACULACIÓNIPRECOZ*Y>BLANQUEAMIENTOS'DENTALES rs K e,17
2170.25,2808.12,143.25,41.12,68.0,CENTRAL TELEFÓNICA ©702 8425 © 96723 7214:093655 8352,17
1018.75,149.62,105.12,28.38,87.0,18 (FAMILIA) MIERCOLES 9 DE MAYO DEL 2018,18
1507.33,1154.53,71.92,29.47,82.08,"Parlante FBL b un sonido estéreo potente y con batería de larga duración. En venta en tiendas iShop. eo | S be MENSTRUALES © Odiada por muchas y bendecidas por otras... Diamonds de la — La menstruación. Base Súper marca Mary Kay; — Dolor cabeza, hin— Stay 24 de Maybelline, con aroma a durazno, — chabón de manos y pies,",18
618.0,1446.29,65.41,26.24,90.41,su fórmula Micro—Flex es resistente al sudor y al movimiento para un look ideal por más tiempo.,18
1646.48,497.22,72.8,28.31,79.8,"¿Mami fitness? s ea Las zapatillas Tommy la el romántico, reúne /' Appeal con Weekend. un peluche de 2 * plantilla de goma Disponible en chanchita, media +? y amortiguadores Tiendas Ripley docena de rosas y son cómodas en | y Ripley.com caja de chocolates. cada pisada. Pedido:rosauramas Impresora HP Sprocket. — E Imprime fotos de 6 cm nl ] a desde el smartphone en",18
2069.67,1410.83,72.0,29.33,82.83,"orquídea y vainilla, ideal para mamá.",18
2387.0,691.0,135.0,29.0,87.8,papel adhesivo. En venta: www.hponlinestore.com.pe.,18
2398.18,1590.69,68.89,27.93,88.11,"cólicos, gases, irritabili— dad, náuseas, aumento de apetito y sobre todo incre— mento de peso (pero por retención de líquidos bási— camente). La serotonina, llamada la hormona de la felici— dad, disminuye durante la regla y eso es causante de muchos de estos sín— tomas.",18
1628.35,1887.0,66.42,29.74,83.84,;o Abrigo Debora de la El chocolate y los dulces marca Brigitte Naux. 223 ayudan a regular esta hor— Disponible en tiendas e Ripley y Ripley.com M cuidado de no exage—,18
2374.25,1989.25,75.0,26.0,90.25,rar porque se registraran,18
2352.55,2039.55,44.09,25.36,75.18,! | subidas de peso por el 4 tema del dulce.,18
2426.13,2136.87,60.53,28.0,90.93,Para evitar la retención de líquidos o hinchazón es bueno el plátano y la zana—,18
1414.0,2250.94,64.45,26.16,87.03,"Labios perfectos con Súper horia, además es necesario Stay Matte Ink, labiales de aca— & a disminuir el consumo de lado mate que mantienen el sal, tomate o la leche, ya",18
372.0,2320.33,56.83,27.83,90.67,color sin retoques todo el día.,18
2390.52,2405.14,69.62,27.43,85.57,"que no son buenos duran— te el período menstrual. el ee que tomar mucha agua. Cuando termines de menstruar, el emolien—",18
998.18,2697.94,60.07,28.23,81.43,"! ! E INGREDIENTES al gusto E r te, agua de cáscara de d almendras se vayan tostan— piña o infusiones (como Te PREPARACIÓN do, añade el arroz y remueve la manayupa), actúan ; — 440 gr. de almendras +Dora el fideo en acei— constantemente sin parar. E te de oliva caliente de 2—3 Agrega el agua y deja coci— les dando la sensación de E 440 gr. de pasas minutos. Luego añade las nar a fuego medio hasta sentirse más ligera. 1 +40 gr. de fideo grueso almendras enteras, las uvas — que el arroz granee. Acom— 1 — 44 das de aceite de oliva pasas y el diente aplas— para con un guiso, came o a l n tado. Cuando las pasas",18
1725.33,152.44,115.33,29.22,83.78,MIERCOLES 9 DE MAYO DEL 2018 mj& (FAMILIA) 19,19
651.75,278.0,181.75,40.75,87.5,NUEVA FORMA DE VERDE,19
2403.5,366.5,93.5,28.5,74.25,Para regarlas' debes humede—,19
1509.65,453.65,71.95,25.2,57.75,e E ” . = | * e musgo por unas bi 9 — 7 7 coq/una planta'de ei it,19
2449.5,557.5,56.38,27.75,91.12,"día, todo depende— rá del tamaño de tu",19
1389.06,581.72,64.61,31.83,65.5,"l — anturio, crotón, cap— e= ol d a a — u . BRAVO Todo dependerá de €ac'y",19
651.15,802.25,83.8,36.1,81.7,"Las ko teda ntos son ra un obsequio fuera de lo musgo y dama y bola, de ahí pro— común y muy",19
441.84,1046.79,57.3,26.98,84.81,"e existen un sinfín de detalles plantación. que le puedes dar a tu mami— ta por su día, sin embargo, si a ella le gusta las cosas natu— rales, alternativas, fuera de lo ol e ir ma idea de qué le darás, entonces,",19
485.14,1206.14,80.57,27.43,81.57,deberías optar por una ”kokedama'. Las plantas,19
1208.39,1371.69,73.52,24.79,86.61,"”Es una forma de sembrar plantas en son decora— una bola de musgo, que es como una vivas ideales Es ideal para personas que le gustan maceta natural que mantiene a esta las plantas, pero no tienen tiempo para hidratada para su crecimiento”, explica res, oficinas, cuidarlas tanto porque esta se riega' Patricia Bribones, dueña de Kokedamor. mesas de cen— una vez a la semana, como mínimo. Bribones detalla algunas caracterís— tro o mueble de ticas que hacen de este regalo algo entretenimiento. Agradecimiento: Facebook: Kokedamor. Correo electrónico: kokedamor18&qmail.com. Teléfono: 9958—05129 a e a m mm ma,",19
708.55,2249.64,35.36,22.64,59.45,"o“f“ P I. I I "". ¡ : ' 1:) [IES",19
945.12,2349.5,36.0,21.62,54.38,": [—_I. ],,__ */'¿5-?)x""—'/% ._ — mA EE",19
562.0,2317.5,27.25,7.75,44.75,marca ee e y,19
2306.25,2572.0,65.25,21.5,69.0,» * ACEPTAMOS VISA,19
2229.5,2654.17,57.0,69.83,34.17,e e e — ra a,19
2261.5,2793.0,64.0,35.0,69.75,276 — ME NIMA,19
742.5,2647.25,148.75,34.25,67.25,pr ¿Dudas o consultas?,19
1160.44,148.11,67.89,26.89,75.22,” % — MIERCOLES 9 DE MAYO DEL 2018,20
1851.96,1423.41,82.14,31.38,76.62,"sta octubre Lee bien la información, =t¿;¡ Í.Í."",? esta tomóspor primera vez' , y respo imágenes el lado de la siguientes preguntas: Lung qsl:ie r|¡unca—se puede La Luna M … aunque no aparecieron to"";: 8Pf:g¡- [civilizaciones ni Tuinas] ma m; o extraterrestresTresultó ser una misma como en dar una vuelta alrede— E d (i ie degeneración de un tejido por la muerte de sus células: A, Disfagia. B. Ambliopía. €. Necrosis. Los gatos ronronea i ls B, Relajados. €. Molestos. * Of — El camaleón sonda espacial tomó 29 pantera es fotos correspodiente al 70% de la originario de: cara ocultarle contacto con la sonda se , | B Madagascar. se quemó en la atmósfera de",20
1560.23,2545.56,71.46,26.38,89.37,"¿Por qué ronronea los gatos? Lo hacen cuando están relajados y cómodos e incluso desde que tienen pocos días de vida. Este ronroneo se usa entre E comunicarse y orientarse. Lo hacen con los músculos de la laringe y el diafragma, de manera constante mientras respirar. Esos ronroneo calman a los humanos.",20
2058.76,2649.55,68.33,25.95,87.57,Es una especie originaria de Madagascar. Los machos pueden alcanzar los 50 cen— metros y las hembras 35. Se agarra a una rama con su cola fijamente rizada para confundir a sus depredadores. Se ali— menta de insectos. Vive hasta cuatro años.,20
404.0,2398.33,213.0,115.67,48.67,—— 5 |___ BECROSS _ |——,20
529.73,2565.0,54.45,26.64,91.73,Es la degeneración de un tejido por la muerte de sus,20
495.73,2716.61,73.57,26.69,90.31,"células. Esta mortalidad es producida por la acción de un agente nocivo que genera una lesión irreparable. La necrosis puede producirse por un traumatismo, una isquemia (cuando el aporte de sangre al tejido no resulta suficiente), la acción de una sustancia química o tóxica, una infección o una enfermedad.",20
985.0,1159.4,102.8,32.0,45.0,n Yahora su carne aidoenascens0.,21
1076.38,1354.62,76.0,38.62,50.62,¡Perúlosabeque El a e ee queev! dador y,21
851.88,1663.75,137.38,41.38,65.0,o mose recue ge unosdías n fe_th momentos bíafelicitgd municación.,21
433.5,1772.5,117.25,32.75,44.5,| sesienteOrgU— IVAN l los odes up,21
595.53,2506.88,63.07,25.87,85.42,"deseo estar en sentencia”, dijo Cielo Torres, la popular 'Sabrina' de para no competir con Yahora, Miett o Michelle Soifer. ”Sé que tengo que esforzarme más y tratar de no estar en sentencia, pues _ podría competir con monstruos en 4 audiencia como Miett, Yahora o Miche— lle Soifer, quienes tienen miles de seguidores en redes sociales. Sueño 7 con llegar a la final y me vengo esfor— dando día a día, solo tengo que dejar los nervios a un lado, soltarme y cantar”, detalló la actriz. (E.C) O",21
600.22,2827.78,80.89,38.33,72.56,¿t Teme competir con To;Qil Miett y Michelle Sofer,21
1140.2,1470.6,95.0,40.8,61.8,sestamosmuY —. A ?4 /,21
1178.4,1672.4,96.4,34.0,51.6,s de los mejores su carrera y nO e,21
1469.38,2526.15,60.92,26.92,84.24,"El cómico Alfredo Benavides señaló que aún sigue asimi— lando su sentencia en 'El artista del año”, pero espera seguir en la e e ”Aún estoy asimilando mi sen— tencia, pero me estoy preparando ! para sorprender el fin de semana. — E No tengo temor de competir con el — Parodi y Luis Baca”, agregó. — | Además, comentó que ”solito' pue— RS de hacer un buen show. cido, solito puedo hacer un buen show, así que se preparen bien”, agregó el cómico. (E.C) G",21
2190.79,2587.0,59.57,25.79,84.97,"pués que aseguró que le hizo mucho daño. ”No hablo de otra persona — que no sea de mí. En verdad, no veo tele, mi familia tampoco, tenemos Netflix, estoy en otra, 3 en mi negocio”, dijo Carbajal, 3 ¿Cuándo viajas a Rusia? 5 El Mundial de los artistas en Mos— tú arranca el 23 de mayo. Hace do Al,3 meses que entreno, participarán 16 países y aparte vamos a can— tar. Antes del viaje, este jueves 17, haremos la previa del Perú— Barcelona. [B.P.) C",21
404.81,915.4,65.75,26.16,87.04,"Maya Gobi dijo que Fabio Agostini es un caballero, totalmente opuesto E i ”El es un caballero conmigo, excelente per— sona. Fabio es rudo ante los demás, pero conmigo es un amor. En la televisión tiene un personaje”, contó la actriz en el progra— ma 'En exclusiva' y descartó convivir con el a ”Falta mucho para eso. Nos conocimos hace como 5 meses y estamos recién ofi—",22
475.25,1131.62,63.25,26.25,91.38,"cilmente dos meses, lo quiero pero aún no",22
402.43,1167.86,68.14,26.0,71.71,"nos hemos dicho 'te amo””, manifestó. O",22
442.38,1227.12,70.75,29.38,77.12,<Cuenta que solo es ”rudo' en la televisión,22
393.13,1779.75,63.24,25.58,91.01,"Michelle Sofer reiteró, ahora que ha vuelto a ser tía, las ganas de ser mamá de un varoncito y que está con— versado sobre el tema con Kevin Blow, aunque el dominicano mencionó que no ”Estamos planeando para un futuro y nos gustaría que sea hombrecito”, afir— me Sofer. ”Sí, me muero por un hombrecito, pero creo que no es el momento, un hijo sabilidad, no sé",22
841.8,1954.6,172.6,41.0,57.2,"7 z amiento de Torbellino', ... ¿considerasquefueun",22
1012.04,1255.21,239.03,33.18,71.57,"age renta de estrategia y contenido de Latina, LucianaOlivares,revelóque DeyvisOroscoseráunadelassorpre— s as que el canal presentaráduranteel desarrollódel Mundial Rusia2018 ”Latransmisióndel Mundialeselproyec— tomásambiciosoque Latinahatenidoento— das historia. ARusiaviajaránEddieFleis— Peter Arévalo, Mar coCifuentes (queestáen España y presenta— rálasnotascuriosas),Cristian Riverly Jaz— mí Pined por la partedeentretenimiento. Deprensa, MariCalixto.Serán15horasdia— riasdetransmisión,nosolodelospartidosde Perú,sinodetodoslosencuentros yel 2022 transmitiremos MundialdesdeQatarpor— quetambién tenemoslosderechos”,dijo. Sehablódeunprogramahecho desvela Seráunprogramaquesellamará'Pia— ¿Ypreparanalgoenla parte musical para alentar ala selec— ción? Sí.conquienestamosdesarrollan— do esto es con DeyvisOrosco, ¿Estaráen Rusia?, ¿habrácum— biaenMoscú? Sí.esbastanteprobablequeviaje,el proyectomusicalseráunagran sorpresa. Cambiando detema, mu— chose ha critica do ellan—",22
930.0,2048.86,65.14,23.71,38.57,3 0 e rd ”Torbellino'hasidoun en el,22
621.18,2174.82,54.0,40.27,66.91,) [ querrá que sea / quel k p3 gustaría ——,22
1714.49,1293.03,214.2,35.49,67.89,"dosícanal, Iguana y Lu— cho Llosa),nopuedolla— marunéxito, no tapo el solconundedo,perores— catoquecomopropues— ta digital fue bien recibida y que se descubrieron mu— chostalentos. [ NeyGuerrerodijo que'La putita verdad'esun'for— — | matoextraño'yqueveía — |> aMagalyenun'lateshow”, Y ¿piensas lomismo? > Creoqueaún haypanporreba— nar. ) predique Neyloconsidere'ex— J! porque un nuevo for matoquealcanzarásupun— k todecocción, ya que eso refleja en el focus group que hicimos yelpúblicorecibebiena Ma— gal y cuando es divert idae interactúaconelhuachano yaconsejaenel'wasapdel amor” ¿Yquéledirias cosqueaseguranquere— nunciarás? Siempresoltaránrumorespa— radesestabilizar,.continua— rétrabajandoporquenome trajeron porserunaerudi— tadelatelevisión,ahiestán miscompañerosconsu granexperiencia,lomío esaportarunaestrate— gilaquegenereuncambio. (CChévez)G",22
454.6,2363.0,84.0,23.8,87.0,La productora Michelle Alexander _,22
1492.75,2359.25,83.75,27.0,90.75,"Además, adelantó que este",22
1861.5,2359.5,60.25,26.25,91.5,"Por su parte, Melissa",22
