left,top,width,height,conf,text,page
223.0,144.5,59.25,41.5,66.5,2 — (AL DÍA),2
529.25,1429.26,71.14,29.52,88.3,"i amigo, el fotógrafo Gary, llegó al restaurante por un potente caldo de chorros y un pescadito a la chorri— llana con su roc o tito molido. Para calmar la sed, se pidió una jarrita de doliente con cebada al tiempo. ”María, me vino a buscar a la Redacción el veterano periodista de Política, Cigarrito”. Llegó de la selva donde realiza un misterioso trabajo. Vino con unas espectaculares botas mostaza 'Caterpillar' y sus clásicos jeans pegaditos. To— daría mantiene una peluca larga castaña y con sus lentes oscuros de luna espejo, impresionó a las redactora jóve— nes. Pero al sacárselos, se descubrió un rostro palidísimo, llenos de arrugas como los surcos del Dakar en las du— nas de Ica y unos ojos rojos, sanguinolentos, como los de un vampiro, fruto de tres amanecido de puro pisco. Las chicas gritaron de espanto y huyeron al comedor. las redacciones de hoy no son como las de mi tiempo. No existía el celular, menos el face”, el wasap', 0 sea que todo lo tenías que hacer cara a cara, ir a la fuente. Ahora se declaran por *wasap”. No seas malo. Conver— sábados mucho, salíamos tarde del periódico a char— lar al bracito ”La cámara de Nadie te molestaba. Eras más libre. Tampoco había Metropolitano, así que las jóvenes que vivían lejos llegaban a sus casas tarde. Eso decía Carola, la fotógrafa que iba conmigo a las co— misiones. Una chica arriesgada y guapa. Una vez, el can— dato favorito para ganar las elecciones fue al penal de Lurigancho a regalar víveres con varias estrellas de la televisión. Pero los presos los botaron por oportunistas. Tomamos la foto y me iba al periódico a sacar la noticia en portada, pero el sobrino del candato me agarró del brazo: ”Cigarrito”, el candato va a dar un anuncio importante en su casa. Solo están invitados periodis— tas seleccionados como tú”. En efecto, fui con Carola. Era una fiesta en una residencia barranquina. Con mozos, buena comida y el trago más fino. El sobrino del candida— to me traía personalmente el pisco sour en vaso catedral. ”¡Salud, 'Cigarrito””, me decía. Sabía de qué pie cojeaba. ”Oye, ese pendejo te quiere emborrachar para que no es— criba la nota. ¡Vámonos 'Cigarrito'!”, me rogaba Carolita. ”¡Ya, el último”, le decía y la cabeza me iba dando vueltas. Pero el sobrino un cineasta reconocido, seguía trayéndo— me más pisco mo que guano en vaso catedral. La fotógra— fa me agarró del cuello y me sacó a rastras. Paramos en un café y me hizo tomar cinco tazas bien cargadas. No sé cómo, con Carola al lado, escribí esa crónica que salió en portada y a tres páginas. El inmenso y rubio director me felicitó y nos mandó a Carola y a mí a una comisión a Iquitos como premio. Pero lo que pasó en Iquitos te lo contaré en otra ocasión””, Pucha, ese señor 'Cigarrito' fue un gran periodista. Lástima que no guardó pan para mayo. Me voy, cuídense.",2
1294.5,149.33,92.5,26.67,91.0,MIERCOLES 9 DE MAYO DEL 2018,2
1729.86,453.07,78.0,33.57,79.29,"¡HEY CALICHE , YA TE DIJE LA HONESTIDAD CONSISTE EN HACERLA BIEN ” PARA",2
1203.2,1201.2,107.2,45.6,86.8,Jala orejas a jóvenes distraídos,2
1285.95,1407.16,60.76,26.72,85.95,"G» id ie rgqorr¡o toda la sala de espera de una clínica llamando a un paciente, pero nadie respondía. Junto a la puerta del consultorio había un joven con unos audífonos cubiertos por sus cabellos. Me acerqué a él y casi al grité sus ape— llídos. Había sido él. Noto a la juventud muy alejada de la realidad.",2
1769.0,1221.75,101.0,47.5,41.5,d E ee 10,2
1846.74,1441.55,63.09,28.43,83.13,": Desde el joven que vende jugo de naranja o : huevos de codorniz para pagar sus estudios, : hasta mujeres como Valentina Phocco, la : puneca que ganó el Premio Mundial al Mejor : Café. Son ejemplos de trabajo, esfuerzo y ee Marcelo Hernández : :",2
1918.17,1301.67,77.25,27.17,89.42,Hay historias de emprendimiento que señalan el camino y nos dan esperanza.,2
1264.72,1760.86,65.42,26.81,89.56,"No solo los jóvenes, también hay adul— tos que se sumergen en el mundo virtual y se desconectan de la realidad. Según algunos psicólogos, eso es peligroso porque hace más indiferentes e insensibles a las personas.",2
1404.42,2082.97,72.81,30.84,86.74,"”No me parece correcto que Kenji Fujimori utilice a su madre y su padre, Es una persona que no tiene reparos. Los utiliza para victimizable y no afrontar su responsabilidad”. y",2
1939.57,1710.5,63.29,27.64,90.57,"Los emprendedores son un ejemplo de que el trabajo, incluso el que empieza des—",2
1884.44,1779.44,55.11,26.72,89.5,": de cero, es el camino del éxito. Grandes hombres Bill Gates y Mark Zuckerberg han salido de",2
1754.92,2311.37,59.71,23.98,67.6,". ( HECTOR BECERRO (CONGRESISTA) p A r n Director — Contenido elaborado_ — Fax: 31—6353. st i s t…* Periodístico: —. por Empresa Editorial —— Páginaweb: Editora El Comercio S.A. Jr. Paracas . a A J. Santa Rosa No247, — E—mait | 10005 105 derechos reservados, | Olnay — Teléfono: 311—6500. — Publicidad: 708—9999, | Prohibida su reproducción total o parcial.",2
2437.0,374.57,73.43,31.57,80.57,canción a 'Personaje del Año' ahora lo,2
2407.0,518.0,118.8,36.6,71.8,©luismorocho !W LUIS MOROCHO &,2
2453.81,665.29,74.95,35.71,76.0,"ese s e o no, pero lo que está haciendo el juez Caramancho parece más una venganza... que ahora retrocede.... s",2
2417.75,1067.75,24.0,26.0,41.5,e ee e a,2
2410.31,1251.88,59.25,28.0,81.88,¿Está de acuerdo con la incautación de bienes a Llanta y Nadine? sí 6% NO37% 5,2
2591.6,1824.0,56.4,20.8,64.8,] ] l 4276904 6175000,2
2319.85,1883.31,84.31,23.69,84.77,Emergencias Defensa Civil Salud Águilas Negras Escuadrón verde Luz del Sur Indecopi NO,2
2426.37,2319.53,57.11,26.05,87.37,Hecho el Depósito Legal en la Biblioteca Los artículos firmados y/o de opinión son de exclusiva responsabilidad de E,2
1719.75,151.62,97.62,28.0,80.12,MIERCOLES 9 DE MAYO DEL 2018 fAVISO; 3,3
1354.16,591.91,153.25,52.25,82.22,"Llevamos más de 18 años apoyando a nuestra Selección. renovamos este compromiso al convertirnos en Patrocinador Oro de la Federación Peruana de Fútbol. Orgullosos de este gran y apostando por el futuro,",3
1012.5,148.25,77.25,30.5,81.62,& — MIERCOLES 9 DE MAYO DEL 2018,4
1748.6,404.1,122.5,41.8,88.1,"¿<Feroz quien había secuestrado a marino, se lanzó de camioneta",4
1982.12,756.82,109.82,31.73,78.3,"escapó LA POLICÍA LE HIZO arrojódel vehículo noche del de mayo, la , oficial curandera policíaatrapó a Piero” bandera llevado, junto con los junto a Guillermo Gu— trasladado la otros integrantes de tirret Rodríguez (27),",4
228.0,929.5,163.5,32.17,88.67,"carcel eta del PoderJudicial, en Ventanilla, un integrante de la",4
2151.5,925.54,96.79,32.29,78.79,"suorganización, porla — DiegoLeónCár avenida La Playa, ala dejas (25), y altura del Banco de la Raquel Rodríguez Pine— Nación del distrito. do(25), cuando",4
280.88,1132.82,125.35,30.71,78.53,"fe roz banda Los sanguinarios del Callao' saltódelacamioneta policial y escapó de sus Según una fuente policial, Nicolás Castillo",4
602.6,1269.1,144.0,30.1,69.2,"£ ra, Bufete (18), 'Piero' se IUNTOCON SUBANDA'LOS SANGUINARIOS DELCALLAO'¡",4
1972.39,1133.0,138.89,29.11,79.17,"”Seestán realizando las indagaciones, porque las autoridades tratan reestablecer por qué el detenido encontraba sin grilletes”,dijoun oficial. Comoserecuerda, la",4
2411.07,1140.37,95.63,27.33,79.96,"tenían secuestrado un marino, a quiero ha— bíandespojadode su di— nero y otras pertenen— casal abordar el falso colectivo en el que per— pensaban sus atracos. (EdgarCirilo)",4
489.86,1546.86,79.64,19.29,74.71,Contro de Catarata y Labor FUTURO VISION (Porú) _ Ammfñcmm S 0] 0©Mer e,4
313.6,1838.8,253.8,50.6,65.8,— [EMHU©©IR£I&X ©&XF&XE3&WÁX — CURIOSIDAD,4
554.25,1961.88,84.75,23.75,84.0,"(Con pegamento tisscel, sin puntos y sin dolor)",4
500.25,2101.54,110.17,30.75,84.0,COSTO SOCIAL AV. SAN BORDA SUR 536 — SAN BORDA (Altura cuadra 30 de Av. Aviación) TLF. 417 5230 — 417 5240 |___ |,4
537.17,2685.33,195.67,52.0,54.67,Estantes cantiga de principio a fin.,4
2361.89,1942.0,100.56,39.33,51.44,l Omn|F9n05 m&mw%r—s VISA ©LDS ( o dd l,4
2438.0,2020.89,43.89,20.33,76.89,Av. Atunes de Manolo 820 A Los olivos ea,4
1952.25,2018.75,74.25,26.75,84.5,© HUEVO LOCAL: MIRAFLORES,4
2211.18,2109.82,71.91,26.55,61.82,la nr| d M62|M¡4Lung7wgrg.m m. Horario de Atención ©597*1 596 p,4
2017.56,2157.33,54.56,26.22,78.78,Lunes a Sábado Sam. a Som. Domingos Previa Cita,4
2287.75,2761.0,97.5,14.0,54.75,e» 9 www.lumingo.com —,4
737.0,1588.38,96.23,40.46,87.15,¿<Facilitó a sus cómplices la entrada al local para que se lleven dinero,5
1103.16,1307.38,191.88,33.28,71.72,"y apoliciíacapturóal trabajador de una empresa de alquiler emotos,aquien acusódeplaneary par tic i paren el asaltoallo— calenelquelaboraba,de donde llevó,juntocon suscómplices, 5milso— lesenefectivo,asicomo computadoras,celula— re sylas pertenencias de losempleados,en Villa El Salvador. Coronel PNP Roger Pé— rez.jefedela DivisiónTe— querer seperpetróel asaltoalaempresa'Mi la cuadra22delaavenida",5
891.33,1838.33,80.83,27.5,79.83,"tomaron cinco mil soles, computadoras e",5
804.33,2159.83,63.33,30.5,75.17,E mientras revisaban todo el lugar.,5
303.38,2195.77,50.62,29.69,71.46,Tres delincuentes llegaron a la empresa ll Y es amenazaron e E A,5
721.95,2493.25,59.5,28.2,85.65,"m Sócrates Mirala Casa— G? nova (23), 'Soca', fue detenido por la policía que lo acusó de asesinar de un",5
687.84,2694.42,71.42,27.68,87.47,"en Magdalena. Los agentes llegaron has— ta la cuadra 27 de la calle Huamanga, donde intervi— dieron al sospechoso.",5
417.5,2840.38,79.12,57.0,64.38,"asesinato — de SU t""0 l mat% E]",5
757.86,2582.71,44.29,24.71,85.43,"balazo en la cabeza a su tío,",5
1213.25,2154.12,56.31,26.88,82.06,"La policia detuvo a jonny Ramos Carrazo (40), trabajador de la ee participó en el asalto.",5
1127.59,2473.65,51.35,26.65,89.65,su tío Ángel Mirala por— que le pidió que se retire del frontis de su casa. ”Este,5
1172.67,2636.14,68.62,25.33,89.43,"detenido estuvo involu— grado en el crimen o % del comandante PNP Pedro Guerre— ro, en diciembre del 2015, cuando inten—",5
1161.14,2820.43,66.14,40.57,60.0,"_/ pollería 'El Corralito”, di('0 un a¡_iente.",5
1522.89,659.44,115.11,43.22,86.89,<Lo atraparon festejando en cantina junto a sujeto con,5
1495.5,1615.3,213.33,33.42,69.3,"Arenales,en ”Lue— gode las pesquisa s yob— servarlosvideosdelacá— mara de seguridad se confirmóqueunodelos ladroneseraeltrabaja— dorJonny AlfredoRamos decuidarse, peroloiden— tificamos, asícomoasus TOMANDOLICOR Losdetectivesacudieron en busca del sospechoso y lo encontraron tomando licor en una cantina del sector2,grupo8.”Estaba acompañado Freddy DiegoTankarunaFlores, quientambién fueinter— venidoparainvestigarlo. En la unidad policial, lue— godelapruebadeiden— tirad mediante hue— lladactilar, descubrió quedichosujetoerareal— mentelván EnriqueTan— karuna Flores(28), Nari— porsuhermano”explicó eloficial. Sobrelosotrosintegran— tesdelabanda, afirmó queseencuentraniden— notificados y quesu'mo— dusoperandi'eracaptar yconvencertrabajado— re s de las empresas para que les facili ten el acceso. (MónicaRochabrum) G",5
1485.6,2509.6,147.6,61.6,88.4,Tenía 100 mil dólares falsos,5
1581.64,2764.27,67.73,28.73,90.09,"© Cuando se disponía a viajar a Estados Unidos con 100 mil dólares falsos, camuflados dentro de su maleta, fue detenido Euge—",5
2403.28,437.22,64.78,27.72,90.5,"4 de la tarde, Jesús Jho— matan Blas Sayre (20) fue atacado a tiros en la inter— sección de las avenidas Universitaria y Angélica Gamarra. El atentado ocurrió en presencia de la pareja sentimental de la",5
2209.6,767.1,65.55,28.48,86.68,"©) A plena luz del víctima, que mila— groseramente resultó do conversaba con ilesa. su conviviente, un Según la mujer, su ei ea pareja fue ataca— con antecedentes da por dos sujetos por robo, fue asesi— que bajaron de un",5
1986.05,994.5,60.59,25.68,88.23,"nado a balazos por dos pistoleros que se trasladaban en un auto blanco, en Los Olivos. Minutos después de las ! £",5
2439.04,985.75,58.17,26.88,86.5,carro blanco y le dis— pararon en la cabeza. Trascendió que la policía hizo un operativo y atrapó a un sospechoso. (E. Cirilo) 9,5
2198.83,2115.7,66.98,27.64,88.45,"€a Media hora después de asaltar un grifo en Chosica, Pavel Jimenez Villaverde (31), Trinchudo', fue atrapado por la policía cuando escapaba en un auto, en Ate. Agentes de Investigación Criminal informaron que los empleados del grifo ETS América SAC, ubicado en la avenida Lima Sur 895, denunciaron que un taxi se estacionó y bajó un hombre armado, que le arrancó su 'canguro' a uno de los trabajadores y escapó. ”De inmediato se inició la búsqueda del malhechor y se ubi— có el carro cuando se desplazaba por el kilómetro 10.5 de la Carretera Central, se le cercó y atrapó. Tenía un arma”, dijo el oficial. [M. Rochabrum) [+]",5
2359.81,2524.0,49.65,28.45,80.97,"Se supo que para des— — | pista a la policía iba a hacer escala en Guate— mala y posteriormente El y | — y XSalvador. la y, ”Pertenece a una",5
1911.56,2792.0,53.33,29.0,79.22,(47) en el aeropuer— to Jorge Chávez' del (6,5
1978.25,2723.75,79.5,37.75,78.5,"no Rodríguez Barranco ¿:,Jf",5
2454.0,2814.29,89.71,30.0,79.43,"financieronorteame— ricano”, dijo un oficial. ([E.Cinlo) ©",5
925.56,148.78,105.0,30.67,81.78,6 — (ACTUALIDAD) MIERCOLES 9 DE MAYO DEL 2018,6
1600.4,362.0,46.2,13.0,92.4,No DE LA SUERTE: 2619349,6
1750.57,340.14,71.86,13.86,82.71,DISTRITO: SAN JUAN DE LURIGANCHO DISTRITO: RIMA,6
2122.61,303.72,81.11,21.33,76.61,GANADORES DE Los 3 premios pe $/.500 el on 08/05/18 w DISTRITO: MAGDALENA No DE LA SUERTE: 2601988,6
1938.11,404.61,57.56,14.17,87.17,"Inscripciones todos los días de 6:00 a.m. a 6:00 p.m, Sorteos: 7:00 p.m, Términos y condiciones en www.trome.pe",6
751.71,791.21,172.48,55.98,61.93,"Llama al SLA LLAMADA GANADORA' ... Regalamos — ingresa a nuestra S y v.""4_,' oy 3 es e p sl gnla'Súgerllama— (m s aganadora' pue— desllevartefacili— ©[m ©i i kg©&l]W© ssf to miles desole sen efectivotodalasemana. Tomanota:Delunesa cadauno,mientrasque ¡Inscríbeteypruebatu viernessalentrespre— losdomingosentrega— suerte! miosdiariosde500soles — mosSmilsoles.",6
389.0,1247.5,184.75,40.75,52.75,y a | mgymm6&%%£am,6
1571.97,2006.12,55.38,26.81,91.28,"Falta solo un mes para el inicio del Mundial de Rusia, y tú podrás verlo con la mejor calidad de imagen gracias a los 50 smart TV de 40 pulgadas que sortear",6
1133.78,2501.74,44.04,24.67,69.52,H E E y A bo €» El comino es un condi— E in d mento que hace eo H ra ese a bién es muy beneficioso:,6
1562.42,2709.62,66.19,26.85,90.27,"©Ayuda a controlar la pre— sin arterial y es un buen reemplazante de la sal. ©Es bueno para la digestión, porque ayuda a descompo— fuente de",6
1865.62,653.0,286.38,32.88,66.75,"Parainscribirte,llama al710—02600ingresaa nuestraweb(wwwtro— me.pe)todoslosdíasde7 delamañanaa6delatar— de,porquelos portesse realizan a las",6
1905.8,947.4,228.0,35.0,72.9,"MÁS SUERTUDOS Ayerganaron:CarmenSo— to(2619349,deSanjuan deLurigancho),JoséGa— larza(2027438,delRimac) zanahoria (2601988,de Magdalena). [+]",6
2051.25,1449.42,64.54,26.58,89.67,Ya salieron 25 televisores y el sábado 19 de este mes salen los otros 25. Participa depo— citando en cualquiera de las ánforas autoriza—,6
1948.64,1686.64,58.79,26.25,84.18,"das un sobre con un envase 67 S] de crema dental Colgate, un sachet del desodoran— *: te Speed Stick y uno de los 1 cupones, que publicamos",6
1990.9,1949.68,64.42,26.4,90.25,"todos los días, en el que deberás anotar tus datos personales. Imagina en la sala de tu casa uno de estos modernos smart TV donde verás tus programas favoritos y, espe— cialmente, a la selección en la justa mundialista. [*",6
1973.88,2564.5,67.88,26.21,85.04,"el la salud del corazón. Fortifica los huesos, pues mejora la absorción del calcio. Por ser rico en vitamina ayuda a eliminar los res—",6
2035.4,2804.33,67.33,30.67,69.67,"©Mejora la memo— ria, debido a sus antioxidantes y propiedades anti— u el el (e",6
2398.85,1054.22,53.98,26.52,86.28,"Tu revista +mer cumple 5 años y lo celebra con una edición especial por el 'Día de la Madre'. Por eso, sortea— rá 3 gift cards de mil soles cada uno para que armes tu look. e tenemos una nota con el chef y modelo Lucia— no Mazzetti. Además, la guapa Sheila Rojas nos revela su faceta de es o",6
2464.75,1435.62,58.5,32.5,79.0,"'""í; tenemos tips de 3 a belleza, modas,",6
2363.0,1526.67,57.17,28.17,91.5,consejos para la crianza de los,6
2361.2,1620.2,55.7,30.1,85.6,"hijos, receta de cocina, el Horós— copo del Amor, e",6
2397.14,2467.0,83.0,34.43,62.57,aside ;Enal Mónica) 3 lados y cnompas'fueron,6
2442.33,2666.0,31.33,15.5,62.83,7 q — N INBEfdijo 454,6
2449.2,2767.8,95.0,27.4,58.2,estos trabajo si como parte del Cárceles,6
1490.55,684.5,241.55,39.8,65.4,"n y mamita;'Rondacriolla decamaronesprepara— RESTAURANTES …5M—A%AM…Á demiabuelita' yotrosex— doconunader€zo%asem A quisitosplatos. deantaño.Seacompaña ©Mamitanorteña: conunoschoclitossanco— Arrozchaufaalestilo chados. © norte.Con langostinos, ©Deliciasmarinaspa—",7
1568.14,151.14,127.0,29.71,85.29,MIERCOLES 9 DE MAYO DEL 2018 (ACTUALIDAD),7
682.6,415.2,80.8,39.2,91.2,caldo y arroz con pato,7
1671.75,567.25,188.5,38.25,55.5,citomaterno; 'Deliciasde _ má:Contundentechupe,7
1667.25,908.08,266.83,38.92,80.58,"trozos de lomo de cerdo ramamá:Causadepa— ahum ado y una tortilla pas n a ti vascon re lleno de dehuevomontado. langostinos. Todoservi— ©Saborcitomaterno: dosobreundeliciosoti— Cebichenorteño, súper radito.",7
1261.13,1073.61,197.17,39.26,70.09,"ee ronda natural.Acompañadode _ GArrozconpatodema— máporsudiaeste ” f rejo l zar and ajay unas má:Sabornorteño.Pre— [MarianalBecerrafdirecd domingo,distin— criolla con a]' e tortitasdechoclo. paradoconlasuavecar— to s restaurantes ga|||na, CBI'BPU|CI'8, ©Rondacriollade s nedepatitohembra,",7
1260.88,1190.62,115.0,36.62,82.0,"A miabuelita:Conla cau cau, ol lu quito y — sazóndeantaño.",7
1205.84,1377.85,111.72,30.84,61.19,"M 5 l y y = cospotajes, ; A Esunarondade5 *. II a.Q_ patata ) sol.toquedeculan— espacio si donde ”” llina,carapulcra, troyelgustoespe— relajarse ¿<f Alcalordelfogón,la — otros restaurantes como — caucau,ollu— cialdelzapa— ¿¿. m. > 27 chefLourdesCuba María) qu¡toypatnta Ilitoloche.(T. al Jockeyalgo que ta y de'SaboresPerua— y Norte' (Cerca— f t¡© Talmaldel y 5 nos'(Mirañoms)yex— dode Lima)presentaron: — GCaldi— “-_Ó a — Medina) G ” pert os cocineros de ”Mamitanorteña; ' Sabor— ___ todema— ¿",7
901.25,2218.0,145.42,73.83,67.5,Gana mo de los 19 armar tu loo 3 ZÍZ$ yuc¡rcfn ¿stilt,7
1075.42,2574.94,107.54,32.98,86.94,¿QUE TIENES QUE HACER? 1. Busca el cupón con el código en el interior de la revista +mujer de las ediciones del 03 y 17 de mayo 2. Ingrese e wunz.tremo.po/registra/certoo—masmujor 3. Completa tus datos personales y registra el código que aparece en el cupón de la revista.,7
1304.8,2731.4,187.5,60.2,81.9,"¡A más códigos, más opciones de armar tu look ideal!",7
1187.55,2845.98,50.34,29.31,75.87,"e a e s t ea ea a sr — ds s s s Tome darle el uso que crea conveniente, Serán 3 ganadoras, cada una se una tarjeta de recargada con S 1,000. El dinero no puede ser retirado en sfectivo. El uso de la es válida en establecimientos a VISA La tarjeta tiene una vigencia de 6 meses contados a partir de la entrega del premio. La fecha de sorteo es el lunes 21 de mayo a las 06:30 pm Se contará con",7
256.92,369.83,117.42,44.08,86.75,"Juez anuló incautación de casas que había ordenado, pero luego la repuso",8
949.0,922.0,5.25,11.5,80.25,N y . :,8
657.2,1031.13,125.27,44.53,84.8,"Viviendas, carros y cuentas siguen en poder del Estado <Ex pareja presidencial apeló medida para",8
801.12,755.88,15.12,19.25,51.88,": y, a 2 » € A— ¡>",8
732.95,1218.0,121.58,30.89,78.05,llanta Humana y medida. Disposición Nadine Heredia fue muy cuestionada podrán vol— los predios políticos. vera sus casas de Laexpareja presiden—,8
1122.0,1408.25,132.69,34.19,74.06,"cial, quepresuntamen— terecibió3 millones dólares del gobierno ve— nezolano, Obrecht y OAS, encuentra en una de las casas de la",8
279.17,1404.5,122.17,31.67,71.83,"Surco y Lurínconsus hi— jos. Juez Richard Con— canción Carhuanchode— jóayersinefectolain— cautaciónque habíaor— dejado el lunes, pero ho—",8
760.24,1775.59,153.51,40.63,76.73,"rasmástarderepusola adrede Nadine. —. —— ee OBRECHT su sin muebles ni cuentas Dk PAK bancarias. A I 3 [K AToledoleimpusieron18 Alan, Pelo y enfermera ma , tivatrasabrirleinvestiga— G$ En las redes socia— Estoscuatropersonajes Unicamente Kuczyns— ción,peroestá prófugo les se preguntan soloafrontanindagacio— — — EstadosUnidos.Lehan por qué la justicia no nespreliminaresynoin— — pediment o de salida del incautadosuscasas(Sur—",8
1191.38,1988.75,96.12,29.62,64.62,país.García y Fujimorino e ea A ! embargado,8
287.92,2105.17,76.19,26.42,86.36,"aplica a Alan García, Pedro Pablo Kuczynski, Keiko Fujimori y Susa— na Pillarán las mismas medidas que impuso a Llanta Humana y su —. esposa si también ( están implica— dos en el caso .o Odebrecht.",8
563.87,2514.07,94.53,29.6,89.2,© Los cambios en las decisiones del juez Richard Concepción Caramancho genera— ron encendidas reacciones:,8
695.28,2683.4,80.1,29.18,83.15,O©Wiltre— ©Duber— ©Alberto do Pedrada la Rodríguez Otrora (abo— (abogado): (presidente del 5 gado): ”El juez — |) ”Esto es una Poder judicial): Caramancho dejó cosa de locos. ”Marchas y con— sin efecto lo que El magistra— tra marchas había suspendi—,8
1123.2,2803.2,58.4,27.8,84.4,do. ¡De locos! ¿Está bien,8
547.0,2817.78,51.89,26.33,91.89,do a cargo de este tema de la cabeza?”.,8
664.83,2823.0,83.17,29.83,90.83,generan mala imagen sobre los jueces”.,8
1487.93,2128.64,234.0,33.93,66.36,"coyPuntaSal) cuentas bancarias. Presuntamente,también recibieron dinero de la empresabrasileñaToledo (20millonesdedólares), García(200mildólares), PPK(300mil), Fujimori(l millón)y Villarán(3millo— nes).(M.Beteta) *]",8
1976.27,438.77,73.5,28.91,86.82,un departa— e el cual transfirió a sus hijas mayores como anticipo de herencia. Allí se habría realizado la entrega de dinero.,8
1991.8,770.0,150.6,34.4,85.4,"segunda disposición del juezConcepción, que",8
1930.62,890.12,161.0,34.0,74.62,"ayeranulópor30días la incautación delas propiedades,ca— raros y cuentas",8
1941.78,1194.61,118.94,30.56,74.06,"malaysuesposa. | ”La suspensión de esta medida solo prolong aba el sufrimiento de . mishijos...Estoya ' dejódeser serio”, sostuvo Ollan— 4 sóla me— ¡""",8
2196.09,2138.36,253.27,53.0,55.18,"m[bn© [Rm [¡11¡> genitoratsulamigajy, mayores. Otrasttres'de ee a mencion adal empresa y o",8
2381.79,511.15,141.33,29.87,71.36,"y esperarme la Sala Pe— nal Nacional la revoque. Nadine, por la tarde, re— tiróalgunascosasdesu inmuebleincautadopa— llevarlos asu nueva morada. Ala vezafirmó:”Esel linchamiento unafa— milia. Estamosaquí, no nos hemos corrido, re— cib i raport es decampa— ñanoesdelitoennues— tropaís”. Laexparejapresiden— cialtambiénpre— eu contraer",8
2456.25,987.5,15.75,14.0,49.0,y E _' ),8
2464.29,1143.57,69.71,23.0,71.14,"8 / cho,pa— '. ;' aparte desuca—",8
1661.0,2427.5,154.75,66.25,72.0,”Acto salvaje y forajido”,8
1574.05,2694.71,61.91,27.36,88.11,"C© Ayer, a la salida de su casa en Surco, don Isaac Humana arremetió contra el juez Richard Concepción Car— huancho, a quien calificó de ”necio y estúpido” Preciso que la medida que se adoptó contra su hijo (Ollanta Humana) y su nuera (Nadine Heredia) 'es un acto salvaje y forajido, de un presidente y",8
1957.2,2570.67,73.87,27.93,87.8,"ministros forajidos”. Al ser consultado, sobre el paradero del exjefe de Estado, don Isaac Humana",8
2040.4,2655.6,66.6,26.8,90.6,respondió: 'Ahora no sé dón—,8
1965.43,2720.43,63.29,26.57,85.43,de estará” Agregó que le recomendó a,8
1969.75,2766.0,88.25,30.25,90.0,la empareja presidencial atrin—,8
1997.0,2808.8,58.8,23.2,91.8,"curarse en su casa, pero",8
1990.25,2856.0,58.88,27.0,78.62,que ellos tomaron otra deci— sión. [ISV) [<],8
1456.17,151.17,97.33,26.83,90.83,MIERCOLES 9 DE MAYO DEL 2018,9
1236.0,311.54,130.46,36.77,68.69,<Por audios Idesafuerodelcongresis— A ta Moisés Mamani(Fuerza donde dice ”otro Popular) planteó Humber—,9
1399.31,718.57,234.4,35.6,64.2,"to Morales (Frente Amplio), luegodeladifusióndenuevosau— para evitarla vacanciadePedro PabloKuczynski. ”Elotro hue...secometodala'mar— maja; y yoqué,oseaqueyoquedo comohue..”,seleescuchadecira Mamanienesasgrabaciones. ”O sea, yodebopedirmásentonces, te estoy llevando cuatro (congresistas), Para Morales, todos losqueapa— rec en en los llamados 'mamani— videos' tienenresponsabilidad, yaque'ladeshonestidad debaser procesada”' Recordóquelo hecho porellegisladorpuneñoimitaal métodofujimontesinistadelos",9
1049.11,416.67,58.33,40.44,89.44,"h... se come toda la a, y yo qué'",9
863.25,1036.25,26.25,33.0,45.75,A e i o,9
1080.81,1145.69,139.81,33.88,59.44,"MF DEFIENDE aparecen el 'mamanwldeos, Mamanise¿íefendióde lasacusa— 1 ll a lionesque hizo en su contra Ken— tienen nsab¡l¡dad quien",9
