left,top,width,height,conf,text,page
1361.21,1383.79,227.07,33.93,67.57,"afirmóque'nuncadebióescuchar a su colega y Precisóquecuandopreguntócuá— lesseríansusbeneficiossinoapo— yaba la va can cia de Kuczynski,so— ;| loerapara'sacarmayorinforma— mi puntualizó. [+]",9
803.26,1361.17,54.91,31.7,64.35,—— s : es 1 e — prestó su 'reloj espía' Y A W _ a su colega fuji mori sta Modesto Figueroa para 4,9
778.38,1485.0,72.75,27.0,84.62,que grabe las conversa— clones con los ”Avengers”,9
1322.29,2141.14,51.29,43.57,43.86,y marketing o E E 5 1,9
1585.11,2785.11,91.67,20.67,83.11,CONTÁCTANOS: (511) 661 2942 | 975 952 535 info©&grupoperuferias.com.pe,9
1570.75,2848.0,63.0,39.5,88.75,©© Expo Bella Mama,9
1989.54,752.61,72.21,27.69,87.43,"©En el Apra se es— tán sacando los ojos. El secretario gene— ral Elías Rodríguez dijo que hay 'vacas sagra— das' y al toque Gordito del Castillo respondió: ”Puede haber búfalos, lo otro, no”. Uyuyuy... d ©Luego de las elec— clones de octubre, Pe— rumanos Por el Cambio reemplazará la 'K' en su nombre por la 'C! Es que las siglas de PPK, de Kuczynski, les es— tán haciendo sombra. ¡Qué feo...!",9
2399.47,943.76,78.0,26.68,86.82,"COLUMBUS ©Para García Belaunde, el fujimoris— mo manda al ruedo a Diethene Columbus no con el objetivo que ga— ne la Alcaldía de Lima, sino 'para meter algu— nos 0 sea, ”caballito de Troya!'...",9
2169.93,1181.33,92.33,30.8,83.67,HORARIOS ©El fuji mori sta Daniel — ©La Comisión de Slavery jura que no Constitución archivó el,9
1979.74,1350.33,69.41,25.63,90.3,se está 'blindando' a ningún congresista y que si algunos no asis— ten a las comisiones es porque se les cru— zan los horarios. No me diga...,9
2387.5,1360.54,83.27,26.58,88.5,proyecto que prohibía la reelección continua e indefinida de con— resistas y permitía re— anunciar al cargo. ¿Será por amor al chancho o a los chicharrones...?,9
2095.25,2229.75,126.5,37.0,46.75,” ea GR MÁ$7PE,9
2187.0,2790.4,57.0,29.4,60.4,orcaniza: E & s es,9
2333.71,2820.71,60.86,20.86,75.57,& Periferia I3/ de Santiago de Surco,9
358.72,1614.65,82.48,31.27,86.61,"easy Cordova nació en Amazonas y luego se fue a vivira Tarapoto. Al cumplir los 18 años vino a la capital para trabajar en un salón de belleza donde hizo de todo, desde manicure, maquillaje y depilación. Estudió aviación comercial y turismo porque soñaba viajar por el mundo, también llevó cursos de diseño de moda y derecho, pero más pudo su gusto por la belleza, así que decidió abrir Con 16 años en el mercado, ¿qué recuerdas del primer local en el que Era un local bien chiquito en un stand de una galería en Jesús María, empezamos de a pocos, solo tenía tres mesitas, una camilla donde hacía depilaciones, maquillaba y también aplicabatinte. Toda tu infancia pasaste en Tarapoto, llegas ala capital y trabajas en un salón, ¿quién te motivó a abrir tu propio negocio? Me puse a trabajar como manicurista, maquillaba, depilaba. Y fue mi esposo quien me dijo que estudiara para poner mi propio negocio. Pero todo se da cuando yo era anfitriona de buenas marcas y siempre ganaba en los casting, hasta que un día eligieronaunaniñade 16 años, yo tenía 22, es asíque me di cuenta que debía retirarme y opté pormi propio negocio. ¿Fue difíciliniciartu empresa? Muy difícil, porque al inicio daba para pagar el local, había mucha competencia, pero el secreto es atender bien al cliente, esto me permitió mantenerlos con el tiempo y crecer. Si vuelvo a nacer pondría de frente mi spa. Contactos años detrabajo, ¿cuál crees que fue la mejor lección que aprendiste a Aprendía no confiar en todas las personas. Ayudaba a las chicas que venían de provincia, les daba hospedaje y les enseñaba todo y me dejaban morirse a otros salones. Pero después regresaban... ¿Qué haces con el capital que ganas? Empezamos con los ahorros de mi esposo y el mío, nunca paro de invertir, los muebles tienen tiempo de uso, siempre renovamos y a los clientes les gusta. ¿Qué tan importante es parate desarrollo profesional viajar al extranjero? Viajo para poder aprender otras técnicas, conocer tendencias y para traer materiales.",10
895.08,1663.5,62.92,35.75,70.33,y r c“e¡? ensueño derriten más las que son ) '““:a cuidario:,10
2051.22,296.22,121.89,36.67,77.22,”IGNORA LA SUERTE. SOLO — TRABAJA REALMENTE DURO P,10
1025.43,994.55,84.84,31.16,86.35,"Empresa se ha expandido, ¿cuál estu laborahora? Superviso que todo vaya bien, asesoro a mis clientas y cuando puedo maquillo y pongo las extensiones, En el mercado, la competencia en el rubro de belleza es muy grande, ¿qué plusofreces? Como dice el Damos el mejor servicio al mejor precio. Busco que las clientas estén cómodas, estén todo el día, se hagan los pies, las manos, maquillaje y ee ¿De qué formate ayudó promocionarte en programas detelevisión? Muchisimo, me hice conocida gracias a la televisión, hemos regresado con fuerza al programa de Gisela. ¿Qué les dices a las chicas que trabajan contigo? Siempre nos reunimos para ver el tema del salón, en qué podemos mejorar, que el cliente tiene la razón y la atención es valorada por las que requieren de es Dastrabajo amaste 150 familias, ¿cuálestu motivación para seguir? Cuando llega una chica de provincia me siento identificada, somos como una familia, Iasapoyoyme",10
1029.82,2008.63,84.39,29.36,85.83,"madres, me afecta cuando hay niños de pormedio, también tengo a venezolana que sufren porlo que pasan y trato deayudarlas. ¿Quétan importante es innovar? Es vital, si no innovamos, nos quedamos obsoletas, hay que estara la vanguardia, siempre traigo a empresas para que nos capaciten, a mis clientas les gusta que les traiga cosas nuevas. Seacercael'Día de la Madre', ¿qué tienespreparado? Estees el día en que las madres deben vivir el momento, que se engrían, hemos hecho muchas promociones para que se sientan felices con 10 años menos.",10
993.55,2546.55,92.17,32.07,83.4,"emprendedores que desean iniciar un negocio? Quedaban lo que más les guste, talento hay, solo deben descubrirlo. Pueden comprar y vender ropa, ahora las redes sociales nos permiten hacer negocio con mayor facilidad. ¿Qué planes se vienen? Sigo abriendo mis locales, dos",10
1822.81,2770.75,140.75,57.0,63.69,e a DEI] DICE QUE EL SECRETO DELEITO ei CE—; CLIENTE C©R”VA VANGUARDIA DE LAS NUEVAS,10
2159.27,371.91,24.09,18.0,46.0,” . (o os | 0 p u ) A —,10
1503.86,149.0,87.86,31.86,86.71,MIERCOLES 9 DE MAYO DEL 2018 —,11
376.4,1399.95,79.94,28.38,90.22,"0 Sabías que en deter— miradas zonas altoan— © digas se puede llegar a experimentar cambios de temperatura de hasta 30 grados centígrados entre el día y la noche? ¿Y que las llu— vias, la granizada y la helada requieren del uso de ciertos materiales para asegurar una temperatura adecuada dentro del hogar y así asegurar su mantenimiento? La sierra de nuestro país nos exige tomar— le mucha atención al clima cuando se trata de construir. Esta realidad es evidente en ciudades como Ayacucho, Cusco, Puno, Moqueta y Áncash, pero también en al— gunas partes de la sierra de Lima y Arequipa. Y es que más de la tercera parte de la superficie de nuestro país es sierra: específicamente el 38% de todo el territorio pe— ruano, según cifras oficiales.",11
368.58,2126.55,84.64,25.64,90.61,"Construir según necesidades Lo preocupante de esta rea— vidad es que muchos de los habitantes de la sierra no sa— ben cómo proveer un mayor confort térmico a sus casas. Por desconocimiento, ellos",11
328.5,2455.9,91.3,26.1,90.2,"Un diseño que propicio un buen aislamiento térmico, ventilación e",11
374.47,2605.93,85.27,25.8,89.87,"imper me a bili dad en los techos, se traduce en un ahorro de hasta 60% en energía eléctrica.",11
1257.83,746.81,112.36,40.33,89.94,Las fuertes lluvias y los cambios bruscos de temperatura en la sierra nos obligan a tomar medidas especiales para poner la casa a salvo. Construye tu hogar para que tenga calidez y resistencia con estos consejos.,11
835.33,1099.67,94.67,21.83,89.83,En zonas lluviosas deben colocar set echos con,11
917.45,1225.73,66.09,23.09,87.09,Las láminas deben ponerse en sentido contrario al viento y e,11
870.33,2604.88,71.74,26.19,90.07,suelen adaptar planos que no fueron hechos para su realidad climática. ”Se suele copiar los sistemas construc— tipos de la ciudad y además del intenso frío no se tiene en cuenta que en la sierra llue— ve mucho y que hay que pre—,11
901.0,1162.4,78.2,23.8,89.6,pendiente a base de calamina.,11
1281.31,2260.59,77.38,23.66,89.09,Opta por ventanas de vidrios insultados (doble vidrio) que aíslan muy bien el frío. Los marcos recomendables son los de madera o PVC. Estos últimos son grandes aislantes térmicos además de impermeables.,11
1337.53,2588.67,99.17,27.37,89.97,"parar la vivienda para eso”, comenta la ingeniera Nancy Barrenechea. Techos especiales, pisos de madera y ventanas con doble vidrio son algunas de las principales instalaciones a considerar para construir",11
1621.67,1153.42,82.64,25.3,88.67,"Por medio de planchas transparentes de policarbonato en los techos se puede proveer de mayor iluminación a la vivienda, además de propiciar el ingreso de mayor radiación solar para aumentar la temperatura interna.",11
1921.09,1559.39,67.3,26.24,84.94,"ese d ea viviendas de la sierra no son una buena opción ya que enfrían la superficie. Por el contrario, los pisos de madera (como la machimbrada) con base de piedra aislar el",11
1892.1,1808.4,69.7,25.6,85.4,También prefiere las puertas de madera sobre las de metal.,11
1874.11,2165.15,60.74,25.59,84.89,"Permiten que el agua caiga por los bordes del techo y no seempocen, hasta llegar a los tubos de drenaje. Estos deben ser de PVC por ME",11
1845.92,2586.95,75.15,25.85,90.44,"un hogar de diseño biocli— mático, es decir que pro— dicie un ambiente cálido y seguro para quienes habi— harán en él. Toma nota, que estas son todas las claves de Maestro para construir una casa en la sierra.",11
1054.41,2831.41,68.39,18.46,88.02,"Agradecimientos: Nana y Barreneches, presidente de la Comisión de Inspectores Técnicos de Seguridad en Edificaciones — IRSE del Colegio de Ingeniero del Perú. Contacto: 97570—0001 Fuente: Diseño bioclimatic de una vivienda rural en Yanacolpa, Provincia de Huaytará, Departamento de Huancavelica y en zonas similares — SENCIO",11
1920.25,1732.0,78.0,24.0,86.75,ambiente de la humedad.,11
2332.14,1479.0,87.95,28.09,71.0,debe cambiar de forma periódica ya que con tiende a malograrse'Una forma de mantenerla por destiempo y además evitar filtraciones internas es audicionando plástico,11
2354.0,2022.0,89.5,28.5,86.75,almacena el calor solar del,11
2316.33,2148.83,105.5,27.0,80.33,aumentarse captación pinta los muros exterior es con,11
2316.25,2553.25,58.75,23.0,87.0,un material local muy,11
2370.33,2674.92,59.92,25.5,70.58,"construcción de la base de los mayor, estabilidad y la humedad no",11
2337.25,2743.5,67.25,32.5,75.75,traspasará por el piso:,11
459.29,1279.43,118.57,39.2,69.39,"?raa:_egríad?su sometieron amilia amigos, EyviAgredaMar— a sexta a Operación ) caja mar quina que fue A quemada salvajemen— pregunto por su teporsuacosadorCar— los Culpa Vacas(36)a hermana y Hordodegnbusen Mira— — tranqu¡|a, ores, yadespertóy pu— íi%decirsusprimel'aspa— mueve la cabeza abras. Ico * —y ”El lunes hicimos una y e e reuniónclinicay secon—",12
371.4,1702.2,111.0,59.0,91.0,la hora por el Mundial,12
275.31,2355.32,68.79,27.05,89.16,"© El Mundial de Rusia no solo será una oportunidad para alentar a la selección, sino también para reunirse con la familia y, de paso, RE comer rico. Según E la Asociación de Ganaderos del Perú, durante los partidos de las Eliminatorias aumentó considerablemente la ven— ta de cames para parrilla en Lima. Por ello, los comercian— tes esperan que en junio la venta se cuadrupli— que. De acuerdo a cifras del Ministerio de Agricul— tura, el año pasado cada peruano consumía 6.2 kilos de carne de res al año, cifra que aumentaría considerablemente. Otros que están muy entusiasmados son los",12
706.96,2536.7,67.1,27.49,86.28,"fabricantes de cilindros, (s pues en el Centro de Lima la venta de estos artefactos se ha triplicado. ”Antes 2 o 3 a la semana, ahora llegamos EE e e el asadores para hacer sus parrilladas”, comentó una vendedora en la avenida Emancipación. Los precios varían de acuerdo al tamaño del asador. Por ejemplo, hay cilindros desde 250 soles y súper parrilladas hasta mil 200 soles. (T. Paredes) G",12
779.7,433.0,27.9,16.4,47.2,/ — — & / l 2 o 57 Fer.w,12
998.25,1443.75,357.5,34.0,61.75,"sideróqueyapodíareti— rarse(lasedación),por— quesuevoluciónfuebue— na...Lapacienteconver—",12
1707.43,1169.91,180.55,32.0,65.49,"doctorElmerPe— la cabeza y 'gra— cirugiaplásticay nada. ”Hemosconversa— N quemados del hospi— — doconellaylehemosda— ) tal'GuillermoAlme— dormimos para que siga > narajenLaVictoria. adelante”,añadió, Ayerellafuesometi— — Eldoctoraseguróquela daasusextaopera— jovenpodríavolvera ser ción,quedurócuatro — sedadasifueranecesa— horas y en donde le rio. ”Todoesrelativo,to— / If quitaron tejido mue r — doestáenrelaciónala /_ _4 todelaespalda. evolución, peroeltrata— LEDANANIMOS mientoestá haciendo Endiálogocon Tro— efecto. Susriñones, cora— me,suhermanaSandra _ zón,aparatodigestivoy AguirrerevelóqueEyvi respiratorioestán fun— despertóluegodela inter— — cionandobien”indicó venciónyloprimeroque — Perea.Aúnnecesitaque hizo fue preguntar porsu — ledonensangre.(Sonia hermana Mónica.”Gra— Obregón) [+]",12
1765.23,341.35,76.39,26.16,85.1,"&No le muestre temor al acosador, déjele en cla— ro que sabe de sus intenciones. ©No le conteste llamadas ni correos. Guárdelos como prueba. ©Denúncielo ante las autoridades y pida protección.",12
1746.12,620.47,167.18,33.94,77.65,"casa Dios pudodeciral— P gunaspalabras, habló más donantes conmipapá(Ladislao), de sangre yasabíaqueélestabaacá (en Lima),escuchóto— sa ydicemonosi— domientrasestabaseda—",12
1796.2,757.2,123.8,28.4,47.6,"labos”, informe da. Estátranquila, mueve",12
1465.67,1667.5,187.0,58.0,89.17,Piden ayuda para peruanos en Venezuela,12
1146.66,1875.44,64.84,27.22,89.28,"Acciones concre— © tas para ayudar a los peruanos de viven en Vene— zuela, en medio de la aguda crisis, sin empleo y dine— ro para alimentarse, pidió al Gobierno el parlamentario",12
1103.86,2109.71,59.93,31.21,65.43,anodino Mario Zúñi— —— > ”Se estima ¡;'% nr vuela hay 4 % Aal,12
1999.69,2021.5,61.77,24.88,73.46,"a d sus enfermeda— des”, agregó. g ea mo e | Carlos Fernández— — Prada, que hace 31 semanas había rogado ayuda, se suicidó en Mara—",12
1825.25,2172.62,65.25,25.88,79.38,*7 peruanos. La — caibo. La Cancillería informó,12
1816.0,2298.33,53.21,25.74,80.24,"que se le brindará ayuda / vive situacio— a la hija del fallecido, que (3/ nes extremas ee a & * como buscar entre — la, para que retorne al Perú. * — la basura sobras — El cadáver será cremado, (T.",12
1661.22,2535.56,135.78,40.67,49.78,Ry ©&I—EDDMIE 'Jhosyk P complicidad deuna doWuemó € m,12
2413.38,1086.36,67.67,28.23,84.29,"© E ie gatos tendrán en Lima su primer 'show internacional de mininos' con concursos, exposi— ción [incluso 'razas raras' como el británico, el de pelo ondulado y el sphinx o sin pelo) y campaña de adopción. El evento, 'Latin Pet”, orga— rizado por el Club Felino Peruano, será gratuito del 6 al 8 de julio en el Vivero del Jockey Club. Reunirá a dueños de mascotas, cria— dores, veterinarios y 'cat lovers' para promover el cuidado de los pequeños felinos. Para participar hay que registrarse en www. latinpet.com. (LM.) o",12
2405.4,2452.4,66.13,26.7,89.66,"©9 Gran caos y desespe— ración generó ayer, entre los usuarios, el cierre de las estaciones Bayóvar, Santa Rosa y San Martín del Metro de Lima, en San Juan de Lurigancho. Según la Autoridad Autó— noma del Tren Eléctrico, la suspensión de inició a las 8 de la mañana como medi— da preventiva, luego de que se registrara un chis— paz en uno de los trenes que tenía como destino Villa El Salvador. Cientos de pasajeros tuvie— ron que ser retirados de dichas estaciones y espe— rar más de dos horas, formando inmensas colas hasta que se restablezca el [+]",12
754.34,539.95,58.59,26.44,89.54,"renunció a su trabajo tras la difusión de un video en las diferentes redes sociales. En la grabación se observa a un alumno profun— demente dormido, la profesora Lisa Houston sube a su carpeta y trata de dole en las mejillas, jala el cabello. Pese a esta agresión, los padres de familia han pedido el regreso de la (e",13
278.83,813.0,73.67,26.17,91.17,Una maestra de la escuela secundaria,13
1086.6,664.9,182.1,37.1,71.1,(delespaldalplateas la sensacionidelZoológico [República porque jp os a modelo para (ii1ñ©&!) fotografa particulardE!la],13
1554.5,741.75,56.38,23.62,85.5,” frente a y la gente bastante …,13
1640.76,1129.97,167.59,30.69,75.17,"AUMENTAN CASOS osresfrios, tos,rinitisalér— gica y complicaciones que valdese asma hastain— lecciones respiratorias , agudas yneumonía,empiezan afectara muchas personas esta temporada en que son más frecuentes to s cambios bruscos detemperatura(porusodeaire acondicionado, faltado ventila—",13
1679.52,1614.81,127.71,29.95,68.86,"”El asma, porejemplo, afec— taa muchosenLimapor factorescomoelaumen— fe modela humedad. Inclu— % sive,lascontinuas ema— naciones humo y ga— se s de los incendio s de es—",13
1294.0,1631.5,171.75,44.25,85.75,23Camb¡os bruscos de temperatura,13
2042.5,371.0,91.5,40.5,60.25,"mal .,…… l >",13
1647.0,1351.6,97.8,28.8,81.2,"ción en los vehículos, contamina—",13
2343.07,575.66,74.04,26.87,88.32,"Por haber protagonizado una pelí— cula en torno al Tíbet, región que se encuentra en conflicto con China, el actor estadounidense Brad Pitt tiene cerradas las puertas del 'gigante asiático'. Sin embargo, no es el único. Tampo— co son bien recibidos los cantantes Lady Gaga y Justin Bieber, conside— lados una 'mala influencia' para los ]ÓV8I'1€S chinos. Mientras que en Malasia, Beyond está vetada por sus vestuarios sensuales.",13
2287.25,1031.83,112.92,49.33,76.08,"<Recomiendan jarabes EL de ajo, cebolla, zion y nabo para combatinos: ='",13
2307.35,1252.13,116.09,32.22,62.61,"laneumonía, por loque el Minis— triode Salud indique piel be— bétienetos, ficbre,respiración rápida, can— rancio y llora constante, debe ser llevado de inmediato al médico.",13
1931.2,1426.65,122.05,27.75,78.55,"ción y hasta el desabrigarse, PARA SU SALUD , porquedeprontodelfrío fo¿7< sq Contralasenfermeda— pasamos alcaloroalrevés). 3 a desrespiratorias, el ser—",13
2264.0,1611.53,158.27,26.87,66.73,"vicio de MedicinaCom— ple mentar ia de EsSa— 3 lud aconseja jarabe s 5 caserosdeajo,cebolla, ki on y nabo con mi el de ] abejaolasopitadepo— ) llo,por suspropieda—",13
1839.56,1991.52,109.01,30.86,74.89,"pueden tas semanas pueden pro— des fluidificantes(ayu— causar hasta infecciones respi— dan a eliminar secrecio— M y arterias — *——* — ©3 nes). Tambiéninhalacio— infecciones teladoctoraDorisLaChi— ee n es de euc a lip to retama ¡ M ra,neumólogadeSalud p alivian lasvíasrespirato— reSplrat0rla,s enCasa. ) riascongestionadas. y peligrosa hasta mortales (Isabel Medina) [* ©Más vulnerables: Niños meno— _ nas. Solo descanso, infusiones y — ©Alimentos ricos en vitami— res de 5 años, las gestantes, los — abrigarse. na C (cítricos), frutas y verduras ancianos. ©Lactarcia materna mejora (antioxidante). ©Resfrío simple: No medici— defensa de bebés. ©Ventilar ambientes y no fumar.",13
1091.09,2431.64,70.36,24.18,51.45,22 Ipascostenbote ten] — mt escritos y sorpresa! Parque de las,13
1612.25,2279.0,107.75,23.0,78.0,PRIMERO EN EL RANKING,13
1631.0,2343.33,176.17,64.17,87.17,San Miguel con más n n qu ull mos morosos,13
1777.17,2471.0,54.0,30.83,84.17,"G» Con un 26%, San Miguel",13
1285.07,2545.04,86.22,30.48,80.63,"E dom¡ngo celebra (=3515 lidera como el distrito Parque de la Expos¡c¡on garra' y con inquilinos más morosos. Este v¡ernes m ¡ Le siguen San Isidro (18%),",13
1699.58,2767.98,61.02,26.46,85.12,"Lince (18%) y Cercado de —| Lima [12%). 4 Según el portal 'Inquilinos Morosos', se atrasan de cua— tro a cinco meses en el pago. Agrega que el porcentaje de deudores subió a 26% en abril último, debido al menor crecimiento econó— mico y la caída del empleo. [SOD] [e]",13
2230.4,2352.4,195.0,57.6,85.8,Idioma francés en cinco continentes,13
2160.0,2484.29,60.71,28.71,63.43,"em Además del inglés, © ie ii",13
2290.88,2734.87,71.83,27.2,89.17,"idioma de uso en los cinco continentes, con gran respaldo para el éxito profesional, económico y empresarial. Johann Turben Delof, director general de la Alianza Francesa, reveló que Perú está entre los países de Sudamérica con más estudiantes de francés que buscan competitividad y más de mil peruanos estudian en Francia, donde la educación universitaria es gratuita. [LM) — ©",13
1018.75,149.62,109.88,28.25,88.5,14 (DEPORTES) MIERCOLES 9 DE MAYO DEL 2018,14
323.93,840.37,125.67,29.57,73.92,"este Tigre' nolo domestican. El pasadosábadoSde mayo, mientras usted y otros millones deperuanosdesayunaban, Ricardo Garecahacíalo mismo perdon unal sabor deboca. El hotel Country Club'deSan Isidro feel punto dela reunión del seleccionador nacional conEdwin Oviedo(presidente dela Federación), Juan Carlos Obligas (director deportivo) y Juan Matute(secretariogeneral), agenda tuvo nombre propio:Claudio Pizarro. Según Exitosa edición noche, en la mesa se habría propuesto a Garecaelnombre del Bombardero' para quelo llevela Mundiales caso Paolo por el TAS y quede fuera de Rusia 2018. Respuesta del técnico fue directa y antena miradaimpávida de los Garecatambién demostró enfáticoenotrotema de la agenda:noestaríadeacuerdo",14
2019.4,1377.4,126.4,81.4,49.6,"s ""oTEI!?G3%KR¿(CSAXYAuE N ; |",14
815.76,1541.24,147.97,43.09,69.61,"conjugar a mis to so contra ArabiaSaudita, el junio | HABR|A BRQP'UE5£7% enSuiza.El partido está UE$GGNV% programado, pernel DT expresó GÍUDIGÍENX M su fastidio.También se le GUERREROS propuso jugar ante Escocia en el ra ” ”Monumental', pero descartó SANG|0NADQ,",14
339.07,1896.3,117.07,28.56,79.14,"esa posibilidad por lo que ya se puso la venta las entradas para el Estadio Nacional. Lapreocupaciónen charla sesentóante complicada situación de Guerrero en el TAS, pues las últimas informaciones que llegaron anuncian que podrían aumentarle la sanción. Losdirectivos analizan la mejor variante en caso el '9' esté ausente Rusia. [+)",14
2018.07,2279.75,93.93,30.3,76.64,"GEL 14 DE MAYO VENCE PLAZO PARA PRESENTAR PRENOMINA AL MUNDIAL Y LA FEDERACIÓN NO SABE SI INCLUIR A PAOLO …Z&ÓE 7 ARRANCARÁN los tratamientos de la selección lores IR ”BLANQUIRROJA! fir Re el el ”John Holden', que vestirá & jugadores en el Mundial.",14
674.56,2607.59,57.86,27.18,86.24,"Unsombre confía, otros esperan. Paolo Guerrero anhela ver ya su nombre en la lista de 23 jugadores que irán al Mundial, pero en la Viena se viven horas de ”Espero ver mi nombre en la lista, estoy muy confiado. Sé que todo va a salir bien y voy a estar en el Mundial, por— que soy inocente. Por esta injusticia, el pueblo peruano lo sufre”, expresó el '9' a América TV. En la Viena, hay movimientos en llamadas y correos /electrónicos. La Federación hizo la consulta a la FIFA sobre si incluir a Paolo Guerrero en la lista final de 23 seleccionados sin saberse el fallo del TAS. La duda es qué pasaría si se aumenta la sanción a Guerrero y no puede VOLANTE BEEF jugar el Mundial. ¿Perú perdería el cupo o podría reempla— ' zarlo? El 14 de mayo vence el plazo para que se entregue A [ N_ f M la prevista de hasta 35 futbolistas. La nómina final, la de y 4 < %o€: ge3¿¡|al .¡.Í3¿'Í'5%Í. 23, tiene como fecha máxima el 4 de junio, donde la ”bico— ” A formg,? CLAU¡O 3 lor ya espera conocer el fallo final sobre el 'caso Paolo: © *",14
2581.85,2589.31,65.46,36.77,68.15,Si Paolo ho va al Mundi ] es un cratk” / ©WILDER CART,14
6.33,2290.67,49.17,31.83,58.83,»] ( n con E opa,15
27.75,2809.75,59.25,29.5,73.25,stir a 1 CARRO,15
1663.0,152.5,112.5,30.25,81.0,MAYO DEL 2018 …J&,15
1698.14,293.0,126.29,25.43,84.57,POPULARES PARA PERÚ— ESCOCIA COSTARON 99 SOLES,15
1758.45,867.83,63.28,27.08,89.65,"©9 Oferta y demanda. La Federación entró en ”modo Mundial' y dio a conocer los precios de las entradas para el Perú vs. Escocia, el 29 de mayo en el estadio Nacional, donde se des— pide la selección antes de viajar a Rusia. Las populares costarán 99 soles, Oriente desde 249 y Occidente a partir de 399 soles. A pesar de las reacciones que se dieron en redes sociales, a favor y en contra, los boletos bajaron de precio en comparación al partido de repechage con Nueva Zelanda. ”Si uno paga para un concierto extranjero, que pague por la selección”, ”Vale la pena si estamos en el Mun— dial” y ”A romper el chanchito”, fueron algunos comentarios de los hinchas en el Twitter. [+)",15
558.67,1033.33,137.83,26.67,77.17,SRUIDÍAZ LLEGO CON HARTO RESGUARDO POLICIAL,15
