left,top,width,height,conf,text,page
405.6,2092.1,127.1,30.7,80.6,Undescoquetefalte realizar... Tomarme un año sabático para viajar porel mundo.,26
345.86,2284.57,121.29,31.36,82.71,"Situación queenfrentarantee!l público... Generalmente me río de todo, encuentro en el público un cómplice.",26
410.79,2439.93,134.93,29.21,87.64,"¿Algunaveztehas sentidoacosada? Sí, sufríamos laboral sexual hasta que me botaron yyo me preguntaba, ¿mecreerán?",26
333.64,2578.71,111.57,32.79,72.79,"¿Tehas hecho arreglos quirúrgicos? Sí, nariz y busto. Tendría ningún problema de hacerme más.",26
350.4,2739.0,135.0,30.7,82.4,"Tuactorpreferidoes... Tengotres: Christian Meier, Salvador Del Solar y Carlos Alcántara.",26
247.71,2842.14,19.14,22.43,66.0,"” — l 4 m D g,",26
1149.11,1198.89,97.72,28.72,88.5,"No, porque un cargo público de elección popular es una responsabilidad queno me | siento capacitada para afrontar.",26
1071.09,1365.82,136.0,32.45,84.91,¿Tienesnegociooempresa? Soy terapeuta. Negocio es mi consultorio y es mi mejorempresa.,26
1029.83,1480.83,66.0,37.33,58.0,pf ne e Elroy el negro.,26
924.5,1814.25,146.5,37.75,64.0,Mayor virtud... La perseverancia.,26
1123.56,2167.89,110.89,30.67,67.89,ea eo Tengouna perrita rescatada que se llama ”Morocha',26
1119.88,2474.38,129.44,35.44,73.31,"¿Cómoafrentas lascríticas destructivas? Las críticas sonopiniones. Las escucho, lo q|u<_eáiene que quedar, queda, ylodemás se olvida.",26
984.5,2644.75,152.5,31.5,86.0,Tefakacomprar... Unacasaen la playa.,26
1780.89,151.11,98.22,29.44,83.89,SÁBADO 26 DE MAYO DEL 2018 (PARA ELLAS) 27,27
1175.9,448.9,141.9,91.8,47.4,' DE GPO l N e a E a ei,27
1885.47,701.58,98.84,33.53,78.26,"CHAQUETA %ñ Además de la palabra, existen transformas xDealgodóny ma % en las que nos comunicamos con los demás.",27
1679.35,805.32,90.71,30.65,79.0,"concierre, encolor Una de ellas es a través de nuestro caminar. plomo. Estupenda Aunque te parezca descabellado, encaja esbásicapara paso que das imprimes tu sello personal. Carolinaporque, al serancha, la protege",27
1763.97,1571.61,83.11,36.23,60.31,"y leda posibilidad de ; [(Íñlííííñj eo ii ñ e Comunicas erguida señala o> poderypresencia, y t e perotambién s i — D un poquito de — para enfrentar a los desafíos que () X | =x setepresenten. ZAPATILLAS JA | ¿ — Además, xTotalmenteblancas perdida, puedes ser f TOP eidealesparadíasde en E ) xDeencaje. Esel |Palsoool?o|c?mpgo el e e a playa, Unaeleccioón phacerlate£lí [Q,';f,?£3oo %í%íá? ii a tenidadepaseo. % Muestras ese deportiva' Si desánimo. Si marcando cada ademástienes la pr ta ii 2 > seguridad y Sexy. y lacolumnacurvada, confianza. Suele pqedesenco_ntrarte caracterizarse, tr l ste ogg obla da 07 pg e poralgún asunto. i el i ( a E l ” rasgado. Pequeño, lo que hace lucir x¿Tucaminarse ea a l n p rápidos, aunque e P ” » el tiempo note y LENTES apremie, revelan ee que eres inquieta decaderas? Sies protege sus ojos delos es rayosultravioleta. El eu a ] personalidad modelo delas gafas E gerfalcon lnforma de su de clin a sen tus , ] decisiones.",27
2291.52,2582.25,94.93,27.77,83.11,"Estudios revisados confirman que 35 onzas de este producto contienen aproximadamente solo 42 calorías, menos que en una alvera común. Por esta razón, puedes incluirlo abundancia entes comidas. Si bien el holanda es originario de Asia Central, también se cultiva en nuestro país. Para",27
1090.58,2700.91,67.46,28.14,68.55,"china, el holantao, | no puede rr | ] faltar. Lo que muy pocos ” 777 3 W ay y W I saben es que el mayor valor — > % — 1 A nutricional de esta verdura ea y F F oriental radica en su alta a 4 H l & ; |¡ & concentración de vitamina(C, aprovechar sus propiedades, 20 0 uU d excelente para fortalecer el sistemainmunológico y cocinado ligeramente, vapor o",27
1750.92,2842.62,109.77,27.46,77.08,"prevenir resfríos, sobre todo en estatemporada. salteado. Mantendrá su textura fresca y crujiente.",27
779.88,2428.25,112.62,52.75,52.12,Consuelo fresco y crujiente % ee e ese,27
1478.13,180.07,75.27,51.2,66.53,a a y pr f canal E de '!Iauz veme 2” para alentar G _!,28
1595.61,959.93,105.18,28.26,80.59,"uso Díaz no sabe nada de ruso, pero tiene muchas ganas de ir al Mundial para alentar a la selección. Dice que el idioma noes un impedimento, por— que sus dietas' reabrirán todas las puertas. Suso, ¿yatienes tus pasajes para Rusia? Todavía...estoy esperandola invitación un canal para armar mis maleta sen dos horas y vuelo alaeropuerto. ¿Estu sueño estaren el Mundial? Claro,esunadelas fiestasmásgrandes del de— porte y Perú está yendo después de 36 años, es un hecho histórico. ¿Yestás aprendiendoruso? Enseñaron unas palabras, pero se meolvi— dan, el ruso es muy complicado. Debe— ríasercomo ensalada rusa,quees — facilitado hacer. Hablando de comida, ¿ya prepa— erastatus dietas mundialistas? r? Claro, tengo dieta del Mundial Y* Rusia, que es: para hacerlo con PA astucia. Y la dieta del tamal, para hacerlo en el Mundial. Algunadietaenhonor a nuestros futbolistas... | Ladietadela'foca'paraha— ¿ celoron el queemboca,ja, ' ja. Y dieta de PaoloGue— & rrero, para hacerlo contigo primero. ¿Alguna vez estuviste con un futbolista? No, solo me han tocado vivido — res. Hasta ahora el Loco' me debe plata, espero que lea el diario y me pague. ¿Tienes ganas detenerpareja? Meacabade hacer una limpia el maes— tro porque estaba em bruja da y ¡$_¡_ : loshombresnimemiraban.Esperoir Y*",28
1566.83,1798.67,86.83,33.33,56.33,a Rusia y conocera alguien interesan ),28
270.9,2752.2,68.7,34.0,73.0,tema yo creo en ti' con E ífentac¡on 1051marv l,28
1053.32,2400.52,68.15,29.55,83.0,"©» [3 chollo E lan— hará una versión 'power' de su éxito 'Porque yo creo en ti', con la participación de 'Son Ten— tación', Guajaja, Orquesta Candela, Josimar, Bartola, Katy Jara y otros. ”Soy un fanático del fútbol y del",28
994.2,2540.0,62.0,36.0,33.4,e i es s o,28
1044.46,2713.62,65.36,26.59,87.08,"amigos para seguir alentando a nuestra selección con mi can— ción, pero en ritmo de salsa. Será una versión ”power'”, comentó el Aunque no estará en Rusia, dirá presente en Moscú a través de su canción. (E. C) G",28
1547.6,2802.5,46.6,31.5,79.0,ee | ”Hoy estaremos desde las 8 de © 1,28
2351.96,771.72,65.65,32.39,75.35,"Alessandra Fuller contó que el perso— nave que interpretará a a e i e '>W ” totalmente diferen— te a 'Rossy' de Ven, |” baila quinceañera”. ¿á_ ”Este proyecto, digamos que es más | adulto, más madu— — ; ro, lo que hace que / rq",28
2365.17,1530.24,65.53,27.21,82.62,"ol para todos, que nos vaa'despegar' — ¿ mucho de nues— | f ee ***y No seré mala, pero digamos ea t el muy maduro para su edad, prácticamen— te es todo un desafío para mi”, afirmó la actriz, que se encuentra feliz al lado de su pareja Pablo Heredia. E nación para crecer como persona día a día, creo mmucho en eso y bueno estoy e feliz y enamorada”, r ¿Yaestánconviviendo? Más o menos. Vivo la mitad del tiempo en mi casa y la otra mitad en casa de Pablo con nuestra perrita, que es nuestra hija. (M. Casas) 0",28
2371.36,2053.0,78.82,35.36,89.27,que en Te volveré a encontrar hará un personaje más maduro,28
1610.1,2653.48,59.62,28.28,88.0,"C> e te aprenda a prevenir y no enfermarse”, dijo el doc— tor Tomás Borda al anunciar su primera campaña de salud en la 'Casa de la Cultura', en",28
1589.6,2840.8,69.2,27.2,89.8,la mañana hasta el mediodía,28
2329.18,2321.0,114.82,29.09,91.0,"atendiendo en especialidades de medicina general, reumatología, cardiología, oftalmología, se harán",28
2352.15,2446.0,86.23,29.85,85.77,"exámenes de Papanicolau, de sangre y mucho más”, contó Borda. ¿El público harespal—",28
2395.25,2656.83,71.58,26.92,88.42,"Sí, estamos muy con— tantos con la aceptación del programa. (M.C) G",28
2422.75,2756.5,102.75,49.0,61.5,|z3Porque ”Segunda opm ¿,28
2401.8,2826.9,81.2,38.2,70.1,tiene buena aceptac¡on ) inicia campaña de < et el,28
1719.75,151.25,95.0,28.5,81.62,SÁBADO 26 DE MAYO DEL 2018 (AVISO) 29,29
1387.25,438.25,184.45,56.7,61.6,"| nei ! (Gena DINERO os EFECTVO, x &f…eo7 i s| EN Feng ” TÚ puedes ganarte uno de ellos:",29
2087.18,803.8,79.8,39.16,75.36,"o 02 premios de S/ 10,000 , / o 04 premios de S/ 5,000 Ú 0 08 premios de S/ 1,000 e a l 'Ex ee 'l?¡ o 900 premios de S/ 100 ) y $00 premios para Lima y 500 premios para el Norte",29
2012.4,1245.8,115.6,26.8,89.8,debes completar una columna para,29
1882.13,1733.39,98.55,38.61,65.35,"Creerte los cupones 7 A, A ' | _ A que necesitas y pétalos (á )o?G en tu cartilla del / 2 < ) BUSCA ,á£/ f.'s_uA USÍCUPONES a d =",29
803.25,2064.75,29.5,31.0,45.0,X . EEE ”,29
2095.07,2300.14,85.36,26.79,85.36,"Y si no ganaste, llena tus datos en la cartilla, depositados en las ánforas",29
1205.78,2478.25,85.08,42.22,50.3,". eo F | autoridades y participa ra i y — |S pr E enla parte superior : ,] i [dellta ci:) %==£—9Á ; > *2 — ” jy es e r 'f' t o;oi£:: del ganar ) — P",29
651.92,633.04,63.29,29.6,85.12,"G> sobre las burlas que recibe Miett Figueroa, en las redes sociales y por parte de 'Peluchin”. * — ”Creo que hacerla sentir mal, por su aspecto físico es lo más bajo del mundo”, indicó. Dijo que se siente atacada por'Peluchin”, El bullying es malo. (M. Casas.) [+]",30
1333.0,776.0,55.33,35.0,66.0,ice que e Dice q mltñ£Lob,30
1880.18,553.69,60.03,27.03,86.28,"G» El salsero Cosima aseguró que un verdadero cantante y no un imi— tador, y que tal vez eso le jugó en contra para haber caído en sentencia en 'El artista del año' ”No me milano con nada porque soy cantante real, verdadero, no soy imi— tador. Si otros tuvieron mejor puntaje fue porque son imitadores, yo no”, afir— me Cosima, quien tendrá que vencer a Miett y Yahora para seguir en el reality. ” ”No me importa si soy 'El artista del año', solamente sé que soy un buen artísta”, finalizó. [<) ]",30
2394.55,693.1,68.0,27.7,84.9,"e contarles los chismes de 'Chollywood”... ERICK OLORES llegó ayer a Kiev, Ucrania, donde hoy se jugará la final de",30
1321.88,1573.06,123.34,33.84,76.38,"Sabatersiga hablandome y ella yqueeldominicano, con tanta belleza' sea incapaz mantener contenta a una mujer. 1 ”Discúlpenmeportodo ese bo— y chornosomomento,dever— parque meda vergtienza” di— ee n llegó acompañada de Kevin Blow al concierto de Dis—",30
1194.62,1356.25,117.25,34.5,66.12,y . íchelle$oife¡'añrmóqlle > 4 leaver git enza que Erick,30
1276.2,1854.5,132.2,43.4,58.7,"Ef_icksigue hablandodeti, dijo quelo engañaste o / amigo. Parecequenoteme —",30
1414.05,2017.9,117.65,41.4,66.25,"J Quesiga(hablando)...es y ” 1 lan1entab[e,noqu¡erosaRé t25:? lplartelbíaloc'or_ cerrada deél. e el su belleza no le ha sido sufi—",30
1424.83,2102.33,120.0,53.67,66.83,cien te para mantener una C£$r J N,30
2371.21,1219.28,63.98,26.85,82.96,"e a y contó que la ciudad es maravi— llosa y que las apues— divididas. E FAGALY MEDINA cele— bro con champán en mano el regalado que le hizo su esposo, ALFRE— 20 ZAMBRARO, un auto marca Masera— ti del año que cuesta 100 mil dólares. Asuuu...",30
1867.82,1427.09,128.45,37.0,83.55,"Estoy mi mejormomento. go tres programas en los cuales trabajo, colome faltaría, ¿qué...?",30
2121.31,1581.03,97.39,30.64,80.14,"Elnoticiero...(risas). Yo feliz Dios | MÓNICA CABREMOS haceeso,nadiemás. publicó una foto en ¿Cómo tomas susofensas? sus redes sociales vis— Soy feliz. Estoy estable (en una re— tiendo prendas Gucki e lación) élestácon una conotra. irónicamente escribió",30
1831.5,1782.0,136.75,39.65,71.05,"Además, yo voy de men ENFRENTADÁAMHL£$ mas Dentro lado, Michelleesta no— n cl_¡etendráen'£lartistadel emi año' un manos mano con Mi— ) lettF1gueroayaf¡rmóqueno",30
1790.6,1935.6,85.2,27.0,48.4,A quiñremásbroncascon gp : 1,30
2427.5,1697.0,48.17,26.33,72.17,que no tenía un sugar 1,30
1814.25,2051.75,140.25,59.5,72.25,"/pb | disculpas, pero si ella",30
1798.92,2550.28,61.99,27.82,77.8,"l showed su proble— trabaja dl Tambiénafirmó ”” ma”indicó pero que trabaja duro biénafirmó quete carrera (M.Casas) para darse sus gustitos. — Qué buena... A propo, —— — || STEPMANEVMEN— a n p 7 — || VUELA dijo que su novio €a Lucecita Caballos ei a quienes no veía hace & l s , calificó como una mi esposo y vivir nues— tres años, y así regresar = & sociales y no le gus— — ”luna de miel' su recien— — tra pasión. Parecíamos recargada a Lima. ' ""' ta andar en chismes y te viaje a Colombia con recién casados, como ¿Quéproyectos vie— de farándula, por eso |_ su esposo Ronny Ríos, enamoraditos”, contó la E l N ell ella trata de no hablar ' donde han encendi— conductora. | L— a del tema. Hunmm... 3 do la llama de su amor, Eraunviajeposter— do a grabar unos videos — 84 — || VELA comen— después de 20 años de gado... para un nuevo programa * tó que en breve abrirá matrimonio. Sí, habíamos planea— que anunciaré en unos — un nuevo negocio en — ”Acabamos de regresar — do hace mucho tiempo días, y con más ideas = ]| su natal Ica... Somos .» de Colombia y pasamos — tener un viaje juntos, para ir concretando. Me — ;.= fuga porque mi amor— 3 unos días maravillosos, pero lo postergába— encuentro muy positiva, ;=”) || cito está listo para 2 — fue como una nueva mos. Además, he podido — condenas detrabajar. — bailar pegaditos... 2 de miel, un tiem— ir a visitar a mi familia, (E. Castillo) — —— l a —",30
1623.43,151.29,83.57,27.29,90.86,SÁBADO 26 DE MAYO DEL 2018 31,31
383.1,432.5,58.9,28.9,81.4,ee QUE QUIERE GANAR PARA SUS HIJOS Y EL PAÍS.,31
392.23,642.0,71.23,28.64,88.68,"36 AROS, Y HOY PODEMOS JUGAR Y GANAR JUNTOS, PORQUE LLEVARNOS DE VUELTA, IMAGINA LO QUE PUEDE HACER TODO UN PAÍS UNIDO.",31
2340.6,1189.2,83.4,31.4,79.2,SÚMATE AL MOVIMIENTO EN: ASTRE,31
1938.75,1869.25,163.12,60.62,83.5,LA REVISTA FEMENINA © MÁS LEÍDA DEL PERU,31
2351.25,2280.5,94.75,39.0,90.25,32 PÁGINAS Y EN,31
2325.63,2431.42,125.68,34.84,87.79,FINO PAPEL COUCHE PAREJAS | CRIANZA | SALUD GOURMET | MODA CONSULTAS ÍNTIMAS HORÓSCOPO DEL AMOR Y MUCHO MÁS...,31
2463.5,2667.25,47.0,43.75,74.0,A Solo 1 Sol,31
1083.62,148.62,97.75,30.25,64.25,r uu . ¡ 3£'£_;5_DE.M AYO DEL 2018,32
1543.24,1016.37,116.57,29.57,74.92,"toy soltera desde ha— chun tiempo. Estoy es— estudiando teatro, impro, canto y danza, asíque no tengo tiempo parapen— sarenelamor. Mesien— tommy feliz misacti— vidades. ¿Vas adebutarenlaac— tuación? Sí,juntoa Orina Riva— deneira, Luciana Fus— ter y otros chicos vamos a participaron lacome— dia 'Depa302' en La Es— nación de Barranco, el próximo9dejunio. ”TROME GOL'",32
1062.62,1444.88,107.46,29.31,64.73,"—sl Paolotienebuen — contó Poly. Porotrolado, la — 7 fueelco— Seríanunalindapa— ”combatiente' fe— o mentariodePo— — reja... limita Trompo ly Avilaalsa— Bueno, esoes un —— promoción",32
884.5,1537.25,140.25,33.25,57.5,becquerel Depreda— supuesto. Locon—,32
1113.88,1631.53,158.0,31.82,71.0,"dor'quisoconocerasu — creto es que en ese a amigaSpheffanyLoza, — momento los dos f dinero comoconfesólamodelo — estabansolte— haceunosdías. rosy nosed ioni ; voa sus",32
1062.77,1798.73,139.0,31.04,72.31,"”Mehesorprendidocon — unaamistad. Te— ; lecto— lo que dijo ”Tefa,tampo— — fa'esunachica coestabaenterada...pe— — correctayPao— y ”Siganjun— robueno, esodemues— lo siempre ha , tandour boli— trague Paolo(Guerrero) mostrado —' _*",32
1507.87,1965.4,92.2,32.47,59.73,buencompor— en cartilla pa— tamiento. ra llevarsela pla— A ' tita. Thymegol > Castillo) [e],32
699.8,1925.2,140.6,30.6,83.4,"tiene buen gustaron las chicas, puesSpheffany",32
815.75,2004.62,145.62,35.88,73.12,"esguapisima,asícomo _ ¿Ycómoteva Alondra y suactualno— — enelamor?",32
881.25,2058.0,132.0,35.0,64.0,"via brasil era Thaísa”, Tranquila, es—",32
939.8,2573.26,73.0,27.4,87.57,"Luciana Fuster comentó que la confianza es la base de su relación con Austin Palo y, por ello, no están metidos en escándalos. ”Nos va bien como pareja porque hay mucho amor, pero también respeto y confianza. Ambos traba— vamos en diferentes canales, pero nos vemos casi a diario, compartimos muchos momentos. Ahora me acompañó a mi lanzamiento como empresaria”, dijo la ”combatiente' al inaugurar su tienda de ropa ”Hechizo' en el centro comercial Zapatón' del Centro de Lima. (E. C)",32
2189.43,294.43,102.57,50.71,64.71,2 ¡ £ D ¡ ¿f» Í¡,32
2309.5,749.65,59.41,27.54,88.64,"N E y El salsero puertorriqueño Lalo Rodríguez se reencontrar con el público peruano, después de 12 años, en 'Una noche de salsa 9' este 9 de junio en el estadio Nacional. ”Vamos a ir al estadio no a jugar fút— bol, sino a bailar salsa y festejar los triunfos de Perú”, dijo el intérprete de ”Ven derrame otra vez, quien afirmó que a pesar del surgimiento de otros géneros musicales, la salsa sigue vigente, ”La salsa no ha muerto y en mi nuevo disco regreso a mis raíces, la salsa dura, con letras de crítica social”, comentó. (M. Casas)",32
2168.38,1108.88,83.62,60.38,79.38,”Ven derrame otra vez' y sus nuevos temas;,32
2092.86,1744.01,68.62,27.08,86.27,"La actriz Ahí de Cardenas comentó que acaba de regresar de Miami, donde estuvo grabando 'Asu mare 3”. ”Esta película será más divertida, es la tercera y se acaba. Ahora tenemos como director a Jorge Ulloa, quien hizo ”Enchufe TV””, contó en 'Canal No. Por otro lado, dijo que mucha gente en redes sociales suele atacarla diciéndole ”bruta”, 'calabaza' o 'pituca”. ”Y no entiendo por qué tanta rabia, olvi— dan que soy un ser humano”, lamentó. G",32
2128.09,2020.27,76.82,42.27,61.45,"Cuenta que regresó de Miami, e p ee ie el película",32
2238.31,2499.7,64.74,28.64,84.48,"© A ritmo del 'Pasito tun tun', uno de sus más grandes éxitos, la agrupación 'Agua Bella' cele— obrará sus 18 años de vida artística y presentará a sus nuevas cantantes en el Barley Bar de Pueblo Libre. Leslie, 70e, Nataly, Roisa, Sandy y Melany son las jóvenes que integran el grupo cum bi amber o de cuyas canteras salieron Cielo Torres, Katy Jara, Gaby Zambrano, Marcarme Marín, Marina Yafac, entre otras. ”Será un honor compartir escenario con la nueva generación y recordar aquellos momentos cuan— _ ) _ do me inicié en el mundo artístico”, dijo la malvada * — ”Sabrina' de 'Ojitos hechiceros' (C. Ch) [<)",32
2129.9,2812.3,105.5,50.1,76.9,&De grupo cum bi amber o salieron ;Cielo %orres Katy la nuevas integrantes,32
1652.12,151.25,94.62,29.88,86.25,"SÁBADO 26 DE MAYO DEL 2018 L""—""“J& 33",33
2411.0,459.42,44.75,28.58,63.92,NOMBRE: a fa DIRECCIÓN: A € E S a TELEFONO: E a,33
1367.6,705.8,133.87,38.13,67.6,CERVEZALIGERA COPA DINAMITA _ PERO | MODELOS | PECADO NIQUEL ESFUERZO & _…o…oa_ 2 |,33
1479.82,1555.89,107.64,48.75,70.43,- TAN 3 PL - S y COBALTO FINAL NOTA A£USAT! ne mi PRECEPTO . - M - ' - ROCKFRANCES . A (e ' ALUMBRADO !,33
1000.33,1067.83,63.0,46.0,69.67,a DE - *| | -,33
244.67,1329.67,126.67,28.67,69.33,CAPITAL LET Nia ] - PEDREGOSO,33
765.6,1646.4,66.4,64.0,63.4,Í$ 2 SL l |,33
1413.52,2670.24,76.36,30.21,57.13,"…Wm… (F muauam=x& u.mmm CALLE A LOU S AC . e Las Palmeras 5144 nmum:e…mmy: Mustafa Cando Rey P d MERCADO VIRGEN DE LAS NERCEDES, A Puesto Puesto de daros m Estras] 43! …LA…A…D i n ERDE SALAZAR SAC, Az San Buen 1050 377 La —— 15, MAR REPRESENTACIONES SAC Av Oso Pardo©20 a 14 527W1a11 Ia2!ú)h:0h1me…1 t a o 25, SURCO: DISURPESA, Av. Primeros 377 Ut Los mmm 17. POL PEDAA: Cerro ”La ta N' 1 S. Pena As 208 Mayo eal o l e a e s en es s ea ee C&W Mab… 28 Mercado A",33
817.44,2843.44,87.0,31.25,35.69,……Y%& nwmms.we Ey p oo e dd E o l a ee e o i a,33
832.33,2766.53,63.76,28.44,87.82,"©Esta muñequita se llama Joselyn y proviene de la tierra del joropo y las arepas. Sí, es venezola— na, se dedica al modelaje y también es cantante y actriz, Es tan linda que está para ponerte en un cuadro. Afirma que se siente encantada con nuestro país, pues todos la tratan con mucho cariño, |;",34
2038.27,1721.15,74.35,28.68,88.78,"ste Búho no se sorprende ante la cadena de denuncias por abusos sexuales que hoy causan un terremoto de grado nueve en Hollywood. No me extraña porque, en primer lugar, desde que se inventó el cine y luego la televisión, siempre han estado sacudidos por terribles es— cándatos. Claro, en esos tiempos no había redes sociales y los abusadores, los violadores y hasta los asesinos se con la suya, porque los grandes estudios compraban a medios y periodistas ”plumiferos' que silenciada las denuncias de las víctimas. Todo cambió cuando un veterano y polémi— co director de cine norteamericano, Kenneth Anger, decidió auto ex i liar se en Europa por ser incomprendido en Hollywood. Kenneth fue recibido con los brazos abiertos por los eruditos de la afamada revista Cahiers du Cinéma', quienes le rindieron pleitesía y se deleitaba con sus increíbles historias sobre los inicios del cine mudo” en Hollywood. Historias de de— pravaciones, excesos increíbles y sórdidos de míticos actores, directores, productores y dueños de los estudios. Los franceses animaron a Kenneth, postergado por y ”transgresor”, y le propusieron publicar un libro. Así salió a la luz ”Holiywood a finales de los años cin— cuenta. Un libro gráfico, con decenas de fotografías de todos los gran— des protagonistas del 'cine mudo', que sucumbieron a los más terribles excesos. El impacto fue demoledor en Europa, pero en Estados Unidos, donde publicó una versión más extensa, el libro fue prohibido gracias al poder de los grandes estudios. Solo fue publicado en la década de los setenta, cuando todos los protagonistas, como Chaplin, Mary Pickford, o el hilarante cómico ”Fatty' Arbuckle habían muerto, Aparecían escán— datos como el de un famoso cómico terri— clemente obeso que mató a una menor de edad aplastándote con su peso, mientras la ultrajada en un cuarto de hotel. Este Búho tenía en su cabecera ese libro lleno de fotografías y chismes maledicentes, y tanto fue su éxito que sacó Babilonia Pero hoy vivimos en un mundo globalizado, donde las redes sociales le pueden dar la voz a los sin voz. Solo bastaron los ”tuits' de actores abusados por el galardonado Kevin Spacey para que el intér— prete de Frank Underwood, en of Cards', haya sido echado de Neelix con una patada en el trasero, a pesar de que a la compañía le causó una pérdida de 35 millones de dólares. Pero no solo los abusos y las violaciones se dan con actores gays; astros heterosexuales también han sido denunciados y sorprendió que James Franco fuera sin— picado como acosador de jóvenes menores de edad. ¡¡Y todavía lucía un pin de apoyo a la lucha contra el abuso!! La actriz Violet Paley, en el mismo momento en que las cámaras enfocaba al ”solidario Franco', tuiteó: 'Qué bonito pin, James Franco, ¿Recuerdas cuando pusiste en mi cabeza tu pene en tu coche, o cuando le dijiste a mi amiga de diecisiete años que vaya a tu habitación de hotel?”. Pese a ganar el €lobo de Oro, esa seguramente fue la peor noche de su vida. No solo actores, sino artistas de todo tipo, como el célebre fotógrafo peruano de la socialite mundial, Mario Testino, están acusados de ser parte de la llamada moledora de came”, un bien afectado mecanismo donde los famosos, enumerados e influyentes, dan rienda suelta a sus más bajas pasiones con aspirantes a actrices, modelos que sueñan con alcanzar la fama y que se ven obligadas a vivir situaciones aberrantes si quieren el trabajo. Pero eso parece estar cambiando, pues ayer a primera hora tuvo que entregarse a la policía de Nueva York el ex— poderoso productor de Hollywood, Harvey Weinstein, acusado de abusar de numerosas mujeres durante años. El sujeto fue llevado esposado por las autoridades, algo que seguramente jamás se imaginó que le ocurriría. También llaman la atención las numerosas acusaciones contra el talentoso actor Morgan Freeman, un octogenario de quien ocho mujeres aseguran que las acosó y dan detalles de sus abusos. Todo acosador, todo violador, sin importar quién sea, debe ser castigado. Apago el televisor.",34
1551.5,149.88,70.88,27.88,81.25,SÁBADO 26 DE MAYO DEL 2018 — f,35
1213.21,534.89,79.34,26.55,89.2,"¿$RAFAEL (40).— Buenos días, doctora *E Carmen, hace algunos años conocí a una madre soltera en el tren eléctri— co. Siempre coincidimos y nos hicimos amigos, hasta que iniciamos una rela— ción. Sus dos hijas me decían papá y yo me sentía feliz. Sin embargo, todo cam— dió cuando ella me confesó que se había enamorado de un venezolano que entró a trabajar con ella en la empresa. En palabras simples, me dejó para irse con él. Yo no la detuve. Mi intención ahora es salir con una mujer independiente y hogareña. La interesada puede llamar— me a mi celular: 912—826—506.",35
1867.29,523.35,80.76,38.65,60.76,") ) €rl¡';cogazón i ss E quet:elo sabes bien porque a;ep;qgtf¡e(,¡zx;r¿3 mucho dolor, la desisto 1 Í>%?e]atomó.&uarda",35
1852.67,655.56,78.67,47.78,68.33,recuerdo el vínculo que llega stg g t;2;f conlasniñas y Sigue,35
1823.5,739.0,131.5,39.25,81.25,encontrará;alamuierconla cual formes una,35
2393.25,408.62,70.06,25.19,85.12,Tienes dotes de lide— 17 razgoyesoteayudaadesta— car. Recuerda que hay que ense— dar con el ejemplo.,35
2393.1,636.27,67.27,27.77,76.13,"Saldrás airoso de una prueba que deman— dará tu concentración. Mejoran tusingresos. e s a d A nostalgia, pero hoy mues— tra tu mejor sonrisa. Los astros alimentan tu espíritu.",35
2453.0,819.0,59.1,24.9,80.7,CÁNCER: Controla el mal *rN* carácter y no dudes en,35
