left,top,width,height,conf,text,page
443.2,385.8,134.8,60.8,82.8,TIPS PARA EL BUEN ÁINIHM©),2
503.79,708.62,70.45,29.8,89.98,"[M]í amigo, el fotógrafo Gary, llegó al restaurante por un churrasco jugoso con papas doradas, ensa— lada de tomate y lechuga, y un refresco de maracuyá fresquecito. ”María, con las presiones diarias del tra— bajo, problemas de dinero, tal vez conflictos en la fa— milia, el caos vehicular que nos obliga a pasar varias horas a la semana en el transporte público y la falta de un adecuado descanso, entre otros factores, nuestro estado de ánimo se ve afectado y nos volvemos tables, ansiosos, sufrimos de estrés y hasta se puede llegar a la depresión. Por eso, te paso algunos consejos de expertos para mejorar el estado de ánimo. Esto es fundamental",2
497.66,1723.79,72.41,28.83,86.92,"nuestros hijos, pues si elos nos ven siempre posi— a serio elos también. En cambio, si paramos tensos, malhumorados o lanzando gritos, ellos nos imitarán. ¡Enseñémosles a ser felices con el ejemplo! ©Escucha música. Una canción de tu agrado puede cambiar tu ánimo en segundos. Te inyecta energía y vi— talidad. Cuando estés contento crea una lista de temas que te ayudará en los momentos difíciles. ©Mira una pe&cula. Que te guste, mejor cómica, y Spedes verla con otras persolas que te hagan sentir ©Relájate. Despeja tu mente haciéndote un masaje facial algunos minutos, sobre tu cama boca arriba y con los ojos cerrados. Si puedes usa aceite de lavan— da. Coloca tus dedos un poco más arriba de tus cejas y prefiona no muy fuerte cinco segundos. Suelta y pre— fiona de nuevo, Repite cinco veces, ©Sonmríe siempre. Así sientas que no tienes motivos para hacerlo. Eso te dará ánimos, contagiará a las per— solas que te rodean y, a su vez, ellas a ti. ©Agradece, Anota en un papel 10 cosas que has lo— grado en la vida y que te dan felicidad. Te hará sonreír sin que te des cuenta. ©Aleja la contra chatarra. Estudios señalan que las persolas que consumen alimentos procesados pade— cen depresión, ansiedad, cambios de humor, hiperacti— vidad y una otros problemas mentales y emocionales. ©Bueros recuerdos. En una pared de tu casa pega fotografías, paisajes y frases que te motive a conse— huir experiencias gratificantes. ©Cuida tu apariencia, Una persona triste descui— da su arreglo personal, lo que demuestra desinterés y baja autoestima. En esos momentos, busca la ropa que más te guste y sal a caminar una media hora. Te dará alegría”. Gary tiene razón. Me voy, cuídense.",2
1254.0,149.33,84.67,26.67,90.17,SÁBADO 26 DE MAYO DEL 2018,2
1090.75,1128.75,88.0,42.75,89.5,Alienta a Ia selección,2
1214.32,1337.17,64.69,27.09,88.92,"(© Todos queremos que Paolo vaya al Mun— dial, pero no podemos aferrarnos a esa idea como si, en caso no se logre, Perú no sería un equipo capaz. Ocurrió con Rada— mel Falcao, que por lesión no fue al Mundial de Brasil. Sin él, Colombia llegó a cuartos de final. Nuestros jugadores han mejorado, son hábiles y, ahora sí, tienen cierta experiencia. ¡Arriba Perú!",2
1421.67,1545.17,106.67,40.17,76.33,Carlos Alberto Bills : ubillus_care?3derágmailcom :,2
1960.5,1135.25,52.0,33.75,35.5,d e e es,2
1830.2,1359.49,52.16,26.76,84.59,": casa y se llevan hasta perrita', donde se : señala que en mi domicilio, del cual publi— : can una foto, una banda de ladrones ingresó : a robar y toparon a mi familia. Debo puntua— : ligar que la foto con la fachada de mi casa no",2
1918.88,1222.0,57.06,25.19,89.38,Me dirijo a usted con relación a la nota publicada en Tome con el titular Roban,2
1858.73,1487.47,64.73,26.8,86.53,: corresponde a los hechos. Pido que se haga : la aclaración. Pablo Quita Mirara,2
1305.44,1652.33,54.44,28.11,84.56,"Es cierto, Guerrero sería una gran baja, pero :",2
1213.52,1735.07,72.15,26.63,90.22,"si no logra ser habilitado para ir a Rusia, tenemos que seguir para adelante. El entrenador Areca debería replantear la alineación y reaco— modar, especialmente, la delantera.",2
1248.33,2023.17,99.5,33.0,91.0,”Es indispensable y urge la modernidad,2
1085.25,2073.5,80.25,33.75,90.75,y gestión del Estado”.,2
1893.29,1667.5,66.29,25.79,87.64,El asalto ocurrió e incluso los ladrones se llevaron una perrita llamada ”Akira'. Lamen—,2
1854.69,1762.06,50.31,26.53,84.41,": tamos la confusión de la casa y le ofrecemos las : disculpas del caso al autor de la carta, cuyo domici— : lino fue objeto de acto delictivo, como él afirma.",2
1707.17,2336.81,67.24,23.62,61.98,"At — Contenido Fax: 31—6353. up ii t…* i o Editora El Comercio S.A Jr. Paracas N.o s a a a A Jr.SantaRosaNo247, — E—mai: Espinosa — piso timal. Olnay — Teléfono: 311—6500. Publicidad: 708—9999. | Prohibida su reproducción total o parcial.",2
908.0,2525.25,391.25,98.0,52.75,TODOS ma&g%& j a©ao,2
705.75,2705.0,270.0,78.75,58.25,ENTREVISTAS EVASIVAS o I,2
2385.07,352.73,49.4,24.87,83.53,La vida sin esfuerzo no existe. Si lo que quieres es existir l ea muerto.,2
2409.33,1061.67,55.5,23.08,92.0,¿Cree que deben extraditar a Elaine Karp como a su esposo Alejandro,2
2415.36,1221.45,61.45,27.18,83.82,"¿Cree que deben desafiar a Kenji Fujimori, Guillermo Arcángel y i",2
2480.25,1606.75,42.5,29.0,53.25,P — *VENTA &,2
2402.73,1872.32,90.32,25.14,86.0,Bomberos .3 Emergencias Defensa Civil 115 4118000 Águilas Negras 3623277 Escuadrón Verde _ 4276904 Luz del Sur 6175000 Semanal 3178000 Indecopi 2247800,2
2439.6,2124.4,113.4,22.8,50.6,"l e a PROMOCIÓN, 2",2
2422.53,2303.42,48.32,22.26,86.47,Hecho el Depósito Legal en la Biblioteca Nacional del Perú N.o 2001—1992. Los artículos firmados y/o de opinión s,2
1302.0,2806.6,163.2,74.8,60.4,mn Jj… AEA f N,2
1754.11,152.22,83.89,29.56,81.0,SABADO 26 DE MAYO DEL 2018 'J& fAVISO; 3,3
1486.3,304.3,95.3,65.8,78.2,S OLO HOY Y M A N A N A,3
1784.57,1667.43,298.57,84.14,85.29,EN MILES DE PRODUCTOS DE VESTUARIO Y,3
1864.0,2137.5,113.75,146.25,86.25,| EXCLUSIVO CON |,3
1631.8,2685.45,57.9,24.85,73.1,"dég:en(a 7.50 (a solicitud del ciente), membresia anual: S/ 39.00, seguro de Desgravamen mensual S/5.90, penalidades por pago atrasado adicional",3
1730.0,2707.73,70.41,23.5,71.27,"órm'alesob(9lásjndiciones, tari fario de las Tarjetas CM y Reglamento CM Puntos enwww.bancofalabella.pe y Agencias. Condiciones: Válido el 26 y 27 de mayo",3
1734.5,2732.39,57.5,15.39,85.83,para compras en wwwfalabella.com. No accumulable con otras promociones u ofertas. Aplica solo a productos seleccionados. Para mayor,3
1124.56,1035.81,105.31,42.62,87.44,Capturan a 5 integrantes de una banda que tenía imprenta en una galería comercial de Brea,4
462.12,2113.9,131.86,30.49,74.22,"cho millones de dólaresfalsos, fa— brica dos en una imp renta de una galeríacomercial, fueron incautados porlapoli— cia durante un operativo entresdistritosdeLima. Cincointegrantesdeuna bandadedicadaaesede— — FOTOS:jOsEPHÁNGELES litofueronarrestados. doña Vílchez(51)yJhon Detectivesdel Departa— ToribioLlanos(24)enel mentoContrael Fraude frontisdelagalería 'Gui— Monetariodela Dirincri del capturar ona julio Men— jirón Huaraz, en Breña. m—-——-—-—-——— .............................................. : COMO DETECTARLOS : OTextura: Son más — y color verde más poniendo el billete a : ásperos y grasosos. — brillante, trasluz. Bien defini— AColor: impre— Marca de agua: da y a ambos lados sin de baja calidad _ Se puede ver el",4
683.71,2596.86,80.57,32.43,79.86,"€? Por conseguir dinero fácil, tres venezolanos,",4
706.8,2755.52,83.52,27.12,89.68,"entre ellos una mujer, fueron arrestados cuando roba— ban prendas de vestir en un conocido supermercado, en Independencia. Ley Gonzales Hernández (23), 'Chama'; Samuel Valera",4
1175.75,2293.75,56.0,67.25,50.5,3 [ / J,4
1143.91,2683.28,63.89,27.17,84.7,"Pulido (23), 'Barbitas”, y Henry Rodríguez García [28), cayeron en ubicado en el cruce de las avenidas Iza— i e Detectives de Inteligencia Lima encontraron en la car— tera de 'CThama' más de ocho polos y tres poleras. Las cámaras de video captaron a los extranjeros cuando sus— traían las prendas. (E. Ciriloj©",4
1498.73,1639.06,212.04,31.77,73.1,"Ambosllevabantrespa— que te s con pliegos 100 dólaresfalsificados. MÁQUINAOFFSET En uno de los puestos dellocalcomercialdon— defuncionaunaimpren— ta,lapoliciíaincautóuna máquinadeimpresión offset, placasyotrosin— sumos que se usan para laelaboracióndeldine— rofraudulento. ”Ambos seencargabandeimpri— mirlosdólaresenhorario nocturno”, expresóelco— ronel PNP JoséCruz. Minutosdespués,los la ls E! WilliamMendozaLópez (47),cabecilla y financista delabanda,enlacuadra 3deljirón Rufino Torrico, enelCercadode Lima. Simultáneamente,losin— vesti g adores detuvieron aLidiaQuispePeña(46), cuyacasa,enlacalleLos Halcones,enSanJuande Lurigancho,sehabíacon— vertidoencentrodedis— tribucióndedinero falso. JayroMaytaQuispe(26), encargadodedarelaca— badoalosbilletes,cayóen vivienda ubicada asentamiento huma— no 28deJulio,dondeen— contaron 104 mil800 dólares falsos, 11 mileu— rosy 215 pliegos impre— sosie garCirilo) o",4
1529.33,2587.17,149.83,75.17,47.33,l — arp ea y ©,4
1566.75,2823.62,77.25,25.38,85.0,modalidad del ”taxi colec— tivo' en diferentes tramos,4
2026.33,2459.08,74.42,30.92,68.83,&T . ii A — de la Panamerica— — distrito los interceptaron,4
2185.71,2558.67,57.67,31.71,66.86,"na Sur, Carlos Rojas Berro— ( © oe B1T—669, donde se cal (26) y Ramiro L 0 e a Z ¿",4
2418.0,697.4,74.8,28.2,75.0,noche del cuando cayó porlas',4
1963.4,633.3,74.4,26.8,72.9,en la nuca y un golpe en la l frente [da muertallacosmetóloga,4
2229.62,1081.0,91.57,32.38,47.57,each delalRegión Podía Romero' (43)) Cialllimafgeneral [fue intentes Castor informólque el en la carajo entel departamen' A denuncias Dolencia [ramiliad o,4
2158.2,1427.6,136.4,55.0,90.2,Moto se despista y muere,4
2114.22,1573.39,72.39,35.67,82.28,esposa de policía €9 La madre de fami— de placa 4531— Y lia Mera Damaris Flores —3F conducida,4
1982.63,1799.24,58.07,26.63,89.44,"Maced (29) murió al ser atropellada por un camión volquete luego de que la moto línea en la que viajaba con su esposo se despistó en la cuadra 10 de la avenida Univer— sitaria, en San Martín de Testigos contaron que",4
2415.89,1857.25,61.25,27.27,88.18,"por el suboficial PNP Glibber Pacaya Manama (43). ”Al parecer, un carro les cerró el paso y caye— ron. Ella fue arrollada por el camión ATY—941, cuyo chofer era Esteban Oregón (57)”, dijo un agente. La víctima y su cónyuge regresaban a casa. (.",4
1963.0,2023.5,75.25,25.0,89.0,el accidente ocurrió cuan—,4
2189.7,2707.26,55.79,25.23,83.6,"Alarcon Carancho gas y letreros con (22) fueron interne — A ) las rutas Lurín, nidos por la policía M Lima y San Barto— en San Bartolo. lo. También serán Agentes de la comi— ' ' investigados por el sabía de Protección y",4
2439.0,2803.25,25.75,25.75,42.0,eo 4 e ea,4
2195.82,2849.36,52.09,25.27,78.09,"de Carreteras de ese / y sa, Yucra) [+] — Lb_.“",4
1779.0,151.0,132.71,31.57,40.71,ee ea ea e crome: (AVISO) 5,5
1812.62,1421.25,127.38,25.0,89.5,MARCAS SELECCIONADAS o CON CUALQUIER MEDIO DE PAGO,5
1416.45,1721.55,101.18,28.45,74.64,LAPTOPS EN EL 2DO. sorteo MILES DE PERFUME DE LOCOS 1,5
1500.25,2003.25,172.5,109.88,61.5,"30%, | 20%, — | 40%, mne eom",5
1331.19,2162.62,86.62,20.25,85.06,e CON CUALQUIER MEDIO DE PAGO CON CUALQUIER MEDIO DE PAGO CON CUALQUIER MEDIO DE PAGO,5
1413.25,2252.5,203.75,81.25,59.88,2Xí] DECORACIÓN ©©o/o COMEQRQQSAS Ú © y í©20[2)06©2……,5
1446.44,2332.0,96.33,23.11,71.0,r Dscto. y SILLAS DE COMEDOR ip Ripley Home,5
901.88,2410.12,80.75,20.25,77.5,CON CUALQUIER MEDIO DE PAGO excLusIvo con [,5
1213.09,2669.49,45.75,16.74,86.72,"[TCFA Máxima en base a cuotas de 12 meses, a un año de 360 un consumo de 5/ 1000, pagará 12 cuotas de S/ 121.76 que incluye el total de intereses de S/ 461.13. El valor final de las cuotas podría variar en función a la fecha de consumo, facturación y pago del cliente. Si mantuviera saldo de 5/ 10 o más en su tarjeta de crédito, se le cargará 5/ 7.90 mensual por concepto de seguro de desgravamen, En caso corresponda, aplicará una comisión mensual por envío físico de estado de cuenta de S/ 5.50. En caso de incumplimiento en el pago, aplicará penalidad por pago fuera de fecha según tari fario vigente. IT (0.005%). Matar información de condiciones y/o tarifas de la tarjeta de crédito en aww bancaripley.com.pe y/o Promoción válida del 26/05/18 al 27/05/18 y/o hasta agotar stock, Stock mínimo 3 unidades por producto, Válido en todas las Tiendas Ripley a nivel nacional. Los descuentos en electro no son válidos para la tienda Ripley Jr. de la Unión, no aplica para concesiones, con sig naciones ni aplica para extra garantía, En el descuenta del ex se pagará el producto de mayor valor. Aplica para productos seleccionados en tienda. Aplican restricciones. Los descuentos aplican sobre precio regular Válido sólo para consumo familiar (máx, 3 productos por cliente o tarjeta). No aplica para ventas al por mayor. No aplica para productos Ahora 0 Nunca, No accumulable con otras promociones. El descuento en perfumes no incluye Dior, Channel, Lancome, Doce Gabanna, Carolina Herrera, Versace, Jean Paul Gaultier, Duty Free ni",5
1445.56,553.5,99.56,70.17,75.72,Sigue juntando tus bolillas y llena D©A[N:I A CI] © M |] |L una cola de tu cartilla,6
1942.5,560.75,64.25,24.0,88.0,| ES BUENA PARA,6
2201.86,826.48,113.66,30.52,82.66,"martes ysábadosentre— r garemosseis. viene Alfinalpodrásentrar a al sorteode5 televiso— a anemia resde39pulgadas más Blu—Ray, 5notebooks, 4 © La cebolla es infalta— smartphones,4cocinas ble en la cocina y sus",6
1949.14,1053.57,147.43,32.43,79.64,y2refrigeradoras.Solo tienesqueanotartusda— tosen aparte posterior de tu cart ill a y deposi— tarea en los lugaresauto— rizados. o,6
2416.73,1068.82,67.68,26.36,79.68,"beneficios son múltiples para nuestra salud. la circulación sanguínea, intervie— d ie 3 la trombosis y del envíe — nacimiento de =",6
1600.7,1344.46,81.41,30.24,75.16,"puedes llenar tus H '; las venas y bolsillosdedine— formaautomática y sin ; Los IREMOS e > roen efectivoco— todos los días, sorteo la cantidad que 1 ©2 premios de 10 mil soles. ; — | ©Combate la mojugando, puesre— pues con ellas debes aparecen la parte supe— 1 ©4 premios de 5 mil soles. ! —| anemia, pues partiránada mejorque — completar una de las rior. Paracobrar,solode— '. ©28 premios de mil soles. _' | ayuda a reponer la pér— ” Reef e seiscolumnasdetucar— — besllamaral311—6399. . ©40 premios de 500 soles. 1 | vida de sangre y regenera Siguejuntandolasbo— tilla. Todoslosdíassalen cua— | ©46 + e e _| los glóbulos rojos. millas que publicamos Silohaces, ganarás de trocupones, pero los -900 premios de 100 soles. '. a",6
1265.45,1600.58,105.87,38.26,60.35,o AA A SOLO 1 SO!.. | C©n m©da & CAB ©Ayuda a controlar la %]g“mui| IN an ana ggÍtg prem e e ie F I 1 mundial i sta e i eo,6
1377.0,1702.25,50.12,28.88,65.88,anana es dom¡n— d nale s e IE),6
2410.83,1859.65,77.13,25.17,81.04,padecer cálculos renales. ©Evita enfermedades del sistema nervioso y muscular. ©Buena para adelgazar —— controlar el peso f— > debido a su bajo,6
294.48,1846.04,58.92,28.8,75.32,"Falta poco para el debut de Perú +muier tiene un especial , de moda mun— / f EE E S ee rs Además, en ””",6
746.39,1859.61,79.44,28.72,89.56,"También tenemos entrevistas a Mónica Delta y Sully Sáenz. Como siempre, hay consejos de belle— za, salud, pautas",6
1968.0,1872.0,71.25,22.75,61.25,A Per¡a]Apolon¡a j nid,6
958.58,2029.27,68.7,31.55,78.7,"podríasisentú! yo para criar a los Para realizantallas] va edición, te — Yy hijos, Horóscopo ingresarla nuestra j web |__ co y su alto decimos en del Amor, Consultorio d 0 Intimo y mucho más,",6
531.33,2135.5,54.5,27.33,91.17,puedes romper a solo 1 sol.,6
1578.77,2452.58,62.23,31.08,80.77,Coca Cola Pilsen Cerveza Four Pack x 3 l 6 ¿¿. Four Pack x 473 mi en televisores e i ] 2 de marcas » seleccionadas,6
1979.83,2549.67,47.17,48.67,68.17,M E $ E $ $,6
1445.0,2608.58,79.42,19.83,74.5,Precio regular S/ 36.30 Precio regular. S/ 13 50 | MNTERE$E$ a,6
1208.43,2651.36,31.21,13.93,89.07,del 17 de mayo al 15 de jun:o de 2018 o hasta agotar stock,6
389.8,839.0,59.0,21.4,89.6,Preciado sin tarjeta: S/ 209,7
354.43,883.43,45.43,20.86,75.57,Colchón New Aura 1.5 paz E ra,7
389.8,1150.6,59.0,21.8,89.2,Preciado sin tarjeta: S/ 299,7
374.08,1221.23,73.69,20.62,72.23,Colchón New Aura 2 paz SKU: 40738074 — Precio regular: ” a o,7
438.18,1499.45,65.55,23.18,88.73,Preciado sin tarjeta: S/ 439 Colchón Tropical Damasco Ergo 1.5 paz,7
391.73,1562.13,54.2,19.8,72.0,+ 1 almohada + 1 protector 1.5 paz SKU: 40868837 — Precio requiar: S/469 eme,7
435.91,1823.27,63.64,23.09,86.36,Preciado sin tarjeta: S/ 479 Colchón Tropical Damasco Ergo 2 paz,7
412.5,1870.88,43.88,20.88,74.5,+ 2 almohadas + 1 protector 2 paz,7
1460.33,151.0,89.17,27.0,89.5,SÁBADO 26 DE MAYO DEL 2018,7
1403.38,566.88,133.25,54.12,83.5,COSECHA DEL 26 AL 28 DE DE 2078,7
1583.3,795.5,57.1,22.4,86.1,Preciado sin tarjeta: S/ 259 Colchón Edén Plus 1.5 paz,7
1580.9,1134.2,54.7,22.4,86.4,Preciado sin tarjeta: S/ 369 Colchón Edén Plus 2 paz,7
1498.5,1239.0,26.5,25.67,48.83,el a a 3 5 1270,7
1590.67,1496.44,78.67,22.78,91.11,Preciado sin tarjeta: S/ 589 Conjunto económico Nappy resortes,7
1588.86,1547.29,51.86,21.43,84.29,1.5 plz+ 1 almohada + 1 protector,7
1567.67,1625.5,44.17,20.5,42.67,p E ir 1 E |mm—-—-smm,7
1590.67,1822.22,78.89,22.67,89.11,Preciado sin tarjeta: S/ 689 Conjunto económico Nappy resortes,7
1569.5,1882.92,58.58,22.58,79.0,2 plz+ 2 almohadas + 1 protector SKU: 40288090 — Precioregular: 5/789,7
1186.17,2077.0,238.17,57.67,83.67,EN CAMAS Y COLCHONES ROYAL ORGANIC,7
1323.49,2267.88,58.5,17.74,87.36,"TEA Máxima 109.83%. | Ejemplo: Consumo total de S/ 1000, plazo 12 meses, envío físico de estado de cuenta mensual S/ 7.50 (a solicitud del cliente), membresia anual: S/ 39.00, seguro de Desgravamen mensual S/ 5.90, penalidades por pago atrasado adicional al interés compensatorio por atraso, factor de amortización de 24 meses. Año 360 días, IT 0.005%, Infórmate sobre las condiciones, tari fario de las Tarjetas CM y Reglamento CM Puntos en www.bancofalabella.peyA7encías.",7
1341.35,2300.62,53.43,16.86,86.27,"Condiclones: Ofertas válidas del 26 al 28 de mayo de 2018 en Hipermercado Cottus. Ofertas no válidas en Cottus Miraflores, Cottus Súper Próceres, Calle 7, Comandante Espinar, San Luis ni ica Centro, Ofertas para consumo familiar y",7
1117.7,2328.19,60.13,18.06,84.91,"agotar stock, Ofertas no accumulable con otras promaciones. Ofertas no válidas para compras por internet. Stock disponible 100 unidades por producto, Máximo 6 unidades por persona por producto. Fotos referenciales, Información difundida de acuerdo a Ley No 28587 y Reglamento de Gestión de Conducta de Mercado vigente.",7
1972.6,2796.8,157.4,101.6,75.6,Te cla més per menes,7
1139.5,150.33,99.83,32.0,78.83,…E SABADO 26 DE MAYO H?r',8
1817.25,543.5,133.25,38.75,66.12,La acusan de praderas inmuebles LasCasuarinas y Sur—,8
1780.62,616.5,153.0,41.12,70.5,"haber parti dpa do co, yel pagoda hipote— compra de caspormásde5millo—",8
1933.0,681.75,86.25,32.75,79.25,"nes de soles, Asimismo,",8
1769.45,801.26,115.55,33.45,77.07,"inmuebles en decontrolarlascuen— G» El alcalde de Lima, Surco tas bancarias utiliza— ee i ea igual que hizo 5% Esposa de daspresuntamentepa— conelexpresi— habría 20 mi— — raocultareldineroilici— Yoshiyama, serán citados dente Alejandro Toledo también llonesdedólaresentre— — to durante el gobierno en junio por la Comi—",8
2401.88,965.38,71.19,27.75,88.5,"sin Lava Jato, anunció la congresista Rosa Bar— tra. Igualmente ocurrirá con Kenji Fujimori y Ren—",8
1975.9,947.9,130.6,34.0,66.7,"desuesposo, a través de sumadre, En tanto, el Ministro deJusticiaexhortóa",8
1009.25,917.25,104.08,33.0,84.75,"Toledo, la Fisca— gados porOdebre— lade Lavado Activos afronta 18 meses cht.",8
1013.07,992.79,120.07,34.71,86.29,"| pedirálacxtradiciónde _ prisión por el El Ministerio esposa Elaine Karp, caso Obrecht Públicoacusa",8
1642.75,1211.4,104.56,30.85,74.12,"quien radica en Estados a Elaine Tarde lasautoridadeses— zo Reggiardo. Unidos y también afron— — ambosycontralama— haber tenido 3 t ado uni dense s a Castañeda, quien ade— prisión preventiva — dredeKarp,EvaFer— ”dominio” /,' aprobarlaex— lanzó su declaración ayer, |_ | 18 meses. nenbug(86),ademásde — y'parti— Ar tradición debe responder sobre el ea, Talrequerimientose JosefMaiman y el ex jefe — cipa— </7 Toledo,cu— proyecto Línea Amarilla, *> — haráanteel Poder judi— — deseguridaddeToledo, — ción' yosdo— mientras que Yoshiya— | cial,luegodequesepre— — AviDanOn,enelmarco — enla , cumen— | senteacusacióncontra — delcasoEcoteva,donde — com— t tomase —| a los 1.2 millones de ie : encuen— dólares que Odebre— 3 a el chat entregó a Fuerza",8
2436.17,1456.67,75.67,27.75,77.42,d[. Popular para el financia— miento de sus campañas presidenciales. ([MBL) O,8
915.9,1492.04,67.33,29.41,75.75,) : — 31/1/2013 — >La Fiscalía abre investigación preliminar por el caso Emotiva contra Eva Fernenbug y Alejandro Toledo. ©C(£ ; — 20/7/2015 — fiscal Manuela Villa denuncia a Alejandro Toledo. l me % | 21/4/2016 — abren proceso penal al mandatario y Elaine Karp. 7 A 4X_Ji '__M',8
1026.94,1681.33,148.44,53.94,69.28,"CASO COOPBRA:£IVAS _YP?“? m ""'.'a &! GLEGISIJ:TIVAS Acusan al fuji mori smo de iii a avalar lavado de dinero facultades",8
1307.32,1993.16,63.58,28.61,82.43,"2 te intentó que 31 sea aprobada”, La bancada de Fuerza — que busca que las coope— ”| expresó. G» Es 'indispensable y Popular fue acusa— nativas de ahorro y crédito E E es urgente' la moderniza— — dor Heresy ”No da de entorpecer la lucha — sean supervisadas por la Belaunde (AP) pidió 33 Lombardi (PPK) sostuvo ción del Estado, señaló el queremos que los pobres contra la corrupción y el cri— — Superintendencia de Ban— investigación con— ¿3 que el fuji mori sta Miguel premier César Villanueva más con estos men organizado' y avalar ca, Seguros y AFP (SBS) tra la fuji mori sta — S ta Torres 'está prohibido al sustentar el pedido A— cambios en el impues— el lavado de Esto regrese a la Comisión de y ' de legislar' en este caso de facultades legislati— to a la renta”, aseguró luego de que, por mayoría, — Economía, donde ya se ”conflicto de inte— . porque él y su fami— vas ante el Congreso, Tuesta. El Ejecutivo aprobara que la propuesta — emitió un fallo a favor. reses” ”Letona — lia ”han trabajado con Lo acompañaron los pidió facultades por para que el proyecto de ley — Víctor Andrés García no podría ser juez coopenativas” | — ministros David Tuesta un plazo de 60 días (Economía) y Salva— E i ee",8
1744.54,2429.81,61.95,29.18,80.78,"F po dentista de los : afirmó: 'Sí tengo auto— — i casa junto a Guillermo —! ya empezaron las pro— N 'avengers' Dijo que : vidad moral para inves— — i Arcángel y Bienveni— i estas contra el llama— x.” no debería estar —! tigar, no tengo rabo de — i do Ramírez. Su herma— — i do Quééé... ) en el Congreso _! paja'! Parece que esta —! na Keiko dice que la de— ! HONESTIDAD porque le reti— — : peleíta continuará. Aya— : misión depende exclusi— — : ©Humberto Lay, uno",8
340.94,2450.83,77.39,26.61,83.39,ROCHE ©Jorge del Castillo pa— só tremendo roche en televisión. Criticaba a —! los congresistas que pi— :,8
1503.8,2601.65,58.12,27.94,83.35,"dieron Smart TV y Al— raro su título. : yay... : lamente del Congreso. — : de los veinte candida— do Mariátegui leyó su F Se preguntó : DESACUERDO : Ya sabe... : tos a la Alcaldía de Li— nombre en la lista de yy 'con qué moral i ©El 'Día D' para Kenji ! i ma ya confirmados, di— los que habían pedido "" : Fujimori ya tiene fecha. _ : ©David Tuesta, el mi— ce que se puede ser",8
1853.36,2770.32,58.32,27.51,84.71,"%3 PELEÍTA —! El Congreso debatirá astro de Economía, se— — i político sin dejar de ser ©Marit— : el miércoles 6 de junio mala que el Gobierno : honesto. La verdad es za García i el pedido de desafue— no quiere que los po— : que con todo lo que es— no se que— — i ro en su contra. Ese día — ! bres paguen más. Oja— —! tá pasando, muchos ya dó atrás y —! pueden mandarlo a su —! lá, porque en provincias ! lo dudan...",8
437.29,2801.06,82.71,25.59,82.12,"televisor. Plop... ©La fuji mori sta Karina Betta 'disparó' contra ! 2 Marita García, del gru— ! MARITA p",8
1593.71,151.0,87.71,28.29,83.43,SÁBADO 26 DE MAYO DEL 2018 N,9
1339.55,539.91,147.64,56.27,71.09,” y APROVECHA DEL 26 AL 28 DE NO DE 20148,9
1387.9,1196.95,62.9,26.71,61.14,"A . Smart Android 7, M e Preci¿zg_ ÍL¡3mtarjeta. S/ 1,399 i Prec¡¿zg_( iovnmtarjeta. S/ 1,399 Prec¡33_ Í¡.'.'. oEarjeta. S/ 1,899",9
1118.33,1248.44,78.0,20.67,32.67,Ro erra mr a (H p ( r e,9
1157.58,1301.75,64.75,24.25,52.92,"o Precio regular: S/ 1,999 a on e E y e la",9
575.58,1907.25,66.17,20.17,57.5,"Preciado sin tarjeta: S/ 2,399 LED ee 5 oo a rt o",9
1619.5,1785.83,194.5,89.5,65.67,S/ 199 ©©i% S/ 2?9 noc,9
1776.83,1885.17,49.17,21.74,82.65,", TV LED 55”, Ultra HD, 4k, l TV LED 65”, Ultra HD Prec¡¿zg_ gi¿¡o$ tarjeta: S/ 2,399 Preciado sin tarjeta: S/ 2,899",9
1623.14,1943.29,102.14,15.14,38.0,a p ea ( a a d,9
1937.5,1974.12,44.12,15.88,83.5,"Precio regular: S/ 4,699 Precio reqular: S/ 3,599",9
1011.0,1697.4,7.0,7.0,35.9,5 5 5 5 5 5 5 5 5 5,9
