left,top,width,height,conf,text,page
1435.75,2039.25,91.0,18.25,71.25,e cuotas mensuaLes curope:,9
1208.02,2120.65,52.44,24.96,75.38,"” u Celular liberado con pulsera * — Celular liberado con TV Análoga , 254 — Inteligente y Sintonizador TV Digital $ + Garantía Extendida por 1 año S / 6 9 ;4&%4 8105Íg€3 253N. uo. MOD: BLISS TV EAN; 818047023650 Precio regular: S/ 129 vá . [+] Precio requiar: 5/ 549",9
1123.27,2193.27,59.18,24.0,72.27,seccion — PFeclazo sin tarjeta: S/ 99 Precio Imbatible: S/ 389,9
1544.5,2201.0,47.88,30.25,56.88,TOEA Total intereses: S/ 4114/ Stod 10U00 ——,9
1252.25,2294.53,55.81,17.69,86.4,"CEA Máxima 109.83%. | Ejemplo: Consumo total de S/ 1000, plazo 12 meses, envío físico de estado de cuenta mensual 5/ 7.50 (a solicitud del cliente), membresia anyal; S/ 39.00, seguro de Desgravamen mensual S/ 5.90, E¡enalídades atrasado adicional al interés compensatorio por atraso, factor de amortización de 24 meses. Año 360 días, ATF 0.005%. Infórmate sobre las condiciones, tari fario de las Tarjetas CM y Reglamento CM Puntos en www.bancofalabella.pe y Agencias. Condiciones: Ofertas válidas del 26 al 28 de mayo de 2018 en Hipermercado Tottys. Ofertas no válidas en Totty La Fontana, Ica Centro, San Luis, Chiclayo Belaunde JI Lora, Calle 7, Miraflores ni Tottys Súper Zorritos, Tusilagos, Proceres ni Campoy. Stock mínimo disponible 10 un por producto en toda la cadena. Ofertas para consumo [amiliar y/o hasta agotar stock. Fotos referenciales. Máximo 6 un por producto por persona. Ofertas no accumulable con otras promociones. Información difundida de acuerdo a Ley No 28587 y Reglamento de Gestión de Conducta de Mercado vigente.",9
1964.2,2798.4,167.6,95.4,75.6,Te cla més per menes,9
269.9,746.1,114.8,42.2,87.6,<Ranking internacional las coloca en el top en América Latina,10
267.19,1247.36,164.75,29.39,74.42,"mo los mejores lugaresparatraba— jarenAméricaLa— inafueroncata— logadas26distinguidas empresasperuanas, se— gúnelúltimorankingde GreatPlace to Work. Des— tacanporsusaltosnive— lesdeconfianza,orgullo ycamaradería, local se reflejan relación que los colaboradores man— tienen con suslíderes, co— legal y sutrabajo. Enestedécimoquinto ranking, el Perúseubicó compel cuarto pasion",10
303.0,1845.88,79.12,28.38,91.62,Con suaves automa saj es se puede reducir la presión,10
319.82,2099.09,67.07,27.51,90.22,"Marco Almerí, jefe de Cardio— logra del Hospital Barton del Callao, señala que esta enfer— edad no tiene cura, pero puede ser tratada. ”La hiper— tensión es una enferedad que va en aumento. Es origi— nada por el estrés, obesidad, consumo de grasas y falta",10
380.25,1714.5,165.5,55.5,89.0,alta con suaves masajes,10
382.57,1838.0,41.29,26.29,92.71,"en el cuello, nuca y la sien",10
316.8,1911.2,71.6,25.8,88.8,arterial en solo cinco minutos.,10
462.68,2305.11,69.21,27.68,90.58,"de sueño. Por ello, hay que alimentarse saludablemen— te y realizar actividades de acuerdo a la edad”, señaló el",10
354.75,2394.0,111.5,31.25,86.25,Recomendó los siguientes masajes:,10
670.57,1340.1,116.05,32.67,74.19,"másfirmas. Enlacategoríadeem— _ > presas locales,con 20a500colabora— dores, destaca Real Plaza,queocupó quinto pues— — P to. InteligoSAB y Centenario también for—",10
1170.17,1471.33,138.33,30.0,72.17,"man parte de esta lista y figuran en el puesto y 50,res—",10
1514.75,1323.5,142.67,33.33,72.38,"pectivamente. Enelrubrode500amás empleados, Supermer— cados Peruanos, que agrupan las cadenas Pla— za Vea Vivanda,sepo— sicionóenel segundo lu— gar.Lesiguen Interbank (7), Promart(12),Casa Angina (23)e Intersegu— ro(24).",10
1491.8,1039.8,61.6,30.6,67.6,| Madre | Flabella I,10
1874.6,327.7,120.6,45.1,84.9,"¿<Figuran Real Plaza, Plaza Vea, Vivanda, Proart y Casa Angina",10
1927.82,586.45,204.64,31.64,77.64,"BUENÍSIMA Laempresadepaque— tenía DHLocupóelpri— merlugarenlacatego— ríase las multinacio— nales con operaciones 31 seencuentranCisco(2),",10
1946.12,1117.49,172.34,32.85,75.1,"Natura(9) y Belcorp(11). Según JuliaGiraldo,es— pe cia lista en Adminis— trasciende Empresas la UniversidaddeCien— dias y Humanidades, pa— raquela s empresas sean valoradas porsustra— bajadoresdebenbrin— darán buenclimalabo— ral,reconocereltraba— jo de su personal y tener flexibilidad de horarios. ”Silosescuchany estan confianza paraqueto— men decisiones, vana crear un sentimiento de pertenencias suscola— me.(SoniaObregón) 0",10
1136.65,2078.07,66.91,27.55,90.18,"©) Gran conmoción en la ciudadanía ha causado el último caso de parricidio en Lima, luego que el coci— nero Pedro Gonzales Conde envenenó a sus tres pequeños hijos y se suicidó tras discutir con su esposa, en San Juan de Lurigancho. Para el psicólogo del Hospi— tal de la Solidaridad, Ricardo Núñez, quienes cometen",10
1507.71,2098.64,87.36,26.21,87.79,"estos horrendos crí— menes son agresivos, calculadores, tienen baja autoestima, usan la violencia para",10
2035.57,1903.28,63.48,27.15,85.0,"(Y compasión por K nadie. Asegu— ra que se da por un quiebre de valores y advirtió que estos casos empiezan desde temprano. ”Cuando son pequeños, dicen que odian a sus padres porque no cumplen sus caprichos, incluso los llegan a agre— a e el pasar como si fuera algo normal y los sobre—",10
1719.79,2258.79,81.07,28.93,85.36,"conseguir pro— protegen”, explicó hecho personal Nunez y no sienten gon *] RICARDO UNE",10
409.11,2617.12,62.04,28.64,87.58,"tres puntos [adelante de las orejas, detrás de ellas y en la clavícula). Usa ¿W= ) las yemas de los dedos y presiona al mismo —* é' tiempo los tres puntos. Realiza este ejercicio 10 minutos en la mañana y otros 10 en la noche. ©Masajea la nuca suavemente duran— te cinco minutos, dos veces al día. ©Coloca las yemas de tus dedos en la sien y masajea por tres minutos, cada vez que sea necesario, durante el día. (N. Salazar]",10
809.25,2779.25,37.25,26.75,53.5,"* r ""h 27”",10
1180.33,2521.83,280.83,63.67,48.17,Subenipreciosidelipollo! pescado verduras e p o,10
1518.14,2633.71,48.43,12.71,60.57,> — 2 t — Megamercado Humano,10
1556.75,2762.5,43.75,25.5,55.25,"e el kilo:de pollo,",10
2399.84,993.38,65.88,27.26,87.87,"CD Panes recién salidos del horno ofrece— rán, entre hoy y mañana, la Municipalidad de Mira— flores y la Unión de los Franceses en el Extran— jero, en la explanada del estadio 'Niño Héroe Manuel Bonilla'. El evento, denomina— do 'Fiesta Francesa del Pan', reunirá a expertos panaderos, así como a la panadería municipal 'Mi Pan', que llegará con deli— ociosos productos como pan con aceituna, pan pan de quinua, pan árabe con —. chía y linaza,",10
2382.14,1946.71,106.43,57.43,71.71,La botan por opinar sobre e 5,10
2400.47,2480.81,63.71,26.49,86.66,"<D El congrelista Jorge Del Castillo ([Apra) cuestio— nó que se haya despedido a una trabajadora de un ministerio por pronunciarse sobre el caso de la congre— lista María Elena Fronda (Frente Amplio), quien con— trató en su despacho a Nancy Madrid, sentenciada por terrorismo. ”No se puede sacar a nadie del Estado por opinar”, sostuvo Del Casti— llo al referirse al caso de Lesly Chica Seguil, ase— sora legal del Ministerio de Desarrollo e Inclu— . sin Social [Mindes), < cuya titular, Lilia— l na La Rosa, es 1 duramente cues— _ tionada. 0 —",10
1510.9,785.2,161.1,33.5,77.6,dieron locuras yconta— ronchistesqueprovo— caron las carcajadas de transeúntes. También participaron,11
1557.11,1008.79,85.16,32.68,57.16,ue ea la Ag y acróbatas y © g otros actores >F relacionados en con el mundo | 'Wa circense. Lla— S,11
1816.75,1141.0,105.0,35.0,70.5,mólaaten— — pr CONGRESO,11
1709.8,695.8,178.8,33.6,58.5,"» ©o©… mentasestrafalarias, durante recorrido hi— —| para [selecciónfanúncióllalMunid me",11
2399.14,1052.95,70.82,27.64,90.41,Congreso de siete computa— horas Apple y lectores para diseño gráfico con un sobre— costo de 75 mil soles. El procurador anticorrup—,11
1357.43,1351.83,74.11,33.34,67.28,"a la gente y noslo ción un pa— ción Amado Eco ha pedido tomamos muy en ja P A caso vesti— al presidente del Congreso, E es e | (:((Wi] | €i!e 3 e na mira ta losartistasquecelebra— _ [ Jardinero? — Bin Lamento — tra, ¿mecastigaría A da adquisición, cuyo valor ronayerelDíadelPaya— —! ;$23:a amv::3,tamn al mga;g;¡;¡ou?p|;? bi d * d bap I!a ||U|p)£] referencia se estima que soon un pasa calle por —! y * , : : el Centrode Lima. %P0áqge a f&e£g:e W A allamaraPiza— © La Procuraduría del _ 30 % respecto de su Cientosdepersonajes —! Y!3 de1en| to"" u To l no hice la u'£""' o E e ii i ee connaricesrojas,pelu— — i Plantada! an majo... * ) e a na ) R . s )",11
1644.6,1739.6,193.4,123.0,41.4,e FINAL DELA UE R,11
1606.8,2435.8,171.2,84.8,37.0,ee oo | ) —UU,11
849.22,2699.67,177.44,54.89,83.78,Miralo en 4K por el Canal 4000 DIRECTO DIRECTO,11
1333.37,2827.08,56.14,21.24,81.87,"©2018 AT&T INTELLECTUAL PROPERTY, DIRECTO, EL LOGOTIPO DE DIRECTO, Y TODAS LAS OTRAS MARCAS DE DIRECTO CONTENIDAS AQUÍ SON MARCAS COMERCIALES OE AT&T INTELLECTUAL PROPERTY Y/O COMPAÑÍAS AFILIADAS DE AT&T. LA IMAGEN DE EQUIPOS, DIGAS Y/O JUGADORES ES A EFECTOS DE ILUSTRAR EL CONTENIDO DE LA PROGRAMACIÓN DISPONIBLE EN DIRECTO RELACIONADO A ELLO. NO HAY VINCULACIÓN CON DIRECTO 0 SUS SERVICIOS. DIRECTO ARGENTINA S.A. — CUIT PARAGUAY 610, PISO 28, CABA",11
1096.29,149.43,80.29,27.29,91.43,12 SÁBADO 26 DE MAYO DEL 2018,12
2467.25,1013.75,63.0,28.25,87.25,"P. Normal: S/ 8,999",12
1612.28,1517.33,98.5,28.17,69.17,J SAMSUN ie e SAMSUN LED LED LE65U797O LED UNSSMUS120 SMART TV SMARTT SMARTT ( Ultra HD 5),12
2564.75,1642.0,62.5,29.0,84.75,"P. Normal: S/ 3,299",12
863.25,1642.0,62.75,29.0,85.0,"P. Normal: S/ 5,999",12
1602.31,2119.44,76.19,29.88,60.5,SAMSUN ©[—<¿ LED UNSSMU61O5SG © — LED 49UJ6S10 LED 43D1810 S el 2 ]] d E,12
1759.77,2237.62,58.31,26.92,81.85,"P. Normal: S/ 2,799 P. Normal: S/ 2,099 | P. Normal: S/ 3,298",12
823.8,696.4,279.2,143.4,51.4,pr ee > TODOS LOS,13
2394.0,1640.0,61.0,28.0,70.75,P. Normal: S/ 1999,13
1468.2,1601.0,65.0,22.6,73.0,bt Ultra HD ] Curvo,13
1532.5,1672.0,61.25,28.0,64.75,"P, Normal: S/ 1699",13
665.25,1642.0,61.0,28.5,55.75,"P, Normal: S/ 1,699",13
1459.33,2102.5,110.33,24.0,72.33,LED 43UJ6300 LED HYLED4SS3INTM LED LE43S5970,13
1423.29,2178.79,38.64,20.07,65.21,SMARTT y y S S [ Ultra HD . Full HD [ Full HD,13
1527.75,2239.33,61.25,28.67,73.25,"P, Normal: S/ 1699 P, Normal: S/ 1,299 P. Normal: S/ 1,399",13
220.0,288.5,136.75,35.75,85.75,CON SU ESPOSA premiado,14
295.37,733.74,67.4,27.51,87.74,"él Por aportar a la alta cocina con ingredientes y recetas peruanos, el chef Gastón Acuario y su espo— sa Astrid Guerche fueron reconocidos con el premio internacional a la Innova— ción Eckart en Estados",14
721.82,747.68,65.37,26.63,87.87,"Eckart Witzigmann, el chef más famoso de Alemania, dio a conocer a los gana— dores y aseguró que ellos ”están revolucionando el mundo culinario de todo un país”. Recibirán el galardón en junio en Nueva York. — G",14
1137.58,1195.79,136.17,31.04,77.04,"a'pachamanca dela selección; con polloycar— nederesentro— zos, siete tipos depa— pa, camotes, habas, choclos, humanas y otrosingredientes, fue prepara da ayer porloscomercian— tesdelGran Mercado Mayorista de Lima,",14
731.81,2105.29,96.38,42.29,87.1,"<Comerciantes, en antesala al Día Mundial de la Papa, hicieron ”pago a la tierra' para que Perú le gane a Escocia",14
1190.4,2700.6,83.6,42.0,53.4,i o a panel usuario,14
251.5,2822.75,147.75,28.0,43.25,"ton regional delRadware! recomienda noicolocar,",14
1290.25,777.25,26.5,30.5,69.5,2 copa y la,14
1610.0,642.0,41.5,21.25,46.25,y .x w_—¡4 o,14
1524.32,1183.68,109.05,35.32,80.79,"rico potaje con habas, choclos, humanas y camotes en SantaAnita. Paraelaborarel sa— brioso potaje, como antesala al Día Mun—",14
1540.17,1360.67,98.5,35.33,90.0,"dialed la Papa, que se celebra cada 30",14
1555.61,1871.32,176.21,30.46,70.79,"ronunpozo, en el fondo encendieron ) fuegoconle— ña, sobras brasascolo— caron piedras y encima lacarne ydemásingredientes. Luegotaparontodocon hojas plátano y tierra. Cuando cocinero mi— rósurelojydiolaorden, procedieron a destapar cuidadosamente ho— yoyempezóasalirelri— cool or de la pachaman—",14
1544.3,2649.33,69.7,27.59,78.89,"a G$ tos que robaban celulares en los paraderos, fueron detenidos en Puente Agentes 'Terna' arres— ataron a Percy Mariano E Ortega [30), Animal Rodrí— et en",14
1658.57,2841.71,70.0,30.57,85.86,Juan Cóndor Mayoría (28) y José Vasquez,14
1535.75,2875.25,59.75,32.75,78.0,Correa (34). (E. Cirilo),14
2370.43,482.71,88.43,26.57,90.57,Mil restantes aprendieron sobre una correcta nutri—,14
2348.6,534.6,77.8,28.0,81.6,"*”. ción, lactancia y prevención",14
2181.35,694.28,55.21,26.33,78.39,",Q del cáncer. ”Ellas mere— G» Decenas de futu— —/ — cen una gestación ras mamás con — *” saludable y segura”, sus barrigas pinta— — Néx..—. preciso la gine— o das con los colores ** ! F M v % de la Bicolor participa— Mendoza, en el ron de una campaña de < a parque Pedro",14
1971.33,857.0,97.5,29.5,91.33,"maternidad saludable, organizada por el Seguro",14
2502.4,848.2,50.4,25.0,75.8,"Ruiz Gallo, en Lince. G",14
2202.77,1026.92,58.56,25.23,85.1,¡ SEPA ©De enero a la fecha se han comercializar 200 mil | ¡QuUE... toneladas de papa en el Mercado de Santa Anita. B B ©lLa papa cancán es la segunda variedad más requerida por las amas de casa.,14
1948.41,1768.17,109.51,32.49,78.32,"ca, queademásde sal, pi— mienta y ajos, llevaají panza y ajíamarillomo— lido, chinche y huacatay. Usaron30kilosdediver— sas variedades de papa, comocanchán, yungay, amarilla y huayro. Estaactividad, organi— nada por la Municipa— vidad de Lima, furor ganinadatam— ”pagoala e a saque losse—",14
2412.29,1613.46,124.42,29.27,73.69,"seleccionados nacio— nales puedan ganar el partido ante Es— cocia,este martes 29 demayo. NUTRITIVA El Perúcuentacon3 mil 200tiposdepapa nativa solen Cus— cose producen cer— cademil200varie— dades. Nutricionista D'Janira Pescar seña— aqueste tubérculos —— nutritivo porque “—_ aportacarbo— 3 / hidratos, vita— > xidantes. Es antiinfla— materia y reduce presión arterial. (Nathalie Salazar)",14
2308.57,2343.43,147.0,54.71,91.0,Hallan restos de 4 personas en basural,14
2222.04,2679.25,69.64,26.79,87.87,"Macabro hallazgo. Los GD restos óseos de cuatro cadáveres fueron encontra— dos en un basural, lo que causó alarma entre los veci— nos, en Carabayllo. Cuatro cráneos y huesos de extremidades estaban entre la basura, en la avenida San Pedro de Choque. La policía trata de establecer si son de reciente data. (e”|",14
915.0,636.17,224.33,53.0,66.83,I__Flpaísmásbellodel ReinoUnidoyformapar— — Escociacuentaconlama— — caballo con un,15
1685.33,150.0,70.33,30.0,81.11,SÁBADO 26 DE MAYO DEL 2018 — X 15,15
1886.88,441.82,114.12,36.29,52.29,"que ha sido motivo demásde10 pelícu— las. Allíseoriginóel golfenelsigloXV. , Sugslidiomassonel 2 e el el ese u el A ensugastronomía",15
1317.5,596.67,148.0,43.67,54.0,tirdesusmúsicos:con cuentosinfan— ue considerado el ) $ t,15
1363.44,748.69,155.24,35.29,71.61,"mundoenel2017 tedelaislaGran Bretaña. _ yorcantidaddeperso— cuernomágico —. , — ;| cor dero,harina,avena S€|€CCÍÓI1 del país 4 k p y P porsuspaisajes.Es— — Destacaporelusodelas naspelirrojasenelmun— — enmedio. y hierbasaromáticas)yel A cocia,queseráelrivalde — gaitas(paramantenervi— — doy su animal oficiales Escociatambiénesco— partanbreec(sopadema— _ Conn p9|II'I'O]OS Perúensupartidoamis— — valamúsicamedieval)y — elmíticounicornio,que no cida por la leyenda del — riscos).(TábathaPare— en el mundo toodle martes,esunade — lapeculiarformadeves— — es plasma do en todos sus _ monstruodellagoNess, des) [<)",15
1280.89,1046.0,111.22,37.89,89.44,EN DEFENSA DE LA VERDAD Y LA PROPIEDAD PRIVADA,15
1299.8,1122.0,303.2,71.2,83.8,COMUNICADO A LA OPINIÓN PUBLICA,15
1136.88,1309.03,102.06,37.28,89.84,"Con respecto al desalojo judicial producido el día 21 de mayo de 2018, en la Av. Proceres de la Independencia—Canto Grande, del distrito de San Juan de Lurigancho, deseamos precisar lo siguiente:",15
1246.3,1475.39,109.59,35.48,88.55,"o Nuestra empresa es propietaria de dos lotes de terreno ubicados en dicho lugar, cuya propiedad se encuentra debidamente inscrita en los Registros Públicos desde el año 2010, en las partidas electrónicas No 43202936 y 43202952 del Registro de _ Propiedad Inmueble de Lima.",15
1259.61,1613.52,90.78,38.43,84.26,") _Esftos lotes de terreno son, desde hace más de 70 años, propiedad _ privada y no pública como se pretende mal informar.",15
1168.53,1736.93,102.67,36.27,89.07,"o Dichos lotes fueron invadidos manteniendo así, la posesión de un área de dicho terreno.",15
1150.0,1840.91,96.25,35.72,89.09,"o El Poder Judicial, en todas sus instancias, nos ha dado la razón reconociendo ese inmueble como parte de nuestra legítima propiedad, luego de un proceso que se inicia en el 2014.",15
1193.78,2016.47,106.33,38.68,85.9,"o El desalojo se ha realizado de forma absolutamente legal, los ocupantes fueron debidamente notificados <5>_c1rc| que cumplan con desocupar y _ entregar a _ nuestra empresa, los lotes de terreno dentro de un plazo de 6 días, bajo a percibi miento de proceder a su lanzamiento. o El incumplimiento a la orden judicial, generó que el Poder Judicial ordene el lanzamiento.",15
1301.61,2221.73,91.07,37.39,87.78,"o La resistencia a este fallo es un nuevo desacato a la Ley y a las autoridades _ que llevan _ adelante esta acción. Este lanzamiento cuenta con respaldo legal y soporte policial, todo dentro del marco del Estado de Derecho.",15
1342.05,2330.53,102.74,37.95,82.21,"o Durante todo este tiempo, la Municipalidad Distrital de San Juan de Lurigancho ha recibido nuestros © pagos por",15
1192.7,2378.91,111.87,42.48,71.04,"concepto de arbitro e _ impuesto — predial, reconociendo por _ ende _ también _ nuestra legitima autoridad como propietarios de estos predios.",15
1076.43,2515.21,123.43,38.0,90.07,La informalidad y la arbitrariedad no pueden ganar espacio ni invadir las decisiones judiciales.,15
1272.82,2623.15,101.23,37.67,89.33,"Invocamos a los medios de comunicación y a la ciudadanía a comprender en plenitud este largo proceso que concluye de manera legal y justa, con el desalojo de quienes habían tomado posesión de un terreno que no es suyo.",15
1524.71,2763.29,112.86,36.0,88.43,"Lima, mayo de 2018 INVERSIONES ARIKI SAC",15
1501.39,1160.59,83.93,32.07,75.9,"eoF A E paradelinquir” Ladetenciónde este sujeto,quien afirmó haberase— sinadoamás300 e ie tiemposdelcár— tele Medel(ljín, seda á.0 otresañosdespuésde mató a más de haberlsalidolibretra(s1 Los hermanos Hugo cumplir un encierro de y Toby, dos perros a 23años. de raza labradoodle, se uu — Durantesupermanen— abrazan de forma con— m | SEPA QUIE'L. : |— ciaenlascalles,'Popeye; | | moledora cada mañana quien salió libre : Ima escrito los libros _ e s ese decía habe : Vida como sicario de Pablo :/ _ E | | dos durante 12 horas, ”Es e se pp ir a3= delitosqueseleimputan, | | como si se hubieran deja— regenerado acusado de escobar utiliza bg las redes s oci ado de ver mucho tiempo”, 7 ! M a : — lesparainsultaryame— afirma su dueña Debbie extorsión y amenazas a candidato , Young, una profesora de — y canal en Youtube. |! — CANDIDATO ra residencial mr — [ GA su madre, Aura : — a ie p a N y — P a : —— Los canes se emocio— antiguo temi— f' ' 1* 1 AV: 10 K tan 7 casas y una tomasen las redes es el tanto al verse que se dojefedesica— /7 o pr y ex alcalde de Bogota y paran sobre sus dos patas riosdePablo E l ex gu err ill ero del grupo y se abrazan como dos Escobar,.Jhon M—19,Gustavo Petro,can— || personas. Luego, salen aire Velasquez Vás— ta ll di dato a la presidencia l a T la quez, Popeye' fuecap— 2 de los delitos _ deColombia,cuyaselec— ei uradoporlasauto— ; ¡M extorsión — cionesserealizaránma— — || es amorincondicional”, idadesdeColombia y'concierto — ñanadomingo. © || añade Debbie. en la ciudad de Mede— = Espectaculares foto— — temida por su venenosa e i gracías que ya dan mordedura. Ganam 28 millones V la vuelta al mundo fue— La serpiente estaba ocul— Pellea|m en seguiran f(|rabaj]ando ron tomadas en el parque — ta en un abrevadero y el Calles eo nacional Yala, Sri Lanka, lagarto, tras descubrinla, la C> Los esposos Donna sigue igual en sus vidas. donde un poderoso coco— — atrapa con sus mandibulas m©mems (48) y David Shickley Donna afirmó: ”Vamos a dilo se enfrenta en una y Ia destroza en contados (58) ganaron 21 millones de — seguir trabajando, no cam— pelea a muerte con una ”",16
1787.62,1763.75,64.75,32.88,71.88,.> minutos. — G G» La violencia recrude—,16
1329.05,1799.58,62.89,28.53,81.16,"libras [unos 28 millones de b|0 E e ee Russell dió en Nicaragua y en de León, donde disparaban",16
1473.22,1968.17,60.39,25.17,71.14,"dólares) de la lote— ) normalidad”. Ella es ... 329 y , . ... ..— las últimas horas murie— morteros artesanales. e l ea (o s —o_.¡ _— * g d 1 6 me. ron al menos dos personas — Las protestas comenzaron pero se entera— ” r : y p y por enfrentamientos entre e| mes pasado, provoca— : ” ” manifestantes y grupos X das por un intento de semana — ¿ y y E ee afines al Gobierno de N reformar el sistema de después. — | íé&¡_ E ie e Daniel Ortega. Estudian— — _—… seguridad social. Desde S l —3 ” cimiento de tes enmascarados 3 ** F entonces, han muer— vos ricos —. ee % aviones de una formaban [ e e señalaron '“—""—“í*==—, y Q_ a barricadas más de 800 fue—",16
1496.38,2172.31,48.15,28.0,80.69,que todo tienen hijos. _ G en la ciudad ron heridas. _ G,16
2063.17,2475.5,201.67,51.83,79.83,Yumi [TU©© Aprovecha nuestras ofertas exclusivas,16
2190.5,2683.12,95.38,28.38,75.38,ENVÍ© GRATIS ¡Y llévate 2 entradas ol cine!,16
2195.64,2786.55,81.18,41.45,79.45,3 FANDANGO con 8 comercio Pos compras mayores a _J b,16
513.73,1334.37,72.54,24.5,90.27,"creció de arriba hacia abajo. Luis no siempre fue lateral, sus inicios fueron en ofensiva. De adolescente, en el Esther Grande de lo ubicaron como volante por derecha. En 2009 fue convocado a la Sub—20 y continuó en el mismo puesto, pero a su regreso al Zurich juega de puntero. Al año siguiente llega a Sporting Cristal y ante la presencia de Junior Ross e Sirven Avila en el ataque, el técnico Roberto Mosquea lo ubicó como marcador derecho. Realizó entrenamientos por la noche al lado de Víctor Reyes Condori, un técnico de Cristal que le enseñó a cerrar como central, proyectarse con equilibrio, meter centros a la carrera y retroceder a velocidad. Allí nació otro jugador.",18
510.77,2511.84,60.9,24.32,85.71,"'ñ ?eloz en la cancha, lento en el amor. Conquistar | a Gosselin Cassoni —ahora su esposa— no fue tan fácil como eludir a un rival. Se conocieron en el 2009",18
480.5,2694.83,66.71,24.97,89.17,"'| y pasó un tiempo para convertirse en pareja. ”No fue ni tan rápido ni tan lento para enamorarme, ja, ja, ja. Lo quiero mucho, pese a que a veces reniega, ja, ja”, contó su señora en anteriores entrevistas. Fruto de ese amor nacieron los pequeños Luis Fabiano (7) y Gian Lucca (4). Ellos suelen vestirse igual a papá y llevan la alegría en los genes.",18
713.78,313.44,86.67,31.33,84.33,DE VOLANTE PASÓ A DELANTERO Y HOY ES LATERAL,18
979.67,150.83,66.17,24.17,91.17,SÁBADO 26 DE MAYO DEL 2018,18
1204.79,2607.38,66.27,24.86,87.16,"a ciudad de la ale— fría tiene habi— E E a a tes. Aquellos que te motivan a se— huir con optimismo y cu— bren con risas cualquier lágrima. Luis Advíncula pudo ser percusionista —la otra vocación que lo llama— ba— pero un balón lo atrajo más. Sin embargo, el ritmo nunca abandonó su cuer— po y hoy es el seleccionado más alegre de la Blanqui— rroja. Si hay que bailar fes— tejo en la Videna, llámenlo",18
1994.53,2801.5,103.14,36.86,80.67,"EN SU MALETA NO MAY CMIMPUNES, CAMISETAS, MEDIAS Y CANCILLER LUIS VINCULA TAMBIEN LLEVA LA A RUSIA, EL INGREDIENTE ADICIONAL PARA MOTIVAR A LA SELECCIÓN. ES EL NOMBRE QUE SONRIE, VACILA Y Si LLORA, ES DE",18
138.75,151.0,112.0,62.75,68.5,$ DEL MUNDIAL S,19
240.4,2537.64,64.27,25.11,88.94,"a Luis. Si hay que mover— se al ritmo de la timba cu— bana, allí está él. Su swing causó furor en Argentina cuando anotó con Newell's al poderoso Racing y las fa— náuticas pidieron que cada vez que haya un gol, el 'Rayo' debía bailar. El lleva la batuta de las bromas, pone apodos a los compañeros cuando jue— ga PES, le buscó en Miami un a Carlos Latón y hacer joda' en plena prác— tica es parte de su entrena— miento. Veinte años atrás, cuando dejó Chincha para vivir en San Martín de Po—",19
680.62,2536.96,65.75,25.34,88.96,"rres, 'Lucho' era igual, De niño escondía los guantes de box que su padre (exfut— solista que jugó en Melgar y Torino) le compró pen— dando en que sería suce— sor del gran Mauro Mina. Se escapaba a jugar fulbi— to a las 5:30 de la mañana con sus amigos Jimmy, Car— los, Ronald y Rudy, y ponía la comida que le dejaba su mamá debajo del mueble, pues por 'pelotear' no le al— cantaba el tiempo para lle— nar el estómago. Advíncula estudió la se— cuidaria en el colegio 'Isa— bel Chimp Ocllo', debutó",19
1225.1,454.3,55.8,25.6,73.5,"ndete bo— re la sonrisa, — pase lo que pase”",19
1232.8,326.2,66.2,45.6,82.0,El dicho (que más re—,19
1229.67,772.42,58.08,26.58,84.08,"res latera— les que he ida y vuelta, y mucha po— tencia”",19
