left,top,width,height,conf,text,page
1305.17,151.0,107.33,25.0,90.0,VIERNES 16 DE NOVIEMBRE DEL 2018,2
459.08,1012.23,55.54,32.0,51.77,1 1) ol H t ideal Aceite vegetal ee na útil E >¿,2
507.2,1553.2,76.4,21.8,75.8,Duraznos en mitades BELLS lp,2
516.6,2004.2,93.8,28.2,77.0,Gaseosa FANTA/SPRITE bt x 2.25L9,2
495.25,2492.12,77.5,27.12,85.38,Shampoo/ % Acondicionador DOVE fr x 400 mi,2
1462.4,1072.5,59.6,24.7,66.1,Arroz l y VALLENORTE superior y P£'.M9>Rl .'!'/ 5 —,2
1196.18,1581.09,53.45,22.91,86.91,Todo Leche evaporado GLORIA pk x 6 la x 400 g,2
1148.83,2003.67,44.17,29.17,63.0,Agua (ei 2Ko) bt x 2.5L,2
1228.0,2510.46,93.0,26.15,84.69,"Pañales Premium BABYSAT Superpack/ Superpremium cuidado total Tallas: P, M, G, XG, XX",2
1831.22,1101.89,87.67,24.22,76.89,Trozos de atún PRIMOR/CAMPOMAR/ REAL/GLORIA la x 170 g,2
1861.0,1519.33,87.83,23.17,90.67,Todo Bebidas lácteos UH LA PREFERIDA,2
1851.44,2504.89,79.11,25.44,89.11,Detergente en polvo OPAL Advance/sports/ bl x 2.6 kg,2
2452.5,1057.75,67.75,23.5,87.25,Aceite de soya SOYA,2
2441.86,1531.29,71.29,27.14,84.29,Yogurt bebible GLORIA regular gl x kg,2
2451.67,2472.33,98.17,25.5,78.17,Detergente en polvo BOREAL floral/limón ir,2
1588.38,152.0,108.62,29.62,79.25,VIERNES 16 DE NOVIEMBRE DEL 2018 tromel] 3,3
249.5,905.25,140.75,98.25,50.75,t/f<íj SICIÍ| © ea,3
1729.0,888.4,139.4,95.6,66.4,5/5 65 515.9o S/c[|cn 79,3
1391.2,1048.47,83.87,36.67,58.73,"a F Po""o fr a nodo ZC—“"":>' Filete de pechuga ÍQM.X a e kg oo",3
1453.0,1478.33,56.5,31.23,61.47,n 49 S/ (0).90 l Kele — Z f Huevos pardos 2 Costillar de res e a 3 B — 2Chorizopre c j be 15 unid i>¡<('go a ;1¡Xs gg(á(()ó)llA,3
367.75,2019.0,53.25,20.88,65.0,Crema dental r COLGATE tb x 75 ml,3
395.57,2339.71,166.29,84.57,48.43,s — ¿399 £ s¡2.29 F —,3
1573.0,1884.0,83.36,54.07,53.93,"s¡í] : ” a s¡c[| .99 r , Melón coquito y x&.£ en ”",3
1819.75,2005.25,47.0,25.5,85.5,kg kg x unid,3
2047.23,2365.54,95.38,59.92,51.69,"2 ea . 512©.90 ra ¿&_1; > <| '>.r ':.… “,*) a o“//'",3
1030.6,2465.8,81.85,30.0,78.9,", __¡ Papel higiénico Zapallo madre Pollo rostizado + SUAVE Rindemax N papas + chicha _-___ ! — Doble hoja",3
2120.17,2510.0,56.17,24.44,82.33,1 — Postres de la casa s! morada NATURALE bt xTL+sachet Ají de la casa x 30 g,3
222.0,144.5,59.75,41.5,70.0,& — (AL DÍA),4
533.02,743.89,68.79,28.28,90.61,"i amigo Gary llegó al restaurante por un cebichi— to de doncella y una jalea de pescado y mariscos con cremita, rocoso y, para la sed, una chicha morada al tiempo. ”María, vi con indignación y sorpresa un in— forme del Programa de Beto Ortiz sobre cómo en al— unos de los restaurantes más exclusivos de Lima los dueños les quitan las propinas a los mozos. ¡Increíble y vergonzoso! Cuando yo dejo propina en un local, es para la persona que me atendió. No es para el administrador, el gerente o el dueño, que seguramente ganan muy bien con el precio que cobran por la comida. No conozco a un mozo que tenga dinero, pues son perso— nas humildes que con suerte ganan el sueldo mínimo. Así que las propinas, que son un reconocimiento a la aten—",4
784.5,1074.86,72.76,31.86,87.88,"ción brindada al cliente, les deben servir bastante. Este A|armada or ola de robos abuso contra el más débil de parte de poderosos em— P presagios es, sin duda, el lado oscuro del boom gas— ©D Me dirijo a usted para informarte que en económico de nuestro país. En la referida investigación la avenida Lima, cruce con Universita—",4
534.04,1702.84,70.37,29.79,88.79,"televisiva, es mencionada ”La Trattoria Di de Larcomar, donde el mozo Percy Carrillo denunció que si él o sus compañeros no logran llegar a la cuota exigida, deben con su propio dinero. Dijo que si una mesa tiene un consumo de mil soles y solo le dan una propina de 20 soles, él debe poner 10 soles. iO sea que, incluso, sale perdiendo! Si por el contrario le dejan 50 soles, él está obligado a entregar 30 soles al local. A esta fea costumbre los em— presagios la llaman retención” Carrillo calculó que el local, dirigido por Carlos Mulanovich, obtiene unos 16 mil so— les mensuales de las propinas que le quita a sus mozos. También se hizo referencia en el informe a ”La Trastienda Crio”la Fusión”, del parlamentario Carlos Bruce. Una me— sera venezolana denunció que en el año que lleva traba— dando en ese negocio, nunca le pagaron los feriados que labor por ser extranjera y que además tampoco está en planilla, como ninguno de sus compañeros de la misma nacionalidad. Consultado sobre este tema, Bruce negó las acusaciones y aseguró que cumple con las leyes. Es hora de que el Ministerio de Trabajo se pronuncie sobre este asunto y defienda los derechos de las personas que laboral en estos lugares. Los empresagios podrán alegar, como ya lo hacen, que la retención de una parte de las propinas de los meseros es el cobro que realizan por haberlos formado. Podrán dar peroyo cierto es que les están quitando su dinero a personas hun vii de s que trabajan muy duro por Hear el pan a su mesa. Hasta cuándo cierto sector de empresagios dejará de ver al trabajador como ”choto barato”, esa subcate—",4
1289.54,1275.8,67.38,26.78,89.42,"ria, se producen continuos asaltos y robos. A pesar de que los vecinos realizamos rondas para cuidar la zona, ya que los serenos ni se aparecen, los delincuentes siguen haciendo de las suyas. Aprovecho la oportunidad para felicitarlo por su gran labor. Cordiales saludos. Carla Polaco : DNI 709482% :",4
1265.51,1583.61,59.63,27.05,89.51,"La lectora nos escribe de San Martín de Porres. Esperamos que las nuevas autorida— des de este distrito, en coordinación con la Policía Nacional, tengan éxito en su gestión, especialmen— te en lo que contiene a la lucha contra el hampa.",4
1194.56,1825.89,56.67,24.0,72.33,"SA, YO BAMBI a l LE ROMPÍ LOS DIENTES!",4
1342.4,1938.8,41.0,28.6,56.2,¿Y QUIEN [3 rg a,4
1211.25,2326.93,69.25,27.99,76.41,") y Director —. Contenido Fax 311—6353. Impreso en la Planta Dando de Empresa gorda de peruano creada desde hace tanto tiempo por el t…& iii racismo y el desprecio de quienes se creen superiores por Carlos Eog;—;mgg tener más dinero”. Gary tiene razón. Me voy, cuídense. Espinosa . — — | 10005105 dE/ChOS reservados, — e a E Pubiodad 708—9999, | Prohibida su reproducción total o parcial.",4
1305.33,151.0,107.17,25.0,90.17,VIERNES 16 DE NOVIEMBRE DEL 2018,4
1864.6,1012.0,91.8,46.4,74.8,:_Tengo miedo de salir sola',4
1934.0,1095.0,51.38,26.75,84.38,"”Ya llegué, estoy bien, no me ha pasa—",4
1864.38,1229.11,50.8,27.33,85.44,"B C> do nada', £s la frase que escribo en un : WhatsApp cuando llego a Se repite día : a día, pues la seguridad en Lima es cada vez : peor. ¿Por qué por el simple hecho de ser : mujer tengo que vivir con este miedo? Aunque : duela admitirlo, como mujeres no estamos : seguras en la calle.",4
1917.13,1519.47,57.4,26.47,92.07,"Pese a la recurrencia de actos delictivos y la demanda de medidas más efectivas, la",4
1861.04,1615.09,55.83,27.61,72.39,: seguridad en las calles no ha El nue— E a ll A ea : semanas en el cargo. Esperemos que haga algo.,4
2396.27,413.92,56.19,27.04,70.12,Alan García pierde los papeles: o s r d i El tema debe estar recontrane— r e e d 3 salida del país? KARINA P NOVIA,4
2339.25,700.0,151.25,35.0,62.25,D|ctan36mesesdepnsón Ana Herz. Ke|koysucupdatras,4
2392.0,1071.14,56.43,24.71,79.71,AT Areca al frente de la selección?,4
2403.35,1605.98,85.32,28.8,78.68,AYER ¿Aprueba la labor del fiscal José Domingo Pérez? ? SI82% INIO18% * TROME.PE (s a —— *VENTA 4 EMERGENCIAS Bomberos 116 Emergencias d Defensa Civil Salud 4118000 3623277 Escuadrón Verde — 4276904 Luz del Sur Semanal 3178000 Indecopi 2247800,4
2449.47,2296.53,43.67,21.73,78.67,Hecho el Depósito Legal en la Biblioteca Nacional del Perú N.o 2001—1992. d d 3,4
2096.5,2789.75,78.75,27.0,84.0,INSULTAS HORÓSCOPO DEL AMOR | Y MUCHO MÁS..,4
1580.88,150.25,91.88,31.38,88.38,VIERNES 16 DE NOVIEMBRE DEL 2018 — 5,5
1232.17,516.0,300.0,64.67,87.83,Para Mujeres Insuperables PRECIOS BAJOS SIEMPRE,5
1477.0,1091.5,41.93,21.57,60.29,S e ta s l Asado de tira con & : i! ADICIONAL kg,5
1887.58,1184.17,65.58,44.08,60.33,"o, | | o, [ConiTarjeta Ú © dé)cto. Cencosud 2© £¡o_ cen co sud",5
434.33,1463.44,46.67,27.89,62.33,", a q .£0 l g,_,g 20 clásico xxl",5
577.0,1977.0,57.5,17.25,65.75,Florida aceite vegetal o,5
1510.0,1592.0,77.8,40.8,75.4,9 ) Pollo fresco Metro,5
2333.33,1978.0,48.83,26.5,50.5,tgf:he 9v?porada 9 £3 E 4,5
1460.15,2414.18,48.65,24.35,56.32,a ) x : PA ) fg&cmsmxdmugapas pA : ie * — o£nz<:salKolaregular : Y Í'c&osn g:;gnafor 2RA1151pgtedeloallhas y : k B € E luz húmedas les active %;—g % '£¿1': freshx48un »,5
1227.78,2635.33,120.67,42.67,70.89,El metro peru _ — (©977455104 Encuéntralos también en DEFOE,5
1140.64,2724.04,49.55,15.17,86.47,"Elemplo; TEA máxima referencia considerando una TEA de 99.9%, para un consumo total de 5/1,000, a un plazo de 12 meses, pagará cuotas de S/ 139.44, que incluyen el total de intereses de S/ comisión por envío físico de Estado de Cuenta mensual 5/ 4.90 y gastos por Seguro de Desgravamen mensual 5/7.90. Se cobra una comisión anual por membresía de S/ 99.00, Mayor información sobre restricciones, tasas, comisiones, penalidades y gastos aplicables, ingresa a",5
1122.55,2834.96,51.57,13.88,84.1,"Condiciones: Promoción exclusiva pagando al 100% con Tarjeta Cencosudl Descuentos válidos presentando tu — ¿bonus en Tiendas Metro a nivel nacional del 16 a! 18 de Noviembre del 2018 y/o hasta agotar stock Stock mínimo 1 unidad/packs/kg por producto. Stock y surtido sujeto a disponibilidad de Tienda. Promociones exclusivas para consumo familiar, No accumulable con otras promociones. Máximo para abarrotes y predecibles 3 unidades/packskg por producto durante la vigencia de la promoción, Fotos referencioles. Promoción válida sobre precio regular. Precios regulares tomados de la ciudad de Lima. Ofertas no disponibles en tiendas Metro: México, Manco Capac — La Victoria, Barranca — Ovalo Balta, Bellavista, Los Héroes — San Juan de Miraflores, Perricholi — Rimac, Martín — Breña, Plaza Castilla, Paseo Chorrillos, Chosica, Grimaldi del Solar — Miraflores, Alameda Sur, Hablas — Chorizos y en Provincias: Las Quintana — Trujillo, Santa Victoria, La Victoria — Chiclayo, Castilla — Lambayeque, San Eduardo — Piura, Hunter y Arequipa Norte. ”Inca Kola, Coca Cola sabor original / sin azúcar 15 L o chicha Naturale L.",5
932.67,150.44,114.89,29.44,83.56,6 _ f(ACTUALIDAD) VIERNES 16 DE NOVIEMBRE DEL 2018,6
941.17,299.5,109.67,31.75,88.17,Todos los días inscribe tu'Número de la Suerte llamando al 710—0260 www.trome.pe,6
1427.2,331.6,83.4,15.8,90.6,NOMBRE: JUAN VOLVERSE DISTRITO: RIMA,6
1480.0,370.0,48.67,15.0,83.17,No DE LA SUERTE: 404239 (3,6
2004.62,348.75,62.88,16.5,80.12,NOMBRE: IRENE ECHEVARIA DISTRITO: ELLA EL SALVADOR — DISTRITO: SAN MIGUEL No DE LA SUERTE: 4555089,6
1900.62,279.38,85.0,23.75,67.0,Los 3 iremos pe $/500 oer dia 135/11/18,6
1183.79,690.19,92.87,37.15,64.46,"CON 'EL GATO DE LA FORTUNA' El Gato dela Fortu— na'eslatremenda promoción que no soloreparte5 mil m premios en efectivo, si— ¿g noqueademástease— WD © |:?é] A dura nacen navide— 34 *—— ñainolvidable, pues |mi m p l on 33 a a lal] “ de ocho kilos. W[I Pt % El sorteoserealiza—",6
1476.08,1006.38,133.23,36.85,56.15,"dees— &y/ temesenlaTienda ( Trome(Pasaje Acu— 10010! — ña120,CercadodeLi— d 114 Loúnicoquedebes ha—",6
394.58,990.92,113.58,42.08,85.67,<Anota tus datos en tu cartilla y depositada en los lugares autorizados,6
1240.38,1199.75,82.5,34.25,76.0,Salen los viernes y podrás | _ SUPERLLAMADA,6
1574.5,1726.83,52.67,25.5,92.33,"Para tentar a la suerte, solo",6
1342.8,1996.08,94.84,23.8,80.44,"Diganle ADIÓS al dolor de la Columna, Hombro, Rodilla y Talón CON LA NUEVA TERAPIA DE ONDAS —— REGENERADORA ARTICULAR —— % P ie F",6
806.0,2156.2,79.2,18.0,85.2,SOMOS FABRICANTES DE ÁRBOLES y,6
621.44,2206.33,72.78,20.22,87.67,DE TODO TAMANO E IMPORTADORES DE LUCES Y ADORNOS.,6
1275.44,2475.79,87.79,30.24,81.03,"ATENCIÓN VENTA MAYORISTA Y MINORISTA Ciática, Pico de Loro, Escoliosis, Espolón, Hernia Discal, Lumbalgia, Artritis y Artrosis 1 GRAN CAMPANA — de Del 12 al 25 s ga ()C adrillosiRex)] > 5328.309 pm ©975'5'89547",6
594.0,2442.21,68.79,18.84,78.21,"*_ Jr José María Rasgada & 713—715 Lima Cercado alt.odra. 8 Av. Oscar Benavides (ex—colonial) Telf, 51—1—332—3112 / feliznavidadzg©gmail.com",6
446.05,2587.32,33.58,18.53,63.68,p l l a ea e + Jr. Puno 618 Int. 108 Lima — — Jr Andahuaylas 691 Lima,6
2146.43,612.37,132.34,35.66,62.26,"ul y -. E e i nne i ©15premiosde5milsoles ! Mientrastanto,loslec— : ©30premiosdemilsoles i toresdeTromequega— o nar9nplat¡taengfect¡- : ©100premiosde200soles ! Yo Siguen Pasandolo H y : — cajaparacobrar. :©250premiosde100soles ! que lle— :©4555premiosde50soles..< naruna columna de",6
1933.2,996.53,102.13,30.47,74.47,ceres anotar tusda— tos per— senales en lapar— te posterior de cartilla y de— u posit arla en los ___ j,6
1218.64,1494.72,66.51,31.98,80.21,"H(Q) $alle en Ik|]t adquirir ;:ada ] tu| PRE_MIA bitte llamando quiosco favorito por solo ' al 710—0260 o d|e C(Q)Hdlu€fg©|f 10 soles. El viernes pasado Erce dmnng0 salió un cargador USB para |!amos e Hoy es la segunda Android. a ) entrega de la colección © Viernes 16: Cargador 5 mull so!les N) Puedes el Kit del Conductor, con E [3 Y hacerlo los accesorios necesarios © Viernes 23: Soporte de CAE Este domingo pue— g» . delinea para que las personas que celular en ventilación. des ser el ganador */JH domingo, de 6 se sientan tras el volante © Viernes 30: Soporte del reventón semanal de 5 de $¿ de la mañana tengan un via— para volante. mil soles de la 'Súper llama— z.-._Q¡ B a 6 de la tar— je divertido y — © Viernes 7 de diciembre: | — da ganadora', la promoción ; e l seguro. Cargador de pared. más regalona. _ los sorteo se",6
2131.5,1726.75,40.5,25.0,93.0,realizan a las 7,6
2487.11,897.16,81.63,29.37,76.32,cinco casillas de la cartilla y de for— ma automá— ticasega— na el monto que apare— ce anotado parte,6
2415.61,1470.12,72.92,27.88,84.76,"de la noche, siempre ante un notario público. Inscríbeme todas las veces que desees, pues mientras EE e tus oportunidades de ganar. Además, de lunes a viernes tenemos tres premios dia— rios de 500 soles cada uno. UE Ayer ganaron Juan Volverse (4404239, del Irene Echevaria (4339731, de Villa El Salvador] y Leonardo Sosa (4555089, de San Miguel). 3",6
1933.5,2113.75,174.25,53.75,40.25,: DEPARACHOQUE [ 3,6
1975.19,2247.86,43.38,27.76,67.57,": — Las Mejores marcas de — a e a e ) ; — para tu vehículo, en un E e",6
1982.11,2701.78,57.89,23.89,82.44,Afila tu y flota vehicular y liviano y pesado,6
2177.4,2856.45,63.1,24.45,87.45,y Busca nuestra red de Tiendas en: — www.renusa.com.pe Promoción válida presentando este cupón. Vigencia de acuerdo a cada promoción,6
2389.0,2670.8,54.8,22.6,83.6,P Estamos a nivel nacional,6
2402.18,2731.55,63.82,30.27,70.0,al por mayor menor 4 Vari_e'da'dee productos! más da 100 marcas,6
1698.0,151.56,99.78,31.67,85.11,"VIERNES 16 DE NOVIEMBRE DEL 2018 ""' _ 7",7
1969.7,637.0,62.3,47.5,75.0,D EL 16 AL 18 DE M B R E,7
2137.2,1154.6,63.4,29.6,75.8,f o ADICIONAL CON a,7
199.62,678.12,17.0,61.62,80.0,ee romoción. Las ofertas son exclusivas con Tr,7
222.88,1009.62,25.88,37.5,57.0,na otra Xl IR nr]?2 g%' E d,7
247.33,656.44,18.56,58.89,73.56,"gravamen S/5, Comisión de membresía anual de a s",7
208.88,879.38,18.38,43.12,71.88,intente en cada tienda. Precios es E n'5,7
205.45,1340.73,20.18,48.45,87.18,pones no son accumulable entre sí ni accumulable con nin y,7
179.0,1331.67,23.33,56.0,36.5,a a e s a d,7
287.31,1557.06,22.5,47.69,63.5,"olor q vidad por pago fuera de fecha [ a i — y ( , ,",7
195.75,1880.25,29.0,92.25,59.25,stn:l?memm i 82uu%adu/ d,7
272.09,2105.55,17.45,48.27,80.09,[ un r envío fusi difundida de acuerdo a Ley No,7
2035.75,2495.5,107.25,27.5,76.5,— MUJER — INFANTL),7
1842.0,2760.86,115.86,50.43,86.29,"Estés donde estés, compra en ( *g",7
1305.33,151.0,107.17,25.0,90.5,VIERNES 16 DE NOVIEMBRE DEL 2018,8
337.5,148.0,135.5,38.5,66.75,8 _ actualidad Erome:,8
1299.06,310.35,65.88,29.82,88.41,y © Tres agentes del Inge seguían siendo hasta ayer rehenes de 23 peligrosos presos del penal,8
1758.25,287.5,69.0,30.5,85.25,"nada por el preso Julio Becerro Espejo, 'Gor—",8
2364.85,308.46,76.54,27.92,81.46,"por el control del recluso— rio, murió apuñalado 'Gordo Julio”, mientras que 'Llaverito'",8
1772.81,440.04,73.38,28.88,83.27,"do Julio”, de la banda 'Los Ochenta', y Miguel Angel Chavez Loyola, 'Llaverito', de los extorsionadores ”Los Pulpos”, ambos de Trujillo. En el enfrentamiento, que sería",8
1297.28,462.6,80.04,27.76,85.08,"g— Challapalca (Tacna), quienes exigen ser trasladados a otros reclusorios. Fueron capturados cuando ingre— saron al Pabellón N.o 1 para terminar con la pelea protagoni—",8
2333.29,474.1,78.52,28.14,81.05,"quedó herido. En dicho penal están Gerald y Oropeza, Tonny Montana!, Angelo Espinosa Brissolesi, 'Renzi— to', y otros peligrosos reclusos. 0",8
224.2,440.6,138.8,51.8,61.0,un muerto A p g,8
307.22,1648.22,115.22,39.56,51.33,bala zo [deudosisospechan'que detrás del intercept ——3 bosque uniadto],8
659.93,898.27,108.8,41.93,88.53,"banda ”Los Chalacos' asaltó vivienda de comerciante de cuyes, a quien amarró junto a su",8
1522.38,2211.38,218.25,32.38,77.88,"nunadespiada— damujeralmando, unabandaderoba— asasasaltólavi— vien da de un criador de cuyesy, tras mantener se—",8
990.73,2516.29,66.2,27.98,89.95,"Con el cuento de comprar un biberón, una mujer y sus dos cómplices de la banda 'Los Malditos de Oasis' asaltaron tres botitas en menos de 24 horas, pero la policía los capturó cuando planeaban otra fechoría, en Villa El Salvador.",8
1009.59,2675.53,58.71,27.29,91.18,"”Robaron 9 mil soles en efectivo y medica— menos por un valor de seis mil”, preciso el",8
1486.4,2501.8,116.0,51.4,89.6,VICTORIA Mujer mata a su,8
1892.12,1981.94,175.88,30.88,68.41,"cu estrado s a los dueños, llevó dinero y joyas por unvalorde30mil soles, en Puente Piedra. Pero fue— ron arrestados cuandofugaban. Alas2:00delamadruga— da,'LosChalacos'irrum— pie ronen el inmuebles",8
1954.5,2273.75,179.75,31.75,65.25,"D,lotel,urbanización SantaPaula. Al ysues—",8
1957.39,2546.14,63.57,27.89,84.79,"m Luego de una dis— €D fusión cuando tomaban licor, Lidia Sampán Campos (29) asesi— nó a su supuesto amigo José Quise Zapallos (44) al incrustar en el",8
2368.27,1454.89,185.44,33.9,65.45,"pos a los amor daza ron y ataron de pies y manos. Durantemediahorare— buscaron todo in— mueble, hasta las jaula s deloscuyesycogieronto— doloquehabíadevalor. Laféminaquedirigiael atracopreguntaba'dón— deestánlos Conlorobado huyeron trescarros. Enlasalidade laurbanización,detecti— venderla Direccióndeln— teligencia(Dirin) del De— pincriCarabayllo,queles seguíamos pasos,losin— tervinieron. Fuerondetenidos Ne— ley Quiro Rojas(31), gra', WalterSánchezRa— mírez(46),Chato';Alber— toSegundoSalvadorTa— _ mayo(40), 'Gor— do'; Kerry Mi— chal FriasSan— chez(52),'Negro'; LuisChumpitaz Vásquez(43), j ga ta ránCabana(39), 1 | Selesincautólos 1 autos de placas | F9K—428,F1T392 y DOB—514.Enel primerosehalló documentosdelosagra— viados,sogasyunagra— nadadeguerra.Lasvicti— mas,albordedelaasfixia, reconocieron a la 'Negra' (EdgarCirilo)",8
2397.5,2469.0,70.5,27.75,89.0,"los Ríos, cuando ambos",8
2433.6,2583.93,59.07,27.0,89.47,"Hayas (34), pareja de Lidia. ”La chica es malcriada, con todos se mete, ella le",8
2197.8,2675.9,71.9,29.2,71.0,"& ha metido un 'puntazo”, pecho un destornillador — S",8
1592.26,2793.65,61.52,27.62,83.54,"jefe de la comisaría Urbanización Pachacá— de unos 20 centíme— 75 víctima. La mujer y mac”, mayor Luis Mango. A los sujetos se les tros, en La Victoria. v, incautó un revólver y el cotopaxi 3678—0€, El crimen ocurrió a y intervenidos con el con el que huían tras delinquir. . Yucra] G las 7:30 de la noche, arma homicida. (. entre los jirones [+]",8
1656.25,152.25,110.25,27.5,76.5,VIERNES 16 DE NOVIEMBRE DEL 2018 (AVISO) _9,9
1805.4,590.0,114.8,58.2,57.4,Te els més por menos,9
1471.27,1533.27,77.91,31.91,68.09,H IMBATIBLE ) o Dén|m _ o Subpack mezcla láctea compuesta,9
1454.05,1905.8,55.63,30.79,67.32,"H H P k l eo Six pack evaporado COTTUS IDEAL Amanecer NutriFortx 3959 Yogurt GLORIA galones x kg Azúcar rubia COTTUS x kg EAN:2000417096168 F EAN: B B n ! H ¿…;o…o':2 H o¡x'»ogl Patsak H P a H IMBA""BL£ 1 ó IMBATIBL£ 1 ¿!1 ¿4í!3 : visito ” EE - - F - - preciado S / .é9 H s / 89 1 Arroz extra COTTUS x 5 kg Aceite vegetal COTTUS xxl H Aceite vegetal PRIMOR Premium x 1 L ne B B et",9
1551.1,2605.59,58.77,31.1,68.07,"i | yl Pack: Cerveza PILSEN H H twelve pack lata x 355 mi 53 H Á:|P © S /4 © t CORONA 3 o P F F A l SP(………,LZS S/ 99 e ea _ Panteón COTTUS caja x 6 un ? —— Duraznosenmitades COTTUSx820 g — : Huevos pardos COTTUS x 30 un : TOMAR BEBIDAS ALCOHÓLICAS EN : EaN:2000406987861 j o ep ”PRECIOEXCLUSIVOCONCMR Stock: 100 kg nivel nacional.",9
1325.55,2822.66,46.27,17.04,79.7,"Elomplo: Consumo total de S/ 1000, plazo 12 meses, envio fisico de estado de cuenta mensual S/ 7.50 (a solicitud del cliente . membresía anual: S/ 39.00, seguro de Despravamen mensual S/ 5.90, pena”dades por pago atrasado adicional al interés compensatorio por atraso, factor de amortización de 24 meses, Año 360 días, IT 0.005%. Infórmate sobre las condiciones, de las Tarjetas CMA y Reglamento CMA Puntos en bancolalabella.pe y Agencias. Condiciones; Vigencia del 16 al 18 de noviembre de 2018 en Hipermercado Tottus. Ofertas no validas en Tolus Mirafores, Huaral, Pacasmayo, Chepén, Huánuco, Cajamarca, Cusco, Huanaco ni Tolus Súper Tusitagos, Próceres, Campoy, Morritos e Centro. Precios para consumo familiar y/o hasta agotar stock. Precios no accumulable con otras promociones. Precios no válidos para compras por internet, Stock disponible 10 ung por producto de alimentación y de no alimentación en toda la cadena. Fotos referenciales. Información difundida de acuerdo a Ley No 28587 y Reglamento de Gestión de Conducta de Mercado vigente.",9
256.56,421.0,104.17,41.56,88.28,Víctimas tienen 14 años y una de ellas sería enamorada de alumno que les dio gaseosa con pastillas,10
252.65,1051.74,168.39,33.09,70.78,"( Indignante! Treses— colares fueron 'pe— Bpeadas'porotro alumno dentro del colegio HipólitoUna— nue,en el Cercado Li— ma. Lascolegialas sere— cuperan, pernel casona causadora preocu— paciónenlacomunidad estudiantil. Las menoresdeinicia— lesCQPM.SPyG.G.S.to— dasdel4años,fueronen— contradassemiincons— cientesdentrounbaño delcentroeducativo.Se— gúninformóla policía, un alumnol segundoaño invitó unadeellas, que aparentemente era su enamorada, una gase os a mezcla da con pastillas,",10
501.75,1595.75,117.25,24.75,84.0,QUE ASESINARON A 'GRINGO',10
277.24,2279.34,67.68,27.78,85.08,"© Lo extrañan. La muerte de 'Gringo', el perro héroe que ayudó a un vecino a librarse de unos delincuentes, que lo golpeaban salvajemen— te, ha enlatado a todo el barrio de Los Jazmines, en Ate. Para don Religio Quis— r E a animalito habría sido vic— tima de una venganza o ”ajuste de cuentas”. ”A 'Gringo' lo han mata— do. Ese volquete [carro que atropelló a la mascota), do, ni le importó el rompemuelas que había, lo aga— e Para nosotros, es una venganza”, dijo el vecino muy apenado. Los niños del",10
727.78,2482.43,60.73,26.01,81.62,"barrio llevaron flores a *Gringo', cuyo cuerpo descansa en un par— quesito cercano al lugar donde vivió durante los últimos tres años. _ E a El más triste, sin duda, es el perrito 'Chato', su v hermano, con el que 'í$x compartía comida y un pedazo de car— . tan para dormir. En las redes socia— les, los usuarios ) crearon imágenes ) donde se ve a 'Grin— 7 go' subiendo al cielo A E ell a",10
891.83,1047.33,62.83,34.75,64.17,» r _' en ' otro ” - ! ' F egio,10
557.0,2850.6,34.0,28.2,45.0,&3 — U (T. Paredes) [+) N l 4 [1119,10
1048.0,1703.4,157.8,63.2,90.6,2019 será un año complicado,10
1145.83,2053.52,64.17,26.7,85.26,"©) El panorama económi— co para el próximo año es todavía incierto. Ante un posible retraso en el cre— cimiento económico, el economista Jor— ge Gonzalez Izquierdo — w t* recomendó a la pobla— (…S'ÍS.Y ción cuidar su A N y trabajo y no sobreen— quedarse",10
1603.5,226.0,85.25,29.75,60.25,SEPAQUE* Hace tres s,10
1270.0,2769.4,223.4,41.2,54.2,estos fone cen o e falla g resort c realizaba jun al gra bag [metersetenllaltomal,10
1554.0,1999.56,61.44,26.11,90.78,ni usar su fondo de Com— sensación por Tiempo,10
1581.8,2073.0,92.4,30.4,62.2,de Servicio [CTS) ee a,10
1902.0,610.5,64.67,22.5,37.17,*: M A zadondehansi— ._J P,10
1901.0,464.14,221.0,31.14,82.43,bebidaquehabríasi— do compartida con las atrasados menores. ”Lasestudiantes fue— ronllevadasalhospi—,10
1990.54,1115.62,147.92,32.73,75.78,"unlavadogás— tricoyesta— ríanentrata— mientodere— hidratación. 6. 4 cuperando”in— y formóunoficial. Familiares de las menores acu— dieron al centro educativo para exigiría expli— cación, perdonadme quisopronunciar— sobre el hecho. ”En este colegio vendendroga, licor ynadiehacenada.A mihijapodríanha— berl a vio lado y na— dieseentera”,ex— presólamadrede",10
