left,top,width,height,conf,text,page
2335.02,1631.64,72.08,27.15,91.04,"DEL SAQUE somos carnecita... LA FIRME QUE LA “U? pudo traerse los tres puntos de Puerto Mordaz en su debut copero. Ese Carbono solo lo presionó unos minutos y después defendió el 1-0. Cohberg no sé si jugó porque nunca lo vi en la cancha. Del solo chispazos, sigue en deuda, aún no me llena los ojos, ahora tendrá su revancha en Lima. Ese charla Alonso es un carrito chocó y le pega a todo lo que se mueve cerca al área. Los rivales le apuntarán la placa porque es una falta segura, los “chamos' lo encargaron y dejaron sin cintura. Los cremas no deberían tener problemas para clasificar cuando se enfrenten en el 'Monumental"". Así de sencillo... YA ME CONTARON que el 'Churrito' perdió y por goleada con una arequipa mamacita. Entró en plan de amigos con la flaca que trabaja en un banco y cuyo nombre empieza con 'M' de Miluska. Ella lo aceptó, le dio su amistad, pero en la segunda conversación el pelotero ya quiso irse de avance. Por wasap' le hablaba de amor, de querer vivir juntos y la respuesta fue que seguirán de “patas' y nada más. Pobechito... ASÍ QUE EL *CHEMO DE LOS POBRES” se puso a apoyara su 'causa' que abrió un local de bocaditos chinos, en la calle San Basilio, en el Rímac. Lo promocionaba en sus redes, lo recomendaba y la cosa tuvo buena pegada. Lo malo es que iba al local dejando un día, a veces llegaba con invitados y comía harto, gratis y pedía para llevar. Ahora, cada vez que lo ven aparecer, cierran el local. Noooo0o... HAY UN RUNNIN QUE LA *MUÑECA' anda pisando huevos. Ahora que dirige en Primera a sus colegas de las menores. Dicen que ha dicho que deberían sacarlos a todos porque no dan la talla. Pensar que entró por la ventana. Así no es... Me voy, soy fuga.",15
512.52,750.67,63.48,27.79,88.49,"€) Después del beso entre Cristiano Ronald y Paulo Bala aparecieron las escenas de celos. Según la cadena ESPN, 'CR7 estaría peleado con Gonzalo Higuaín, Juan Cuadrado y Mirale Pjanié, quienes no le hicieron caso cuando les pidió saludar a los hinchas tras el triunfo de la Juventud al Parma. Hoy (2:45 la 'Vieja señora' recibirá a la Roma por cuartos de la Copa ltalia. Ayer, Napoli avanzó a 'semis* al derrotar 16k a Lazio, último campeón del torneo.",16
430.8,1065.53,128.4,48.07,82.07,"INICIÓ TERAPIA POSTOPERACIÓN A RODILLA Y BARCELONA SIN MESSI, wm HOY FOR COPA DEL REY",16
485.0,1454.91,118.88,31.09,76.9,"arcelona.-El Pistolero'conpólvora nueva. Luis Suarez D J fuera gran novedad en el entrenamiento del Barcelona donde arrancó proceso postoperatorio además conoció a su nuevo entrenador 'Quique Setién. Eluruguayo realizó trabajos de terapia en surodilladerecha, luego de algunos días de máximo descanso que nole permitieron asistir a la cena entre el plant el y el flamante DT. Suarezdio entrevista laredsocia! 'Otro'yratificólaenorme amistadquelouneconLionelMessi. ""Me abrió las puertas despegue Ilegal club, apartese superamigos enelfútbollo somos afuera”,dijo el'9"" queestará cuatro meses de para. Barcelona, sinMessi, Busques y Piqué pordecisióntécnica, visitahoy[1p.m./DTV- 610)allbiza, de Tercera División, porlos Pavos de bacopa del Rey.Real Madrid pondráenjuego suinvictode17 partidos ante Unionistas de Salamanca(3p.m.),unequi__—podeSegundaB.Ayer, Sevilladerrotó",16
483.78,1988.51,66.58,36.65,84.43,"BATAZOS EMERICK Aubamexang (Arsenal) y Timo Werner $[E;e(|:oz IR son Ios 9 QU€ sigue el Barcelona. AGUERO, Manchester City [2* con 51) venció 1.0 de v¡s¡ta a Sheff eld por la jornada 24 de la Liga Premier. VISITA hoy € p.m/Espnj a Stade Reims por semifinales de la Copa de la Liga de Francia.",16
597.33,2159.0,73.92,40.0,74.16,Tottenham vs. Norwich (2:30 p.m.) Ac Burnley P3 :15 p. |?1 /Espn2),16
1211.5,150.5,87.25,27.5,86.47,MIÉRCOLES 22 DE EP,16
1131.25,558.1,64.76,29.06,90.49,"O Luego de 10 años en Europa (Manchester United, Real Madrid, Bayer Leverkusen, West Ham y Sevilta), el mexicano Javier Hernández se convirtió en refuerzo de Los Ángeles Galaxy de la MLS, donde reemplazará al sueco Latan Ibrahimovic y será el mejor gado de todo el torneo Fóamlllones de euros). El usará la camiseta que costará 149 dólares, el mismo precio que tiene la de Edison",16
1114.62,872.75,37.38,26.62,56.97,) _ Flores en DC United. — 6,16
1470.71,704.43,75.0,23.57,84.08,C SERA EL MEJOR PAGADO DE MLS,16
2146.71,505.29,92.0,25.43,88.54,“CAVANI DEJA PSG Y LLEGA AL ATLÉTICO,16
2203.88,744.56,64.3,26.85,89.01,"GD La estadía de Edison Cavan en PSG llegó a su final. El uruguay empezó a hacer las maletas, porque su llegada al Atlético de Madrid, que dirige el 'Cholo' Simeone, es cuestión de horas. Según medios españoles, los “Colchoneros' llegaron a un acuerdo con PSG y pagarán 15 millones de euros por el 'Matador, de 32 años, que tendrá un salario de 10 millones de euros anuales y firmará hasta el 2022. Su reemplazante en el cuadro parisino sería Gonzalo Higuaín.ea",16
424.0,2531.09,76.18,29.0,57.51,") = A LINCE %INICOS Av'Pmu cm"" N TI_IIP_;2 ”ggl$g 14PETITHOUARS",16
440.2,2584.1,133.3,49.7,73.19,Dí 2 6 %d%iñg 57 26 992 163998 9ao?4é€4 3gºgººm,16
676.88,2439.59,74.88,42.24,60.85,WE $ LENTE mcnu¿3 ov.quou AuCantaCajlao en 7 [¡| RTE WIYAT n ¿'á E 5f57'59203 To YE,16
525.75,2713.62,161.5,49.0,70.34,LIGERO saleuu&sn 962194281 923860869 0922610618 TEO 45835335 994520727,16
1753.82,2471.18,115.46,35.36,60.02,"19 ESTACION PRAO 20 %¡; $Clzºí€£ 998199402 9avo%'1'%'5 921506346 9a7esa%""& 953245515 Cl£¿0 1 WEE% 2GIIIIIM|| 953518774 MAS UNIV, 3—?33?3%3? wºº'¡5m VILLANO CTA. uno a g""º…'”'%"" 9asa11aoa 974643000 95%""5“£%372",16
2263.14,2273.57,71.0,37.43,69.4,y San SJ 1 º…m gf»|:£sozsoes 9'f-75&%%,16
2249.5,2392.0,109.7,45.1,69.1,"9560861 75 959605310 BAANCHERº 966729%E 921984124 BARBERO q,/,… ) RICO",16
2111.0,2616.71,97.14,33.29,68.74,92 95049931o 34º %5532 85?8?535 938 5,16
1833.41,2696.12,118.06,62.0,56.71,% %&á %% %% % ? a. .¡5' ¡ÍEE£E;3;;¡% ………… cu.cu.uo 0767267 ! 1 924639003 E E,16
325.08,544.69,74.08,34.38,89.72,Organizaste Haz una lista de ©__Ias actividades que harás en el día y,18
309.75,641.12,62.5,30.75,76.29,tacha las que culmiñas. Dedica un tiempo,18
1184.56,150.22,88.33,23.33,83.04,E— UN É MIERCOLES 22 DE ENERO DEL 2020,18
1142.05,500.05,77.5,48.0,73.45,1; max 4£i '; Ordena tu esto o de tu mesa de trabajo.colócalos en elprimercajón del mueble; no los,18
1105.5,701.25,84.25,29.75,92.99,dejes encima del escritorio.,18
2219.0,670.42,72.33,29.33,80.69,"ventanas o en tu balcón (con buen soporte), porque ofrecen beneficios",18
2382.0,633.5,51.5,40.33,80.82,"© Pon macetas cori plantitas en tu escaléra, I | I U",18
368.9,752.8,160.3,33.8,76.16,para tomarte un N descanso. NE - APRENDE A PROTEGERTE,18
435.36,1476.5,66.07,29.57,82.05,"on las altas tempe. ranuras del verano, l ya se comienza a ©_U/Eooo",18
449.58,1682.69,77.62,29.4,88.4,"dentro de la casa, oficina ©> Consume una o auto. Por este motivo, dieta balanceada algunas personas hacen — confusas y Verduras uso del aire acondicionar fortalecer el nado para refrescar sus sistema inmunológico ambientes, Sin embark evitar otros males. go, hay que tener mucho —",18
300.0,1898.69,83.56,28.31,92.41,cuidado porque sin un mantenimiento adecuado este aparato podría perjudicar tu salud. Según la Organiza,18
709.14,1918.79,80.43,29.0,92.42,"ganta irritada y procesos bronquiales. El neurólogo Ruben Huamán, especialista de la ONG",18
499.35,2094.5,73.57,28.85,89.75,"ción Mundial de la Salud “Una Vida por (OMS), este aire con tie recomienda lo siguiente gérmenes, polvo y te para prevenir cualquier bacterias que pueden ori— enfermedad ocasion agin ar enfermedades como — da por el mal uso del aire faringitis, neumonía, gar— acondicionado:",18
552.29,2569.55,55.14,27.65,86.02,"; INGREDIENTES PREPARACIÓN 1 5 varas de apio cortodas — En un bol une el apio y la 1 entramos palta cortados. Condiment +2 paltas medianas corta con el jugo de limón, sal 1 todas en cubos y aceite de oliva; remueve 1 +2 limones para integrar bien y que la 1 +2 cdas. de aceite de oliva — palta se una con el apio. E +Sal al gusto Sirve en un plato con ta",18
1831.58,1734.84,72.49,27.44,89.99,"+ VERIFICAR QUE LOS FILTROS ESTÉN LIMPIOS. Es importante tener en cuenta el mantenimiento y la limpieza periódica de estos aparatos para evitar el contagio de enfermedades. “ LUGARES VENTILADOS. Si el lugar donde estás cuenta con ventanas, es mejor primero buscar la ventilación de forma natural. Abre las ventanas para que pueda entrar aire y así eliminar las sustancias nocivas de los lugares cerrados. * USO CORRECTO. Se recomienda que solo exista una diferencia de 8* entre la temperatura del aire acondicionado y la del ambiente exterior, sobre todo en esta época de verano, para evitar los cambios bruscos de temperatura. La temperatura ideal para este clima es entre 219 y 22”. “ EVITA QUE CLAIRE TE CAIGA de manera directa porque podría afectar aún más tu salud. « VACUNAS AL DÍA. Es recomendable contar con todas las vacunas al día para poder prevenir cualquier tipo de mal respiratorio.",18
1175.44,2516.56,69.36,26.4,92.65,"ayuda de un molde cilíndrico para mejorar su presentación, una vez listo sirve de inmediato. Lo puedes acompañar con pan francés o tostadas.",18
2316.5,984.0,86.25,26.25,92.18,Lupe Maestre Psicóloga clínica,18
2401.92,1924.2,69.62,26.71,91.39,"© Dejar ir cuando uno está enojado, dolido o con algún otro sentimiento es complicado. Pero dejar tramando es una experiencia muy compleja. Volver a construir una vida sin esa persona que aún tiene sentido en nuestro día a día pone a prueba nuestra capacidad de desapego, de amor por el otro y de búsqueda de una nueva forma de estar con nosotros mismos. En un primer momento pueden surgir conductas obsesivas hasta caer en un profundo vacío y hueco que no se puede llenar ni dar sentido con nada. Se puede incluso mendigar amor a otras personas poniéndonos en bordes autodestructivos. La ansiedad y la abstinencia se apoderan de uno y la crisis se hace mayor,. Es fundamental en este momento tener algunas cosas claras: esto duele y va a pasar, el tiempo que dure durará y no podemos hacer nada para evitarlo, pero sí podemos trabajar en nosotros mientras dura. De hecho tratar de tener cero contactos con la persona amada es un buen comienzo. [",18
1186.67,184.0,133.11,33.22,88.66,MIÉRCOLES 22 DE ENERO DEL 2020 TE LO AGRADECERÁ,19
2269.45,407.64,63.59,27.73,86.15,"EN + Si no tienes tiempo de preparar jugos o refrescos que puedas llevar cada vez que salgas de casa, opta por",19
2292.0,481.17,67.0,26.0,92.95,comprar la bebida envasada de tu,19
1653.96,556.9,57.65,33.51,70.08,"- YO y - NN —| y “ preferencia al por mayor. Por ejemplo, = x I ¿_3 < UU 1_:] Dj 1Ú” Ó puedes comprar jugos de fruta en caja . E — DD C D _ por docena. Compara precios en tiendas - — —] Fa distribuidores o supermercados.",19
1980.35,704.24,93.0,36.59,82.96,"… invertir en un buen 23C0mp ra envasados a| puf mayor, tomatodo. Uno que conserve por largo",19
1918.12,776.12,79.36,32.56,87.13,"lleva agua en un temer to dio o tu tiempo la temperatura de la bebida, sea propio … en casa fría o caliente. También debe ser práctico",19
1749.33,897.17,62.83,26.89,89.92,de llevar y con capacidad de litro y medio. ¡ te preguntaran ¿cuánto destinos de tu presupuesto a,19
2301.15,944.85,65.65,26.5,89.94,"<+Una vez que cuentes con este envase, define el tipo de bebida que llevarás, puede ser solo agua hervida de",19
1645.08,1118.42,72.8,29.28,80.97,"ZE NN tu casa u otro refresco. E 3>) .7 - lasbebidas?, puede que A X> . +turespuestasea'niidea, « Si quieres llevar alguna bebida con — porque generalmente nunca sabor, usa el agua helada que guardaste “.%7 . se tiene presente cuánto se el día anterior y prepara el refresco de gasta. Pero si llegaras a sacar la tu elección. Puedes preparar limonada o",19
1063.66,1335.53,77.47,27.21,92.78,"cuenta, te sorprenderías de todo gelatina líquida. lo que desembolsar mensualmente para refrescarte. Para ahorrar empieza a salir con una botellita de agua, desde tu casa, pero cuidado que esto incluye todo tipo de bebidas. Aquí unos consejos:",19
2286.57,1349.87,74.57,28.43,88.76,*¡Adiós a la cerveza! Ahorrar en bebidas también implica dejar de tomar cualquier bebida alcohólica y cambiarla por agua. Eso dependerá de ti.,19
1208.79,1641.5,131.46,46.17,79.43,- = | Artrosis de Rodilla | AGREE | E CLÍNICA í — Qs A ESPECIALISTA EN DIAGNÓSTICO Y TRATAMIENTO DE LAS ENFERMEDADES BIOLÓGICAS,19
619.62,1847.38,65.62,19.12,86.36,Cirujano - Urólogo Magister 00289 - Doctorado 00115,19
2120.33,1812.5,111.83,29.5,64.84,E — N CATARATA Y LA,19
1047.77,1906.46,91.9,22.31,80.21,"AA o ; C * IMPOTENCIA SEXUAL - DISFUNCIÓN ERÉCTIL Si £|Ry<siA—_ - FALTA DE DESEO SEXUAL + EYACULACIÓN PRECOZ € CURIOSIDAD . IRROSTATA, - SEXUALIDAD DISMINUIDA * INCONTINENCIA URINARIA * Con pegamento tisseel, sin puntos y sin dolor",19
568.17,2002.04,62.26,23.35,83.62,ISINICORTE¡UÁSER] - CÁNCER DE PRÓSTATA Y GENITALES (Prevención y diagnóstico [CITAS CONSULTA MÉDICA DE LUN. A VIER. DE 6 PM A 9 PM,19
439.33,2108.33,129.33,23.83,52.59,(ESpalda Hospitales Niño) LIMALWWW.E SPECIALISTAENEROSTATA PE,19
1152.0,2041.7,104.6,31.7,85.77,O AY. LA MARINA 385 PUEBLO LIBRE | IDrHícanloDuran www.doctorduran.com,19
1241.7,2335.0,122.3,43.85,70.94,o UDIFONOSIMEDICADOS; — * Encuentra más contenido PROCEDENCIA | dedicado a la mujer en la sección . N an i,19
1945.11,2616.22,143.78,27.78,63.66,"moldes, calibración N Y mantenimiento, "" informes Qinstitutoninadesign'com Wwwinstitutoninadesign'com",19
1157.78,154.89,71.89,29.67,75.79,í Ñ '$ MIÉRCOLES 22 DE ENERO DEL 2020,20
514.75,573.75,109.25,54.75,64.51,CINE Y LA TELEVISIÓN,20
2385.0,592.25,71.5,26.75,92.92,Lee bien la información,20
1555.16,1288.27,72.38,29.6,86.18,"NOS ENGAÑAN Y SIEMPRE que sala encesta página y LES CREEMOS 23 UEAE£:I©S El . ta d .. p|-=;ºmtas: g ALGUNAS COSAS QUE de DAMOS POR VERDADERAS? con dos pistolas a la vez para intentar quitar dar a varios blancos. Es impo&I:| *$Ia argolla de una a televisión y el cine nos sible apuntar a dos objetivos granada con los muestran situaciones que a la vez y menos darles. |:| dientes te dejará: damos por ciertas. Veamos A. Fuerte Iguanas de esas 'verdades' .Unautoseestrellay — [ ] || B.Contento que son mentiras. lota de inmediaC. Sin dientes to en la TV. La gasolina es |:| poco explosiva y un auto puede incendiarse, pero para explotar |:| cuando debe tener algo explosivo. . Cuando una persona se está ahogando en una pelí» Es común ver en panta fñd&l:,¡:':;enggnde cula, pide auxilio y mueve fuerte lla que al colocar un pañuelo como: sus brazos. En el mundo real, empapado con cloroformo a una |:| A Ras.uñar un objeto muchas veces no se ve que persona, esta se desvanece en B irritar 0 exa errar a alguien se está ahogando. El segundos. Eso es falso, para dor|:| alquien P cuerpo simplemente se hunde. m(i)r de verdad deben pasar como c.%ontracción de un 10 minutos. - 2£/:mosqu¡elosam|:| músculo quitan la argolla a una granada |:I v%:::;:m con los dientes. Pero la películas. Por lo general, el ños argolla es tan dura que, balazo en el cuerpo no te ] a__años más al intentarlo, nos quedamata, a menos que uno se que los hombres. iríamos sin dentadura y sin desangre, se llama shock |:| A.15 activar el aparato. hipovolémico. gg . Sacar datos de una I:I computadora ajeC] f el caracol na es cosa de segundos moro es: en cine y televisión. En C A. Desagradable verdad, ello requiere 8. Venenoso un trabajo largo de un e. Comestible experto. |:|",20
1716.0,2394.51,72.97,26.35,92.46,"¿Por qué las mujeres viven más que los hombres? Las mujeres viven en torno a seis años más que los hombres. Esto podria deberse a que ellas tienen determinadas Estos caracoles viven tanto ventajas. Por ejemplo, son en praderas y jardines, más fuertes en el útero [la como en bosques y en tasa de abortos precoces es dunas de arena carmanor en hijos hombres), ca del mar en España, son menos temerarias, Reino Unido, Noruega y desarrollan problemas Ucrania. Pueden ser cardiovasculares más tarde, blancos, amarillos, tienen vínculos sociales más de tonos rosados y",20
508.95,2511.68,74.16,26.77,90.62,"Significa causar contracción repentina y pasajera en el tejido muscular, en cualquier otro tejido de naturaleza contráctil, o en una parte del cuerpo. 'Se le crispa la cara”. Coloquialmente crispa se entiende como irritar o exaspera a alguien, según explica el diccionario académico.",20
1160.53,2651.18,85.12,28.0,91.3,Ejemplo: Las propuestas criaron los ánimos del fuertes y se cuidan más. marrones claros. Son sindicato. comestibles.,20
773.9,1643.87,110.7,32.19,72.84,"f || deríaalnombredeKitty. ! || Magaly, el 'ampay al Zambmanotecolocóen el puesto siete del mano king... Sí, feliz mente desde el P | inicio de esta temporada nos ha sonreído la aun Y diencia. f | Zambmanotalvezimaginó quepo estar en alta mar no lo iba s aampayar. Buenos equivocó,somos | | los firmes del a. o |] Sediceguesu o ] MarcialSuccar]sesepa? | ¿creesquetevaya dar una c port unidad comparó conCallese? | | Croqueta pasarlo mis | mocomoelfenómeno Callese y Cueva.No sopor qué pasado y perdonan - lainfidelidad, verdad '__fñ que estamos mal.",21
993.32,1063.96,137.2,32.76,71.71,"agal Medina reiteróqueella 1 y del luego de descubrir al futbolista Car=y sayaveceslasbarrastienensuspasiolosZambranosin suesposa,abordo - r, Q¿é | deuncatamaránbastantecariñoso eo > | con una joven cita que respo",21
829.12,2134.38,65.75,32.62,52.11,(a [ — ñ _%ÓE7 iN l,21
1653.79,612.57,133.29,29.29,80.78,¿Ytehsenviado otra carta notarial por este'ampay”? Tendría razónalguna para hacerlo. Encima quisieron comprar atu equi,21
1597.0,871.38,171.93,31.97,79.53,"po... Eso fue ofensivo para todosenelequipo,nosomoscorruptos. ¿Nosientes temor ahorque estás apoyando alosfutbolistas?, ¿aumentarástuseguridad? Si, prestamos más cuidadosos que antes, porque desgraciadamente estepaísmuchas'estrellitas' del fútbolestán rodeadas de gente peligro",21
1679.92,1478.96,175.79,31.98,77.76,"nesmalentendidas, y arenque anulándomevanasalvarasus idolos barr o cuando ellos mismossecometenfoul. BORRÓ SUSTOS a Porotrolado, MarciaSucV car,esposa deZambrano, N borrólasfotosque tenía conélytrascendióque no quiere ver al futbolista ni a los dos amigos que se habrían encargado de la “logística para la fiesta en elcatamarán. “Enlasimágenes sentados tipos,ellosson amigosdeél y han comparti do también con Marcia. Ellaestádecepcionada ambos ytambiéndeunaamigasuya que aparece en el video.Además, parecequelachi1! ca con la que sele",21
1300.19,1985.03,54.23,25.19,88.95,"Los Vílchez 22 La rosa de Guadalupe 20.5 Chapa tu combi 195 La rosa de Guadalupe 17.5 América Noticias 135 La rosa de Guadalupe 12.8 Fagaly TV, la firme — 109",21
1722.75,1998.25,164.0,30.25,91.77,unajoven chiclayanaquesellamaría nuestra,21
287.5,2634.0,68.75,36.5,92.49,en película de Julián,21
237.0,2687.0,79.25,45.0,83.14,Cuchi y Riddel Eslava,21
1028.37,2481.3,64.68,28.0,85.89,"G» Judith Bustos, la 'Tigresa del oriente; adelantó decae les de su participación enel — Á preestreno de la cinta peruana “Sí, mi amor;, comedia protagonizada y producida | por el argentino Julián Cuchi ir y su pareja Diddy Eslava. “Estoy muy agradecida con Julián y con Diddy porque me han dado el personaje de la en su película. Interpreto a una empresaria que saca adelante su negocio”, detalló",21
1694.88,2493.41,69.85,26.14,89.55,"la cantante, que acaba de recuperarse de una intervención quirúrgica. Además, confirmó que pronto iniciarán el casting para encontrar a las actrices que la caracterizan a ella en las distintas etapas de su vida, G pues ya se viene la película que contará su vida. En tanto, Julián y Diddy invitaron al público a ver la comedia, pues es fundamental el apoyo para mantenerse en cara telera. [F. López) o s",21
1851.0,1947.5,61.25,34.0,73.39,cariñoso seria K “,21
2148.83,638.33,59.67,30.33,78.41,"R Ricardo Zúñiga, €9 el Zorro",21
2252.28,996.55,75.12,27.45,90.28,"espera que Carlos Mambrino solucione los problemas que tiene con su esposa luego del “ampay” que Fagaly Medina le hizo. ¿Quéopinas del ampay”? Ella (la esposa de Carlos, Marcia Succar) me cae muy bien, espero que solucionen sus problemas. La próxima vez me gustaría que me inviten. Me encantan las fiestas en yate. ¿Hastenido comunicación conCarlos? Todo está bien, los problemas [legales] están olvidados. Uno no puede vivir de rencores. [D. Bautista)",21
2349.45,2150.83,64.77,27.36,87.03,"€? Marcelo Effie aseguró que Joshua granoff es solo su amigo, luego que fueran vistos conversando atentamente en una cafetería. ; “AJoshua lo conozco hace años, 5) somos amigos y esa reunión f ' fue netamente de trabajo, de / un posible negocio al que quiero entrar. Si fuera otra cosa jamás",21
2259.33,2491.36,88.09,28.45,87.29,"te siempre malinterpreta”, dijo. Entonces, ¿estás soltera? No estoy saliendo con nadie. Ahora estoy de vacaciones, disfrutando 4 de mihija. ¿Continuarástrabajando en'De - vueltaalbarrio? IQ' a Sí, renové contrato. En febrero graba",21
2273.25,2646.0,57.0,28.0,82.2,mos. [D. Bautista) o,21
2313.91,2727.82,76.18,32.64,87.64,que reunión con Ivanofffue solo por negocios y está soltera,21
683.8,544.28,62.81,31.11,83.73,"€> Anah¡ de Cardenas reapareció en público y se mostró optimista frente al cáncer de mama al que viene dándole batalla con quimioterapias. 2 || “Algo ;|)o%ítivo que rescato fs la cantidad de ente linda y amorosa con la que me cruzo F3Re$cata e| Ca""“º %odos los d|gs y me llenan de %ariño y amor"", del público que la 3| expresó la actriz.",22
575.5,697.5,60.64,32.07,83.2,¡ en su lucha y En cuanto a su novio dijo: 'mi amores apoya (F. López),22
290.25,731.0,72.75,45.0,54.06,¡contra E ca_n_cgr |,22
2146.38,820.68,68.43,27.71,86.98,"() Neck Varias presentó en sociedades — | enamorada Katya Montesinos, con quien TV ya lleva tres años de feliz romance. | A ""El secreto para tener tres años juntos es que se trata de la primera vez que nos mostramos en público”, bromeó el modelo. TIAN DOMÍNGUEZ “El matrimonio está en nuestros pla— afirmó que el productor nes, pero tenemos que ir quemando í[_— PETER FAJARDO quiere etapas"" añadió. [F. López) :=_H E que su amorcito, PASE LA FRANCO, ingrese a “Esto es guerra;, pero le ha dicho un tajante no. Más sabe el diablo por viejo... MARITA PODRÉ VEZ le desea lo mejor a YAMAIRA, quien mantiene una amistad con [EFFERSON FARFÁN, y espera que puedan estar juntos. Hummm... * || GUILLERMO ROSSEN comentó en “Los Chisto| sos' que tiene un largo I matrimonio porque siem! || arriba de su trabajo a su casa, en referencia",22
2386.07,514.4,82.93,27.6,87.74,"090 HOLA, M o BARRUNTO. Llego embalada para contarles las últimas de “Chollywood.. CHRIS",22
1328.0,702.43,88.43,42.57,83.06,Ticon novia y no 7Í_ descarta casarse,22
455.03,1328.26,144.2,30.09,80.82,"ario Hartysuesposa Orina Rivadeneira respondieron a Rodrigo González, Peluchín; quien hace un mesrevelóque la venezolana suexpareja, Gino Pesaressi, viajaron juntos a Arequipaeinsinuóqueentreellos habría habido un porun parde detalles en las fotos que ambos subieronasusredes. “Esobvioque no hice nada malo,peroesunalástimaquein-",22
1151.33,1481.11,155.89,36.0,64.68,"_| me he puesto la gorradeningunaex”añadió el piloto. ""A “(Peluchín)nosama,esunamoroculto “ 1",22
1113.33,1620.86,115.23,28.91,70.55,"sinúencosascuandonotieque nostiene, creoque nos tenga bron— ca,esunamorreprimido, creo yo”,co3'1¡ , , prueba),dijo la venezolana. mentó sarcásticamente Hart. a N 0 N Desigual modo, el piloto mostró Deotrolado, Mario reveló que está anCA sumalestarycalificóde'estusioso por convertirse padre, pero 0",22
1251.33,1836.19,139.19,29.43,74.81,"que los compromisos laborales de Korinaretrasan seaplanes familiares. “Esperemosqueyale depende salir tantos proyectos mi esposa traqueal fin de - cidasalirembarazada”, comentó.(FLópez) € NO N",22
864.53,2072.88,118.34,47.88,77.85,afirma que es ur una “esítupad&z' insinuar que venezolana fm infiel por cambiar gorrita con su empareja Gino Pesares en Arequipa - ESChato” cree que Gonzalez les tiene un “amor reprimido” E,22
275.73,1826.82,199.82,28.45,78.62,"pide el relacio naruna gorra conunatraición. “Nopuedesinsinuarunainfidelidad esoesunaestupide.Sinoyotambién hubiera sidoinfiel, aunque",22
2382.8,2018.09,73.59,26.72,89.26,"a tantos escándalos de infidelidad. Mientras que MERCIAN VIDAURRE lo miraba calladito. Upsss... La criticó ayer a JULIO GUZMAN y el “LEÓN” MAMBRINO por serinfieles, y añadió que al menos “debieron ser maletas para que no se enteren sus esposas'. Plop... TULA JUEZ contó que tiene la consigna de hacer de su hija VALENTI",22
767.27,2515.41,69.8,28.27,89.7,D Amy Gutierrez está apenada por el enfrentamiento que protagonizaron Paula Arias y Kate Candela porque lanzaron la misma canción. “Me da un poquito de tristeza que haya este tipo de problemas entre personas que han trabajado juntas. Igual creo que no es un,22
1939.4,2453.5,62.9,27.75,89.23,")> Israel Dreyfus aseguró que a Sheila Rojas toda— vía le falta experiencia para Á asumir la conducción de PA 'Esto es guerra. “Un reality no solo demand daprofesionalismo, sino otro nivel de madurez. Sheila es joven, todavía está en pañales en la conducción, pero",22
1946.0,2647.57,51.86,28.29,89.18,es muy buena en el formato -,22
