left,top,width,height,conf,text,page
1198.51,2079.89,66.12,28.91,84.4,"rán 45 mil “roscas de reyes, — antigua y el Cristianismo”, En tanto, la celebración de el dulce tradicional de la dijo Pío Pantoja, presidente — “Bajada de Reyes' se escalada y »Auna personalyasaldrá'a festividad. de la Asociación de Empre— unificar hoy en el Centro de C) “La rosca de reyes es un ali— varios de la Panadería y Lima. (1. Medina) o BARRANCO ayer con la vigilancia x._;_£ _ MUNICIPALIDAD DE LIMA",7
606.65,2338.65,67.76,32.06,78.82,ñ y control deberemos — Alejan del distrito y efectivos E=3: pengo s pol¡ciale3. por lo que el Ey 47 tránsito de peatones de puede = ¿— fue más fluido. = “Está muy bien,7
1857.0,2253.2,196.2,49.6,92.57,Serenos campeones en artes marciales,7
1870.9,2372.43,82.05,28.57,89.76,"€9 Dos serenos de la respectivamente. Municipalidad de En Colombia, el agencia son campeones te Hernández ganó ecartes marciales Y",7
1326.61,2517.78,63.72,27.59,86.24,"Ante la pálida ? que ahora haya y las aplican ense — € can Muay Thai Open rosa y Más serenos del trabajo defensivo y Championship aglomeración de a Municipio y poli di su asi vo en favor de 1 Y en el Perú, Hinojos veraneantes registras ubicados en los ciudadanos. logró el primer premio",7
2144.69,2707.52,65.55,26.76,88.42,"nacional del torneo Banda Warrior de Kung Fu tándem y Miguel 2019. Ambos entrenan Hinojos ganaron en | nacionales y nacionales en el gimnasio del Serenazcompetencias inter de muay thai y karate, go de Lima. (1. Medina) — €",7
268.71,2660.71,60.53,28.24,92.42,"trata en los primeros días del año, el puente de la Bajada de Baños, en Barranco, contó",7
949.22,2660.69,67.36,28.11,88.76,"el puente, para así evitar dirigía a una playa de la cualquier desgracia. Ahora — Costa Verde. No se prestamos más protegidos"", dijo ningún incidente de indicó una bañista que se riesgo. ). Hemández) e",7
1521.67,2630.0,68.67,25.5,93.09,"Hace poco, en diciembre, Raúl Fer",7
1223.33,153.0,79.33,25.0,92.86,LUNES 6 DE ENERO DEL 2020,8
337.12,1369.53,66.94,24.35,85.44,o cesan los cuestionamientos a la elección de Marco Falcone Picado como miembro titular de,8
694.09,1364.32,67.45,27.73,89.13,"la Junta Nacional de Justicia UN)). Ayer, el Tribunal Constitucional (TC] señaló que no fue consultado sobre el comunicado de",8
1466.6,332.2,143.0,38.4,81.62,D “ DEJUSTICIA queen examen le dieron “ayudita” que no le correspondía,8
1516.75,962.21,76.0,26.36,87.25,"un anuncio en Twitter, aseguró que ni ella, ni su - ""— antecesor, Ernesto Blume, “han sido consultados, ni tuvieron conocimiento del acuerdo para publicar dicho _, comunicado”.",8
1567.32,1276.09,68.73,26.07,92.82,"El último sábado la Comisión Especial ratificó la elección de Falconi, pese a las críticas porque recibió una bonificación del 10% de puntos en el concurso al ser considerado licenciado de las Fuerzas Armadas. Un informe periodístico indica que a Falcone no le",8
1120.76,1365.65,85.06,28.35,92.97,"la Comisión Especial que ratifica la designación del excongresista. La presidenta del TC, Marianelia Ledesma, mediante",8
510.57,1533.71,102.71,25.86,87.14,£FISCALÍA PIDE QUE LOS MANDEN A PRISIÓN,8
274.88,2407.12,75.88,27.5,85.29,el libro Metamemotá primero y que varias,8
290.44,2615.44,76.59,28.15,90.07,a Tiempo recios; de Vargas Llosa. Beto Ortiz recuerda que el Nobel compitió con Fujimori y llegó segundo. Ahora compite con Alan y llega séptimo.,8
333.42,2309.83,52.67,27.25,90.36,ca el ranking de la librería Crisol y destaca que i,8
357.17,2396.83,54.33,29.17,88.61,"rias, de Alan García, es¡",8
366.8,2468.6,64.6,28.2,83.36,'agendas' del año le ga,8
703.23,1863.85,67.04,28.38,91.13,") El expresidente Alberga to Fujimori, preso en el penal de Barbadillo, ha expresado a allegados preocupación por sus hijos Kenji y Keiko Fujimori, sobre quienes recaen pedidos de prisión por varios años. Sobre Kenji, la fiscalía acaba de solicitar 12 años de cárcel por",8
723.25,2703.12,79.12,27.12,81.97,O'Vitocho' García Ei laude destaca la elec,8
1552.38,1589.23,69.62,27.54,92.31,del expresidente Pedro Pablo Kuczynski. El objetivo era lograr el indulto de,8
1383.09,1731.17,61.37,26.94,87.0,"su padre. los delitos ; ¡ En el caso de Keiko Fujimori, de cohecho / 9 el Ministerio Público solicita y tráfico de que se le dicten 36 meses influencias agravado. de prisión preventiva por",8
1567.16,1925.32,80.89,26.79,88.61,"el caso Cócteles. La acusan de asociación ilícita, organización m criminal, falsedad genérica, fraude procesal y falsa declaración.",8
1079.92,1924.38,66.5,27.29,92.4,Se le acusa de comprar los votos del congresista Moisés Maman (Fuerza Popular) a cambio de evitar el primer pedido de vagancia,8
1567.98,2421.74,68.55,28.43,85.12,"i la municipalidad. Y en: cima usó los viáticos — ; para un traje, zapatos y i : un espá. ¡Se pasó...! ; ARRESTO i. Según Daniel Urresti, si sale elegido congresista por Podemos Perú, de ninguna manera defenderá a la Universidad Telesup, cuyo dueño es José Luna, líder de",8
1084.32,2457.65,57.56,27.74,86.95,i ción de Marginella Lei desma como presiden; ta del Tribunal Consti; nacional y dice que se i trata de una magistra: da proba. Vale... i VUELA ALTO : Qué tal vida. La i prensa del Cusco i informa que el al: calle de Santiago ; estuvo 17 días en i Croatia y Austria i contado pa: gado por ;,8
1994.4,886.89,68.04,27.1,91.29,"correspondía dicho beneficio porque no hizo el servicio militar, sino que solo estudió en el Colegio Militar Francisco Bolognese de Arequipa. Por ello, expertos recomendaban que se suspenda su juramentación. *ESTÁ RESUELTO' Asimismo, la fiscal de la Nación, Zoraida Avaros, quien votó en contra de la elección de Falcone y de Henry Avila Herrera como miembros de la JJ al considerarlos “no aptos” para el cargo, volvió a pronunciarse sobre el tema. A través del Twitter del Ministerio Público, Avaros ratificó su voto en contra de Falcone y de Ávila. Además, se señala que la Fiscalía de la Nación no tuvo conocimiento previo del comunicado de la Comisión Especial que ratifica la elección de Falconi. Este, sin embargo, dijo ayer que su nombramiento como miembro de la )NJ “está",8
1942.07,2516.64,56.66,27.15,86.65,"; ras de los candidatos i es parar los abusos de i las AFP. Dicen que pon: irán como ejemplo lo : que está pasando en i Chile y esta vez no po: día haber lobbies que : las defiendan. Ayayay... i ; En las redes hay una : campaña contra el vo: to en blanco o viciado,",8
2346.71,2465.86,63.44,28.17,86.95,"í porque permitiría a ali unos partidos supe; rar la valla electoral. No : me diga.. ; ; Daniel Abugattás : aclara que, a fin de : cuentas, es la cifra re; partido la que deter: mina la composición i del Congreso. Dizque : Impulsar a votar por : votar es perpetuar un i sistema antidemocratic ¡Qué cosa...!",8
2410.28,451.75,56.47,28.42,81.89,10 . SEPA QUE í La Comisión Espíe cual convocó a todos sus :integrantes a una sesión| : i hoy a las | : : 19:30 de la mañana para : ¡tomar acuerdos finales' : Sobre la elección de los : Nuevos integrantes de : la JN). Se verá el caso de,8
2398.0,872.26,71.59,28.62,90.08,"resuelto”. Afirmó que el comunicado de la Comisión Especial que lo respalda aplica “la ley con absoluta justicia”. Además, sostuvo que no comparte las expresiones de la fiscal Ríe la Nación, Zoraida Ava0S,",8
1153.0,570.1,50.75,18.7,58.62,"í — "" /I/) >I ///////// ; f …/,”,, E 7 1 í Papaltalas:Gx80/XGx72/ é | | . , Naturalcare",9
1725.45,1034.0,90.09,29.55,64.96,Huggins Pañaltallas: Gx58/Mx64/ XEX48 XXGx44 Natural care Pañaltallas: Mx58/ Gx527 KGx42/XXGx38,9
1727.83,1522.83,58.0,18.67,77.19,Toallitas húmedas bolsa por 65 unid.,9
2003.11,2456.0,47.89,21.82,87.34,"N 4 . , ! . móvil y web Inkafarma.pe). Stock mínimo de 100 unidades en toda la cadena. Precios TENIAS Y PRECAUCIONES DE LOS PRODUCTOS: BABYLON los",9
1429.39,2500.94,61.37,26.95,88.23,"*Los productos deben adg:lrlm en la misma compra. Válido por ticket de compra. Precios válidos 2020, a excepción de las botitas ubicadas en Plaza vea, Vianda y Tottus. Promociones no válidas para delivery (wll enter a oonsum¡dorfmal noválrdo ra mayon s las ni convenios. Máx1m03 cien te por dr a Precios no accumulable con otras promociones. Las productos son referenciales. AD' con 41 nutrientes, vitaminas y minerales. Antes [ preparar la fórmula lave sus manos con agua y ¡abón. Li tensos a ul1lrzar Este producto no es un sucedáneo de la leche matema. HUGGINS NATURAL CARE PURO Y consulte a su médico. No se automedique, consulte con su médico. Inkafamna promueve el uso responsable de re alejados. Para evitar peligro de sofocación mantenga los niños. Descontinuado el",9
1430.86,2571.94,58.18,27.89,84.75,"B%O 3 POLVO: Aumento lácteo en polvo NATURAL ACTIVE SEC PAÑALES: Mantener fuera del alcance de los niños. Tirar los a ala basura, nunca en el sanitario. En caso de médicos. BABYSAT PREMIUM SUPEREGO PAÑALES: Los pañales desechables pueden incendiarse si son Me&od ¿Ja edad de sus niños maté los Su uso. Enmsodeque persista, consulte a su médico. NINE SUPEREGO ES Nunca tire el | mantener fuera del alcance luego r sofo ma ones man tenga la bolsa plástica lejos de bebés y niños. NINE inmediatamente. Puede causar irritación en los o¡(3se",9
1212.3,2690.79,64.92,25.86,85.57,"farmacéuticos y dispositivos bdsadepláshoolepsdebebésynvños Srobserva£nareawóndesthe descartables incendiarse si son expuestos al unidad de sus n|ños mantén&a s¡empre SUAVE CUIDADO TO IBAS HUMEDAS Para uso extemo. Manttener el empaque cerrado cuando no esté en tener fuera del Ensen a?u IÓ.RRA en caso de contacto con los ojos, en;uague con bastante agua. Manttener en lugar fresco. NAN 3 0PTIPROICRECIMIENTO AVISO IMPORTANTE ""LA LECHE MATERNA ES EL MEJOR ALIMENTO EL LACTANTE Este produjo no es ni pretende ser la leche matema, para niños menores de 24 meses de consulte con su pediatra. Laorganmónmundualdelasa!udasrwmoel0$ 009—20066A…dahh&amml&mexdmdumntebspn £ cia continuada hasta los 24 meses de edad implementada con alimentos sólidos. NESTLE apoya esta te lavarse las manos y manttener adecuadas prácticas de higiene durante la preparación de los alimentos del bebé. ENFADO OW: Este producto no es sucedáneo de la leche matema. En niños menores de 24 meses consulte con su pediatra. SIMILAR 3 PRO SENS!T Sola 3 no es ni intenta ser un sucedáneo de la leche matema. Es para niños mayores de 2 años insulte con su médico.",9
705.11,1288.26,152.32,28.05,80.49,"lexfutbolistaJulio'Coyote' Rivera fue detenido ayer por la Policía,cuando manejaba e brio y en sentido contrario por una caliente San Borja. Losagentesinformaronqueconducíala camionetablanca,de",10
437.75,1616.25,120.0,50.75,91.07,Asesinan a dos en,10
486.21,2427.12,67.39,27.14,89.03,"©Tres amigos, uno de ellos menor de edad, fueron acribillados de 23 balazos cuando estaban reunidos con otros muchachos en un parque del Callao. Dos de ellos murieron, mientras que el tercero se encuentra grave. A las 3:10 de la madrugada de ayer, Hugo Sánchez Flores [21), otro joven no identificado y el adolescente J.Q.M. (17) conversaban en una de las bancas del parque 'Juan Velasco Alvarado; conocido como 'Los cuando fueron atacados por un pistolero que bajó de un auto blanco. Junto a ellos había otros cinco amigos. A la hora del ataque todos corrieron, pero las víctimas se desvanecieron a una cuadra. Hugo Sánchez y el joven no identificado fallecieron en el hospital “San José"". El menor está delicado, pues recibió un tiro en el tórax. En la escena del crimen la Policía recogió 23 casquillos de bala. Se supo que esta es la segunda vez que atacan al mismo grupo de muchachos. (]. Yucra]",10
1111.61,1292.83,161.61,27.96,76.44,"placa AWX-095,que pertenece hermano Paolo Guerrero. “Seleintervienealas6:30 delamañana,enlacuadra2deljirón Ordóñez. El examen cual it at ivo arrojóqueingirióalcohol. No haopuestoresistencia”, señalóelcomandante PNP Jhon Luján,dela co",10
1958.73,1289.05,159.91,32.5,75.8,"misaríadeSan Borja. Alserilevadoalacomisaría,'Coyote"" dijo:“Estoy tranquilo” Luego fue trasladado a la Oficina criminalística parcel examen toxicológico. “Elresultado fue0.98gramosdealcoholporlitro desangre(el máximo leEstarádeteni-",10
1408.5,1573.5,86.5,22.5,92.74,DE MESA Y OMISO AL SUFRAGIO,10
1353.8,1623.0,188.8,55.0,92.42,Cuidado con las multas electorales,10
1151.43,1960.36,64.84,26.07,92.64,"Los ciudadanos que no e cumplan con su deber de ser miembros de mesa titulares o suplentes en las elecciones del 26 de enero, tendrán que pagar la multa de 215 soles, recordó la Oficina Nacional de Procesos Electorales (Onpe]. Dicha sanción se impondrá también a las personas que, estando en la cola de votación, no acepten cumplir con el cargo si no se",10
1968.3,1848.5,76.6,26.9,89.73,"presentara ningún miembro de mesa. De otro lado, se informó que Estados Unidos, España, Argentina y Chile son los países con mayor cantidad de peruanos electores. (J.Hernández) E",10
1936.1,2099.9,95.4,31.2,64.82,o .O 42 | soles: : SalEs: POBRES BMIPOBRES EXTREMOS:,10
2391.55,902.05,138.78,29.49,79.04,"horas por ios delitos de peligrocomúny manejarenestadodecbriedad”, indicóeloficial. Asuvez, Kitty Cachay, abogada Rivera,diJoqueesteera víctima “abusode autoridad pues la fiscal Claudia Valdivia vino temprano para leerlelosderechosaJulioy se desapareció.Que intervenga fiscaldelaNación, Zoraida Avalos. Quépasaconlos fiscales”. GUARDAN SILENCIO Julio Rivera inauguróayersuaca- Y | demiadefútbolen Surco,porloque habríabebido. Por latarde, Paolo Guerrero, madre Petronia Gonzales modelo Alondra Garciallegaronala comisaría paraapoyaral'Coyote- El Coyote"" Riverajugó por Cristal, Melgar Univesitariode Deportes, asicomoenlaselección nacional. (NathalieSalazar) 6",10
2391.11,1908.44,118.89,41.56,62.15,E u . Amenazan _- con balas a salsero,10
2407.32,2424.96,62.17,26.65,90.05,"“Plata o plomo si quiero res seguir cantando, Librito"". Ese mensaje, acompañado de dos balas, le dejaron al cantante de salsa Junior Flores, conocido como “El Librito chalaco;, en su casa del Callao. El teme por suvida. El artista contó que la carta la dejaron el viernes. “Me di cuenta al salir. No sé el motivo. Quizás es por envidia porque en estos días he sido invitado a eventos, he salido en televisión y hace días mi rostro fue retratado en el mural conocido como “Las caras de Atahualpa”, expresó. []. Yucra) o",10
1718.5,153.38,91.5,27.62,92.6,LUNES 6 DE ENERO DEL 2020 (AVISO) 11,11
812.0,1216.2,131.4,22.8,92.68,INICIAL - PRIMARIA - SECUNDARIA,11
762.7,1372.4,97.9,25.0,90.66,ÚNICOS COLEGIOS ÚNICOS COLEGIOS TRIACE EN LIMA TRIACE EN PROVINCIAS,11
2574.0,1300.17,21.0,87.0,80.73,PARA ALUMNOS DE SECUNDARIA ESCOLAR 2029),11
654.82,1596.41,103.95,29.73,87.51,"Brea Arequipa Callao Chanchamayo Corrillos Chiclayo Comas Huanaco Jesús María (Salaverry) Piura La Molina Trujillo Los Olivos (SMP) Aranga p ""_, VACACIONES",11
714.78,1867.53,75.66,34.31,77.31,Salamanca (Ate) s/_x r ““:Eg San isidro > San Juan de Lurigancho - W © t t Santa Anita Santa Beatriz (Roma) A s 2© Surco (Marsano) Villa El Salvador Villa María,11
681.17,2120.67,102.67,26.5,85.55,Atendemos los DOMINGOS de [(consultar sedes),11
1324.33,2452.5,52.83,24.33,76.53,03 Colegio Triace K 6198 100,11
980.0,2496.3,71.4,59.9,69.16,O E 1 © © Gtrilcecolegio (O 922 33 6565,11
1003.5,2619.0,119.5,32.5,56.1,COLEGIO O ETRILCEweer w,11
965.62,152.75,106.75,31.25,83.93,12 (tACTUALIDAD) LUNES 6 DE ENER? DEL 2020,12
932.8,406.55,161.5,48.55,80.31,"áEN|VACACIONES WEB Balnearios Inician de ku may el _ camgaga||y norte son — contra bullying más visitados — ruta Hermosa, Manchen colegios",12
687.25,517.0,72.0,29.25,90.63,"ra, Colán, Vlchaylto, Los",12
1229.18,550.0,81.45,33.91,65.06,sanitario l n el ob1et¡vo Ce cuidar al salud de las if a mi lids que,12
1334.81,704.89,76.62,28.96,86.08,"CD Las playas de Lima, Órganos, Las Pocitas, ©) Según el último reporte — dias a la plataforma digital Piura, La Libertad y Huanchaco, Salaverry, El del Ministerio de EduLambayeque son las favoFaro y Pacasmayo. Uno de canción [Mined), cada día 27 — “La finalidad de 'SíSeVe' es ritas de los peruanos en ) cada cinco vacacioniscimiento! ÍBGB©DT1EB niños son víctimas de vio motivar a que los propios vacaciones de verano, tas desembolso 600 clausura p|scmas por int ring i y norma si sanitaria s y encia escolar. estudiantes reporten casos informó Promperú. AZ $ soles o más durante conespond¡entes. Ante esta situación, de bullying, y así generar Algunos de los destiny Su recorrido por las m¡entos claus ura dos la | Mined y Unicef escuelas acoge - nos más visitados =1) playas y más de la bloque Wilafpiseima iniciarán una horas y libres de son Cerro Azul, + mitad son illene E| campaña contra vioencia”, indicó el Chacra y Mar, nials. (IMM) a el bullying, graMined. JAW — O",12
2114.08,1196.03,69.17,27.89,85.02,"e VN RECOMENDACIONES MIDA su capacidad de endeudamiento. No más del 30% de i í lo que gana. i ; O LLEVE control de sus deudas [cuánto y a quiénes debe). : O POR cada tarjeta: básico recordar monto de la deuda, fecha : :) de pago y de facturación. :10 REVISE su reporte de deudas. Gratuito en www.infocorp. : |com.pe/deudas : (O NO hay forma “que lo borren' de Infocorp. Cancele y máximo! ; : por dos años se mostrará que tuvo deuda. AHORRE: Pagando la deuda y no solo el mínimo, invierno en algún producto financiero (depósito a plazo, fondo",12
1315.44,1435.67,93.78,44.0,75.05,"Eººfº es, para muchos, £3Indican que el —O EMPRENDE",12
1480.43,1500.36,106.86,32.82,80.26,"eO i O EMPRENDIMIENTO (analice viabilidad, riesgos, flujos. ded—gmente duro' y a la vez el ahorro es C|8V€, ngresosg_gr3gg] in¡Ci0'd.e un nuevo año hay que invertir en",12
1657.6,1581.07,75.0,28.87,90.04,"con el propósito de mejorar las de Equifax, dueña de Infocorp, — “Esotambién perjudica porque",12
1624.63,1736.95,69.87,29.38,86.85,"finanzas. GÓUC3CIOI1 y |a 5a|ud advierte sobre las “deudas aparecerá como sujeto moroso Entre los principales retos enjambre' (afecta a los que y los bancos no le darán crédiestán ahorrar, evitar y reducir preguntan 'cómo si con las jus— tienen tres o más tarjetas de to” indicó. [Isabel Medina) — E las deudas, y eliminar las deu— tasalcanza; él señala que hay — crédito, pierden el control y das 'enjambre”. formas: Evaluar si el gasto dia— acumulan deudas en cada Edmund Lizarzaburu, propio es realmente acorde a sus — una). “Estarán más tentados a feasor de Administración y ingresos reducir el capital de — caerán la trampa del 'carrusel' Finanzas de la Universidad . P la deuda [porque los intere(se endeudado para pagar otra",12
1265.59,1918.72,64.69,27.62,81.55,"- - ESAN, resalta que “el aho— * ses son sobre eso), invertir deuda)”, explicó a Trome. señalan que mUChOS p|den rro es clave”, no solo N _3 en educación y cobertura — Añadió que también hay 'deu",12
1286.85,1988.35,63.94,30.47,83.91,"dinero con tarjetas de crédito por los gastos de HB - de la salud. das fantasma' [montos menores fiestas de fin de año. A su vez, Sergio Soto, de 200 soles que uno olvidó",12
1255.09,2038.59,66.73,35.45,87.77,para pagar otros pr estamos - Y aunque muchos se ) gerente de marketing — pagar o que ni sabía que tenía).,12
1366.3,2193.58,137.88,47.15,75.79,"GISI:AMISTAS LANZAN COHETES A EMBAJADA "" EL VERANO . GINI?TERIO DE CULTUI:A Gringos mandan — Crece alquiler Distinguen artistas soldados contra lrán <—= HA T decadas de playa — por danza de tijeras",12
1307.73,2457.71,67.88,27.64,83.62,"Estados Unidos Irak. - . G» Entre a C> El Ministerio de Cultura distinguió a comenzó a enviar a Además, el presiden30% aumenVíctor Tomar, Andrés Ramos y Gre— Oriente Medio a 3 Mil 500 donald Trump reiteró les impactaron ayer cerca tó la demanda de gordo Condor por su labor de soldados antenas — de la embajada de Estaalquiler de casas promoción, difusión, transmisión y amenazas de Irán, é ”*ºº* _só que, si Teherántoma — dos Unidos en Bagdad, de playa en Punsalvaguardia de la danza de jeque jura vengar /< h AAO — . . dejando cinco civiles ta Hermosa, Asia , ej ras. Tomar es reconocido el asesinato — ?NE “lias, “quizás'” — heridos. y Santa María. violinista, Condor destaca con de sugene= Y — responAdemás, un alto responEduardo Gonzalez Prada, director comerse arpa y el danzante de tijeras",12
1433.99,2678.1,68.13,27.03,82.91,"ral - . dade 'una manera sable iraní amenazó con cual de Urbania, señala que el precio varía Andrés Ramos, “Cellopisgo”, Soleima< gy desproporcionada. — atacar Israel y reducir Tel según el lugar, tiempo y habitaciones. Por tiene una trayectoria de ni, cuando Sin embargo, al Aviv y Haifa “a polvo' si cuatro meses hay de 9 mil 500 dólares en más de 40 años. Recibieron estaban / ad menoscincomisiEE.UU.los bombardea. E | Asia,7 mil 500 en Punta Hermosa, 7 miles — distinción 'Personalidad í , ( Arcón y 5 mil en Punta Negra. (IMM] e Meritoria de la Cultura.(IMM) E",12
1950.31,328.06,89.62,44.62,78.77,"m Llevó de viaje a ] Su hijo de 18 años, sin teléfono, para “desintoxicación digital",14
2081.29,640.71,69.52,32.24,86.99,"los smartphones. Primero lo llevó a cruzar se da ¿a Mongolia en moto un fin de semana, sin celular. gen Wd|a",14
1490.33,894.96,58.84,26.38,85.33,"Meses después, el padre le propuso hacer lo mismo, para N ver que su hijo Kho— Clarke cuenta que Y< pero durante un mes, — be, de 18 años, se había la adicción de su hijo «a % alo que Kobe se o pu en ganar 6 enviciado con el teléfono y empezó cuando tuvo SO Finalmente aceptó y ""” 1 perdía contacto con el mun— su primer BlackbeNAN ahora ya está recupere - Z E do real, Jamie Clarke, de rey y empeoró con NN TÚ lado de la adicción.",14
518.18,1149.36,106.91,70.82,72.58,"— | 33¡€2:f£3 Mono roba | lentes a , / turista",14
2411.28,1009.86,60.56,27.51,91.57,"Un sujeto que, con el cuento del “créditos de carbono' estafó a 130 personas por 2.4 millones de libras esterlinas, fue condenado a ocho años de prisión en el Reino Unido, pero está prófugo y se da la gran vida, según fotos publicadas por él mismo en Instagram. Sami Raja (32), quien estaría en Dubi desde el 2017, publicó fotografías donde luce un reloj Rolex de 4 mil",14
1392.5,768.54,55.69,29.38,80.74,"según los psicóloCanadá, lo puso % gos, la adicción del — proceso de desintoxi$, ¿ siglo es el celular. Al — canción digital' e",14
1765.5,1177.76,59.53,26.35,88.87,"él, sobre un tejado, el alien las imágenes se ve al mal dio un saito y le robó primate brincar desde un los anteojos para luego huir — tejado para arrebatarle los por los techos. lentes y escapar velozmente singular hecho, de te.El mono se sentó que fue grabado N finalmente sobre el por otra persona techo de una casa",14
1744.49,1369.24,59.18,29.45,81.6,"€a Cuando Connor y difundido en las 'K y empezó a ob ser libras y un auto de ComanSargent(24] redes sociales, ocu> varios anteojos, sin Aston Martine — % se tomaba un selfie con un crió en Uluwatu, saber qué hacerlo — | 33 millibras. — e !",14
1193.89,1439.33,68.89,27.67,92.26,"mono que estaba detrás de Bali, Indonesia. estos. o",14
1789.7,1608.7,122.7,52.4,82.82,-7 1 Todo lo que necesita saber 7 para estas,14
1934.42,2168.08,144.25,61.75,93.15,"El antes, durante y después de la jornada electoral del de enero",14
1942.7,2412.1,179.9,38.9,84.28,ENTREVISTAS _ INFORMES TRANSMISIONES EN VIVO DESDE NUESTRAS REDES SOCIALES,14
1942.2,2612.0,151.8,88.0,59.43,[ () trompe — Etrompe,14
1481.79,568.21,85.26,56.58,66.11,"L|e a aY . ', | M , . = | ALCEN INDISCIPLINA | QUEDARÁ FUERA DE ALIANZA LIMA",15
2129.12,1023.53,89.9,30.18,84.42,"Bengoechea dejó en claro que el código de disciplina no será negociable alianza Lima.“No me queda ninguna duda de que aqui que cabalgo malo, queda afuera.No hay que acertada que pueda perjudicarnialainstitución nialgrupo. Quien haga algo diferente serun buen profesional, queda fuera, nadie lo saca”, advirtió el DT. Hace unos días el ""Comando Svr'también fue tajante con los nuevos ficha jes que estánllegando al club. Bengoechea se mostró conforme con los fichajes que se han realizado, pero sueña con más. “Veremos sila billetera alcanza. ¿Steven Rivadeneyra? Elclubestá negociando. Lo de Christofer Gonzales estos momentos es jugador Cristal. Enel tema de Carlos Zambrano, siempre hablo conél, lo conozco desde hace muchos años y me intereso porel bienestar de los futbolistas; además, siempre digo que todos los jugadores de la selección son bienvenidosalianza Lima”, finalizó. Tambiénarribó el delantero Adrián Rocky Balboa, quien tiene contrato hasta junio de este año y continuidad dependerá de surendimiento.",15
2120.32,1432.68,96.16,48.26,75.73,"BATAZOS gsá$tr¡¡;áe/% OSÉ MANZANA y Gonzalo Godoy se — de í£%idieron de Alianza%n sus redes .sg%iales. Alianza, era lo",15
2198.6,1507.8,55.87,41.53,78.69,ó i que podía pasar. NIEL AHMED llegó %S¿r¡ y $gf]¿f|g €I La decisión fue,15
2131.0,728.33,57.8,37.2,80.5,"U legó el Profesor y con la regla en la mano. Ibien pisó Lima, Pablo",15
1818.25,1541.25,78.5,39.25,81.35,gaea de inteligencia depo,15
2191.38,1579.77,68.69,32.23,89.65,EL CONTRATO DE Carlos Ascuas no sería — dura y mía” PEDRO CALLESE,15
799.0,2256.64,138.0,30.55,83.8,“FUE OFICIALIZADO EN MATTE 5 PRETEMPORADA EN CIENEGUILLA FINA DE ILUSIÓN,15
