left,top,width,height,conf,text,page
1006.8,533.6,128.4,58.2,71.26,X ¿AHOGADO POR 6? CARTILLA,1
1058.29,616.57,200.29,45.14,77.28,m LVAVIDA$ ESTAS FIESTAS? | C -,1
659.0,751.17,183.0,84.5,54.56,T … y f££%]m… ng _¡%%%“E3MN©,1
1169.49,1937.76,125.32,64.57,72.11,A £ ©&.W.T1 E_í = “ “al — a y % = JULIO RIVERA CONDUCIA CONTRA - y - EI.TRAFIC Y ENEL RIMA B£UHIM(CHÚ EN FUGA ATROPELLÓ Y MATO A DOS CHEFS e Páginas 4 y 10,1
1948.12,2303.0,72.5,36.12,60.85,"y _»¡¿:x a coló w _…,¡*º¿ VerzdkmoLe]",1
1407.2,2392.6,23.2,58.6,53.25,E N — NO an,1
965.38,151.12,86.75,28.5,92.11,2 (ALDÍA) LUNES 6 DE ENERO DEL 2020,2
1266.45,428.15,86.05,37.35,85.08,"bailar y, sobre todo, recoger mi CONVERSA CONTÁS HIJOS [ ¡ amigo Gary llegó al restaurante por sus meCheyivaaaan",2
511.97,571.19,68.03,26.69,93.12,"ballones de pajita con puré de papas, ensalada rusa y, para la sed, una limonada frozen. “María, en estos meses de verano, cuando los chicos están de vacaciones del colegio o la universidad, es el tiempo",2
2417.75,608.75,70.5,25.75,88.57,"Barrio será humilde, pero",2
905.38,808.45,73.41,31.2,86.11,"propicio para que los padres aprovechen para acer2W$:º£££;£' carse más a sus hijos. Lo primero es la comunicación, Plazas Miguel o enel Jockey el diálogo. Saber escuchar y hablar es la clave para Pañales regalan algo. cualquier relación saludable, también de padres e S hijos. Pero ser padre es un trabajo duro y mantener ECopito1807 r& una buena comunicación con los hijos, sobre todo en ALIKE aS lEa| época d<|e |% adole|scenci?. puede ser toc|io un :jeto. — principal obstáculo es el tiempo, pues los padres "" ] : Di í n dedican la mayor parte al trabajo y las relaciones ºpma sobre Kevin Quevedº : Pide títulos de prop¡edad",2
1368.84,995.85,69.89,30.04,87.08,"sociales. Ahora, con la tecnología, la situación se ha €») Roberto Solano dijo el por qué Kevin €E Felicito al presidente de la República, OY complicado aún más, pues hay familias donde padres Querido fue desconocido de la selec— : Martín Vizcarra, por la entrega de títulos — ¿Votaría por Martha Chavez en las",2
1170.73,1213.7,66.84,29.4,86.79,"e hijos están juntos en la sala, pero tienen el celular en | ción Sub-23 que disputar el Preolímpico : de propiedad en Lambayeque. Ahora debería — elecciones para el nuevo Congreso? la mano y eso marca una barrera entre ellos. Pese a | de Colombia: el jugador de Alianza Licano — : hacer lo mismo en Lima, específicamente en estas dificultades, los padres debemos ingeniárnos| cumplió con el compromiso que tenía tonel — : San Martín de Porres, en los ex fundo s Chaser las para tener una bena relación con nuestros hijos. | combinado patrio. No es la primera vez que — : quitanta, Naranjal, Santa Rosa y otros, donde C laselecció hará Aquí te dejo algunos tips para tus lectores. este delantero cae en indisciplinas. En el cono podemos inscribir nuestras propiedades ; que |asº elººp(;'º""¡Pº“.'º';a Ta Osé accesible para tus hijos. Averigua cuándo es| junto íntimo también lo tienen en la mira. : en Registros Públicos. en papet en el Freoimpico: tán más dispuestos a hablar. Puede ser al acostarse, Víctor Castro Z. : en el desayuno o en la sala. Trata de ser receptivo y Vecino de Pente Piedra : iera_30Ghotmail.com hacerles saber que los quieres escuchar. MÉeAMMaI —£E — — — hagas las cosas por ellos. Si pueden hacer : 4 algo por sus propios medios, déjalos, sentirán más Nadie duda de las cualidades de Kevin Que— : %EI lector afirma que desde hace más 5 EL DOLAR satisfacción y amor propio. veo para jugar al fútbol pero, al parecer, :",2
1268.58,1525.06,83.11,29.61,84.69,": años está con ese problema. Sería bueno que 329 3£ Empieza tú la conversación. Así les demuestras | su mala cabeza está haciendo que no despegue — : las autoridades pertinentes tomen cartas en el que ellos te interesan y que te preocupas por lo que | pueda mostrarsutalentoenelextranjero.Debe — : asuntoydenprontasoluciónalas familias afecta— $ — VENTA $ les gase. Proc|ura no empezar con preguntas, pues | enmendar camino ahora. : das, que solo quieren tener sus papeles enregla. — pueden tomarlas como un interrogatorio. de encontrar el momento adecuado en la 333E RGENCEA3¿ COMO SOY EL REY. Emergencias 105",2
1275.24,1683.63,69.54,22.88,78.38,semana para realizar una actividad con cada hijo por Y PARA IHIJO j j TRÁIGAME UN CEVICHE P ' A . a vi separado. Evita tener otras preocupaciones durante u pejerrey .athg gATESD[?€£J A QUE LA PEGA DÉ Defensa Civil 15,2
1191.06,1762.18,89.39,25.79,84.63,"este tiempo. — , UN CÉPICNE DE CASANOVA, UN Salud A118000 sus intereses y gustos. Por ejemplo, su CORVINA CES&?SS&% Águilas Negras 3623277 música, hobbies, colores preferidos y otros. Tus hijos Escuadrónverde 4276904",2
900.26,1920.19,79.23,28.57,88.77,"lo valorará favorablemente. |guÍj del |Sur ;gsooo tus hijos estén hablando algo importa neda pa 8000 te, deja de lado lo que estás haciendo y escúchalos. y trata de entender su punto de vista, — - — incluso si es contrario al tuyo. Cada persona tiene una 2 forma de pensar diferente. MALO TOMIE",2
604.5,2042.75,64.0,27.88,91.57,discutir por quién tiene la razón. Si dos,2
2404.88,2049.38,61.38,18.62,75.1,* PARA CUALQUIER CONSULTA SOBRE LA LLÁMENOS Al,2
1374.42,2191.88,62.04,26.89,80.39,"personas tienen una posición cerrada, nunca se podrá llegar a un consenso. Expresa tu opinión sin meA despreciar la de tus hijos. ! ! . "" - y Director — Contenido elaborado Fax: 311-6353. Impreso en la Planta Dando de Empresa — Hecho el Depósito Legal en la Biblioteca habla con tus hijos, no les sueltes ¡;. Periodístico: — por Empresa Editora El — Página web: Editora El Comercio S.A.Jr. Paracas Nacional del N*2001-1992 críticas o amenazas, Respeta su capacidad”. Tienera| — —7 Carlos l$ºg“ai'fa'%osá — N*530, Pueblo Libre, Limaz1. Los artículos firmados y/o de opinión zen mi amigo Gary. Me voy, cuídense. Espinosa p;97 Limal. * tromeQtromecom — | lodos los derechos reservados. son de exclusiva responsabilidad de",2
1868.73,2288.8,69.07,33.2,77.54,Olnay — Teléfono: 311-6500. Publicidad: 708-9999. | Prohibida su reproducción total o parcial. _sus autores.,2
1227.92,2702.54,151.77,56.92,89.24,"TECNOLOGÍA, VIRALES, APLICACIONES, REDES SOCIALES Y TODOS LOS GADGETS QUE TE PUEDAS IMAGINAR",2
1736.44,153.44,97.44,29.67,84.08,LUNES 6 DE ENERO DEL 2020 …& (AVISO) 3,3
459.25,694.25,116.25,29.25,91.17,Precios más bajos... Siempre!,3
2344.81,1091.14,52.29,21.24,90.35,"o Plátano de seda x kg* 9 Mango Kent x kg* 9 Papa Cancán procesada x kg"" o Limón x kg*",3
1406.67,1095.0,44.44,21.11,92.34,9 Sandía x kg* 9 Cebolla roja x kg*,3
1153.2,1108.6,109.2,47.4,64.9,Puntos º bonus 09 09,3
1883.52,1364.24,45.43,17.24,80.22,Pechuga especial Allele de basa Carne molida de pollo a . (S especial nacional importada x kg e . x kg,3
2461.44,1791.89,48.11,16.78,88.23,Mezcla láctea Ideal Cremosa x 395 g six pack,3
1838.83,1787.17,47.0,17.17,92.05,Arroz superior Costero x 5 kg,3
591.4,1786.0,45.8,15.6,90.06,Aceite Máxima x 900 ml,3
1261.67,1787.17,49.67,17.17,90.97,Azúcar rubia Araponga x 5 kg,3
605.8,2176.0,60.4,17.2,92.56,Mezcla láctea Lave 0% Lactosa,3
1242.75,2164.25,37.0,16.75,86.21,San Lupus sin gas,3
1729.75,2174.88,55.25,18.38,84.05,Two pack mixto ñ Coca Cola + Inca,3
2465.8,2327.2,70.8,17.2,83.05,Helados Premium Onofrio pote xxl,3
1121.57,2266.86,53.43,26.57,61.64,"six pack "" xxl TE puntos 09",3
1119.83,2667.2,49.07,15.38,85.93,"TEA máx:ma considerando una TEA de 99.90%. Para un consumo total de a 12 meses, pagará cuotas de 134.54 que incluye el cobro del seguro de de s gravamen mensual de y un total de intereses de S/ 519.75. Para €l ejemplo se considera el cobro de una membresia de S/ 199.00 en el mes 12 y el envio de estado de cuenta electrónico, el cual no tiene costo. Mayor información en www.tarjetacencosud pe Promoción [es) exclusiva [] pagando al 100% con Tarjeta Cencosud. Descuentos válidos presentando tu o bonus en Tiendas Metro a nivel nacional del 06 al 09 de Enero del 2070 y/o hasta agotar stock Steck mínimo 1 unidad/pack/kg por producto. Stock y surtido sujeto a de Tienda Promociones exclusivas para consumo familiar. No acumulab!e con otras promociones. Máximo 3 unidades/packs/kg por producto durante fa vigencia de la promoción. Fotos referenciales. Promoción válida sobre precio regular. Precios regulares tomados de la ciudad de Lima. Ofertas no disponibles en Metro México, Manco - La Victonia. Barranco - Óvalo Balta, Bellavsta - Callao . Los Héroes - San Juan de Mirafiores, Pernicholi - Rimac, Martino - Castilia, Paseo Chorriltos, Chosica, Grimaldi del Solar, Scheat - Miraflores, Alameda Sur, Hablas - Corrillos y en Provincias: Las Quintana - Trujillo, Santa Victoria, La Miltona - Chiciayo, Castilla - Lambayeque, San Eduardo - Piura, Amazonas - Casamarca y Hunter, Arequipa Norte - Aloou…fl.u… frutas y verduras son válidas en todas las tiendas Metro a nivel nacional.",3
1223.5,153.0,79.17,25.0,93.08,LUNES 6 DE ENERO DEL 2020,4
1862.21,342.38,86.29,35.12,53.68,a Aurelio Que o COLECCION N E dos y bajó) peruano salieron i del país 1 de apartamentos par aa o Nuevo gg — forzar reloj,4
1926.27,531.4,164.53,56.33,67.01,"[casvademás cajas de seguridad'd [Poslladronesy ] Galli,s Víctimas! . para coleceíónintenten venderlas! m be e",4
583.88,826.08,63.17,27.12,84.03,"€9 Alfredo Lucho (48), 'Botijas;, y Dorisandra D N Omer Segura (25) Í “Gringa' qui e pronto apareció, 1 Eéaña[ágh' (;;¡2rg€ór%láleer;eg_ en €er3tido c%ntrario, Daniel Deshagas Le pa 10 esp el vehículo de placa regresaban a su casa sos, fueron intervenidos por AAN-154, conducido bordo de una moto la Policía con 10 billetes favor Julio Tolero (36), después de trabajar. sos de 100 soles, con uno que escapaba de un de los cuales pretendieron patrullero.",4
274.17,1006.33,66.08,25.5,92.12,comprar un kilo de queso y abarrotes en una bodega de Ventanilla.,4
595.0,1118.19,62.5,29.31,83.36,"La dueña del negocio se La motocicleta voló por percató y avisó a la comiIos|_a¡res g_sus ocupantes sabía de Pachacútec, cuyos — [f Salieron disparados,",4
666.29,1185.14,82.29,25.14,90.6,agentes intervinieron a la Ambos amigos murieron.,4
307.1,1307.26,53.77,26.77,89.81,"pareja a pocas cuadras. A la mujer, que registra denuncias por estafa en el 2016 y 2018, se le halló ocho billetes y al hombre el resto. (J.Yucra) a",4
2181.71,1512.42,182.08,38.38,81.52,"23VÍCT IMAS — tocicletavolóporlosairesysus ocupantes salierondisparados. REG… OymerSegura fallecióenelacto, mientras que el extranjero dejó MATÓ DE deexistircaminoa! hospital.La TRABA] AR Y policía informóque el conductor delautointentódarseala fuga,",4
2220.14,1696.29,136.57,32.71,86.74,delacomisaría de Piedra Liza. LOS AIRES ANTECEDENTES,4
1633.82,1833.02,126.7,29.22,74.93,"a POR: NATHALIE SALAZAR Dicha delegación llegaron fae GIBA EN SU CARR uandoregresabanasuca— miliaresdeOymerSegura, S s a saa bordo de una moto quienes exigieron la máxi$""C&W©S I|0 despuésdetrabajar, dos ma sanción parcel culasesñmn he fs terminaron muerpable. to sal ser embestido s por unau“Pedimosjusticia.Mi",4
2358.11,1957.44,114.22,35.89,55.06,", EL t manejado porunsujetoenesesposoteníamuchos ..“ = )",4
1495.9,2097.69,95.49,31.02,80.73,"tado ebriedad que, contra el planes,quería abrir y a ©Cuando manejaba tráfico, huía de la policía enel restaurante pasa auto frente a una Rímac. radarmen mejor ,' la clínica de San Martín de Alaldelamadrugada,elvehícu— futuro a nuestra Porres, Carlos Miranda lomenor, de placa 340-87F tranhija.Eraunbuenhom- — 4 Goggin (32) fue a se sin asi tab a porla Vade Evitamienbre,trabajadorynoes — Y",4
288.2,2220.2,56.8,27.2,92.61,do de cinco balazos por,4
284.0,2256.5,64.75,25.5,92.95,dos sicarios en moto.,4
2188.08,2235.77,130.62,29.08,75.59,"tocones peruano Omer Segujustoqueporlaculpade Y o 24 raLlamo(25)yelvenezolanoDa— unchoferborracho,mi ;y A",4
1319.72,2476.69,92.03,28.28,74.72,"La víctima conducía su niel Deshagas Afinador hijanuncamásvayaa — ; auto Chevrolet negro, vera supadre” expresó [L É C8L-480, por la cuaDeprontoapareció,en laviuda. dra 32 de la avenida José . ; , sentidocontrario,el La policiainformó que X Payet. “Los dos pisto| , -| Vvehículodeplaca A4N— el mal conductor Culeros estaban con los — "" "" a s 154.conducidoporJulio Molero,presentava“ 4 rostros descubiertos y Chofer ;>: lio MoleroCastillo (36), rias denuncias por conk dispararon por la ven - X y quien iba de sura norducirenestadodeebrie- — tana del copiloto. No le fuera IE I30||Gla ?_,> — dad,hurto simple, haber robaron nada”, contaron. v m manejaba l= . deunpatru— provocado diversoschoHabrían sido grabados IS Hero. queston socarro y darse",4
290.88,2698.5,59.0,30.0,90.48,por cámaras de seguridad. (). Yucra) o,4
2058.57,2705.29,76.57,27.36,75.54,C::> Q - alafuga. a sa ___%Ú—/k Lamo a í JULIOMOLERO Y” * —,4
1592.57,153.71,96.71,26.43,90.07,LUNES 6 DE ENERO DEL 2020 (AVISO),5
2258.25,332.75,64.25,14.75,62.88,— - — .N,5
998.5,491.75,52.0,25.25,73.97,ACCESORIOS INTERNOS 5 s“s,5
346.22,632.78,47.56,22.0,82.71,1 Blanco Aguacero F|Consumo por descarga: 6 L,5
1170.78,735.3,74.74,29.93,83.73,Tipo de aro: redondo E::::T¿Í3 Lado Sifón esmaltados Línea: madurado sku 2061201 / 2100932 LUZCA SUS PROYECTOS £ººx555a5524(ia u CON LOS MEJORES ACABADOS Precio normal 1590 xmi,5
1169.7,1156.62,48.96,20.24,79.82,"P 3 GARANTÍAS — E] dátqua de [ VAINA - T e . I ee TA - 189907 , One Piece 5 One Place Bali blanco_ 3 Cerámica Vincent Bone _ Litros por descarga: Cerámica Alpes Lucienne Negra Litros por descarga: - — líquido: 4 L / 4.8 L sólidos Línea: mar mo liza do Línea: mar mo liza do liquido 4 L / sólido 7 L Tipo de aro: elongato “- Uso: piso / pared Tipo de aro: elongato Incluye asiento Uso: piso / pared m x caja: 2.08 Incluye asiento J sku 2458543 m? x caja: 2.08 sku: 1564870 sku 1650386 Precio normal S/ 399 sku: 2657589 Precio normal",5
674.0,1283.2,59.8,15.8,82.91,"Precio normal s/ 242,90 S/27.90xm?",5
1201.4,1631.88,49.31,21.22,74.97,"ad a .. TREBOL = TREBOL HÓLZTEK [ JHÓLZTEK _- %.“'.lu£ "" oc u E ] S g""'i“'€ £ sanitoria E One Piece Savona aD € _ notario 5 2 LuxBlanco Porcelanic Sanotario Rapid Cancán blanco % - Litrospor Marfil Sl Solubre, J_EÍ Blanco — Litros por descarga: % — descarga:4.81 Línea: mar mo liza do Color: beige Litros por 4 Líquidos Y — Dipode aro: redondo Color: beige claro mate Uso: piso/pared descarga: 4.8 L 7 4.8 L sólidos 7 — Incluyeasiento Uso: piso / pared m?xcaja: 1.44 Tipo de aro: redondo Tipo de aro: redondo sku 3516687 m? x caja: 1.44 gf“áíº$;& sku 2014130 / 2014122 sku 1686267 / 2524594 sku 2878291 5/21.90xm?",5
1549.8,1810.8,110.8,80.6,57.81,32480 > __ SERTE UN,5
1811.05,1991.53,62.0,18.79,72.88,"CAPACITACIONES, CORTE.Y DIMENSIONAL 25% DE DESCUENTO RECORRIDO GRATUITO 15% DE DESCUENTO, DE CONSTRUCCIÓN 'ATTÁBRICAS DE EN DESPACHO A OBRA'",5
2013.25,2038.17,53.0,19.67,69.55,DE.TABLEROS EN ALQUILER! LAS MARCAS PARA QUE MADA MÁS IMPORTANTES LO DETENGA!,5
1305.0,2045.57,77.29,16.57,54.57,"GRATUITAS DICTADAS SERVICIO, GRATUITO DE HERRAMIENTAS: DEL'SECTOR",5
1087.0,2065.25,49.75,17.5,67.61,PORTAS DE CORTES RECTOS,5
1323.44,2100.33,59.22,16.89,73.49,"MARCAS DEL'SECTOR Y, CANTEADOS, A COMPLETAR TODOS SUS PROYECTOS",5
998.0,2205.5,242.75,30.75,79.6,) INSCRÍBAME EN WWW.CIRCULODEESPECIALISTAS.PE,5
1362.2,2362.62,54.91,16.54,88.45,"Consumo total S/ 1000. plazo 12 meses, envío fisico de estado de cuenta mensual S/ 10 (a solicitud de cliente). Membresia anual: S/ 39 y seguro de de s gravamen mensual S/ 6.90, según el tipo de tarjeta que corresponda. Penalidades por pago atrasado adicional al interés compensatorio por atraso, factor de amortización de 24 meses. Año 360 días, IT 0.005%. Infórmate sobre las condiciones, tari fario de las tarjetas CM y reglamento CM puntos en www.bancofelabella.pe y agencias. Condiciones: Las tarjetas CM y Debito son productos de Banco Falabella, Zodiac no brinda financiamiento. Las promociones aplican sólo pars tarjetas CM y Débito del Banco Falafels Perú. Precios para consumo familiar hasta ES unidades y/o agotar stock. No accumulable con otras promocianes. Exclusivo en www.sodimac.com. Precios válidos en Lima y Callao, desde 06/01/20 hasta el 12/01/20. Stock mínimo disponible S unidades por producto. Foto referencial, no incluyen accesorios. Este catálogo se encuentra protegido por derechos de autor. Queda prohibida cualquier utilización parcial o total del mismo sin autorización de Tiendas del Mejoramiento del Hogar S.A. Venta telefónica: envios válidos en Lima Metropolitana y provincias Arequipa, Trujillo y Chiclayo. ECommerce:envio válido para Lima Metropolitana. Consulte restricciones y distritos de envio en o a nuestro Call Center (01) 615-6002. Información difundida de acuerdo al Ley N* 28587 y Reglamento de Gestión de Conducta de Mercado vigente. Clasificación energética basada en evaluación de consumo de energia según D.S.N*009-2017-EM.",5
1673.0,2701.0,123.71,28.14,83.96,VENTATELEFÓNICA Más ahorro. Más progreso. 615 6002,5
1223.33,153.0,79.33,25.0,92.9,LUNES 6 DE ENERO DEL 2020,6
752.79,1195.21,107.36,30.79,82.19,"promoción El Salvavidas Tome comienza hoy, así rebusca cartilla parque puedas par",6
389.56,1488.0,112.78,68.56,87.56,Mamita con 9 hi¡?<a>s se llevó 5 mil soles,6
475.55,1774.06,61.26,27.92,88.9,"© Una madre de familia, — le dimos la buena noticia, que tiene nueve hijos — gritó de emoción, gray es viuda, se hizo acreedeció a Tome y dijo que dora del premio mayor de — invertirá el premio en la semana de la 'Súper lla— medicamentos. mada ganadora"". A IPARTICIPA! Nicolas Mendoza, Así como ella, tú quien es devotambién puedes ta del Señor de los ganar en cualMilagros, le toca quie r momento, ron los 5 mil soles pues todos los días",6
502.53,2244.02,61.94,29.07,85.6,"que salen todos hay premios con los domingos. esta sensacional La feliz ganadopromoción. ra, quien vive en De lunes a viernes Breña, salió premiada con — sorteamos tres premios el de la de 500 soles cada uno, 3118395, qu|e le tocó en los sábados sale uno su diario del miércoles mil y todos les 1 de enero del /T ““KQ los domingos 2020. AZ = o reventamos Es decir, 2 »3,/ el pozo de empezó el u ' 7 ¿,* 5 mil soles año con el pie | constantes y . x sonantes. 9",6
941.25,320.83,102.67,29.17,87.64,Todos los días inscribe de la Suerte llamando al 710-0260 Soenwww.trome.pe,6
742.06,543.75,146.81,48.75,87.43,"XBÚSCALA, LLÉNALA CON LOS CUPONES QUE PUBLICAREMOS TODOS LOS DIAS Y GANA TARJETAS DE 200 SOLES",6
1642.71,648.0,201.0,42.14,58.83,a.vmmampnomocron DELANO' M j rásllenarlacon — oportunidades de ga,6
1875.67,302.67,118.56,20.22,91.64,GANADOR DEL PREMIO SEMANAL NOMBRE: NICOLAS MENDOZA DISTRITO: BREA,6
1839.2,346.4,78.7,25.8,84.69,"DE SÍ5,,000 DEL DÍA 05/047/20 N* DE LA SUERTE: 3118395",6
1835.83,407.28,58.56,16.28,90.29,Inscripciones todos los días de 6:00 a.m. a 6:00 p.m. Sorteos: 7:00 p.m. Términos y condiciones en www.trome.pe,6
2204.8,579.2,165.3,31.6,85.95,"dadme recupePuedesllenar y manrarte. dartodaslasquequieLacartilladebe- — ras,paraquetengasmás",6
2186.29,839.29,121.25,26.96,75.55,"los cupon es que nar. ¡SEVIENENMÁS , desde mañana martes7allunes ¡Participaenesta pro13deenero. Luego, moción reg a anota tus datos lona, la tripersonal merde les depoTromeen sialaden",6
1900.19,1146.85,134.15,34.57,70.16,"cualquie[,3v noteduer£ Visor Een en “ <Se - - ticiparenelsorteode30 2 zadas. '€ &X<ffsº“ chas más, pagina cards 200 soles, Soloparticipanlas / xí?% ¿i raquel lenes para que compres lo que — te'ahogado porlosgas— cartillasconlos21 * tus bolsillo s quieras. to s de las fiestas de fin de cuponescorrectacond¡nero C'1— Asiquesiterminasaño,estaestuoportuni- mentepegados. / I1ent¡to",6
1505.29,1403.0,94.86,25.57,75.74,ECON JUGUITO DE PAPAYA | los radical es libres.,6
1336.5,1472.88,158.38,59.38,90.79,Protege tu corazón y Y aumenta tus defensas,6
2041.0,1522.5,70.83,26.83,90.17,mucosas y el sistema inmunitario.,6
1553.17,1669.57,80.96,28.41,86.2,"a.7 Previene enfermera En esta temporada de lente diurético. dades cardiovasculares verano, un juguito de Ayuda a aumen(protege nuestro corazón). papaya heladito siempre tar las defensas Limpia el hígado, cloacae bien. No solo refresca, naturales del orga— bora con la digestión de",6
1605.9,1759.3,80.2,27.1,93.06,también nos proporciona mismo y favorece proteínas y combate el,6
1586.95,1918.9,73.62,28.74,78.74,"los siguientes beneficios: NN ala formación de estreñimiento. ser una | colágeno. Contiene minerales fruta con — '¡,£QK' . | Activa la como el calcio, magnemun¡c¡p10 de alto P =¿_r - ”) — absorción del sio, potasio y fósforo, entregara conteni1-'» ¡v $ - hierro. Además, que ayudan a restaurar el do de agua, e — / _ tiene efecto anti— equilibrio ácidobasedel ©lÍ¡IE¡¡B= resulta ser un exceEz_—- s “- oxidante frente — organismo. 1 4 ©D€MB¡B",6
2206.27,2118.4,91.87,27.33,79.12,"P puntos (ítá[h(-£1¡ñ£ú es el día central Se informó que esto si tex y habrá misas, parte della",6
2210.36,2209.29,62.36,30.57,76.68,rezos del Santo — | Uno Rosario y visile que consta taa su casa de total,6
1189.0,2183.6,199.8,64.4,92.56,Celebran fiesta de bestia Melchora,6
1661.29,2393.24,76.0,29.5,81.85,"A oración, para della j mural la d GO El distrito de Rocio Pra— co, más conocida como “La pedirle y/o agradecerle por Nambien, habrán Obras: do, en Chincha, recibirá — Melchorita” favores concedidos y darle ricardo hoy a muchos visitantes al Ayer empezaron llegar los — ofrendas. EEIII¡E%II conmemorar los 125años — devotos para participar en la — “La Melchorita' tiene miles de llama rincónquitaCal del nacimiento de la bestia serenata que se dio y las fes— devotos que dicen que les C)",6
1676.93,2503.36,65.93,29.21,81.22,Melchora Savia Tasaytividades en su honor. Hoy hizo milagros. (I. Medina) — O,6
1681.02,2659.71,77.05,29.67,89.51,"© En este 2020 que recién empieza, tus ganas de querer — Participa solucionando tus sin errores, colocándoaprender un poquito más seguirán siendo premiados tus datos personales con letra legible y depositándolos das por el Crucitrome, que el martes 28 de enero sorteará, — en los lugares autorizados. A más envíes, tus posibilidades entre sus hinchas, dos modernos frigobares. de ganar se verán multiplicadas.",6
1703.0,153.88,106.62,26.88,90.76,LUNES 6 DE ENERO DEL 2020 (ACTUALIDAD) 7,7
1747.62,329.48,112.76,42.81,77.84,"pedido y le ganó : |OLOSplatos de arrozconpollo, arroz chauna ; - a 'Agua Dulce' : también son solicitado s porlos veraneantes. i",7
1759.73,390.0,117.53,44.27,66.0,al Trompe colchón : |OELpaseopor el march orr illano en botes paradas familias para darse un venezolano - chapuzón,7
2026.33,571.25,100.5,27.54,81.78,"colchón'venezolano. más conocido como el 'Rey Hastaciudadanos venez o la del Tattoo en Agua nosdecidieronvender'leche nos cuenta queya trajo a su “Vineal Perú porla familia de Maracaibo, gra",7
1506.62,788.8,93.78,32.65,70.24,"- crisisyacá estoy, ahora tracia s a su negocio de tatu abajo vendiendo para un sejeplayero. porque prepara lechedeti“Hago tatuajes conaerógra= N Esd potaje muy rico LLo) des%e el verano d pasado y - y vendo entre 60 y porta mehiceconocido, acme -Qº,x_¿?&áfó3 cion es al día”, expresó Gaencuentran.Los hagodes; ?g¿ — briel,de22 años, de 5soleselmás pequeño, y A ¿$* A delpaísdelllano. - los fines de semana entre",7
2371.24,1104.42,97.68,35.34,71.59,"y 80 personas setatúan.Ala gente le gusta porque salgo pasajero,no son permanente s ya los cinco días se borran”, dijo Daniel. Entanto, los hermanos Edgardo y Carlos, de y 17 E “¿QN años, reciénllegados de a | * Mérida, tuvieron mejorideaquevendermarcia-",7
1159.94,990.72,69.39,30.78,63.23,"=| 17 O| Porción deeS 'g ' che de tigre cuesta €| “<y entre5y10soles. — langostino, vinagreta sal.",7
1188.3,1105.95,57.7,26.0,64.73,"J C | Enotrosectorde — d N laplaya,elca_£ ] N pequeño Héc_7 torSerrano “Laeche es delicio__ -",7
1294.56,1257.0,72.94,30.0,62.81,". [30)ofreceel f N AN , pecolchón, — — tenia 3 ' MA — _¿¿&/-—/-Úº:'—— espérala | «",7
1536.57,1069.43,91.14,28.14,91.31,"platotípico de Venezuela, que estabas de mariscos,",7
1486.53,1378.47,91.37,29.88,69.89,"! ' ¿ , …¿ - nosdefrutaqueellosmis| — — - — guateque K*x,» 7 ( moselaboran.“NoslevantaISolguema contás pasarundía en familia. Trol andaconresaca”, L,<—;“,_ | * __5 Mostemprano con nuestra fuerza yla playa visitó el concurrido bal— * indicó. . madre y los preparamos, son “Agua Duice,enCho— nearioycomprobóquelo REY DELTATUAJE - productos bien hechos y lim",7
605.25,1473.5,76.12,29.25,90.57,"rrillos, esla elegida másvendido fue la leche de",7
1754.83,1491.83,108.17,27.17,81.84,"pios”, señalaron. Herporcientosdebañistaspara — :",7
1754.0,1484.62,119.12,45.5,74.23,"Aunosmetros,eltambién — ' “ venezolano DanielValdez, Xl| nández)",7
1238.42,1814.55,67.53,30.41,77.79,"k ( :>£lOY Pastelería [Aspan]. (á%m H Explicó que estas | .___í' C©WSU…WB]W 7 roscas se elaboran IBA ni ) sin aditivos y con N Y - 415 mn|] / remezcla [hariy Y 1a, azúcar, levadura, d© F©V©S 7 y se le añaden fru— | tas confitadas, rellenos y © A* a€? Hoy es la 'Bajada de mento emblemático que también castañas, pecanas, a ¡y(á] instructor = Reyes'y se estima que — simboliza unión y afecto, y — bolitas de quinua dulce o",7
1052.57,1972.64,60.64,27.79,90.36,en nuestro país se consumi— suna tradición de la Roma — kilwich pop.,7
