left,top,width,height,conf,text,page
2006.7,1812.62,53.76,23.3,87.61,"Deseo final 1:15, 3:15, 5:15, 7:15, 9:15 Nueva York sin salida l|4ll00b]l20] 1:30, 330, 5:30, 7:30, 9:30 Jumanji: El siguiente nivel [Apt] [Dobl2Dl 1:00, 2:00, 2:30, 3:15, 4:20, 5:00, 5:30, 6:40, 7:15, 7:50, 9:00, 9:30, 10:00 Marcado por la muerte (aj [Dob)[2D] 6:00, 8:00, 9:45 Star wars: El ascenso de Skywalker [Apt][Dob] (20) 3:00 OCINESTAR METRO BREA _ “ SALA DIGITAL 3D S/.10.00",21
2007.36,2124.53,52.87,24.31,84.98,"La princesa y el dragón (Apt][Dob 3: 33"" 5:15 Deseo fºmal IIAHDOb""ZD 3:30, 5:30, 7:30, 9:30 Nueva York sin salida [14][Dob][20] 3:45, 5:45, 7:45, 9:45 Jumanrji: El siguiente nivel lApl] (Dob]l2D) 3:00, 3:30, 4:15, 5:15, 5:45, 6:45, 7:30, 8:00, 9:00, 9:45, 10:15 Star wars: El ascenso de Skywalker [Apt] [Dobl[20l 3:30, 6:30,7:00, 9:30, 10: 00",21
2015.74,2395.74,51.81,21.77,84.21,"“ SALA DIGITAL 3D S/.10. 00 Deseo final [14][Dobl[20l 3:30, 5:30, 7:30, 9:30 Nueva York sin sal [14) (Dob]i2D) 6:00, 8:00 Jumanji: El siguiente nivel [Apt][Dob)[2D) 3: 00 4:15, 5:20, 6:45, 7:70, 9:00, 9:30 Sta wars: £l ascenso de Skywalker lApl) 3:15,10:00",21
2003.8,2647.57,56.36,22.8,85.49,"O CONTESTAR METRO SAN MA “% SALA DIGITAL 3D S/.10.00 Deseo final (14)[Dob)[2D) 3:45, 5:45, 7:45, 9:45 Jumanji: El siguiente nivel (Apt](Dob)[20) 3:00, 3:30, 4:15, 5:15, 5:45, 6:45, 7:30, 8:00, 9:00, 9:45, 10:15 Marcado por la muerte (14)(Dob)(20 6:00, 10:00 Desastre en paris [14",21
2413.0,958.78,63.94,23.67,80.65,"(Dob)(2D) 4:00, 8:00 Star wars: ascenso de Skywalker (Apt lDob3[20 3:30, 6:30, 9:30 Frozen 2 (Apt][Dob] IZD]315 5:15,7:15,9:15",21
2423.7,1190.9,50.84,22.32,82.57,"CINE STAR METRO UNI S.5 “ SALA DIGITAL 3D $/.10.00 La princesa y el dragón (Apt][Dob 2D) 4:15, 6:15 Deseo final [14][Dob 20) 3:30, 5:30, 7:30, 8:15, 9:30, 10:00 Nueva York sin salida (14)[D0b)20) 3:45, 5:45, 7:45, 945]uma¿¡ El siente nivel 3:00, :30, 4:15, 5:15, 5:50, 6:45, 7:30, 8: 0 9:00, 9:45, 10:30 Star wars: El aspen so de Skywalker (Apt][Dob][20] 3:30.",21
2389.0,1406.56,53.0,19.44,68.02,E CONTESTAR SUR SE » SALA DIGITAL 3D 5/.10.00,21
2425.25,1685.75,55.39,24.62,83.64,"La el dragón (Apt)[Dob)(20] !""Tsm Deseo fuñm]lnopb""2m33o 5 30, 8:15, 9:30, 10:00 Nueva York sin salida 3:45, 5:45, 7:45, 9:45 Jumanji: El siguiente nivel ( Apt] [Dobl Dl 300 3:3 415 515 5:45, 30 800 900 9:45, 10:15 Star Skywalk (Apt] [Dob](20) 3 45 6:45, 9:45 ENCESTAR $/.7 “ SALA DIGITAL 30 $/.10.00 Deseo final (14)[Dob](2D] 3:45, 5:45, 7:45, 9:45 Nueva York sin salida [14] lDob]l20] 3:00, 10:00 ]uman¿r quinte nivel [Apt][Dob](2D] 3:00, 3:30, 5:15, 5:45, 7:30, 9:45 Star wars: El ascenso de Skywalker (Apt)[Dob] (2D) 3:30, 6:30, 9:30",21
2431.16,2082.04,51.52,24.86,85.77,"CINERAMA EL PACIFICO ]umargr, El siguiente nivel (Apt]íSub] 3:00, 3:45, 5:15, 6:00, 7:30, 8:15, 8:45, 9:45, 10:30 Star wars: El ascenso de Skywalker 3:15, 4:15, 6:15, 7:00, 9:15, 10:00 Nueva York sin salida 114][Sub] 4:30, 6:30, 8:30, 10:20 Cabalga y la princesa de hielo (Apt] [E) 3:20, 5:00, 6:45",21
2385.09,2263.27,67.36,21.09,75.84,OUVKSAN MARTIN y SALA DIGITAL 3D S/.14.00 umanji: El siguiente nivel[Apt],21
2440.06,2367.94,48.25,21.06,86.55,j Dob)1:15 2:30 3:40 4:50 6:10 7:20 8:40 9:50 Star wars: El ascenso de Sk walker[A t)Dob)3:30 4:20 6:20 9:10 10:00 Nueva York sin salida[ld]lDob]3 10 5:20 7:30 9:40 Frozen 2,21
2365.67,2527.67,57.0,19.33,67.42,% SALA DIGITAL 3D S$/.14.00 Jumanji:,21
2426.94,2639.79,63.61,25.82,80.32,El siguiente nivellApt] (Dob]1:15 2:10 3:40 4:407:10 8:40 9:40 Iuman|r El siguiente 3D) 6:10 Nueva York sin (Dob)3:305:407:50 10:00 Star wars: El ascenso de Skywalker[Apt)[Dob]1:20 3:10 4:10 6:00 7:00 8:50 9:50 Frozen 2,21
334.11,638.74,60.11,26.58,91.6,"dos veces al día sin falta, pues en el verano sudamos más y los poros se pueden tapar causando",22
965.12,751.56,76.56,27.69,76.27,N . 7 cuerpo y el rostro. Embolia . primero. | 1 MIXTAWGRA ; N ©,22
427.73,991.27,66.12,27.0,92.9,"Se recomienda el uso de protectores en gel. Estos evitan el brillo en el rostro dejando un acabado mate, además de regular la producción de sebo.",22
1214.11,998.0,66.22,27.6,80.4,": ; 6 Yaseauna piel con alergia solar o hiper¿+ pigmentación [manchas), existen protectores solar es con ¿+ en crema, porque además de proteger : + activosespecíficos que ayudan a sus condiciones. Debes i : 1 acudir médico para que te indique cuál es la ideal.",22
1302.22,603.61,62.11,27.94,92.01,"Si tienes la piel muy blanca y quieres lucir un mejor tono, aplica un autobronceador por todo el",22
1815.43,1031.0,66.29,25.43,86.68,": lapel del sol, van a hidratarla. También : permiten una aplicación más cómoda.",22
1844.11,937.22,58.56,35.56,73.74,: 1 O Ideal estar los bloqueadores solares í,22
2179.43,598.29,124.29,44.43,87.81,Adiós ojeras © Desaparece esas antiestético bolsas,22
2258.14,678.0,63.43,28.71,93.17,"y ojeras, colocando cada día dos rodajas de papa sobre los ojos durante 10",22
1487.23,1301.94,59.75,26.98,91.51,"on el paso del tiempo la exposición a los rayos UVA y UVA pueden provocar cáncer de piel. Por ello, para evitar daños a corto y largo plazo es importante usar un protector solar que brinde protección efectiva contra los rayos UVA y UVA, todos los días, incluso si las par",22
1968.76,1310.47,60.82,26.0,85.26,¿ ( Existen opciones en crema o en spray. La elección va a depender : delas preferencias,22
1966.83,1418.17,85.5,35.5,86.38,"del usuario, lo © importante es",22
1577.87,1652.32,69.87,28.06,88.49,"tes expuestas de su cuerpo que ambas ya están bronceadas. deben tener “Por lo general las pierna prolección les latinas, por su prototipo q mínima de y el nivel de sensibilidad, 50+ FPS. deben utilizar protectores solares con un factor de pro— lección mínimo de 50 FPS. » POR: Además, los peruanos deben /? FRANCESCA tener en cuenta la posibilidad 7 y NN BRAVO de contraer alergias solares X",22
1396.68,2015.78,71.97,28.2,91.54,"que se evidencian en la piel en forma de enrojecimiento y picazón”, explica Aldo Galvez, dermatólogo de La RochePosay.A continuación, el especialista brinda los siguientes tips para elegir protectores solares de acuerdo a tipo de piel:",22
249.42,2553.25,59.33,35.67,78.72,E 100 gramos de 1. mantequilla E “+]Jugo de limón 1.. parmesano,22
313.0,2467.0,69.75,27.0,78.16,1 docena de conchas,22
343.5,2612.25,73.5,27.25,78.74,100 gramos de queso,22
326.8,2683.8,54.4,25.2,81.51,+ Limón en cuñas para,22
772.2,2600.62,63.8,27.25,87.5,PREPARACIÓN Limpiar las conchas y salpimentarlas. Cubrir con queso parmesano y % de cdta. de mantequilla y gotas de jugo de limón. Llevar al horno de 175%C o durante 8 a 10 minutos o hasta que el queso,22
1186.0,2579.41,60.24,25.68,89.54,"se derrita. Si no se cuenta con un horno, usar una sartén que contenga 2 centímetros de agua. Colocar las conchitas, tapar la sartén y cocinar de a 4 minutos. Servir con rodajas de limón.",22
2431.57,2293.57,41.0,25.29,82.33,» jade papaya o piña y un,22
2378.57,1149.57,101.0,36.29,90.52,BAJANDO DE . PESO DESPUES DE FIESTAS,22
2420.19,1789.8,64.5,27.61,91.86,"© Claro, ahora que celebraste las fiestas vienen los arrepentimientos, pero tranquila. Todo ese malestar y dolor en el alma que sientes por haber ganado unos kilitos de más debido a la juerga de fin de año, lo vamos a corregir limpiando tu organismo. Esta dieta la puedes utilizar incluso después de cualquier comilona de verano. Aquí va la receta: Desayuna fruta picada, invaluables aquí media pitahaya o 2 granadilla con unas cucharaditas de salvado de trigo (2-3) y un vaso con agua tibia o caliente. A media mañana come 3 o 4 orejones, guiones o higos secos. Almuerza de 3 a 8 huevos sin sal [fritos o cocidos) con una roda",22
2415.77,2490.02,56.02,28.17,92.58,vaso con agua caliente 0 tibia. En la cena copia el desayuno o ingiere la mitad del almuerzo. El agua es fundamental. Toma todo el día cola de caballo o agua de pelos de chocto. Si tienes la presión baja solo toma agua y 2 litros al día.,22
1726.89,153.67,106.89,29.33,86.77,LUNES 6 DE ENERO DEL 2020 …& (FAMILIA) 23,23
2100.97,618.11,85.13,30.06,88.39,"7 ?CAMBIATUS HABITOS Y COMIENZA UNA NUEVA VIDA color verde como brócoli, acelga …' y zapallo italiano que, además, protegen la piel y mejoran la y come frutas y digestión. .Come frutas de forma diaria. PA …… La papaya, la piña, la sandía consejos. y el melón tienen mucha agua e . Haz ejercicios cardio vas cu hidr a tan el cuerpo. lares, como caminar, bailar, Evita el alcoho! y el cigarro. practicar artes marciales o mon'Ambos son factores de restar bicicleta, durante 45 minutos — go para muchas enfermedades. diarios y de preferencia en las También reduce la ingesta de mañanas. bebidas gaseosas. . Consume regularmen. Mastica despacio. De a 20 te alimentos que contengan veces por cada bocado para é",23
1588.74,1111.32,63.4,26.46,89.67,"abundante fibra, facilitar la digestión. es decir, ver Procura no conos primeros días del bajar de peso, sino tamburas de sumir harinas, año son los mejores bién te permitirá azúcar y grabara asumir propósitos. — conservar una sas después de Quizá puedes propo buena salud. El las 6 de la tenerte dejar los malos nutricionista clyde porque el hábitos alimenticios y empezar — nico José Antonio cuerpo se prea llevar una vida más saludaQuispe te ayu para para dormir ble, que no solo te ayudará a da con estos — y no necesita de A Z alimentos energéAGRADECIMIENTO: FACEBOOK: JOSÉ ANTONIO QUISPE. K Z ticos. [<]",23
567.17,1785.42,199.25,34.08,84.31,CLÍNICA SanMarcos ' ESPECIALISTA EN DIAGNÓSTICO Y TRATAMIENTO DE ILAS ENFERMEDADES BIOLÓGICAS,23
909.54,2003.85,93.69,27.85,93.93,Cirujano - Urólogo CM 12339 - RE 10151 Magister 00289 - Doctorado 00115,23
683.17,2180.17,221.72,39.78,75.0,SF p| IMPOTENCIA SEXUAL 2| DISFUNCIÓN ERÉCTIL o FALTA DE DESEO SEXUAL o EYACULACIÓN PRECOZ o SEXUALIDAD DISMINUIDA,23
945.56,2351.22,161.89,35.0,65.26,N c * INCONTINENCIA URINARIA 2 AUDIPHONE % Í.L,23
1344.82,2443.18,132.05,41.15,77.01,"Á L(& % o CANCER DE PRÓSTATA GENITALES aS CENTRO RADIOLÓGICO TECNOLOGÍA ALEMANA YZ7| Prevención, detección y tratamiento ¡ … 054 299977A E 407 Frente a Quesada CIRUGÍA DE PRÓSTATA SIN CORTE CON LÁSER º_…º?;'?£ ' ¡!90an1 Cacumen ¿bm%mw:wumm",23
1331.12,2556.12,168.62,61.62,57.65,?M/ Y 9A02473¿8j& g;g;;g;; T U ',23
1771.4,2698.2,244.7,54.3,50.76,BRENA s) 00282 d NE …' d| ST) 1'73n44;7z<9¡06 -¡,23
1223.33,152.33,80.0,25.67,90.54,LUNES 6 DE ENERO DEL 2020,24
1338.81,642.5,87.12,26.62,91.96,LOS CHICOS HACEN MÁS AMIGOS. Pueden encontrar amigos con un interés común y desarrollar habilidades de,24
2414.17,633.0,70.17,28.58,91.78,Lee la información que sale en esta página y responde las siguientes,24
1777.87,893.7,82.85,27.79,83.44,"6 _ s) ELECTRÓNICAS. También En el tallar de mecánicas y de programación robótica tos niños informática. construirán un: O REFUERZAN SU A Robot CREATIVIDAD. Con la robótica pensamiento científico y lógico Foco los niños se hacen más creativos, — para poder ejecutar sus proyectos. Mueble",24
1833.09,1110.41,75.52,28.32,88.19,"ya que parten de una idea y la 5 MEJORAN SU AUTOESTIMA. desarrollan hasta el final. Los menores aumentan su El 6 DESPIERTAN SU amor propio y su capacidad hacerse tiene el PENSAMIENTO CRÍTICO. de superación cuando ven uso figurado de: Les ayuda a desarrollar un la aplicación directa de sus Morirse de sueño conocimientos, lo que les estimula E Tenerhambre — para seguir aprendiendo. Perder la paciencia",24
1871.87,1401.43,71.85,26.93,92.26,E LOS HACE MÁS TOLERANTES. Les ayuda a superar la frustración cuando no logran su objetivo y a pedir apoyo al grupo para desarrollar estrategias. O LOS PREPARA PARA EL FUTURO. Todo lo aprendido con la robótica les servirá para cuando se hagan jóvenes y adultos.,24
2322.0,1497.29,59.43,25.14,81.37,"A. Fantasía E La abuela €, Molde",24
1228.91,1894.71,73.74,30.93,81.43,"o El facóguero 4 es un mambo - de la familia | M MEJORA , Jabalíes salvajes - DIVERSAS ÁREAS DE / || . , CONOCIMIENTO COMO - pequeño P n taller que es de gran con el exterior de forma autónoma, asista a talleres de interés para los chicos siguiendo un patrón definido. LAS MÁ7MWCÁ$ robótica, pero no esel de robótica. Podrán — Ysinotienes claro qué beneficios le - CIENCIA Y D sabes dónde los construir robots sencillos — otorga este curso a tus hijos, ahoy 24| hrindan, ingresa a: para posteriormente pro— ra que están de vacaciones, aquate — /& www.troonic.com gramarlos, a fin de que interactúen — mencionamos solo algunos: i NE",24
1529.09,2254.74,65.09,28.29,88.19,"¿Por qué el pan baguette se llama así? En francés, la palabra significa 'bastón 0 “palo'. En un principio le decían pan de fantasía, pero su forma alargada (entre 70 y 80 centímetros) hizo",24
2073.88,2468.32,62.95,26.08,91.29,"ES de la familia de los jabalíes salvajes. Su nombre se debe a que posee cuatro protuberancias que salen de su cabeza. Tiene el hocico largo con dos pares de colmillos que usa para excavar o luchar. Habitaensabanas, bosques . y zonas de pastos de - Kenia, Utopía y Somalia, así como de otros países de África.",24
963.17,2475.89,68.15,27.34,89.71,"que lo llamaran baguette y Derivado de raya es el verbo rayar, que en su así se quedó. Existen varias forma pronominal “rayarse ' tiene entre nosotros versiones respecto de los usos figurado familiares de 'perder la este tema. Una cuenta paciencia, encolerizarse, sobre todo de modo que este tipo de pan se",24
853.32,2610.38,72.76,27.03,86.06,"intempestivo; y 'enloquecer, perder el jucio”. hizo famoso en el siglo Ejemplo: Juana estuvo a punto de rajarse cuando ? Vigilen Europa durante la viO que su hijo rompió su maceta favorita. revolución industrial.",24
1826.79,718.46,106.86,29.09,80.82,"arioIrivarren continúa vacacionando por Parísjuntoa su pareja,lamodeloIvana Yturbe:sin embargo, el guerrero' aclaró que anno piensa en el matrimonio conla'ojiverde, porqueaún tiene28años. Es más, de - talla que recién los años podría pensaren esa posibilidad. “Me encanta viajar, siento que viajar noesgastardinero, sino es invertir lo enexperiencias. Tengo que aprovechar ahora que soy joven tengas posibilidades de hacerlo, porque más adelante nosé cuálserá mirealidad”, manifestó Irivarren. Ahora que están disfrutando de su viaje por París, ¿teanimarías entregarle el anillo de compromiso albana y pedirlematrimonito? 3 Elmatrimonioaún estáen mis planes. Pero antes de lanzar el y Estoymuyjoven,tengo28años,talveza _ L comunicado oficial, la U losañosya piense en estable» |Q conductora de televi. º… sin viajó a Uruguay,",25
2414.73,720.73,76.64,27.12,89.1,"Jazmín Pined reaparecerá esta mañana en “Mujeres al mantras anunciar su separación de Gino Assereto. Como se sabe, hace unos días la 'Chinita” y el contaron que llevan 'algunos meses' separados.",25
2178.96,1133.74,83.59,29.93,75.51,"N ahorrarinvertiryviajar. hy , donde se la vio dis I frotando del verano toesguerra' esteañoopiensas | y compartiendo al abrimtenuevoshorizontes? Y x lado de su her",25
2439.71,1246.0,55.71,25.29,85.74,", Mana, quien se encuentra en “a",25
2032.25,1261.0,153.75,31.25,68.37,Sientoqueestoy hecho para la dulce espera'.,25
1663.6,1282.8,202.8,32.4,48.75,"competencia,noes fácilapesarde 28 que muchas personas digan:'Es",25
2100.0,1370.29,148.29,31.43,72.26,"to s chicos se la llevan fácilEstarN Respetando su expuestotodoslosdiasagolpes,a contrato con *Í algunalesiónnoesfácil.Disfruto “ '?¡ Latina, Jazmín",25
2404.65,1677.48,66.15,25.87,86.65,"regresó ayer [dommgo] de sus d pequeñas vacaciones para retomar sus labores en Latina. Por su parte, Gino Assert se mostró Telajado' en sus redes sociales, mientras cuida de su pequeña hija Kareeta si y se sometió a un cambio de look. E",25
2311.33,1957.42,83.17,31.5,82.69,| $3Hoy retoma conducción de “Mujeres al mando'y Gino luce nuevo look!,25
1724.26,1625.93,100.02,28.11,84.93,"EA lo que hago y quiero quedarme en . queen programa tenga que deciradiós. ¿Quisieras incursionar en la actuación? Siento que si me ponen a actuario puedo hacer, porque considero que tengo tomala capacidad paralograrlo; sin embargo, para hacerlo tienes que prepararte y lo harenes futuro. (L.Gamarra) o",25
1023.69,2278.03,61.78,26.71,91.77,"©> Patricia Quinta contó que el último fin de semana estuvo en la celebración por los 95 años de la recordada actriz cómica Jesús Morales, y resaltó la lucidez mental con que se mantiene. “Mi amistad con ella es de hace muchos años, la quiero mucho porque me ayudó y me asesoró con la educación de mi",25
2290.31,2419.93,65.16,28.12,89.19,"© Melissa Paredes le dedicó un breve pero tierno mensaje a su esposo, el futbolista Rodrigo “Gato' Cuba, quien fichó por el club mexicano Zacatec y tendrá que mudarse al país azteca. “Toda la suerte del mundo en esta nueva etapa en tu carrera, mi vida. ¡A romperla en México!"", expresó la actriz en instagram. € “Te extrañaré mi cielo, pero a romperla en México, a darle con todo en el Zacatec”, añadió. , Aunque Rodrigo fue anunciado como -1 nuevo refuerzo de Sport Boys, días í después fue fichado por el equipo que disputa la Segunda División de México. le",25
1031.79,2451.93,62.43,26.79,91.89,"hija y siempre me ha aconsejado, es como una mamita”, reveló la actriz de",25
814.78,2607.67,66.8,33.02,83.55,"NA'£Zhapa tu combi' , Alumna contó E Está tan lúcida que es ella quien ue acaba de cuenta los chistes, hace el crucigrama 5 ma todos los días y lee dos libros por cump|lr9 M mes, pero no puede cami a nos y cuenta D TE nar largos tramos”, detalló la | ch¡5tesº actriz. [F. López)",25
1543.92,2630.0,69.0,42.5,81.6,suerte en su viaje: |¡ 'a México donde jugará en el Zacatec,25
1988.92,430.14,58.28,26.72,92.41,"hijo; pero aclaró que actualmente sí cumple. “Eso fue en el 2017 porque no me fue bien con el trabajo, pero desde el año pasado me he empeñado para estar en regla y cumplo con",26
904.2,430.6,66.04,27.16,90.1,"“Uno no puede descartar nada en la vida, todo puede pasar. Ahora somos solo amigos y nos llevamos bien”, sostuvo. Luego, añadió, que",26
2383.29,536.29,84.0,31.0,92.62,embalada para contarles los últimos chismes,26
1257.05,623.0,64.52,28.64,81.23,"í 5 espera que Angie mi hijo, no soy un mal de 'Chollywood...La © Jota Benz no descartó . £' encuentre el amor “porpadre"", dijo. (L.G)_8 “Gringa” ALEJANDRA que surja más de una que como mujer es BAIGOREMA sigue de",26
2406.91,836.88,71.82,27.44,88.29,"vacaciones en Punta Cana y compartió algunas fotos de sus hermosas playas. Sin embargo, no puso ni la sombra de su pareja, el “*REY” ARTURO. Nooo... JEFFERSON y YAHA!- RA aprovechan el tiempo",26
1983.33,718.44,62.78,33.44,77.7,¡ que se -% latrasócon pero ahora sí cumple,26
1386.33,711.11,66.89,26.78,87.97,retraso con la pensión de alimentos para su menor,26
565.4,695.3,60.0,32.4,75.51,"amistad con Angie Arizaga, ¿j…$ / un 20”, [L. Gamarra)_",26
507.2,732.6,57.9,27.3,73.06,| tras los besos que se dieue_todº.puedºf ; saB,26
1897.96,1154.18,127.83,28.1,75.95,"usyDíazaseguróqueno mimatrimonio.Perolesagradeztieneamigasenlafarán- co porque no me hicieron daño, N| al máximo y cuentan que dula,luegoqueMonique — sinon favor.Sime hubieraque/ | 3 estuvieron el sábado Pardorevelóen'Elvalor adcon Augusto hubiera a h juntitos en una saldelaverdad' que tuvo intimidad llegado alCongreso. , -* conAugusto PoloCamposcuan— ¿Mececuántosucediólo 1 h derrochando amor. doerasupareja. duecento el Ayayayyy... A propo “Loúnico queséesqueenlafaHace28años, Florcita N de amor, dicen que rándulano hayamigas,porquete — tendríadosañitos.Inla cubana DAYAN quitanelmarido,laplatayeltra— cluso, CURARLO se olvidó bajo. Y ellaloconfirmó”expresó bamaldemiyladenuncié del actor BARULLO",26
1927.68,1405.58,141.0,29.89,81.59,"larubia. pordifamación y calumCHAPPELL, pues ¿SabiasqueMeniqueestuvocan — Nia.GraciasaBetoOrtiznos ahora anda muy Augustocuantdo eratupareja? amistamos. ilusionada con el nue",26
1466.66,1635.8,167.32,32.32,75.13,"Yalosabía.Debidoaestosincon— ¿Leguardesrencor? tenientes decido separar me del Noletengo rencor niodio. papá Flor. Moniquellamabaa — Ahoritanos hablamos, =, cadarato(alacasa), n ores peta ya todo quedóenelpa— ba,teníamifamilia.Peronosolo — sado. - hapasadoconella,siMeniguetambiéndijo no con otras ar que le debes turama... Esoesmentira.Conocí trujeron aMoniquedespuésdehaberaparecidoen “Risas y Salsa: (D. Bautista) 6 /",26
2410.8,1474.8,44.0,25.2,77.96,No cirujano de las,26
2408.95,1624.84,68.26,26.21,87.89,? MARINA MORA se encuentra recontra templada y no tiene roche venir a broncearse en la Costa Verde jun,26
2388.83,2149.75,62.58,27.5,86.61,to a su novio. Buenaaaa... SILVIA celebró el cumpleaños de su,26
2097.77,2265.58,61.19,30.13,87.3,"f | pequeño y lo disfrutó al molesta porque po”, agregó. máximo junto a su parese tomó foto con suhijo) — Además, aseguró que no ja, con quien ahora todo",26
1538.8,2554.06,62.16,26.97,87.0,"N h retomará su relación con el es amor y paz... Sammy su nueva pareja salsero, 'porque él no sabe HARA LDY£ATÓN fundido”, expresó Doña en — lo que es tener una de MELISSA KLUS, desInstagram. pues 'solo hace hijos y luemintió los rumores de un : F Además, no permitirá que go los posible embarazo tras Agnella Doña, “La Fe Saldaña. E * pequeño pase tiempo — De otro lado, expresó que unas fotos que publicó volvió a “No me molestó (la e ) X ... ladodeMaríaFe. desea el divorcio. “Según en sus redes sociales... arremeter contra Josimar, foto), pero no está bien que e > “YO soy la mamá, soy rece— él, nunca nos casamos, Ese Bueno, soy fuga porque tras enterarse de que el él quiera confundir a mi T losa con mi rey. Vivo con floro que se lo coman todas mi amorcito sigue con cantante compartió fotos bebé. Si mañana cambia “ S mi hijo y siempre será así, sus chicas, yo solo || antojos navideños y le de su pequeño hijo al lado de mujer, como siempre pero lo mando cons papá — quiero mi divorcio”, voy a llevar mi panetón... de su nueva pareja, María hace, mi hijo estará con' para que compartan tiem— finalizó. u Suuuaaaveee.",26
1731.22,153.89,102.33,29.0,89.17,LUNES 6 DE ENERO DEL 2020 …& (FIESTA) 27,27
1496.43,457.79,61.21,28.07,93.5,"el pan de cada día y hay mucha ineficiencia de las autoridades”, agregó.",27
1223.92,658.28,68.8,28.21,86.85,"Pero enclplaropersonal, tenue comentó Lady. bienenel2079... retoma la conducción Además, dice que se siente agra— Fue un año donde pude colegiado un renovado Tengo decida por el respaldo que le ha me como abogada, mi vida con f algo que pues dado el público. mi hija Victoria y con Christian (su —| ¡I © La bailarina Jessy Kate reveló ahora saldrá a las calles y A “Agradezco la confianza del pareja) se ha consolidado. ¡ que el cantante Tony Rosado la tocará la puerta de la gente N >»Yy Q público, de abrirme sus corazo— ¿Hayplamesdematrimonio? N U — enamoró descaradamente, y por ello,",27
2238.39,802.52,56.74,26.52,84.39,| lo calificó de “pícaro y mandado”. A “El día 29 de diciembre coincidimos en 4) un evento en Cieneguilla y el “distin,27
1303.06,800.69,68.09,28.22,91.79,"nes, contarme sus historias. Sí, voy a realizar varias cosas que Sin embargo, aún me sien— tenía pendientes. No quiero hablar to triste porque las mucho, espero que todo se cumpla...",27
221.09,799.0,79.55,26.18,91.97,"para conocer sus problemas. Además, este año espera concretar algu",27
1215.7,945.92,68.18,26.58,84.86,"nos pendientes como su estadísticas muestran y espero el anillo. caballero me dijo matrimonio. ( que la violencia con— HacepocoCathy Sosna consigue *x que tenía un cuer“Tengo más de 3 años v tra la mujer no ha fue victimadeviclencia, , paz y no dejaba al frente del program cesado, los femi— ¿Quéocpinas? de mirarme el ma y en este 2020 . nacidos son El tema de violencia es deli'totó. Me estuvo",27
2225.33,1113.89,61.5,26.39,82.29,"“afanando' el muy 7 pícaro, hasta me 4 pidió que lo acompañe a otro evento”, detalló la vedette.",27
1465.8,1100.53,82.33,25.8,93.07,"cado, todos tenemos el derecho de expresarnos al sentirnos violentados. De . manera general espero",27
191.88,1111.59,53.18,25.47,92.45,"nos renovamos, pues saldré a las calles a buscar a la gente y seguir siendo la",27
1463.0,1227.78,56.24,27.73,82.03,"ayuda para sus proa que todo esto no suceda 1 Asimismo, dijo que colgará las plublemas. Creo que el )f más. [E.C.] G .£ A mas lentejuelas para incursionar espacio se ha cony _ -x*' 3""ºi en el canto. “Quiero crecer artista",27
232.0,1295.0,58.5,33.25,80.69,soldado y cada ¡º*,27
1246.33,1318.42,69.25,35.83,85.82,"N lamente y probar otras facetas”, año hemos / crecido”, á a",27
2204.33,1384.44,93.56,37.33,73.2,", pecisóE.L] _ — i j ento que estuvieron juntos en y no dejaba de mirarle el totó)",27
1357.43,2598.29,298.0,101.57,60.25,ando NUEVA $' QWWÁ©TE%©W tu diario …,27
896.29,152.0,89.57,28.0,86.41,28 (FIESTA) LUNES 6 DE ENERO DE,28
1885.67,617.5,55.0,27.17,83.81,f La actriz Cielo Torres N,28
1229.85,639.31,68.38,28.31,86.89,"© María Victoria Santana, la popular = admitió que disfruta mucho X. *",28
831.08,645.15,73.62,34.38,79.58,"u €9 Daniela Harcourt “Pánfila, contó que está empezanX) desmintió que se",28
