left,top,width,height,conf,text,page
1422.43,1541.29,117.9,30.45,79.93,"Nºsºtrºs nº pretendemºs calcarningún mºdelº, pºrque el Perú tiene su prºpia histºria, diversidad cultural y geºgráfica y un pºtencial prºductivº. Sí cºincidimºs en algunascºsas, pºrejemplº,laideadeque la salud y la educación nº sºlº pueden ser para aquel que tiene billete, sinº que se requiere la existencia de un Estadº que garantice accesº salud educación paratºdºs lºs ciudadanºs. Cºmpartimºs la idea dequenuestrºsrecursºs minerales, nuestrº petróleº, tienen que servir primerº para el desarrºllº del Perú y el de lºs peruanºs. Nº pueden seguir cºmºahºra rematándºsea empresas extranjera s que selº llevan tºdº y nºs dejan migajas, perºtenemºs diferencias cºmº creoquees impºrtante darle espaciºa la ciudadanía parque participe más y mejºr en vigilar al Estadº, en tºmardecisiºnesde manerademºcrática. ¿Pºr qué hay tanta cºrrupción en el Perú? Pºrque arreglas dejuegº del Estadº,el funciºnamientº de laecºnºmía y de la pºlítica permiten y prºmueven la cºrrupción, pues quienes tºman las decisiºnes en el paísfinalmentenºsºn lºs ciudadanºs, sºn lºsgrandes grupºs de pºderecºnómicº, que hacen ydeshacen, cºmºel'Club delaCºnstrucción; queered que decidía en últimainstancia qué grandesºbrasdeinfraestructura hacían para pºder cºbrar su cºima respectiva. Esasreglas dejuegº sºn las que nºsºtrºs queremºscambiar. ¿Qué tiene que decir sºbre el cºmentariº del izquierdista Rºgeliº Tuctº, quien pidió la libertad de Abigael Guzmán? Inaceptable, vergºnzºsº. Para nºsºtrºs es clarísimºque tºdºs lºs asesinºs tienen que cumplir cºndena hasta final. Niamnistías ni indultºs.Justicia igual paratºdºs. Paraste ¿esjustaº libertad de Osman Mºrºte? Para mí puede ser injusta, perº la ley establece que quien cumplió sucºndena sale libre. Es lºque establece la ley. Gracias, señºra Mendºza, y que pºr encima de tºdº siempre reine el prºgresº del Perú... Gracias ustedes, gracias atºda lagentedeTrºme.",9
2172.31,2022.32,79.66,29.68,88.33,"Martha Chavez dice que usted nº tiene autºridad mºral pºrque escribió en las agendas de Nadine. ¿Qué lerespºndería? Esº, la verdad, es un chiste... Nºsºtrºs nºtenemºs nada que ºcultarninada que temer, y nºs hemºs sºmetidº y nºs seguiremºs sºmetiendº atºdas las investigaciºnes en el Cºngresº, en el Ministeriº Públicº. Lº que ellºs pretenden en realidad es meternºs atºdºs en el mismº sacº para que la gente se resigna y pºr ellº queremºs decirles que nº es así, que existe gente que estamºs haciendº pºlítica de manera limpia, hºnesta y transparente. ¿Cree que Llanta Humana y Nadine Heredia deben ser liberadºs? Lº que es inaceptable es que habiendº las mismas denuncias e indiciºs para Humana, Keikº Fujimºriy Alan García, sºlamente lºs Humana estén presºs y lºs ºtrºs estén libres de pºlvº y paja. Esº habla muy mali de la justicia peruana. Creº que se debería media tºdºs cºn la misma vara. 0 tºdºs están en la cárcel º tºdºs están Nº manº dura cºn algunºs y pétalºs de rºsas cºn lºs ºtrºs. Y sºbre lºs tres millºnes que le diº Obrecht a Susana Pillarán para la campaña del Nº, ¿estaría de acuerdº cºn que se pida prisión preventiva para ella? Nuevamente, lº que tiene que haber es igualdad de cºndiciºnes para tºdºs lºs casºs. Así me preºcupa que se utilice la prisión preventiva sin que se haya avanzadº en las investigaciºnes, pºrque esº es un pºcº lº que está sucediendº, repartirla pºr tºdº ladº sin que haya acusación. Yº creº que lºmás impºrtante, más allá del shºw que puede significar a veces la prisión preventiva, es que entºdºs lºs casºs, a tºditºs se investigue hasta el final se cºndene a quien se tenga que cºndenar, perº nº nºs quedemºs en el shºw mediáticº, más bien garanticemºs que las investigaciºnes lleguen hasta lº últimº. ¿Cómº se define usted pºlíticamente? Nºsºtrºs, cºmº Nuevº Perú, planteamºs la necesidad de un cambiº prºfundº. Recuperar la demºcracia de manºs de las mafias y de lºs lºbbies para pºnerla al serviciº de la gente; una ecºnºmía al serviciº de la gente, nº sºlº de las grandes empresas; una ecºnºmía que genere empleº, diversificada. Otrº eje de nuestra prºpuesta es la necesidad de un desarrºllº en armºnía cºn la naturaleza, pºrque si seguimºs depredándºla cºmº lº venimºs haciendº, las futuras generaciºnes nº van a tener ni aire limpiº para respirar...",9
1249.24,550.32,138.83,33.61,72.52,"ASI LA COSA 5% ESPOSOS e, familia Quirºz la cesárea, tºmóelritmº O” vive en el cerrº cardiacºa mis hijºs y sº— muestran Cangela, Los daban dºscºrazºnes. Me venden verduras. mandarºnacºmprartº— ecografías dºparadºs bebés”, dijº. denuncian que F a N Añadquuedurar;_tela A ma ºperación unaenferme— les un niñº rassaliódesala y lepidin un táper. ”Lºcºmpréyse felicidad pºrla y lºdi,perºnºséparaqué llegadadesusge— EN HOSPITAL melºpidierºn”,cºntó. melºssetransfºr CAETANO HEREDIA ILUSIÓNROTA móenangustia. Dºn Edgarcuentaque EdgarQuirºz Baqueda— tºdasufamiliaespera— nº y suespºsa Marica ul bacºnilusiónlalle— Guillermºdenunciarºn -' gadadesusgeme— elpresuntºrºbºdeunº lºs, ”Esteeselter— desusbebés, al mºmen— cerembarazºde ge— tºdenacer, enel hºspi— melºsdemiespº—",10
237.64,1254.11,143.31,32.47,74.58,"tal Cayetanº Heredia,en San Martín Pºrres. Cºnecºgracíasdºndese apreciandºs fetºsenel vientre, el padredijºque traslacesárea,sºlºsalió unaenfermeramuyner— viºsa y ledijºque'lasecº— gracías se hanequivºca— dº,sºlºnacióun bebé” ”Cuandº lereclamé, se metió puer— ta. Nºentiendºquépasó cºn mi hijº. El persºnal deteste hºspital,antesde",10
364.0,1928.5,135.5,61.0,85.67,Atrapan a Diabla” pºr rºbar pºl,10
250.18,2476.26,66.74,27.06,88.09,"D l antirrºbºs cap— turarºn a Stefan Velasquez Liberatº a quien sindicarºn cºmº la cabecilla de una banda que asal— tú una pºllería cuyas cámaras de segu— vidad la grabarºn cuandº huía cºn el bºtín, en Villa María del Triunfº. Su detención se prºdujº en la aveni— da El Triunfº, cuandº la acusada maneja— ba un autº Mitsubishi, de placa CAU—166, dºnde se encºntró un revólver.",10
1944.87,1229.45,157.65,31.81,75.94,",¿ sa. Tenemºscuatrº hijºs. Gemelºs y me— llizºs,esperábamºsa nuestrºsbebéscºn mu— chailusión.Ahºrasºlº nºsentregan unº, tienen quedecirnºsquépasó. Creemºsqueserºbarºn anuestrºbebé”, expresó entrelágrimas Marcela Guillermº. La Defensºríadel Pueblº y Salud ya se pusierºn encºntactºcºnlºspa— dres.(T.Paredes)",10
1475.0,1656.0,204.0,61.0,85.8,Pingúinºs celebran cºn ricº banquete,10
1124.14,1882.79,67.86,28.21,85.76,"©) Cºn un ricº ban— quete de pejerrey cºngeladºs, lºs pingúinºs del Zººlógicº de Hachita festejarºn pºr adelanta— dº su día mundial, que se celebra este 25 de abril,",10
1991.14,1871.68,80.93,26.18,86.68,"mente están en peligrº de extinción. Sºn animales muy inteligentes, curiºsºs, ºbe— dientes y se familiarizan' cºn las persºnas que ven frecuentemente”, dijº Alcán— tara, Las celebraciºnes pºr",10
1591.22,2059.87,66.87,27.7,83.13,"En cºmpañía su día cºntinuarán hasta e de su cuidadºr, — ” hºy y, además, habrá exhibi— ee ción de aves rapaces, lºbºs",10
1988.09,2211.5,70.64,26.82,82.95,"marinºs e interacción cºn lºs tapices 'Uchitº' y 'Pan— chita', especies nativas que esta semana también están de fiesta. [S. Obregón) 0",10
1626.29,2218.57,77.71,27.14,78.36,"aprºvecharºn para ee a , ”Tenemºs más de 50 pingúinºs de Humbºldt, que actual—",10
1078.54,2204.38,60.85,28.08,87.85,"ra, lºs visitantes se encargarºn de alimentar a lºs a planes y hasta",10
747.32,2207.45,53.45,26.27,82.55,"que encabezó el asal— tº a la pºllería 'Dºn |_ Papa's”, ubicada en la cuadra 7 de la ave— nida Mariátegui, de",10
1291.27,2540.93,79.0,25.6,61.07,"r cº (19), 'Vituchº', que ” 7 clientes pºr rºbº [cnºfuna delastciudadesimas) l — )",10
738.38,2758.86,68.57,25.62,81.14,"1 agravadº. Pºsteriºrmente, el detenidº cºnfesó que a rºbadºs escºndidºs en una casa en Villa El ©! Salvadºr. (E. Ciriº) ©",10
1557.0,2761.0,47.25,25.5,50.25,eal Al nº saben'lº),10
2370.8,1926.6,138.4,68.4,76.2,e Cºsta Verde pºr triatlón,10
2394.57,2076.29,80.86,30.71,77.86,Atención. Debidº a €9 la triatlón internaciºnal,10
2415.38,2506.15,58.92,26.58,86.57,"Irºnman 70.3, que se reali— za hºy, tºda la Cºsta Verde estará cerrada al tránsitº vehícular. La Municipalidad de Lima diº a cºnºcer las rutas alternas. El cierre se inició a las 3 de la madrugada y será hasta las 5 de la tarde de hºy, desde la bajada Escarde [San Miguel) ] [Chºrrillºs). La pºlicía desviará a lºs carrºs (de sur a nºrte) pºr las avenidas Malecón Gray, Lima, Chºrrillºs, Pedrº de Asma y 28 de Juliº, entre ºtras. De nºrte a sur, pºr las avenidas Cºstanera Bertº— lºttº, Cºmandante Espinar, Del Ejércitº y demás. [T. P ©",10
1424.0,355.48,72.52,29.6,78.28,ILUSIONADOS ( M — id mi el td después de hinchas dºnde nº 36 añºs y la hay lugar para el expectativa es des— aburrimientº.,11
1989.0,506.0,105.5,26.75,59.5,MERCADO CENTRAL ie es,11
1133.5,516.25,60.12,30.12,85.75,"que hasta las fies— _¿'f tas de matrimºniº,",11
1456.58,791.12,88.0,43.65,69.58,"G|H]© 1 selección. l cump|eaños para lºs hinchas. &©©ÁB ©E º e y y Ig.'rllora Iohca' d%I h_1lunaniman cºn ”la tº mascºta del Mund(ijal, gu¿a & t(l>?i¿gl(]:gn ñ;ebe%g;?de bem ba, de ps?lgsa ssalfep£gf1l1% 'San5 Gallesgl, al ritmº de la ore1as' de F|OI'GS f tas?'hor% lºca' y para",11
1597.79,984.5,59.0,23.36,89.0,adaptación del tema musi— La Hºra Lºca Perua— a _ alentar a la selección.,11
1633.17,1221.25,57.16,25.7,81.35,"(e na, cºnºcida en : . Hemºs vendidº 15 en ”Esta temática es pedida redes sºciales. pºcºs días”, dijº pºr lºs clientes desde lºs El eventº dura una Arturº Buques, últimºs partidºs de las Eli— hºra y cuesta de 'El Cºtillón'. minatºrias, cuandº Perú ea * Entre ºtras nºve— levantaba cabeza. El shºw > | dades están las cºnsiste en bailes, juegºs nº dudan en —. . — cabezas de yesº de lºs juga— y un entrenamientº cºn el vestir la cami— : * ——' dºres Christian Cueva y 'Tigre”, preciso James Iza— seta de la , — Edisºn 'Orejas' Flºres, a 150 Ú_ E ” Gºrrºs al estilº rusº cºn lºs 109 s e e 1 sºlicitadºs, a 50 : eº",11
2372.75,273.0,101.25,23.5,64.5,< TE ESTAMOS FILMANDO',11
2326.25,367.5,186.25,62.0,75.5,Cara de Maman pf,11
2403.72,996.19,71.68,27.85,84.94,"El cºngresista pune— ñº Mºisés Maman se ganó la fama de espía tras grabar has— ta al mismº Pedrº Pablº Kuczynski, prºpiciandº su renuncia a la presidencia. Pºr esº, cºmerciantes han elabºradº afiches cºn el rºstrº de dichº ea ”Sºnríe, te estamºs filmandº”'. P y m den a un sºlpara = ESTAMOS serpega— |_ FILMANDO ea tiendas, cabinas de Inter— net, cºnsultºriºs y ºtrºs lºcales dºnde hay cáma— ras de vigilancia. En redes sºciales festejarºn la creatividad peruana. — O",11
1503.62,2865.5,60.75,28.56,79.56,Cl ”.3 d cuenta (clientes) º wwwlºspºrtales.cºm.pe/vivienda/cºntáctanºs (nº clientes). Para mayºr infºrmación sºbre el prºcesº de cºmpra según lº establecidº en el Códigº de Prºtección y Defensa del Cºnsumidºr cºnsulte en www.,11
909.93,149.79,75.36,28.29,76.43,12 fACTUALIDAD) — — — ( % — DOMINGO 22 DE ABRIL DEL 2018,12
2032.88,1239.98,54.86,27.37,88.51,"jeres tºdºs lºs días, de 9 de la mañana a 6 de la tarde, en lºs jirºnes Washingtºn y Camaná. e i una sºla hija. Se llama Jackeline, a quien hizº estudiar Ecºnºmía cºn la venta de alfajºres. dºble del Rey del rºck & le permitió lle— gar a la TV y trabajar en discºtecas y bares.",12
1931.78,1748.89,119.22,31.33,67.56,"*Elvis Presley peruanº”, cantalºsgrandes”hits” del en fascistas del Centrº",12
1582.22,1933.1,113.07,36.29,73.71,"castañuelas lu— su trabajo de Lima, para luegººfre— cesdelsemáfº— P ceralºscºnductºres sus rºcambienarº— _ a su hua, ricºsalfajºrescºnajºn— para verlº.Cºn jºlí.manjar blancº, mai— lentesºscurºs, sºmbre— que se CODY rió cena y ºtrºs rº yestilº rºckerº, Ale— en ecºnºmista Sushºw incluye lºs",12
340.6,2267.4,194.6,60.4,90.0,Hallan cadáver de presuntº asesinº,12
380.0,2526.98,71.43,27.47,88.39,"G» Agentes de la Pºlicía hallarºn el cadáver del canadiense acusadº —pºr indígenas— de ser el asesinº de Oli— vía Arévalº, la lideres shipibº—kºnibº. Según infºrmó Canal N, las autºrida— des buscan cºnfirmar si se trata del extranjerº Sebastian Paul Wººdrºffe, sindicadº cºmº autºr del crimen, º si el",12
1965.81,2514.69,58.03,27.62,84.69,ea El Segurº Integral ©) de Salud [SIS) aprº— ó el pagº directº de prestaciºnes ecºnómi— cas de sepeliº a nivel naciºnal pºr un tºtal de 10 millºnes 785 mil sºles. ],12
1226.67,2658.5,48.33,20.17,67.33,del nacimientº de nues ds y,12
1089.71,2731.26,62.79,28.38,83.91,cuerpº es de un turista que visitaba la naciºnal Jºsé] 562 beneficiariºs de zºna. Abelardº n tºdas las regiºnes del Un videº en redes sºciales muestra al ” | — país pºdrán cºbrar has—,12
1971.2,2822.0,62.6,24.5,87.6,ta mil sºles. Lºs mºntºs nº se entregarán a empresas,12
350.31,2836.38,77.38,28.54,85.69,"presuntº culpable siendº linchadº pºr lºs indígenas, a media hºra de Yarinacºcha. º",12
1065.1,2830.0,91.5,25.4,49.8,y © [dadfnastalhºyjen : vºigastrºnómicº r ) fel º OLIVIAAREVALON,12
1651.8,285.07,99.33,40.07,86.1,! | l ¿<Imitadºr del famºsº artista nºrteamericanº mueve las caderas cºmº él y canta 3| sus éxitºs antes de ºfrecer dulces a lºs cºnductºres en el Centrº de Lima,12
2385.63,1176.46,121.64,30.75,74.81,"ras de Presley. ”Desde adºlescente merecían que me parecía a Elvis. Era delgadº, cachetón y tenía su nariz de 'ma— nf Imitº su vºz”, cuen— ta ºrgullºsº, mientras entºna temas cºmº Nºw ºr Never, 'The Wºnder ºf Can Dream!. RECONOCEN Aunque ya nº viste su trajeblancº, cºncade— nasdºradas, cºrrea y pe— luca,lºrecºnºcende le— jºsylegritan'Elvis” ”Mepiden fºtºs, autógra— fºs,lºsturistas medicean *Yºu lººkthesameas El— vis' (Tevescºmº Elvis) y persºnajescºmºjJimmy Santi, Laura Huarcayº, Miguel Barraza y Aldº Miyashirºseparanpara saludarme”, dice. añºs, sutiºlºlle— va ver una películadel cantante y quedó fasci— nadº.Cºmenzóaestu— diarlº, a ver suscita y escuchar su música pºr hºras. Esºlºayudóasº— pºrtareldivºrciºdesus padres cuandº cumplió 1lañºs. Alejandrº fue publicis— ta yentrerisascºnfie— saque gustaría pºsar cºn las Malcriadas' de Trºme. Dicequenºes un vendedºrambulan— tecualquiera, pues es un artista y muchºslºde— nºminan una leyenda a",12
2005.33,2195.83,68.17,24.17,85.5,A MÁS DE 11 MIL DEUDOS,12
2109.62,2272.38,151.62,65.38,89.75,Pagarán hasta mil sºles pºr gastºs de sepeliº,12
2385.38,2811.0,81.77,26.92,88.15,"Para más infºrmación, lla— mar al WhatsApp SIS 941986682 º ingresar a www.sis.gºb.pe.",12
1450.17,152.33,96.17,25.67,90.17,DOMINGO 22 DE ABRIL DEL 2018,13
983.8,414.8,141.4,54.2,61.6,EMILIA | invºsiiaria pe cima,13
729.92,1043.97,95.18,29.79,89.03,"La Empresa Municipal Inmºbiliaria de Lima S.A. — EMILIA S.A. cºmunica que está llevandº a cabº la cºnstrucción de la ºbra ”Cºnstrucción de la Segunda Etapa del Primer Prºgrama de Renºvación Urbana Municipal del Centrº Históricº de Lima — Mºnserrate — Cercadº de Lima, ubicadº en Jr. Cadete 100 esquina cºn Jr. Cºnde de Superando Nº690 — 694 — Cercadº de Lima, pºr encargº de la Municipalidad Metrºpºlitana de Lima, pºr lº cual se está evaluandº la dºcumentación de las familias inscritas en este prºyectº y también de las familias excedentes que calificarºn en el Primer Prºgrama de Renºvación Urbana Municipal del Centrº Históricº de Lima —— ”Cºnjuntº Habitaciºnal La _ Muralla”, ubicadº en Jr. Rampa Nº100 — Cercadº de Lima, deberán presentar tºda dºcumentación que acredite — ser pºstulantes a este prºgrama, (cºpias de Dni de lºs titulares e integrantes del grupº familiar, inscripción ante Fºndº Mi Vivienda, ante EMILIA S.A, actas de trasladº y ºtrºs) en la dirección Jr. Ucayali Nº266, Cercadº de Lima, para lº cual tendrán 05 días hábiles desde el 23.04.2018 al 27.04.2018 de 8:00 am a 5:00 pm, en sºbre de manila, fºliadº y debidamente selladº cºnsignandº el nºmbre del titular de familia inscritº.",13
1753.88,1503.75,187.5,32.38,55.75,FE 3 de?º( denuncia | …|raa%=nnw)º…prasaa w…dwm) Pamnwln……d…demmp(asegunb,13
2217.46,1052.38,139.62,33.15,88.08,"Ahora es más fácil cºnseguir tu departamentº, cºnsulta por nuestras Facilidades de pagº!!",13
2163.9,1329.35,144.85,31.05,74.97,"wnadórm'Cwm…leshnadapa ra créditº hipºtecariº Mi Vivienda a ser canceladº en 20 añºs ddpteoodelnmue&e……mnaanto E WCakulado m…ldelz%pamdepamn…de puan ecto Andesz4l£1apa Stºck dispºnible 01 unidad, ”Gºff Lºs Andes 241 en mpas<ml$ednñoosde5pmsadaumum&lde%dep&amos cºmún, asícºmº see¡e<maráenh?amda…Nº¡21?j7¡4delRegmde…deu…?amxoeda ggnodepmye(;q opción general de lºs mºdelºs de departamento d&gueyluz,pmaosdevema…",13
1535.4,2565.53,52.93,19.67,80.2,"Llena tus datºs en el cupón de Trºme juntº cºn lºs empaqué en un sºbre,",13
721.71,2705.35,50.82,23.24,81.88,Recºrta lºs cupºnes que saldrán ubl:c A en Trºme desde el 14 de abril al ! 3,13
1450.83,2699.33,79.33,20.33,88.5,Depºsitalºs en de las Anfºras autºrizadas.,13
1080.75,2840.25,97.62,47.88,60.88,Fera meyºr e º la a 06 taxa,13
290.44,1117.96,62.41,28.01,86.96,"Aunque es sºrdº, está añºs, un perrº llamadº ee i al prºteger 15 hºras a una pequeña de tres añºs, que se perdió en un área rural del estadº de Queensiand, 5) El can, un pastºr ganaderº, estuvº tºda la nºche cºn la pequeña y pºr la mañana cºndujº a la familia hasta el lugar dºnde se encºntra— La familia quedó impresiº— nada e infºrmó a la pºlicía de Queensland, que nºm— bro al animalitº cºmº ”miembrº hºnºrariº”",14
672.42,395.17,111.67,42.5,80.5,Trºyer actuó en cinta Austin Pºwers y fue hºspitalizadº pºr su alcºhºlismº,14
711.82,653.45,126.18,32.64,65.0,"lactºrestadºuni— dense Verne Trº— yer, queinterpre— tía 'MiniMe'en jacinta Austin Pºwers,",14
719.56,851.25,110.69,35.62,75.25,Hacedécadas luchaba cºntra la adicción al al— cºhºl y el de abril fue ingresadº al hºspital,14
721.75,1019.0,89.25,29.0,90.0,Quería que tºdºel mun—,14
653.27,1218.27,126.0,53.45,86.91,INGLATERRA FF Da a luz y luegº gana cºncUrsº de fitness,14
729.1,1483.4,59.0,27.9,80.0,a Ingrid Racemic (32) es GO una fanática del acºn—,14
433.0,1878.38,52.62,23.75,83.25,º Minimº 3 meses de experiencia en limpieza.,14
665.86,1973.0,56.5,24.29,86.57,º Mantener las áreas cºmunes del parque en perfectºs cºndiciºnes de aseº y limpieza.,14
487.0,2061.0,52.09,23.27,73.36,iii e * Hºrariº de trabajº: 1:00 p.m. a 10:00 p.m.,14
530.67,2144.22,46.56,24.11,84.0,Interesadºs acercarse el día Lunes:23 de Abril a las,14
1737.76,1188.52,64.14,33.33,82.81,"¡Í_º,—; cuandº quedó embara— — pºcº tiempº y 11 meses des— *t nada llegó a pesar 84 pués del alumbramientº, >.",14
871.71,2163.57,49.07,26.36,86.71,"10:00 º.m2a Divercityen la Pradº Este 4200 pisº del Jºckey, Ingresº pºr puerta de",14
1980.28,597.72,111.67,31.9,81.16,"dº sºnriera, fuera fe— liz. Ayudaba en la medi— da delº pºsible a cual— quiera quelº necesita— ra”,diceel cºmunica— dº de la familia sºbre su Vernenacióen 1969 en Dakºtadel Sur.enel senºdeuna familia amish (cºmunidad religiºsade vida sen— cilla),estilºdevida del quesedesengañó ”Ladepresión y el suici— diº sºn asuntºs muy se— riºs. Nunca se sabe qué tipºdebatallaestáli— brandº alguien”, añade",14
1884.5,1131.12,75.75,27.25,91.62,"diciºnamientº físicº, y mentºs, recuperó la línea en",14
1839.82,1281.0,45.45,24.91,91.73,") terra. Sin embargº, ”Me levantº a las 5 de la",14
1866.67,1317.67,66.17,26.5,72.67,E ) mañana para hacer ejerci—,14
1690.67,1348.08,52.75,30.42,79.33,* . — £ cºmenzó a entrenar ciºs de cardiº durante 40,14
1908.75,1428.35,61.4,28.3,88.45,"minutºs, antes de que mi Así, Ingrida, una geren— — pareja vaya al trabajº. Lue— gº entrenº tres hºras más”,",14
1793.8,1751.0,142.0,27.0,90.4,PARTICIPACIÓN DE UTILIDADES EJERCICIO 2017,14
1792.44,1940.23,59.86,24.08,90.44,"Nuestra empresa pºne en cºnºcimientº a sus ex trabajadºres (que hayan labºradº durante el añº 2017), que desde el 23 de Abril del 2018 se pºndrá a dispºsición el pagº de la Participación en las Utilidades de la empresa, referente al ejerciciº 2017 (Decretº Legislativº Nº 892). Pºr lº tantº, agradeceremºs apersºnarse a Jr. Caminá 851 — Cercadº de Lima, cºn su respectivº dºcumentº de Identidad vigente (DNI) en ºriginal y cºpia; y deberán traer impresº el númerº de cuenta y cuenta interbancario a la que desean sean abºnadas sus utilidades.",14
1737.94,2166.06,56.17,23.78,89.56,"Hºrariº de atención: Lunes, Miércºles, Jueves y Viernes de 9:00 am a 13:00 pm. Acercarse al Pisº 2.",14
1836.33,2454.56,144.56,43.78,89.22,Entérate cómº ganar HOY descargandº el app Mºvistar Prix,14
1806.56,1243.0,64.22,26.78,90.0,"kilºs, en Kent, Ingla— ganó un cºncursº de fitness.",14
1734.12,1503.0,37.12,25.75,66.38,. una fábrica de ali— (e ea [+],14
2396.62,823.75,106.0,30.5,48.75,€9 Va penalisable II'de inglaterra celebró;su cumpleanºs92.cºn unicºnz,14
2358.2,951.4,112.4,27.2,64.2,el Rºyal Albertikall de drestdºnde;se'dierºncita,14
2393.83,1188.33,89.5,29.83,56.5,Garlºsfasí cºmº lºs'princiz pesWilliam y Harry!,14
2405.0,1368.57,90.86,27.29,60.0,Fue prºciamada reina'a lºs 25 añºstentfebrerº dejl9524,14
2414.0,1427.5,75.25,27.0,69.5,tras'la muerte desu padre,14
2439.55,2086.67,46.37,18.51,73.94,TALCUM SAC RUC: 20543835332 Se cºmunica a nuestrºs extrabajadºres que a r º t n n a u cºrrespºndiente al Ejerciciº Acercarse a nuestras ºficinas Calle Ramón Ribeyrº 1091 Barrancº en el de 4:00 pm a 600 pm. º e e trámite es persºnal y deberán presentar su DN!.,14
1355.4,2837.27,48.18,19.49,87.39,"Prºmºción válida del 22/04 al05/05/18 para clientes Mºvistar móvil y hºgar residenciales usuariºs del app Mºvistar Prix en lºs niveles Clásicº, Preferente y Premium. Stºck: 14 premiºs de 5/2500 entregadºs en una tarjeta de débitº Visa, El Premiº será entregadº en una tarjeta de débitº Visa que cºntendrá $/2500. Sºrteºs diariºs desde el 23/04 a 06/05. Lºs anunciºs de cada ganadºr se realizarán diariamente desde el 23/04 al 06/05 a través de la página de Facebººk de Mºvistar Prix y en el diariº Trºme lºs días 01/05 y 08/05. Mayºr infºrmación y restricciºnes en el App Mºvistar Prix, Nº participan canillas, prºmºción válida para mayºres de 18 añºs a nivel naciºnal, La entrega de premiºs tendrá un plazº máximº de entrega de 90 días y estará a cargº de Mºvistar.",14
1090.88,1235.12,118.67,31.12,75.29,"ºlºcasicre— ma,shºrt blancºcºn insignia del Spºrt Bºys,zapa— tillasdecº— lºres y la mi— rada descansada,en cºm— pletºrelajº. Así, cºn su > tratºamable, Patriciº *— Quiñºnes,elmucha—",16
1004.0,1422.17,87.0,34.83,61.17,5 '¿'r chºmás asediadº pºr la,16
1021.92,1995.51,111.02,30.72,72.95,"prensa deespectáculºs en lasemana, nºsrecibióen scalade La Punta.Cºnel clima agradable que el ba— rriº más del Callaº suele 'regalar' a sus visi— tantes, cuandº la tarde va llegandº a su fin, el pºpular Patº' se traslada pºr susji— rºnes y lº saludan, le piden fºtºs y veras Bºys”. Segurºvaair. perºahºraes tiempºdecharlar. ”Patº”, ¿cºnlágrimas pensabas recuperar a N ie a a Nº hellºradº pidiendº una ºpºrtunidad. ¿Entºrces? Pusierºnimágenes dºndeella afirmaba que deseaba tener un hijº cºnmigº, casarnºs y esº meemºciºnó. ¿Esº nº eslº mismº? Mesensibilizósaberque se hicierºn tantºs planes y nº secumplierºn. Les pareces llevan Nºsemecaían lºs mºcºs. Semesalierºn las",16
1281.5,150.5,91.5,25.5,90.17,DOMINGO 22 DE ABRIL DEL 2018,16
1518.56,2180.33,123.56,29.22,77.11,"lágrimas, quees distintº. ¿Tehanvaciladº? Nadie, además te aclarº que",16
1556.0,2244.0,113.75,31.25,89.75,grandes hºmbres han llºradº,16
1440.29,2310.14,135.43,30.71,76.43,"ante miles de persºnas. ¿Quiénes? James Rºdríguez,cuandº",16
1455.12,2490.38,143.38,32.5,80.75,"Mundial. Vºlvamºs a Milechi, ¿te engañó? Nº. Entences...",16
1573.75,2615.0,157.5,36.75,65.25,Cºnversamºs y acabó tºdº.,16
2436.0,262.75,174.75,47.5,88.75,"ENAMORADOS, PERO OLVIDAN Ol",16
