left,top,width,height,conf,text,page
2148.57,1903.0,116.29,28.94,78.68,"Nºdeseº hablar más del tema. Jamás me expresaría mal de ella. Esºsepuede entendercºmº: ”Mejugó mal, perº nº lºdigº”. Siquiera pasadº, nºestaríadandº estaentrevista, pºrqueunº debe tenerdignidad. ¿Tºdavíase hablian? Nºhay cºntactº, cerº cºmunicación. i Y nº pºr rencºr, ya se vºlteó la página y eslº mejºr. ¿Pºrqué cºntastetu televisión? Nºmecuelgº de ella, nº seºlviden | dequelarelación también fue mía. ¿Guardarás lutº? Pºr mí. ¿Yesº? Necesitº tiempº, estºy metidº en ºtrºs prºyectºs y además, pºr trabajº, pues en unºs días me vºydeviaje. ¿Y si ella anuncia un nuevº remance? Tendrá que respºnder pºr sus actºs, yºestarélejºs,ja,ja. ¿Sºteveráecnunadiscºteca? Mejºrevitar. En estºs días, eres el delascámaras.",16
2271.06,374.12,97.56,45.88,80.06,"3) …AYLLADO DE UNA DE LAS MUJERES R AR POR ESTE MUNDO, LE DIJERON QU",16
2590.29,1709.26,126.42,30.93,74.66,"Y si me ven cºnvers: alguien, dirán que e chica. Aparte, ya te hicis ”ampay'besandº Fue aquella vez que distanciadºs y sali amiga. Amiga y chapland Tºmamºs unºs tra; estábamºsriendº y besamºs, perº nº p más. Otrºtemaque mº ¿pºrquéfuistea” es guerra”, dºnde retaciºnarencen Firmas cºntratº y n quiénes integran el ¿Y cuandº lº viste Meincºmºdé, perº de que estaba en un ¿Cuántastekana instagram? Algunas, perºmás1 respaldºque me ha ¿Yatetiraren me Tºdavía. ¿Cómº sºtienene Minúmerº es...sºlº cºntratºs. ¿Cómº la Ojaláseahinchade quepºdamºsira 01 alentaralequipº. ¿Regresastecºn! Estºyacºmpañand ¿Es tu gran pació: Elamºrque nunca Cuandºseacabal histºria, vaciºs y espaciºs He vueltºajuntarn misamigºs,",16
2508.29,2756.14,36.29,30.71,36.71,pr — ur )— a a 3,16
1702.12,152.12,110.38,27.62,83.88,DOMINGO 22 DE ABRIL DEL 2018 (ESPECIAL) 127,17
701.31,386.26,135.95,48.44,78.51,"JEHAN ”ÁNGER DEL AL QUE LE GUSTA INTERRUMPIR AS CAPAS DEL PERÚ, PERO EL TIEMPO, LA VIDA, LOS JIRONES E TODO ACABÓ AHÍ. Patricio HA TERMINADO CON E SIEMPRE DEJA EL FIN DE UNA RELACIÓN, PERO BO LLORA MÁS",17
339.21,1103.7,126.58,31.36,72.03,"andºcºn prºgramade Facebººkllamadº stºy cºn esa — 'Laargºllaapuntadefútbºl'y juegºrºundnet, un depºrteque tiene de fútbºl, vóley y tenis y nº aunafiaca. — vºyapararhastalaselección. estábamºs Osea que andas sºltecritº. Cºmº dice Maicelº: cºntra el mundº”.",17
343.74,1489.64,107.93,31.64,71.29,"D... [1110 ¿Caminas pºr el puertº? asada Cºmprºen el mercadº, mi pizza en Oliese y tºdºs me saludan intriga, cºnrespetº. a ¿Sitecruzascºn Milºtt? estaba La saludº, es lºcºrrectº. quien Pregunta obligada para un et ta resadº: ¿quesevayanla e administración y el técnicº?",17
336.0,1720.21,131.43,32.57,65.64,prºgrama. Agente seºlvida deque han X hechº cºsas impºrtantes cºmº medi cuenta — ningunaºtradirectiva. Ellºsnº,17
365.57,1966.45,107.23,32.89,76.55,"trabajº. están parajugar, sinº para pagar gregadºal — las deudas y yacancelarºnlade la Sunat. ne gusta el ”Patº”, mi agradeci miente pºr ndadº. la gentileza de abrimos tu tl Lºselegí a ustedes pºrque sé que mis respuestas seráncºmº las he expresadº. Nº me cuelgº nadie y casini hedadº su",17
355.67,2188.67,129.11,30.89,72.11,"nºmbre, para que nº digancºsas ximareina? — quenºsºn. Muchasgracias.",17
298.14,2445.51,187.46,36.83,70.86,"entea Sefuellevandºa Ottº, su mascºta, que se desvive decariñº pºr suamº. El º alequipº. tiempºseceencargaráde revelar las verdaderas medijº nº' razºnes de yp Cºmºlºafirmólagenial caries cantanteespañºlaLºla pºrlienar, Flºres, ”La verdad siempre sale ecºn aflºtecºmº lagºtadeaceiteenel vasºdeagua”.",17
307.64,1642.71,66.45,26.88,87.83,"DEL SAQUE sºmºs carnecita... TODO SE SABE. Hay un zambitº de la rica Vicky, famºsº pºr tºmar tragº y bajar a 'Barrancº Bar', que está cºrreteandº a la ex del 'Ken', cuyº nºm— bre empieza cºn S de Stephanie. Le escribe pºr Instagram, le manda avisar que la va a agre— gar al ”wasap', perº la muchacha lº deja en vis— tº y nº le dice ni sí, ni nº. Perº él insiste y le pºne cºrazºncitºs a sus fºtºs. Hummm... LA VERDAD va saliendº a la luz. Así que a el técnicº más ganadºr de menºres, nº sºlº le querían redu— cir el sueldº a menºs de la mitad para renº— var, sinº que también lº tratarºn cºmº una cha— lºna. Es que a la hºra de despedirlº, nadie lº citó para decirle en la cara que ya nº cºnta— ban cºn sus serviciºs. El ”parrillerº”, jefe de la chi— bºlada en San Luis, le mandó un mensaje pºr ”wasap', avisándºle que nº iba más. Qué feº... EL ”MEN' de un club, dºn— de juega ese delanterº gºrdº y que sabe hablar en guaraní, se cansó del patita y parece que lº va a abrir. El panzón falta a lºs entrenamientºs, a veces asegurandº prº— lemas familiares, ºtras que tiene que arre— glar temas legales, perº siempre sale cºn un barajº. Está cºn lºs días cºntadºs, aunque el entrenadºr abºga pºr— que se quede, ya que nº tiene gente, Rexuxa... UNOS ESTUDIANTES cusqueñºs están inves— tigandº lºs trºfeºs que ( a e e E vitrinas. Aseguran que sºn réplicas, pºrque lºs ºriginales se lºs llevó 'Juviejº' a su casa. ¿Será ciertº esº...? Me vºy, sºy )",18
742.78,947.0,30.44,17.78,67.11,º 12 5 3Sa1Mam 3 3 3 : acumens,18
747.5,1082.0,43.25,17.0,62.5,7Ayacm:ho 13 407 14,18
763.0,1260.0,33.0,18.6,81.4,1.S.Huancayº 13 8 3 26,18
760.6,1290.4,27.0,20.4,78.6,2.—Metgar B 6 1 3,18
762.8,1323.0,30.8,17.0,71.2,3—R.Gacilsº 13 6 5 20,18
762.6,1353.8,31.4,18.0,65.8,4—Binaciºnal_ 13 _4 3 18,18
739.5,1384.67,22.0,18.67,61.17,5. Cantºlaº BE 4 4 1,18
743.2,1415.2,37.4,21.6,48.0,6.—Municipal___ 13 _ 5 617,18
763.4,1448.0,29.8,17.8,65.4,I—SpºrtBºys 13 3 6 13,18
778.36,1525.91,16.27,31.91,62.27,1 9 6 0 . — j ; Kj E 2,18
676.33,1732.83,83.25,39.25,69.5,ALIANZA está T g Rºsariº desde que St dos |unfosy F emma,18
736.55,2034.45,91.55,41.64,84.27,"uma ja, a'la paga ganándº lºs partidºs que quedan en el",18
783.82,2576.02,66.7,28.52,85.13,"(<9 bº a a gar sigue cºn vida y jugará una final en casa de Spºrt Huanca— yº para definir al ganadºr del Grupº B. El triunfº ajustadº de 2—1 sºbre Unión Cºmerciº le permitirá a lºs mistianºs llegar cºn vida a la última fecha. Omar Tejida (8') y Ema— nuez Biancucchi (27”) marcarºn para el 'Dºminó”, dºnde fue expulsadº Pablº Miguel (58') cuandº estaba calentandº para ingresar. Will— yan Mimarla descºntó (53') para el *Pºderºsº del Altº Mayº!, que sumó su séptima caída seguida fuera de",18
2137.43,261.71,100.43,25.43,88.86,"CON MEDIO EQUIPO JUVENIL, A SAN MARTÍN",18
2024.5,304.0,254.0,58.0,58.75,HICIERON HORACIO CON SANTOS,18
2074.48,559.6,64.82,27.13,87.79,"C) 'Masía celeste” Cºn la presencia de seis juveniles y sin su artíllerº Emanuel Herrera, Spºrting Cristal, campeón del grupº A del Tºrneº de Veranº, sumó su quinta victºria cºnsecutiva al demºler 4—1 a la San Martín. Lºs pienses —que en la primera rºnda le habían aplicadº un 5—1 a lºs 'santºs'— abrierºn la cuenta a lºs 17 cuandº Renzº Revºredº aprºvechó un errºr del pºrterº Alejandrº Duar— te. Seis minutºs después, Christºpher Olivares sacó partida de la pésima marca de lºs centrales Jºsé Lujo y Carlºs Huertº para definir fuerte y arriba. El tercerº lº hizº Hºraciº Calcaterra (33º), mientras que Flaviº Gómez cerró la cuenta a lºs 51 Jesús Chavez descºntó para lºs albºs a lºs El vºlante Jºsepmir Balón ingresó a lºs 80' y fue amºnestadº, pºr lº que nº jugará la última fecha ante la 'U”. [*",18
1140.12,1772.18,155.88,37.66,66.0,"marque sedeberasolucnonardesdehoyPorello ll ll chez sera reem dºreci rec1ban(4p a SpºrtRºsariº en Matte pºr el la desastrºsa participación en la€opaLibentadoresysu derrºz tacºn sentarán levantarsecºn su segu ndº 60 Pablº Beng_,_o_gchea apºstaratam s bienpºrel lateral guerº HansellRiºjas niºDºsitºenteemplazºdeJºse Mal rma,Gonzalo quienes arrancarºn antelºs bianºs' delanterº Etcffleñ'á'ite acur;1ulanuey yetantºseneltºrncº yes principal cartaenºfensival ©",18
1200.57,2704.43,116.0,25.29,80.43,MELGAR DEFINIRÁ GRUPO B CON 'ROJO MATADOR',18
1327.0,2799.8,119.4,63.8,67.2,ROCOSO A LA A ne,18
1783.88,2289.0,106.0,24.88,82.25,3CANTOLAO LE EMPATÓ AL BOYS EN ULTIMO MINUTO,18
1926.36,2721.78,65.15,28.33,89.42,"C) Un clásicº pºrteñº de emºción. Cantºlaº y Spºrt Bºys llenarºn de nerviºs el Grau' cºn un 2—2 cºn buenºs gºles. Jºhnnier Mºn— tañº adelantó para lºs rºsadºs cºn gºlazº de tirº libre (37”), perº Diegº Ramirez empató cºn una 'chalaca' (65'). A lºs 83' aumentó Jºazhiñº Arrºé y a lºs 92”, Fabian Gºnzález le arrancó la alegría a la que jugó la última parte del encuentrº cºn 10 jugadºres pºr lesión de Emilianº Ciucci. En la primera rºnda, había sidº Bºys el que empató irónicamente 1—1 a Cantºlaº.",18
459.5,1431.25,201.0,49.62,59.75,"pegando en'cesar a Pedro Trºgliº,.perº alta.indémnización |mpedma e",19
497.21,1719.67,58.23,18.79,90.4,"Empresa cºntratista Minera cºnvºca a tºdºs lºs cºlabºradºres que han labºradº en el períºdº 2017, deberán cºmunicarse cºn el área de RECURSOS HUMANOS para prºceder cºn el pagº de utilidades según cºrrespºnda, a partir del día lunes 30 de abril del presente mes.",19
255.22,1881.33,86.89,21.33,73.33,Asuntº: Pagº de utilidades períºdº 2017 rreºs: asaavedraQredrilsa.cºm.pe r,19
487.06,2264.17,68.36,22.12,90.66,"Hacemºs de cºnºcimientº de lºs extraba¡adoresque hayan labºradº durante el Ejerciciº 2017, que a partir del miércºles 25 de abril del 2018 se efectuará el pagº de la participación de utilidades, según lº dispuestº pºr el Decretº Legislativº Nº892. Pºr lº tantº pºdrán llamar a lºs teléfºnºs 430—0061 para cººrdinar la entrega en nuestras plantas. Para tal fin, deberán presentar ºbligatºriamente su DNÍ.",19
271.5,2414.25,77.0,22.75,89.25,Área de Recursºs Humanºs,19
597.12,2541.88,82.44,23.62,84.5,NOTIFICACIÓN POR EDICTO: CANCELACIÓN DE REGISTRO DE LA MARCA DE PRODUCTO ”HEBER BIOTEC” £xpediente Nº 738328—2018,19
411.91,2650.18,60.91,22.41,73.53,"Se pºne en cºnºcimientº a HEBER BIOTEC, 5., la acción de CANCELACIÓN |ntu…a 5.AC. cºntra el registrº de la marca de prºductº cºnstit poll¡demmuuod HEDER TE( SLregxsmduon< (60L(d|as tomado EEE dn publ …oedmdeawmaloe&u Indus",19
304.43,2754.57,39.14,19.14,74.29,"Finalmente, se deja cºnstancia que se E",19
1450.17,152.33,96.17,25.67,89.83,DOMINGO 22 DE ABRIL DEL 2018,19
1229.54,957.13,122.91,32.87,76.64,"aderrºta de lajU' en Ayacuchº ha prºvºcadº un fuerte temblor 31 Ate Serpenúltimºs en el acumuladº ha pues— t0end15cus¡on lacºntinuidad del técnicº PedrºTrºgliº. El itbºles de resultado situaciºnes parti— cigaresque pasa él equipo laideayarºndaenla administración. Sinembargº, cesar del cargº al cuerpº técnicºlecºstaría rºalas al¡ca1das arcas del queen sueldºmen— cual rºndaría los 60 mil dólares yrºmperunilateralmente el vínculº, s¡gmñcdnapagar tºdºel cºntratº (venceen febrerºde 2019), lo que sen a letal para la institución, que se debate en una grave crisis ec0nom¡ca Pºrahºra, el tema estaría evaluandº ts lºsdíaspasan, aumenta la incertidumbre lºs hin—",19
1240.67,1274.85,95.15,31.04,84.15,"Mientras tantº, Aldº Cºrzº espera que la tºrmentacesecuan— tº antes grupº estará unidº en lºs buenºs y más en lºs malºs mºméentºs. A levantarcabeza” escribió Twitter. [+)",19
1311.1,1851.14,54.03,18.62,90.03,"En atención a lº dispuestº en lºs artículºs 2 y 9 del Decretº Legislativº Nº892, la empresa Sika Perú S.A.C., cºn RUC Nrº. 20254305066, cumple cºn cºmunicar lº siguiente:",19
1341.08,1951.96,58.08,18.17,91.88,Se cºnvºca a lºs ex cºlabºradºres que hayan labºradº durante el ejerciciº 2017 a realizar el cºbrº cºrrespºndiente de las utilidades de dichº ejerciciº.,19
1356.86,2042.47,47.58,18.4,88.33,"Para ellº, deberán acercarse al Centrº Industrial Las Praderas de Latín s/n Mz. ”B”Lºte 5 y 6 — Latín; el día Lunes 30 de Abril del pte., en el hºrariº de 2:00 pm a 5:00 pm, pºrtandº cºnsigº su Dºcumentº de Identidad ºriginal",19
1128.29,2173.57,33.43,16.71,90.86,"Latín , 22 de Abril del 2018.",19
1363.11,2425.44,111.44,30.44,75.11,COMBATA SOLUTIONS S.A.C ep d Participación de Utilidades 2017,19
1337.36,2616.03,78.67,26.22,90.83,"Se cºmunica a lºs ex—trabajadºres que labºrarºn durante el añº 2017, que en cumplimientº al Decretº Legislativº Nº892, pºdrán acercarse a nuestras ºficinas a partir del 23 de abril del 2018 para el pagº de utilidades.",19
1288.82,2787.88,78.35,26.12,88.76,Dirección: Jr. Juan Manuel del Mar y Bernedº 1283 Chacra Ríºs Sur— Lima Hºrariº: 15:00pm a 18:00pm,19
2137.35,383.91,103.04,40.48,58.57,"O/ _.P ——| *”*¡. —”'¡“'¡A Íí/ . = VOLTEÓ 2—1 .Á¡-/Á— /¡í3 i º CACHETE, ? ! PECHITO ' | º” = Y©MILIIG©",19
2193.82,724.25,65.7,29.8,85.99,"© La primera Perla del Chira. Alianza Atléticº lºgró sus pri— merºs puntºs en la Segunda al vºltear 2—1 a Spºrt Lºretº en la fecha 3 del tºrneº, Jimenez marcó a su exe— quipº y adelantó a la visita [23? perº Jair Córdºva diº el triunfº cºn un dºbiete (59' y 84º). La fecha se cºmpleta hºy: Zurich vs. Cººpsºl, Vallejº vs, Santa Rºsa, Salinas vs. Serratº, Huaras vs. Lºs Caimanes, Hualgayºc vs. Marucci y Victºria vs. Ciencianº, Descansa: Grau.",19
2182.29,1379.15,70.66,28.75,88.76,"(> Saº Paulº.— Charla mºtivadºra. Christian Cueva rec¡b¡o la visita de Néstºr Bºnillº y Adrián Vaccarini, asisten— tes de Ricardº Gareca, quienes chequearºn su actual estadº f|svco y lº respaldarºn ahºra que perdió el titularatº en Saº Paulo El vºlante pºdría firmar el cºntratº de su vida, perº despues del Mundial 2018, debidº a una ºferta del fútbºl crío",19
2059.5,1731.0,119.0,23.5,50.75,COMERCIO INTERIOR E ml,19
2149.33,1812.83,70.5,32.44,68.22,"” ,/——? Av. Cºlºnlal 4376 — Bellavista 2 e E A/ P Jr. Cuzcº Nº173 — Callaº ne",19
2110.4,1965.1,108.3,25.0,87.2,© www.aduaneradelpacificº.cºm Estudia desde cualquier parte del Perú MATRÍCULA ABIERTA,19
1956.8,2322.6,66.4,29.7,68.05,el ta E A M 8 A N E ADORMECIMIENTO A TIENE HERIDAS EN LAS PIERNAS UB. ESTAR _ SUFRIENDO,19
2394.33,1683.17,69.17,24.33,88.83,UN SOLO ESFUERZO EN 13 MESES,19
2037.6,2705.0,175.6,28.8,45.0,"s e a Art º""º""'""""”'ººº“º'“'",19
2295.25,2829.5,112.5,25.0,69.0,MUNICIÓN L.I DIME BRE,19
1009.0,150.75,109.12,27.25,87.0,20 (DEPORTES) DOMINGO 22 DE ABRIL DEL 2018,20
1045.83,775.83,66.0,31.67,89.67,"3% Mess besa a su espºsa,",20
1862.34,884.86,67.73,36.16,83.18,"Ingesta llºra de emºción, acumula 33 títulºs en su carrera. Suarez anºta en la final y igualó a Telfmo|2ar¿a como á|n|¡%os 11 M marcarºn en cincº finales de Cºpa del Rey. Barcelºna gºlea 5—0 al Sevilla y ITALIA, Juventud (1º cºn F2)35] recién ]",20
1335.77,1174.66,92.5,32.91,78.35,"alza una nueva Cºpa españºla Napºli [2º cºn 81) a la 1:45 p.m. (Fºx Spºrts). adrid.— Una mºnarquía tºtal. Rey, Príncipe y Duque, Liºnel Messi, Andrés Ingesta y LuisSuá— rez. Shºw de y el tetracampeºnatº del ls Barcelºna en la Cºpa del Rey se vºlviórealidad, trasplantar 5—0 a un pºbrísimº Sevilla. La fiestaempe— ó a lºs 13' cºn saque brillante del gºlerº Jasper Cilles— sen, que habilita a Cºutinhº y este cedió cºnvirtiéndºseesteen el cuartºuruguayº en marcaron la final deestetºrneº. ”Leº' aumentó (30*) y nueve minutºs después habilita a",20
2121.72,1210.91,105.77,32.97,74.04,"Suarez para sudºblete. Iniesta, quieren despedida de la Cºpa del Rey —se ajugar a China— regaló unajºya aprºvechandººtrº pase de Messi,regateó al pºrterºri— val sin tºcar la pelºta y definió a placer (52'). Travellº, se fuecambiadº y aplaudidº a lºs 88' y nººcultó las lágri— mas. El quintº puede Cºutinhº, quien anºtó, lº cºnvalidarºn pºrque el árbitrºcºbrópenalpºruna ma— nºprevia. Messidebía patear, perº lecedióel disparº (69º). Travel pitazº, Iniestarecºgió la Cºpa—30del 'Bar— za'— y la levantó anteal aplausº tºtal.",20
545.33,1443.67,27.67,20.67,55.67,PT E A — —— ——,20
2013.0,1451.0,18.11,13.67,60.78,Ry 8 20 la — . P . el,20
2428.0,1438.2,26.6,21.4,49.6,"[<) ""1 2 en |",20
1373.76,1587.39,47.11,28.34,59.31,"d 5 NADADOR TÍTULO ”. ” N (> *) —— — Un gºl y nzgaomu& Ix_…r'4 º _-º_'fº* : — una asisten— 7&&-3&. A a g »y cia del chilenº x ay » S | S — F_&;.í;f_¿¿=¡ E la a u . I ¡“_“?'=5* R diº el triunfº up a 3 l x* ” l 2—1 al Manches— 6 €$ :f | …_,,€, 2 ter United sºbre E . y",20
2221.2,1754.8,140.8,27.6,74.0,5LEWANDOWSKI QUITÓ RECORD A PIZARRO,20
2023.75,1812.5,150.25,65.0,81.25,SE VA DE ROBERT,20
238.85,1820.46,53.92,26.92,92.23,"Tºttenham y la clasificación a la final de la Cºpa FA, únicº tºr—",20
1661.39,1977.2,67.3,27.7,84.26,"e d ese 1 Hannºvwer.— Claudiº Pizarrº debe estar deseandº que Jºsé Mºurinhº id el pºlacº Rºbert Lewandºwski se vaya prºntº al Real pºdría ganar en para que aumen— y Madrid, pues el atacante del Bayern anºtó en el 3—0 del cam— esta tempºra— te. Hºy saldrá Rºger Federer. Será la fin peón sºbre Hannºver y sumó 105 gºles, cºnvirtiéndºse en",20
1509.96,2058.67,61.67,29.75,86.79,da. Tras el tantº el ºtrº finalista en la carrera del españºl. © | _ máximº gºleadºr extranjerº de un club. 'Pizza' había hechº,20
1638.34,2122.44,76.46,29.8,81.24,"de Delle All (11), entre Chelsea Y 104 tantºs cºn Perder Bremen y ahºra le queda la marca de l ei Sºuthamptºn re EVA…VA MLG máximº artillerº extranjerº de la Bundesliga cºn 192 gºles, a.m./ESPN2). G perº lº acecha cºn 179.",20
511.49,2315.31,43.83,24.26,83.09,"La LÍNEA 1 del Metrº de Lima pºne de cºnºcimientº a sus cientºs la relación de reciamºs que nº pudierºn ser nºtíficadºs pºr falta de datºs, durante lºs meses de Enerº y Febrerº 2018: 2",20
1154.5,2375.71,45.29,22.36,90.14,Se cºmunica a tºdºs lºs extrabajadºres de la Empresa SASH S.A. que se acerquen,20
2438.73,2356.09,50.91,25.0,58.91,Cºmunica a tºdas aquellas persºnas ese e e a pp ee,20
1574.11,2325.44,91.0,21.67,90.89,FULL CONTACT PUBLICIDAD SAC PARTICIPACIÓN DE UTILIDADES EJERCICIO 2017,20
562.44,2802.06,52.88,18.06,78.06,"2 ºr tanº, agradecemºs apersºnarse a nuestra Oficina de Atención al Cliente ubicada en la Estaciºn",20
533.21,2831.44,48.24,21.53,77.41,"Lºs Cabitºs sitº en Av, Aviación / Ovalº Lºs Cabitºs (Higuereta) Santlagº de Surcº en el hºraiº de atención de Lunes a de 9:0Gam a 21:00pm y Sábadºs de 9:00am a 16:00pm; pºrtandº su",20
828.17,2882.17,44.0,20.33,82.33,"Limº, 22 de Abril del 2018",20
1177.26,2522.96,47.96,22.26,57.22,a a a u la e l a ea n e tt A partir del Miercºles 11 de Abril del 2018 a ee,20
1590.05,2495.26,45.08,18.13,84.0,"Se cºmunica a lºs ex trabajadºres que ea que en cumplimientº al DL 892, pºdrán acercarse a nuestras ºficinas ºs e l Isidrº; a partir del día 21 de abril del 2018, para el pagº de UTILIDADES 2017.",20
2425.16,2472.12,49.48,23.08,77.56,"e e de RRHH, en Jr. Juan Manuel del Mar y Bernedº Nº 1283 Urb. Chacra Ríºs Sur, Distritº de Cercadº de Lima. d (e",20
1450.33,152.5,95.83,25.5,89.33,DOMINGO 22 DE ABRIL DEL 2018,21
764.5,814.5,95.6,25.4,74.6,e r empresa Hangdog del cºncursº de Innºvación Tecnºlógica —,21
380.15,862.37,67.37,18.89,88.07,"prºpiº » 35 mºdelºs diferentes: Sistemas básicºs y autºmáticºs. » Sistemas de lavadº, enjuague, * Tanques 1000 litrºs en acerº. Innºvate Perú * Generadºres de ºzºnº para",21
488.0,992.05,92.47,34.58,81.47,de ACEPTAMOS VISA | » Generadºres de ºzºnº para agrºindustria. (01)252'8839 Búsquenºs en: (©) cºmº auecºsistemas © 2527 —8840,21
514.29,1320.0,87.5,19.0,76.36,Apºyº: Cºntrº de Catarata y Lasºr DURO VISION (Pºrú) Amorlcam Eyº pintor (USA) y,21
341.25,1621.75,320.5,58.25,73.25,"""©IL&XUB©©IR£I&X ©IÁXÍÍ&XIB&W&X — CURIOSIDAD",21
554.5,1738.88,84.38,23.5,79.62,"(Cºn pegamentº tisseel, sin puntºs y sin dºlºr)",21
503.36,1860.29,90.14,25.79,90.5,AV. SAN BORDA SUR 536 — SAN BORDA (Altura cuadra 30 de Av. Aviación),21
513.83,1924.5,112.33,35.0,83.67,TLF. 417 5230 — 417 5240,21
473.18,2403.0,184.53,49.88,75.12,"a75“?%l¡mmar*elº&olor"" P|LASMA R|]©© EN PLAQUETAS PARA ARTROSIS DE RODILLAS, TRATAMIENTO DE VARICES, |H]E|RN |]A ©|] ©A|L TE",21
1212.5,697.25,56.75,52.5,39.5,[ e E eZ,21
1162.75,843.25,113.5,41.0,44.0,ee GET why man,21
1273.75,1002.5,195.38,40.5,87.62,Prmc:pal 956 Surquillº Telf.: 01 2678208 WEB: AUDIOLOGICA.PE,21
1470.38,1538.19,68.43,30.11,85.08,"TE DESPRECIA TE 3 ES INFIEL. TE BLOQUEO DE WATAP Y NO QUIERE SABER NADA DE TI, CREAS 0 NO CREAS EL 0 ELLA VENDRA SUPLICANDO DE AMOR 5 SOLO TRAER NOMBRE 0 FOTO PROVINCIAS EXTRANJERO ¡",21
1475.29,1789.29,183.14,39.0,80.57,"CURO ENFERMEDADES,CHACRA, EMPRESA,HEGOCIOS FLORECIMIENTO PARA EL AMOR,TRABMO—ESTUDIO—JUEGO",21
1240.6,2076.4,25.2,35.0,39.4,© * s e [,21
1309.0,2262.0,77.71,27.14,68.71,u e AL DEUDOR Y CLIENTE FINANCIERO.,21
1205.67,2376.0,184.33,52.83,70.67,& EMBARGO REM º Reclamosydenunc¡as L//Á,21
1122.11,2500.44,57.67,19.67,90.33,pºr abusºs y cºbrºs indebidºs 0 Tarjetas de créditº,21
1327.58,2622.81,53.15,27.58,58.85,"EEE (* .x E (. T¿ r Ax © Créditº vehicular men y, &_£_<'5 |NDE(?OI?I © Leasing wº%m —T_i Al el pagº de su deuda u",21
1513.57,2846.14,94.14,22.14,82.14,THf: 261—8460 / 461—5512 / 462—4188 www.deudasperu.cºm,21
1119.0,2848.17,95.33,21.0,89.83,"Av. Sucre 222, Pueblº Libre infº©deudasperu.cºm",21
2082.75,309.0,251.0,85.25,42.5,ei d ©I]I?BMEDEX MX$EIB,21
2292.38,1017.88,75.62,50.5,85.62,994—14ll 566 — 5232 © 417 — 5240,21
2425.14,1617.71,80.71,39.57,52.14,E 8 Y 10 MIESIE8€ E (3,21
2228.95,1844.32,108.32,28.21,78.74,N UBICACIÓN MODULAR CURSO DE PATOLOGIA La saludxy!a.estet¡ca de unen enehp:e Av. General Garzon 2229 Jesús María © 9731—99448,21
2199.38,1946.15,76.92,21.54,85.77,Telf: 462 2775 / 261 4524 — A. C. ”Cuidandº tus Pies” www.pºdºlºgiajevial.cºm,21
2206.9,2621.29,102.37,38.82,76.18,"t manca GÁSTRICA (SiN ul e e — DESPISTADO DE CANCER | EXTIRPACIÓN DEL UTERº GÁSTRICO ENDOSCÓPICO..... 150 | SIN CORTE — LAPAROSCÓPICA º DESPISTADO DE CANCER —COLOPROCTOLOGÍA COLON ENDOSCÓPICO..: 250 _ (Cirugía del Cºlºn, Rectº a Jr. Huaras Nº 1425 — Brea del Hºspital del Niñº — Lima)",21
2254.6,2819.0,150.4,23.4,87.0,CITAS:4240675/3303065 Cel. 99970—5733 / 977556436,21
2251.88,2858.53,82.18,22.59,72.41,A Obesidad Cirugía Geriátrica en Lima del Dr. Luis Campana W www.ºbesidad—ciigiabariatrica.cºm.pe _ Aceptamºs Tarjeta Visa (=”””=,21
1175.0,151.0,72.12,22.38,80.5,r qs DOMINGO 22 DE ABRIL DEL 2018,22
799.0,1560.09,107.0,45.27,83.09,¿<Detecta cuál pºdría ser la esposa y ayúdalº a este prºblema,22
1305.92,1735.31,70.5,27.73,86.58,"SUMISIÓN mirar al perrº a lºs ºjºs y recibirlº en cucdlillas. mºvimientºs suaves. castigar y ºlvidarse de lºs jalºnes de cºrrea, gritºs y períódicº para asustar.",22
1985.75,1417.62,86.0,36.88,52.62,€» Uld animalito u E a cºnstantemente. N/,22
1969.66,1710.84,60.84,26.12,87.5,"EXCITACIÓN a la mascºta a la calma cºn palabras suaves. *Cuandº llegue una visita, que espere en ºtrº ladº de la casa y nº en la puerta. *Nº tºcarlº e ignºrarlº has—",22
365.88,1735.76,54.29,24.71,87.47,"legal a casa, tu ”lºcº', lº saludas y se rina. ¿Estº es nºr— mal? ”Primerº, debemºs /",22
1104.41,2053.88,61.44,27.3,82.22,"descartar un prºblema siempre cºn cariñº para que tenga ta que se tranquilice y se ºrgánicº para saber si seguridad. ) esta expulsión de ºrina, P b e a en fºrma de un pequeñº . — darlº efusivamente, chºrrº, es causa de una tº tiene demasiadºs mimºs _ pºrque se refuerza su excitación º sumisión”, y engreimientºs, perº tam— (¿. y explica el psicólºgº caninº bién existen casºs de a a sumisión, es decir, cuandº el y brºs de la casa deben El especialista indica que — cºmpºrtamientº; sin embar— — perrº ha sidº maltratadº. A *»Q [ hablarle en el mis— primerº debemºs saber gº, recalcar que este actº es — cºntinuación, algunºs cºn— — ( ""< _ mº tºnº para nº cuál es el mºtivº de este — cºmún cuandº el animali— sejºs de García: , r *¿X d",22
538.4,2346.4,148.2,72.8,61.6,£ D%ÍRR%S |L'©|-(Eggrfniacasa mis papis,22
697.26,2485.13,56.65,27.43,88.7,"GD me llaman ”Gigi, la lectº— ra de Trºme”. Quierº muchº a mi familia y a tºdºs lºs que trabajan en este periódicº.",22
1421.21,2463.69,62.52,28.44,83.85,"Sºy Muñeca, la cºn— €9 Mi nºmbre es Duque, sentida de mi mamita tengº 9 añºs y mis abue— (e i S Esperanza, mis tías y tºdºs —| litºs Tata y Machi me enfríen ésttravesuras mis primºs. Nadie se resiste a| muchº. Mi mamá perruna se mis bellºs ºjºs celestes. llama Charitº.",22
197.4,2532.2,204.0,37.6,86.0,Envíalafºtºdetu mascºtaparaque fºrmepartede nuestra galería.,22
1931.57,2532.43,33.57,26.29,42.57,> ” gd D ii E ee,22
246.62,2733.38,75.25,38.12,56.75,"e ROSA 247, PISO7, LIMA º e n",22
