left,top,width,height,conf,text,page
1523.57,1857.75,158.64,30.61,70.18,"Mesa Directiva del Par— lamento queest sea multipartidaria. Agregó del fuji mori smo y que tampocoson'susalia— dos políticos: Porsuparte, su colega de bancada, MauricioMul— der.dijoquelapresencia del 'partidodelaestrella' enlapróxima Mesa Di— rectivadelCongresoes— tácasidescartada.Seña—",8
1486.25,2233.5,200.75,36.25,83.25,queen fujimorismode— je la presidencia del Parlamento.,8
1879.75,1493.0,119.0,41.25,60.0,33 CHORRILLOS) _ dos post ulana,8
2312.0,1929.0,160.75,34.25,53.88,memmm… ha [tolenfmarchalunajestrategialque l [ N y ”,8
1871.2,2099.2,123.6,43.4,40.8,gastolpondía Sepondrafa [dese encontraran [VisitaronB,8
2419.0,515.71,69.43,31.29,85.0,"”Nada me impide ©D criticarlo, creo que",8
2397.85,1076.56,59.61,26.53,81.4,"[Ernesto) Blume ha pues— to en manifiesto una postura de intolerancia ante las críticas y esta— es E e de derecho”, dijo Concepción Car— rancho al referirse al presidente del Tribunal Constitucional (TC). En declaraciones a Jui— cio justo”, el magistrado cuestionó que Blume haya manifesta— do que el ente a su cargo 'pisa [ l a corrige los ero— — * res de otros, en *% y alusión al fallo | que encarceló a ? Llanta Huma— c. = la y Nadine _ Heredia. 3 ).",8
2312.78,2480.51,70.24,27.73,83.22,"G» Después que tres de sus colegas retira— ron las firmas que habían puesto en el A proyecto que plantea la colegiatura como N requisito obligatorio para ejercer el perío— dismo, el parlamentario Clayton Galán (No Agrupados) anunció que está evaluan—",8
2227.57,2618.57,69.43,23.57,85.86,7 do desistir de su controvertida iniciativa.,8
2284.28,2756.08,63.38,27.5,90.06,"”Me reuniré con los colegas que firmaron el proyecto para evaluarlo. Si la mayoría retira su firma, no valdría la pena seguir adelante con la propuesta”, dijo Galván. Los legisladores que dieron un paso atrás son Estela Bustos, Rober— to Vieira y Lucio Avila, todos del bloque de los No",8
1460.83,152.67,85.33,26.33,89.17,LUNES 18 DE JUNIO DEL 2018,9
1126.78,721.69,72.82,26.96,87.65,"rechaza la norma que pro— hice la publicidad estatal en los medios privados, llamada 'ley mordaza' e impulsada por Mauricio XT Necesitan 33 firmas para llevarte al ente constitu— clonal y ya cuentan con 23. Están las de Nuevo Perú, de los 'avengers' del sus— perdido Kenji Fujimori, las de Peruanos Por el Cambio y los ex oficial i stas Alber— to de Belaunde, Gino Costa y Vicente Zeballos, entre otros. INCONSTITUCIONAL El parlamentario de izquier— da Alberto Quintilla señaló que 'se puede poner reglamentos o límites, pero no prohibir que el Estado informe, es algo que solo se puede calificar como",9
1570.04,460.29,53.96,24.25,83.88,"'* Derechazo la za' porque sino cómo se van '| : difundir las cam— H pasas de vacunación, contra la anemia y otros”) :",9
1623.83,749.38,42.71,29.58,64.25,a d H l ” H e T Gobierno haya A subsidiado a 2 H algunos medios F con varios millones de — :,9
1551.25,1090.2,68.25,28.4,83.75,"©Et Tribunal demo— haría de tres a cuatro meses para resolver las demandas contra la Tey mordaza”, informó su pre—",9
1986.33,843.38,79.65,26.78,87.69,"©Los padres de fa— milia son ejemplo de ”trabajo, dedicación y anhelo' Con estas pa— labras, el presidente Martín Pizarra envió un afectuoso saludo a los papito perua— nos por su día. Tam— bién recordó a su vie— jito. Vale... YEHUDA ©Yehude Simon de— anunció que no pu— do inscribir su candi— datura en Lambaye—",9
2407.82,1033.61,89.18,26.57,83.0,"Gonzalez Posada. Defendió a Mauricio Mulder califi— cando como una ”infa— mia repudiable' que lo comparen con Nicolás Maduro. No me diga... ”ESSERIA' ©El fiscal de la Nación,",9
2008.0,1170.2,58.0,27.4,90.8,que por culpa de una,9
1527.12,1296.95,67.75,29.35,74.11,"l inconstitucional. _ .. — siente Emeto Blume., ley que promociona— — Pablo Sánchez, ase— las acciones que 23Gob|erno, e n (> K ron Velasquez duró que la investiga— presentarán ante congresistas el pre— — y ¡?;'—9)J ; o d o 1 A a ción que se les sigue el Tribunal Cons— g h siente Martín — Becerril. Dizque dará a Toledo, Alan y PAK y gremios ee e Ejecutivo comuni— pelea. Ayayay... seria y no cual— el Gobierno y la Sociedad periodísticos S ] e EE ) quier cosa', A buen en—",9
1635.43,1454.29,62.43,25.0,85.0,afecta el derecho a la información. [<,9
1038.33,1473.17,60.83,27.83,86.67,"desacuer— do', ya que impide al",9
313.2,1463.6,62.2,26.27,91.27,"Nacional de Radio y Tele— visión, se sumaría la de un grupo de congresistas que",9
1994.88,1453.25,70.12,25.38,85.62,©Nos ganamos con un ”tuit' que lanzó el,9
764.6,1886.8,271.8,71.2,67.4,ASEGURA TY AUTO : NOSOTROS,9
477.86,2297.14,92.43,33.0,85.57,Y PODRÁS VER EL MUNDIAL En un,9
528.5,2374.5,91.5,35.0,89.0,SMART TV DE 55”,9
800.18,2806.94,55.58,15.27,85.22,"Válido del 15/05/2018 al 1409/2018 o hasta agotar stock. Solo con de crédito VISA y CM del Banco Bien Promocional: SMART TV AVC UH de 55”. Stock min. 300. Consulta condiciones en segurosfalabellacorredores.com Asegura y organiza: LA POSITIVA SEGUROS Y REASEGUROS. Contáctenos al 6156000 (Lima) o 606015 (Provincias); o búscanos en nuestras oficinas en Saga Flabella, Banco Flabella 0 Toltus. CM: TEA Máxima 109.83%. Cá'culo para un consumo total de S/ 1000, a un plazo 12 meses",9
279.35,583.22,115.26,44.3,82.52,Joven peruano contó su ejemplar historia e lo aplaudieron <Sus padres se pusieron de pie y él les dijo los quiero ESTADOS UNIDOS,10
566.63,1426.0,68.63,27.04,88.78,": d Javier Juarez se desempeña como miembro de Alcance Comunitario, una orga— : nación sin fines de lucro que se enfoca en el mejoramiento de estudiantes",10
353.27,2147.82,102.36,66.64,78.27,Don Perrito llegó a Rusia luego de — . . la,10
503.01,2587.51,60.45,27.72,89.37,"© Luego de 29 días de travesía, Pedro Niñez Soto (58), el hincha peruano que por el Mundial viajó en su bicicleta de París hasta Rusia, llegó a su destino final. Flameando la bandera nacional y con la camiseta blan— quirroja, recorrió 3 mil 60 kilómetros a puro pedal, ”Fue una experiencia increible, solo tuvo un poco de dificultad por el idioma. Por cada lugar que pasaba, todos me aplaudían y hasta me invitaban a comer a sus casas. El último tramo tuve que hacerlo a pie porque mi bicicleta se malogró antes de lle— gar a Varsovia. Menos mal vino un peruano a mi auxilio con su auto”, contó don Perrito a Trome. Agregó que se quedará en Moscú para ver los partidos de la Bicolor junto a miles de hin— chas de todo el mundo en un fan fest que ha organizado Rusia para los que no pudieron conseguir entradas. ”Estoy seguro de que pasaremos a la otra fase”, indicó. (S.Obregón)",10
1554.5,541.45,121.39,30.03,78.08,ejóasucasaya su familia para cumplir susue— ño americano y convertirse todo un profesional. Unjovenin— emigrante peruano ven— dió todoobstáculo y lo— grógraduarseen la mis— ma universidad donde anteslimpiababaños con su padre Estados Unidos. En unaemotivaceremo— nisen la Universidad de,10
1435.07,1637.36,77.21,32.29,69.64,"M P Sullana, : Sen Moquegua, Ven má — Piura Pauline _| Rafael Sanjinez",10
1676.65,1708.12,58.88,30.59,83.29,Boulanger Mogo— : Maman (106) ase— — |e león (109) aconseja : dura que la quinua es,10
1981.42,700.43,124.28,31.96,73.06,"Brown,en el estado de Rhode Island, donde vi— desde hace 18 años, Ja— vier Juarez contó lo que sintiócuando fueacep— tadoendichacasadees— judios para realizar su maestria en la Facultad salud Pública. ”Seradmitidoen Brown fue modelos momen— tomás importantes de mivida.(Alllegar) en vez diera miclase, comuna derecha y fuialbañode hombres. Fue un senti— miento surrealista, vi mi reflejo en el mismoes— penique había limpiado hacemuchoaños(cuan— doeraniño) y vi la ima— gendemipadreaúnlim— piandoesosbaños para que unía su hijo tuvie— rala oportunidad",10
1599.46,1846.9,74.49,33.18,71.74,"menestras, leche : indispensable para v CUGWÍÍ&H de cabra, sangre— — : los más pequeños. cita gu¡sada secretos yucas, y el 'yupi— — : ©Enjauja,Junín, : ©En Loreto, sin' [mazamorra de : Lucio Mucha Vivan— : Manuel Vela Cene—",10
1586.62,2108.94,57.58,27.69,79.08,"”centenarios', del algarrobina, maíz — : col103)dice po (101), — Programa 'Pensión 65' molido y leche). — que para 5)06 r y 'Saberes Productivos' E : que sus 12 .'_Í¿ San Martín, P del Ministerio de la Pro— ly : hijos c rez [ N recuerda el ducción, revelaron sus st *—— can fuertes, : desayuno secretos de longevidad, — 4: los alimentó conqui— : 'mingado de plátano que son a base de quinua, R< : nua, habas, máchica, : verde' con caracha— pescado, sangre de cuy, : cancha, leche devata : ma y caldo de frijol habas y otros alimentos : y, a veces, cladode : con pescado y carne",10
1339.14,2282.86,57.0,29.57,70.29,de alto valor nutritivo. s l ea,10
2054.0,2282.83,34.83,28.17,66.33,: del monte. . M) G,10
1625.0,2699.25,225.75,34.5,45.75,WendySotelofmeédicolinternisd eielson su mi n yema delnuevofsalmon%,10
2382.98,647.95,137.19,32.83,73.12,"dijon discurso casialbordedelaslá— grimas. ORGULLOSOS Suspalabrasretum— baron en el auditorio y nodudaronenaplau— dirlo.Sus padres, muy orgullosos, se pusie— ronde prepara hacer lo ”Losquieromucho”, di— joel peruano asus pro— genitor es en su idioma natal. Javier forma par— ni— ños yjóvenesindocu— sentados que llegaron a Estados Unidospara ricano'(S.Obregón) G",10
2356.12,1997.88,81.12,31.75,81.12,3 ”más buscados' © Más 60 nuevos prófu—,10
2396.46,2506.7,63.36,26.6,84.96,"gos fueron incluidos en solo esta última semana en el programa de e T ellos se cuiden' del Ministerio del Inte— rior. La mayoría son acusados de violación sexual, tráfico ¡lícito de drogas, con— trabando y secuestro. Entre los fugitivos más bus— E eg p l (l Arce Arias, sindicado como integrante de la banda 'Los Malditos de Santa dedi— cada al tráfico de terrenos, homicidio calificado, lesiones graves y tenencia ilegal de armas en los distritos Santa Rosa y Ventanilla. Ofrecen 20 mil soles a la persona que dé información de su paradero.G",10
1720.0,152.38,92.12,28.0,85.62,LUNES 18 DE JUNIO DEL 2018 fAVISO] 11,11
586.0,1112.3,27.7,52.3,41.7,ie e e o o fr et o — a,11
294.27,711.02,62.9,27.37,89.35,"(D Con 41 años, el derechis— ta Iván Duque [Centro Democrático) fue elegido —en segunda vuelta— como nue— vo presidente de Colombia y reemplazará en el cargo a Juan Manuel Santos. Con 53.96 % de apoyo popu— lar, Duque se impuso a su rival de turno, el izquierdista Gusta—",12
239.29,1118.43,141.14,47.14,84.29,"<Lo emplean perfiles personales, noticias y chatear",12
267.61,1513.57,166.52,30.52,75.96,"nestemundoci— bernéticoydere— ( el padres perua— nos también se vuelven mástecnológicos.Un estudiosobrecompor— tamientodigitalrea— liza do en nuestropaís porfa Perú,empre— sasociadelAB Perú,in— dicaqueel53.4%depa— dr es de familia usan In—",12
717.77,690.67,66.72,27.9,83.21,"vo Petro [Colombia Humana), quien obtuvo 41.82 % y reconoció su derrota expre— sando: 'Por ahora no seremos gobierno' Duque, conocido como el 'del — fín político' del mandatario Álvaro Uribe, modi— fiar el pacto que se firmó con",12
2372.88,233.75,74.38,48.75,64.88,Al A [ VARIEDAD DE SABORES & y,12
2310.3,341.6,123.5,46.1,72.9,Festivales de cervezas : 5% artesanales en I!.nma A ?,12
2082.42,657.19,69.43,27.18,86.99,"() En el mes de papá y del Mun— dial de fútbol, se realizan festivales de cerveza en Lima. En el Jockey Plaza se disfru— tú hasta ayer la cata de cervezas artesanales. En La Rambla de San Borda continúa hasta el viernes con variedad de sabores (quinua, maíz morado, trigo, café) y presentaciones abusivas a la Blan— quirroja. Participan varías marcas artesanales: Cumbres, Barranco Beer Company, 7 Vidas, Abrilia, Tío Luque, Candela— ea",12
1355.8,517.4,132.2,38.0,84.6,Mundial aumenta ser más cu¡dadosos,12
1723.0,939.17,55.83,37.83,35.67,o a a d el a,12
1912.73,1057.4,72.02,25.77,85.06,"; <Más de la mitad de encuestados afirma —| gram(8.2%)yLinkedin ; que se conecta a la red a diario. Un 14.3 % lo hace una o dos veces por semana. RESPONSABILIDAD 64.9 % prefiere conectarse desde casa, Janet Oliveros,directora 34 % desde su trabajo y solo 12.5 % desde del Centro Psicoterapéu—",12
2346.25,1172.25,168.75,36.5,74.0,"timonel Perú, remarcó que”definitivamentela",12
1850.42,1193.25,64.17,29.0,85.25,una cabina de Internet. 19.3 % usa otro dispositivo para acceder. |,12
1798.13,2486.83,86.74,30.48,82.91,"Ia segunda (D El escurridizo ladrón Resemble Junior (D Camuflados en 20 %—]EE¡]II=EEB Saavedra Condor (19), 'Llorón', fue atra— paquetes de una cono—",12
1021.33,2758.08,133.42,35.5,66.42,"WG]I¡ID(¡'I!&I¡b ) nada , per1ud¡car pal ©(ññ Elnmgun f P amae¡¡ ©",12
2108.49,1573.21,144.94,31.59,76.73,"*Solo el 25 % afirmó que publica con tecnologíaestáen nues— mucha frecuencia en sus redes sociales. trasvidas, en lolaboral, y """""""""""""""""""""""""""""" — ayuda muchi simo en las ternet. comunicaciones, pero Lamayoríade'padresdi— _ debeusarseconrespon— vitales peruanos' no ha— — más cen publicaciones con sisetienenniños”. frecuencia. Lasredesso— — Indicóqueayudaacono— cialesquemásusan cerel'mundo'de son: los hijos asobre— Facebook llevarladistancia. 71.2% para revisar l ”Unaconversa— perfil es personales y |_5 ciónporwebcam actualizaciones puedeserrecon— noticias, yel 45.5% fort ante cuando se parachat. LIGEROS estálejos de ellos. Lasredessociales 59.6% lausa. tambiénayudana mo— ©Lesiguen Youtube nito rear los y saber con (45%) y Google (38.9%). quiéneschateanycon— tactan”, aseguró.(Isabel Twitter(11.9%), Insta— Medina)",12
1905.81,2123.86,115.95,44.24,88.81,¿<Especialista señala que redes sociales los ayudan a comprender el mundo de sus humos y conectarse con ellos cuando están lejos,12
2179.5,2270.75,82.25,24.5,78.75,$A PENAL DE ARCÓN,12
2137.25,2346.25,223.75,54.25,86.0,Metían marihuana en chocolates,12
1566.8,2352.0,206.0,58.8,85.8,“Lllorron arranca cartera a estudiante,12
1112.0,2357.0,124.8,30.2,66.0,sin queícuando despierta velaltres] |dent¡f¡ca,12
2056.96,2688.77,71.91,27.91,84.4,"G lado cuando jugaba tras asaltar a cida marca de chocolate, T— = — una estudiante, en San Luis. Katherine Morales Montes ¿ Los agentes del Escuadrón de (30) y Flor Hermosa Cora— Emergencia Centro lo descu— zen K%3] intentaron ingresar marihuana al establecimien— to penitenciario 'Ancón 1, pero fueron descubiertas por agentes del Depincri Puente Piedra. Ellas cayeron en día de visita y dijeron que un desconocido les entregó las golosinas. (. Yucra) o",12
1745.61,2780.59,51.54,28.95,83.12,"£1_ abrieron en plena huida por la 23) || avenida Nicolás Millón y el d jirón 26 de Junio, con la cartera que le robó a la muchacha. Al &M ser detenido no tenía lo roba— ” do. [M. Rochabrum) [+]",12
648.54,1007.34,144.68,32.16,73.4,"n indecisión tomada conjunto porel Ministerio justicia yel Instituto Nacio— nal Penitenciario(INPE), Car— los Hualapai César Alva, losasesi— nosdeEyviAgreda(22) y pequeña Jimenita(11), respectivamente, fue— ron trasladado s del penal aldea Cochamarca(Cerrode Pasco), a mil 800 metros sobre el niveles mar,dondela temperaturallegaa10 gradosbajocero. ”Los gravesdelitosquecometie— ron merecen repudio del pueblo poreso han sido llevados a uncen— trodereclusión de máxima seguri— dad. Tendrán un régimen másseve— ro,solodos horas de patio y visitas restringidas”, manifestóelministro Salvador Heresy (Jjusticia), al pro—",13
1238.79,1016.14,170.05,31.33,72.93,"grama'Panoramal'. Hualpaacabócon navidad Ey— viquemándolavivadentrodeun bus de transporte en Miraflores, so— loporquelaguapamuchachalore— chazó. Alva, el ' Monstruo dela Bici— violó, mató quemó ajimeni— ta,enSanJuandeLurigancho. ”NADIE ME QUIERE* Duranteelreportaje, ambosase— sino s demostraron queso unos ”monstruos' Hualpaafirmó: ”Nadie mequiere, pido perdón, peroséque nadie meperdonará. Es cierto, bus— caba desfigurar(a Eyvi)...Diossabrá micastigo. Nosoymachista...”. Alvarevelóqueelhorrendocrimen de jim en it a no lo hizo solo y que cuandoentreajuicio,daráelnom— brodequin sería sucómplice. ”Ese",13
898.04,1462.87,101.52,45.22,91.04,que quemó a Envi Área y violador de la bicicleta fueron trasladados a prisión donde la temperatura llega a 10 grados bajo cero,13
783.5,1743.75,291.75,81.0,85.5,MANANA VIVE EL MUNDIAL,13
1814.44,833.36,141.08,32.89,80.0,"día(delasesinato)estabaesperan— doa un policía... Merezco per— dón, merezcomorir,dicen”, acotó. LamuertedeJimenitaocurrióen febrero deteste año, mientras que a Envi reprendieron fuego en abril. Ambos casos causaron el repu dio general de los peruanos, que salie— rona las calles para exigi r la pena de muerte para Alva y Hualpa.",13
643.86,671.86,112.71,44.71,85.29,y pronostican triunfo en partido ante Japón,14
1451.7,1796.88,59.72,27.23,88.19,"© Un terremoto de 6.1 grados en la escala de Richter sacu— dió la ciudad de Osaka [Japón) y causó la muerte de varias perso— nas, incluida una niña de 9 años, y dejó al menos una decena de heridos, informaron las autorida—",14
1897.5,381.3,155.7,39.3,71.5,m Angeles [¡m camb¡ara$ala de A penod¡cos400 per¡od¡stas t|empos |Ie—,14
1739.78,1397.93,120.52,30.89,72.15,"/A gritar: ¡Colombia! Acompañando A ¡Colombia!¡Colom— ala fotogra— —— mulandoalrecor— — impondrámaña— bia! Losleones se dado pulp o — naajapón,ensu unieronasíalga— mensaje: ”He enel Mundial debaten la Copa torso Sudáfrica 2010, del Mundo Rusia queacertócon nuevo atuen— ' los leones y 2018. pronóstico do de la del ParqueZoo— Paradaralgana— del Rusia—Arabia lógicoSantaFe,vatici— _ dorsecoloca— - Sauditaenelinicio eo",14
2024.8,1732.16,72.48,25.64,88.04,"cinta. El nom— des. Además, varios edificios en las ciudades de Osaka y Takayuki será se derrumbaron e incendiaron. El fuerte movimiento teórico causó .",14
1937.94,1869.06,54.78,26.28,89.61,la suspensión del servicio de ”tren bala' en la zona y no se activó la alarma de tsunami.,14
1960.5,1574.75,63.25,33.0,77.5,E del Mundial. o,14
2409.33,927.17,54.83,28.72,86.17,"En su cuenta ofi— ©) cual de Instagram, la bella actriz israelí Gal Gado (33) reveló la pri—",14
1928.35,791.52,143.7,30.87,76.83,"(unaconlabandera colombiana oracon lajaponesa), queen interior tenían he— noy carne. Fueroncol— gadasenunárbolala misma altura. Ibien las vieron, los felinos salvaje s se lanzaron sobre loscolorescafe— teros.",14
2251.73,1060.0,80.87,29.47,77.27,mera imagen del traje Estaelección serea— que utilizará cuando liante laminada de e E E,14
2110.0,1172.38,96.31,30.54,86.15,"decenas de visitantes, sobre todoniños, quie— segunda película desempeñaron a de la saga.",14
2375.5,1586.75,69.0,26.25,76.75,mucho del usa— E,14
2333.57,1863.14,50.57,26.86,82.14,hará el 1 de t del 2019.,14
433.07,2265.13,156.07,27.53,63.07,'SIENTES[UNICOMPORTAMIENTO E)(TRANOI Ú S' ENÍSU)VIDA?¡TE(SIENTES!REC ABANDONA XYÍCON.* MAUASUERTEEN: EL'AMOR?¡'I'U'XVIDA SEN S EESTÁ'DESTRUYENDO?¡TODO LO/QUE REALIZASTE 2,14
438.0,2363.14,270.71,37.0,56.29,(P ouanísusmnonu—:ms;nn r os¡mzmns.v¿couocr—:n& 36 1rzn¡c¡nnmrmís¡mvm—: EFECTIVOS,14
486.93,2540.7,73.07,20.47,66.95,"E VIDA. NO IMPORTA TIEMPO DE SEPARACIÓN. TE DEVUELVO u o en u l s e SER AMADO Y TE LIBERO_DE MALAS INFLUENCIAS NEGATIVAS: ¿TIENES DUDAS EN EL AMOR?, ¿NO SABES QUE CAMINO TOMAR?, u o a u e e a TE _ PREOCUPES _ TENGO _ TODAS LAS RESPUESTAS Quue NECESITAS. REALIZO AMARRES DE AMOR PARA TODA LA VIDAD",14
563.22,2681.22,111.41,23.31,67.72,"INMEDIATO, SIN IMPORTAR LA PERSONA QUE PONGAS EN MI MESA REALIZO:ENDULZAMIENTOS; HOROSCOPOATAROT, SE DESTRUYES ¿ELIMINAMOS*TODO.TIPO DE HECHICERÍ_A.' X DEJES QUE EL""AMO R EN¡TI&CORAZÓN,¡PA T LO'DESCONOCIDO, ¿YALIENTE HAYIUN'EÚ URO PARA(TODOS LO HAGO POSIBLE|",14
1371.88,2230.88,148.88,35.62,87.25,ENSEÑANZA ESPECIALIZADA DE ALTO NIVEL CON NUEVAS NORMAS,14
1348.89,2539.11,97.33,29.0,59.0,Exc uz_lf de Choferes RPC _ 991—890—225 RPM 4961—624—532,14
1264.22,2682.67,111.67,22.22,58.78,2 LOS LOCALES LINCE [wwwescueladechoferesperutcom)] Av Cantaro 338 01301,14
1306.26,2806.32,134.53,18.84,69.58,RPC.OS7T399829 [|nformes©vscueladechoferesperñ'com PUEBLO LIBRE SAN MIGUEL JESUS MARIA 4604432 4z4—3422 E surco LA MOLINA Av. Avion 2469.10 449—0542 348—1440,14
2068.77,2369.92,126.38,34.62,87.92,"CON CELULAS MADRE y ELIMINE EL DOLOR Y RECUPERE LA FUNCION (TRABAJO, DEPORTES)",14
2196.75,2469.0,178.0,41.75,89.75,TRATAMIENTO CON CELULAS MADRE:,14
2171.87,2687.89,111.32,29.26,83.92,£ Diabetes f Disfunción Eréctil w Caida del Cabello (Damas y Caballeros) Antienvejecimiento — Fatiga Crónica y Rejuvenecimiento Facial — Cuello — Manos Dr. Ricardo Duran Citas: T. 261—8724 ee 996590243 AV. LA MARINA 385 — PUEBLO LIBRE,14
950.78,151.11,108.56,29.56,82.11,16 (DEPORTES) u:…; LUNES 18 DE JUNIO DEL 2018,16
1442.18,249.77,152.82,27.0,54.73,Z Tn [[E) k D | | » e ….—' ” Al BOR:FERN ERNANDO:VOCHADÁVIUA| ENVIADO ESPECIAIFARÚSIA 3 ) N_ a -_… a,16
521.56,1078.78,160.78,48.11,78.33,o TITULAR PARA CONQUISTAR A FRANCIA Y SEGUIR RU$HÁ2©“H&,16
499.76,1276.82,125.82,38.65,72.12,"oscú.— Rearmar, organizar y sorprender. 4 Tres puntos básicos para iniciarlaestra— V tenia en busca de sorprender a Francia.No",16
483.21,1606.21,110.02,31.02,73.13,"queda otra. El comando técnicodejólas du— das y decidióque Paolo Guerreroregresealoncetitu— lar. Peros vuelta provocará un cambio de piezas obli— gado. O sale Jefferson Harán o Edison Flores. Trascendió queen los planes de Arcano estaba ubi— car dos atac antes rival poderoso como los 'ga— los, pero nodes carta esa idea porlaobligacióndecon— seguir lostrespuntos. La posibilidad desatar al 'Ore— jas' esriesgosa, pues la función que cumpleessuma— mente importante para el equilibrio de su oncena, algo Suecia. Undate más: ayer en el partido de práctica, Paolo mar— chun gol y lo gritó con rabia, como maldiciendo porlos tantos que no hizo ante Dinamarca. El capitánestá hambredegloria.",16
462.15,2124.31,75.54,43.27,78.69,"ue no arrancaron ante — el 'ESTADIO ENTRAL. a era a Ia Sub—20, en L SW|II|am A v¡st s actuar £é AUL uidiaz, e dos co",16
354.0,2271.0,94.08,45.85,63.62,Anderson Santamaría y perder Paolo ei i (e e % ron los TANTOS.,16
522.44,2478.11,90.93,56.89,76.22,"£PERU viajará e £ á de n1<ater¡m%urgo y el l? 70 hawt¡empo que perder, hay que cambiar el chip wldo, mejorar y buscar la victoria ante Francia”",16
602.65,2801.71,103.18,44.06,89.35,"Con mas tranquilidad después del golpe que tuve. o recuerdo nada de ayer (sábado)” Renato Tapia, volante",16
1460.83,152.33,85.33,26.67,89.33,LUNES 18 DE JUNIO DEL 2018,17
1215.0,427.29,96.07,40.93,66.57,l e t p CUEVA CANCIONES DE IDOLO DE LA CHICHA PARA PENAL FALLADO,17
1752.73,471.91,106.09,30.68,78.14,"oscú.— ”Con la ayuda de Dios sé quetriunfaré, eh, Cueva pasó alarga nochesindormir, pensando en el penal errado, pero con el respaldo desuscompañeros, el",17
1724.2,683.6,79.0,27.6,43.4,las llamadas de sus amigos,17
405.36,2360.82,137.09,60.82,63.36,TI 33 JUGADORES r SE REUNIERON |..— na PROMETIERON [ —=:,17
548.0,2552.71,37.14,34.86,55.29,SEGUIR t. — E la [ y,17
1151.78,2792.7,63.3,26.28,88.88,"Los referentes hablaron, motivaron y también se refi— rieron a los errores cometidos. Hablaron de lo difícil del momento y también de lo necesario de ganar para seguir en la lucha. Se supo que todo acabó en gritos de arenga,",17
409.08,2787.98,61.35,27.58,90.08,"Moscú.— Primero: el equipo. En la interna de la selec— ción, la caída ante Dinamarca ha dejado heridas que siguen sangrando. Por ello, se hizo necesario que el plan— tel tenga una reunión para sanar los golpes de la dura",17
811.0,2879.29,57.57,26.21,90.93,batalla ante los daneses. tal cual se hace antes de ingresar a la cancha.,17
1678.38,1005.75,157.31,29.5,70.0,"volvió sonreir. Trascendióquesuangustia provocóqueel psicólogo delaselección tuviera que charlar conal por casi una hora. Peroladesazón no seiba. Alamanecer, unos amigos suyos, los hermanos Sánchez,lehicieron una video llamada desde el lobby del hotel concentración y le en ton aron las emblemática provinciano' y 'Como un",17
1593.8,1286.4,104.2,32.4,68.2,_ ave' del falleci do idolo de la chicha.,17
1638.65,1543.53,212.18,34.29,75.41,"Aladino' no pudo evitar derramaralgunaslágrimas. Suscompañerostambién lehandichoqueconfían enél,quelovanarespaldar sideseaseguirparándose desvelos 12 pasos y poco a pocolapenairá pasando. Estas horas sonde full apoyo moral.",17
2240.12,689.91,57.93,26.18,89.16,"a noche es corta en |LáR:sia. Pero es hermo— . Apenas son unas | cinco horas de oscuridad. La gente no corre, cami— na. A lo mucho, trota. Los locos somos los latinos que hemos llegado a ver el Mundial. Se vive con calma, los rusos saludan siem— pre con una sonrisa y cuando te miran, te",17
