left,top,width,height,conf,text,page
477.62,1292.68,65.82,24.34,89.69,"Mi amigo, el fotógrafo Gary, llegó al restaurante para recoger un taco taco de frijoles con un vomito encima, y para tomar una manzanilla al tiempo. ”María, ya vamos a cumplir medio año de esta crisis por la pandemia que ha afectado la vida de todos, a unos más que a otros. Cientos de miles han perdido el trabajo o han visto quebrar sus negodios. Pero la esperanza y el optimismo deben guiar siempre nuestras vidas y debemos tener presente que aún en las situaciones más difíciles hay posibilidades. Es— luché en la televisión decir a un joven que debido a esta situación se vio obligado a comprar cosas para revender— las. es como descubri el genio que tenía escondido para los negodios y me está yendo muy bien. Si no hu— diera pasado todo esto, yo seguiría igual que antes”, dijo. Es en estas situaciones cuando más debemos dejar aflorar nuestro espíritu emprendedor. Algunos consejos que pueden ayudar a esos peruanos luchadores que quie— ren o necesitan iniciar un negocio. © Supera tus miedos. No es sencillo empezar desde cero, pero hay que hacerlo. Lánzate. La valentía es como un mús— culo, que mientras más se ejercita más fuerte se hace. ©Busca algo que te apasione. Lo mejor sería que te de— diques a algo que te gusta, que te entusiasme, pues así tendrás el estimulo necesario para dedicarle todo tu es— © Analiza el mercado. Trata de encontrar una necesidad que no esté cubierta y ocúpate de ella. Debes tener algo que te diferencia del resto. Todo está inventado, pero tal vez en el medio donde tú te mueves no se dan los servi— dios adecuados. ©Estudia, asesórate. Hoy hay muchas páginas gratui— tas en internet que te dan asesoría para iniciar nuevos emprendimientos. Por ejemplo, en Tome tenemos el Em— prende Tome' y Bodeguita' que salen los lunes. ©Utiliza la tecnología. Debes tener presencia en redes sociales para hacerte conocido y ofrecer tus servidios o productos. Comienza con tus familiares y amigos y luego pasarás, casi sin darte cuenta, a otras personas. ©Cuida la calidad de tus productos. Es fundamental si quieres ver crecer tu negocio. Si vendes comida, tus insu— mos deben ser los mejores, así como la limpieza y el buen trato. Igual si vendes ropa y otros. Así la gente se pasará la voz y tendrás más clientes cada vez. ©Orden en tus finanzas. Debes llevar un estricto con— trol de tus gastos e ingresos. Es fundamental si no quieres que todo acabe pronto. Muchos negodios han naufragado por la indisciplina de sus dueños con el dinero. © Ten paciencia., Ningún negocio es exitoso de la noche a la mañana. Deberás dedicarle bastante tiempo y esfuer— z0, pero la recompensa, con un poco de suerte, puede ser grande”. Gary tiene razón. Me voy, cuídense.",2
1187.33,158.5,92.67,23.5,90.33,LUNES 14 DE SETIEMBRE DEL 2020,2
1201.63,954.96,65.93,27.7,88.56,Agradece a personal del 'Loayza' Soy un paciente que se atiende en el Hospital 'Arzobispo Loayza' y quisie— ra agradecer el buen trato que recibo de su,2
1170.14,1036.86,65.86,25.43,91.86,"personal de salud, en especial del médico",2
1189.33,1070.0,81.83,27.0,89.83,oncólogo Carlos Borrego Peche. Nos ayudan,2
1072.0,1106.0,67.0,23.2,91.0,en estos tiempos tan difíciles.,2
1278.71,1227.14,83.43,30.86,74.0,César Villanueva Paciente del Hospital Arzobispo Loayza”,2
1173.28,1391.02,59.13,25.34,88.81,"En su misiva, el lector nos cuenta que los doctores, enfermeras y demás personal de salud del Hospital Loayza' traba— jan muy duro y que, en su caso, ha encontrado un gran apoyo en ellos. Lo bueno hay que rescatarlo y desde acá vayan nuestras sinceras felicitaciones.",2
1358.75,2177.0,60.5,24.25,67.0,"Olnay — Teléfono: 311—6500,",2
2269.96,386.71,57.54,32.54,81.82,"Vizcarra, que a juicio de algunos e ee n te con este destape de los audios se ha enterrado políticamente y es muy difícil que resurja en el",2
2266.62,661.58,56.25,34.62,90.42,"Sin duda, hay que investigar cómo se ha movido el tren decida de Miran Morales, que desde el día uno puso y sacó ministros.",2
1799.8,874.8,130.2,38.2,83.6,Recuerda al gran Ribero ©ENCUESTA,2
1887.46,981.51,71.21,26.18,83.54,"© Días atrás se recordaron los 91 años del [H]©Eí j l nacimiento de Julio Ramón Ribeyro, uno _ ¿Estaríade acuerdo con lava can cia de los más grandes escritores que ha dado el £;2'oo""og:%…vzwmm Perú. Recuerdo que leí su cuento ”Alienación'",2
1909.18,1093.14,62.68,26.23,86.95,y quedé fascinada. Te atrapa de principio — AYER fin. Recomiendo a los jóvenes que lo lean. ¿Cree que el presidente Martín,2
2273.22,1190.44,86.56,32.44,59.0,Pizarra será sacado estevienes? 20% INO 80% * TROME.PE,2
1953.75,1212.5,99.25,27.0,70.75,F. Milagros S.V. fimisavi&hotmail.com,2
1810.17,1370.33,64.89,24.47,87.19,"”Alienación' fue escrito hace 50 años y tra— ta sobre la discriminación, que aún sigue presente en nuestra sociedad. También tiene un cortometraje que fue premiado en los Estados Unidos. Julio Ramón Ribero siempre será recor—",2
2111.86,1667.86,87.41,23.55,78.86,— dado por sus espectaculares obras. OEBEERGENCIAS Emergencias 105 p ] ud Águilas Negras Escuadrón verde 4276904 Luz del Sur 6175000 Semanal 3778000 Indecopi 2247777 Enel Perú ©ALO TOME,2
2247.5,1951.0,74.0,26.25,67.5,"CONSUL'DÁ LA PROMOCIÓN, AL:",2
2014.44,2112.21,50.29,26.08,75.94,"ee Impreso en la Planta Dando de Empresa ... Hecho el Depósito Legal en la Biblioteca d Editora El Comercio SA. r Paracas %… Los artículos firmados y/o de opinión _ 10405 los derechos reservados. e Publicidad: 708—9999, ..— Prohibida su reproducción total o parcial. — sus autores.",2
270.18,640.12,69.0,25.12,83.12,€» Alexi; Desg;alz_o contó que invir— ti todos sus ahorros para continuar con su carrera musical. ”Tuve,20
312.21,2547.86,60.57,27.07,83.14,"€» Vemos Hernández contó que el papá de su hijo (11), el empresario Carlos",20
1187.33,158.67,88.83,23.33,89.83,LUNES 14 DE SETIEMBRE DEL 207,20
821.1,412.03,67.68,24.61,85.35,"que ”romper el chanchito' y pronto estrenar mi nue— va canción titulada 'Que se joda”, una composición mía que está dedicada al desamor”, dijo. Además, comentó que está feliz al lado",20
783.91,632.52,53.04,24.43,77.22,de su pareja Shan— continuar tal y su hijo Lavan CON SU de dos meses carrera de nacido. (D. l e e ta,20
1314.75,604.0,58.25,23.5,90.75,contó que estos últi—,20
1292.56,653.78,56.67,22.22,89.67,"mos meses los pasa en Máscara (Piura), ya que",20
1264.5,704.0,79.0,25.0,89.75,todos sus proyectos queda—,20
1156.97,1335.53,72.28,25.86,89.14,"una posible vacancia. Presidente Vizcacha, ¿qué tiene que decir por lo audios de *Richitar Bueno, primero sor— prendido porque nunca imaginé que ese muchacho, al que contrata— mos para que se meta en el muñeco Muy",20
1278.2,1669.18,67.06,23.86,89.35,"de PPK, sería después una perso— na tan famosa y esos audios me parecen más falsos que los dien— tes de 'Chibolin” Pero 'Richitar' era su asesor... No, en realidad fue mi ascensor porque subía las cosas al techo de Palacio, pero después nos dimos cuenta de que enamo—",20
1281.4,1845.7,51.7,27.0,83.5,rara a los Húsares de Junto y lo C sacamos.,20
1268.05,1978.55,68.27,25.18,83.86,"A CONOCE ¿Es darte que ordenó cermml€mgmso” Cómo crees, a mí nadie me que debe cerrar es su boca, pobre la mas—",20
986.48,2362.76,58.78,23.75,86.73,"González, desde hace casi siete años no cumple con la pensión de su pequeño. ”No hay ningún tipo de preocupación de él ni de su entorno. Nosotras sí tenemos que ver de dónde conseguir dine— E a e Te evaden sus responsabi— alidades con decir ”no tengo'. Van a ser siete años que no pasa nada, cuatro años luchando con él para que",20
1219.46,981.43,65.08,25.86,87.41,I presidente Vizcacha (Miguel Moreno) puso el pecho y salió al frente para responder sobre el escándalo en el que está envuelto por los audios que con mucho ”Swing' están haciendo tamba— lear a su gobierno con,20
1801.62,590.25,81.12,26.0,90.0,proyectos están postergado hasta que termine la pande—,20
1768.12,688.88,63.0,27.38,71.62,"¿Y sigues soltero? Sí, soltero y felz. (M.CJG",20
1792.54,914.31,65.23,26.23,86.35,"carilla que usa, la van a llevar a un laboratorio para analizar el virus. Dice que no va a renunciar, pero poniéndose la mano alped|o, no",20
1931.32,418.57,61.93,27.73,74.61,"ron en stand by. 33 Afirma ”Aquí es más que allá tranquilo, hay todo poquísimo gente y es más e M la tran—quilg [ e e e de contagio del EF o _ RARRUNTO. Llego coronavirus son soltero embalada para contar— mínimas, igual mis",20
2267.56,757.93,64.19,23.3,87.84,"les los últimos cientos de 'Chollywood'... BRU— HORA dijo que seguirá viviendo en el norte hasta fin de año, pues aún la pandemia no se ha controlado y quie— re cuidarse para retornar con fuerza a Lima en enero. Buena... La con— doctora RIVERA compartió su secreto de belleza con sus seguido— ras, al mostrar cómo se",20
2079.2,1132.59,56.42,24.09,87.91,"piensa retractarse? — aplica botox en su ros— De qué me voy a tro desde hace 12 años. retractar si solo pien— Hummm... La actriz ANA— so en el Perú. El único — HIDE contó error que he tenido que estuvo bicicletean— es no decomisar los do por el Morro Solar, celulares antes de las pero como no tiene prác— reuniones, pero ahora tica se cayó un par de se ha hecho un barri—",20
1874.4,1435.47,62.03,25.0,88.47,"do electrónico, con decirte que el cuadro de Tapa Amar tenía micros detrás. seguro que le va a componer algún rap o valsedito... er? Ese no tiene ni una sola",20
1847.5,1573.0,70.17,25.0,91.67,"composición, las únicas letras que le",20
1783.36,1620.0,47.93,21.86,91.79,conozco son las que le debe a la dueña de la casa donde vive.,20
1698.25,1671.0,104.5,27.5,71.75,¿Cuál sería su último,20
1861.0,1692.0,90.75,24.5,77.75,"monsaje, per— e alanación?",20
1780.03,1874.16,62.59,23.72,91.05,"Bueno, mi mensaje es el de siem— pre, ahí va: Estamos haciendo todos los esfuerzos para combatir el coro— navirus, no me van a doblegar, esta semana sale el otro bono, no se abracen con sus familiares porque ahí está el virus y todos tranquilos hasta que llegue la vacuna, solo espe— ro que cuando llegue todavía haya",20
1579.26,2295.9,60.62,32.41,70.66,"le dé algo (de dine— que tiene más de ro), uno que no dio mil 500 premios y dos con sentencia E a judicial”, afirmó, 0 ie promoción y < OF recuerden que hoy galgo ( sol¡cia sa|lf_|||a 5Tegunda_ e o — — a a ee d e d; ”PUPITROME desd5?1ac8 7 años _ familias peruanas y Por otro lado,",20
1407.0,2525.27,60.45,22.73,90.09,Vemos invitó a los lectores de Tome a participar en nuestra,20
1812.91,2514.55,57.73,21.45,81.0,"d a tos que nos cae bien un dinero extra”, remarcó.",20
2257.5,1290.0,55.1,22.6,90.7,"veces. Ella se vaciló, pero lo malo es que terminó",20
2254.21,2079.15,63.44,24.97,85.69,"con una fractura en el pie y ahora tendrá que guar— dar reposo. A cuidarse... Me cuentan que ”PELU— E l s ie todas las 'pilas pues— tas', ya que hoy regresan a la pantalla chica con 'Amor y Fuego' por Willax. Muchos éxitos... MARIO HART y KARNA RIVA— MENTIRA estrenaron su reality 'Papás en pañales' y el primer capítulo fue el parto de Larita. Además, prometen que mostra— rán todo el proceso del embarazo. Esoco...TULA EZ asegu— ra que le encanta bailar y esa es su mejor forma de de se s tres arse y olvi— darse de los problemas. A mover las caderas... Aho— ra sí me quito porque mi amorcito quiere que esta noche nos jugue— mos una pichanguita...",20
320.85,2463.1,65.53,24.7,87.38,"(> doctores del dijo 'Melcochi— ta', quien anunció su regreso a los escenarios como imagen del restaurante ”Han sido días difíciles para los artistas, la hemos pasado feo. Poco a poco volvemos a la nor— malidad, pero sin descuidar las",21
1300.5,160.67,97.83,23.33,90.83,LUNES 14 DE SETIEMBRE DEL 2020,21
965.3,1224.65,61.22,25.22,87.59,"elly Reyna aseguró que está feliz porque es la nueva ”protagonista' del cantante Josimar, luego de participar en las grabaciones del próximo videoclip del salsero titu— lado Tú te la perdiste”, donde interpreta a una joven influencer a la que le interesan la fama y el",21
1034.76,1577.52,53.39,25.17,84.93,"”Ayer (sábado) cum— olí 26 años y me la pasé trabajando desde las siete de la maña— na hasta las 10 de la noche, grabando el nuevo videoclip de Cosima donde soy la protagonista”, con— tú la modelo y Miss Eco Perú. a a e a",21
1408.39,434.06,59.09,23.7,85.42,"trata mal, que solo me interesa su fama y dinero, y él me canta Tú te la perdiste”. Me siento bendecida de tener trabajo en estos momen— tos tan complicados. dos l mr y d ee",21
1402.51,1209.76,60.13,25.45,85.72,"OF muy grasoso no lo conocía y me parece un hombre humil— de, emprendedor, educado, me cayó muy bien. En su casa [donde grabaron el video) tiene un muro enorme que habla de la palabra de Dios y sí, hubo buena 'química” Durante la grabación estuvo su mamita, su novia y todo su staff. Tú eres la protagonista de su videoclip, pero la protagonista de su corazón, María Fe Salda— ña, ¿no se puso celosa? La vi de lejos, estuvo presente en toda la grabac¡on (s cercanía ni conversé con ella. eo cómo trabajan? No podría decir algo así, pero sí estuvo todo el rato. Dicen que Mostrar es medio flo— E a l eo e mdd!o” Súper amable sí, pero no, Muy bien, con buena salud, pero preocupa— da porque mi papito tiene tuberculosis, está mal de los riñones y lo escucho decaído. De hecho, estoy haciendo una nueva cam— para llamada 'Sin miedo, recicla y dona', donde reci— aclaremos prendas de vestir para donarlas, a fin de mes, a la casa hogar de niñas 'Nuestra Seño— ra de la Misericordia' y al penal de",21
1911.03,696.06,64.84,24.29,87.56,"© El cómico Manolo Rojas afirmó que se encuentra destroza— do tras la muerte de su hermano Carlos, quien además era su mánager, a causa del coronavirus. ”Estoy des— trozado, siento que una parte de mi vida se ha ido. Carlitos era más que mi hermano, mi alma geme— la”, comentó. Además, diversas figu— ras como la 'Chola Puca”, Marsella Zanetti, Desi Abajo y otros lamentaron su partida. (E.C.] [—]",21
2155.44,1521.69,65.32,24.97,88.57,"Mónica Cabremos festejo los diez años de 'Al sex— to día' y dejó de lado sus diferencias con Olenka Zimmermann para agradecerle el tiempo que estuvo en la conducción del programa. ”No podemos decir que 'Al sexto día' cum— ple diez años sin agradecer a quienes ya no están con nosotros... un agradeci— miento especial a Olenka Zimmermann, quien estuvo a cargo de este pro— grama durante 9 años. Aunque muchas cosas se han dicho en la prensa, desde aquí mi agradeci— miento y mi respeto temo para Olenka, quien fue la conductora de este espacio”, los 9 dijo Mónica duran— años te la emisión del 5 de conducción de aniversa—",21
2157.0,691.47,65.8,28.13,77.53,3% Dice que su hermano Carlos era su 'alma gemela” se lo llevo el coronavirus,21
1228.5,1905.67,77.0,27.67,89.83,influencer que lo Lurigancho. (D. Bautista),21
1000.57,2077.14,84.79,25.0,85.86,"medidas de bioseguridad. Tenemos que mantenernos alertas hasta que aparezca la vacuna”, dijo 'Mel—",21
1277.72,2237.69,56.67,26.61,85.81,"| ”La gente anda muy estre— C'í = IR | , sada, necesita y quiere divertirse sanamen— © El cómico Kike Suero te. Nosotros somos dijo que prefie— doctores del alma y re mantener su vida",21
1047.0,2341.5,62.75,24.0,91.75,la mejor medicina son,21
1332.6,2356.4,91.8,24.4,90.4,"sentimental en priva— nuestros chistes,",21
1451.2,2376.4,47.6,22.8,92.8,do y no desmintió los,21
1237.64,2451.21,61.61,26.14,83.46,"porque logramos rumores de que vol— vuelve a 105 robarle risas y vería a ser padre con su escenarios carcajadas al pareja, la bailarina para hacer [ e",21
1438.83,2551.67,46.0,24.0,80.83,”He aprendido de todo lo que me público gis. o E y,21
1521.57,2578.57,49.0,24.86,91.14,ha pasado y ya no quiero deta—,21
1992.25,2210.79,66.67,25.17,86.52,"liar mi vida sentimental, pero estoy en un buen momento, tranquilo y feliz”, señaló. De otro lado, afirmó que es un padre responsable. ”Siempre me he preocupado de mis hijos, todos mis proble— mas vienen porque i a 5 imposible. Pero ahora quiero hacer las cosas diferentes”, agre—",21
1991.0,2545.0,82.62,32.0,81.38,3% Cuando le preguntan si será padre nuevamente,21
220.67,497.17,158.83,71.5,59.67,o facial ©|AI Ífinálizarltr ru't¡img(del ….…3£'%%&2%'¿%%&%,22
271.2,641.2,48.4,30.6,46.4,e e ss u las yema side,22
913.0,520.0,85.54,37.46,49.54,ei rs Exfoliación l n de rostro ©A'demás:deue&rarllas d e e u eg,22
448.14,1203.29,235.71,126.57,51.29,oo E U IO EN L ROSTRO,22
396.09,1753.73,218.55,34.86,59.45,"pieza t adecuado si para l tu usaslnada]para(cu¡darltu|rostro (cosmetcmgllanc¡a(de Natura; ;expli— (ca(quellasipersonasiconteutisigraso;:son propensas:al o br||low¿seboxen1la|plel' png¡c¡palmente'en1las nariz, mejillasyfrente. ”El usojpro— l en gadoid el a unala||adallmpresc¡nd|ble]para|protegemos (delicoronavirus; puede&ontnbu¡ritamblen añade ell ]Ia(espec¡al|stñlnosibnnda isiguientesiconsejos:",22
1290.09,983.36,178.64,35.0,59.55,(©Npara controlarlellexceso(de1bntamb|én¡puedeslutllaan papel arroz. éSolo(colocalo(enclma (dellarzonatcon l gr asaz s m S unostsegundos&y¡retlran la,22
1528.2,1353.6,127.0,44.6,53.2,"í noche, luna(espuma¡suave(espec¡al|para(ell el Ge",22
1633.5,1504.25,210.25,42.12,51.5,"<2 MASCARILLAAplicate,.una ex fal i arite i una (o (dosivecesiporisemana (para redincirélttamaño dellosporos:",22
1709.88,1625.25,103.62,36.88,51.12,"(f_ a u e g e |punflcante¡paralm¡n¡maar¡|arapanenc¡a¡ (deslos,poras.,",22
1783.0,1957.0,127.5,41.75,45.42,£ SbTRATAMIENTONEntlamoche el ei ds el ra …0|es¡dad continuo |promuevellalreducc¡onlprogreisiva (de'laígrasatdellapiel!,22
1440.88,2204.5,88.5,41.0,75.75,For Boda _ Fideos con salsa de menudencia,22
375.2,2346.0,142.4,34.8,47.8,INGREDIENTES fideos: lee ] IPREPARACGIÓN),22
268.67,2500.5,179.5,36.5,56.67,"((exceptollasipatas) :dejpollo $110019r'de¡|amon picado .+a""/ncebolla &illedta:(desorégano",22
1063.43,2398.57,143.43,32.86,43.14,"Salpimientaydeja hastarquetsercocine, Com= l lAlrservm,¡espolvoet eem",22
2255.81,1835.53,104.77,30.81,48.55,"© Cuántasvecesihas miradita plato: A s ,guntado¡s¡l|oxque ea p ea test realmente tiene pesticidas, fue ¡otelipollofue ¡eriadoten el campoo en E e e ¡procesada: tal'día ¡que:comes, posiblemen— iunitrastormodella(con— ¡consiste.enllatobse— signior la comida:sana: estun:desor— es ei e Sittejpones'ajpen— es A es a a e E es a la tal 100% ¡porejemplo, haber:sido ima ni pu lado i con l las imanos'sucias. No:por— ¡queralgosea.orgánicova: (estarlb¡en,.puede(estar infectado por l insectos 0 mi'abuela:Bue— inotes:culantro; siempre l leer las.",22
933.88,158.88,111.75,25.38,86.62,24 (TROMECITO) LUNES 14 DE SETIEMBRE DEL 2020,24
1383.86,1068.43,66.94,27.22,75.78,"E ea a responde las siguientes: preguntas:. a — (.| le dio a Lupe E a el el B.Canasta.: a ESTE CUENTO AYUDARA w pita es una niña de 6 años. Ella estaba molesta porque A REFORZAR AUTOCONTROL ¡ J A no tuvo un buen día. Por eso decidió salir a pasear un TOLERANCIA A rato. Mientras caminaba por el parque vino una pequeña a m piedra sobre el camino, se incomodó porque impedía su a a a Ponte em acción! l — a ca_minando_, mísma piedra Su_(;8mín_(). Completa los puntos para darle forma al caracol. s Muy enojada, Lpita la pateó con más fuerza y siguió cami— Luego pintalo para darle mayor alegría.",24
1108.59,1533.96,53.32,25.64,82.68,"y nando. Para su sorpresa la misma piedra apareció una vez , | w V más delante de ella. Esto la enfureció e hizo que la pateara ) ml 22 | A M grítando: ¡No quiero volver a verte, eres un fastidio! i —— 1 |_ La niña pensó que ya se había desecho de la piedra cuan— V w — do volvió a verla en su camino, pero esta vez no la pateó y la 9o'oo““ produce: [ A ( ) miró fijamente, Es ahí donde escucha una diminuta voz que — … M A salía de la piedra. Se acercó un poco más y escuchó: a a a — Hola Lupita, pasaba por aquí y te vi enojada, por r 5 eso decidi acercarme para alegrar tu día. lujo sanguíneo. — ¿Alegrarme? ¿A qué te refieres?, preguntó la € Una sed r ] incontrolable, De pronto de la piedra se asomaron unos ojitos, des— pués un largo cuello y al final una linda sonrisa. í,1 gato Lupita se sorprendió y se dío cuenta de que realmen— ( esfinge es te la piedra era un caracol. Este animalito sacó una _| de origen: flor de su caparazón y se la dio a Lupita, quien sonrió ee a y se disculpó por haberla pateado tanto. El caracol le dijo que no se preocupe, que él esta— € Japonés.",24
596.0,2025.6,156.8,60.4,81.0,¿CÓMO SE ESCRIBE? — y,24
467.71,2310.17,70.29,24.17,90.08,"Etimológicamente la palabra deriva del verbo atorrar, que a su vez procede de torrar, que significa 'abra— ”sufrir sopor o embotamiento”. En países como",24
1026.69,1890.5,60.12,23.88,80.25,"2 t ir alegre La niña siguió caminando, pero ahora con una sonrisa en el rostro.",24
1012.12,2148.5,49.62,46.38,64.12,PORQUE | D] .J: || ¡' ¿1£¿)_5 1*,24
1493.03,2199.48,72.52,23.29,82.94,¿Por qué beber ” líquidos fríos rápidamente causa dolor de cabeza? Se trata de un — fenómeno conocido. como 'congelación: cerebral”. La sensación de frío en la garganta produce un aumento,24
479.69,2432.29,70.91,23.54,90.46,"España, Venezuela, Panamá y Perú significa pesado, necio, molesto. Y, como tal, puede referirse tanto a una persona como a una cosa, situación o fenómeno. ©Ejemplo: Pedro no quiso invitarme su tostada, es un atorrante.",24
1481.19,2412.12,53.44,25.5,86.5,"rápido y fuerte del flujo: . sanguíneo que va hacia el cerebro, y esto activa :",24
1496.4,2475.2,43.4,24.4,92.2,el dolor a través del,24
1503.0,2516.5,54.75,16.5,72.0,. nervio trigeminal. —,24
1962.43,2320.86,63.0,24.71,89.68,Gato esfinge Es de origen canadiense y su piel está cubierta en determinadas zonas por un vello muy fino y corto. Es el único gato que tiene glándulas sudoriparas. Los machos lle— gan a pesar 7 kilos y las hembras 4. Suelen ser bastan— te amigables con otros animales y le encanta jugar con sus e,24
1300.5,160.5,97.83,23.5,91.0,LUNES 14 DE SETIEMBRE DEL 2020,25
948.75,581.75,144.75,27.25,58.25,"—FRANCISCO CHACHI Y ,—",25
278.4,1382.7,54.9,23.5,87.7,"a Mientras mayor sea el número de personas que pasen por la zona, más posibilidades de que entren a comprar.",25
267.19,1757.94,68.12,26.94,87.25,Competencia. Analiza si hay otros locales del mismo rubro y evalúa qué podrías aportar para diferenciarte.,25
281.71,2103.29,54.07,23.86,65.21,"Seguridad. Recuerda que d e d tanto, asegúrate que el área et e d",25
547.53,2470.12,74.24,32.71,70.41,"HM MÁ$ durante crisis sanitaria, tu o A/ tienda se ha convertido en el | p AN",25
652.0,2505.0,109.75,36.0,63.25,lugar más confiable donde comprar,25
668.0,2542.0,88.6,26.4,85.4,los productos de primera necesidad.,25
690.8,2575.6,84.8,30.4,90.6,"Para seguir captando clientes, pon",25
1351.69,824.6,87.25,32.6,74.0,"d G VAGINA — chi (63) ysuesposaLeo— nora Leva dejaron su Buena vista. Tu bodega querido Huanaco para no debe estar en un lugar buscarunfuturomejorenlacapi— M M tal. Al llegar, decidieroninvertirto— escondlfio, na prefer gn a a dos sus ahorros y abrirunatien— que esté en una esquina o g dan ala quellamaron'Bodega Leo” ++ ”Nosiniciamos en Canto Gran—",25
1515.89,1074.03,90.43,40.08,80.41,"M P PA lugar muy alejado, asíque huancaínos se adaptan a los nuevos tiempos y están orgullosos e Al in na de que sus dos hijos sean profesionales gracias a su tienda Afirman que posa aBreña. Aquíy más",25
2224.11,1778.87,103.85,27.36,77.26,"gente, sabía que nuestros in— gres os iban a crecer no me equivoqué”, recordó Cochachi. Sinembargo, estos 36 años al mando de su negocio no han sido fáciles, pues lainestabilidadeco— nómicalos ha hecho pasarpordu— rosmomentos. ”Hemos pasa— do por muchos gobiernos, a ve— consolo alcanzaba para pagar el alquiler. Pero gracias a nues— tro buen servicio y granvarie— daremos salido adelante. Es que nosotros no solo vende mos productos, buscamostransmi— tir confianza anuestrosclien— tes,condecirlequeyanicuen— tanelvuelto”, dijoorquiloso. Gracias a su bodega han podido solventar las carreras profesiona— les jesus hijos Erick(29) david (23), quienesensimbolodeagra— decaimiento se han involucrado más en el desarrollo del negocioy, con la llegada de la pandemía, han ayudado a sus padres ingresar elmundo digital.Ahorallevanpro— ductos víadelivery a todo Lima. ”Tenemos página de Face— booky recibi mos listas de pe— didos, Esposa y yo alistamos las bolsas con los productos, Erick encarga del protocolo debio seguridad y David los lle— vaa su destino. Cada quientie— ne función específica. Que— remos ser la primera bodega tradicional online”, confesó don",25
1704.69,2512.88,116.81,28.54,80.81,"Francisco. en práctica siguiente: paredes y/o pasillos. Puedes colgar LafamiliaCochachiLeyva asegura Coloca una buenailuminación, carteles ponlos precios, descuentos queda logrado un buen equilibrio música agradable aromas y promociones de tus productos. entrelaexperienciadeventatra— placenteros entulocal. Incluye herramientas digitales de adicional la iniciativadigital, pues Sacaprovecho atusventanas, pago, como Yape, Plano Lukita. saben quees importante que sus clientes confienenellos. E",25
2271.5,2740.0,105.75,33.0,39.5,[p p em r,25
933.75,158.75,115.12,25.5,86.0,26 (CRUCITROME) LUNES 14 DE SETIEMBRE DEL 2020,26
