left,top,width,height,conf,text,page
346.0,119.75,123.75,29.5,31.25,[ es 2 Whatsapp:(951:665.767.,1
1374.14,777.0,206.71,107.57,53.71,f_ílE QUIE [LA FOI…I H ZAX”IUÚ ROMPO,1
1333.4,2242.0,105.0,36.4,75.6,RESPETARÁ SU E EVITAR JUICIO,1
1132.0,2470.8,200.8,94.8,59.8,SEE eu eo ¡ |,1
241.95,703.24,59.61,25.97,85.53,"G» Mackenzie Scott, la exesposa de leff Bezos, el propietario de Amazon, según la cadena CNN [Esta— dos Unidos), se convirtió en ”la mujer más rica de todo el planeta” Su fortuna asciende a 68 mil millones de",10
250.04,1667.14,116.49,28.57,74.67,"uedenserdecual— ui eres trato social, profesionales, mu— ch os con altos cargos, y susvíctimas sonsobreto— do lassumisas.Losacosado— res sexuales no para n ni en tiempos de pandemia ahora aprovechanmáslos medios digitales para operar, escon— diéndosedetrás de una falsa all María Teresa Rivera, psiquia— tray psicoterapeuta del Insti— auto Nacional Salud Mental Honoris Delgado—Hideyo No— guchi, explicóquelos acosa— d ores vigil a no a se diana otra personas in que esta locon— sienta. ”Tienencarenciade",10
698.75,688.89,61.78,25.22,87.64,"dólares y desplazó del primer lugar a Francoise Betten— court Meyers, heredera de LOréal. La mayor parte del dinero de Scott es produc— to del acuerdo de divorcio que firmó con Besos el año pasado. [<]",10
649.5,1509.69,115.38,37.69,88.69,"¿$Expertos afirman que buscan a las sumisas, no tienen amor propio, son narcicistas, fríos y calculadores",10
639.43,1835.65,103.78,33.43,65.57,"amor propio, pocaonulaem— pata haciamos demás ypo— bretolerancia”, señala. Aña— dique ”les dificulta manejar el estrés situaciones decon— fictor casisiempresoninse— gur oso tienen la autoestima ee A",10
369.8,2029.6,39.6,31.6,49.8,(* 0 o M sr,10
304.0,2521.33,32.0,22.0,49.17,116 um cine 41 en ell,10
655.73,2378.91,35.09,24.0,47.64,less el on i mo ei lEa o Ollivorz; 3 y,10
1196.5,157.17,93.67,24.83,91.17,SÁBADO 5 DE SETIEMBRE DEL 2020,10
1477.69,479.25,46.25,26.38,45.94,"18 uu in étdaradl, [Sn ll les d (e a ee eo ie s i ee",10
1064.25,934.5,253.25,53.0,74.75,—ÚTAMBIÚN EN PANDEMIA ©[U],10
1016.06,1713.56,127.59,28.72,80.91,"Además, sonnarcisistas, fríos, calculadores, muy hábi— espara convencer, seducir chantajear, y el 95% jesus víctimas sonmujeres. VENALAMUJER COMOOBJETO ”Losacosadoressa— l en de la realidad y tienen una mentali— dadpsicópata.Aho— rausanbastantelasre— des.Venalamujerco— mo objeto y soncazado— res de personas sensibles.",10
1098.67,2279.4,50.73,27.0,45.53,e 2 ese a ell ts 16518 ee| (t]monm|(>qniiuo] url eso el e ¡ndisitón: seis,10
1383.18,2290.35,63.06,25.88,87.88,"G$ hallado muer— to y maniatado en el depar— lamento que alquilaba para vivir, en San Miguel.",10
1579.48,2492.46,60.78,24.22,89.22,"La Policía encontró el cadáver de Iván David Cruz Pimentel (46) boca abajo en el segundo piso del inmueble, en la calle Los Girasoles Mz. A, lote 2. Familiares lo identifi— caron. El cuerpo fue internado en la Porque Central de Lima para establecer la causa",10
1429.0,2606.0,57.25,28.0,72.75,del deceso. [E. Cirilo),10
1786.75,402.0,131.5,58.0,60.75,] a gatitos Ag,10
1833.09,727.03,58.31,24.03,86.66,"G» abandonada y a punto de alum— bar a sus cachorros fue rescatada de la calle. La llevaron a un albergue en Ari— zona [Estados Unidos), pero perdió a todas sus crías.",10
2295.6,601.2,60.31,24.22,85.11,"Ella fue bautizada como *Georgia' y estaba deprimi— da. Sin embargo, encontró consuelo en unos gatos recién nacidos a los que pro— tele y da de lactar como si fueran suyos. ”Su amor de u a grande”, dijo una de las trabajadoras del alberque. [<]",10
2089.39,1026.59,65.15,24.39,86.34,"©Empodeérese. Aprenda a decir 'no' sí algo le incomoda. Observe bien el círculo de personas con las que se rodea. Osi sufre acoso sexual, no se quede callado y denuncie. Pida ayuda. Hable con sus familiares sobre el caso y acu—",10
2058.15,1621.22,88.37,30.81,77.01,"a E ee ta el Tienen mentalidad psicopática y ahora están Secreensuperiores y apro— US&I1CIO baStante echan sueltos cargos para las redes su byu gar las emocionalmen— te”, aseguró Ricardo Núñez, SEPA QUE... psicólogo delaClínica Buena— ventura y el Hospital de la So— 3 Pe(u, el acoso sexual — — ligaridad. se castiga con penas de —— Riveradijo que también pue— tres a cinco años denser a cosa das mujeres de sin y hasta ocho _ carácterfuerte.Advirtió que E en las familias dondesefor— ne entre 14 y 18 años 0 — man los acosado re s nose está en condición de promueve la igualdad entre subordinación. hombres mujeres, ymu— caos pueden habersufri— Vensusnecesidades abuso sexualensuin— afectivas, econó— fancify oadolescen— micas, paraganar— r cia. [Sonia Obre— R¡(|Z)Agl|?¿)á)£l¿%£2 gón) o &EN LA ESPALDA",10
2204.25,2073.5,97.25,56.5,85.25,Chapa a JC' por,10
2116.49,2296.51,60.05,25.7,86.65,"Q> Fue atrapado Jean Carlos Prez Espinosa (32), ”Loco JC”, quien era buscado por atacar con un cuchillo por la espalda a un fiscali— dador de la Municipalidad de Lima, en un operativo en Marzanilla, el 12",10
2079.21,2491.97,62.59,23.91,86.85,de julio pasado. Geison Ortega Áva— los acabó esa vez con una profunda herida en el hombro derecho. Detectives del Departamento de Lesiones de la Dirincri detuvieron a 'Loco JC' en el Cercado de,10
2061.71,2604.57,54.57,31.0,65.43,© — Lima. (M. Rores) [<] DETENIDO,10
748.8,351.4,358.4,84.4,44.2,"MESSIN MARQUAAJRÍS PORILAS, IUÁS©R¿IIWA&S—IIE s%£/é%%©©lwnñuw©",11
611.89,1970.44,109.33,35.33,38.33,i o r sls Imástgeritelioven (geritemueva) e y tetapateniBareelonatsinitiéndolomuchisi—,11
670.25,2426.0,113.5,34.75,36.0,oe l M e,11
1463.29,1832.43,171.43,53.57,42.57,e e o SINIRonald SEIFUEIDEIPEPA © ija9lábr?a's(fibílaé,11
1813.0,2417.0,47.5,30.67,37.67,u a a es s u,11
1756.5,2556.5,125.0,32.5,46.0,IInstagramigene: Ot [ es,11
2109.6,940.4,188.4,42.4,47.0,"€3 ” Rúbfe""nll']ñía;(edit0r“(enljéf'eld'el¡mr'&al (GeallEspañaysantigosuyolhacetaños: (En)",11
2166.31,2464.38,113.15,40.15,41.31,o a [ Nrovlt>) r ta Q$Rál&ifi'elñanz&á¡un'frñiáíI'(ejoribria[su& texcompañeros: quienteonfim$ querdejó:e! a ea a,11
1196.5,157.17,93.67,24.83,91.33,SÁBADO 5 DE SETIEMBRE DEL 2020,14
678.67,443.33,99.67,44.33,88.0,SE OFFICIALIZE CHOQUES ANTE PARAGUAY Y BRASIL EN OCTUBRE POR Y AYER SELECCIÓN GANÓ1—0 A LA SUB 20,14
265.4,1545.6,109.4,22.0,87.2,DUDA ANTE CROATIA POR PICADURA,14
765.57,1589.81,68.76,25.95,83.9,Lisboa.— A cerrar ventanas. Cris— piano Ronald tiene muy pocas chances de alinear hoy (1:45 p.m./ Espn2) cuando Portugal reciba a,14
1185.0,1556.0,75.0,22.0,89.25,IGUAL EN EL SCRATCH,14
761.1,1868.94,64.31,25.12,87.47,"Naciones. El técnico Femando Santos encontró a la culpable. ”Se diría que tiene una picadura de abeja, su dedo está rojo. Dudo mucho que esté al 100%”, señaló el DT. En la misma lla— ve, Francia visita (1:45 p.m./DTV—610) a Suecia. También Islandia recibirá (11:00 a.m/Espn?2) a Inglaterra y Dinamarca choca (1:45 p.m./DTV—612) contra Bél— gica. Ayer, Italia igualó 1—1 con Bosnia y Austria superó 2—1 a Noruega.",14
963.13,1667.07,50.47,35.47,84.87,Croatia por el Grupo 2 de la Liga de las ©©C© M E N ©S,14
1665.82,721.65,53.81,23.92,91.04,"e viene la pandemia del fútbol. La FIFA officialize el inicio de las Eliminatorias para el Mundial Qatar 2022, El ente máximo del balompié fijó los días de las fechas que se disputar en Sudamérica. Perú debutar el jueves 8 de octubre ante Paraguay en el estadio 'Defensores del Cha— co' de Asunción, luego recibirá a su similar de Brasil en el Estadio Nacional el próximo 13 de El profesor Ricardo Areca tuvo que reacomo— dar su agenda y ha anunciado que entre el 18 y 20 de setiembre dará a conocer a los convo— cados para dar los dos primeros pasos rumbo a alcanzar nuevamente una copa del Mundo. De otro lado, ayer los seleccionados del medio local ganaron 1—0 a la selección Sub 20 con anotación de Aldo Corzo.",14
1596.43,1140.29,79.57,31.14,87.86,"LA SELECCIÓN viajará, via charter, a Asunción.",14
1702.57,1325.61,84.26,31.78,87.87,"Lo complicado será traer a los que Juegan en Europa y devolverlos a sus clubes a tiempo”... Antonio García Pye, gerente de selecciones.",14
1580.55,1534.91,59.27,28.55,75.0,D 4 MARTA GANARAN C> Río de Janeiro.— La ley de,14
1720.21,1817.33,65.62,24.56,88.19,"la igualdad. En un hecho histórico la Confederación Bra— isleña de Fútbol anunció que la selección masculina, donde destaca Neymar, y la na, con Marta de abanderada, tendrán los mismos ingre— sos. ”Los premios y viáticos serán iguales para los plante— les mayores”, reveló el titular Rogerio Caboclo. Las diferen— dias eran enormes, ya que los varones llegaban a cobrar mil 600 dólares por jornada traba— jada y las damas solo 70.",14
2370.0,359.5,59.5,25.5,88.25,AVANZÓ EN MENOS DE,14
2216.22,673.22,48.78,24.09,87.11,"G» Novak Djokovic se metió por no ocasión a los octavos de final del US Open, tras vencer al alemán Jan—Len— nard Stuff por 6—3, 6—3 y 6—1.A 'Nole' le bastó una hora y 45 minutos para sumar su triunfo 26 en el año. Su próximo rival será el español Pablo Barreño Busta. G",14
2149.5,857.6,71.3,26.9,89.4,COSTÓ 100 PALOS Y FUE PRESENTADO EN ESTADIO DEL CHELSEA,14
2350.32,1239.54,40.61,24.11,76.64,es al Chelsea por 100 u e t in El chico de 21 años l fichaje más caro del actual mercado de pases y fue presen— tado en,14
2122.5,1739.5,117.5,44.5,53.0,A o CHUPE* ALEMÁN,14
2192.37,1940.85,58.37,25.9,85.59,"G) El exagero del Real Madrid y la selección alemana, Christoph Metzelder, fue acusado por posesión y distribución de pornografía infantil, Según 'Der Spiegel, la Fiscalía de Dusseldorf le abrió la causa, ya que habría pasado el material a una mujer.",14
316.25,446.0,36.0,24.0,35.0,Ro eo ie o,15
290.23,1522.5,63.41,23.76,88.08,"DEL SAQUE somos car— necita... MESS NO EXTRATERRESTRE. Es humano. Ríe, llora, renie— ga, maldice, patalea, perdona, se resiente, se enoja, se le pasa, va al baño y se le van los ojos como a ti y a mí. Se que— da en Barcelona porque no le puede hacer juicio al 'amor de su vida que le dio todo. Los días lo enfriaron, le trajeron cal— ma. Pero yo creo que la clave estuvo en las lágri— mas de su señora y sus hijos que le pidieron no marcharse. Ahí le movie— ron el el piso. La familia y la gratitud están por encima de cualquier buro fax o chequera. Sí, señores... YA ME CONTA— EL DEL RÍMAC” volvió a las andadas. Su nueva con— quita es una muchachita cuyo nombre empieza con J de Jimena. Tiene cuerpo de modelo, talla de vole ibo lista y con su buena chamba. Por ahora se 'escapan' por Monte— rrico. Dizque el arquero se ha enterado de que tiene sus cositas y por eso solo la pasa bien. Su dame que te doy. Rexuxa... EL ”TANQUE ROTO” anda en remembers con un vie— jo cariño. Se siente en la *Gloria' cuando se encie— gran entre cuatro paredes. Cuentan que ella fue quien lo ubicó por ”wWasap!, le habló de tiempos pasa— dos, le mandó su última foto y el amor. Dejando un día se ven. Asuuu... EN EL CLUB DEL FINAL DE LA AVENIDA JAVIER PRADO siguen sucediendo cosas raras. Botaron a todo el perso— nal de seguridad y no les dieron un mango, pero contrataron a la gente de una empresa cuyo due— ño tiene un proceso penal por ingresar a la fuerza al ”Monumental”. Hummm... A —3",15
976.89,2000.56,67.33,22.78,87.67,(21) 0 CAULO (38) ANTE LA SAN MARTÍN Z,15
805.6,2409.69,62.13,24.75,90.73,"Uno sobra. Roberto Mosquea debe elegir entre Martín Tátara y Jorge Cazulo. El juvenil anotó un gol ante Can— toldo [6—2lJ en la última fecha, mientras el experimentado, quien se recuperó de una lesión, ingresó en el segundo tiempo y dío dos asistencias que terminaron en la red. La decisión es complicada. El chico de 21 de años con buen presente o el uruguay de 38 que es el capitán de Sporting Cristal. El próximo miércoles enfrentan a la San Martín y ambos están aptos para recibir las indicaciones del profesor.",15
1156.6,1775.8,26.0,18.6,40.8,p ra a un. —.,15
1641.71,298.57,94.71,22.57,79.43,&DT PIENSA QUE TODOS LO QUIEREN TUMBAR,15
2119.31,442.34,64.68,24.86,88.84,"G$ Perseguido. El DT Angel Comienzo es líder en la Liga 1, pero no disfruta porque siente que hay ”fantamas' con los que debe lidiar. Ayer reunió al plantel de Universitario y expresó sus angustias. Primero, habría explicado que todos van a que— ser verlos derrotados. Segundo, puso énfasis en tener mucho cuidado con los árbitros, porque si te expones a amarillas puedes quedar fuera del cam— leonato por acumulación de tarjetas. Luego les aclaró que concentrarán desde hoy en un hotel de San Isidro y quedarían libres el próximo martes en la mañana. [",15
2101.07,715.43,84.71,35.43,90.07,ALIANZA LIMA HA MARCADO 9 GOLES EN 9 FECHAS Y SOLO GOLPEA EN MESA,15
2122.83,1102.26,61.16,24.47,89.2,"tención, en Matte podrás encontrar arque— ro, defensas y volantes de muy buen nivel, pero no intentes sondear por goleadores, ue por ahora los que más anotan son sus directivos. Alianza Lima ha marcado 9 goles en 9 fechas: Joazinho Arto (2), Carlos Ascuas (1), Federi— co Rodríguez (1), Alexi Gómez [1] l [1). Los otros tres los ”marcaron' en mesa porque les otorgaron un 3—0 del partido ante Binacional, que no se disputa en la fecha 7, ya que los juliaqueños no cumplieron con los protocolos de bioseguridad. Pero si hay deficiencia arriba, hay buenos negocios por ”abajo”. Altair Fuentes, a los 22 años, cruza— rá el charco. El Fuenlabrada, de la Segunda División española, compró el 80% de su pase y hoy viajará a Europa. El contrato es por cinco años y la idea del blanqui azul es mostrarse para en un futuro no muy lejano fichar por un equipo de Primera.",15
2217.45,1472.5,80.5,32.6,83.15,Estoy muy ansioso por viajar y dispuesto a esforzarme al máximo para lograr los objetivos e ee a Altair Fuentes,15
2131.66,1778.53,65.84,39.44,73.34,TABLADIEEA GOLEADORES 2 á'é |' JUGADOR Z © MESA A 3 JC. ¡X?SI?C% 12 def¡ende H la casquillo del A H Fuenlabrada . GAME es el delantero J. BALÓN 1 Heisson Martínez.,15
2113.0,1996.86,83.86,23.14,90.86,BOTARÁ A DEJA SI COMETE OTRA FALTA,15
1766.61,2368.61,66.66,24.25,89.28,"<D El castigo será donde más le duele. Jean Deja rompió el protocolo de bioseguridad. Se revelaron imágenes del chalaco comprando en un centro comer— cual con el uniforme del Binational y la directiva le descartaría cer— ca del 15% de su sueldo, pero con la advertencia de que si vuelve a incurrir en una falta sería despedi— do definitivamente. Trascendió que la Apreciación de Futbolistas no tomaría la defensa del delantero, pues considera que es un error injustificable.",15
1302.83,159.17,98.5,24.83,91.0,SÁBADO 5 DE SETIEMBRE DEL 2020,17
1088.36,447.86,119.29,30.21,78.0,"LacarismáticaconductoradetelevisiónKarenSchwarz, quienes semana debutó frente del programa'Modo nos muestra uno de sus looks favoritos.",17
786.7,1479.72,93.93,31.14,65.7,"rx_ VESTIDO xX Usa e largos ese marquesa e intensos. COLLAR b i oro blanco y dije de ue STILETTOS b e e ie transparentes. Enestaocasión muestraunosencolornude. MAXIBOLSO x Grandeyentonomarrón, es favorito porque ahípuede guardarse maquillaje, celular, zapatos i ese Ps Jeannette Marchara — Ginecóloga — CMP24371",17
1284.0,669.25,84.5,24.25,58.5,la perfeccióncon un look casual o,17
1335.0,2141.33,77.5,24.33,89.83,"Todos los meses, durante la etapa",17
2008.76,611.48,86.0,26.44,85.68,"¿Sabías que se puede saber si eres alegre, creativa o valiente con solo mirarte uñas? Continuación fijate qué forma tienen las tuyas y descubre más sobreti.",17
1892.92,1497.06,103.94,30.44,69.45,"Rectangulares Ovaladas Cuadradas XAlegres, sociales X Caracterizan Trabajadoras ymuyoptimistas. por ser personas Anhelos problemas analíticas muy naturaleza. Saben nosequejan, más e e divert irse sin E en olvidar se de sus TA pendiente jesus e ea amistades. responsabilidades. Triangulares Almendrados Creativas decididas.Asumen apasionadas. Son confiables.Prefieren retos sin medir las personas adorables a l que valor an el sentido _ antes de decir algo ee e ei de la amistad y lealtad. _ que no es cierto solo de hacerlos. Viven Siemprepodrás contar — porque dar bien con límite cadadía. e sea E",17
2057.62,2140.25,86.25,26.5,91.0,obligándote a usar más de 20 toallas higiénicas,17
1286.22,2360.01,78.19,25.27,88.03,"fértil, el cuerpo de una mujer se prepara para recibir un bebé produciendo una capa de tejido sanguinolenta en la cavidad del útero. Si el embarazo no viene, esta capa de tejido se desprende reproduciéndose la menstruación. Una menstruación NO es normal si: a menstruar antes de que cumplas 9 años o no menstrual hasta los 18. sangrado te dura más de 7 días o sangras menos de 2 días en cada Sangras con coágulos y en forma abundante,",17
2041.58,2346.69,84.86,25.12,83.67,en cada periodo menstrual. Gte produce dolores que te impiden realizar tus actividades normales y no se calman nico antiinflamatorios orales. Hay menos de 23 días o más de 33 días entre el comienzo de una regla y la siguiente. Que retira la menstruación en forma definitiva la esto se le llama menopausia) antes de cumplirlos 40 años. Ocurren sangrados extras entre uno y otro período. Presentas sangrado menstrual con mal olor.,17
1334.0,518.0,214.25,25.5,74.5,conductora LucecitaCeballos comentóqueniShirley Africano,18
1298.19,1313.03,117.43,26.4,76.37,"Gossamery Toledotienen amor propio al pelearpúblicamente porun hombrecito Jean Deza, quien tiene varias denupcias por violencia fa— miliar. ”Aestaschicas les falta amor propio, parecen fieles al castigo porque se han mostrado peleando por un hombrecito si fueseuntro— feo. Y realmentenotienemu— cho valor como persona por toallas denupcias que sele conocen porsusex— parejas”, dijolacolom— biana. ¿Estonoes normal? Enla vida no puede pelear por una persona, el amor no semendiga, no se pe— lea, noesunacompetencia, es un sentimiento que debe de flu ir y disfrutarse. Muchas personas las han critica do en paredes sociales por todo eso... Estamos untiempoenqueha.— bamos de lem poder amiento de la mujer, de su independencia y resal— tando crecimiento en todos los niveles, y este tipo de casos no son un buen ejemplo. Unosepreguntasi es en serio, o si es sacado alguna esce— nadenovelaocomedia, pareceincrei— blequeestoestésucediendo. El cambio debe empezar con ellas... Hay que saber sacarse a las perso— n as negativas detu vida.Lasde— nupcias quel tienedemues— tran que no sabe respetar a las mujeres. Porotrolado, Lucecitaco— mentó que sigue al frente de su programa Atrévete soñar, ”Hemos hecho algunas varia— coneen el programa estamos haciendo cambios de look, y claro, sin de s cuidar la ayuda social”,enfa—",18
1350.21,2248.48,58.0,30.48,80.97,tizó.(EC) o (D Shirley Arica aseguró que — ?¿Dice que _ haga un poco de memoria. Quien Gossamery Toledo ”no tiene se metía a la casa de él cuando,18
985.0,2339.17,55.44,25.28,90.5,nada de víctima!' y no cree en la denuncia por violencia física y psicológica que le interpuso al,18
993.52,2513.29,52.87,22.61,90.45,"”Eso no es cierto ... ella no es la víctima, la golpeada, la engañada, la 'cachuda' tam— poco es... No le he quitado nada a nadie. Que no sea conchita y",18
1256.0,2336.0,84.0,31.75,90.88,"expolicía no es la víctima, la golpeada, engañada",18
1566.81,2437.65,61.0,24.19,90.9,"estaba conmigo era ella”, acotó. En tanto, Fagaly Medina dijo que Gossamery Toledo le contó a uno de sus reporteros que le pidió dine— ro a Deja para pagar dos meses de alquiler del departamento en el que conviven y una cantidad de plata por la humillación pública que le hizo pasar.",18
1969.0,259.0,94.5,33.5,47.0,aclara ip )] relación,18
2181.48,1015.9,69.6,24.54,83.45,"4 )x,1|_ l a o €) Michelle Sofer dijo que ”todo está bien' con Giuseppe Benig— nini, luego que se especuló que Michelle, en el programa ”En boca detodos' Reinaldo Dos Santos comentó que habías terminado con Giuseppe. Sólo vi, pero todo está tranquilo. Trato de mantener mi vida priva— da en reserva para no cometer los errores de antes. Incluso Giuseppe apareció llorando enunvideo... No tengo nada que ver. Por otro lado, en América Espec— táculos, recalco que le está dando prioridad a su carre— ra y al spa que abrió con su hermana Chris. (C. Chévez)",18
2267.65,2052.1,56.78,24.04,87.05,"G> Rafael Cardozo afir— me que no se corre del matrimonio y la demora para dar el 'sí frente a un altar con ”Cachaza' es porque quie— re hacer las cosas bien. ”Mi demora es por mi deseo de hacer las cosas bien. Espero casarme el próxi— et ea cuando cumpla diez años de relación con Carol. Me gustaría una boda privada”, dijo el garoto, quien mañana es uno de los invitados de 'Mi mamá cocina mejor que la tuya' Por último, aseguró que el secreto de su rela— ción es que respetan sus espacios. o",18
2310.25,2504.0,51.75,28.0,92.25,que se casará el,18
2197.11,2560.22,67.56,33.33,91.67,próximo año y le gustaría que sea en privado,18
332.5,528.0,222.0,96.5,54.5,cosima W W seguimos,19
298.67,734.0,76.83,49.0,48.5,"y ( 7 _ÍA'AY k _,j",19
212.38,1149.5,272.81,40.31,56.06,"(de_qu 'tendnaplanesfde¿matnmo— inue…veúpareja¿,laljovenwa— life o“El¿puede!hacer&loque,le¿guste_contsum— (da.pero)nasotrossegmmoscasados¡por g1es¡axy;aumn0ftenemosplanes'de_dl— xvorc10muncamelhahablad0deesata epuede_casanmllwecesfesfcosa'de (elñy0) ixo! zk—:jmjnim'i ] t0¿y;n0¡mef1om— ”X (e$e1casa*ro]1[pojíg'l&¿fáo",19
1165.18,1197.27,357.45,41.73,48.55,"/A110mejor;s¡jperoesun&ema(quenannann_ t esurelaciónidepapasBamejorado? )N0ftenemosínmgunftlpade_comun*lca' (consumam 0seárecúerda.¡]os¡mancpmento.que) |ll s'Banalllegamuevmnentealaltar'eo'n [su¿nare1aíManaiFe£aldana,gdurantesum,— [Lat:nna.([0“&Bautusñaí): )",19
1795.5,486.5,151.75,69.0,58.75,dal con se jit o a $U Vra),19
1897.29,916.13,141.29,34.39,54.24,"*|La Rengi— Fo diotalgunosiconsejostaSilvia (Corne|o ee e TV (depar'tamento:de&su(esposm]ean Paull (Gabuteau, lolimportan= temes At l a tienentunihermo— isolbebé y seguro (de:su hijo.Si vuelven to i no están tema relac¡on¡mas(que1los¡pmtagon¡stas., indicóllacantante. &¿Siempre la apoyarás'como ILos(amqgoslestamos¡pararaconisejar;inoparajjuzgar. ¿Yquéleaconsejarías? icomoiélla(quiera. (D. Bautista) _ ©",19
1863.0,1316.5,205.0,56.25,46.75,"om 0 mpartante(e5(que¡seaífe'lw sóla(axcam1e'""a[qwera.",19
203.5,153.25,55.75,40.25,73.5,2 — (AL DÍA),2
462.09,1275.87,62.76,25.5,89.53,"i amigo, el fotógrafo Gary, se comunicó conmigo por WhatsApp para hacerme su pedido por delivery: cal— dito de pollo, bistec a lo pobre y manzanilla calientita para bajar la grasita. De pasada, se quedó conversando conmi— go, pues siempre me mantiene bien informada. ”María, hoy quiero hablarte de aquellos muchachos que transgre— den fácilmente la línea de lo que es correcto y de lo que no lo es, Muchas veces ellos aseguran que de malas experien— dias han aprendido pero, lamentablemente, vuelven a caer en lo mismo y, para mí, eso ya no tiene ninguna disculpa. Como dice una vieja canción: Tropezaron con la misma piedra”. Lo peor de todo es que no miden las consecuen— dias, no analizan la situación y parece que poco les importa hacerse daño ellos mismos y a la gente que los rodea. No les interesa ser la comidilla de la gente por sus escándalos y falta de valores. Creen que se ve muy bien Lucirse con dos mujeres al mismo tiempo o decir que me meto con este hm n bre para que me de mls cap nd ntos Por favor, qué dase de educación recibieron en casa y en sus escue— las. Si bien uno es libre de hacer con su vida lo que quiera, existen ciertos límites que debemos respetar. Esto va tanto para hombres como para mujeres. En estos momentos, recuerdo las palabras de persolas mayores que siempre dicen: ”El mundo da vueltas, si hoy estás arriba, mañana estarás abajo... Y el mal que haces ahora, más adelante lo pagas.... Nada más cier— to. Y algo que no entiendo es que esta gente a la que le gusta estar metida en la cochinadita, como diría una co— nacida conductora de televisión, tiene hijos que saben lo que pasa y que están creciendo con imágenes de padres y madres a quienes no les interesa nada, solo buscan divertirse sin pensar en el mañana. A ellos les digo que la verdadera felicidad es la tranquilidad. Por eso quiero compartir con tus lectores algunos consejos dirigidos a la juventud, para que sean mejores persolas y ejemplos a seguir: No vivas la vida loca, tarde o temprano todo pasa la factura. Busca la estabilidad en todo sentido. Llamás te sientas más que los demás, pues siempre se aprende de hasta quienes menos imaginas. No hagas a los demás lo que no quieres que hagan contigo. Siempre muestra respeto por las persolas. Puedes tener talento para algún deporte, pero com— aliméntalo con estudios. Para nadie es un secreto que quien estudia triunfa en la vida. Ten a tu lado gente que te valore de verdad y no per— solas que están contigo por lo que les das. Siempre escucha a tus padres, ellos jamás querrán algo malo para ti. Da una mano a quien lo necesita”. Pucha, mi amigo Gary siempre habla con la verdad. Me voy pensa— tiva, cuídense.",2
1196.5,157.33,93.83,24.67,90.5,SÁBADO 5 DE SETIEMBRE DEL 2020,2
1067.33,846.67,140.17,40.0,70.5,HABLA TOMIE Opina de posibles candidatos,2
