left,top,width,height,conf,text,page
845.21,2142.0,70.16,24.74,84.68,agradecimiento por su presente. ”La vida es mejor con tus seres queridos. _ Hong Kong. Unanse a nosotros saborean—,18
558.46,2193.92,60.5,24.35,88.5,"Disfruta cada momento con amor y felicidad”, posted hace poco el portu— qués, a lo que la modelo ha respondido: ”Mereces lo mejor, mi vida”. G",18
1314.1,2184.8,85.1,25.0,90.8,"do nuestra favorita”, publicó en Twitter el también comentarista deportivo.",18
2211.8,566.8,80.6,26.4,91.4,ARTHUR HEREDA NÚMERO DE PANIC,18
2216.24,763.84,65.26,25.58,82.16,"(D Llegado desde Barcelona, donde tuvo una agitada vída nocturna, el volante brasileño Arthur (24 años) fue presentado en Juventud donde llevará la camiseta que era de Mirale Pjanic. ”Jugar con un campeón como Cristiano es ME 1",18
2243.0,1276.5,51.25,24.75,83.5,CHIBOL DE 17 DELATARÍA HOY EN EL 1,18
2231.69,1466.63,46.89,25.91,88.8,"(D Con Luis Enrique volviendo a la banca y jóvenes como Ansu Fati, España visita hoy pm. /DTV—610) a Alemania por el grupo 4 de la Liga de las Naciones. En la Espn2] a Suiza.",18
2217.78,1911.33,70.22,34.56,66.89,VOLTEO PARTIDO YAVAI!ZÓ EN US OPEN a eo a,18
2237.57,2085.4,48.55,25.83,82.48,"(D os e u el Djokovic venció 6—7 [7/5), 6—3, 6—4 y 6—2 al británico Kyle Edmund y avanzó a la terce— ra ronda del US Open. El serbio, que suma 25 victorias en el año, enfrentará ahora al alemán Jan—Lennard Struff.",18
868.8,315.8,124.6,106.0,45.8,w j ko“ Il Iík?3,19
1084.25,483.5,78.5,68.0,51.75,o W _/1—k D,19
944.87,1125.17,135.4,29.17,70.1,"Programa MagalyTvLafir— me' presentóanochelade— nuncia que el esposo deFio— rella Alzamora, Jakin Lars, hizo contra Ricardo Zúñiga, el Zorro; por 'violencia sexual” el pasado31de Enestadocumentación, quefuetradu— cida del italiano al castellano, refieres un menor afecta do porel",19
937.6,1315.8,132.5,33.9,68.8,"drogada del 30 dejulio, cuando Fiorella, esposo y sus tres hijos disfrutaban de",19
919.61,1482.17,100.53,28.61,73.92,"sus vacaciones anuales. Como sesabe, el Zorro' estuvoaloja— do porcino meses en lacasadeFiore— lla, en Suecia, al cerrarlas fronteras debido la pandemia, pero estrecha amistad terminó después queen menor de15años reveló a su padre lo quele",19
966.4,1604.4,164.4,32.0,77.2,hizo aprovechando su vulnerabilidad y,19
874.92,1697.17,183.0,26.67,80.83,"embriaguez, pues anteslehabríadado abeberalcohol. También cuenta queen Zorro' habría amenazado por un mensaje de texto al menorparaquenodijeranada.",19
972.0,1804.4,122.2,32.0,64.2,"Posteriormente a este ingrato episodio,",19
958.0,1839.5,115.25,31.0,52.5,Fiorello borró susfotografías con,19
1036.88,1871.25,83.38,31.5,81.25,Única y posteó una imagen que de —,19
945.63,1971.26,87.53,24.11,72.68,"cía: 'Pedofilianoesunaorientación sexual”, que luego borró. En tanto, en su circulo más cerca— no, Alzamos contó al detalle el",19
1540.2,1297.2,87.2,34.4,46.2,inunda dance A a p,19
1523.4,1485.6,134.2,40.4,37.2,rr O] asur nei w audio de ve ced con es,19
1514.98,1822.27,77.82,23.81,85.19,"milia que ha marcada”. La denuncia contra el Zorro' ha procedido por el delito de ”vio— encia sexual' y se sabe que fue citado por las autoridades ita— lianas para que rinda su ma— nifestación, pues estuvo desaparecido por varias se— manas, sin embargo hace unos días publicó en su cuen— ta de Instagram una fotografía con el fondo del Coliseo Romano,",19
1303.46,2158.67,73.44,28.79,76.9,"doloroso momento que vivió fa— — en Roma. Alejandra Baigorria con— ”todo por ti mamita!. E /y t|nua pendiente de Además, la 'Gringa de 1 Ia salud de su madre, Gamarra' ya reapa— pues probablemen— creció en Esto es",19
701.6,2287.6,150.0,51.2,48.0,MI Inn?o.1 a m”w en i mano side,19
698.75,2546.0,85.62,33.38,85.62,Dice que está consciente e por segunda vez,19
1171.18,2431.42,68.95,24.21,90.47,"te no la operen por segunda vez, pero esto dependerá de su evolución. ”Los médicos no te pueden decir algo con— creto porque si retrocede hay que operar, así que debemos esperar”, señaló Alejandra mientras le extrañan sangre,",19
1689.0,2300.25,52.75,26.5,79.75,guerra' y contó que su mamá está n,19
1670.25,2408.5,66.25,25.0,90.5,”Sabe qué día estamos.,19
1623.61,2507.35,54.13,24.13,78.26,"Cada progreso mínimo es muy bueno. Es pasito a pasito. (3 a e e manos de Dios y de los doctores”, señaló. G",19
2233.0,832.46,65.9,25.57,86.41,"G> Joseito Carrera reve— la que conquista por el estómago y estuvo a punto de perder su restaurante por la pandemia. e E ta pasar mi negocio porque, en un comienzo, los ban más restringidos para poder atender. Al final, decidí perseverar, rein— ventarme, le puse más ganas y fuerza, para seguir adelan— te”, dijo Joseito durante la grabación de mamá cocina mejor que la tuya' enfrentán— dose a Melissa Klug. ”Conquisto por el estómago, con un buen ceviche y una jalea”, señala.",19
2152.33,1251.33,98.17,28.0,82.83,Y continúa trabajando con su restaurante,19
2245.3,1960.66,70.16,27.37,82.89,"D a e y ; | y Á?&%Óy a m El periodista Beto Ortiz (<9 viene evolucionando favorablemente al tratamien— to que recibe para vencer al coronavirus. ”El doctor orde— nó quitarle totalmente el oxí— geno porque su evolución respira— torta ha avanzado mucho. Todavía hay que espe— rar que baje la inflamación pulmonar pro— pia del Covid. Con suerte, qui— más esta semana Beto pueda volver a su casa”, escri— + e amiga Carla García. ”Entiendo que está haciendo ejercicios de respiración para que los pulmones hagan lo suyo”, añadió. [+] ordenó quitarle totalmente el oxígeno, pero todavía ”hay que esperar'",19
1227.67,174.78,87.22,29.67,73.67,JUEVES 3 DE SETIEMBRE DEL 2020 A EEE ¿y,2
203.5,153.25,55.75,40.25,74.5,2 — (AL DÍA),2
782.0,320.06,91.88,43.19,62.5,"] f,/ 7 TWITTER M—». .q 5]_F'['?Í_/£ lb l A E|L EXIIÍ© DE YAN A|L :gs&ég;gfoumpf¿u;í%g&gs",2
507.21,485.47,66.63,25.37,90.53,"i amigo, el fotógrafo Gary, llegó al restaurante por un lomo al jugo con papas nativas, amorcito bien graneado,",2
2294.14,452.29,66.57,32.0,81.57,"ser embajadora en Japón, a lo El",2
702.42,719.81,72.05,26.83,85.18,"roc o tito y, para la sed, una manzanilla tibiecita. ”María, leí R©£%o;¡o…odismo en *Emprende Trome”' la historia de Canal y me hizo re— GASTELUMENDI flexionar. Esta compañía peruana fue fundada hace más de cinco décadas por Fernando Belmont, quien en 1967 re— e. gres al Perú de Estados Unidos, donde trabajó en firmas E£&%%Am de cosmética, decidido a fundar su empresa de belleza. y Tenía 19 años y comenzó a vender sus productos puerta M por puerta. En entrevista con Trome, su joven nieta Danie— €m'“& la Aguirre Belmont, quien es parte de Canal, señala que HABLA la Ferr_1ando le decía todo comenzó ll la idea de dar a la mujer una oportunidad de que se quite el delanta! y — Preocupado por el futuro Lector pide ”hambre de gloria' —",2
1204.76,998.63,65.8,25.84,87.24,"pueda salir adelante, de llevar un sustento a su familia, de ser independiente económicamente, y por eso les propuso <9 La pandemia del coronavirus nos ha €) Las eliminatorias al Mundial Qatar 2022 [H]©V y ser sus impulsados y vendedoras. Hoy Canal está en golpeado tan fuerte que hay recesión arrancarían en octubre, si es que no ¿Aprueba la labor de la ministra de diez países y ha pasado de generación en generación. Esta — económica, despidos masivos y falta de hay cambios de último momento. El técni— Economía, MaríaAntonieta Alva? historia es aleccionadora y debe ser vista con mucha — empleo. A esto se suma el pésimo mane— co Ricardo Areca ya sabe cuál es la base de AYE|R atención, sobre todo por los miles de peruanos empren— — jo de la situación que han tenido nuestras . su equipo y necesita ver a otros a jugadores.",2
1012.15,1170.32,67.62,26.66,83.98,"demores que inician o tienen sus propios negocios, chi— — autoridades, Veo con mucha preocupación el —— A estos últimos quiere pedirles que tengan _ ¿EtádeacuerdoconqueVicente _ cos y grandes. Te dejo algunas frases e ideas que Daniela — futuro del Perú. : de Caballos sea representante del Perú compartió con el público de Trome: o“¡o_ow O'La transición digital es uno de nuestros mayores retos, E A INO 60% también algo de lo que estamos muy orgullosos porque todo Vecino de Pueblo Libre —** el equipo lo está llevando con la mejor disposición'. En estas",2
1233.14,1397.34,62.83,24.55,86.77,"El coronavirus ataca en todo el mundo. Este Para las fechas iniciales de las 2020 habrá una caída fuerte de nuestra Eliminatorias no contaremos con el economía, pero se prevé que para los próximos _ capitán Paolo Guerrero. Está demostrado es una forma de que muchas personas salgan — dos años el Perú recupere su senda de creci— que el juego en equipo se impone a las adelante, una linda manera con la belleza y el empodera— — miento. Todos los peruanos debemos poner individualidades. El 'Tigre' Areca debe formar — sombra miento de la mujer'. Un emprendimiento es importante por— — optimismo. un cuadro sólido.",2
514.59,1331.96,68.89,23.96,91.63,"épocas en las que se debe mantener la distancia social, es fundamental adaptarse a los cambios y hacer uso de la tec— nología. Quien no evoluciona, desaparece.",2
713.79,1575.74,74.58,24.44,87.39,"que da la posibilidad de tener independencia económica, de EMERGENCIAS mejorar la vida de esa persona, de su familia y de otros. Bomberos G'Los pequeños negocios deben tener claro su posiciona— om los miento de marca y qué quieren lograr, definir la estrategia Defensa Civil para atraer al cliente y estar atentos para atenderlos'. Es— Salud 4118000",2
1062.48,1685.52,74.1,26.0,86.24,"establecer objetivos, el público al que quieren llegar y siempre Águilas Negras 3623277 darle la mejor atención. Escuadrón verde — 4276904",2
1118.08,1739.5,71.75,21.5,90.58,mayor valor que buscamos transmitir a nuestros co— Luz del Sur 6175000,2
718.59,1857.1,79.64,26.11,85.23,"labradores es el espíritu de emprendimiento, el luchar por lso;apa'_ % sus sueños'”. Hay que ser siempre optimistas y valientes. S Jamás rendirse ante los obstáculos. El fracaso es parte del éxito, porque se deben extraer enseñanzas de él. P G'Aprendan de finanzas y habilidades blandas, hoy lo ©ALO TRO…Ó puedes hacer por Internet porque eso les ayudará a llegar ú%%%%£…oo“",2
515.86,2007.17,72.97,24.62,89.31,mejor al cliente y no tener pérdidas en su negocio'. Muchos emprendimientos con buen futuro fracasaron porque los li— eres no tuvieron un adecuado manejo del dinero y gastaron,2
1487.71,2060.86,52.71,22.29,59.14,Director —. Contenido elaborado _ Fac 3116353,2
1147.83,2092.14,83.11,32.67,78.58,"sin disciplina. Se puede comenzar con un curso básico de fi— ie a ta L2gmf'¿¿o,,ífg“¿o&fo,&if&… =;m: $$áo,&o%3¿í""&%““o nanzas, para así invertir de forma inteligente”. Qué buenos Carlos m€a%ár e… Los artículos firmados y o de opinión",2
1502.83,2155.57,63.37,34.33,68.07,"consejos. Me voy, cuídense. Espinosa — No 171 la Victoria _ 10005 105 derechos reservados, Fleay — Teléfono: 311—6500. —— Publicidad: 708—9999, —. Prohibida su reproducción total parcial, — susautores.",2
535.2,337.2,46.0,22.2,39.2,"7 © 2 adelante ,(duo*",20
1391.75,267.5,12.25,13.75,43.5,u a y E,20
1265.22,369.44,189.78,47.11,47.22,"f a.) . Av¿;,_yí.1'¡M¿/ alehabucalGranda Cf>'Tony55úcear,gganador(del[G'ramyll!at|no lanzarátsuldisco:",20
943.65,636.0,149.3,39.45,56.6,"C> los¡manrevelo,(en ellprogramafModo) l e ee x e |ESPoCÍBCU|05""G€» Karen &nEáModol£spectamloo porque ¡s1¡s(dls€o £Schwarzg(quelt1eneiplad¡p¡que¡5e(casara(conxsu wlhoy|podre ¿Mestio” ) nov¡alManalFex esti",20
534.4,1495.6,147.0,90.4,44.2,_030 C m UC así,20
447.2,1859.6,141.8,37.4,62.6,3 orque_su ály;i]Wñllaf adaopor[elífu bolust»aíl!u¡s/&d',20
345.8,2019.7,171.3,44.6,49.7,")masfque¡sangrar xynque5me deje.cmao [Nosxefn't“e]atnpsigue1éjteanallestátapqyah,: (¿ib1aí$hewla¡yque1es e e o f'E—os;)á'sie]11to l",20
1720.5,828.5,179.25,28.25,53.75,$Sheylatestmraífuerarde!¡Estas(enfñ > (das;1p(mu e,20
1779.67,1007.17,154.0,33.0,50.33,(¿Ese¡fldmbol aTalqpmejla] jparaíquees (cansemre k e¡commucha.,20
1642.25,1150.0,313.5,54.75,51.0,"ía> (c4£síllceholaof,;*£urfalsuwen |p:e]¡feotat&bíla'boye;áo (ella)y)hemos!llegadofatun¡acuerdm",20
1079.53,2375.76,134.56,33.76,50.91,"© Giúllia'n'a' cuando“empezaba(en*ellmune e o a a a a e e poaridos; .c6nbtidos1productoree4peroíle,s(puso .e| parcher |Noíselo[en(el mundo ítodosllos¡traba]os'hay(acosadore9Wo oe 2 (en'dosroportun|dades'tuve, a s ee g s (dos|preductores(que no) E pena(dec|risus1nembres|porque tatestatalturatdellawida,ya” e feranteasadosyiyolunatehibola,ftenía",20
1598.33,1571.0,34.83,27.83,38.5,( t o in os E,20
1590.77,1811.69,169.23,34.62,60.92,"(tena(de¡¡&morw¡ ífuego(qu&en[el(cercana!a¿&d' viíncula> if¡noiloimegq,, pen0¡sab¡a(que!so llo Lena amela— (c10n(de¡padnes[can¡ jjasall!e't?enga¡cam— a queria",20
1653.56,2463.44,226.78,37.56,58.33,'detaI|esqpara15u(conc¡ertomrtual_que;se |rea||2ara |Estoy muy_emoc¡onada |puesideléjmeses&volVere i 'escenarlo*|Nofsera1lolmlsmofs¡n pero)mueroxde.ganas por,20
2217.04,812.89,146.18,32.07,56.07,"©$g KOLA, Ml ( BRRRUW'I'O ítarles'lastultlma5(de ”Chollywood'... $9…lcumplelhoy(60 t abril est y ¡contólque estájpasan: 3 3 LLA madre(de ¡puestella publi— ¡cówideosentsusiredes socmle5(dond61aparecen ,Juguetones Manya ¡Diablito”, l'(le1mandotsaludos(al (MWIAWÍNCUUW E sombrero:porque *esimuyibravo”Asuu... 3",20
2247.44,2201.0,104.29,29.79,51.85,"porque (eliV|deocl¡p(de sitema a e a grabó con'suiesposa E u tacercatalimillóntde wisualizaciones. EM IPORCENEA: por, fin ireveló,entellpro— quell at duena desuicora— ¿zóniestunaljoventde;22 a ] xy(Gl$lldebutan¡con g a eo s Somos fuga porque:mi amorcito estállisto:para jugara lobo",20
271.85,2505.85,77.15,31.85,90.69,pide a vecinos que los apoyen porque músicos no reciben bono del gobierno,21
1304.67,160.67,96.67,24.33,91.0,JUEVES 3 DE SETIEMBRE DEL 2020,21
875.2,1564.92,104.35,25.9,80.64,"arla Tarazonaconfir— mequetieneunarela— ción formaronelempre— sariochinchano, Rafael Fernández(43), con quien haformado'unafa— milia' y dijo que no responderáalos luego que enel programa Ma.— galyTV:Lafirme, unablogueracuestio— nósuromance y la lla— me exvedette' Karla, felicidades portu nuevarelación... Bueno, sí, loque severo se pregunta, tengo unarelación formaron Rafael... (Interrumpe Rafael) Estamos juntos, yo la amo y nos quere— mos un montón, lo que pasa es que queremos proteger a mis hi— jos y los hijos de Karla, porque no soy un personaje público. Noso— tros ya formamos una familia y no queremos exponernos. Karla: Exacto,nos van a ver juntos porque somos una familia ynote— nemosnadaqueesconder. Rafael",21
1362.31,1612.78,111.2,27.0,75.15,"d el ee me s, una señorita... Noleresponderéabsolutamentea nadie, colonos importaloquenues— tras familias piense n ysientan. ¿Tienentiempojuntoso es recien— [ Tenemos una bonita relación, co— mo tiene que ser ya estamos bien grandes parajugar alosenamora.— ¿Tus hijos cómo lohantomado? Mis hijosestán felices, sus hijos, fa— milia, todostranquilos. En verdad, lo que digan metienesincuidado, acálosúnicos protagonistas somos él, yo y la familia, no tenemos pape— lesparalosextrasnipararelleno.Es un momento tan valioso bonito que lo guardamos para nosotros. Rafael Hernández es un empresa.— rio dedicado al rubro de alimen— tos, hijo del dueño de un laborato—",21
1246.18,2291.53,66.67,24.57,89.7,"re spet a mucho rio clínico y amante de las motos. Enel programa de Fagaly habló (C.Chévez) El cantante Jim eg Malo contó que Ala en estos tiempos de Sí, pero veo que algu— pandemia tiene que nos vecinos llaman ingeniárselas para tra— a la policía y botan bajar y ahora canta en a los músicos de los las calles caracterizan— barrios... que los apo— do a Héctor Lavo. yen, ningún músico ha ”Me aparezco como recibido bono, benefi— Héctor Lavo con mi dios ni nada. Nosotros equipo cantando en llevamos alegría y las calles y gracias a guardamos el distan— Dios no he tenido pro— ciamiento, no blemas. Soy de barrio y molestamos a",21
1095.0,2577.5,67.0,24.0,75.0,el barrunto' me respal—,21
2117.71,788.16,65.3,25.22,87.73,"© Judith Bustos, 'La Tigresa del Orien— te', agradeció a Dios por haber vencido al coronavirus y espera reinven— tarse para salir adelante ante la crisis. ”Me encuentro mejor de salud y me van a dar el alta médica. Agradezco a Dios porque he podido superar esta terri— ble enfermedad para seguir con mi familia y fans. Ahora estoy viendo cómo generar algunos ingresos porque no podemos hacer shows. No solo este virus nos afecta, también la falta de trabajo”, dijo. (E.C.)",21
2209.5,1031.0,66.67,35.67,71.17,queya se siente a de médica,21
2197.21,1698.77,57.39,25.17,88.31,"”Es un picarón”, dijo Paloma de la Guaracha sobre Javier Yaipén, luego de ser ampayado, por las cámaras de 'Magaly TV: La fir— me”, saliendo del hotel con una jovencita. ”Javier es terrible, ese hombre es un picarón. Ahora qué le habrá dicho a su esposa porque ella está en el norte con sus hijos. A mí me pidió videos, fotos, es un mujeriego y mañosón, no va a cambiar”,",21
291.81,598.43,67.29,24.67,89.67,"© Así el trabajo consuma tu tiempo, no debes olvidarte de las muestras de cariño. Besos y caricias fortalecen una relación.",22
1185.17,158.5,91.83,24.5,90.83,JUEVES 3 DE SETIEMBRE DEL 2020,22
1024.38,565.77,52.88,23.77,91.54,"© Si algo te moles— ta de tu pareja, La honesti— dad es esencial en una relación, así no sea agradable lo que tengas que decir.",22
1873.45,556.73,60.68,27.0,80.36,"© Cuando tengas que dar tu opinión, pri— mero escucha y luego dices: 'Entiendo que.. lll que..' (no uses un a E",22
1224.74,1017.02,65.95,24.02,90.79,"Ramos también explica que es fun— amental que las parejas valoren su relación y lleguen a acuerdos sobre concebir. ”Deben conversar si quieren o no tener hijos y respetar la decisión que se tome”, añade. Para ello, es importante acudir a un",22
1752.78,978.43,69.24,24.43,90.31,"médico para saber nuestro estado de salud a fin de elegir el método anti— conceptive ideal. En Impares existen diferentes canales de comunicación (llamadas, WhatsApp y página web) para tener la información clara. Es esencial que en ambos casos se acceda a la información que existe sin miedo al qué dirán.",22
1720.43,1207.71,52.71,22.57,90.29,"mar su partes por su nombre, sin",22
1697.71,1238.29,65.57,25.14,90.14,"miedo ni tabú, incluso esto los protegerá",22
743.5,1406.0,232.25,34.5,55.0,a +ES IMPORTANTE PREVENIRLOS,22
469.0,1899.93,76.7,24.43,89.7,"durante este periodo de confinamiento los servicios de planificanción familiar y el acce— so a métodos de anticoncepción quedaron relegados, ocasionando el aumento de los embarazos no deseados en adolescentes (12%). La médica ejecutiva de Inppares, Cima Ramos, explica que para prevenir un embarazo no deseado es importante que los padres tengan una comuni— canción clara y directa con sus hijos sobre el sexo. ”Desde pequeños debemos acostumbrarnos a lla—",22
778.93,2425.78,57.23,24.58,86.85,"INGREDIENTES PREPARACIÓN finamente ajo y colocarlo rebanadas de pan En una olla verter el vina— sobre el pan. Salpimen— gre y el azúcar. Cocinar tar a su gusto. Llevar el pan +Aceite de oliva ea +1 diente de ajo la mezcla se haya redu— ja y dejar que se cocine por n sido a la mitad. Verter un 3 minutos. Agregar al pan +V taza de vinagre poco de ese aderezo y un _ salido del horno las reba— edta. de azúcar rubia chorrito de aceite de oli— nadas de palta, las hojas de +8 hojas de albahaca va sobre ambos lados de albahaca y el tomate corta—",22
652.59,2574.35,55.24,28.59,79.59,4+ Sal y pimienta al gusto — las rebanadas de pan. Picar — do en rodajas. Salpimentar.,22
1741.5,1289.0,85.5,25.25,90.33,"de violaciones. Además, hay que brindarles habilidades sociales para que puedan empo—",22
1839.6,1513.68,69.09,23.81,89.6,"dejarse y formar un proyecto de vida”, señala. Los padres tienen que hablar y aceptar que sus hijos pueden usar méto— dos anticonceptivos y eso no es ”echarlos a perder”, sino hacerlos responsa— bles para que puedan cumplir todas sus metas a futuro retra— dando un embarazo.",22
1243.83,2207.67,141.17,41.0,58.83,AV Ia tl _ Tostadas mediterránea,22
2257.14,1827.63,67.08,24.78,88.5,"(D M_arcial, de 50 años, prestigioso matemático y catedrá— tico de una universidad española, tiene todos los grados académicos, incluido un doctora— do. Iba a dictar una conferencia, en la cual trataría de demostrar un teorema que tenía años sin resolver. Acu— dieron profesores de la universidad, alum— eo el id los participantes esta— ba don Pedro, su viejo profesor de matemáti— ca del colegio, quien le enseñó a sumar y res— tar cuando Marcial era Al final, no se pudo demostrar el teore— ma, pero quedaron satisfechos, pues en la reunión hubo mucha ciencia e inteligencia reunida. Una semana más tarde Marcial recibe un e—mail de su profesor en el cual le da la solución al problema que nadie pudo resolver. Marcial, muy emocionado, le escribió agradeciéndo— le. Finalmente le dijo: 'A pesar de todos mis títu— los y grados usted sigue siendo mi maestro. ©",22
335.5,822.0,276.0,56.25,48.25,(el|uso)(dexvent¡ladores e [pac:entesch* corenavirus;,23
1233.33,826.0,221.22,34.33,62.33,recomlendatcontar¿con1um púlsio> )x¡metro (en(casa]para*detectar(a ítlemp01una1h|pox¡a[[falta*de[&n(qge |no]5y¡prevemr(en(casos(extrem ) (ell lusolde¡vent¡ladoresimec,23
1214.75,701.75,180.0,50.5,61.0,ntellastaltasitasastdetcon: ltag|o'de.coronaVlrus se N,23
1182.57,1168.57,237.5,39.0,62.07,"'dlsp t|v |parec¡dolaluna¡gan' ho lunos(segundos(saldra'(emnumeros eo gfeno[entel[cuerpo.o) lAllmsertar'el[dedo)(el(ox¡metw'em¡- londitudestdetonda' 'de¡luz)II!01que¡busca(es'Ia1hemqg, ie moleculatde¡protema 'en1Iaisangrelque¡transporta(ellox4- persona'en1buen[estado",23
1642.17,806.25,294.67,38.75,57.33,tienetuntniveltdezsatura: (c|on[entre£96¡y¡98jpor(aento*lPero* 55|[es!menor¿aí924se¡debezawd¡r¿de; mmed¡atoxal hosp¡tal' ”Sitelwadlor (está )y(entoncestse) procedezallatenb.¡baaon¡paramnb— |aaon|mecan¡cal¡mas¡va¿.;sostlene. XW|IN¡DBZI]JeÍeIde1UMM(de1Cu¡dado& IIntensnvosidellhosp¡tal?2(deleo*,23
1601.8,1230.3,184.2,33.7,61.5,"1, Elderly I|mplos'S|n(esmaltesinl[unas 3 IDebes]prensar¿|a]p¡nzaten(el| (datorderecha: 53 ILa]manoldebe¡permanecer (estable, (dara|unaffalsallectur&",23
2151.36,682.79,221.93,40.93,55.14,"(> Doctoñ¡productoxde) Ia]pandemla,¡me(des(estoy[endeudadoxmn(el lbancoxdeb¡doía¡un(cred¡- Rot ( E |puedo[perdeñm¡“reh¡culo? (cQue¡puedolhacer”' lh]pnmero(que¡tlenes* (que1hacer¡es&recumñalla¡ ¡para' |reprognamañtus¡dagos*",23
2179.5,1107.0,154.33,30.67,57.5,10 n|paralofrecerle¡un¡ (ofreci oxde¡pagoma¡ e (deudoñpagañlaítotal¡dadl,23
437.07,715.2,54.53,22.67,86.73,"quiero hacer un viaje a un país lejano, uno que parezca un rei— no encantado.",24
353.83,939.83,66.43,25.66,89.4,"Debo decir cómo he de viajar. Tengo varias formas, solo debo optar. Me cansaré mucho sí uso bicicleta, tal vez sea mejor tren camioneta. Quiero que mi viaje sea divertido. No tomaré subte, menos colectivo.",24
1185.17,158.5,91.83,24.5,91.0,JUEVES 3 DE SETIEMBRE DEL 2020,24
2132.85,778.75,67.58,31.9,63.19,"W A E eg un oo““%““;“e“ que sale en esta página y Ó“Bequeoo'e?¡m responde las siguientes a a mva oca x aca“oó“ lan 1 . moo““ E!ugg la palabra l ] a ) m“o siguente frase. la (pag“$ú Dice la araña Anaclete que andes en:. . A. Patin, e £ Bicicleta. a E! palai)ra",24
1068.27,1176.71,77.1,31.27,70.49,"Y ivoy por mar, ¿cuál será mejor? a . p / /camalla tiene una a a ee o N — ep a p con mas ea Sin duda sería una gran emoción. © Positiva. . Hasta en helicóptero podría volar, m",24
337.37,1374.32,59.37,26.11,88.84,"sería la forma más original. Podría ir en tren, los hay a montones, y conocer gente en las estaciones.",24
377.94,1487.38,49.12,23.0,90.44,"Si subo a una moto, casco me pondré. Pero soy pequeño, no sé si lo haré,",24
341.3,1576.2,79.1,26.4,87.6,"Pensándolo bien, puedo yo viajar, de un modo distinto, espectacular.",24
327.17,1667.0,62.08,24.83,85.58,"Sé que llegaré al país deseado, ese que parezca el reino encantado.",24
340.81,1786.25,71.0,24.38,90.44,¿Cuál será mi medio de locomoción? El medio más bello: mi imaginación. Fin. Autor: Liana Castillo,24
483.9,2388.9,66.87,23.86,89.96,"El concepto de canalla se utiliza en nuestra lengua para referirse a aquella persona que se muestra ruin y miserable en su accionar y trato para con los demás. Normalmente la sociedad desprecia a este tipo de personas, es decir, aquel que es considerado y cali— fijado como canalla será despreciado. La palabra entonces tiene una absoluta connotación negativa. Ejemplo: 'No seas canalla y devuélvele a Pepe su dinero”.",24
1358.71,2108.65,45.62,28.26,78.82,: ] | ¿Por qué los hombres | tienen mucho más vello W )/K[) 7(K[) H [ que las mujeres? Los ra 1 hombres no tienen más _ vello que las mujeres. Lo ©,24
1476.64,2285.76,57.44,25.76,86.96,que sucede es que los hombres tienen el vello más grueso y pigmento gracias a la hormona de la e a las mujeres tienen vello,24
1491.22,2464.44,72.89,25.11,92.0,En realidad tenemos la misma cantidad de vello corporal.,24
2206.67,1475.11,104.0,24.89,72.67,( el hormona: A. Testosterona.. B. Estradiol. C. Progesterona.,24
