left,top,width,height,conf,text,page
1025.93,1808.41,64.41,24.19,91.22,"de primera necesidad y otros alimentos en espacios abiertos como cerrados, y así evitar el contagio del tema de desinfec— ción con luz ultraviole— ta y puede",5
554.29,2130.29,141.57,51.71,89.86,Ven caso de racismo de Martha Chavez,5
690.46,2388.18,65.32,25.04,83.75,"a a g n tarea Martha Como se recuer— nes racistas que van Chavez [Fuerza da, Chavez indicó contra las personas Popular]. que ”por sus ras— de rasgos andi— La acusa— gos andinos, el nos, la Comisión de ción contra exprimir Vicente Etica del Congre— la fujimo— Caballos debió ser so programó lista fue ARLETTE — nombrado emba— para hoy ver presentada CONTROLAS dador en Bolivia y el caso que por la legis— ee el involu— ladora Arlette del Perú ante la OEA'. La era a la Controlas (No sesión empezará a las 9 parlamen— Agrupados). de la mañana.",5
1499.68,1766.02,64.81,24.26,87.26,"ser empleado incluso en ea s con funciones de un robot mesero. ”Va a ser teleope— lado desde un centro de mando; entonces, se hace la llamada telefónica, el robot reparte y quien maneja todo puede ser una persona con discapacidad o que presenta condición de obesidad”, contó Enri— que, [S. Obregón) G",5
1472.0,2100.0,108.0,26.0,75.75,&NO ACEPTÓ SU INVITACIÓN,5
1434.17,2203.83,186.17,60.83,89.17,Pizarra hotel a Comisión de Visualización,5
1482.83,2504.81,70.61,25.47,88.17,"Mediante una car— €$ ta enviada al presidente del Congreso, Manuel Meri— no [Acción Popular], el mandatario Martín Vizca— rra informó que no aceptó la invitación hecha por la Comi— sin de Fiscalización, que dirige Edgar",5
2298.33,1784.33,39.08,23.0,51.75,"¡posto;, i lta 2 fovenes;, ¡ elijo ep sul es p ell",5
2234.1,2349.76,64.2,24.44,88.21,"Alarcon (UPP), para comparecer por diversos temas, entre ellos el caso ”Richard Swing'. En la misiva, el jefe de Estado adjunto un informe elabo— lado por el Ministerio de Justicia y además preci— só que no tuvo ninguna participación en la contra— nación de ”Richard Swing' con el Estado. Agregó que la política de su gobierno se caracte— riza por la transparencia y se dará toda la información que se pida.",5
355.8,583.2,320.6,112.8,63.6,Este lunes sale el Pupitrome”,6
410.81,1002.97,81.53,27.25,83.58,"papá” siempre piensa en su fiel legión delectores, so— sobretodo en estos mo— menos complicados, y poreso lanza nueva promoción el me' que llega con el más debil no Nueva promoción tiene más de mil 500",6
699.7,1165.8,91.3,43.0,80.8,"500 premios, quedan des— premiados de hasta 15 mil soles",6
1196.5,157.33,93.67,24.67,90.33,SÁBADO 5 DE SETIEMBRE DEL 2020,6
1794.0,284.0,85.8,24.2,74.8,pe $/500 peL pia 04/09/20,6
1709.83,361.5,59.75,14.0,83.58,NOMBRE: AMANDA ESPINOSA DISTRITO: BARRANCO No DE LA SUERTE: 5695813 E 5,6
2165.86,524.86,43.29,27.71,86.86,"de S/ 15,000 jos de S/ 5,000",6
2074.2,585.8,80.6,34.6,67.1,"LABRAS: 5 premios de S/1,000 í$7XLRBR¡XS 15%0 ei S/ 100",6
1743.67,960.0,100.37,28.0,75.59,"olvides que es completamen— tegratis. Complé— talaron las palabras quesaldrán has— publicadas talos15mil so— hasta el sá— les cont antes y so— bado12de se— nantes. 10 Primera Llenas cuatro cartilla reclá— palabras ganas mala este lu— 100 soles;con cinco nes7desetiem.— palabras, mil soles; brecon compra con seispalabras, 5",6
1695.25,1268.5,75.62,21.0,84.62,LA SUPER LLAMADA mando al 710—0260 o en,6
1659.21,1583.39,59.25,26.65,83.52,"E nuestra web [trome.pe). Malagma o £ de la suerte” quedate e A de la portadal, DNI 5 mn|| S©MGS y teléfono fijo y/o celular, de 6 de la Mañanas domin— — mañana 4 de la go y tú podrías ser el — tarde. afortunado que lleve a sus Cuando los relojes mar— bolsillos los 5 mil soles quen las 5 de la tarde constantes y donantes del — se conocerá el nombre semanal' de la — del ganador, siempre ”Súper llamada ganado— — bajo la atenta mira— ra'. No te quedes da de un notario",6
1651.44,1852.38,56.0,28.12,70.62,"l l na público, quien cruzados y otorga la participa en el legalidad, a el ee",6
1572.75,2032.0,103.75,22.0,89.5,LUNES POR FACEBOOK LIVE,6
1879.6,2574.0,58.53,23.6,91.33,"lunes, desde las 11 de la mañana vía Facebook Live, tiene un nuevo invitado. Se",6
1502.78,2586.22,58.67,26.0,79.78,(? Trome' apo— ee luchadores y por eso este,6
2263.53,951.46,81.02,25.42,84.68,"labras, el premio mayor a MASCARILLAS Si ganaste, solo deberás llamaral934—147—102 (Aló para que coordine la entrega de tu dinero. Puedes hacerlo de 9 de la mañana a 6 de la tar— de, de lunes a sábado. También te informa— mos que la segunda car— tilla saldrá el lunes 14 de setiembre y la tercera el lunes21desetiembre.",6
2286.29,1563.53,62.71,24.73,75.0,"E ee No olvides que tus posi— habilidades de ganar 0 d ee e ea e es t sorteo de mañana todos los diarios registrados desde el lunes 31 de agosto al domin— go 6 de setiembre. n ea Amanda Espinosa (5896813, de Barran— co) ganó los 500 soles.",6
2260.23,2300.3,68.87,24.79,88.99,"trata de Carlos Armando de La Flor, gerente de la paste— sería Maria Almenara, quien dará excelentes tips. ”La calidad, la atención y la tecnología son importan— tes para fidelidad al cliente”, señala. Remarcar que ”es vital estar en vitrina, usar las redes sociales ayudará a darles más exposición”. Además, no faltarán los mejores tips en el 'ABC Emprendedor' y se pro— emocionará pequeños negocios en ”Yo Te Apoyo Emprendedor”.",6
1302.83,159.17,98.5,24.83,91.17,SÁBADO 5 DE SETIEMBRE DEL 2020,7
1071.55,452.91,34.18,27.55,44.09,of e (e el a ta los coquiésoo ell a ell,7
724.5,629.5,33.0,24.5,48.25,un [Al eques [(),7
558.64,793.82,106.27,36.18,90.64,recrea a los personajes de con empaques de cartones para huevos,7
252.0,1243.67,310.67,105.33,64.33,Esculturas delkChnayos y elan la hora,7
665.91,1738.08,63.05,24.56,87.86,"on empaques de cartones para huevos, — trato de hacerles todos Ever Rodríguez Prado crea sorprenden— — los rasgos correctos para que me tes esculturas de los personajes de 'La — salgan igualitos”, comentó. vecindad del Chavo del Ocho', en un LO FELICITAN taller de mecánica, en Puente Piedra. Por redes, Ana Mimarla dio a conocer Este padre de familia hace las figuras para su arte a través de videos, que ya tienen que, al término de la pandemia, los cientos de vistas y 'me gusta” niños se tomen fotos con el 'Chavo' y ”Ese es el ingenio, creatividad y don divino de los peruanos para ”Tengo una pequeña de seis años y sé crear y recrear cosas. ¡Felicidades!”, que los niños la pasan mal, pues no le escribió un admirador. pueden salir. Busco alegrarlos”, dijo. Ever también ha hecho al vaque— Hace cinco meses Ever decidió dar rien— ro Woody', de la película animada da suelta a su creatividad. ”Siempre *Toy Story”, y figuras de elefantes, pumas y perros. [Jordan Arce)l _ © SEPA QUE...",7
654.85,2041.0,67.77,26.15,90.69,ver más de su ingenioso trabajo pueden ingresar a su Facebook Roger Rodrí—,7
667.5,2103.83,63.94,24.72,87.17,"juez Prado” Las figuras están rellenas de botellas de plástico, retazos de madera y tela que la gen—",7
640.17,2268.83,175.33,51.17,90.67,Condenan a funcionarios de Félix Moreno,7
273.17,2343.0,46.5,27.33,83.67,G» A cuatro años de cár—,7
703.75,2342.5,39.5,23.5,91.75,Se trata de los,7
657.26,2482.51,68.25,24.88,86.74,"cel condenó el Poder excelentes Andrés bles de colusión y Judicial a cinco exfuncio— Villarreyes y Daniel uso de documen— varios del Callao, que Bellido, y los tos falsos, para se desempeñaron en miembros del favorecer con la gestión del senten— — 'Comité Especial Perma— una obra de 179 criado gobernador — gente 2012 David Medina, mil soles a una regional Félix Jacqueline Murga y Manuel empresa contra— E Torrejón. tista. [<]",7
854.44,157.33,102.89,28.44,83.78,8 — (ACTUALIDAD) SÁBADO 5 DE SETIEMBRE DEL 2020,8
1906.54,258.62,85.85,27.54,84.69,"ANUNCIA MINISTERIO DE SALUD (> El doctor Luis Suárez, contra el coronavirus y",8
1120.16,367.16,106.88,49.64,72.36,"A ”l | viceministro de Salud _ est &$g¿""'o“o—o» a a perímetro de pulso vacunados a Te da Información valiosa sobre tu salud durante un",8
1968.88,502.0,109.88,48.25,78.12,a QUE EL EJECUTIVO CONTINÚEN MEDIDAS QUE NO,8
693.5,588.25,50.62,23.25,86.62,El oximetry de pulso o pulsioximetry es un,8
778.8,659.2,70.52,31.08,81.6,"dispositivo electrónico para medir el porcentaje de m(iqena_dón de la sangre en los seres humanos, el Vizcarta: ¡¡':hay 3 …$' las células puedan realizar (",8
1288.46,843.58,60.46,24.92,88.54,"+Desde la región Apurí— mac, el presidente Martín Pizarra solicitó a la ciuda— daría no bajar la guardia ni dejar de cumplir con las",8
964.61,1116.8,61.75,24.86,83.64,"medidas de bioseguridad para frenar el avance del =' A 22020 ”Todos debemos sumar en En el caso de Lima u otra En el caso de Puno u otra — La función principal de este esfuerzo, ya que aun— ciudad a nivel del mar*. ciudad en altura.*. ea e ese transferir el oxígeno a está cerca, aún faltan la sangre, lo cual es meses para tenerla... No s ie podemos bajar la guardia”, l señaló el jefe de Estado. Pizarra cuestionó que algunos irresponsables sigan fomentando reunio—",8
1847.71,1444.71,70.18,55.41,62.88,depende la nosot|rc35 © AFI RM A QUE to la Con U ese E [ HAN RELAJADO,8
572.29,1905.12,74.54,37.62,59.0,"Noches (4.1|… … fec etra side ¡'f_f,j'5í' a l V y y a a Fuente: New YoricTumes / Dr.Juan Cargos Infectólogo César Barrico / Diario Trome.",8
303.8,2092.8,61.0,54.0,58.6,[F] KM [… UNO i,8
361.4,2336.0,65.2,24.0,54.0,"|un1|nlñumm,!|um es less cito en",8
441.12,2445.25,52.5,27.75,46.25,"a Ilu(dnf ” (cxu1uiua o Iull,(uhnnto(** la talk",8
438.5,2518.0,49.5,22.5,51.0,(m)nmlrmlm 0 ell ell,8
113.75,288.0,157.0,36.75,62.0,"(dejpersonas;itodas:mayo— reside (edad, ¡durante:el",9
435.1,375.3,188.6,31.8,54.0,n at empresa |a|pandem¡a proceso: A wenderáivacunas;yalque Todas*se'apl¡caran¡gratu¡- ¡Además;fue claro:en itodallajproducciónimun= tamente”acotó.,9
642.2,499.8,51.2,53.6,30.0,e o ee i ay,9
1297.94,908.36,163.58,37.85,49.11,"Medio a a [[GMP] (C|ro]Magu¡na,, (cuest|onokque. (desdere! E|ecut¡vo sse¡senalezqueúestamos(en¡ latetapa'Tinal della e tsenafracasadoenilalbata— els e pl a eo tallas hanttomadotenilasúiltimas, e E S (decirquetestamosienilateta— largo 'estamosien1la detona maratónillamada' 19:Estotacab; lat mitad i del próximoyafio, (cuando¡salgailakvacuna (Cu¡— (dado, yya(que]mucha[gente. note asimedidas: ssamtanasis¡!' E talertólque,(entalgunosises; ¡toresidelL¡ma Jmucha1gente yya1no*esta¡usando)mascam— G] igual Ios|protectoresñ”ac¡alesxenrell lalbroma, l te glendo l cuando l usan (elitransporte¿publ¡coxy ssegu¡r¡hac¡endotcampanae (de¡prwenc¡onton prie; basimolecularesgy(a¡slarlos…",9
1237.56,1981.75,225.81,38.62,62.94,"(agr /As¡m¡smo (cntlc queilasfautonda' (desicontlnuentapl¡cando med|dasique,fallaron[en¡la prlmera|partelde late uar en e |Nolse]puedelsegwr' xwl¡zac¡on'dellos(dommgos tresxdom¡ngosfs¡m ssal¡r,,(el(gob¡emoxdebeímfon maris¡lestafunc¡onando*;s¡l hay4resuItadosjpos¡tuvos!o) no…md¡co",9
869.38,2417.66,162.84,49.44,54.5,"|Ib|en1|a|proxma| |mos|paralalgunos¡meses. rela1en(con1lostu¡- Ibr:eal¡zacg>r;|¡de¡prue- |rr;&s'deágrxgnvwencf¡a'cgu <dagos:jy(d |g|ol%uellta% — May©s eran?a55 'chlna([delllaboratono) (eltexministrotde&Salud,, — Iper©((de em©s — /AbeliSalinas: — (con1los[traba]os'detcon_ Portalimotivo, hizo ea u ea $emreal |Stas (debemosiserirealistas;, e — (enfermedades.",9
1709.65,862.24,183.1,37.55,54.29,"|pa¡s[ edana partir 'de|11lde(octubrg] ea ítokquejse1debemalt0marfuna a f|ntde(este]mes 3 festquelsetconfimatntdes: tenso[emlosxcont»ag¡es* £s|necesanoxque[los¡p¡lo— ítosgylazafatas¡pasempon |pnuébas&moleculares'lmlen' ítrastque(a1los¡pasajerosfse | ea hacerfun[sggu¡— lMagu¡na [ EE 2 miinistra(de: (Comerc¡olEx.tenor¿y)ñunsf ima;, 'que]para(dar¡ml ""0Xa1laf ase Atdellatreactivasiónteco |m1ca%emla(que.&vo | e 'en1laszc¡frastde(contaglosw |muertos|por(£w¡d'í© ee g1¡01a(conoeer. .que¡se]planlf¡cafabmrf 3 íteraszcomaquellosma¡ 3 'en1|guallcondlc¡on ¡dándo> Ile]pnondad(ataquellostque .conformanllaMl¡ama(del a nuestro>, .cuentan(conlun1bonadon ¡gundad(que:acataran1la9 Jo&5!llderado]por'el",9
1733.6,1642.4,80.0,31.0,48.8,lM1n¡st 06 (e ne (Gomunicationes;,9
1623.25,1817.75,126.5,47.0,49.5,'del»5alud)y&se& [tor4pnvado uu ee,9
1721.15,2425.38,125.23,34.23,48.38,ep ¡presidente MartínWiz= .carra]porlhaber¿dado |un1mensajetdemasuaeo e e ea .quetestanamosxen1la 'etapafflnal (dellajpande— (,9
2170.36,939.25,152.42,38.86,51.81,"o ds P? y si es segura (> LU.m(e's.tuñibld ¡fundidopes ps Ilaxvacunatc0ntra(el((?ov¡d'519) tdesarrolladateniRusiamoha' |provocadoímc¡dentesfadven ¡sos¡y£s¡tgenera(ant¡cuerpw ítras;I051resultados¡prel¡m¡na' eo e e ie (quelllevat omb) > putn¡k&V¿lagrego'[ell linfonme, esfsegura…losfantl— (cuerpostcontra lat enfermedad $se[generaron[af%1(d¡asfde taplicadallafinoculación l o )zac¡onlMund¡al(de]laí—$alud [[©MS] S OF a ©",9
