left,top,width,height,conf,text,page
593.29,122.43,85.86,30.29,46.0,S a e _ Whatsapp:(951:665:767 — ©tromepe,1
1746.57,845.79,89.0,36.64,83.61,”Yo renuncio hoy día y mañana qué van a decir todos los titulares: renunció y ella es la culpable. ¿Y Mirian? Ella es la campeona de las mentiras...”,1
1238.0,1798.22,305.56,120.78,44.78,n ER%%%ILAN MRD%ILREES'ÓL|%L7% QMWIIWENI©EWA PRES[¡DEMFE £ 258 I%&SII E'ROWÁCA&©I&,1
1396.0,1911.5,178.0,84.0,44.0,E$(C£MDÁL. ID)E — RELA,1
1187.33,158.5,92.67,23.5,90.17,LUNES 14 DE SETIEMBRE DEL 2020,10
854.14,302.86,102.43,38.57,83.71,Trujillo solidario viaja a su tierra para,10
798.1,449.8,113.0,37.8,88.8,seguir apoyando a necesitados con dinero y canastas de víveres,10
262.25,628.25,83.25,25.75,80.0,&LE DIO 300 SOLES,10
489.86,1334.77,90.64,37.77,88.73,Extranjero dejó un momento su trabajo para rescatar a víctimas de derrumbe en el Centro de Lima y su jefe lo botó,10
437.38,1578.75,122.0,50.5,68.5,su ee g celebraron su día en casa,10
241.29,2014.65,65.41,25.84,88.24,"En casa, con €9 actividades como recorridos vir— tuales, dibujos y películas, juegos de mesa y videolla— madas, se disfrutó la Familia El Parque de E eg ta virtual a su Granjita Inte— activa con conejos, cuyos y gallinas, ovejas domésticas y de Somalia, las caritas alpi— nas, vacas, cerdos, alpacas",10
184.15,2449.23,69.62,24.0,79.77,y pony. Hubo actividades para afron— (6 £ body—baile y en Facebook Plastifigu—,10
697.35,2301.55,72.76,25.22,85.67,"plastilina. Juntos ”Compar— eu el mejora la comu— nicación, autoestima y fortale— ce los vínculos afectivos. Disfruten juegos de mesa, cine en casa con canchita, cocinen juntos, vean álbu— mes de fotos, bailen, y animen a los que están lejos con video— llamadas”, dijo Juan Pablo Castro, psicólogo de Mapíte. (e",10
1488.47,646.86,87.22,25.1,78.22,"Tiburón eljo— ventrujillanode27 añosquehacomenza— do a overpopular por sustos de solidaridad, nobuscaimitaranadie. D a mantiene el anoni— mato, niega tener fi— nes políticos y su misión es seguir ayudando eco— nómicamen— tenlos más ne— cesitados. A ve— cesion 200,300 0 400 soles, lo que salga de su bolsillo y co— razón. Hacernos días, un nue— vo video del personajes",10
1174.57,1569.43,180.29,57.43,88.29,Continúan bajando casos de contagios y muertes,10
1043.1,1841.8,52.8,24.6,85.08,G» E mantier_1e el des— censo de cifras de fallecidos y de infectados por coronavirus en el país. El Ministerio de Salud [Min— sa) informó que se elevó a 30 mil 710 el número de decesos y el de contagios a 729 u E lpl que en las últimas 24,10
1079.58,2492.67,45.58,24.17,35.83,Canjeo i a resilate!l cle Ibos e a es E| [Plemo ss,10
1462.95,1843.54,67.14,24.03,90.76,"horas se registró 117 fallecidos y 734 nuevos casos de infectados. Sin embargo, aún hay 10 mil 122 personas hospitalizadas, de las que mil 448 están con respirador artíficial. Rusia confirmó que su priori— dad es inmunidad",10
1417.43,2506.57,47.57,22.86,45.71,"men! e E ls, A unvesz, ell",10
1844.83,719.83,87.5,34.83,59.83,i Tiene viajes progra— e i,10
1914.0,848.8,68.8,29.2,78.8,O_Ha recorrido las calles —,10
1882.8,886.0,54.4,24.0,91.2,de San Martín de Pobres,10
1830.0,921.71,41.0,20.86,83.57,— y el Cercado de Lima para,10
1793.91,1179.36,169.41,28.55,75.23,"volvió viral en Facebook y TikTok. Enlasimágenes aparece juntos Angelo Torrelles, el venezolanoqueperdió su trabajo por socorrer a los atrapa dos en el fatidi— coderrumbedelCentrode Lima,dondeunhombre falleció sepultado. ”Eltrabajabaporellugar, salióaapoyartraslospe—",10
1852.57,1947.43,62.17,23.91,85.57,"a toda América Latina con su vacuna Sputnik V. Seña— la que están aseguradas 100 millones de dosis para Brasil y México, y que esta semana firmará acuerdos con otros países. Perú tiene el ea",10
1925.0,2531.17,40.33,25.17,57.0,el S os e — ©,10
2216.41,835.03,159.83,29.56,68.97,"didos de auxilio y lobo— taron.Ledi 300 soles y se emocionómucho. Tenía ganasdellorar”,.contóa Trome. Estasemana, Tiburón Li— ma' dejarálacapitalpa— raviajarasuciudadnatal, Trujillo, y seguirregalan— dodineroycanastasdevi— ver esa las personas de la calle. ”Quierorecordar mi infancia. Depasomeen— contraréconmis padres mi hermano. Ellosestán orgullososdemí”,dijo. LAGENTELECANTA Agregóqueeligióeldis— fraude escualo porque sus amigos le dicen quees un tiburón losnego— (s ”Mededicoalcomercio electrónico ymevabien. Empecéhacemenosde unmesconestainiciati— va.La gente sorprende por la cantidad de dinero quedo creo que por eso mehehechomásfamo— so.Cuando meven, mepi— devotos y hastamecan— tan 'mami, qué quieres, aquí llegótutiburón”, dice entrerisas.",10
2206.75,1502.5,113.5,22.0,84.0,&HOY PUEDE SER CENSURADA,10
2175.2,1638.8,146.8,51.2,84.4,Ministra Alva cruza los dedos,10
2238.95,2173.01,61.69,24.56,85.11,"GD Hoy se definiría la suer— te de la ministra de a e María Antonietta Alva, cuan— do el Pleno del Congreso debata, desde la 9 de la mañana, la moción de censura en su contra. La iniciativa, sus— cita por 36 legisladores, seña— la que la titular del ME manejó mal la política económi— ca en la pandemia, generando desempleo y perjudicando a las Mypes. La censura procederá con mayoría simple, es decir, 66 10TH Las zancadas de Alian— za Para el Progreso, Somos | Partido Morado anunciaron que no respaldo a",10
523.57,289.43,87.14,28.57,50.43,TAPÓN M E ese peque— Mamita rsr,12
669.0,434.44,57.94,23.78,90.39,"con diseños tan bien ela— dorados que 'dan pena Con el estilo bento, que es la preparación de",12
215.4,514.8,64.6,31.6,85.2,La mamá © japonesa Eto—,12
412.16,784.08,63.8,25.18,83.2,"G o es ni Mama, de Tokio, se ha convertido preocupación en una sensación en su aspecto, en Instagram 151 )e donde tie r ne más de 150 mil seguidores naranjas, Toy por las comi— Story' con arroz das que prepara y otros. o POR Y REVISTA G DE GESTION",12
135.5,1656.5,422.5,114.5,64.75,10 son l la simas admiradas cleo,12
439.44,2071.33,97.11,46.78,52.11,.LI>XUIÍ s 2£=“1='1 5] ese Parque de Lss leyendas,12
361.2,2495.2,41.4,26.8,37.2,[Al iii i a ii,12
1047.36,1682.55,90.34,26.53,76.7,"jezcompañías han sido reconocida s co— mo 'Empresas Más Admiradas del Pe— rú (EMA) sonpar— te del esfuerzo del sector privado parala recupera— cincel país. Lapremiación, realiza— da de forma virtual por PwCylarevistaGde Gestión, ubica en el Top10'y forworden al— patético a:Alicorp, Backus, BBVA, BCP, Belcorp, Ferreycorp, Interbank, Rímac, Scotia— bankyWong.",12
1158.0,2462.67,37.5,18.67,40.5,es es e 3 el la,12
1940.33,332.33,155.0,50.67,90.83,Esconde tesoro en montaña y muere,12
1806.38,630.76,60.08,24.59,85.14,"€9 El millonario el murió tras una caída en su casa de Nuevo 1 a dos Unidos, sin revelar el lugar donde escon— dió un tesoro de más de dos millones de dólares en las Montañas Rocosas",12
2298.39,606.78,52.43,23.15,91.28,"hace 10 años, lo que pro— tocó una búsqueda en la que participaron más de 350 mil persolas de todo el mundo y cinco Fen señaló que lanzó el reto para motivar a las per— solas a salir de sus casas y tener contacto con la",12
1784.71,941.93,100.64,38.64,89.71,reconocidas por su esfuerzo y capacidad de adaptarse a los retos de la pandemia,12
1464.72,1509.72,85.77,26.08,79.75,"”Enesteimportantereco— nacimiento la evaluación ha venido de los pares li— eres empresariales) que han valor ado el esfuerzo y la resistencia del otro en es— ta coyunturadepande— mia”, dijo a Tome el doc— torenCienciasAdmi— nistrativas, Otto Rega— lado, docente del MBA RON a Figuran grandes empre— sas, de muy buena reputa— ción, queridas por los perua— nos, contrabajo de muchos años, varias reconoci— das por Marco y el Great PlacetoWork. ”Sonlas que mejor han realizado su gestión las de mayor valor en el mer— cadocomomarca.Ge— eran empleo, contri— buen al desarrollo, pa— saron momentos duros, pe— rohabíanavanzadoensu",12
1598.4,2313.21,79.3,29.28,86.4,"]ugaban changa ratan de escapar €9 Dos grupos de peloteros que jugaban culito en la cancha alquilada pa Grande”' fueron intervenidos por serenos y policías de Lurín. Intentaron huir corrien— do, pero fueron reducidos y llevados a la delegación por no acatar la dis— posición que prohibe las aglo— relaciones para evitar contagios",12
1734.25,2590.5,71.75,28.0,83.5,del coronavirus. (MRC] o,12
1847.3,1431.0,71.17,25.74,82.93,"SEPA QUE: Se evaluó: política de equidad de género, reputación empresa— rial, liderazgo gerencial, estrategia comercial, gestión de talento, innovación y respon— habilidad social, entre otros. E n n E * nas y grandes empresas | se esfuerzan, con sus , recursos y limitaciones, . para salir adelante y man— tenerse en el mercado.",12
1816.27,1796.64,141.91,28.82,84.45,"transformacióndigital y cultural, y eso utilizó su reacciónconmejores decisiones”. BIENESTAR TRABAJADORES",12
2171.5,1215.5,54.25,44.5,66.5,"_ por la gente,",12
2214.0,1363.4,99.6,39.8,75.0,e : desarrollo del país,12
2308.0,1505.5,83.5,25.5,84.0,botellóagua census plantas. El,12
2169.6,1557.6,146.4,20.4,51.6,— BCPconsucampaña Come . sumo'paradonacionesein—,12
2235.0,1743.54,191.15,28.62,76.23,"novócon'Yape', tanútilenes— tostiempos. ”Lasempresasvelanpor susoperaciones, elbien— estar de sus trabajador es ycontribuyenconlaso— ciedad, muchassi— lenciosamente.En estos meses todos hemos cambiado",12
2036.83,1934.67,115.17,38.0,61.5,"Porejemplo,Alicorp _ OTTO REGALADO — parasermássolida—",12
2349.75,1972.5,29.0,31.25,43.25,ee sl (e [<],12
2130.57,2096.57,109.29,51.43,81.71,Familia cae al río Rima en auto,12
2105.66,2432.21,60.0,24.03,89.1,"Cuatro miembros de una familia, entre ellos un niño de siete años, se salvaron de morir al ser res— casados tras la caída de su auto al río Rimac, en Chaclacayo. Se dirigían al condominio Sol de Huampaní, pero en el kilómetro 24 de la Carre— tera Central sufrieron el despiste. El carro quedó con las llantas arriba, todos fueron salvados y llevados a un hospital. (MRC G",12
831.75,337.75,294.0,125.25,43.0,L“_l KW a K“,13
825.67,550.44,127.78,37.56,62.67,----- Ify n [I|anzalL|ma es¡cacharrero¡ponfueray.feo¡por ¡f_JN LANZA — dentro,13
528.67,666.5,189.83,55.67,55.0,© Jxí£]$ |Q' _E' (gaenIajpenumbrade1malos4resultados'a1ustes'eco:E,13
2019.17,938.5,276.33,37.78,54.17,íodofa¡puertaede¡uganestem¡ercoles*comra Y ras'la(derrota'contralum ltoede1Mano$$ala9a Jugadoresxenl|as<u|tlmas¡ho|ras<surg|ootro problema:BetoidaSilva!&ichadolhas— e (so|oIhahugadoí90|mmutos*en¡ lPeonaunfen es elaps o se hab n a temibol: isadoul$4'm¡ldolaressyaque cobra:22<m¡hmensuales (Poréllosen ladecisiónseriatrevi sarleel'contratodemanerahnmed¡atay&omanunadefhanmueltaame-,13
2097.68,1390.0,218.61,39.32,53.11,"nerloenijaqué'sustaparicionesmediáticasitambién Inangeneradomelestiaenilalintena. (Eldelantero, 1ponsus<do|enc¡as,sy?atnc¡dRub|01[suspend¡do]!han <eljwven cuadiolla— e IEItema¡se.comp|ma¡másmorquelelv¡a1e.aWenezuela una¡od¡sead£ltequ¡po enmmbaíhcw¿ponla ue ea oe o E|ng6 IA||||egar(en pasaran¡pencabmas<de desmfecc¡on,y (demas'esmctas<medldas'de bioseguridad Rosterior— lE|¡plantells“eíhospe¡wmananaentrenara en(ellcomple1015mentenseíFC lacaratdeAlianza: (Esaqueyalucevieja.. <",13
2044.64,1762.0,103.45,47.27,46.18,I Sí eo a a l a ( Br&dos [cuandmtdenotamn At,13
2154.11,2071.56,175.11,46.56,42.33,Solo:conunmiilagroestaríaconimiequipo.. dmg¡r.¡porcelulan..… tay ee oy t 2 el A,13
2035.11,2249.44,222.22,62.56,59.44,( N[USTA?COPERAX o lFrancoiMedma Sebastián Lineary /Adnan|Bal ¡IFedericolRodtíguez [Lu¡siAgu¡arr/Alda|mFuentesw(©swaldoxvalenzueía,13
412.6,445.8,13.6,24.2,41.6,[F p o e a,16
398.6,1529.98,68.96,24.15,89.87,"DEL SAQUE somos carnecita... LA FIR— ME que el sábado vi el Liverpool—Leeds de la Premier League y la realidad es que estamos a años luz de ese ritmo, nivel, intensidad y pressing. Y encima dos locos, enfermos, estudiosos y sabios en los bancos. Dos hombres que desayunan, almuerzan, merienda y cenan fútbol. Esos dos, Klapp y Bielsa, no hacen el amor ni se acuerdan de sus cumpleaños por revisar videos, carpetas, estrate— y qué perfume se echan sus rivales. Ojo que no solo es ir a clases para saber cuántos paños tiene el balón, también hay que estudiar y leer de nutrición, físio— logía, psicología, administración. Muchos creen que con haber jugado basta y los que van a la escuela de entrenadores solo sacan el cartón y punto. Enrique— verse te da un plus, conocimientos. Sí, señores... Y NO SOY DESLENGUADO cuando digo que somos una carreta en La Liga 1, Liga 2, Segunda y Copa Perú. Los chicos acá entrenan hora y media o máximo dos. Dan 5 o 8 vueltita alre— dedos del campo, levantan un ratito mancuernas, 10 planchitas, 10 barras, 10 canguros, 15 minutos en la bicideta, se bañan, se echan su gel, se 'amononan' y revisan su celular. Timbra a la que está de moda o disponible y salen a capturarla. Otros se quitan a comer un cebichito, seco con frijoles, una chelista negra y a latear. Los más sanos se reúnen para hacer hora en un depa. Son pocos los que van a des— cansar y hacer un personalizado. Diría que con los dedos contados. Entonces no estamos preparados para correr parejo ni marcar los 90 minutos. El reflejo es que no tenemos un solo jugador en la Bundesli— ga, Premier League, Serie A. Miguel Truco está en la reserva del Saint Etienne en Francia y Renato Tapia acaba de debutar con el Celta de España. No estoy inven— tando nada. Curuju... EL LOCO” BIELA presentó casi el mismo once que cam— peinó en la Championship y con un par de refuerzos sin renombre. Lo que me sorprendió es la juventud que hay en su equipo. Varios chicos de 18, 19 y 20 añi— tos y algunos de metro noventa. Todos conchudos, con rebeldía y demasiada pro— yección. Los de Klapp, monarcas vigentes, son una máquina del ida y vuelta. Obvia— mente, la diferencia sobre el papel era la experiencia y millones de euros de sus estrellas, pero en el campo fue de igual a igual. Solo un gol inclinó la balanza. Con talento puedes estafar en el Perú, Boli— via, Ecuador, Venezuela y hasta Chile. Y los países donde regalan la plata. En la éli—",16
366.75,2543.75,66.25,23.0,90.25,te no tienes sitio ni como recogebolas. Así,16
270.6,2579.4,53.4,24.2,89.6,"es... Me voy, soy fuga.",16
1187.33,158.5,92.67,23.5,89.33,LUNES 14 DE SETIEMBRE DEL 2020,16
2062.4,262.4,81.6,22.0,87.8,POR UN 'DULCE' EN MATTE,16
2113.0,313.0,143.75,58.5,87.75,TRES KILOS DE ASUSTAR,16
2183.56,412.06,61.38,23.94,77.12,11 © Agarra su 'escoba. Con su artillero Matas Surcar encendido — viene de hacer doble—,16
1190.0,675.88,95.88,36.62,84.75,3% DT Comienzo tiene números que superan a,16
1054.2,730.0,84.4,36.0,93.2,Areca y Marcarán en la,16
988.12,1791.68,121.48,25.98,71.66,"n'Mago' teregaladiversión, un Angel' el paraíso. Esallídonde está Universitario quecontinúa acercándosealtítulodel , Apertura. Modelos artífices es Angel Comizzo, quien puede presumir de números históricos.Sucedequeconel triunfo ante Deportivo Llacuabamba, alcanzamos 135 puntos 79 partidos. Honesto superó a Sergio Marcarán que quedó con 133en 76 encuentros. El DT ya es el tercero en unidades ganadas ydejóatrása RicardoGareca,",16
1023.14,2137.24,63.9,30.48,89.14,EL URUGUAY Luis Shruti será operado hoy por una lesión meniscal en la rodilla derecha. Estará de baja por tres semanas.,16
2193.85,574.22,59.96,24.91,84.27,"te—, Deportivo Municipal se mide hoy (1:15 p.m.) en Matte contra Ayacucho FC tratando de mantener una racha particular. Desde que ascendió en 2014, la Academia” nunca per— dió en Lima contra los 'Zorros' (4 triunfos y dos empates). El rival quiere cortar la seguía de tres partidos seguidos sin victorias en la Ligal. G",16
2177.75,1227.5,119.25,44.5,90.5,PERDIÓ EN LA BOLSA,16
1930.76,1571.43,82.38,26.1,82.37,"G» No va más. El entrenador Marcelo Vivas presentó su renuncia al Sport Boys. Solo sumó tres puntos de quince disputados, desde que volvió el campeonato, lo que sen— venció la salida del argentino que dirigía a los chalecos desde hace 14 meses. Los herma— nos Luis y Francisco Hemández, técnicos de la reserva, tomarán el mando interino, y sue— José Manuel Ramos Delgado y Osvaldo — na Julio CésarUribe como opción. [<] Piazza. El 'gaucho”' solo tiene por delante en el ranking a iván Bric (163puntos) y Roberto Scarone(429). ”Vamos partido partido, queda mucho camino porrecorrer, poreso solo pensamos en Ayacucho”, señaló el técnico. Deotrolado, el plantel volverá hoya Mar'Las instalaciones, que estuvieron cerradas buen tiempo, fueron relacionadas y puestas punto.",16
1532.73,2142.0,82.45,29.82,66.73,San Martín vs. Cusco FC T:00A.M. Mannuccivs. A. Gran — 330PM.,16
1681.83,2274.0,134.83,22.0,82.0,CRISTAL BUSCA SEGUNDO PUESTO ANTE CIENCIA,16
1951.94,2489.55,65.48,25.65,89.03,"D Es hoy. Sporting Cristal quiere meterle presión al líder Universitario y, por ello, urge de ganarle esta tarde (6:00 p.m.) a Ciencia en el cie— re de la jornada 11. Los dirigidos por Roberto Mosquea contarán con el medialuna Washington Corozo en ofensiva. Johan Madrid reemplazará al suspendido Nilson Loyola en el lateral zurdo. Por su parte, el confía en un exceleste, Damian ismodes, para dar la sorpresa.",16
241.0,680.0,80.5,24.0,81.25,PESAS Y DIETA RIGUROSA,18
195.25,758.0,136.75,42.0,88.5,ADELGAZAR EN EL GYM,18
254.0,961.52,62.65,25.65,88.95,"G» Eden Hazard recibió un duro plan de traba— jo por parte del Real Madrid. El belga deberá pasar varias semanas en el gimnasio, donde hará pesas todos los días y varias rutinas de fiexiones. Además, tendrá una dieta rigurosa.",18
276.84,1822.71,68.18,26.45,87.16,"CRY ANOTÓ CON NUEVO DT YO PILLO ITALIANO G» C[istiano Ronald arran— có su tercera temporada en Juventus, que dirige Andrea Pirlo, anotando en el amistoso donde golpearon 5—0 al Nova— ra, de la Tercera División. 'CRY marcó a los 20' y no jugó el complemento. La 'vieja seño—",18
269.56,2022.22,66.0,24.22,90.44,ra' debuta este domingo ante Sampdoria en el Calcio.,18
1186.67,158.5,93.33,23.5,90.67,LUNES 14 DE SETIEMBRE DEL 2020,18
1406.33,272.17,283.0,160.33,50.5,ne elijo mono hijo ee p..,18
668.25,710.5,97.44,38.62,85.5,y revela que golpeó a zaguero del Marsella por expulsado clásico de Francia y PSG cayó1—0,18
874.59,1344.4,66.46,25.85,77.39,"aris.— Se le salió la 'favela”. Keymar se acordó quecre— dió en un barrio pobre, con gente 'maleada' y setren— ó enana pelea tonel defensaAlvaro González. Esto enen clásico de Francia'caliente' que PSG (18o) perdió 1—O contra Olympie de Marsella (5o) en la no fechado la liga. El brasileño y el zaguero se 'repartieron'todo el partido has.— ta que la' bomba' explotó' a los 95'. Enes momento, 'Ney'em— pujó español empezaron a agredirseverbalmente. En la si— guienne jugada se produjo una pelea el 10' aprovechó para darle un ”lapo' al central, porlo que vio la tarjeta roja. Al salirde campo, el sudamericano dijo ” porracista, por eso lo golpeé”.",18
1242.17,1579.67,111.5,23.33,89.5,TENÍA FACHA DE ESTRELLA DE HOLLYWOOD,18
1675.66,1302.39,63.59,26.81,81.47,"Luego se despachó en su cuenta de Twitter. ”Lo único que la— mento es no haberle pegado en la cara a eseidiota. Que el VAR es fácil, ahora quiero ver la imagen delra— cista llamándome'*mono hijo de puta”... eso quierover”, posteó. Por su parte, el defensor contestó por la mismavía. ”No exis— te lugar para el racismo. Carreralimpia y con muchos compa— veros y amigos en el día a día. Aveces hay que aprender a per— der”, publicó. El partido terminó con otros cuatro expulsados, además de 'Ney':Leandro Paredes y Lay vin Kurzawa (PSG), y",18
1681.88,1470.5,86.38,29.25,74.5,Daría Benedetto Jordan Amadi [Marsella). Único gol hizo,18
1731.0,1608.0,117.5,42.0,76.75,TODO A SU TIEMPO,18
1249.74,1882.43,64.09,25.48,88.31,"LA PREMIER Leeds.— Con jale. El diario The Sun' resaltó el juvenil de Marcelo Biela allá por los años 1975 y 1977. ”Se veía guapo y limpio, con apariencia de estrella de Hollywood”, señaló el diario inglés. Por la Pre— mier League, y con el debut de James Rodríguez, Everton venció 1—0 de visita al Tottenham de Mourinho. Hoy [215 p.m/Espn2) se estrena Chelsea ante",18
1772.86,1862.18,59.06,25.62,87.41,"€» Nueva York.— La nueva genera— ción. Dominic Them doblegó 2—6, 4—6, 6—4, 6—3 y 7—6 (8/6) al alemán Alexander Vere y se quedó con el US Open. Es el primer tenista nacido en la década del 90 que consigue el trofeo, logró su primer Grand Slam y también el primero que el *Big Three' dejó libre desde 2016. ”Merecemos un US Open normal en 2021”, dijo el austriaco, quien había perdido dos finales de Roland Garras (2018 y 2019) y el Australia Oper (2020).",18
2251.43,677.5,64.11,32.5,82.29,"e peleó con Papet recordan— do un video que posteó tras la final de Champions. EN 2015, jugando para Espanyol!, A'Iva,ro Gonzalez le pegó y llamó 'enano' a",18
2269.65,884.24,65.06,31.76,86.59,"essl. EN MARSELLA hubo celebraciones, ya que después de 9 años TP0 partidos) le ganaron al PSG.",18
2252.16,1205.42,74.24,32.16,89.87,"Keymar me dijo que se trató de un insulto racista. Yo no escuché nada en la cancha”... Thomas Tuchel, DT de [ No creo que haya racismo, sí un escupitajo de Di María”... André Villas—Boas, técnico del Marsella.",18
2019.12,1567.0,97.12,25.0,81.88,&*AUSTRÍACO REMONTO Y ES CAMPEÓN DEL US OPEN,18
1397.06,984.73,93.33,38.23,52.86,"X""'Gn_ol3?… papi ©Ilug?03“m=— CI.©|EII”I£!©Í]|1 t 1 f y a 1 ” debi> A ea 7 | &F&?&%&u%% H o donde e= ” ” i D 9 d '—7N1m1¡;aem' y a profesional mlr Miendaorapal '/ — mo puede c stier <m:x,©1©lam D a — — e a ©“1anU©'t_mmb M —y> ) — e — a aamn©©nrmmvwmt© re x¡ | Ny O D | =| |/4 i y I_| i , : .. 1 N B — mucho erquilo, on llegué me ea a ©er¿5 — ©Diceque: —r UP N — ..oe…<:;mwwom *'Hmlll”9<3…&í£3 a nolle;gusta pública, — hacer OCHO h _…_ —— $mwed:—.rmwew©altxln .,Ibu(¿b©<:s y bres. la ja, nero está en la …… / a ie mmoe[tsw…am £i“&?%%o&%*£¿o£% mue A S paga i'1[c1[cñ“[3o& M saben webster a l",19
1452.92,1748.38,103.24,36.04,45.16,"©s %&g Lñúgf“éxlf es m% gg C©xx: AN e o l poncho E a wmwm'©om* gQC©“N p cóncebailosy © b nz s mernes. E o ©¿a LIÚ©EL'©¿LC(£©%LF©'& posos quele heredó en <l (feliztalllado:de:su novio ea con:quienitie— It Fj(€(J€líl relación. U$íC ea ga ea os *Tenemostdostaños!juntos; tranquilos,feli— o y bientde:salud.Nosotros: dies",19
2070.0,2094.22,77.67,34.0,46.67,f e d en inos mudamos'aWestches— $¿Chata — tenedos,19
1322.54,2359.38,75.47,30.42,68.9,"——> o Lima para _ Debes esta ansiosa por muy tranquiilo, aquí _ años de p %y ¿y a semanal _ elenderro... inlay mucho problema'con relación la p 1, A J ¿_A./Vk E| A¿_,4_ nar mi tema |promoaonar Te juro migraña llajpandemia,ipero igual nos' con E Z/ (M y ”La fea'yyano _ tema 'Laífea me da afirma. novio, pero pude regresar ahora|m|pu d e e d d e u ¡¿Y tienen planesdema&H— no L;] porque Tacna — ¡regresara Tacna aPasiona.lIncluso:me ha seripapis? nes de cua— l dado insomnio,thoy ( ayer] © Eresialinda comentó que se Alimentos tampoco pude dormir, estuve des— quedó varada en Lima y no 'allá podría in a la:chacra a — puerta hastallas:seis de la mañana. Hemos tenido otrasiprioridades;y puede i regresar a su natal Tacna, me desestresa— ¡De ahí dormí dos horas y eso imomento.estamos tranquilos;iponién— ya que la provincia está enicua— ba, acá me siento conias me trae dolores:de:cabeza, :donostotras ' metas y felicestasí, manos pero.sé detengo que tener E 2 ee E )",19
807.64,2577.55,60.91,24.91,87.73,”Solo vine por una semana a cantante de 'No paciencia. ©,19
203.5,153.25,55.75,40.25,76.75,2 — (AL DÍA),2
363.5,340.33,151.83,52.17,74.83,m rt?íol INICIA TU PROPIO NEGOCIO,2
